,id_str,created_at,retweet_count,favorite_count,text
160,657592276240224258,Fri Oct 23 16:19:50 +0000 2015,0,0,Better Sales Funnel Transition Means Better Conversion Rates https://t.co/NqeauviIdP
161,657568500785938432,Fri Oct 23 14:45:22 +0000 2015,0,0,Are your sales reps accountable or do they make excuses? You can learn from your mistakes when you take... https://t.co/x4LblgKuZC
162,657553381637169153,Fri Oct 23 13:45:17 +0000 2015,0,0,Are you in home improvement sales? Learn how VanillaSoft can help you close more deals faster. https://t.co/KmuuGtGfB7
163,657396792623935492,Fri Oct 23 03:23:03 +0000 2015,0,0,Check out the buzz around inside sales enablement! https://t.co/GcZbBbORVW
164,657314352555429888,Thu Oct 22 21:55:28 +0000 2015,0,0,Once you control sales lead management you will control revenue growth and pipeline reporting. https://t.co/eGPTnksvzR
165,657290457781837824,Thu Oct 22 20:20:31 +0000 2015,0,0,Recruiting Telefundraising Volunteers https://t.co/Dmiw6E6wRo
166,657281821986586624,Thu Oct 22 19:46:12 +0000 2015,0,0,Are you challenging your sales reps?  Challenging them will make them better sales reps. https://t.co/p8SeJRbdlU
167,657269110775128064,Thu Oct 22 18:55:42 +0000 2015,0,0,Case Study: Shaving Time and Effort off the Sales Process https://t.co/FzdTfzy2o8
168,657266692821643264,Thu Oct 22 18:46:05 +0000 2015,0,0,Need some ideas for long-term fundraising success? Here are some ideas to help you incorporate some new ideas to... https://t.co/TLnikcg2H9
169,657217532038938625,Thu Oct 22 15:30:44 +0000 2015,0,0,"Are your KPIs actually key performance indicators, or are they out of line with your company’s goals and objectives? https://t.co/qHmX5XGMUi"
170,657206246198538242,Thu Oct 22 14:45:54 +0000 2015,0,0,Do your sales reps know how to listen? Here are some tips to help them become better listeners. https://t.co/hjioAick0f
171,657197405956362240,Thu Oct 22 14:10:46 +0000 2015,0,0,"10 Tips, Trick, Tactics to Increasing Sales Opportunities https://t.co/LKTkS0w1L5 via @MySales4Life"
172,657191136612618240,Thu Oct 22 13:45:51 +0000 2015,0,0,Looking for tips to battle sales objections?  Check out these tips for responding to the 6 most common sales... https://t.co/kpalwUI1ov
173,657180316461871104,Thu Oct 22 13:02:51 +0000 2015,0,0,Inside Sales Processes Soar When Standardized https://t.co/z8aHfHXfFN
174,656953413201186816,Wed Oct 21 22:01:13 +0000 2015,0,0,Inside Sales Processes Soar When Standardized https://t.co/7npU4hAgVD
175,656935594975698944,Wed Oct 21 20:50:25 +0000 2015,0,0,The Death of Lost Productivity https://t.co/raokqpSxa5
176,656919369239404544,Wed Oct 21 19:45:57 +0000 2015,0,0,Need a different kind of strategy to reach prospects?  Try the Skeleton Strategy! https://t.co/BGffO99l9j
177,656906603040481280,Wed Oct 21 18:55:13 +0000 2015,0,0,Sometimes Leadership Is Ugly as It Should Be https://t.co/pfufM634Jh via @CoachLee
178,656904295917449216,Wed Oct 21 18:46:03 +0000 2015,0,0,Do you have a road map to success for your inside sales team?  See how appointment setting software can improve... https://t.co/pPoFVXOoBd
179,656889119436574720,Wed Oct 21 17:45:45 +0000 2015,0,0,4 Ways Queue-based Lead Management is Shaping the Inside Sales Industry https://t.co/ga7B0PcP14
180,656843882106241025,Wed Oct 21 14:45:59 +0000 2015,0,0,Would you like to increase sales opportunities?  Check out these 10 tips. https://t.co/T6w0tkh5QS
181,656557027955617793,Tue Oct 20 19:46:08 +0000 2015,0,0,Do you know why your cold calls aren't working? Check out these case studies for some insight. https://t.co/WmLsW3eoT5
182,656543108474273792,Tue Oct 20 18:50:49 +0000 2015,0,0,Is it hard for your sales reps to let go of the 'No'? It may be costing you. https://t.co/oMsxZYFgG7
183,656481548506701824,Tue Oct 20 14:46:12 +0000 2015,0,0,Do you know how to fill your sales pipeline? Pick up the phone. https://t.co/p7W1vaOPID
184,656466338098081792,Tue Oct 20 13:45:46 +0000 2015,0,0,Is your lead management process optimized? Write down your step by step process. https://t.co/3uVkiUKVaR
185,656228630691979264,Mon Oct 19 22:01:12 +0000 2015,0,0,RT @gerhard20 How to Develop an Attitude of Resilience in Selling https://t.co/Ke5YG0MyBy
186,656223400311042048,Mon Oct 19 21:40:25 +0000 2015,0,0,Important Research on Email That Impacts Your Sales Productivity https://t.co/ZLSa59IDcz via @JillKonrath
187,656205844095332352,Mon Oct 19 20:30:39 +0000 2015,0,0,5 Tips For Better Inside Sales Calls https://t.co/Ev32jkeyPf
188,656194569277542400,Mon Oct 19 19:45:51 +0000 2015,0,0,Do your sales reps know how to deal with prospects that seem to know everything? Check out these tips to learn... https://t.co/VLA1Mnfgmh
189,656186909631344642,Mon Oct 19 19:15:25 +0000 2015,0,0,TCPA Nonprofit Exemption Protects DialAmerica https://t.co/I1uvbAsqvb
190,656179460979429376,Mon Oct 19 18:45:49 +0000 2015,0,0,Need some tips on creating dynamic scripts that engage and sell? Watch this webinar to learn tips to create... https://t.co/V7oQz40qCn
191,656170237168062464,Mon Oct 19 18:09:10 +0000 2015,0,0,Are You Measuring the Right Performance Indicators? http://t.co/2U408RnXwA
192,656118991774023680,Mon Oct 19 14:45:32 +0000 2015,0,0,Is email impacting your sales productivity in a bad way?  Learn more about the impact of email on sales productivity. http://t.co/ozgmUURomM
193,656103874655162369,Mon Oct 19 13:45:28 +0000 2015,0,1,Do your sales reps cringe at the mention of cold calling? Check out these tips to make cold calling a more... http://t.co/DCCO1gspFq
194,655118796353466368,Fri Oct 16 20:31:07 +0000 2015,0,0,Consistency is Key in Your Lead Management Process http://t.co/thXvbNGSMD http://t.co/4kMQZ29mAu
195,655107336776884225,Fri Oct 16 19:45:35 +0000 2015,0,0,Need to improve your cold calling process? Here are 7 tips to help. http://t.co/rvkvaq4Yqt
196,655092242340667392,Fri Oct 16 18:45:36 +0000 2015,0,0,Are your sales and marketing teams collaborating?  It takes collaboration to be successful. http://t.co/FPUtYK2B4z
197,655046915025956864,Fri Oct 16 15:45:29 +0000 2015,0,0,Performance-based Training Can Give Sales a Boost http://t.co/icVMU4c75J
198,655035070864994306,Fri Oct 16 14:58:25 +0000 2015,0,0,Are your sales reps effective?  Check out these 6 habits of effective inside sales reps. http://t.co/mgxXAVr6pN
199,655025455519637506,Fri Oct 16 14:20:13 +0000 2015,0,0,RT @SalesProAcademy Via @mayeralen Why Staff Training is so important http://t.co/czw5f0D0RV #sales
