,id_str,created_at,retweet_count,favorite_count,text
0,668893202418651136,Mon Nov 23 20:45:41 +0000 2015,0,0,Are your sales reps effective influencers?  Here are some tips on how to be an effective influencer. https://t.co/xA71w3FAd7
1,668878130367475712,Mon Nov 23 19:45:48 +0000 2015,0,0,Are you asking your sales team to hunt with a shovel?  Having the right tool makes all the difference. https://t.co/BFvTPI8nKx
2,668817642367688704,Mon Nov 23 15:45:26 +0000 2015,0,0,Does the thought of switching lead management solutions make you anxious? Learn more about the 6 stages of sales... https://t.co/aKN3T5fdWK
3,667841213572259841,Fri Nov 20 23:05:27 +0000 2015,0,0,Brush up on your appointment setting skills with these five tips! https://t.co/NEOxSqn2b6
4,667832504192098304,Fri Nov 20 22:30:51 +0000 2015,0,0,Selling to the Challenger Customer https://t.co/yZT3BtVPED via @JillKonrath
5,667819810923786240,Fri Nov 20 21:40:25 +0000 2015,1,1,The Five Tips for Better Appointment Setting Calls https://t.co/2j8tustGZk https://t.co/ZOLUv05WiI
6,667806077849722880,Fri Nov 20 20:45:50 +0000 2015,0,0,Want to be successful in your sales role?  Learn more about how to be successful. https://t.co/Sj2tSQv7BT
7,667791007333949441,Fri Nov 20 19:45:57 +0000 2015,0,0,"Are you a sales hunter?  You need lead management software.
""What gets measured gets managed"" - Peter Drucker https://t.co/2k3zyIgEz6"
8,667776985926656002,Fri Nov 20 18:50:14 +0000 2015,0,0,"FTC Beefs up Telemarketing Fraud, Do Not Call Rules https://t.co/pTcN7k5OHm"
9,667758885718122497,Fri Nov 20 17:38:19 +0000 2015,0,3,RT @Megan_Marie_T #SalesDevelopment Managers: This is where you are needed most! https://t.co/fkznY2F4jn | @MkCheevers | @quotafactory
10,667715453129785344,Fri Nov 20 14:45:44 +0000 2015,0,0,Do you know what dials and baking powder have in common?  Find out here! https://t.co/gGbQ5o9FS3
11,667448588264472576,Thu Nov 19 21:05:18 +0000 2015,0,0,Study: Cloud Helps Sales Enablement Reach Its Promise https://t.co/vKcwDiKVgE
12,667443596677783552,Thu Nov 19 20:45:28 +0000 2015,0,0,Do you sell to the Challenger Customer? Check out this interview by Jill Konrath talking to the authors of the... https://t.co/vJmNY7E403
13,667429712180944897,Thu Nov 19 19:50:18 +0000 2015,0,0,The Scoop on Effective Inside Sales Scripts https://t.co/CO6lsgNSnm
14,667428502292013056,Thu Nov 19 19:45:29 +0000 2015,0,0,"Are your sales reps explaining the ""What"" instead of the ""Why""?  Learn more about how your call scripts should... https://t.co/rjom1StJT1"
15,667395714834673668,Thu Nov 19 17:35:12 +0000 2015,0,0,Do your sales reps have optimistic minds? Learn how having an optimistic mind can help to grow your sales. https://t.co/6jhwRLzQcq
16,667388885207556098,Thu Nov 19 17:08:04 +0000 2015,0,0,Learn more about VanillaSoft in today's 2pm (ET) Demo Day webinar! Register now! https://t.co/YDhymAB4jp https://t.co/yvFJS8LWWN
17,667379785249738752,Thu Nov 19 16:31:54 +0000 2015,0,0,Are you looking to improve your appointment setting process?  Check out this road map to success! https://t.co/k2A8utrDRq
18,667071208291041280,Wed Nov 18 20:05:44 +0000 2015,0,0,Vote for VanillaSoft's David Hood and Genie Parker in the SLMA's 40 Most Inspiring Leaders in Sales Lead Management! https://t.co/WqcBI3QsBY
19,667027175510556672,Wed Nov 18 17:10:46 +0000 2015,0,0,A #script should be an #insidesales tool - not a sales rep's crutch. https://t.co/x7CvSjU4TL
20,666980551342075904,Wed Nov 18 14:05:29 +0000 2015,2,1,Are you using tie downs to build #insidesales momentum? https://t.co/eoouXfvwhT
21,666934233378762753,Wed Nov 18 11:01:26 +0000 2015,1,0,VanillaSoft is a Platinum sponsor of the @AA_ISP Inside Sales World 2015 conference taking place in Dublin today. #ISW2015
22,666778267135922176,Wed Nov 18 00:41:41 +0000 2015,0,2,Looking forward to my keynote presentation tomorrow at the @AA_ISP Inside Sales World 2015 conference in Dublin tomorrow. #ISW2015
23,666754018794938368,Tue Nov 17 23:05:20 +0000 2015,0,0,Is Your Sales Team Prepared To Succeed? https://t.co/KqBW82zRIj via @EngageColleen
24,666735164828028929,Tue Nov 17 21:50:25 +0000 2015,0,0,Optimize Lead Management: Write Down Your Step by Step Process https://t.co/RYZwqNGHv2
25,666718900650835968,Tue Nov 17 20:45:47 +0000 2015,0,0,Do your sales reps need some help navigating B2B buying?  Check out these tips to help improve your sales. https://t.co/CFhqRSM6MF
26,666703820366417920,Tue Nov 17 19:45:52 +0000 2015,0,0,Do you record your sales reps outbound calls?  Learn how recording calls can help to improve your inside sales... https://t.co/2fjVpSn905
27,666699984365092864,Tue Nov 17 19:30:37 +0000 2015,0,0,Build Sales Muscle: Break from Your Comfort Zone https://t.co/yXx40Aq0tY via @raintoday @JillKonrath
28,666698345189015552,Tue Nov 17 19:24:06 +0000 2015,0,0,VanillaSoft is a Platinum sponsor of the AA-ISP Inside Sales World 2015 conference taking place in Dublin. Will we see you there? #ISW2015
29,666674697950597120,Tue Nov 17 17:50:08 +0000 2015,0,1,Blog: Avoid the 'Sales Robot' in Inside Sales https://t.co/KqaUhLOzCA
30,666643355686838273,Tue Nov 17 15:45:36 +0000 2015,0,0,Do your sales reps need to improve on their negotiation skills? Make sure your sales reps are prepared. https://t.co/8gKCIGEfrC
31,666364021667405824,Mon Nov 16 21:15:37 +0000 2015,1,0,A call center is only as good as its agents. How do you use metrics for coaching? https://t.co/oOJRIOBzfW
32,666345756299821056,Mon Nov 16 20:03:03 +0000 2015,1,1,10 Tips for Working at a Trade Show Booth https://t.co/JXevOg4c7k via @donleeonselling
33,666301080310030337,Mon Nov 16 17:05:31 +0000 2015,0,0,Using Interactive Content to Improve the Sales Funnel https://t.co/eXD6CkfPLm
34,666279639346737153,Mon Nov 16 15:40:19 +0000 2015,1,0,Always Have This Close Handy…. https://t.co/c885kk5Gmi via @EyesOnSales by @Top20Percent
35,666260713095172096,Mon Nov 16 14:25:07 +0000 2015,0,0,RT @scoremoresales How can you be more productive in sales? https://t.co/eB9QPD7Ae6
36,665295811849363460,Fri Nov 13 22:30:56 +0000 2015,1,0,When's the Best Time to Send a Marketing Email? https://t.co/tiGG8hW68j via @xoombi
37,665275572742987776,Fri Nov 13 21:10:31 +0000 2015,0,0,6 Tips for Managing Virtual Sales Teams for Outbound Selling https://t.co/IJ2jAGstzQ
38,665269308386340864,Fri Nov 13 20:45:37 +0000 2015,0,0,Does your company work trade show booths?  Check out these 10 tips to help make sure you have better results. https://t.co/GoXszQiEUX
39,665254245193654273,Fri Nov 13 19:45:46 +0000 2015,0,0,Need some sales lesson tips?  Learn from Don Draper's example. https://t.co/jMXXY0Xidp
40,665254245168467968,Fri Nov 13 19:45:46 +0000 2015,1,1,Need some sales lesson tips?  Learn from Don Draper's example. https://t.co/CKVr5zlLIA
41,665235383408570370,Fri Nov 13 18:30:49 +0000 2015,0,0,4 Surefire Tactics to Get Out of a B2B Sales Slump https://t.co/ASXr5cS98F via @SalesStaffLeads
42,665216429122306048,Fri Nov 13 17:15:30 +0000 2015,0,0,Mind KPIs When Coaching Contact Center Agents https://t.co/nsEPWj1o2g
43,665193809186332672,Fri Nov 13 15:45:37 +0000 2015,0,0,"Not sure how to handle the "" let me talk to my partner, boss, manager, spouse, etc.? Here are some suggestions in... https://t.co/iKDWlqnktl"
44,665178653018443776,Fri Nov 13 14:45:23 +0000 2015,1,0,Do you want to achieve record profits?  Learn how to motivate your sales team with cold calling. https://t.co/GtN465lJck
45,664942118264315904,Thu Nov 12 23:05:29 +0000 2015,0,0,"Selling In Today's World: Eight Tips for Optimizing Your Sales Success
 https://t.co/lCASS2tnn0 via @SalesGravy"
46,664913192364195841,Thu Nov 12 21:10:33 +0000 2015,0,0,Perfection is the Enemy of Good When Designing Sales Processes https://t.co/X6Ajqbdxod
47,664906969946447872,Thu Nov 12 20:45:49 +0000 2015,0,0,"Are you translating the organization’s vision, mission, and values into a meaningful context that your sales team... https://t.co/wg3VYDOsQ2"
48,664891836461391872,Thu Nov 12 19:45:41 +0000 2015,0,0,Dear Mr. Customer: I Try Hard To Be A Great Sales Professional…… https://t.co/maFH8rRUif by @davidabrock
49,664855331642679297,Thu Nov 12 17:20:38 +0000 2015,0,0,How to Hire and Produce a Top-Performing Inside Sales Team https://t.co/DU37bG0DUj
50,664831397161525249,Thu Nov 12 15:45:31 +0000 2015,0,0,Are your sales reps trying to sell to everyone?  Selling to everyone can lead to a massive sales disaster. https://t.co/Ld3AzkC9yk
51,664823816573579264,Thu Nov 12 15:15:24 +0000 2015,0,0,RT @SalesGravy Why salespeople must prospect! - https://t.co/TkSwtzQvob @davidabrock
52,664816301869801472,Thu Nov 12 14:45:32 +0000 2015,0,0,Do you want your sales reps to make money like bees make honey?  Learn how a queue-based lead management system... https://t.co/1OQKJlTJZa
53,664802386330976256,Thu Nov 12 13:50:14 +0000 2015,1,0,"VanillaSoft CEO, COO Nominated for @SalesldMgmtAssn Distinction https://t.co/VQRnfEfSOz"
54,664544548442537984,Wed Nov 11 20:45:41 +0000 2015,0,0,Looking for ways to optimize your sales success?  Check out these tips! https://t.co/Oom492tPin
55,664529477532274689,Wed Nov 11 19:45:48 +0000 2015,0,0,Have you ever failed in sales? Learn tips from Harland Sanders on how to be successful when faced with failure. https://t.co/tTF55VynZx
56,664469041717743616,Wed Nov 11 15:45:39 +0000 2015,0,0,Are you focused on training or helping your sales reps learn?  Learn more about training vs learning. https://t.co/pLSaSyRMd7
57,664465660509102080,Wed Nov 11 15:32:13 +0000 2015,0,0,Could Your Sales Team Need to Break Down? https://t.co/AtDbzITBGF via @EngageColleen
58,664192138184417280,Tue Nov 10 21:25:20 +0000 2015,0,0,"It 's all about making better calls, the right calls, and making more of them. https://t.co/Ffr5O57dl9"
59,664182166201475074,Tue Nov 10 20:45:42 +0000 2015,0,0,Is your sales team running on fumes? Learn tips to avoid sales fatigue. https://t.co/H39eRcmfye
60,664167048805752832,Tue Nov 10 19:45:38 +0000 2015,0,0,Is your inside sales team using scripts effectively? Scripts are a tool...not a crutch. https://t.co/EqYXdkaM7b
61,664151859255349249,Tue Nov 10 18:45:17 +0000 2015,0,0,"If I Were the Queen of Sales, I'd Ban This... https://t.co/18FpFXe4Mx via @JillKonrath"
62,664133026641768448,Tue Nov 10 17:30:27 +0000 2015,0,1,Telecoms Would Benefit from More Lead-Generation Outsourcing https://t.co/KBlbSzQk5U
63,664106583689961472,Tue Nov 10 15:45:22 +0000 2015,0,0,Does your sales team need to break down?  Come up with new ideas and ways to learn from each other. https://t.co/phlNSPHOdE
64,664091504768638976,Tue Nov 10 14:45:27 +0000 2015,1,1,"VanillaSoft's CEO, David Hood, to be a featured presenter at AA-ISP's Inside Sales World event in Dublin, Ireland... https://t.co/rBNEsghodE"
65,663854957414719488,Mon Nov 09 23:05:30 +0000 2015,0,0,How Great Leaders Keep People Moving Forward https://t.co/fcMoNiTfs7 via @Forbes
66,663837304465813504,Mon Nov 09 21:55:21 +0000 2015,1,0,40% - 80% of sales leads are dropped between marketing &amp; sales. What are you doing about it? https://t.co/0KHUY0B6tb https://t.co/LQsSQQtjsb
67,663819787710017536,Mon Nov 09 20:45:45 +0000 2015,0,1,Do you talk about your product or service in the first conversation? You may be starting the relationship off on... https://t.co/tqIf3T3SJI
68,663764335190233088,Mon Nov 09 17:05:24 +0000 2015,0,0,White Paper: Sales &amp; Marketing Alignment: Bringing the Pieces Together https://t.co/veOxsXi5Vj
69,663750391419543552,Mon Nov 09 16:09:59 +0000 2015,0,0,@Technology_Adv Thanks for the share!
70,663746658455453696,Mon Nov 09 15:55:09 +0000 2015,0,0,Using Interactive Content to Improve the Sales Funnel https://t.co/JOfB7Bor58
71,663744221220859904,Mon Nov 09 15:45:28 +0000 2015,0,0,Do your sales reps set goals? Check out these tips to help your sales reps identify and set goals to improve... https://t.co/RxYE4Zsawf
72,663729110989062144,Mon Nov 09 14:45:26 +0000 2015,0,0,Do your sales agents need coaching? Use call metrics to improve your coaching process. https://t.co/FOdB2dfKMP
73,662759079232839680,Fri Nov 06 22:30:52 +0000 2015,0,0,Thanks @SalesldMgmtAssn! We're proud to have two of our team members nominated :) https://t.co/kvd7K2bDAX https://t.co/KXbzkBB9mR
74,662746368914624512,Fri Nov 06 21:40:22 +0000 2015,0,0,How do you track your call metrics? https://t.co/aFNpudjelq https://t.co/IkqTRoLIK8
75,662729117868015616,Fri Nov 06 20:31:49 +0000 2015,0,2,B2B Cold Calling Best Practices https://t.co/W4AbCgUVYh via @InboundMarketer
76,662703563328634880,Fri Nov 06 18:50:16 +0000 2015,0,0,Using Interactive Content to Improve the Sales Funnel https://t.co/1gCmln2D6U
77,662687290943217664,Fri Nov 06 17:45:36 +0000 2015,0,0,Proud to be nominated! https://t.co/EMCEYP8nec https://t.co/IBk5SOb7ED
78,662657053488455680,Fri Nov 06 15:45:27 +0000 2015,0,0,Need some tips on how to make the number in complex sales? Check out these tips. https://t.co/WMmoL4M8F7
79,662647148392132609,Fri Nov 06 15:06:06 +0000 2015,0,1,Do excuses get in the way of your sales team being productive and closing deals?  We all make excuses at some... https://t.co/cdhvsNxXCg
80,662382700318322688,Thu Nov 05 21:35:16 +0000 2015,0,0,4 Ways to Make Sure You Never Miss a Sales Call https://t.co/27PowSoIDw via @Renbor
81,662370270284521472,Thu Nov 05 20:45:53 +0000 2015,0,0,Are you an effective sales coach? Clarity is the key. https://t.co/19yxvbxY2F
82,662363852722593792,Thu Nov 05 20:20:23 +0000 2015,0,0,"“What gets measured gets managed."" Why Sales Hunters Need Lead Management Software https://t.co/DnGSOewRVc"
83,662355212976431104,Thu Nov 05 19:46:03 +0000 2015,0,0,Do your sales reps know who to call next? VanillaSoft can help take the guesswork out of your process. https://t.co/ISjXssw2Ul
84,662341168450150400,Thu Nov 05 18:50:14 +0000 2015,0,0,Are You Measuring the Right Performance Indicators? https://t.co/B5OFZZnc9x
85,662321049443426304,Thu Nov 05 17:30:18 +0000 2015,0,0,Your sales email is just one of 100 or more your prospect receives everyday! https://t.co/lcyn4o8pnM
86,662294771201933312,Thu Nov 05 15:45:52 +0000 2015,0,1,Need some tips on how to improve your cold calling process?  Check out these B2B cold calling best practices. https://t.co/ylfLfWTcFk
87,662279654913503232,Thu Nov 05 14:45:48 +0000 2015,0,0,Do you need a complete solution for your merchant services sales team?  VanillaSoft’s complete software solution... https://t.co/hh6zhSSKc0
88,662061883596406784,Thu Nov 05 00:20:28 +0000 2015,1,0,Sales Coaching 101: Be Curious https://t.co/ZcQVBJVn7N via @EcSellInstitute
89,662036699061624832,Wed Nov 04 22:40:23 +0000 2015,0,0,Case Study: How did Cogent Analytics bost appointment setting by 40%? https://t.co/fDvWt4tAiv
90,662007933031550976,Wed Nov 04 20:46:05 +0000 2015,0,1,Do you have a sales opportunity plan? Check out these 5 elements of a sales opportunity plan. https://t.co/SSmXVhTejv
91,662005205995753472,Wed Nov 04 20:35:15 +0000 2015,0,1,Put These 3 Sales Script Tips to Work https://t.co/qarWguyG7X
92,661992875413106688,Wed Nov 04 19:46:15 +0000 2015,0,0,Tired of kissing frogs to get the right leads? Learn how VanillaSoft can help your inside sales reps call the... https://t.co/J6RaIxhQPu
93,661986363680628736,Wed Nov 04 19:20:22 +0000 2015,0,0,Using Interactive Content to Improve the Sales Funnel https://t.co/rnVa9lGgqG
94,661973809243758592,Wed Nov 04 18:30:29 +0000 2015,0,0,7 Career-Killing Habits That You Can't Afford To Keep by @SujanPatel https://t.co/snOWgM0XiN via @Inc
95,661957756124012545,Wed Nov 04 17:26:42 +0000 2015,0,0,Sales Can Rise When You Speed up Employee Onboarding https://t.co/XVEOhSiyAB
96,661932411761094656,Wed Nov 04 15:45:59 +0000 2015,0,0,Are your sales reps curious? Encourage asking questions to become better sales reps. https://t.co/cucUpPoyW1
97,661917284261339137,Wed Nov 04 14:45:53 +0000 2015,0,0,Are you an entrepreneur? Make sure you're using the right technology. https://t.co/Q0CMFlYo1D
98,661704522956455937,Wed Nov 04 00:40:26 +0000 2015,0,0,How To Establish a Rhythm for Your Business https://t.co/eEwbTYHvSp via @iannarino
99,661664495580917760,Tue Nov 03 22:01:23 +0000 2015,1,0,Better Sales Funnel Transition Means Better Conversion Rates https://t.co/nEqQkCWKhJ
100,661647861310955520,Tue Nov 03 20:55:17 +0000 2015,0,0,The Importance of Measurable KPIs- A call center is only as good as its agents https://t.co/47FQ9G0Idc https://t.co/pe1EUigKbp
101,661630420187029506,Tue Nov 03 19:45:59 +0000 2015,0,0,Are you in hospitality sales?  Selling happens all year round.  Learn to make the most of digital marketing tactics. https://t.co/WotRAE904S
102,661607634504704000,Tue Nov 03 18:15:26 +0000 2015,0,0,"Workarounds Available for Weak Internet Marketing, Sales https://t.co/DnBCGiwQwR"
103,661586205193170946,Tue Nov 03 16:50:17 +0000 2015,1,0,Why Your Team Won’t Speak Up—And How to Change the Dynamic https://t.co/NHFo20uRVq via @IThinkBigger
104,661586008467746816,Tue Nov 03 16:49:30 +0000 2015,50,0,RT @HarvardBiz: Consumers Don’t Understand the Relationship Between Time and Speed https://t.co/9gS4OV3k0V
105,661569934372298752,Tue Nov 03 15:45:38 +0000 2015,0,0,Does your sales process have an established rhythm? Check out these tips. https://t.co/H7j2ACygMq
106,661554825461547008,Tue Nov 03 14:45:36 +0000 2015,0,0,Do you want to save in your production costs?  Learn how Millikin University saved thousands in production costs. https://t.co/8sfrUG9Sfl
107,661540913701720064,Tue Nov 03 13:50:19 +0000 2015,0,0,Don't forget to stop by the VanillaSoft table at the AA-ISP Inside Sales Conference today!  Looking forward to a... https://t.co/h73u4PC51N
108,661296865745502208,Mon Nov 02 21:40:33 +0000 2015,0,0,How to Coach Your Agents Using Call Metrics https://t.co/e6macd92Oc
109,661283081081475072,Mon Nov 02 20:45:47 +0000 2015,0,0,Help or Hindrance?  Where does your sales process fall? https://t.co/lphu1ehQaO
110,661268047244623872,Mon Nov 02 19:46:02 +0000 2015,1,1,Is your sales system sophisticated enough for your business? Take it through the 7-step rehab program. https://t.co/vyA2Dayd4i
111,661242706375651328,Mon Nov 02 18:05:21 +0000 2015,0,0,Essential Productivity Tools for Inside Sales Teams https://t.co/4cX8WUU84I
112,661225066001276929,Mon Nov 02 16:55:15 +0000 2015,0,0,Avoid the 'Sales Robot' in Inside Sales https://t.co/qnzhq1rarY
113,661207537455337472,Mon Nov 02 15:45:36 +0000 2015,0,0,Are your sales reps building or ruining relationships? Learn tips to help you improve your relationships. https://t.co/frmhVHt8x3
114,661192417941565440,Mon Nov 02 14:45:31 +0000 2015,0,0,Do you attend trade shows? Check out these tips for effective follow up after the show. https://t.co/LNkEfQArfC
115,660849348650102784,Sun Nov 01 16:02:17 +0000 2015,0,0,Posts from VanillaSoft Blog for 11/01/2015 - https://t.co/qzI66KHBkH
116,660180857936699392,Fri Oct 30 19:45:56 +0000 2015,0,0,Are you managing your sales leads? Learn how to manage leads more effectively. https://t.co/xcDWpGpMqq
117,660165765769859072,Fri Oct 30 18:45:58 +0000 2015,0,1,Do you know how to coach your sales agents? Learn how using call metrics is a good coaching tool. https://t.co/gDzmXrOgW9
118,660122829837303808,Fri Oct 30 15:55:21 +0000 2015,0,0,Are you social helping in your social selling efforts? https://t.co/PAnPSZ34us
119,660105371982422018,Fri Oct 30 14:45:59 +0000 2015,0,0,Are your sales reps a signal or just noise? Check out these tips to help improve your sales calls. https://t.co/nL3e5EFqsA
120,660090252288110592,Fri Oct 30 13:45:54 +0000 2015,0,0,Looking for ways to help your insurance sales reps make a good first impression? Learn how to make good... https://t.co/wQL7f2VqxQ
121,659827212070297601,Thu Oct 29 20:20:41 +0000 2015,0,0,Email is Easy But Calling is Better https://t.co/IZtRU1NO33
122,659818445739917312,Thu Oct 29 19:45:50 +0000 2015,0,1,Looking for ways to improve your sales? Marketo has some suggestions. https://t.co/Aodh49N5Ai
123,659803343926226948,Thu Oct 29 18:45:50 +0000 2015,0,0,Looking for ways to improve your inside sales team’s efficiency and productivity? Check out these tips! https://t.co/qM1C2N40e9
124,659799732139778048,Thu Oct 29 18:31:29 +0000 2015,0,0,RT @SalesStaffLeads 4 Compelling Events you can Create to Drive #B2BSales https://t.co/Dc4SD0lQ8F
125,659778093540864002,Thu Oct 29 17:05:30 +0000 2015,0,0,Are Internal Conflicts Stifling Your Sales Productivity? https://t.co/agIoqdb1jh
126,659759195386957824,Thu Oct 29 15:50:24 +0000 2015,0,0,RT @HarvardBiz 4 Ways Leaders Fritter Their Power Away https://t.co/TWP0FI5xgK
127,659742828839481344,Thu Oct 29 14:45:22 +0000 2015,0,0,"Do your sales reps know how to handle the ""We're happy with our current provider"" objection?  Here are some tips... https://t.co/pYXzTWy2OU"
128,659741565468975104,Thu Oct 29 14:40:21 +0000 2015,0,0,"Workarounds Available for Weak Internet Marketing, Sales https://t.co/e8Mflh5xtf"
129,659727743077085185,Thu Oct 29 13:45:25 +0000 2015,0,0,Does your nonprofit do telefundraising campaigns? Engage donors with a compelling message. https://t.co/2PnWiJWL5n
130,659708607789932544,Thu Oct 29 12:29:23 +0000 2015,1,0,RT @SalesldMgmtAssn: @VanillaSoft  Genie Parker nominated to 40 Most Inspiring Leaders https://t.co/HUcDoEvQFE #callcenter #salesleads http…
131,659708466282553344,Thu Oct 29 12:28:49 +0000 2015,0,0,@gumbodopeness Are you still having trouble?
132,659708405091799040,Thu Oct 29 12:28:35 +0000 2015,0,0,"@gumbodopeness I'm sorry, no one was monitoring this account last night. Email or call for support here. https://t.co/4cCEKKLEwb"
133,659476052717260800,Wed Oct 28 21:05:18 +0000 2015,0,0,Using a Sales Script Well Is About Listening – Not Talking https://t.co/ExNxRlLM6s
134,659457236272549889,Wed Oct 28 19:50:31 +0000 2015,0,0,"RT @janinepopick 3 amazingly successful storytelling campaigns, what's yours? @Inc #marketing #sales https://t.co/1ECv7NVpWI"
135,659456052845408256,Wed Oct 28 19:45:49 +0000 2015,0,0,Looking for some sales insights? Listen to this podcast for some powerful sales tips. https://t.co/cowFTcu3mL
136,659440947420262400,Wed Oct 28 18:45:48 +0000 2015,0,0,Is your sales script a crutch or a tool for your inside sales reps? Check out these 3 tips for using inside sales... https://t.co/lgBm8xXr7m
137,659439556794667008,Wed Oct 28 18:40:16 +0000 2015,0,0,RT @gerhard20 Three Ways to Increase Sales Through Passion for Your Product https://t.co/qXFCtwStcH
138,659420496778371072,Wed Oct 28 17:24:32 +0000 2015,0,0,Blog: Avoid the 'Sales Robot' in Inside Sales https://t.co/h7xZA2jGt9
139,659380456853516288,Wed Oct 28 14:45:26 +0000 2015,0,0,Need to make the buying process easier? Un-complicate the decision process. https://t.co/0r928RQbrz
140,659365327415869440,Wed Oct 28 13:45:19 +0000 2015,0,0,Are you in sales for the banking &amp; finance industry? Learn how to achieve greater profitability with lead... https://t.co/s3IrfKZB2j
141,659093666439524352,Tue Oct 27 19:45:50 +0000 2015,0,0,3 Tips for Using Inside Sales Scripts Effectively https://t.co/Z0Uu1Rub1x
142,659093544532099073,Tue Oct 27 19:45:21 +0000 2015,0,0,"Want to be a better leader for your sales team? Move from ""I"" to ""We"". https://t.co/gyhVP338Wr"
143,659078548276252673,Tue Oct 27 18:45:45 +0000 2015,0,0,Looking for a Sales CRM Designed to Accelerate Inside Sales Performance?  Learn how VanillaSoft can help! https://t.co/k2OXahnNNb
144,659075932637016064,Tue Oct 27 18:35:22 +0000 2015,0,0,Why I Started Exercising First Every Day https://t.co/860SCPArRZ via @iannarino
145,659057118432075776,Tue Oct 27 17:20:36 +0000 2015,1,0,Better Sales Funnel Transition Means Better Conversion Rates https://t.co/v8mQyidk2X
146,659038161729953794,Tue Oct 27 16:05:16 +0000 2015,0,0,"40 Most Inspiring Leaders- Nominee: David Hood, @VanillaSoft https://t.co/b1QsWSsZdA Thanks @SalesldMgmtAssn!"
147,659018067398148096,Tue Oct 27 14:45:25 +0000 2015,0,0,Going to miss your sales quota this year? Check out these tips to help you succeed. https://t.co/pTWDjtz2VL
148,659006886587584512,Tue Oct 27 14:01:00 +0000 2015,0,0,@AKB2BTuneUp Thanks for the share!
149,659006751736492032,Tue Oct 27 14:00:28 +0000 2015,1,0,Need some tips on managing a high-performance inside sales team?  Check out these tips. https://t.co/qdwuhSqR29
150,659001669896814593,Tue Oct 27 13:40:16 +0000 2015,0,0,"Workarounds Available for Weak Internet Marketing, Sales https://t.co/S9CP9puRVb"
151,658979194899177472,Tue Oct 27 12:10:57 +0000 2015,1,0,RT @SalesldMgmtAssn: David Hood of @VanillaSoft Nominated to 40 Most Inspiring Leaders. https://t.co/AEOef14bGv Whom will you nominate? htt…
152,658691751910092800,Mon Oct 26 17:08:46 +0000 2015,0,0,3 Prospecting Tips to Warm Up a Cold Call https://t.co/AxegPCypVu
153,657685624363831296,Fri Oct 23 22:30:46 +0000 2015,1,0,Sales Leadership No Excuses Accept Responsibility and Be Accountable https://t.co/8e6p5EdwXb via @scoremoresales
154,657655428906618881,Fri Oct 23 20:30:47 +0000 2015,0,0,Inside Sales Processes Soar When Standardized https://t.co/K3C0UJxpMe
155,657644063022292992,Fri Oct 23 19:45:37 +0000 2015,0,0,Looking for ways to make your sales reps better? Here are 2 tips to help improve even your best sellers! https://t.co/pinV3rqze7
156,657638971669913600,Fri Oct 23 19:25:23 +0000 2015,0,0,Road Map to Drive Appointment Setting Success https://t.co/KanqZYs0IK https://t.co/ezYg5zD9Y8
157,657631377504862208,Fri Oct 23 18:55:13 +0000 2015,0,0,3 Tips for Using Inside Sales Scripts Effectively - VanillaSoft Blog https://t.co/ntGkyy6NEl
158,657628969760522240,Fri Oct 23 18:45:39 +0000 2015,0,0,Don't let internal conflicts disrupt your sales productivity. Learn ways to work together. https://t.co/hqoZP5nBGV
159,657626345577521153,Fri Oct 23 18:35:13 +0000 2015,0,0,To Manage Sales You Must Manage Sales Leads https://t.co/f6ptxVxe7k via @B2Community by James Obermayor of @SalesldMgmtAssn
