,id_str,created_at,retweet_count,favorite_count,text
0,669041512924188672,Tue Nov 24 06:35:01 +0000 2015,54,48,"Dudes be like: let me text &amp; call you every day, tell you I like you, give  you A1 dick but say it's not a relationship."
1,668893872299315200,Mon Nov 23 20:48:21 +0000 2015,95,0,RT @megaIeio: You can't marry him if his last name sounds trash with your first. That's God way of saying don't do it.
2,668605860571160576,Mon Nov 23 01:43:53 +0000 2015,15,0,RT @LiveFromSlaySt: #MyFollowersCute 😊 @Eritrean_Gual https://t.co/zUJebG5JOm
3,668605753813417984,Mon Nov 23 01:43:28 +0000 2015,30,0,"RT @megaIeio: me &amp; some these bitches could never relate
they fake
&amp; always cuttin on another man's cake
eatin off another man's plate
i go…"
4,668595372520902656,Mon Nov 23 01:02:13 +0000 2015,22,0,RT @PrettyySalute: Riding thru the city with you on my mind.
5,668595314958274560,Mon Nov 23 01:01:59 +0000 2015,58,0,RT @LiveFromSlaySt: life is too short to be waiting for someone to act right
6,668563485178073088,Sun Nov 22 22:55:30 +0000 2015,24,0,"RT @ProjectGlA: Ladies break up with your man dec 23rd then get back with him on the 26th.- 27th

save money"
7,668561950473850882,Sun Nov 22 22:49:24 +0000 2015,95,52,How you have a problem with me and address it with everybody but me? Is there really an issue? Nah. There's not.
8,668561039353585664,Sun Nov 22 22:45:47 +0000 2015,42,0,RT @QueenTrillaa: Hate when you high and people send you paragraphs
9,668560960710381568,Sun Nov 22 22:45:28 +0000 2015,27,0,RT @HighHaleigh: Everyone has that one friend that you fall out with when she get a new man then she come back when they break up and repea…
10,667887900344889344,Sat Nov 21 02:10:58 +0000 2015,47,0,"RT @QueenTrillaa: If a woman likes you, she'll hand over the pussy effortlessly like https://t.co/mWuf1pbvFd"
11,667887833798045697,Sat Nov 21 02:10:42 +0000 2015,31,0,"RT @ProjectGlA: Ladies make sure he sends you a selfie fitted free. 

Hats are contour for these niggas"
12,667055450806857728,Wed Nov 18 19:03:07 +0000 2015,57,47,https://t.co/kQkLIwc68C
13,666365831782121472,Mon Nov 16 21:22:49 +0000 2015,5,5,"A lot of females encourage and enable their ""friends"" stupidity....  ."
14,666361323169550336,Mon Nov 16 21:04:54 +0000 2015,2510,0,"RT @SexualGif: *on a first date*
ok dont let them know i stalked them online
them: my aunt--
me: theresa or sharon"
15,666358267942182912,Mon Nov 16 20:52:46 +0000 2015,61,0,RT @HighHaleigh: I lose interest too quickly to fuck with anybody who has attachment issues.
16,665334391669846020,Sat Nov 14 01:04:14 +0000 2015,203,0,RT @lorenachou: Cities in all over the world are changing their buildings' light into French flag to show the support #PrayForParis https:/…
17,665333763988000768,Sat Nov 14 01:01:45 +0000 2015,267,0,"RT @5SOSTeamWork: Eiffel Tower's lights go out in memory of those killed in today's siege.😔❤ #PrayForParis 
https://t.co/EOTxKL8xW7"
18,653669321730715648,Mon Oct 12 20:31:25 +0000 2015,52,20,"If you don't like what somebody does, you should just stop fucking with them instead of complaining."
19,651488622982488064,Tue Oct 06 20:06:06 +0000 2015,11,10,Simply because I know how it feels to be led on and let down. It's so hard to detach yourself from someone you shared so much with.
20,651488118386757632,Tue Oct 06 20:04:06 +0000 2015,18,11,"I would never lead anyone on. If I'm no longer feeling you or never was, I will not hesitate to inform you."
21,651487383125381120,Tue Oct 06 20:01:10 +0000 2015,11,6,It is what it is. You live and you learn.
22,648608867878875136,Mon Sep 28 21:22:59 +0000 2015,151,74,i'm not a quitter but sometimes the game ain't worth playing anymore
23,647866177335726080,Sat Sep 26 20:11:48 +0000 2015,17,20,i always get what i want because i get up and get what i want
24,632305877249355777,Fri Aug 14 21:40:43 +0000 2015,122,94,"When you're good without them, they come running back."
25,629722196097654786,Fri Aug 07 18:34:05 +0000 2015,51,64,Sometimes you have to remind a nigga you can get chosen .... And he can get left. http://t.co/syQRugdfcT
26,624019677732306945,Thu Jul 23 00:54:19 +0000 2015,112,79,😭 http://t.co/CswL5bGdUb
27,624005847480434688,Wed Jul 22 23:59:22 +0000 2015,42,43,"Never tell somebody you like them unless they tell you first because if they don't like you back, they will fuck with your emotions. 💯"
28,623268117519712256,Mon Jul 20 23:07:53 +0000 2015,16,15,Funny how much you learn about yourself by watching the people you surround yourself with.
29,618174328664903680,Mon Jul 06 21:46:59 +0000 2015,2,7,"People get so distracted and caught up in their own reflection, they fail to see the absence of hope in another's eyes"
30,617843532393529344,Sun Jul 05 23:52:31 +0000 2015,89,54,I wish people would put less energy into promising me shit and more energy into actually being there
31,615985681916035072,Tue Jun 30 20:50:05 +0000 2015,18,12,"Sometimes you have to stop trying to please others 
&amp; do what YOU truly want to do"
32,615733053017714688,Tue Jun 30 04:06:14 +0000 2015,18,9,When you want to do stuff but you have no one to do it with &lt;&lt;&lt;&lt;&lt;&lt;
33,613963650366353408,Thu Jun 25 06:55:15 +0000 2015,96,44,"I am a very private person, yet I am an open book. if you don’t ask, I won’t tell."
34,613364961516126208,Tue Jun 23 15:16:17 +0000 2015,75,90,The moment you realize that there are too many other men interested in you to be stressing over one that doesn't know how to act &gt;&gt;
35,612417121759440900,Sun Jun 21 00:29:54 +0000 2015,18,7,"when they complain about ""neglect"" and not having your attent cause  they see others giving you attention 😊😊😊"
36,610982055141330944,Wed Jun 17 01:27:28 +0000 2015,7,6,most women don't take to having other women around. They're too territorial &amp; arrogant. Reasons why I don't have many girl friends.
37,610893042879328256,Tue Jun 16 19:33:45 +0000 2015,78,43,"We don't have to be around each other every day to know that we are friends. Taking care of business comes first, but when we link up... 🙌🏾"
38,609858403330998272,Sat Jun 13 23:02:28 +0000 2015,27,24,"You be sitting there singing your heart out, all of sudden your music cuts off, and you look down to a incoming call 😑"
39,607586753764061185,Sun Jun 07 16:35:45 +0000 2015,12,10,self love is knowing you don't need permission to speak your truths.
40,605487195642691584,Mon Jun 01 21:32:51 +0000 2015,3,2,No one remembers whether or not your intentions were good or where your heart was.
41,605486946937245696,Mon Jun 01 21:31:52 +0000 2015,3,2,“Good intentions” without a follow through on said intent don’t mean shit.
42,605141658599100416,Sun May 31 22:39:49 +0000 2015,59,29,I have a small list of people I wish would act like they just don't know or knew me. Like lose memory completely
43,604989425714626560,Sun May 31 12:34:53 +0000 2015,5,4,how https://t.co/NgBemBkwRS
44,604771724194942976,Sat May 30 22:09:49 +0000 2015,10,12,I always have too many options in every aspect of life which makes me indecisive. I just want to make the right choice with whatever.
45,604717090742878208,Sat May 30 18:32:44 +0000 2015,25,4,"""Surround yourself with those who see greatness in you, even when you don't see it in yourself"""
46,604696203658457089,Sat May 30 17:09:44 +0000 2015,1,2,Happy Saturday http://t.co/fhFhUawiUd
47,604464483176722433,Sat May 30 01:48:57 +0000 2015,13,6,Something really weird about you girls who don't mind sharing your man with other women. Couldn't be me.
48,604453514668998656,Sat May 30 01:05:22 +0000 2015,50,0,RT @LiveFromSlaySt: People lways wanna claim they did it out of love but be the first one to throw it in your face that they did something …
49,604350478659555328,Fri May 29 18:15:57 +0000 2015,7,4,Appreciate your blessings! Whether you think you have them or not you do!
50,604141230851776512,Fri May 29 04:24:28 +0000 2015,0,0,@sicemanlaflare lol thank you
51,604127106923118592,Fri May 29 03:28:21 +0000 2015,12,10,can't deal with someone that's one person behind closed doors and another to the world
52,604048554550804480,Thu May 28 22:16:12 +0000 2015,2,34,http://t.co/sW3XYFsQNX
53,603731632617562112,Thu May 28 01:16:52 +0000 2015,10,6,"I'm more accepting of people who are who they say that are because I can adjust, but someone who'd rather sit around &amp; put on this act. No."
54,603233469481746433,Tue May 26 16:17:21 +0000 2015,6,3,I love the people I surround myself with. They keep me level headed when I think clearly.
55,602970103802667008,Mon May 25 22:50:50 +0000 2015,6,8,"I can give some really good advice on how to deal with emotions... but when it comes to my own, I'm so awkward."
56,602892392279220225,Mon May 25 17:42:02 +0000 2015,69,45,"Be down for me consistently, not just around for me conveniently."
57,601477326187175936,Thu May 21 19:59:04 +0000 2015,26,21,Ever missed someone while you're with them...just because you know you're going to have to leave them at some point. Shit is crazy. 😩
58,601151107063259136,Wed May 20 22:22:47 +0000 2015,270,167,😳 http://t.co/ARc1lw8ZpT
59,600710234546507776,Tue May 19 17:10:55 +0000 2015,41,33,I often have to remind myself to keep good karma despite how I feel. It'll come back to me otherwise and I don't need that.
60,600419601525026817,Mon May 18 21:56:02 +0000 2015,9,7,"But if our situation ended on some corny or foul shit on your end, all is forgiven because I'm mature - but I don't fuck with you. Period"
61,600418867173810177,Mon May 18 21:53:07 +0000 2015,7,9,I don't have any beef with any of my ex's or old boo's. They cool &amp; I have nothing negative to say about any of them
62,599690810691457024,Sat May 16 21:40:05 +0000 2015,0,4,Stuck watching Handy Manny with my niece
63,599324727602192385,Fri May 15 21:25:24 +0000 2015,13,12,Always great to think different and have a mind of your own. Never try to be these bitches
64,599279351952191488,Fri May 15 18:25:06 +0000 2015,4,8,My fear is ending up with someone who's too antagonizing instead of supportive. Someone who'd thrives from seeing me sad.
65,599227638545252353,Fri May 15 14:59:36 +0000 2015,0,1,@Trapboog_300 thank you for the shoutout
66,599227561026179072,Fri May 15 14:59:18 +0000 2015,1,0,RT @Trapboog_300: Special S/o to @CrownHer. She follow back and is cute asf 💯 #FollowHer
67,599227548782956544,Fri May 15 14:59:15 +0000 2015,4,0,RT @Guey_Nyathii: 💪🏻💪🏻💪🏻💪🏻💪🏻💪🏻 https://t.co/HxMCcfh3zE
68,598911864517632000,Thu May 14 18:04:50 +0000 2015,9,9,I hate when I genuinely am in the mood to talk to someone and they're dry as hell. I can honestly never win.
69,598607696712073216,Wed May 13 21:56:11 +0000 2015,47,49,"I love when my exes hit me with the “hey stranger” messages. 😂 Bye, baby."
70,598552798171680770,Wed May 13 18:18:02 +0000 2015,70,44,Choose to surround yourself with people you can learn from/with.
71,598352407026794497,Wed May 13 05:01:45 +0000 2015,3,0,RT @m3nac324: 90% of communication is non verbal  https://t.co/1iisOTREp7
72,598308193064853504,Wed May 13 02:06:03 +0000 2015,11,11,A person will tell you all you need to know without even directly telling you..
73,598249065059655680,Tue May 12 22:11:06 +0000 2015,1,0,RT @josephbrooks47: DONT LET SOMEONE CHANGE U FOR WHAT U WANNA BE. ALWAYS BE YOURSELF OKAY #@CrownHer  https://t.co/dqfgddpmfb
74,598236629493383168,Tue May 12 21:21:41 +0000 2015,46,47,"I'm scared to open up to someone new because I'm scared of change, I'm scared of someone walking away so soon, I'm scared of secrets."
75,598119210015920128,Tue May 12 13:35:06 +0000 2015,3,7,"How you mad at the chicks your ""man"" is dealing with if he out here telling everyone he's single ?"
76,597854353114923010,Mon May 11 20:02:40 +0000 2015,2,0,RT @YeaaimRich: Lmfaoo On God this Accurate  https://t.co/2VZFPKNuNV
77,597846901581549568,Mon May 11 19:33:03 +0000 2015,88,43,Was taught to be a winner but I learned more from my losses
78,597845117488226306,Mon May 11 19:25:58 +0000 2015,56,0,"RT @2TitSalute: Don't get mad when you see me doing what I was trying to do with you, with someone else"
79,597837121467056128,Mon May 11 18:54:11 +0000 2015,684,330,"When you lose something and someone asks you ""where'd you lose it at?"" http://t.co/YtQ4rPTGgY"
80,594470698019586048,Sat May 02 11:57:13 +0000 2015,3,0,Starting my morning off sultry like http://t.co/6uKCbi65y3
81,594306758337789953,Sat May 02 01:05:47 +0000 2015,9,3,"I always pay attention, but I try not to over-analyze. things are usually never as deep as I make them out to be."
82,583033992863223808,Tue Mar 31 22:31:50 +0000 2015,49,36,The truth hurts only once. A lie hurts every time you remember it.
83,580495363460595712,Tue Mar 24 22:24:14 +0000 2015,20,18,OMG he text me 'hey' yesterday. He sent me a snapchat. He liked a picture. 😁 ..... But he don't really want ya baby. Where's the effort?
84,580493833655361537,Tue Mar 24 22:18:09 +0000 2015,32,27,The smallest gestures/comments will have girls makin stuff more than it is. Lol plannin futures nShit
85,580492898749288448,Tue Mar 24 22:14:26 +0000 2015,65,42,You should want to fall for someone that actually wants to be around you and makes an effort to be around.
86,580491969710940160,Tue Mar 24 22:10:45 +0000 2015,84,90,"If he doesn't make any real effort to see you, but continuously tries to maintain a connection via text, just forget it gal."
87,580481615945662466,Tue Mar 24 21:29:36 +0000 2015,63,52,"stop overthinking. there's no reason to stress out over possible scenarios that haven't happened, and might not ever happen."
88,580128394886713345,Mon Mar 23 22:06:02 +0000 2015,11,8,"He who does not feel me is not real to me; therefore, he doesn't exist. So poof. Vamoose son of a bitch."
89,580095406312439808,Mon Mar 23 19:54:57 +0000 2015,88,0,RT @YassssHairGods: Not everybody that comes in your life is meant to be kept
90,580095330739494914,Mon Mar 23 19:54:39 +0000 2015,48,0,RT @HighHaleigh: Why do men get annoyed that we associate sex and love? Want us to be hoes ?
91,580095250972192768,Mon Mar 23 19:54:20 +0000 2015,29,0,RT @CassieRocheIIe: potential is like a student loan. Sounds good at 1st but fucks u over BIG TIME
92,580094139284471808,Mon Mar 23 19:49:55 +0000 2015,42,21,I'll only get mad or upset if I care .. If I don't care then http://t.co/WDcOAn6puI
93,579856062632837120,Mon Mar 23 04:03:53 +0000 2015,5,3,Always trying my best to put out into existence what I would like to receive + hoping my actions are somehow appreciated in some small way.
94,567915019133984768,Wed Feb 18 05:14:26 +0000 2015,61,59,Ever almost feel ashamed that someone is so important to you that without them you feel like nothing ?
95,567462517551955968,Mon Feb 16 23:16:21 +0000 2015,62,57,"You ever have that person that hits you up and it fucks with your whole day and when they don't hit you up, it fucks with your whole day?"
96,531142048251129856,Sat Nov 08 17:51:47 +0000 2014,59,30,I have a horrible habit of stressing over things I shouldn't entertain two thoughts about.
97,530165949626716161,Thu Nov 06 01:13:07 +0000 2014,22,22,A girl plays with your mind. A woman explores it.
98,524637918028369920,Tue Oct 21 19:06:41 +0000 2014,19,6,I have a lot going for myself. I do a lot. So I don't want parts or attention from a man who isn't about something.
99,524636602409451520,Tue Oct 21 19:01:27 +0000 2014,0,0,@NicosB thanks. How's your day going?
100,523596636128161792,Sat Oct 18 22:09:00 +0000 2014,7,5,I hate when people don't take business seriously. I hate working around another persons schedule. It's simple to get shit done.
101,523584393609105408,Sat Oct 18 21:20:21 +0000 2014,1,0,@sixelanicole &lt;3
102,523584113085657088,Sat Oct 18 21:19:14 +0000 2014,0,0,@EstIIXVIIIIV thank you
103,523556319958032384,Sat Oct 18 19:28:48 +0000 2014,19,143,thee other night http://t.co/w8db02PqzA
104,523185427327377409,Fri Oct 17 18:55:00 +0000 2014,11,5,"I'm surely not about to make something that doesn't involve me, my concern."
105,523185241008001024,Fri Oct 17 18:54:16 +0000 2014,22,10,Everything isn't worth my reaction or energy. People know what they're doing at all times. You thought I'd be mad? 😴
106,522528860265791489,Wed Oct 15 23:26:03 +0000 2014,24,10,I spent so much of my life waiting around on other people or things that I was hoping would happen.
107,522090765485604865,Tue Oct 14 18:25:13 +0000 2014,11,12,People will disguise themselves like they're trying to build with you but they're really just leeching off of you for their own satisfaction
108,521809166604578816,Mon Oct 13 23:46:14 +0000 2014,18,18,"So yes, I am picky. That is the only way I can preserve who I am, to be the best that I am. It may not work for others but it's best for me."
109,521808072419713024,Mon Oct 13 23:41:53 +0000 2014,10,12,"Just as you should be picky about who you let in your body, you must be as picky about who you let in your life."
110,521807887191269377,Mon Oct 13 23:41:09 +0000 2014,27,14,I'm so picky. I'm picky with energy. I'm picky with time. I'm picky with friends. I'm picky with guys. That's just me. I'm picky &amp; private.
111,521703559654817793,Mon Oct 13 16:46:36 +0000 2014,15,7,"I have a huge problem with people doing my job for me. Whatever it is, I like to work &amp; accomplish things at my own pace."
112,521433223260569600,Sun Oct 12 22:52:22 +0000 2014,193,147,Mood: http://t.co/xUYoPYHLl0
113,521368428985479168,Sun Oct 12 18:34:54 +0000 2014,43,31,I moved on and grown out of certain things and people... Life.
114,520337661593399296,Thu Oct 09 22:19:00 +0000 2014,100,58,"a girlfriend is a potential wife, if you ask me. relationships are investments not hobbies. y'all gotta grow up."
115,519635603617366016,Tue Oct 07 23:49:16 +0000 2014,17,14,I like to test people. I'll tell someone something absurd as hell and watch them run with it. Just to prove how right I am about ppl.
116,519261846197399553,Mon Oct 06 23:04:06 +0000 2014,21,19,"relationships are beautiful, but if your partner doesn't inspire or motivate you to be a better you, you should cut that shit off."
117,518910108890595328,Sun Oct 05 23:46:25 +0000 2014,27,11,"can’t please everybody
can’t be loved by everyone
stick to those who see the real you
and love you for that."
118,518830548421050368,Sun Oct 05 18:30:16 +0000 2014,10,12,"people are so extra. 
i'm definitely a different type of chill."
119,518495621796622336,Sat Oct 04 20:19:24 +0000 2014,1,2,@CountryMusikMan i agree!
120,518495436072816640,Sat Oct 04 20:18:39 +0000 2014,1,0,RT @CountryMusikMan: @QueenIsHer Yes if man and woman could stop playing games. The problem is past problem with unloving users
121,518495290362707968,Sat Oct 04 20:18:05 +0000 2014,0,1,@HardcoreH52ver i'm feeling great... how are you?
122,518495103833604096,Sat Oct 04 20:17:20 +0000 2014,1,0,RT @LawrenceRobert2: @QueenIsHer Please consider my 59yr_Continuum Project 4 Humanity-If U find Value_please find ways 2 share http://t.co/…
123,518483241964032000,Sat Oct 04 19:30:12 +0000 2014,84,49,"Someone who just gets it, gets you, without you having to explain yourself."
124,518221696961351680,Sat Oct 04 02:10:55 +0000 2014,102,61,"If everyone was straightforward and avoided playing games, the world would be a better place."
125,518073418927702017,Fri Oct 03 16:21:43 +0000 2014,78,35,Only weak individuals seek attention where they envy
126,517412975809167361,Wed Oct 01 20:37:21 +0000 2014,112,54,"No matter what transpired between us, I wish everyone the best. We may not be in a good space but I wish bad upon no one."
127,516769310027808768,Tue Sep 30 01:59:39 +0000 2014,33,16,"nothing ""regular"" about me.
I don't strive to be basic."
128,516655991044468736,Mon Sep 29 18:29:21 +0000 2014,20,16,I'm the type of person who thinks far ahead of a situation before going through with anything. I analyze every single thing.
129,516391859724115968,Mon Sep 29 00:59:48 +0000 2014,22,16,I'm not even remotely concerned with what anyone else is doing and/or has. Nothing satisfactory or beneficial comes from it.
130,516301797733179393,Sun Sep 28 19:01:55 +0000 2014,15,12,You can't expect people to do things for you just because you would for them
131,516017377931444224,Sun Sep 28 00:11:44 +0000 2014,133,73,I just hope I don't regret who I'm choosing to share my time with.
132,515916033010327552,Sat Sep 27 17:29:02 +0000 2014,38,0,"RT @CrownHer: See how consistent I am, see how persistent I am"
133,515714806377381888,Sat Sep 27 04:09:26 +0000 2014,10,17,I'm the type of person that will always try to outdo myself
134,515284005604716545,Thu Sep 25 23:37:35 +0000 2014,42,27,"If we not making money together, are we even friends? Do we even care about growing together."
135,514936091099418625,Thu Sep 25 00:35:05 +0000 2014,119,58,"“Do not chase people. Be you and do your own thing and work hard. The right people who belong in your life will come to you, and stay.”"
136,514205092103213056,Tue Sep 23 00:10:22 +0000 2014,90,42,"The difference between me and you, you always got your hand out and I don't take no hand outs."
137,514167799162634240,Mon Sep 22 21:42:10 +0000 2014,6,3,Visit http://t.co/Ps4VMvFwST  for all social media needs😉 http://t.co/6IiPaI6Fov
138,514139450826567680,Mon Sep 22 19:49:31 +0000 2014,70,40,I don't have time for childish ass males and females because I'll check you real quick
139,506922052008173568,Tue Sep 02 21:50:10 +0000 2014,33,21,"If your ex is still capable of changing your mood, you still have feelings for them."
140,506143792081039361,Sun Aug 31 18:17:38 +0000 2014,15,19,"don't say you like me, make me catch feelings, then say ""we're just friends"". Get your selfish ass away from me"
141,505945030545399808,Sun Aug 31 05:07:49 +0000 2014,122,95,I don’t want anyone else getting the same butterflies I get when I hear or say your name
142,505739220804067329,Sat Aug 30 15:30:01 +0000 2014,10,10,Being afraid of rejection don't exist when you know you dope
143,505551286507696128,Sat Aug 30 03:03:14 +0000 2014,17,13,"People stay calling me fake for not texting them. No, it would be fake of me to text you &amp; I really don't wanna talk to yo ass."
144,505192960875827201,Fri Aug 29 03:19:22 +0000 2014,15,15,I need a conversationalist. I'm tired of lackluster personalities.
145,505045988516429824,Thu Aug 28 17:35:21 +0000 2014,16,11,I like my space. I'm quiet. I'm not a people's person. I do not like humans. Sometimes I just want peace and quiet. And to draw. Leave me.
146,505006859762143232,Thu Aug 28 14:59:52 +0000 2014,7,3,"Don't mistake accessibility for access. It don't matter that you got the number, it only matters if they take your call."
147,503557059821178880,Sun Aug 24 14:58:53 +0000 2014,10,14,I can't fake it I jus can't if I'm feeling a certain way about a situation ima let it be known
148,502949531273555968,Fri Aug 22 22:44:47 +0000 2014,20,10,I have too much to accomplish to allow anyone to come in my life and jeopardize everything I have been working towards.
149,502248147297374209,Thu Aug 21 00:17:44 +0000 2014,13,11,"You can't force someone to open up to you, all you can do is exude comforting energy &amp; hope it's enough"
150,502176838501031937,Wed Aug 20 19:34:22 +0000 2014,12,10,She found her self now; she demanding respect more.
151,501492149733842944,Mon Aug 18 22:13:40 +0000 2014,12,13,I know who cares. I know who doesn't.
152,501089711700455425,Sun Aug 17 19:34:31 +0000 2014,190,87,"don't underestimate me I know more than I say, think more than I speak, and notice more than you realize."
153,500713234362400768,Sat Aug 16 18:38:32 +0000 2014,17,14,I don't like when ppl act as if they're better than others when you're working through life just like the rest of us
154,500276130403061760,Fri Aug 15 13:41:38 +0000 2014,173,115,"When you lie to someone you love and get caught, have enough respect to come completely clean. You owe them that, it's the least you can do."
155,497804699656278017,Fri Aug 08 18:01:03 +0000 2014,14,18,"Fall in love in person, not thru text."
156,497600698822197248,Fri Aug 08 04:30:26 +0000 2014,6,10,Note to self: Decide you want it more than you're afraid of it.
157,497487458242924547,Thu Aug 07 21:00:27 +0000 2014,3,3,"A 9-5 is more ""guaranteed"" money, but exploring other opportunities is so much more exciting."
158,497419490163175425,Thu Aug 07 16:30:22 +0000 2014,11,17,"I'm not perfect, but I REFUSE to act as if I'm not worth it because I AM."
159,497125056640995328,Wed Aug 06 21:00:24 +0000 2014,19,17,People will disguise themselves like they're trying to build with you but they're really just leeching off of you for their own satisfaction
160,497102384540430336,Wed Aug 06 19:30:18 +0000 2014,28,17,nothing annoys me more than when someone expects you to be okay with something that they wouldn't be okay with if you did it
161,496853284712624128,Wed Aug 06 03:00:28 +0000 2014,30,22,everyone doesn't have the same mindset &amp; heart as you.
162,496808031171403777,Wed Aug 06 00:00:39 +0000 2014,23,5,never forget the ones who wouldn't help you when you really needed a hand.
163,496785291378958336,Tue Aug 05 22:30:17 +0000 2014,13,7,all she wants is her booty rubbed on and some understanding.
164,496762668716662784,Tue Aug 05 21:00:24 +0000 2014,11,10,I love hanging out with people that make me forget to look at my phone
165,496740058628882432,Tue Aug 05 19:30:33 +0000 2014,22,14,"never chase. if they're feeling you, they'll walk with you."
166,496694707838529536,Tue Aug 05 16:30:21 +0000 2014,18,11,"I can care less about who you are and who you know. If you're not genuine, I can't fuck with you."
167,496490973644353536,Tue Aug 05 03:00:47 +0000 2014,21,13,mood: https://t.co/kML0zG2AoP
168,496422897867448320,Mon Aug 04 22:30:16 +0000 2014,16,7,who cares what they think about you.
