,id_str,created_at,retweet_count,favorite_count,text
169,496309844660731904,Mon Aug 04 15:01:02 +0000 2014,16,12,you can not easily drop a person out of your mind; especially when that person left a special mark on your heart.
170,496105882976288769,Mon Aug 04 01:30:34 +0000 2014,8,5,"""without dreams, we reach nothing; without love, we feel nothing; and without God, we are nothing."""
171,496083353662410752,Mon Aug 04 00:01:02 +0000 2014,7,6,"your time is limited, so don't waste it living someone else's life."
172,496060630311636993,Sun Aug 03 22:30:45 +0000 2014,13,5,know the power of your own influence.
173,495947433294450688,Sun Aug 03 15:00:57 +0000 2014,14,11,doubt kills more dreams than failure ever will.
174,495720992275456000,Sun Aug 03 00:01:09 +0000 2014,15,7,people just don't care at all these days.
175,494905539948969984,Thu Jul 31 18:00:50 +0000 2014,13,6,Its crazy how u can sit back &amp; stop putting forth effort toward friendships or relationships&amp; you'll watch them either grow or deteriorate.
176,494837454298701824,Thu Jul 31 13:30:17 +0000 2014,6,6,it's almost amazing how you can limitlessly fall for someone neglecting the reason you were always scared of love..
177,494565751324282880,Wed Jul 30 19:30:38 +0000 2014,12,11,girls out here giving themselves to anyone without them having to put in any work.
178,494497880108175360,Wed Jul 30 15:00:56 +0000 2014,43,21,Saw you at your worst and still thought you were the best.
179,494475089572683777,Wed Jul 30 13:30:22 +0000 2014,20,19,"I have a habit of hanging onto relationships wit ppl I have a lot of history wit, but history is just that. The past. People change. Move on"
180,493372707229024256,Sun Jul 27 12:29:54 +0000 2014,189,69,I love when I'm in a good mood for no reason. Especially when there's a million and one things I could be worrying about right now
181,492481938490662912,Fri Jul 25 01:30:18 +0000 2014,3,10,"Put me on to good books, and great music."
182,492164902715678721,Thu Jul 24 04:30:31 +0000 2014,191,106,remember the people that saw your potential from day one.
183,492051633929723905,Wed Jul 23 21:00:26 +0000 2014,70,38,"I automatically tune people out that complain about their circumstances to me, and don't do anything to fix them."
184,492026234532921344,Wed Jul 23 19:19:30 +0000 2014,0,2,"Don't forget to download @POLY3ST3R The Saint's new album #ForthePlayerinYou on iTunes http://t.co/DYFRsTYcTm"""
185,491983647231062016,Wed Jul 23 16:30:16 +0000 2014,42,25,"workin on myself, for myself, by myself"
186,491734650520600576,Wed Jul 23 00:00:51 +0000 2014,32,17,don't worry about who wants me  if I only wants you.
187,491711879245742080,Tue Jul 22 22:30:22 +0000 2014,48,22,"if anybody can have it
i don't want it."
188,491621367335624705,Tue Jul 22 16:30:42 +0000 2014,191,58,"y'all got relationship goals 
but no life goals 🐸☕"
189,491598762851446784,Tue Jul 22 15:00:53 +0000 2014,8,5,"someone I can build with
someone I can grow with

🔍👀"
190,491440221738004481,Tue Jul 22 04:30:54 +0000 2014,14,8,"I learned that, you should never trust into a person who cannot trust into themselves. You can't save someone who doesn't want saving."
191,491232213447753728,Mon Jul 21 14:44:21 +0000 2014,31,22,bitches like to play victim to circumstances they created
192,490686920154812416,Sun Jul 20 02:37:32 +0000 2014,53,20,Rather be tired than broke.
193,490568907342626816,Sat Jul 19 18:48:36 +0000 2014,17,8,"I do everything for my own sake. To never want for nothing, to persistently improve myself and to never have to depend on anyone."
194,490316376448319489,Sat Jul 19 02:05:08 +0000 2014,4,2,Cause I like my damn self
195,490316137150689281,Sat Jul 19 02:04:11 +0000 2014,7,2,Don't like how I act? That's fine.
196,490315599222800384,Sat Jul 19 02:02:03 +0000 2014,10,3,Don't like what I say? That's fine.
197,490314897721667585,Sat Jul 19 01:59:15 +0000 2014,17,10,Don't like me? That's fine.
198,489618413547827202,Thu Jul 17 03:51:41 +0000 2014,9,11,I'm not looking nor do I want anyone's relationship. If I meet someone worth settling down for then I'll change my mind.
