,id_str,created_at,retweet_count,favorite_count,text
185,664949435756081156,Thu Nov 12 23:34:34 +0000 2015,0,0,"PGS, TGS wrap up joint acquisition season offshore Canada https://t.co/QxKFtVvYUB"
186,664949434518798337,Thu Nov 12 23:34:34 +0000 2015,0,0,"“Safety must not be compromised for cost efficiency,” urges ADIPEC chairman https://t.co/NSvLrUuIPF"
187,664949433117855744,Thu Nov 12 23:34:33 +0000 2015,0,0,IMI precision engineering introduces first smart solenoid valve https://t.co/WtoMdQHo4O
188,664949431385645056,Thu Nov 12 23:34:33 +0000 2015,1,0,TransCanada: contract to build and operate Mexico gas pipeline https://t.co/R1z9jy8GhZ
189,664585375877328897,Wed Nov 11 23:27:55 +0000 2015,0,0,Hoegh LNG Partners to restate earnings – TradeWinds (subscription) https://t.co/mPOD9kCMsP
190,664585374178635776,Wed Nov 11 23:27:55 +0000 2015,0,0,True Climate Leadership Means Stepping Away From LNG – Huffington Post Canada https://t.co/r7aNzMLQBz
191,664585372844859392,Wed Nov 11 23:27:54 +0000 2015,0,0,SBM Offshore Hit By Slowing Industry Spending https://t.co/lmJp9hkBUS
192,664585371553013761,Wed Nov 11 23:27:54 +0000 2015,0,0,"Shell shifts crude terminal, pipeline system to midstream outfit for $390 million https://t.co/6dsTURFlQ0"
193,664585370319904768,Wed Nov 11 23:27:54 +0000 2015,0,0,VAALCO Energy Responds To Misleading Comments Made By Group 42 And Bradley Radoff https://t.co/EAxdVi6BgU
194,664585369019654145,Wed Nov 11 23:27:54 +0000 2015,0,0,Baytex to Present at FirstEnergy Conference https://t.co/rhI72W7cNJ
195,664585367732035584,Wed Nov 11 23:27:53 +0000 2015,0,0,"US LNG Exports to Boost Trading Flexibility, Says IEA – Natural Gas Intelligence https://t.co/T0ZgjNafAL"
196,664585366398246912,Wed Nov 11 23:27:53 +0000 2015,0,0,Noble Corp. (NE) Stock Falls on Slipping Oil Prices https://t.co/iz35MbHv6b
197,664585365160902656,Wed Nov 11 23:27:53 +0000 2015,0,0,MURPHY OIL CORPORATION TO PRESENT AT UPCOMING ENERGY CONFERENCE https://t.co/s49X3Do3mH
198,664585363822878720,Wed Nov 11 23:27:52 +0000 2015,0,0,"Peru To Cut Oil, Gas Royalties To 5% To Counter Price Slump https://t.co/S7c5lKkEvT"
199,664222254474108928,Tue Nov 10 23:25:00 +0000 2015,0,1,IPAA elects chairman and vice chairman https://t.co/Qauhq2jeB9
