,id_str,created_at,retweet_count,favorite_count,text
0,669073899007668224,Tue Nov 24 08:43:42 +0000 2015,0,0,Woodside gives Browse FLNG deal to Benthic https://t.co/bC2GZN6fzd
1,669073898038812672,Tue Nov 24 08:43:42 +0000 2015,0,0,Lundin spuds Barents Sea wildcat https://t.co/pbaugCzzLG
2,669073897174769668,Tue Nov 24 08:43:42 +0000 2015,0,0,Update: Greenpeace activists arrested after boarding oil exploration vessel https://t.co/dFTFgV2OyR
3,669073896310747136,Tue Nov 24 08:43:42 +0000 2015,0,0,Benthic nets two deals with Woodside https://t.co/aw7OU6vxUs
4,669073895224442881,Tue Nov 24 08:43:42 +0000 2015,0,0,Worthington buys Taylor Wharton cryogenics unit https://t.co/b7BD3kqnfV
5,669073894238789632,Tue Nov 24 08:43:41 +0000 2015,0,0,British Columbia funds more Aboriginal LNG training programs https://t.co/EHXNBGOK8K
6,668953115530534912,Tue Nov 24 00:43:45 +0000 2015,0,0,Analyst: Offshore investment to double by the end of 2017 https://t.co/PAUVwQLWa1
7,668953114075144192,Tue Nov 24 00:43:45 +0000 2015,0,0,BG farming into Aphrodite block off Cyprus https://t.co/EkR8bWWdX3
8,668953112573538304,Tue Nov 24 00:43:45 +0000 2015,0,0,BLM extends comment periods for proposed changes in onshore orders https://t.co/BmO2Fm3ODe
9,668953110845497348,Tue Nov 24 00:43:44 +0000 2015,0,0,BP receives setback for Bight drilling campaign https://t.co/gvQfO73TzL
10,668953109503352833,Tue Nov 24 00:43:44 +0000 2015,0,0,Firm given permission to build NEGI gas pipeline in Australia https://t.co/0Yv7MmBJB5
11,668953108081455105,Tue Nov 24 00:43:44 +0000 2015,0,0,"Sembcorp Marine to build North Sea Culzean ultra-high pressure/high-temperature field development floating, storag… https://t.co/pZEwfTSBmG"
12,668953106818932736,Tue Nov 24 00:43:43 +0000 2015,0,0,Statoil reports minor find in North Sea Visund area https://t.co/P3eMS4vO4R
13,668953105514516481,Tue Nov 24 00:43:43 +0000 2015,0,0,Thailand approves offshore Rossukon production bid https://t.co/wgIhuL8ZYn
14,668953104147193856,Tue Nov 24 00:43:43 +0000 2015,0,0,Norwegian Petroleum Directorate calls for second thoughts on offshore oil and gas well plugging https://t.co/YJP4Fd2NKy
15,668953102582743041,Tue Nov 24 00:43:42 +0000 2015,1,0,Spectra applies to begin Nexus gas pipeline’s FERC review https://t.co/RAHMj7k36A
16,668831420534624257,Mon Nov 23 16:40:11 +0000 2015,0,0,World leaders seek new path to slow warming of planet https://t.co/l0zoWvhFu0
17,668831419397967873,Mon Nov 23 16:40:11 +0000 2015,0,0,Business Roundtable calls for strategic approach to US energy policy https://t.co/gmE9lkJHRT
18,668831418034860033,Mon Nov 23 16:40:11 +0000 2015,0,0,TAEP: TPI sinks again as employment in Texas contracts https://t.co/s8ywfsAJOC
19,668831416277422080,Mon Nov 23 16:40:10 +0000 2015,0,0,BLM releases draft SEIS for Roan Plateau plan amendment https://t.co/E0dBLZhUmZ
20,668831414641651712,Mon Nov 23 16:40:10 +0000 2015,0,0,"BLM’s Utah state office abruptly postpones oil, gas lease sale https://t.co/sR2H9c6wzl"
21,668831412120903680,Mon Nov 23 16:40:09 +0000 2015,0,0,Ebinger: Obama administration’s antifossil-fuel bias poses threat https://t.co/EEN0clQGfq
22,668831410543792129,Mon Nov 23 16:40:09 +0000 2015,0,0,"Mexico hopes transportation upgrades will accommodate expanded oil, gas supply https://t.co/XCDHZEPybP"
23,668831408731889664,Mon Nov 23 16:40:08 +0000 2015,0,0,Report: ICG evacuates Mubaraz LNG carrier crew member https://t.co/QKDdoNCvtn
24,668831407129645056,Mon Nov 23 16:40:08 +0000 2015,0,0,ELA Container Offshore Builds First Mobile MEDICbox for WINDEAcare https://t.co/1jYsxuPdWR
25,668831405846241280,Mon Nov 23 16:40:08 +0000 2015,0,0,BG grabs stake in Aphrodite gas discovery https://t.co/9nmScDGIWn
26,668709258570178560,Mon Nov 23 08:34:45 +0000 2015,0,0,Klaipedos Nafta creates LNG bunkering unit https://t.co/y01d8aKBLj
27,668709257043382272,Mon Nov 23 08:34:45 +0000 2015,0,0,Quadrant in well spud delay (Australia) https://t.co/EEna575CI4
28,668709255743201280,Mon Nov 23 08:34:45 +0000 2015,0,0,Premier gives Isobel another go https://t.co/qDrc3Scnvc
29,668709254354849792,Mon Nov 23 08:34:44 +0000 2015,0,0,Monadelphous wins Prelude FLNG deal https://t.co/0M0Snx5VwK
30,668709253193052160,Mon Nov 23 08:34:44 +0000 2015,0,0,Monadelphous in Shell’s Prelude FLNG scoop https://t.co/IDHR056n7F
31,668709251704094720,Mon Nov 23 08:34:44 +0000 2015,0,0,KrisEnergy gets go-ahead for Rossukon production area https://t.co/eo9aRsJSmQ
32,667864211922558976,Sat Nov 21 00:36:51 +0000 2015,1,0,Polarcus awarded broadband 3D seismic project offshore Egypt https://t.co/CAAWG7ZG93
33,667864210571948032,Sat Nov 21 00:36:50 +0000 2015,0,0,"BLM seeks comments on Nevada land for possible oil, gas leasing https://t.co/EqnkliE5Ys"
34,667864209343053824,Sat Nov 21 00:36:50 +0000 2015,0,0,BLM draft EIS examines existing leases in White River National Forest https://t.co/OwKeM2N5Wy
35,667864208088965120,Sat Nov 21 00:36:50 +0000 2015,0,0,Second exploration well fails to produce oil and gas for Ophir offshore Thailand https://t.co/DHa68pckTd
36,667745712860438528,Fri Nov 20 16:45:58 +0000 2015,0,0,Maersk Training opens simulation facility https://t.co/NsMiONYQQZ
37,667745711312805889,Fri Nov 20 16:45:58 +0000 2015,0,0,HollyFrontier settles federal air pollution charges from refineries https://t.co/duoLGJCbld
38,667745710092218368,Fri Nov 20 16:45:58 +0000 2015,0,0,Force: Sharing information benefits all parties https://t.co/ThOdWHwyZU
39,667745708674572289,Fri Nov 20 16:45:57 +0000 2015,1,1,"Three firms, three people charged in 2012 gulf platform explosion https://t.co/Pd3crRdwKK"
40,667745707168673792,Fri Nov 20 16:45:57 +0000 2015,1,1,UK: Shell charged for North Sea oil leak https://t.co/qTXKI2MFXG
41,667745705553993728,Fri Nov 20 16:45:56 +0000 2015,1,0,Update: Qatar ships Polish maiden LNG cargo https://t.co/R2xsUIQDAc
42,667745703943368705,Fri Nov 20 16:45:56 +0000 2015,0,0,Tekay: global LNG trade up in first nine months https://t.co/sA8QCJBJvd
43,667745702274015232,Fri Nov 20 16:45:56 +0000 2015,0,0,HitecVision buys Prosafe stake https://t.co/CuAM4kVqLh
44,667745700940247045,Fri Nov 20 16:45:55 +0000 2015,0,0,China trims gas prices to boost demand https://t.co/u7c5doUwhv
45,667745699598090240,Fri Nov 20 16:45:55 +0000 2015,0,1,Companies face manslaughter charges over fatal rig explosion https://t.co/CeDQxfoe1n
46,667624088052113409,Fri Nov 20 08:42:41 +0000 2015,0,0,LNG Limited makes new appointments https://t.co/DeASOhc7KF
47,667624087167062017,Fri Nov 20 08:42:40 +0000 2015,0,0,More LNG for UK’s South Hook terminal https://t.co/z7ZluS9l5B
48,667624085636149248,Fri Nov 20 08:42:40 +0000 2015,0,0,Statoil wraps up Tarvos well in North Sea. Songa Trym rig stacked https://t.co/9gHQBiZNJ7
49,667624084642099200,Fri Nov 20 08:42:40 +0000 2015,0,0,HIOS requesting permit to serve Delfin LNG project https://t.co/Qw0sRt7pdJ
50,667624083677384706,Fri Nov 20 08:42:40 +0000 2015,0,0,Subsea Well Intervention Capabilities Presented at OEEC 2015 https://t.co/QSgcQah4W6
51,667624082712735744,Fri Nov 20 08:42:39 +0000 2015,0,0,Ophir finds some oil offshore Thailand https://t.co/zLNoBbGZSL
52,667624081794166784,Fri Nov 20 08:42:39 +0000 2015,0,0,ATP Oil &amp; Gas to pay $41.9M for unlawful oil discharge into Gulf of Mexico https://t.co/z6GNVRN6fO
53,667624080812699648,Fri Nov 20 08:42:39 +0000 2015,0,0,Eni selling remaining Galp shares https://t.co/HSDqAvytiJ
54,667624079894175744,Fri Nov 20 08:42:39 +0000 2015,0,0,MAN Complements Marine Fuel Business by Acquiring Cryo AB https://t.co/bxknBbHgUp
55,667501597828784129,Fri Nov 20 00:35:57 +0000 2015,0,0,Endesa Signs to Supply CityLogistics Fleet in Lyon https://t.co/ICFSl2eiPc
56,667501596608188418,Fri Nov 20 00:35:56 +0000 2015,3,1,China slashes natural gas prices https://t.co/JZribXhl0t
57,667501591096860672,Fri Nov 20 00:35:55 +0000 2015,0,0,Bergen Group’s 3Q loss deepens https://t.co/inDP0PWIgH
58,667501589570191360,Fri Nov 20 00:35:55 +0000 2015,0,0,ATP Oil &amp; Gas to pay $41.85 million to settle federal charges https://t.co/jEHWdjN2YZ
59,667501588244770817,Fri Nov 20 00:35:54 +0000 2015,0,0,Norway: Downturn in O&amp;G investments to reverse in 2017? https://t.co/Y46zatK58e
60,667501586718027779,Fri Nov 20 00:35:54 +0000 2015,0,0,"Swan Energy, Exmar partner for India’s first floating, storage, and regasification-based  liquefied natural gas te… https://t.co/aVMG0KPLKa"
61,667501585405247488,Fri Nov 20 00:35:54 +0000 2015,0,0,Murkowski welcomes approval of US-Mexico oil exchange license https://t.co/AMCh8ECqev
62,667501583618449416,Fri Nov 20 00:35:53 +0000 2015,1,0,"Saddlehorn, Grand Mesa combine DJ-basin crude pipelines https://t.co/RBNoqrGN3s"
63,667381181130895361,Thu Nov 19 16:37:27 +0000 2015,0,0,Suretank signs offshore equipment deal with Halliburton https://t.co/RXL2cfUsJq
64,667381178996015104,Thu Nov 19 16:37:27 +0000 2015,0,0,Amec Foster Wheeler ‘uniquely placed’ to lead North Sea oil and gas industry decommissioning https://t.co/HWUSY8MIp3
65,667381177309884416,Thu Nov 19 16:37:26 +0000 2015,0,0,Ramform Titan &amp; Sovereign set to shoot seismic offshore Myanmar https://t.co/JuzsX5okOx
66,667381175401521153,Thu Nov 19 16:37:26 +0000 2015,0,0,MARKET WATCH: NYMEX oil prices settle flat ahead of contract expiration https://t.co/QLkJOowu5d
67,667381173606330372,Thu Nov 19 16:37:25 +0000 2015,0,0,Case Study: Shell Nigeria Helicopter Hanger https://t.co/3R33z1k9p8
68,667381172016693248,Thu Nov 19 16:37:25 +0000 2015,0,0,DNV GL Guidance on Inspection Planning of Offshore Structures Will Save Operational Costs https://t.co/vCQL7UcFNs
69,667381170041200641,Thu Nov 19 16:37:24 +0000 2015,0,0,‘Siem Daya 1’ suffers yet another deferral https://t.co/oGVWo2VCFM
70,667381168233431040,Thu Nov 19 16:37:24 +0000 2015,0,0,Petrobras sees higher output in October https://t.co/3gHkeWMwmo
71,667381166576640001,Thu Nov 19 16:37:24 +0000 2015,0,0,Half of Cheniere’s US LNG exports heading for Europe https://t.co/6PipDOt9NF
72,667381164643102720,Thu Nov 19 16:37:23 +0000 2015,0,0,Panoro Energy tightens its loss https://t.co/QsuxDK7g4q
73,667263015130152961,Thu Nov 19 08:47:54 +0000 2015,0,0,SCT&amp;E LNG picks Air Products tech for its export project https://t.co/FTAeJgKNtj
74,667263014048002048,Thu Nov 19 08:47:54 +0000 2015,0,0,"Awilco Drilling: 3Q numbers rise, but… https://t.co/rkzT0RC3Bb"
75,667263012991053825,Thu Nov 19 08:47:54 +0000 2015,0,0,Australia’s watchdog clears Shell-BG merger https://t.co/CsI9MFGxEk
76,667263011808243712,Thu Nov 19 08:47:53 +0000 2015,0,0,UK to get more Qatari LNG https://t.co/VPfSlRCyFL
77,667263010835140608,Thu Nov 19 08:47:53 +0000 2015,1,0,Australia clears Shell-BG merger https://t.co/GIdg4q8oZ4
78,667263009383845888,Thu Nov 19 08:47:53 +0000 2015,0,0,Polarcus scoops 3D marine seismic project offshore Egypt https://t.co/fcvZEePN2E
79,667263002056466432,Thu Nov 19 08:47:51 +0000 2015,0,0,Deutz Develops Natural Gas Engine for Agricultural Tractors https://t.co/0XJUO5lCvI
80,667141723747975169,Thu Nov 19 00:45:56 +0000 2015,1,0,Shell finds oil and gas success in deepwater Gulf of Mexico with Kaikias oil and gas discovery appraisal well https://t.co/sGJ34eI30s
81,667141722577727488,Thu Nov 19 00:45:56 +0000 2015,0,0,Shell finds oil and gas success in deepwater Gulf of Mexico with Kaikias oil and gas discovery appraisal well https://t.co/9Vw6pXvAuM
82,667141721617276928,Thu Nov 19 00:45:55 +0000 2015,0,0,"API, ANGA agree to combine https://t.co/XkhXlB2ybW"
83,667141720421871616,Thu Nov 19 00:45:55 +0000 2015,0,0,AFPM endorses Flores bill addressing ozone requirement problems https://t.co/JB4820klRe
84,667141719230664709,Thu Nov 19 00:45:55 +0000 2015,0,0,Petrofac extends use of Intergraph Smart solutions https://t.co/UtB8b7jA3w
85,667141717636829185,Thu Nov 19 00:45:55 +0000 2015,0,0,Total contracts Fugro for underwater services https://t.co/TQKSWNARSn
86,667141716248567808,Thu Nov 19 00:45:54 +0000 2015,0,0,Total contracts Fugro for underwater services https://t.co/o0UNuu2bSP
87,667141714512072704,Thu Nov 19 00:45:54 +0000 2015,0,0,TransCanada withdraws Keystone XL route application in Nebraska https://t.co/VkSgRm1a6p
88,667141712750501888,Thu Nov 19 00:45:53 +0000 2015,0,0,Suncor’s oil sands output to slow in 2016 https://t.co/71Y6rzUa5y
89,667141709680259072,Thu Nov 19 00:45:53 +0000 2015,0,0,Bureau of Ocean Energy Management extends public scoping comment period for Liberty project offshore Alaska in the… https://t.co/jnxpDwkyiV
90,667020353923883010,Wed Nov 18 16:43:39 +0000 2015,0,0,Strike still affecting Petrobras’ oil output https://t.co/ZWK78nkEoL
91,667020352917266433,Wed Nov 18 16:43:39 +0000 2015,0,0,Tecnicomar-Reverse Osmosis Watermakers and Water Purification Systems https://t.co/6WH5LgcJN2
92,667020351105335296,Wed Nov 18 16:43:38 +0000 2015,0,0,Soco hikes 2015 output guidance. Lowers forecast for 2016 https://t.co/eGlqi07qK2
93,667020349654048768,Wed Nov 18 16:43:38 +0000 2015,0,0,PM: Poland could consider second LNG terminal https://t.co/qqNGsb8Mvj
94,667020348286701569,Wed Nov 18 16:43:38 +0000 2015,0,0,UK gov’t sets out strategy to boost offshore oil &amp; gas recovery https://t.co/Ggcg8eZa53
95,667020346655170561,Wed Nov 18 16:43:37 +0000 2015,0,0,Platts: December spot LNG prices up https://t.co/fkDx309eCg
96,667020345220689921,Wed Nov 18 16:43:37 +0000 2015,0,0,Sembcorp Marine building FSO for Maersk Oil’s Culzean field https://t.co/Sh4Cwir8TI
97,667020343723302913,Wed Nov 18 16:43:37 +0000 2015,0,0,"Klaipedos Nafta, Port of Helsingborg in LNG infrastructure deal https://t.co/gPnHtBwF7U"
98,667020342725058560,Wed Nov 18 16:43:37 +0000 2015,0,0,Spectro Scientific-Portable Oil in Water Analyzers for On-Site Measurements https://t.co/XtY3dc6KcJ
99,667020341496147970,Wed Nov 18 16:43:36 +0000 2015,0,0,Sen. Murkowski laments Statoil’s Alaska exit. Blames ‘project killing’ administration https://t.co/l06aHHxPnN
100,666898570268811264,Wed Nov 18 08:39:44 +0000 2015,0,0,Japan’s Tepco imports less LNG in October https://t.co/bS4J1oKSVj
101,666898568754655232,Wed Nov 18 08:39:43 +0000 2015,0,0,Crowley begins pier construction for LNG-powered ships https://t.co/TG2VxfdURV
102,666898567311831040,Wed Nov 18 08:39:43 +0000 2015,0,0,Cheniere progresses Corpus Christi liquefaction project (Gallery) https://t.co/cNhasJtLMm
103,666898565965459461,Wed Nov 18 08:39:43 +0000 2015,0,0,Petrobras confirms Pitu oil discovery https://t.co/iIAyC775H6
104,666898564640034816,Wed Nov 18 08:39:42 +0000 2015,1,0,Marco Polo breaks off rig construction deal with Sembcorp Marine https://t.co/ICCR5FY58K
105,666898563327217664,Wed Nov 18 08:39:42 +0000 2015,0,0,Swedish oil company puts assets up for sale https://t.co/yUxE04v1Ts
106,666898562014453760,Wed Nov 18 08:39:42 +0000 2015,0,0,"Exmar, Swan sign India FSRU deal https://t.co/i1WxKNAPoO"
107,666898560793886720,Wed Nov 18 08:39:41 +0000 2015,0,0,U.S. gives green light for Schlumberger-Cameron merger https://t.co/13jVOnz0KQ
108,666777357865377792,Wed Nov 18 00:38:04 +0000 2015,0,0,US Department of Justice approves Schlumberger-Cameron merger https://t.co/mB6ZZdRtH9
109,666777356267311104,Wed Nov 18 00:38:04 +0000 2015,0,0,BLM releases draft supplemental EIS for Roan Plateau plan amendment https://t.co/jJVHfdRcMJ
110,666777354757406720,Wed Nov 18 00:38:04 +0000 2015,0,0,DNV GL teams with oil and gas operators to cut carbon emissions https://t.co/Q3slHmFoIz
111,666777352555352064,Wed Nov 18 00:38:03 +0000 2015,0,0,Apache Corp. provides North Sea oil and gas drilling and production operations update https://t.co/Rfe1HOgV1G
112,666777351171268609,Wed Nov 18 00:38:03 +0000 2015,0,0,"Statoil follows Shell, will vacate Alaska Chukchi Sea leases https://t.co/8gmfO9V1I4"
113,666777349506129924,Wed Nov 18 00:38:02 +0000 2015,0,0,Bordelon Marine takes delivery of ultra-light intervention vessel https://t.co/m6X9ccHcbX
114,666777347811614728,Wed Nov 18 00:38:02 +0000 2015,0,0,TGS restructures to adapt to current market conditions https://t.co/FGvTh52nUS
115,666777346234523648,Wed Nov 18 00:38:02 +0000 2015,0,0,NEL forms joint industry project to address heavy oil challenges https://t.co/qkuNXwFoYK
116,666777344418426881,Wed Nov 18 00:38:01 +0000 2015,0,0,Australian regulator rejects BP’s Bight environmental plan for offshore oil and gas exploration drilling https://t.co/6eFKi9kGQP
117,666777342333820928,Wed Nov 18 00:38:01 +0000 2015,0,0,Statoil exits Alaska upon dismal oil and gas exploration results https://t.co/LTxocJqaei
118,666656101664993280,Tue Nov 17 16:36:15 +0000 2015,0,0,Offshore photo of the day https://t.co/wZPymbIsij
119,666656100343746560,Tue Nov 17 16:36:14 +0000 2015,0,0,Schlumberger adds geochemical logging capability with acquisition https://t.co/sBDJhzzr0W
120,666656098745716737,Tue Nov 17 16:36:14 +0000 2015,0,0,Unique Group acquires marine survey equipment firm https://t.co/lNjbUiyKHK
121,666656097218990080,Tue Nov 17 16:36:14 +0000 2015,0,0,Halliburton signs supply deal with Suretank https://t.co/woyPAMhZS8
122,666656095411298304,Tue Nov 17 16:36:13 +0000 2015,0,0,ClassNK gives AIP for LNG-fueled vessel https://t.co/oyELvTgexF
123,666656093716750336,Tue Nov 17 16:36:13 +0000 2015,0,0,Reach Subsea gearing up for vessel layups https://t.co/TVHecK5K7f
124,666656091728683008,Tue Nov 17 16:36:12 +0000 2015,0,0,DNV GL Helps the Petroleum Industry to Cut Emissions https://t.co/0kdI996Jbz
125,666656090315218945,Tue Nov 17 16:36:12 +0000 2015,0,0,Another oil major abandons Alaska Arctic drilling plans https://t.co/PZODTSxR0K
126,666656088247414784,Tue Nov 17 16:36:11 +0000 2015,0,0,Indonesia: Bojonegoro LNG terminal to receive JBIC funds by June https://t.co/zfbISziTm5
127,666656086171254788,Tue Nov 17 16:36:11 +0000 2015,0,0,Sovcomflot’s profit spikes https://t.co/Seuv7ro8nd
128,666537733502930944,Tue Nov 17 08:45:53 +0000 2015,0,0,First Nation eyes LNG project https://t.co/J8vtx6pl34
129,666537732164988929,Tue Nov 17 08:45:53 +0000 2015,0,0,Flint Hills requests LNG export permit https://t.co/0Qgi94beor
130,666537730231377920,Tue Nov 17 08:45:53 +0000 2015,0,0,Awilco LNG’s freight income down YoY https://t.co/6mPthXWecZ
131,666537721909936129,Tue Nov 17 08:45:51 +0000 2015,0,0,SBM Offshore invited to bid for Petrobras’ FPSO projects https://t.co/yOO4kkq0kw
132,666537720685191169,Tue Nov 17 08:45:50 +0000 2015,0,0,TGS shedding workforce citing challenging market conditions https://t.co/oD3U17yX8S
133,666537719452065792,Tue Nov 17 08:45:50 +0000 2015,0,0,Statoil completes Alfa Sentral share buy https://t.co/OFnydML1jB
134,666529115714035712,Tue Nov 17 08:11:39 +0000 2015,0,0,NPD gives go-ahead for Edvard Grieg production start-up https://t.co/BxGxWjclQ2
135,666529114627641344,Tue Nov 17 08:11:39 +0000 2015,0,0,US drilling rig count down; offshore drilling rig count remains flat https://t.co/O8XUWPMXv6
136,666529113373585408,Tue Nov 17 08:11:38 +0000 2015,0,0,"More imports may help China address pollution problems, official says https://t.co/4hdwsY4Bmm"
137,666529112262090752,Tue Nov 17 08:11:38 +0000 2015,0,0,Ban looms on crude tankers off northern BC https://t.co/8DaozyHYCr
138,666529110861225984,Tue Nov 17 08:11:38 +0000 2015,0,0,"SBM Offshore to participate in Petrobras floating production, storage, and offloading vessel tender https://t.co/FvsJp7AH4Z"
139,666529109703532544,Tue Nov 17 08:11:37 +0000 2015,0,0,Norwegian Petroleum Directorate authorizes oil and gas production start-up at Edvard Grieg field offshore Norway https://t.co/BK5Le5qzud
140,666529108441104385,Tue Nov 17 08:11:37 +0000 2015,0,0,Magnolia LNG Lake Charles project advances https://t.co/c8p0TENJtV
141,666529107337965568,Tue Nov 17 08:11:37 +0000 2015,0,0,Polarcus completes Capreolus seismic survey offshore Australia https://t.co/Zt9Ut8Dxiq
142,666529106188701696,Tue Nov 17 08:11:37 +0000 2015,0,0,HKN to increase Sarsang production in Kurdistan https://t.co/4xBHhLPHFU
143,666529105031135232,Tue Nov 17 08:11:36 +0000 2015,0,0,Conductor Installation Services completes subsea work on Alvheim oil field development offshore Norway https://t.co/c5EbLIpBQt
144,666408606036828160,Tue Nov 17 00:12:47 +0000 2015,1,1,Turritella FPSO heads for the Gulf of Mexico https://t.co/30GSdPS1rG
145,666408604946288642,Tue Nov 17 00:12:47 +0000 2015,1,0,Premier Oil sells Norwegian subsidiary to Det norske https://t.co/DH9JdmyYfO
146,666408603893563392,Tue Nov 17 00:12:47 +0000 2015,1,0,MARKET WATCH: Crude oil prices whipsaw following attack in Paris https://t.co/9JWMIADL9P
147,666408602597531649,Tue Nov 17 00:12:46 +0000 2015,1,0,Hibiscus abandons Sea Lion dry hole (Australia) https://t.co/WUZcdrJ9fL
148,666408601607610368,Tue Nov 17 00:12:46 +0000 2015,0,0,"If he could, would Obama reject Quest CCS project, too? https://t.co/x2Oh8bRmQt"
149,666408600496132096,Tue Nov 17 00:12:46 +0000 2015,0,0,SB – Rail-Guided Powered Trolley https://t.co/70LOSq0dxp
150,666408599376297985,Tue Nov 17 00:12:46 +0000 2015,0,0,"BP, Chinese companies reach separate LNG, shale gas pacts https://t.co/zyRNs1i4EM"
151,666408597912477696,Tue Nov 17 00:12:45 +0000 2015,0,0,"Next-generation biofuels better at cutting carbon emissions, report says https://t.co/d2OigXDTFH"
152,666408597006458880,Tue Nov 17 00:12:45 +0000 2015,0,0,Watching Government: What broke the logjam https://t.co/KV6qKdCU2r
153,666408595915935744,Tue Nov 17 00:12:45 +0000 2015,0,0,US House subcommittees hear wide range of recommendations for RFS https://t.co/Oq3YsiVFFN
154,665676476952551424,Sat Nov 14 23:43:34 +0000 2015,0,2,"Weatherford, Maersk team up to improve well control training https://t.co/E9kAIPp8tn"
155,665676476054962180,Sat Nov 14 23:43:34 +0000 2015,1,1,New Fortress to build LNG terminal in Jamaica https://t.co/hundEqrb4x
156,665676475148984323,Sat Nov 14 23:43:34 +0000 2015,0,1,North Sea veteran set for new lease of life in the land of samba https://t.co/wdy3fd2vYb
157,665676474041634816,Sat Nov 14 23:43:33 +0000 2015,0,1,Blue Bird Debuts New CNG Powertrain for School Bus https://t.co/jO2wWs2sRi
158,665676473097916416,Sat Nov 14 23:43:33 +0000 2015,0,1,Carl Icahn acquires more Cheniere shares https://t.co/ccb7sNTjXV
159,665676472166825984,Sat Nov 14 23:43:33 +0000 2015,0,1,"Norway: October oil output down vs. 2014, but above prognosis https://t.co/4z6pqL05pS"
160,665676471147601920,Sat Nov 14 23:43:33 +0000 2015,0,1,IEA sees bear oil market as stocks balloon https://t.co/ZwHLeZXWKT
161,665676470073884672,Sat Nov 14 23:43:32 +0000 2015,0,1,Report: funding for Yamal LNG by year end https://t.co/XjzXTp0A59
162,665676468580696064,Sat Nov 14 23:43:32 +0000 2015,1,1,Gasrec supplies UK NGV Sector from Grain LNG Terminal https://t.co/wbl2Gg758C
163,665676467519533056,Sat Nov 14 23:43:32 +0000 2015,0,1,Guide for Fleet Operators to Save Money with Natural Gas https://t.co/31v5rdCmfa
164,665313416752398336,Fri Nov 13 23:40:54 +0000 2015,1,0,Japan power utilities’ LNG consumption down in Oct https://t.co/VtnDUsnN1M
165,665313414873350145,Fri Nov 13 23:40:53 +0000 2015,1,0,Petrobras declares commerciality of Sepia Leste (Brazil) https://t.co/6cUllS3id5
166,665313412591648771,Fri Nov 13 23:40:53 +0000 2015,0,0,Ichthys LNG christmas trees delivered to Ensco 5006 https://t.co/985c77LS6y
167,665313404433866752,Fri Nov 13 23:40:51 +0000 2015,0,0,Quadrant Energy set to spud Roc-1 (Australia) https://t.co/dVJ6iHChad
168,665313402693120000,Fri Nov 13 23:40:50 +0000 2015,1,0,Statoil acquires new acreage offshore Canada https://t.co/DjOYD8XHFn
169,665313400738611201,Fri Nov 13 23:40:50 +0000 2015,0,0,Gov. Cuomo rejects Port Ambrose LNG project https://t.co/K5TdYzMdcZ
170,665313398163288065,Fri Nov 13 23:40:49 +0000 2015,0,0,Polarcus completes ‘largest ever’ 3D survey offshore Australia https://t.co/y4hYuj84eZ
171,665197860124774401,Fri Nov 13 16:01:43 +0000 2015,0,0,Kosmos reports second ultra-deepwater gas discovery offshore Mauritania https://t.co/8guel749IU
172,665197858400960513,Fri Nov 13 16:01:42 +0000 2015,1,0,Kosmos reports second ultra-deepwater gas discovery offshore Mauritania https://t.co/ht9h6BBEgR
173,665197856660324352,Fri Nov 13 16:01:42 +0000 2015,0,0,"Subsea 7 to work with Premier Oil on offshore oil and gas field studies, subsea installations https://t.co/cOnbbMn1R6"
174,665197855011954688,Fri Nov 13 16:01:42 +0000 2015,0,0,"Subsea 7 to work with Premier Oil on offshore oil and gas field studies, subsea installations https://t.co/JMi1xGqSV8"
175,665197852029775872,Fri Nov 13 16:01:41 +0000 2015,0,0,"SBM Offshore on schedule with latest offshore Brazil floating production, storage, and offloading vessels https://t.co/RaQibFOyal"
176,665197850083647492,Fri Nov 13 16:01:40 +0000 2015,0,0,"PGS, TGS complete offshore eastern Canada seismic acquisition season https://t.co/HdCyGLusov"
177,665197848045207553,Fri Nov 13 16:01:40 +0000 2015,0,1,Petroleum Safety Authority Norway sanctions production operations through Edvard Grieg field development gas pipel… https://t.co/P6PfgIMuaq
178,665197846434611200,Fri Nov 13 16:01:40 +0000 2015,0,0,Offshore Thailand oil and gas fields building to peak oil and gas production https://t.co/pQUEQCHUC3
179,664949444174049280,Thu Nov 12 23:34:36 +0000 2015,0,0,CapeOmega buys Noreco’s stake in Oselvar in North Sea https://t.co/88XhZ1Z0px
180,664949442643140608,Thu Nov 12 23:34:35 +0000 2015,1,0,Petronas’ profit plunges 91 percent https://t.co/hfpuKzxUxR
181,664949441380622336,Thu Nov 12 23:34:35 +0000 2015,0,0,Eni pens concession deals in Egypt https://t.co/ieTGDP8sr1
182,664949440042676228,Thu Nov 12 23:34:35 +0000 2015,1,0,BigRoll launches first of four marine transport vessels https://t.co/GJp3kak6fJ
183,664949438809579521,Thu Nov 12 23:34:35 +0000 2015,1,0,Baltic Sea pipeline reopens after munitions object cleared https://t.co/jFhhLqGD4m
184,664949437500903425,Thu Nov 12 23:34:34 +0000 2015,0,0,Croatia: Brodosplit starts building LNG container ships https://t.co/Gaamn6mCyJ
