,id_str,created_at,retweet_count,favorite_count,text
0,668119445370466304,Sat Nov 21 17:31:03 +0000 2015,5,0,RT @Quallit: 31st annual Turkey Drive Cozen PAL @cozen_oconnor @PhillyPAL @barristerspa https://t.co/5eBYkbEo2x
1,667747095546343424,Fri Nov 20 16:51:28 +0000 2015,1,0,Look who happened to stop by the same day as our Soldier Drive. @MissionBBQ https://t.co/V1MczcKDCR
2,666992988116099072,Wed Nov 18 14:54:55 +0000 2015,2,0,RT @ktrain_11: Thank you @JustinWineburgh of @cozen_oconnor for speaking to the Sports &amp; Entertainment Law Society students at @DrexelLaw t…
3,666346565838225409,Mon Nov 16 20:06:16 +0000 2015,4,0,"RT @NFWLJodyThomas: Having fun at this reception, @cozenoconnor! #WhiteHouse @ElectedWomen https://t.co/13IymToKGS"
4,664473420583800832,Wed Nov 11 16:03:03 +0000 2015,3,0,RT @CrowdfundCampus: Cant wait @foxalumni #crowdfunding event. See experts @SeedInvest @cozen_oconnor @RobinHoodVent @76Capital @CoPhilly h…
5,664110753897693184,Tue Nov 10 16:01:56 +0000 2015,1,0,RT @JThorntonEsq: Honoring inspiring women today at the American Red Cross Spectrum Awards #spectrum2015 @cozen_oconnor https://t.co/Dghva0…
6,664072926552064001,Tue Nov 10 13:31:38 +0000 2015,1,0,Are you attending the White Collar Practice seminar hosted by @pacdLawyers at the Union League today?  https://t.co/p440FlQboX
7,663845545065205760,Mon Nov 09 22:28:06 +0000 2015,1,0,Join members of our commercial litigation team tomorrow for a white collar practice seminar. 12 CLE credits offered https://t.co/FHzXA9ohkS
8,662045388518596608,Wed Nov 04 23:14:55 +0000 2015,2,0,RT @ecgrady: #IMPACT2015 Michael Heller thanks everyone for participating in IMPACT 2015. @cozen_oconnor https://t.co/HhMaQxL4nB
9,662041289677021184,Wed Nov 04 22:58:38 +0000 2015,0,0,Wells is out. Corrato asked why they only want $100k. Hagan &amp; Buckley are in for $50k each. Brassington  put $60k on the table. #IMPACT2015
10,662037612333572096,Wed Nov 04 22:44:01 +0000 2015,0,0,The last company to enter the Lion's Den is PurpleCloud Technologies. PurpleCloud technology helps hotels run more efficiently. #IMPACT2015
11,662037276738912256,Wed Nov 04 22:42:41 +0000 2015,0,0,The Lions have been told they need to make a decision: All five lions are in at $350k combined. #IMPACT2015
12,662034812505628672,Wed Nov 04 22:32:53 +0000 2015,0,0,PhotoSonics device uses light and sound to kill acne; Lion Michael Wells has concerned about the FDA approval. #IMPACT2015
13,662031411248001028,Wed Nov 04 22:19:23 +0000 2015,2,0,Next up in the Lion's Den: PhotoSonics for the treatment of acne without drugs. #IMPACT2015
14,662031028320649216,Wed Nov 04 22:17:51 +0000 2015,1,0,"$150k offer from Wells, Corrato &amp; Buckley, valuing the Smartplate at $2.5 mil. Fitly declined based on a $5 mil. valuation they received."
15,662026586456223744,Wed Nov 04 22:00:12 +0000 2015,1,1,"Fitly's Smartplate weighs food and tells users within seconds how many calories they will consume. What do you think, Twitter? #IMPACT2015"
16,662025573309485056,Wed Nov 04 21:56:11 +0000 2015,0,0,The first company selected to present before the Lions is Fitly. #IMPACT2015
17,661913353816825856,Wed Nov 04 14:30:15 +0000 2015,3,6,"""I want to make Pennsylvania work better for you (creative risk takers)"" @GovernorTomWolf at #IMPACT2015"
18,661906849197907968,Wed Nov 04 14:04:25 +0000 2015,0,0,PA Gov Tom Wolf @GovernorTomWolf has taken the stage #IMPACT2015.
19,661901278721794048,Wed Nov 04 13:42:17 +0000 2015,2,1,IT exports grew from $4.8B to $5.8B from 2007-2014. #IMPACT2015
20,661899637813587968,Wed Nov 04 13:35:45 +0000 2015,1,0,Greater Philadelphia IT report being presented now at #IMPACT2015.
21,661895878697971712,Wed Nov 04 13:20:49 +0000 2015,0,0,Join us at 9:15am for the #IMPACT2015 Technology Featured Company presentations hosted by Cozen O'Connor. @PhilaPACT https://t.co/jiiXCzv7Ad
22,661670242679185409,Tue Nov 03 22:24:13 +0000 2015,1,1,We're proud to host the #IMPACT2015 conference. Stay tuned for more tweets from the conference. https://t.co/QdgvTRPECO
23,660196716986126336,Fri Oct 30 20:48:57 +0000 2015,1,1,Looking forward to IMPACT's first Lion's Den &amp; the chance of investment deals for businesses. https://t.co/7WzcUYJRcj @phillymag @PhilaPACT
24,659843412791828480,Thu Oct 29 21:25:03 +0000 2015,0,0,"The 2015 Professional Liability Seminar is underway in New York, NY. https://t.co/wqX6Cgwt8n"
25,659056694413172736,Tue Oct 27 17:18:55 +0000 2015,0,0,You're welcome @DreamitVentures Happy to host #DemoDay and see all the innovations happening in Health IT.
26,657218660466098176,Thu Oct 22 15:35:13 +0000 2015,1,0,FTC Announces Red Light on Unqualified Green Seals https://t.co/y0AoTdWtYg from the Products Liability Prevention &amp; Defense blog
27,657173701004296192,Thu Oct 22 12:36:34 +0000 2015,0,0,“Adoption Day” Marks Official Launch of P5 + 1 Nuclear Deal with Iran https://t.co/01XbfpXuOz A Transportation &amp; Logistics Alert
28,656478529979351040,Tue Oct 20 14:34:12 +0000 2015,2,0,Morello v. Kenco Toyota Lift: No Duty to Advise Of Optional Safety Devices https://t.co/xRRV1677sU New from our Products Liability blog
29,654316659889541120,Wed Oct 14 15:23:42 +0000 2015,1,0,RT @IABCNPhila: Congrats @IABCNPhila Members from @cozen_oconnor @IBX @BeneficialBank @NGKF @PhillyInvSales on being named to @PHLBizJourna…
30,654287064813412352,Wed Oct 14 13:26:06 +0000 2015,4,3,We're serving free cappuccinos (and espresso and lattes) from @OldCityCoffee until 12:30 pm at @ACGPhilly #MAEast http://t.co/PN2epmmoLx
31,652580080787570690,Fri Oct 09 20:23:10 +0000 2015,2,0,Not Driving in America: Navigating New Territory in Product Liability http://t.co/QPyQlD14fV Products Liability Prevention &amp; Defense blog
32,652142774972649472,Thu Oct 08 15:25:28 +0000 2015,1,0,Looking for analysis on preventing &amp; defending product liability claims? Visit our new Products Liability blog http://t.co/WztQ966uQ2.
33,651534993496403972,Tue Oct 06 23:10:22 +0000 2015,0,1,USWST Captain @CarliLloyd talks about dedication &amp; perseverance at the Cozen O'Connor Women's  Initiative Reception. http://t.co/fV5V0hzUPs
34,651520688126357504,Tue Oct 06 22:13:31 +0000 2015,0,1,Our Women's Initiative co-chairs with the evening's guest of honor @CarliLloyd http://t.co/0dhec61OYz
35,649210315259969536,Wed Sep 30 13:12:55 +0000 2015,0,0,"SRBC Proposes Regulations to Authorize General Permits http://t.co/vSQcE4J3ZA An Energy, Environmental &amp; Utilities Alert"
36,648952051653844992,Tue Sep 29 20:06:40 +0000 2015,0,0,OFAC and BIS Announce Further Easing of Cuba Sanctions http://t.co/i3hn7XSe2W A Transportation &amp; Logistics Alert
37,648887336588210176,Tue Sep 29 15:49:31 +0000 2015,2,0,RT @thelegalintel: Our next Lawyer on the Fast Track: George Bibikos of @cozen_oconnor: http://t.co/zabUpjFmVc #TLILOFT15 http://t.co/xoJoN…
38,644867388530388992,Fri Sep 18 13:35:41 +0000 2015,1,0,NLRB’s Joint Employer Ruling Threatens to Reorder Employment Relations in the Health Care Industry http://t.co/JMYllG3oIx A Health Law Alert
39,644155339609362432,Wed Sep 16 14:26:15 +0000 2015,1,0,Newly Paved Path for Asserting Construction Defect Claims in Florida http://t.co/MvVI5ZFYdU a Commercial Litigation Alert
40,643840619094409217,Tue Sep 15 17:35:40 +0000 2015,3,3,Join @JustinWineburgh tonight at @UnionTransfer as he judges @LawrocksUSA – a battle of bands made up of lawyers. Benefits local nonprofits.
41,642354392373555200,Fri Sep 11 15:09:56 +0000 2015,0,0,Bruce Meckler Named to 2015 Crain’s Chicago Business “Who’s Who in Business” list http://t.co/cqPf9McUUh
42,641696438070706178,Wed Sep 09 19:35:27 +0000 2015,2,5,Join @JustinWineburgh Sept 15 at @UnionTransfer as he judges @LawrocksUSA – a battle of bands made up of lawyers. Benefits local nonprofits.
43,641344442092224512,Tue Sep 08 20:16:45 +0000 2015,2,1,Insider Trading Hack was Cinematic in Scope http://t.co/NNqItjsnXa from Cyber Law Monitor by @DaveShimkin
44,641266127264477184,Tue Sep 08 15:05:33 +0000 2015,2,1,"Cozen O’Connor Expands Energy, Environmental, and Public Utilities Practice with Addition of George Bibikos http://t.co/hcGfHPVM20"
45,639429918850449408,Thu Sep 03 13:29:07 +0000 2015,0,0,Linda Riefberg @lriefberg Discusses New FINRA Rules on Equity &amp; Debt Market Research in The Wall Street Journal @WSJ http://t.co/meVx2Wlvij
46,639063054962003968,Wed Sep 02 13:11:20 +0000 2015,1,2,"Cozen O’Connor Continues Growth of Washington, D.C. Office Expanding Energy and Real Estate Practices http://t.co/my3wzy4WXa"
47,638731915521073152,Tue Sep 01 15:15:30 +0000 2015,1,2,"Cozen O'Connor Ranked First in Philadelphia, Second Nationally in @AmericanLawyer Best Places to Work http://t.co/5761aOULMq"
48,638697975439564800,Tue Sep 01 13:00:38 +0000 2015,0,1,Life After Browning-Ferris: What Employers Need to Know Under the New Joint Employer Regime http://t.co/uONJ73siEU Labor &amp; Employment Alert
49,636238854501085185,Tue Aug 25 18:08:58 +0000 2015,3,2,NewSpring's @marcrlederman on why Philly startups should pitch successful entrepreneurs &amp; angel investors @PhilaPACT http://t.co/5m69UZgYBJ
50,634727483842121728,Fri Aug 21 14:03:19 +0000 2015,0,0,Health Policy Pulse Blog: A Moment of Appreciation for Frances Oldham Kelsey &amp; Dedicated Countless Others at the FDA http://t.co/O1zkJnvHNU
51,634468840160817152,Thu Aug 20 20:55:34 +0000 2015,1,2,Michelle Lee Flores Discusses Utilizing the Human Resources Department in @SHRM http://t.co/32QoCslPMn
52,634051596360531969,Wed Aug 19 17:17:35 +0000 2015,1,0,RT @PHLBizJournal: After 2 years of planning @Cozen_OConnor moved into their new headquarters in Center City http://t.co/x3jxsKDOYB
53,634051502592552961,Wed Aug 19 17:17:12 +0000 2015,2,0,RT @PHLBizLawBank: Inside Look: Big law firm @cozen_oconnor’s office space of the future http://t.co/U9yXpZckRy http://t.co/oPzrQPIoHd
54,633664899885977600,Tue Aug 18 15:40:59 +0000 2015,2,1,Cozen O'Connor Labor and Employment Attorneys Score Big for Northwestern University http://t.co/Gp4sXl79eM
55,631106026616524800,Tue Aug 11 14:12:56 +0000 2015,1,2,Jason Bonk Discusses the Upcoming Case Between the NFLPA and the NFL in The @BostonGlobe http://t.co/c817J6ejnz
56,630763095246381056,Mon Aug 10 15:30:15 +0000 2015,0,0,The City of San Bernardino Proposed Bankruptcy Plan http://t.co/8tFesEA5kw A Cozen O'Connor Podcast
57,630719601316372480,Mon Aug 10 12:37:25 +0000 2015,1,0,Ignorance Is Not Bliss: Clock under ACA’s “60 Day Rule” Can Start Before Exact Amount of Overpayment is Identified http://t.co/ODuqXw2fv4
58,629657448006176768,Fri Aug 07 14:16:48 +0000 2015,1,0,Joe Tilson Elected Vice-Chair of ABA Section on Labor and Employment Law http://t.co/ApGKIUp7ki @abaesq
59,629273599707324416,Thu Aug 06 12:51:32 +0000 2015,0,0,Cozen O'Connor Sports Law Team Weighs In on Recent Scandals http://t.co/YGCR9R7MRf
60,628694808626905088,Tue Aug 04 22:31:37 +0000 2015,0,0,"Team #cozen_oconnor- bill by the hour, run by the second #corporatefunrun http://t.co/LWKzXg9eY1"
61,628677320799330305,Tue Aug 04 21:22:08 +0000 2015,2,2,Team #cozen_oconnor ready to take on the Philly #corporatefunrun tonight! http://t.co/4pMRcvLilW
62,626372453594476544,Wed Jul 29 12:43:25 +0000 2015,0,0,Ashley Madison Reveals Even More: Hacking May Be An Inside Job http://t.co/6ie70utqv3 from the Cyber Law Monitor blog
63,624627697520648192,Fri Jul 24 17:10:22 +0000 2015,0,0,P5+1 Nations Reach Nuclear Deal with Iran http://t.co/fP2wZ4vcq8 A Transportation &amp; Logistics Alert
64,624560976575209472,Fri Jul 24 12:45:15 +0000 2015,0,0,A Fall (or Stumble) for Illinois Pension Reform - a Public &amp; Project Finance podcast http://t.co/1uIGGptSyg
65,624329823205199872,Thu Jul 23 21:26:43 +0000 2015,1,0,RT @delvacca: Sponsor @cozen_oconnor http://t.co/r7GIbYvG5N
66,623597632502501376,Tue Jul 21 20:57:16 +0000 2015,0,1,"Peter Lynch (USMC Retired) assisted homeless veterans in 28th Annual Veteran ""Stand Down"" in San Diego @SDVLP http://t.co/o40dwA6kE7"
67,621401761631354884,Wed Jul 15 19:31:39 +0000 2015,0,1,Tomorrow Leslie Hulburt &amp; Marisa Saber give a free webinar on pursuing claims against the government. Learn more at http://t.co/KzwRUWTWNM
68,621334297509806080,Wed Jul 15 15:03:35 +0000 2015,0,1,John Johnson interviewed by @capitalnewyork about @USWNT captain @CarliLloyd #IBelieve http://t.co/alraC97nt3
69,620698965705641984,Mon Jul 13 20:59:00 +0000 2015,1,0,"RT @IMPACTvcConf: What will #IMPACT2015 offer to over 1,000 attendees? Just take a peak at last year's conference http://t.co/x4EeRifwHk Ho…"
70,620586300039692288,Mon Jul 13 13:31:18 +0000 2015,0,0,On 7/16 Leslie Hulburt &amp; Marisa Saber give a free webinar on pursuing claims against the government. Learn more at http://t.co/KzwRUWTWNM
71,620580265006637056,Mon Jul 13 13:07:19 +0000 2015,1,2,Jason Bonk Discusses MLB Scandal &amp; Crossroads of Privacy in Sports on KXFN Talk St. Louis http://t.co/QGB8nica1M
72,619244793437093890,Thu Jul 09 20:40:38 +0000 2015,0,0,On 7/16 Leslie Hulburt &amp; Marisa Saber give a free webinar on pursuing claims against the government. Learn more at http://t.co/KzwRUXbxFk
73,618801609523503105,Wed Jul 08 15:19:35 +0000 2015,0,0,Cozen O'Connor's Summer Associate Program featured in the @WSJ law blog http://t.co/GNCyFFxgvq
74,618451574378098688,Tue Jul 07 16:08:40 +0000 2015,0,0,On 7/16 Leslie Hulburt &amp; Marisa Saber give a free webinar on pursuing claims against the government. Learn more at http://t.co/KzwRUWTWNM
75,618151272689049600,Mon Jul 06 20:15:22 +0000 2015,0,0,U.S. and Cuba Reestablish Diplomatic Relations http://t.co/rx3qtlZH9m A Transportation &amp; Logistics Alert
76,618127224156327936,Mon Jul 06 18:39:49 +0000 2015,0,0,"Update on Significant DOT, FAA and Other Federal Agencies’ Aviation-Related Regulatory Actions http://t.co/OamWRqhyQx"
77,616599937413947392,Thu Jul 02 13:30:55 +0000 2015,0,0,Department of Labor Announces Long-Awaited Increase in Salary Threshold for Exempt Employees http://t.co/7bBSuNXV2q Labor &amp; Employment Alert
78,616246472879800320,Wed Jul 01 14:06:23 +0000 2015,3,0,RT @IMPACTvcConf: #IMPACTvc Spotlight - Day 1 Keynote Announced - Kynetic's Michael Rubin &amp; @CampusAptsCEO http://t.co/INQeIQpvHw hosted by…
79,615985132424589312,Tue Jun 30 20:47:54 +0000 2015,2,0,"RT @JThorntonEsq: Today @cozen_oconnor moved to its new Philadelphia office in One Liberty Place. So far, so good!"
80,615955890714357760,Tue Jun 30 18:51:42 +0000 2015,0,1,We are unpacked (almost) and back to work in our new headquarters at One Liberty Place.
81,615559183375724544,Mon Jun 29 16:35:20 +0000 2015,0,0,Progress in Medicare Takes Many Forms: Moving Ahead with Maintenance Care After Jimmo http://t.co/xgUuMqCwZP from the Health Law Informer
82,613336494649044992,Tue Jun 23 13:23:10 +0000 2015,0,0,Washington Supreme Court Misses Opportunity to Clarify the Meaning Of “Collapse” http://t.co/JxOhR5Mqvf Property Insurance Law Observer Blog
83,612983103221534720,Mon Jun 22 13:58:55 +0000 2015,0,1,Largest Criminal Health Care Fraud Takedown – 243 Charged &amp; $712 Million in False Billings http://t.co/TuSPwrbCGH - Health Law Informer blog
84,611916899102924801,Fri Jun 19 15:22:12 +0000 2015,1,0,"Employers May Fire Employees for State-Licensed Medical Marijuana Use, Colorado Supreme Court Holds http://t.co/cUsaCPAIJH"
85,611572531938652160,Thu Jun 18 16:33:48 +0000 2015,2,0,"Member Jillian Thornton recognized in @billy_penn monthly ""Who's Next"" as outstanding young leader in Philly legal community. @JThorntonEsq"
86,611236354664566784,Wed Jun 17 18:17:57 +0000 2015,0,1,Weather Events Create Difficult HR Issues http://t.co/RV7ZPeet5c from the HR Headaches blog
87,610461909402394624,Mon Jun 15 15:00:35 +0000 2015,0,0,"Time for an acronym update from our favorite government acronym, #NLRB http://t.co/e5Vwm2xD2W from the Social Media Employment Law Blog"
88,610455025597456384,Mon Jun 15 14:33:14 +0000 2015,0,0,"June 30, 2015 Filing Deadline Approaches to Report Foreign Financial Accounts http://t.co/TOOg2bIEko A Private Client Services Alert"
89,609437895926136833,Fri Jun 12 19:11:31 +0000 2015,0,0,Only 1 hr left for the @AlexsLemonade stand! There's still time to donate! Stop by 19th &amp; Market and help us break last year's record!
90,609416816927051776,Fri Jun 12 17:47:46 +0000 2015,0,0,Over $2500 raised for #ChildhoodCancer Research! There's still time to donate! Don't miss our @AlexsLemonade today! #LemonadeDays
91,609392751772336129,Fri Jun 12 16:12:08 +0000 2015,0,1,@AlexsLemonade #LemonadeDays http://t.co/kS0Db28uJB
92,609392435123355648,Fri Jun 12 16:10:53 +0000 2015,0,2,Beat the heat! Stop by the Cozen O'Connor @AlexsLemonade stand today at 19th &amp; Market. We've got pretzels too! #LemonadeDays
93,609344457444577280,Fri Jun 12 13:00:14 +0000 2015,2,1,Our Alex's Lemonade Stand is open for business at the corner of 19th and Market Streets.
94,609089296134488064,Thu Jun 11 20:06:19 +0000 2015,1,0,CMS’ Long Awaited Final ACO Regulations for 2016 and Beyond: Major New Options and Plenty of Fine Tuning http://t.co/F3kvODcmo5
95,606628891923496963,Fri Jun 05 01:09:33 +0000 2015,0,1,#JPMCC #teamCozenOConnor http://t.co/Fmuq1Uthtv
96,606628697358102528,Fri Jun 05 01:08:46 +0000 2015,1,3,Team Cozen O'Connor ready to take on the JPMorgan Corporate Challenge. #JPMCC http://t.co/ZMg70o2JQQ
97,606100351515815936,Wed Jun 03 14:09:19 +0000 2015,1,0,"RT @TheGesuSchool: Gesu honored Tad Decker as a Spirit Medalist @ 2015 Gala. See his dedication in action! http://t.co/BifIZjwXfJ 
@cozen_o…"
98,605755628175421441,Tue Jun 02 15:19:30 +0000 2015,4,0,Cozen O’Connor Combines with Meckler Bulger Tilson - Expands Midwest and West Coast Presence http://t.co/hK7gcnOtJn
99,596642202350198784,Fri May 08 11:46:00 +0000 2015,3,0,"RT @StateAGReport: State AG Report Inaugural Edition ! GA AG now oversees consumer protection, plus False Claims, patent trolls, &amp; more! ht…"
100,596303306135367680,Thu May 07 13:19:21 +0000 2015,1,1,@PhilaPACT Cybersecurity Event today in West Conshohocken with Matt Siegel on cyber attack! Learn more http://t.co/bSxJuVdWuQ
101,595963856352112641,Wed May 06 14:50:30 +0000 2015,2,1,"It’s not too late to attend @PhilaPACT Cybersecurity Event tomorrow, featuring Matt Siegel discussing cyber attack! http://t.co/kIqlqPY5ec"
102,595601775975096320,Tue May 05 14:51:43 +0000 2015,7,1,Cozen O’Connor Launches New State Attorneys General Practice with Addition of Nationally Acclaimed State AG Practice http://t.co/kNpkiohTsD
103,593123866672799744,Tue Apr 28 18:45:24 +0000 2015,0,0,Member Kerry McTigue is up next with expert panel on #atrisklaunch at #ACIPIV conference. http://t.co/4Is8kJOUDD #HatchWaxman @ACI_Pharma
104,592744855115300866,Mon Apr 27 17:39:20 +0000 2015,0,0,Member Marty Pavane is up next at 1:45 with panelists discussing #PTO proceedings at #ACIPIV Conference http://t.co/dNCBpJOQiq #HatchWaxman
105,592663305216491523,Mon Apr 27 12:15:17 +0000 2015,1,0,#ACIPIV kicks off today in NYC. Hot topics on #HatchWaxman and #ParagraphIV. Proud to be a sponsor. @ACI_Pharma http://t.co/OxCgGKq9TB
106,591696929165332480,Fri Apr 24 20:15:15 +0000 2015,1,1,Hear from the experts on the latest in #HatchWaxman @ACI_Pharma. #ParagraphIV conference starts Monday. #ACIPIV  http://t.co/IurrRQwAgC
107,591295039663448065,Thu Apr 23 17:38:17 +0000 2015,0,0,"Jonathon Held of J.S. Held, Incorporated discussing builders risk &amp; delay at 2015 National Property Insurance Seminar http://t.co/vTcyhbZAVc"
108,591284114961084416,Thu Apr 23 16:54:53 +0000 2015,0,0,Kevin Kamraczewski speaking now on income loss arising from catastrophes at 2015 National Property Insurance Seminar. http://t.co/eiwJTJgjYL
109,591267383467212800,Thu Apr 23 15:48:24 +0000 2015,3,0,Cozen O’Connor and Chicago-based Meckler Bulger Tilson (MBT) Vote to Combine http://t.co/WDGF2XC98m
110,591230022192594944,Thu Apr 23 13:19:56 +0000 2015,0,0,Get the latest on #HatchWaxman litigation &amp; patent approval on generics @ACI_Pharma #ParagraphIV April 27-28 in NYC http://t.co/cGFEGtbLoV
111,590851420179554304,Wed Apr 22 12:15:30 +0000 2015,0,0,Member Kerry McTigue talks damages in at risk launch scenarios 4/28 at #ACIPIV Conference in NYC http://t.co/FgwY66SD06
112,590544946337345536,Tue Apr 21 15:57:41 +0000 2015,4,1,Cozen O’Connor Welcomes Health Care Attorney Marc Auerbach to Growing Miami Office http://t.co/zbgez1vbWE
113,590489024290226176,Tue Apr 21 12:15:28 +0000 2015,1,0,Member Martin Pavane discusses #PTO Proceedings at #ACIPIV Disputes conference on 4/27 in NYC #HatchWaxman http://t.co/6LhNp5RvTk
114,590126627318849536,Mon Apr 20 12:15:26 +0000 2015,0,0,Member Barry P. Golob talks ANDA litigation &amp; legal #analytics in #ParagraphIV disputes at #ACIPIV conference on 4/27 http://t.co/bMqQqs2oZd
115,589099884873179139,Fri Apr 17 16:15:32 +0000 2015,1,0,Join the conversation. Expert insights on #HatchWaxman litigation strategies for brand names and generics @ACI_Pharma http://t.co/pqcGJ4RDix
116,588375097066528770,Wed Apr 15 16:15:29 +0000 2015,1,0,"ACI's 9th Annual #ParagraphIV Disputes Conference: Barry Golob, Kerry McTigue, Martin Pavane speak Apr. 27-28 #ACIPIV http://t.co/mvL0MXKs0p"
117,586271533141774339,Thu Apr 09 20:56:40 +0000 2015,3,0,RT @BigLawBiz: Cozen O'Connor CIO: Delivering Freedom of Choice to Attorneys https://t.co/UDKOocVJRq @cozen_oconnor
118,586242422755176449,Thu Apr 09 19:01:00 +0000 2015,1,0,Judges &amp; Lawyers in Conversation: Melissa White participates on @seattleulaw Tech. on Appeals panel. 4/10 in Seattle http://t.co/sdCemXersQ
119,585908335326720001,Wed Apr 08 20:53:27 +0000 2015,0,0,"@RebeccaBrodey named one of Global Investigations Review's 2015 Top 100 ""Women in Investigations."" http://t.co/VUeIDHaTKq"
120,585839641967861760,Wed Apr 08 16:20:29 +0000 2015,0,0,Proud to sponsor ACI's 9th Annual Paragraph IV Disputes Conference April 27-28 in NY @ACI_Pharma #ACIPIV #HatchWaxman http://t.co/TBCpcNSDZk
121,585805002440122368,Wed Apr 08 14:02:50 +0000 2015,0,0,Charles Wilson talking hot issues in employee raiding cases at @TexasLawyer Semi-Annual Energy Summit. Houston - 4/9 http://t.co/fowqh0QDru
122,585519548226494466,Tue Apr 07 19:08:33 +0000 2015,1,0,Jason Bonk discusses Clinton's use of her personal email account in her capacity as a government official in @Law360 http://t.co/37hH8LfuKM
123,585503618977103872,Tue Apr 07 18:05:15 +0000 2015,1,1,"2015 Texas Learn &amp; Burn - April 8, Wylie, TX, with cosponsors @Firensics &amp; Integrity Forensics &amp; Engineering. http://t.co/myvwQry121"
124,585472427301466116,Tue Apr 07 16:01:18 +0000 2015,0,1,Michelle Flores &amp; Sara Poster discuss laws &amp; developments affecting LGBT employees &amp; employers. 4/8 in West Hollywood http://t.co/ojjiOXtMaD
125,585453122371375104,Tue Apr 07 14:44:36 +0000 2015,2,0,RT @TheGesuSchool: Gesu Gala awarding Tad Decker 1 of 2 Spirit Medals on 5/7! Details &amp; tickets: http://t.co/NODAlu4iHm @cozen_oconnor http…
126,585452603846320130,Tue Apr 07 14:42:32 +0000 2015,1,2,Join us for the @PhilaUnion 3rd Annual Cocktails &amp; Cleats Gala on April 22 at Vie @cescapheevents. Tickets at: http://t.co/DVif0nQ9TX
127,583733027819409408,Thu Apr 02 20:49:33 +0000 2015,1,0,"RT @ecgrady: My alert discussing details of SEC's new Regulation A+ to raise up to $50 million in capital. http://t.co/qIuGjyQlFN
  @cozen_…"
128,583732010994294784,Thu Apr 02 20:45:31 +0000 2015,0,0,Brace Yourselves: Major Overtime Regulations Coming Soon #DOL http://t.co/pe1MT8CqzN from the HR Headaches blog
129,583313071713755137,Wed Apr 01 17:00:48 +0000 2015,1,0,Another Health Plan Hit By Massive CyberAttack and Class Actions Follow http://t.co/IFmwtimVZR from the Health Law Informer blog
130,583257379090927616,Wed Apr 01 13:19:30 +0000 2015,1,0,Young v. UPS Calls for a Review of Accommodations Offered to Pregnant Employees http://t.co/f2cb5ky0G1 A Labor &amp; Employment Alert
131,582960009803350016,Tue Mar 31 17:37:51 +0000 2015,3,0,RT @2013Chancellor: @PBICLE @cozen_oconnor Steve Cozen discusses future of #legal education #pbitownhall http://t.co/4izVL1qMP6
132,580715515737456641,Wed Mar 25 12:59:02 +0000 2015,2,4,Eva Moskowitz (Success Academy Charter Schools) speaking now at NYC breakfast.Hosted by @cozen_oconnor &amp; @observer. http://t.co/khE3MskcZ1
133,580058820182937600,Mon Mar 23 17:29:34 +0000 2015,2,0,Melissa White participates on a Bad Faith panel at the 2015 @TheCLMalliance Annual Conference in Palm Desert on 3/26 http://t.co/vpGt8PwZJB
134,578262125145108481,Wed Mar 18 18:30:08 +0000 2015,2,0,"RT @atlblog: Per @mschmidtemplaw at #ATLConverge: in my blogging on employment law (see http://t.co/YADXrE1Zmi), I try to inform AND entert…"
135,578260842648588288,Wed Mar 18 18:25:03 +0000 2015,7,0,"RT @atlblog: Per @ScottGreenfield at #ATLConverge: lawyers can't ignore their ethical obligations in the social media context, even if inco…"
136,578248916052918272,Wed Mar 18 17:37:39 +0000 2015,2,1,On deck at #ATLConverge @MSchmidtEmpLaw talks tech trends with @JosephPatrice @rlytle @rightbrainlaw @upwardaction http://t.co/kyluty9x58
137,578219282682789889,Wed Mar 18 15:39:54 +0000 2015,0,1,"@AbbySacunas explores the use of experts in product liability litigation in 3/20 webinar. Complimentary registration, http://t.co/RhYdscdeTM"
138,578191397834125312,Wed Mar 18 13:49:06 +0000 2015,0,1,@Justin_B_Smith advises lawyers to think like entrepreneurs at #ATLConverge
139,578182362904793088,Wed Mar 18 13:13:12 +0000 2015,2,0,Let the converging begin @atlblog. Looking forward to @MSchmidtEmpLaw discussing tech trends. #ATLConverge
140,578164227778736130,Wed Mar 18 12:01:08 +0000 2015,1,0,"Have a great symposium today, Michael Schmidt, at ATL Converge in NYC. @MSchmidtEmpLaw @atlblog  http://t.co/5sAiRv61a7 #lawtech"
141,577941300147851264,Tue Mar 17 21:15:18 +0000 2015,0,0,Catch tomorrow's ATL event in NYC. Everything lawyers and marketing pros need to know about #lawtech. @atlblog http://t.co/PqPBFv6B9z
