,id_str,created_at,retweet_count,favorite_count,text
142,577886436000731136,Tue Mar 17 17:37:17 +0000 2015,1,1,@ecgrady writes for @CorpCounsel about proxy access and public company options after SEC’s no-action reversal http://t.co/IherFLHqV7
143,577864710349017088,Tue Mar 17 16:10:57 +0000 2015,0,1,@RuryKelday Thanks for coming out and supporting the program. Every year gets better and better!
144,577863610166308864,Tue Mar 17 16:06:35 +0000 2015,1,0,Above the Law Converge symposium tomorrow in NYC: @MSchmidtEmpLaw talking Emerging Tech Trends &amp; Best Practices. http://t.co/VJwg57I91Q
145,577660503897538560,Tue Mar 17 02:39:31 +0000 2015,0,1,"Above the Law Converge on 3.18.15 in NYC, with Michael Schmidt talking social tech + law. http://t.co/djg6fgFZ8Z @MSchmidtEmpLaw @atlblog"
146,577568177015668736,Mon Mar 16 20:32:38 +0000 2015,0,1,"Breakfast conversation w/ Eva Moskowitz (Success Academy Charter Schools). Hosted by Cozen O'Connor &amp; @observer, 3/25 http://t.co/DHwKXAlpDB"
147,576055164030873600,Thu Mar 12 16:20:28 +0000 2015,0,0,New FMLA Regulations Will Affect Texas Employers http://t.co/e6dt5L85gx from HR Headaches blog
148,575996821702594560,Thu Mar 12 12:28:38 +0000 2015,0,0,Practice Leasing: An Alternative Worth Considering http://t.co/SD6DFmmVb2 from the Health Law Informer blog
149,573879197527064576,Fri Mar 06 16:13:57 +0000 2015,2,1,Thanks to everyone who participated in #SportsLaw symposium. Great event with true professionals! @BrewerSports @StevenSilton @sportslawyers
150,573591469040205824,Thu Mar 05 21:10:37 +0000 2015,4,0,RT @deberman91: .@BrewerSports and @AmarantusBio CEOs speak on Concussion Issues panel at the @cozen_oconnor #SportsLawCLE #GBHC http://t.c…
151,573546296985960449,Thu Mar 05 18:11:07 +0000 2015,0,0,RT @SportsLawChat: Excellent sports law conference today in miami hosted by @cozen_oconnor. #SportsLawCLE #SLChat http://t.co/jf7l6hxpJz
152,573545502052085760,Thu Mar 05 18:07:58 +0000 2015,2,3,@BrewerSports Thanks for your support. Happy to have you as a partner for this event! #sportslawCLE
153,573525335444176896,Thu Mar 05 16:47:50 +0000 2015,1,1,"Happy to have @scottrosner @KMMsports @leighsteinberg for Sports Law for Rookies &amp; Veterans, happening now in Miami. http://t.co/KaEBdg2M6b"
154,573511738160779265,Thu Mar 05 15:53:48 +0000 2015,5,0,RT @clairezovko: Great turnout today at the @cozen_oconnor sports law symposium. #sportslawcle http://t.co/3XIF8nhCy8
155,573472610882822145,Thu Mar 05 13:18:19 +0000 2015,1,2,"@StevenSilton Have a great conference with a fantastic group of sports, media, and law professionals. #SportsLawCLE"
156,573460360763736064,Thu Mar 05 12:29:39 +0000 2015,2,0,RT @StevenSilton: All set up and ready to go!  @cozen_oconnor @JackBrewerBSI #SportsLawCLE http://t.co/ekzGN9pRCt
157,573290710180491264,Thu Mar 05 01:15:31 +0000 2015,1,1,Tomorrow's #sportslawCLE kicks off w/ @leighsteinberg. An all-star team of experts will make a great event. Join us! http://t.co/pmmpH0EiHn
158,573245344831553536,Wed Mar 04 22:15:15 +0000 2015,1,2,"Looking forward to tomorrow at Eden Roc Miami Beach #Sportslaw for Rookies and Veterans, an outstanding #sportslawCLE http://t.co/CaAaAbbKJ6"
159,573169870113804288,Wed Mar 04 17:15:20 +0000 2015,2,2,"#SportsLaw for Rookies and Veterans, tomorrow in #miamibeach with co-sponsors @BrewerSports @sportslawyers @umlawschool"
160,573124637485350912,Wed Mar 04 14:15:36 +0000 2015,1,1,"Tomorrow's the big day in #miamibeach. #Sportslaw for Rookies and Veterans http://t.co/S7Fl7RXju4 All-star panel, hot topics, #sportslawCLE."
161,573085424446537729,Wed Mar 04 11:39:47 +0000 2015,0,0,@lainey_vb131 Thanks! Hope to catch you at another event soon.
162,573083862257025024,Wed Mar 04 11:33:34 +0000 2015,0,0,@protennislaw Glad to hear it. See you there!
163,572883034283773952,Tue Mar 03 22:15:33 +0000 2015,2,1,"Hot topics in sports, media &amp; law March 5 #miamibeach. Agenda and all-star panel http://t.co/vQLh159hDx Moderated by our own @StevenSilton"
164,572807458701352961,Tue Mar 03 17:15:15 +0000 2015,3,2,"2015 Sports Law for Rookies and Veterans, a free event not to be missed. http://t.co/YYuTmMdeca #miamibeach #sportslaw #freecle"
165,572790748367753216,Tue Mar 03 16:08:51 +0000 2015,0,0,"@TimStrawFSU Yes, it is complimentary to everyone and there are seats still available. Register http://t.co/ebDs15nbZr"
166,572790324885622784,Tue Mar 03 16:07:10 +0000 2015,0,0,RT @StevenSilton: Pleased to have @umlawschool as a sponsor for @JackBrewerBSI #sportslawCLE! #sportslaw Register at http://t.co/m0SAxAgAYQ
167,572747096270508035,Tue Mar 03 13:15:23 +0000 2015,1,0,"Head to Miami Beach for a complimentary, informative program &amp; CLE on sports, media &amp; law http://t.co/wKSKSsf3DZ #sportslaw #sportsbiz"
168,572520579057758208,Mon Mar 02 22:15:17 +0000 2015,1,1,Check out the agenda &amp; all-star speaker line-up for Thursday's Sports Law symposium and CLE in Miami Beach http://t.co/sfwyvufnnq #sportslaw
169,572445075021664257,Mon Mar 02 17:15:16 +0000 2015,2,1,"Join us: Sports Law for Rookies and Veterans, March 5, Miami Beach, with co-sponsors @sportslawyers and @BrewerSports http://t.co/j1B6OmrVEK"
170,572374670076465152,Mon Mar 02 12:35:30 +0000 2015,3,2,"2015 Sports Law for Rookies and Veterans March 5 Eden Roc Miami Beach, a complimentary program http://t.co/Aoxw1P0YP8 #sportslaw #medialaw"
171,571478737142861824,Sat Feb 28 01:15:23 +0000 2015,2,1,"If you missed Greg Fliszar's discussion on #cybersecurity last night, catch him again at PBI's 21st Annual Health Law Institute on 3.12"
172,571074775164059649,Thu Feb 26 22:30:11 +0000 2015,3,0,HIPAA audits expected to resume in 2015 and Business Associates will likely be targets. Do you have BAA's with health care firms? @PhilaPACT
173,571072625818140672,Thu Feb 26 22:21:38 +0000 2015,1,0,Greg Fliszar explains that HIPAA privacy regulations and enforcement go far beyond traditional health care organizations. @PhilaPACT
174,571067050849927169,Thu Feb 26 21:59:29 +0000 2015,1,0,"Breaches caused by insiders, though serious at times, are relatively few compared to other breach causes. @PhilaPACT http://t.co/wQVPK55WJQ"
175,571063158430945280,Thu Feb 26 21:44:01 +0000 2015,1,1,Dave Snyder CISO @IBC presenting compelling statistics on data breaches in health care organizations.  @PhilaPACT #cybersecurityseries
176,571062389866668032,Thu Feb 26 21:40:58 +0000 2015,1,0,RT @PhilaPACT: Dave Snyder @IBX kicks things off with a discussion on data breaches #cybersecurityseries
177,571052508245831680,Thu Feb 26 21:01:42 +0000 2015,2,0,"Have a great event tonight, Greg Fliszar, Esq and @PhilaPACT, 4-7pm. Looking forward to insights on #cybersecurity #healthcare #HIPAA"
178,570958195021225984,Thu Feb 26 14:46:56 +0000 2015,0,0,See you tonight at Greg Fliszar's #healthcare #cybersecurity event at  W. Conshohocken Phila Marriott West 4-7 pm  http://t.co/0QLYvwGpkg
179,570708724094009344,Wed Feb 25 22:15:37 +0000 2015,1,0,Attorney Greg Fliszar's slides for tomorrow's @PhilaPACT event are up on Slideshare. http://t.co/Iuyw23MxMB #healthcare #cybersecurity
180,570644004854992896,Wed Feb 25 17:58:27 +0000 2015,0,0,Strategies for Minimizing Risk: a breakfast &amp; luncheon discussion on workforce reduction legal risks. 3/26 in Houston http://t.co/wmA6X3ycAQ
181,570572801549201408,Wed Feb 25 13:15:31 +0000 2015,1,0,It's not too late to register for tomorrow's @PhilaPACT event in Conshohocken 4-7 pm #cybersecurity &amp; medical records http://t.co/wXfjdXipQV
182,570346254074449920,Tue Feb 24 22:15:18 +0000 2015,2,0,The @PhilaPACT event with our own Greg Fliszar is almost here-2 days to go. Register now at http://t.co/UNW5o5B4NJ #healthcare #cyberattacks
183,570270880187719680,Tue Feb 24 17:15:47 +0000 2015,0,0,"It happened to #Anthem, it can happen to your business. Greg Fliszar, Esq will talk about how to protect your electronic #healthcare records"
184,570233828285026304,Tue Feb 24 14:48:33 +0000 2015,0,0,EEOC Loses Another Background Check Case http://t.co/zO2EHcPL27 from the HR Headaches blog
185,570225473093050368,Tue Feb 24 14:15:21 +0000 2015,1,0,Getting ready for Thursday's #cybersecurity #healthcare event. Greg Fliszar is talking risks &amp; precautions @PhilaPACT http://t.co/5yN6yVax3d
186,569985192171061248,Mon Feb 23 22:20:34 +0000 2015,3,2,How can we protect electronic medical records from #cyberhacks? Register for event @PhilaPACT Thurs 2.26 http://t.co/MERypBJatW @PhilaPACT
187,569907176233439233,Mon Feb 23 17:10:33 +0000 2015,1,0,Thanks for the RT @sharperlawyer  Thursday's @PhilaPact event on #cybersecurity #healthcare should be great  Register http://t.co/Tgwrk2Yd1B
188,569860034986971136,Mon Feb 23 14:03:14 +0000 2015,1,0,"This Thursday #PhilaPact event on #cybersecurity #healthcare Greg Fliszar, Esq. See his article now on #JDSupra http://t.co/WnMoXFrlFQ"
189,569739183218139136,Mon Feb 23 06:03:01 +0000 2015,1,0,Not just Hollywood--Cybersecurity breaches affect your medical records/data. Learn the risks 2.26 Atty Greg Fliszar http://t.co/a8BzyjBHip
190,568898475762573313,Fri Feb 20 22:22:20 +0000 2015,1,0,"Secure your medical records from hackers? Learn more &amp; register for PACT #Cybersecurity event 2.26 http://t.co/qpv8QptKPH Greg Fliszar, Esq"
191,568539131338305536,Thu Feb 19 22:34:26 +0000 2015,3,0,"RT @PhilaPACT: PACT #Cybersecurity Series 2.26.15 http://t.co/vYZLwV0V9Z
Best practices for #data breach analysis &amp; prep @cozen_oconnor @La…"
192,568465161809465344,Thu Feb 19 17:40:30 +0000 2015,0,1,"Protect medical records from cyber-attacks. On 2.26 Greg Fliszar, Esq talks #cybersecurity #healthcare. Register now http://t.co/aghHbVJzjL"
193,568434102556356608,Thu Feb 19 15:37:05 +0000 2015,2,0,RT @knowlengr: RT @Quorum_Sc Join @PhilaPACT 2/26 #Cybersecurity event on HIPAA and HITECH compliance: http://t.co/SZ7XQHudyX http://t.co/E…
194,568104334073966592,Wed Feb 18 17:46:42 +0000 2015,0,0,Matthew Siegel Discusses the Increased Need for Cyberinsurance http://t.co/Rme3uEE5oW @thelegalintel
195,566344899315105792,Fri Feb 13 21:15:20 +0000 2015,0,0,"This week's #Cybersecurity Attack on Anthem, Inc. Highlights Risks for Companies Handling Electronic Medical Records http://t.co/bjWPDzhk3J"
196,566338782795141121,Fri Feb 13 20:51:02 +0000 2015,1,0,RT @KryptonBrothers: RT @Quorum_Sc @Cozen_OConnor) @PhilaPACT 2/26 #Cybersecurity on HIPAA and HITECH compliance http://t.co/hjcJJveNww htt…
197,566254880726462464,Fri Feb 13 15:17:38 +0000 2015,0,0,Mandatory Sick Leave Becomes the Law in Philadelphia http://t.co/kesMSWCfja A Labor &amp; Employment Alert
198,565558143028322304,Wed Feb 11 17:09:03 +0000 2015,0,0,Jason Bonk discusses ways an attorney can work a case in their favor with successful cross-examinations @Law360 http://t.co/Hv6PCEACqx
199,565210634439380992,Tue Feb 10 18:08:11 +0000 2015,1,0,"RT @MarilynNeiman: I also will be a Twitter panelist on 2/12, starting at 12 (EST) for the discussion on the Innovation Act of 2015.#law360…"
