,id_str,created_at,retweet_count,favorite_count,text
0,669419501000200193,Wed Nov 25 07:37:00 +0000 2015,22,12,Learn to care less and just live life.
1,669402921155608577,Wed Nov 25 06:31:07 +0000 2015,19,20,"Tough times don't last, tough people do.."
2,669384771336863744,Wed Nov 25 05:19:00 +0000 2015,26,21,Life becomes easier when you delete the negative people from it.
3,669354646155186176,Wed Nov 25 03:19:18 +0000 2015,25,23,People with a sense of humor are so much easier to talk to.
4,669348549931462656,Wed Nov 25 02:55:04 +0000 2015,29,26,Nobody has a perfect life. Everbody has their own problems. Some people just know how to deal with them without revealing it.
5,669342497257209856,Wed Nov 25 02:31:01 +0000 2015,32,33,Don't trust too much. Don't love too much. Don't hope too much. Because that too much can hurt so much.
6,669335482178920448,Wed Nov 25 02:03:09 +0000 2015,41,23,"I'm not the person I used to be, I admit, a lot of shit got to me."
7,669328398481825792,Wed Nov 25 01:35:00 +0000 2015,39,48,"No one ever gets tired of loving. But everyone gets tired of waiting, assuming, hearing lies, saying sorry &amp; hurting."
8,669318885301223425,Wed Nov 25 00:57:12 +0000 2015,23,20,"Accept what you can't change, and change what you can't accept."
9,669309283121672193,Wed Nov 25 00:19:02 +0000 2015,29,29,"Sometimes good things fall apart so better things can fall together. Every story has an end, but in life every end is just a new beginning."
10,669302814267559936,Tue Nov 24 23:53:20 +0000 2015,22,16,Stay true to those who would do the same for you.
11,669296544856850433,Tue Nov 24 23:28:25 +0000 2015,33,37,"I'm done trying. If you want me in your life, let me know."
12,669286382318297088,Tue Nov 24 22:48:02 +0000 2015,39,29,"Life doesn't get easier, you just get stronger."
13,669276324536696832,Tue Nov 24 22:08:04 +0000 2015,41,30,"In the end you'll know who's fake, who's true, and who will risk it all for you."
14,669267755712053248,Tue Nov 24 21:34:02 +0000 2015,29,26,"If you spend your whole life regretting things in the past, you'll never get to enjoy the things in your present."
15,669259522960203777,Tue Nov 24 21:01:19 +0000 2015,39,30,The best way to avoid disappointment is to not expect anything from anyone.
16,669248925879181312,Tue Nov 24 20:19:12 +0000 2015,17,34,Just because something isn't happening for you right now doesn't mean that it will never happen. It means you're not ready for it.
17,669238096198791168,Tue Nov 24 19:36:10 +0000 2015,24,20,"Just because you miss someone, that doesn't mean they belong in your life."
18,669218727917969412,Tue Nov 24 18:19:12 +0000 2015,44,31,"Appreciate what you have right now, because you don't always get a second chance."
19,669203584261689344,Tue Nov 24 17:19:02 +0000 2015,24,25,"Hoes will always come back, but when a good woman is gone, she's gone forever.."
20,669193791136468996,Tue Nov 24 16:40:07 +0000 2015,24,17,"Leave the past, live the present, create the future."
21,669182702910873600,Tue Nov 24 15:56:03 +0000 2015,34,23,"Sometimes, it takes a good fall to really know where you stand.."
22,669167108526366724,Tue Nov 24 14:54:05 +0000 2015,39,44,Be with someone who knows exactly what they have when they have you. Not someone who will realize it once they've lost you.
23,669152772642705408,Tue Nov 24 13:57:07 +0000 2015,22,34,You know you truly care about someone when you have to try and convince yourself that you don't.
24,669135153084702720,Tue Nov 24 12:47:07 +0000 2015,52,34,Don't risk something you aren't willing to lose.
25,669122148154417153,Tue Nov 24 11:55:26 +0000 2015,49,40,You can never start the next chapter of your life if you keep re-reading the last one.
26,669106956288794624,Tue Nov 24 10:55:04 +0000 2015,26,16,"Some ""friends"" be haters on the side.. Watch out for that shit."
27,669090915986841600,Tue Nov 24 09:51:20 +0000 2015,15,39,"The moment you start caring about what other people think, is the moment you stop being yourself."
28,669072726653599744,Tue Nov 24 08:39:03 +0000 2015,38,25,"You are breathing, so you are blessed."
29,669057138556293120,Tue Nov 24 07:37:06 +0000 2015,50,50,Nobody texts faster than a pissed off female.
30,669040539061325824,Tue Nov 24 06:31:09 +0000 2015,27,23,Nothing worth having is easy to get.
31,669022408754507776,Tue Nov 24 05:19:06 +0000 2015,62,52,"When I fight with you, I'm really fighting for us. If I didn't care, I wouldn't bother."
32,669003780382400512,Tue Nov 24 04:05:05 +0000 2015,45,32,"I'm quick to say fuck it, and fuck you."
33,668992184687968256,Tue Nov 24 03:19:00 +0000 2015,39,29,"If your problem has a solution, do something about it. If your problem can't be solved, there is no need in worrying about it."
34,668986153886986240,Tue Nov 24 02:55:02 +0000 2015,54,45,Jealousy = I actually care about you.
35,668980140454641664,Tue Nov 24 02:31:09 +0000 2015,55,34,"I can't blame you for being who you are, I can only blame myself for thinking you were different."
36,668973131239981058,Tue Nov 24 02:03:18 +0000 2015,32,34,I always wonder who thinks of me.
37,668971604651700224,Tue Nov 24 01:57:14 +0000 2015,39,23,Learn to care less and just live life.
38,668966059664416768,Tue Nov 24 01:35:12 +0000 2015,50,45,She's the type of girl that can be so hurt but can still look at you &amp; smile.
39,668962010592333824,Tue Nov 24 01:19:06 +0000 2015,48,51,Find someone who wants you as much as you want them.
40,668955440701640704,Tue Nov 24 00:53:00 +0000 2015,80,53,Never give up on someone who means so much to you.
41,668949159832068097,Tue Nov 24 00:28:02 +0000 2015,38,23,I refuse to open up. I'm good with keeping my problems and shit to myself.
42,668939131519660032,Mon Nov 23 23:48:11 +0000 2015,53,53,Text me first. I like that shit
43,668929062824488960,Mon Nov 23 23:08:11 +0000 2015,54,38,Memories never die.
44,668831411126837249,Mon Nov 23 16:40:09 +0000 2015,51,54,"No matter how hard things may seem, there is always something good coming around the corner."
45,668820340148183040,Mon Nov 23 15:56:09 +0000 2015,28,43,"When someone shows you how they really are, Don't try to paint a new picture."
46,668804748670279680,Mon Nov 23 14:54:12 +0000 2015,21,19,The only thing I chase is paper??
47,668790373431537664,Mon Nov 23 13:57:05 +0000 2015,59,38,"Just because I didn't say shit, doesn't mean I didn't see it."
48,668772789504094208,Mon Nov 23 12:47:12 +0000 2015,67,57,"I no longer give a fuck, well, I do, but fuck it."
49,668759666223108096,Mon Nov 23 11:55:04 +0000 2015,35,35,Stop worrying about people that aren't worried about you.
50,668744550991687681,Mon Nov 23 10:55:00 +0000 2015,49,40,"It seems like everybody wants the truth, but nobody wants to be honest."
51,668728448655998977,Mon Nov 23 09:51:01 +0000 2015,57,30,"Don't leave a girl you need, for a girl you want."
52,668710335247986688,Mon Nov 23 08:39:02 +0000 2015,34,43,"Don't fuck with someone's feelings, just because you're unsure of your own."
53,668694723847131136,Mon Nov 23 07:37:00 +0000 2015,22,32,You're not gonna be in a relationship very long if you can't keep YOUR relationship business to yourself.
54,668678117725249536,Mon Nov 23 06:31:01 +0000 2015,121,67,"Just because I'm not talking, doesn't mean I'm in a bad mood. Sometimes I just like to be quiet."
55,668660015448879104,Mon Nov 23 05:19:05 +0000 2015,30,28,"If you're absent during my struggle, don't expect to be present during my success."
56,668641429414092801,Mon Nov 23 04:05:14 +0000 2015,39,23,"Haters will broadcast your failure, but whisper your success."
57,668629826203459584,Mon Nov 23 03:19:07 +0000 2015,64,66,"Fake friends are like shadows: always near you at your brightest moments, but nowhere to be seen at your darkest hour."
58,668623792151875584,Mon Nov 23 02:55:09 +0000 2015,28,45,"You never just stop loving someone, either you always will, or you never did in the first place."
59,668617785858236418,Mon Nov 23 02:31:17 +0000 2015,28,32,I don't forgive people because I'm weak. I forgive them because I am strong enough to know people make mistakes.
60,668610778069602304,Mon Nov 23 02:03:26 +0000 2015,45,33,"I don't want perfect, I want honest."
61,668603661736652800,Mon Nov 23 01:35:09 +0000 2015,25,27,"A real woman can do it on her own, but a real man won't let her."
62,668594097897230336,Mon Nov 23 00:57:09 +0000 2015,26,33,No girl wants to be with a guy that can't let other girls know he's taken.
63,668584505767297024,Mon Nov 23 00:19:02 +0000 2015,33,40,"When you stop chasing, they start noticing."
64,668577998073962496,Sun Nov 22 23:53:10 +0000 2015,32,44,"You're responsible for your own happiness. If you expect others to make you happy, you will always be disappointed."
65,668571726020788224,Sun Nov 22 23:28:15 +0000 2015,36,35,There are some people I'm kinda glad I'm not close to anymore.
66,668561598768939008,Sun Nov 22 22:48:01 +0000 2015,20,35,Sometimes letting go is what actually brings you closer.
67,668551575816769537,Sun Nov 22 22:08:11 +0000 2015,23,31,Sometimes the person you'd take a bullet for is the person behind the trigger.
68,668543034066395136,Sun Nov 22 21:34:14 +0000 2015,32,46,"Every time I give a fuck, it back fires on me.."
69,668534710805639168,Sun Nov 22 21:01:10 +0000 2015,32,25,"Sometimes the best thing to say is nothing, some people are not even worth your words."
70,668534706212888577,Sun Nov 22 21:01:09 +0000 2015,24,35,"I know we aren't close anymore, but I'll always care."
71,668524120821354496,Sun Nov 22 20:19:05 +0000 2015,43,41,"If you don't like me I'm cool with that, just don't pretend that you do."
72,668493955223392256,Sun Nov 22 18:19:13 +0000 2015,31,43,I'd rather be heartless than heartbroken..
73,668478809222610945,Sun Nov 22 17:19:02 +0000 2015,63,57,"I'm done trying to get your attention, if you want me, come find me."
74,668469017582182400,Sun Nov 22 16:40:08 +0000 2015,35,38,"Waking up every day is a blessing, not a privilege. Don't take it for granted.."
75,668458007118913538,Sun Nov 22 15:56:22 +0000 2015,44,39,I can't fuck with people that waste my time.
76,668442332606373888,Sun Nov 22 14:54:05 +0000 2015,40,36,"If they don't chase you when you walk away, keep walking. Fuck em."
77,668428002561232896,Sun Nov 22 13:57:09 +0000 2015,60,44,"I fall too fast, crash too hard, forgive too easy, and care too much."
78,668410348962205696,Sun Nov 22 12:47:00 +0000 2015,58,41,"If you don't like the situation you're in, change it. You are in control of your own life."
79,668397271654998016,Sun Nov 22 11:55:02 +0000 2015,70,44,"True friends don't care about the size of your house, or what brand of clothes you wear, 'cause it's never about wealth, it's about loyalty."
80,668382229563842560,Sun Nov 22 10:55:16 +0000 2015,29,31,"If something's bound to happen, it will happen.. Right time, right person, and for the best reason."
81,668366083334754304,Sun Nov 22 09:51:06 +0000 2015,69,54,I miss talking to the OLD you.
82,668347964629348353,Sun Nov 22 08:39:06 +0000 2015,33,25,"You're suppose to trust, but never get so comfortable to where you can't see the obvious.."
83,668332363710144512,Sun Nov 22 07:37:07 +0000 2015,84,57,I wish you knew my thoughts.
84,668315745307226112,Sun Nov 22 06:31:05 +0000 2015,50,53,"Many relationships can't work because sometimes even when you love the person, the timing is just wrong."
85,668297610013351936,Sun Nov 22 05:19:01 +0000 2015,19,34,"That ""what if"" feeling &lt;&lt;&lt;"
86,668279012217765889,Sun Nov 22 04:05:07 +0000 2015,32,25,I'm getting too old for the rumors. I'm over that shit...
87,668267433103372289,Sun Nov 22 03:19:06 +0000 2015,45,39,If you want me to trust you just be real and honest.
88,668261395419541504,Sun Nov 22 02:55:07 +0000 2015,70,41,"Don't ever mistake my silence for ignorance, my calmness for acceptance, or my kindness for weakness."
89,668255343923896325,Sun Nov 22 02:31:04 +0000 2015,27,24,"Don't be too dependent on other, because people leave, and in the end only you yourself stay."
90,668248423322251264,Sun Nov 22 02:03:34 +0000 2015,29,27,"The less you worry about what people think, the less complicated life becomes."
91,668241244192178177,Sun Nov 22 01:35:02 +0000 2015,44,28,Keep going until you make it.
92,668231699105452032,Sun Nov 22 00:57:06 +0000 2015,26,18,You can't shine if you don't grind.
93,668222111220178945,Sun Nov 22 00:19:00 +0000 2015,37,27,Never settle for less!
94,668215576695873536,Sat Nov 21 23:53:02 +0000 2015,68,33,"Enjoy life, laugh a lot and realize how blessed you are."
95,668209330999685120,Sat Nov 21 23:28:13 +0000 2015,80,48,"You reach a point in your life when you realize who really matters, who never did, and who always will."
96,668199208416116736,Sat Nov 21 22:48:00 +0000 2015,48,26,"At this point I don't even care. I'm just going with the flow. Whatever happens, happens."
97,668189234340208640,Sat Nov 21 22:08:22 +0000 2015,39,32,Never make someone a priority when your just an option.
98,668180597890748416,Sat Nov 21 21:34:03 +0000 2015,45,34,"Don't force someone to make time for you, if they really want to, they will."
99,668172372407644160,Sat Nov 21 21:01:22 +0000 2015,24,25,"You don't have to be in a relationship, just to have someone to be down for you.."
100,668161740723634177,Sat Nov 21 20:19:07 +0000 2015,39,49,She's a keeper. Too bad you didn't keep her.
101,668150930618060800,Sat Nov 21 19:36:10 +0000 2015,64,33,"I got a smile on my face, and a fuck you attitude."
102,668131572340662273,Sat Nov 21 18:19:14 +0000 2015,50,38,"I don't want perfect, I want real."
103,668116451828592640,Sat Nov 21 17:19:09 +0000 2015,30,26,Sometimes you just need to distance yourself from people and their shit.
104,668106600163483649,Sat Nov 21 16:40:00 +0000 2015,40,25,Either fuck with me 100% or don't fuck with me at all.
105,668095558867898369,Sat Nov 21 15:56:08 +0000 2015,79,32,"No fucks taken, no fucks given.."
106,668079944216522752,Sat Nov 21 14:54:05 +0000 2015,71,79,"Relationships where you can just chill at each other's house, make each other laugh, cuddle, take pics, &amp; tell each other everything."
107,668065635285487617,Sat Nov 21 13:57:14 +0000 2015,56,40,"I rather cuddle and watch a movie with you, instead of going out to a party."
108,668047969044811776,Sat Nov 21 12:47:02 +0000 2015,81,60,"I care, but I'm done trying."
109,668034918170144769,Sat Nov 21 11:55:10 +0000 2015,64,40,Do not pray for an easy life. Pray for the strength to endure a difficult one.
110,668019849080213504,Sat Nov 21 10:55:17 +0000 2015,44,43,I actually take relationships seriously.
111,668003676087328769,Sat Nov 21 09:51:01 +0000 2015,31,41,"Find someone who's going to be faithful to you all the time, not just when you do something for them."
112,667985621756047361,Sat Nov 21 08:39:17 +0000 2015,31,26,Doubt me. Hate me. Tear me down. You're the inspiration I need.
113,667970016172752896,Sat Nov 21 07:37:16 +0000 2015,32,32,If we had visiting hours to heaven. &gt; &gt; &gt; &gt; &gt; &gt; &gt; &gt; &gt; &gt; &gt; &gt; &gt; &gt; &gt; &gt; &gt; &gt; &gt; &gt; &gt; &gt; &gt; &gt; &gt; &gt; &gt; &gt; &gt; &gt; &gt; &gt;
114,667953367923236864,Sat Nov 21 06:31:07 +0000 2015,38,53,"I am Thankful for everyday even if its good, bad, or sad. Cause I know that God is there for me no matter what."
115,667935223829667840,Sat Nov 21 05:19:01 +0000 2015,46,36,Giving a fuck = Getting fucked over.
116,667916615216951296,Sat Nov 21 04:05:05 +0000 2015,45,29,R&gt;E&gt;A&gt;L&gt; Remember. Everybody. Ain't. Loyal.
117,667905020000645121,Sat Nov 21 03:19:00 +0000 2015,32,26,"Respect some, trust few, and take none for granted.."
118,667898994874564608,Sat Nov 21 02:55:03 +0000 2015,32,37,A good relationship is worth the wait.
119,667892947153743872,Sat Nov 21 02:31:02 +0000 2015,36,31,"We both make mistakes, we got to move on .."
120,667885912265723904,Sat Nov 21 02:03:04 +0000 2015,31,20,"If it's real, you know, if it's not, let go."
121,667878851029151744,Sat Nov 21 01:35:01 +0000 2015,59,52,Fuck what you heard. Try asking me first.
122,667869307821531140,Sat Nov 21 00:57:06 +0000 2015,28,30,"I heard you're doing you, and you heard I'm doing better."
123,667859736210067456,Sat Nov 21 00:19:04 +0000 2015,39,39,"The past cannot be changed, forgotten, edited, or erased. It can only be accepted."
124,667853179569184769,Fri Nov 20 23:53:00 +0000 2015,40,36,Never get too attached.
125,667846886368387072,Fri Nov 20 23:28:00 +0000 2015,40,20,I speak my mind because it hurts to bite my tongue.
126,667836850560770048,Fri Nov 20 22:48:07 +0000 2015,64,48,"You can break down a women temporarily' but a real women will always pick up the pieces, rebuild herself, and come back stronger than ever."
127,667826813721145344,Fri Nov 20 22:08:14 +0000 2015,85,67,Why hurt a girl who would never hurt you?
128,667818268275572736,Fri Nov 20 21:34:17 +0000 2015,31,45,"No girl wants to hear about your ""other girls"""
129,667809945786576898,Fri Nov 20 21:01:13 +0000 2015,33,40,It is never too late to make things right.
130,667799328677896192,Fri Nov 20 20:19:01 +0000 2015,38,60,"You get in the biggest fights with the people you care about the most, because they are the relationships you're willing to fight for."
131,667788540730810368,Fri Nov 20 19:36:09 +0000 2015,34,21,"Live your life, take chances, be crazy. Dont wait cause right now is the oldest you've ever been &amp; the youngest you'll be."
132,667769195887767552,Fri Nov 20 18:19:17 +0000 2015,68,60,"Every girl wants a bad boy, who will be good just for them, and every boy wants a good girl, who will be bad just for them."
133,667754060116815873,Fri Nov 20 17:19:08 +0000 2015,39,42,"I try not to miss you. But in the end, I still do..."
134,667744213648457728,Fri Nov 20 16:40:01 +0000 2015,39,31,"Roll up your stress , and burn the rest.."
135,667733143781310464,Fri Nov 20 15:56:02 +0000 2015,46,43,"A year ago, I would've never guessed my life would be the way it is now."
136,667717537287794688,Fri Nov 20 14:54:01 +0000 2015,52,40,"Less expectations, less disappointment."
137,667703234715340800,Fri Nov 20 13:57:11 +0000 2015,45,54,"Only fall in love when you're ready, not when you're lonely."
138,667685631221460992,Fri Nov 20 12:47:14 +0000 2015,104,78,"I'll never chase a friendship. That's just not me. If we're cool, cool. If we're not, that's cool too. Life goes on."
139,667672535270584320,Fri Nov 20 11:55:11 +0000 2015,73,48,R.I.P. to the hoes dying for attention.
140,667657414242639872,Fri Nov 20 10:55:06 +0000 2015,59,27,Actions always prove why words mean nothing.
141,667641283528237056,Fri Nov 20 09:51:00 +0000 2015,36,37,Don't fall for the wrong person just because they know how to say the right things.
142,667623199203545088,Fri Nov 20 08:39:09 +0000 2015,38,37,"Never assume. Never ask. And never demand. Just let it be. If it's meant to be, it will happen."
143,667607576125775872,Fri Nov 20 07:37:04 +0000 2015,45,21,"To change your life, you have to change yourself. To change yourself, you have to change your mindset."
144,667590996440571904,Fri Nov 20 06:31:11 +0000 2015,45,30,"Nobodys perfect, but you're perfect for me."
145,667572857141108737,Fri Nov 20 05:19:06 +0000 2015,70,52,"You must be one hell of a person to hear me say ""I love you."""
146,667554240106250240,Fri Nov 20 04:05:08 +0000 2015,31,30,It takes a REAL man to realize that only ONE ?? female is enough... ??
147,667542670538113024,Fri Nov 20 03:19:09 +0000 2015,126,103,"No calls, no texts, nothing. But here I am thinking about you like crazy."
148,667536731823063040,Fri Nov 20 02:55:33 +0000 2015,27,39,"Ain't no sex like that ""we ain't fucked in a while"" sex."
149,667530600002228224,Fri Nov 20 02:31:11 +0000 2015,42,32,The moment you catch feelings...that's when everything changes....
150,667523635503067137,Fri Nov 20 02:03:31 +0000 2015,72,42,Why stress over something you can't change.
151,667516478971887616,Fri Nov 20 01:35:05 +0000 2015,62,62,I hate when I forget to press send and I'm sitting there like an idiot waiting for a reply.
152,667506904126627841,Fri Nov 20 00:57:02 +0000 2015,35,37,A relationship where you're both weird &gt;
153,667497336558493697,Fri Nov 20 00:19:01 +0000 2015,58,40,Don't ever forget who was there for you when no one else was.
154,667490809177075712,Thu Nov 19 23:53:04 +0000 2015,47,40,Apologies don't mean shit after a while.
155,667484529418964992,Thu Nov 19 23:28:07 +0000 2015,38,50,If you want me to trust you just be real and honest.
156,667474470228070400,Thu Nov 19 22:48:09 +0000 2015,29,30,"The more you try not to care, the more you end up caring."
157,667464421254553601,Thu Nov 19 22:08:13 +0000 2015,67,40,People always give a fuck when it's too late...
158,667455849418334209,Thu Nov 19 21:34:09 +0000 2015,44,21,(G)et (R)eady (I)t's a (N)ew (D)ay
159,667447591827820545,Thu Nov 19 21:01:21 +0000 2015,44,33,"Wait for what you deserve. Don't settle, just be patient."
160,667436951956516864,Thu Nov 19 20:19:04 +0000 2015,47,37,The best things happen unexpectedly.
161,667426161350336512,Thu Nov 19 19:36:11 +0000 2015,31,26,Things won't get better unless you think better.
162,667406765709987840,Thu Nov 19 18:19:07 +0000 2015,24,31,"Don't expect someone who gets around, to stick around."
163,667391644640088064,Thu Nov 19 17:19:02 +0000 2015,82,68,"Whenever I find a song that relates to my current situation, I listen to it over and over."
164,667381877578297345,Thu Nov 19 16:40:13 +0000 2015,67,45,I don't need anyone that doesn't need me..
165,667370905341927424,Thu Nov 19 15:56:37 +0000 2015,37,37,Good people do bad things. Learn to forgive and move on.
166,667355161950597121,Thu Nov 19 14:54:04 +0000 2015,110,63,Lie to me and watch how fast I lose interest.
167,667340903502192640,Thu Nov 19 13:57:24 +0000 2015,64,46,"Trust is like paper. Once it's crumbled, it can never be perfect again."
168,667323211986681856,Thu Nov 19 12:47:06 +0000 2015,62,61,"You're everything I was looking for, when I wasn't even looking."
169,667310121463083008,Thu Nov 19 11:55:05 +0000 2015,54,55,"Those who are heartless, once cared too much.."
170,667295003484381185,Thu Nov 19 10:55:01 +0000 2015,49,39,Don't apologize for something you plan on doing again.
171,667280456392413184,Thu Nov 19 09:57:12 +0000 2015,25,28,Sometimes you just outgrow people.
172,667260819474894849,Thu Nov 19 08:39:11 +0000 2015,32,28,"When a girl says ""do whatever you want."" do not do whatever you want."
173,667245221965598720,Thu Nov 19 07:37:12 +0000 2015,60,25,I distance myself from bullshit..
174,667228562584375296,Thu Nov 19 06:31:00 +0000 2015,73,52,"Be with someone who brings out the best in you, not the stress in you.."
175,667210455853768704,Thu Nov 19 05:19:03 +0000 2015,79,63,Don't think too much. You'll create a problem that wasn't even there in the first place.
176,667191832170864640,Thu Nov 19 04:05:03 +0000 2015,36,40,"Half the shit you think I don't know, I found out a long time ago."
177,667180270337040384,Thu Nov 19 03:19:06 +0000 2015,50,44,"The past cannot be changed, forgotten, edited, or erased. It can only be accepted."
178,667174215695642624,Thu Nov 19 02:55:03 +0000 2015,41,43,Don't fall for the wrong person just because they know how to say the right things.
179,667168199092412419,Thu Nov 19 02:31:08 +0000 2015,85,53,Sometimes the people who act the happiest are really the ones who are going through the most.
180,667161141173440512,Thu Nov 19 02:03:05 +0000 2015,44,30,I'm single because I'm waiting for the right time in the right place with a right person.
181,667154116091772929,Thu Nov 19 01:35:11 +0000 2015,34,39,"When you let the right people come into your life, good things start to happen."
182,667144525412966400,Thu Nov 19 00:57:04 +0000 2015,39,36,I cut people off like it's nothing
183,667134951226216448,Thu Nov 19 00:19:01 +0000 2015,61,39,"If you still talk about it, you still care about it."
184,667128431889522688,Wed Nov 18 23:53:07 +0000 2015,22,24,The best way to appreciate someone is to imagine your life without them.
185,667122112914698244,Wed Nov 18 23:28:00 +0000 2015,65,46,Girls remember everything.
186,667112057301557248,Wed Nov 18 22:48:03 +0000 2015,65,33,Stay strong. Even when it feels like everything is falling apart..
187,667102016926318592,Wed Nov 18 22:08:09 +0000 2015,41,35,The people that still focus on their past wont ever move on.
188,667093480443899904,Wed Nov 18 21:34:14 +0000 2015,58,39,"The older I get, the less patience for bullshit I have.."
189,667085245913694212,Wed Nov 18 21:01:31 +0000 2015,43,29,"Don't stress it, God knows what he is doing."
190,667074583338590210,Wed Nov 18 20:19:08 +0000 2015,31,22,"In life, it doesn't matter what you have.. what matters is who you have."
191,667063746028785664,Wed Nov 18 19:36:05 +0000 2015,50,39,"Don't judge what people do, if you don't know what they've been through."
192,667044368151355392,Wed Nov 18 18:19:05 +0000 2015,18,21,Never been the type to trip over little shit..
193,667029298453291008,Wed Nov 18 17:19:12 +0000 2015,42,30,"Never stop learning, because life never stops teaching."
194,667019490442518528,Wed Nov 18 16:40:13 +0000 2015,49,30,I'm tired of going out of my way for people that don't deserve it..
195,667008396713926656,Wed Nov 18 15:56:08 +0000 2015,73,60,Stay strong. Even when it feels like everything is falling apart.
196,666992760554131456,Wed Nov 18 14:54:00 +0000 2015,45,36,Karma has no menu. You get served what you deserve.
197,666978542245289987,Wed Nov 18 13:57:30 +0000 2015,146,71,Age doesn't define maturity. Some people will never grow up..
198,666960816634228736,Wed Nov 18 12:47:04 +0000 2015,41,48,"Sometimes you have to let things go, so there's room for better things to come into your life."
199,666947802291916800,Wed Nov 18 11:55:22 +0000 2015,65,44,Loyalty will get you far.
