,id_str,created_at,retweet_count,favorite_count,text
0,668888656527015936,Mon Nov 23 20:27:37 +0000 2015,2,1,"Our YMCA has a saying, ""Promote what you love, instead of complaining about the things you hate."" https://t.co/M2w1hm3E9c"
1,667763172627972096,Fri Nov 20 17:55:21 +0000 2015,0,8,"Let's show people more of the Love of Christ, and less of the Wrath of God and let God be in charge of His own Wrath https://t.co/eNS8ooSN2j"
2,667403151788511233,Thu Nov 19 18:04:45 +0000 2015,0,0,Of all the things I am thankful for I am most thankful for the Love Christ has shown me. https://t.co/xetZ57Vkfr
3,667084455236898816,Wed Nov 18 20:58:22 +0000 2015,3,6,"Do unto others, as you would have them do unto you. Somebody said that once. https://t.co/92UgWpqO8J"
4,666683635819352064,Tue Nov 17 18:25:39 +0000 2015,4,8,"To be an ambassador of Christ, I must not be caught up in the noise of the day, but be a respite for others. https://t.co/p1SWclHN64"
5,666348652345098240,Mon Nov 16 20:14:33 +0000 2015,3,6,"Father, give me your words to give others comfort and to know that You want to be with them. https://t.co/R208FQmHFn"
6,665306974909689857,Fri Nov 13 23:15:18 +0000 2015,5,6,"Father, continue to nudge me into new adventures, while reminding me those you've given me already. https://t.co/vXBaUkoHT7"
7,664945441830645760,Thu Nov 12 23:18:42 +0000 2015,4,8,IMy prayer is that we all choose to see the beauty in God’s creation. https://t.co/MFKUgJnhf4
8,664509779788722176,Wed Nov 11 18:27:32 +0000 2015,38,59,"Not all superheros wear capes. Thank You, Veterans! https://t.co/sKiDcBr4ry"
9,664185807045955584,Tue Nov 10 21:00:11 +0000 2015,10,21,Let us not be so focused on the big things that we miss all the beautiful little things that Christ is doing in us. https://t.co/WrcqEMbvaS
10,663846139448328192,Mon Nov 09 22:30:27 +0000 2015,1,1,Taster flights: Because beer is good and decisions are hard. https://t.co/AowwmEDRIV
11,662791195823767552,Sat Nov 07 00:38:29 +0000 2015,1,6,"If my job is to present the Good News to people, I better make sure that I am communicating well. https://t.co/cfhtKE4Gnr"
12,662377764520005633,Thu Nov 05 21:15:40 +0000 2015,3,5,"My prayer is that this book helps you see Christ in the everydayness of life.
https://t.co/07hdmzJKy6 https://t.co/YnbEGtMLc2"
13,662006554711863296,Wed Nov 04 20:40:36 +0000 2015,1,3,Lazarus come forth! https://t.co/oyxl8ZA4xp
14,661747868835844097,Wed Nov 04 03:32:41 +0000 2015,1,1,"What kind of tunes did the mummy enjoy at the Harvest Party?
Wrap music. https://t.co/qJ821qhT3V"
15,660180620979531776,Fri Oct 30 19:45:00 +0000 2015,0,0,Hope to see you all there tonight at 6pm! https://t.co/T7yplKrbLj
16,659802425667129344,Thu Oct 29 18:42:11 +0000 2015,0,0,"The 11th Annual Harvest party at the Y is TOMORROW!
Bring your kids out at 6pm for some great family fun! https://t.co/4IRouVQnp7"
17,659448982939144192,Wed Oct 28 19:17:44 +0000 2015,0,0,"Come join me this Friday for the 11th Annual Harvest party at the Y.
And don't forget to put your face on! https://t.co/e1JIqNH13n"
18,659055371252699136,Tue Oct 27 17:13:39 +0000 2015,3,6,"Father, give me Your words to comfort others and to let them know that You want to be with them, That they have hope https://t.co/eMCfZay5Xw"
19,658700192128995328,Mon Oct 26 17:42:18 +0000 2015,4,6,"My prayer is that we all choose to see the beauty in God’s creation, to see a leaf dance. https://t.co/9rgPyyasQJ"
20,657665341150117888,Fri Oct 23 21:10:10 +0000 2015,1,4,"Help me lord see the many little things. 
In them is the big thing. 
Amen. https://t.co/mvh9hQaFxc"
21,656917765043847168,Wed Oct 21 19:39:34 +0000 2015,3,2,"Many hands make light work.
If we all just do the little bit that we can, a whole lot can be done. https://t.co/Hslv4TH5y4"
22,656555850027266048,Tue Oct 20 19:41:27 +0000 2015,6,8,"May we have the eyes to see the possibility of a miracle, and the courage to act on this possibility. https://t.co/GlQcwaNPUJ"
23,656221637252026368,Mon Oct 19 21:33:24 +0000 2015,1,1,"If you haven't had a chance to read my book yet,
I'd be honored if you did
https://t.co/07hdmzJKy6 https://t.co/aNuKlQlJ3j"
24,655153878317469696,Fri Oct 16 22:50:31 +0000 2015,8,9,"Trust in the LORD forever, For in GOD the LORD, we have an everlasting Rock. -Isaiah 26:4 http://t.co/zWvmjyoRxT"
25,654715316719607808,Thu Oct 15 17:47:50 +0000 2015,2,2,"Father, I want to celebrate you everyday. http://t.co/JRuFmuhExC"
26,654006089076183040,Tue Oct 13 18:49:37 +0000 2015,5,5,"We have the opportunity everyday to positively impact a person’s life. 
Look for the opportunities God gives us. http://t.co/dcn9N55xf5"
27,653641341897863168,Mon Oct 12 18:40:14 +0000 2015,3,2,Let's not be so focused on trying to see the big things that we miss the little things that Christ is doing. http://t.co/ohtopLRHEd
28,652521634079707136,Fri Oct 09 16:30:55 +0000 2015,3,3,"Go into the great unknown.

Give God the opportunity to show you great things. http://t.co/NFmObbVXvU"
29,652241733535731712,Thu Oct 08 21:58:41 +0000 2015,0,0,"If you've enjoyed these postings, consider purchasing my book!
http://t.co/07hdmzJKy6 http://t.co/5C3HvJqMeC"
30,651846453527097344,Wed Oct 07 19:47:59 +0000 2015,0,0,Save the date and bring out your kids! http://t.co/B4Ly7dxKtD
31,651478135616110592,Tue Oct 06 19:24:26 +0000 2015,2,6,"Whether life is going great or you're having a tough time; remember these things. 
God loves you. 
Christ is with you http://t.co/1f0QimOgny"
32,651174783246176260,Mon Oct 05 23:19:01 +0000 2015,3,7,"I sit here amidst your splendor, I am in awe. http://t.co/ZZUAgVRlr3"
33,650030514057773056,Fri Oct 02 19:32:06 +0000 2015,1,4,"Lord, Give me the courage to look at people as your creation not just as ""other people"". http://t.co/kDIl6BQDmM"
34,649662384336863232,Thu Oct 01 19:09:17 +0000 2015,2,0,Please join me in praying for the students and families of Umpqua Community College.
35,649298539403542529,Wed Sep 30 19:03:29 +0000 2015,2,7,"Father, continue to nudge me into adventures, while reminding me of the adventures that You had given me already. http://t.co/s4WaBgQpRe"
36,648954482877853696,Tue Sep 29 20:16:20 +0000 2015,4,10,"""Set your minds on things above, not on earthly things."" 
- Col 3:2 http://t.co/F1peOMONeI"
37,648551899927416832,Mon Sep 28 17:36:37 +0000 2015,0,4,"‘I’m telling the truth: Whenever you did one of these things to someone overlooked, that was me—you did it to me.’ http://t.co/khTpI1wVo7"
38,647517117634342912,Fri Sep 25 21:04:45 +0000 2015,5,6,"...And there I find you in the mystery, 
my faith will stand. http://t.co/yoLkftote9"
39,647149141441667072,Thu Sep 24 20:42:33 +0000 2015,0,2,You call me out upon the waters. http://t.co/ZxmELCKHpO
40,646738378868678656,Wed Sep 23 17:30:19 +0000 2015,2,10,"I went where my feet did fail. 
God showed me that it is better to try and fail than to never try at all. http://t.co/QBmT1tusTH"
41,646358790657302528,Tue Sep 22 16:21:59 +0000 2015,2,7,"Lord, forgive me for judging others. Give me that gentle nudge to stop and see where I need to change. http://t.co/k4GBSyVnN5"
42,646061910559879168,Mon Sep 21 20:42:17 +0000 2015,2,3,"Lord, Give me Grace as I extend Grace to others. Help me be a more loving person. http://t.co/UKzdnBfS0n"
43,644969662648709120,Fri Sep 18 20:22:05 +0000 2015,1,7,"""Love the Lord your God with all your heart and with all your soul and with all your mind.""
- Matthew 22:37 http://t.co/62JkrdVoet"
44,644612285223141376,Thu Sep 17 20:41:59 +0000 2015,0,2,"A day in the life of the chaplain.
A day full of pain.
A day full of possibilities.
A day full of wonderment. http://t.co/kLMHj7vVE0"
45,643875554970718209,Tue Sep 15 19:54:29 +0000 2015,0,1,"Here's a great testimonial video that was made for the YMCA Chaplaincy dinner.

Watch here: https://t.co/Tz6RETG1QT"
46,641658505800257536,Wed Sep 09 17:04:43 +0000 2015,0,1,"Seats still remain for our annual Chaplaincy Dinner. Please contact Norm, NWelsh@ymcacw.org if you'd like to attend! http://t.co/LdeuR4hPMP"
47,641294895613784064,Tue Sep 08 16:59:52 +0000 2015,3,3,I will endeavor to be more awake. http://t.co/LtySJlsBBD
48,640936801968898048,Mon Sep 07 17:16:56 +0000 2015,1,1,"""And people should eat and drink and enjoy the fruits of their labor, for these are gifts from God."" http://t.co/kbrmqH4qVN"
49,639904130539089920,Fri Sep 04 20:53:28 +0000 2015,2,4,My prayer is that I will be the best friend that I can and show people a bit of Christ along their journey. http://t.co/KE4UyJe0UX
50,639570874941640704,Thu Sep 03 22:49:13 +0000 2015,1,1,"Dancing with God is healing people, and bringing people to Christ. Plz recommend"
51,639491153994252288,Thu Sep 03 17:32:26 +0000 2015,1,3,"Lord, remind us that you are there to talk with, to contemplate with.
Keep our thoughts on heavenly things. http://t.co/G6X7zSs5zr"
52,639189844254572544,Wed Sep 02 21:35:09 +0000 2015,1,5,"Father, help me focus on You and give me words for others that understand they can't earn their way into Heaven. http://t.co/J6QgE9cpSw"
53,638811155369070592,Tue Sep 01 20:30:22 +0000 2015,1,3,"Lord, give me Your eyes, Your ears, Your mouth, Your heart. http://t.co/IJsMWgk5kJ"
54,638404911491735552,Mon Aug 31 17:36:06 +0000 2015,0,4,I pray we all stop trying to save the whole world and be intentional about saving the piece that in front of us. http://t.co/LpevDKjynE
55,637357675764813824,Fri Aug 28 20:14:46 +0000 2015,3,2,"My Prayer: ""God, speak to me so I get it. http://t.co/qA0tfaGOc8"
56,636966976426938368,Thu Aug 27 18:22:16 +0000 2015,1,2,I learned not to put off till tomorrow the important things that I could do today. http://t.co/OGkQMq4RmR
57,636574884131311616,Wed Aug 26 16:24:14 +0000 2015,2,6,"Love and forgiveness, two concepts that we need to put into practice! http://t.co/2WC9QMt5v1"
58,636265963067867137,Tue Aug 25 19:56:41 +0000 2015,1,5,"How many times I have sleep walked through the day and didn’t notice my neighbor?

I will endeavor to be more awake. http://t.co/Cqv0RJv1CW"
59,635941418792431616,Mon Aug 24 22:27:04 +0000 2015,2,2,"Get ""Dancing with God"" now! http://t.co/e1CwG4cj9v http://t.co/oeTsG2Ox7Z"
60,634825429224853504,Fri Aug 21 20:32:31 +0000 2015,1,4,"Lord, 
Forgive me for judging others. Conform me Lord into your image not for my sake but for the sake of others. http://t.co/vUrymeabMx"
61,634411853892812800,Thu Aug 20 17:09:07 +0000 2015,0,3,If someone never takes that hard look at themselves they may never go from good to great. http://t.co/KG4GRYT81s
62,634105763854598145,Wed Aug 19 20:52:49 +0000 2015,2,2,Of all the things I am thankful for I am most thankful for the Love Christ has shown me. http://t.co/8WSuNB4gwH
63,633760674829594624,Tue Aug 18 22:01:34 +0000 2015,1,2,"Life is worth living.
Heaven is worth looking forward to. http://t.co/e6p4An2QLm"
64,633323252211777536,Mon Aug 17 17:03:24 +0000 2015,0,2,"My Prayer: ""God, speak to me so I get it. http://t.co/DcqP1JMEUT"
65,632396108212232192,Sat Aug 15 03:39:16 +0000 2015,0,2,Today was the last day of the lunch program. We fed over 2K meals. Today the kids gave me a huge thank you card. I'm totally blessed by them
66,631574187786670080,Wed Aug 12 21:13:15 +0000 2015,1,3,"Lord, 
Forgive me for judging others. Conform me Lord into your image not for my sake but for the sake of others. http://t.co/taSq9bPOLA"
67,631199847027052544,Tue Aug 11 20:25:45 +0000 2015,0,0,Thank you to all our volunteers &amp; Share of VanWa. for helping us be devoted to feeding kids this summer. http://t.co/pKXuu9vZrs
68,629760818641440769,Fri Aug 07 21:07:34 +0000 2015,0,5,"I am humbled to be part of Christs redemptive work, giving me the opportunity to show people His love and His desire for their lives."
69,629341094577336320,Thu Aug 06 17:19:44 +0000 2015,0,3,If you are going through a “rainy” season in life know that the sun will come out again. http://t.co/ssD0x8kh89
70,629034593027424256,Wed Aug 05 21:01:48 +0000 2015,0,2,There are many opportunities to Be Christ’s hands and feet every day. http://t.co/79p2cJfmcX
71,628795663191412736,Wed Aug 05 05:12:23 +0000 2015,0,1,@katlynmeadows81 Praying!
72,628668736988254208,Tue Aug 04 20:48:01 +0000 2015,0,3,"My prayer is that while I sit in my house by the side of the road, &amp; be the friend that I can, I show people Christ along their Journey."
73,628377505066385412,Tue Aug 04 01:30:46 +0000 2015,0,2,"Through life, I cannot see God's plan looking forward. Only when I look behind me that I get to see what He is doing. http://t.co/wh50TcSzY9"
74,627221550991720449,Fri Jul 31 20:57:25 +0000 2015,0,0,"How many times I have sleep walked through the day and didn’t notice my neighbor.""

I will endeavor to be more awake. http://t.co/X8aMchNi8e"
75,626797168028823552,Thu Jul 30 16:51:04 +0000 2015,0,3,"Our YMCA has a saying, ""Promote what you love, instead of complaining about the things you hate."" http://t.co/twINxe8YXH"
76,626507595927261184,Wed Jul 29 21:40:25 +0000 2015,3,3,We're feeding hundreds of kids every weekday at the Y! We couldn't do it without YOUR support &amp; volunteers like YOU. http://t.co/HFE6cArIoj
77,626124288156762112,Tue Jul 28 20:17:17 +0000 2015,0,1,Let's not be so focused the big things in our world that we miss all the beautiful little things that Christ is doing http://t.co/vQgCqTjTv2
78,625816163193229312,Mon Jul 27 23:52:55 +0000 2015,0,1,"""If I gave everything I have to the poor and even my body, I didn't love others, I will have gained nothing."" 1 Corinthians 13:3"
79,624705841053106177,Fri Jul 24 22:20:53 +0000 2015,3,2,Christ never meant for us to be so focused on Him that we let the world and those around us go to hell. http://t.co/WTj83EH3kE
80,624342419249590272,Thu Jul 23 22:16:47 +0000 2015,0,0,"Help us raise $20,000 to do good and spread the Good News! Donate any amount big or small at http://t.co/0h3gf1pPeL! http://t.co/od8W39M6OZ"
81,621460146405834752,Wed Jul 15 23:23:39 +0000 2015,0,0,"Help us raise $20,000 to do good and spread the Good News! Donate any amount big or small at http://t.co/0h3gf1pPeL! http://t.co/RJDbojSx5W"
82,621054695059001344,Tue Jul 14 20:32:32 +0000 2015,0,1,"Sam the Balloon Man showed up for our neighborhood lunch today. 

Excitement ensued! http://t.co/ENu2roGAkj"
83,621024191433670656,Tue Jul 14 18:31:19 +0000 2015,0,0,"A few words about Pluto
Daily Bread for Ragamuffins http://t.co/X5wwyZ1Xf8"
84,619190015310983168,Thu Jul 09 17:02:58 +0000 2015,0,1,Because of YOU many kids are able to take swim lessons by being sponsored through YMCA Chaplaincy. http://t.co/RGQWxcGvSi
85,618887079796215808,Wed Jul 08 20:59:12 +0000 2015,4,5,"Lord, 
Forgive me for judging others. Conform me Lord into your image not for my sake but for the sake of others. http://t.co/I0I4ZQL4A6"
86,618516214080385024,Tue Jul 07 20:25:31 +0000 2015,0,1,Thank you to our many volunteers that make it possible for us to help feed kids everyday this summer. http://t.co/3gSBk4GqHX
87,618110326555291648,Mon Jul 06 17:32:40 +0000 2015,0,1,"The YMCA is that place where you can come to experience the healing of broken body from abuse, injury and disease. http://t.co/SvUlnViKGo"
88,617700586750873600,Sun Jul 05 14:24:30 +0000 2015,0,0,"We had a wonderful Fourth of July
Daily Bread for Ragamuffins http://t.co/X5wwyYKmnA"
89,616646204986781696,Thu Jul 02 16:34:46 +0000 2015,2,6,"How many times I have sleep walked through the day and didn’t notice my neighbor?

I will endeavor to be more awake. http://t.co/WZxLl83RSO"
90,616351344694161408,Wed Jul 01 21:03:06 +0000 2015,0,1,Thank you to all our volunteers &amp; Share of VanWa. for helping us devoted to feeding 400 meals each day to kids. http://t.co/62AzjELC7R
91,615997072349659136,Tue Jun 30 21:35:21 +0000 2015,0,3,"Father, 
Continue to call me out upon the waters. http://t.co/GkekBuqW1r"
92,615915620224217088,Tue Jun 30 16:11:41 +0000 2015,0,0,"Who's Your Neighbor?
Daily Bread for Ragamuffins http://t.co/X5wwyZ1Xf8"
93,615626464457682944,Mon Jun 29 21:02:41 +0000 2015,1,1,"Help us provide 400 meals to kids in need all summer long. 
Any amount helps. Donate at: http://t.co/0h3gf1pPeL! http://t.co/ED19PE9j6c"
94,614531149759549440,Fri Jun 26 20:30:18 +0000 2015,0,2,"Lord, please help us and remind us that you are there to talk with. http://t.co/xM91mUOpEq"
95,614117550188707840,Thu Jun 25 17:06:48 +0000 2015,0,1,The 'Y' is a place where you can come and experience a sense of belonging. http://t.co/5sbmHJfYX2
96,613813041952501760,Wed Jun 24 20:56:47 +0000 2015,0,1,"It is one thing to talk about Grace, it is quite another to truly feel it in your heart. http://t.co/89EHGFkIJY"
97,613455211324010496,Tue Jun 23 21:14:54 +0000 2015,0,0,"Help send kids to Camp Collins by supporting Rogers Race! 
Donate any amount at http://t.co/0h3gf1pPeL ! http://t.co/rswpmEMLmW"
98,613115471953399812,Mon Jun 22 22:44:54 +0000 2015,0,0,We're blessed to have a Y in our community that emphasizes the C in YMCA. It's Christ's love empowering us to serve. http://t.co/WMgKom6tRf
99,613115143321337856,Mon Jun 22 22:43:35 +0000 2015,0,0,@katlynmeadows81 Praying!!
100,612025122333954048,Fri Jun 19 22:32:14 +0000 2015,0,0,We are doing many wonderful things in our community. To help continue the work donate at http://t.co/0h3gf1pPeL http://t.co/682OAmbzAa
101,611588265318092800,Thu Jun 18 17:36:19 +0000 2015,0,0,We're partnering with Share of Van. Wa. to feed kids this summer that would otherwise go hungry. We need your help! http://t.co/azjRrq1ifF
102,611291308163006464,Wed Jun 17 21:56:19 +0000 2015,0,0,YMCA Chaplaincy is involved in Community Outreach projects year round! Donate:http://t.co/0h3gf18end! http://t.co/QCVbD1EkAh
103,610908399706857472,Tue Jun 16 20:34:47 +0000 2015,0,0,"With many events and projects going on all year long we NEED you!
 Donate any amount at http://t.co/0h3gf1pPeL! http://t.co/sVSrRgR0en"
104,610490470775435264,Mon Jun 15 16:54:05 +0000 2015,0,1,"Help send kids to Camp Collins by supporting Rogers Race! 
Donate any amount at http://t.co/0h3gf1pPeL! http://t.co/Wclh0b6tHa"
105,609830429776949248,Sat Jun 13 21:11:19 +0000 2015,0,0,@Vwow No minimum age. We start June 29th and feed kids daily around 11am. Sign up at the Y and come join us!
106,609461313685708800,Fri Jun 12 20:44:35 +0000 2015,0,0,"Roger's Race is under way. Raising $20,00 to keep the @ymcacw doing good in VanWa! Donate @ http://t.co/0h3gf1pPeL! http://t.co/C4S3BcMr4O"
107,609046676494372864,Thu Jun 11 17:16:57 +0000 2015,1,0,We are doing many wonderful things in our community. To help continue the work donate at http://t.co/0h3gf1pPeL http://t.co/iSVpv20FTg
108,608719627607134208,Wed Jun 10 19:37:23 +0000 2015,2,0,One of the many things we do every year is offer Camp Collins Scholarships to kids in need! http://t.co/WtmMczIBbg
109,608376497531981825,Tue Jun 09 20:53:54 +0000 2015,0,0,"Good work friends! So far we have we have raised about $2,000!

To donate: http://t.co/rBtEvlL7lh &gt; DONATE! http://t.co/3XpnTAygHf"
110,607966703671123969,Mon Jun 08 17:45:32 +0000 2015,0,0,"Rodger's Race continues! Pray with us as we continue our fundraising campaign!
Donate at http://t.co/KjEm6tFRDe! http://t.co/IpxbkuxxqG"
111,606929597704175617,Fri Jun 05 21:04:26 +0000 2015,0,1,We're partnering with Share Van. Wa. to feed kids this summer that would otherwise go hungry. We need volunteers! http://t.co/TdNKCEzL5r
112,606584755895664640,Thu Jun 04 22:14:10 +0000 2015,0,0,"Only a few days left to reach our goal of $1,000 this week!
To partner go to http://t.co/rBtEvm2IcP click&gt; ""DONATE!"" http://t.co/atEpB6JeWA"
113,606181110007996417,Wed Jun 03 19:30:13 +0000 2015,0,0,"Goal: $1000
Why: To do good in the community &amp; spread the Good News!
How: Go to http://t.co/rBtEvm2IcP click&gt; DONATE. http://t.co/FuuGCWOLUN"
114,605783450423984128,Tue Jun 02 17:10:04 +0000 2015,0,0,"With many events and projects going on all year long we NEED you!
 Go to http://t.co/1GRGxfiVh2 click&gt;DONATE to help. http://t.co/nMAltMs3d4"
115,605571280310444032,Tue Jun 02 03:06:58 +0000 2015,0,0,"Help raise $1,000 THIS WEEK to spread the Good News by giving in ANY amount! Go to http://t.co/rBtEvm2IcP &gt; DONATE! http://t.co/QxqLzoeYzV"
116,604344179318095872,Fri May 29 17:50:55 +0000 2015,0,0,"I got poked by Lions today!

The NW Lions Foundation are at the Y for FREE screening 'til NOON! http://t.co/fZxwtwl3lh"
117,604037911219044352,Thu May 28 21:33:55 +0000 2015,0,0,YMCA Chaplaincy is involved in Community Outreach projects year round! Donate:http://t.co/KjEm6tFRDe http://t.co/jlcIeTGmUo
118,603706827038072832,Wed May 27 23:38:18 +0000 2015,0,1,"Have you checked out my book, ""Dancing with God, seeing God in the everydayness of life.""
Let me know what you think"
119,603675956415430657,Wed May 27 21:35:38 +0000 2015,0,0,"Did you know that your @ymcacw Chaplaincy is busy year round with projects and events?
Donate: http://t.co/KjEm6togLG http://t.co/hyg4hdgblj"
120,603240639996669952,Tue May 26 16:45:50 +0000 2015,0,0,"Roger's Race is under way. Raising $20,00 to keep the @ymcacw doing good in VanWa! Donate @ http://t.co/KjEm6tFRDe. http://t.co/dIGZGT1TiK"
121,601869694430117888,Fri May 22 21:58:12 +0000 2015,0,1,Donate @ http://t.co/KjEm6tFRDe to keep the YMCA providing acceptance and grace in Clark County! http://t.co/ofQZkFXTNb
122,601473120134930432,Thu May 21 19:42:21 +0000 2015,1,1,"Pray with us as we continue our fundraising campaig of raising $20,000 to do good and spread the Good News! 
Donate @ http://t.co/KjEm6togLG"
123,601112204486660096,Wed May 20 19:48:12 +0000 2015,1,2,"Help us provide 400 meals to kids in need all summer long. 
Any amount helps. Donate at: http://t.co/KjEm6tFRDe! http://t.co/DlWZmjmuoS"
124,600744417763332096,Tue May 19 19:26:45 +0000 2015,0,2,"Father, 
Continue to call me out upon the waters. http://t.co/dqIcvdGqIX"
125,600414663013048323,Mon May 18 21:36:25 +0000 2015,1,3,"Help us raise $20,000 with donations of ANY size and for every $100 donated a child in need will be sponsored! http://t.co/YgB2eY47Lp"
126,599304052300652544,Fri May 15 20:03:15 +0000 2015,0,1,"Lord, As I run the race that you have put before me, help me run it well. http://t.co/tO9Y8JK4uK"
127,598960158924869632,Thu May 14 21:16:44 +0000 2015,1,1,"God is not constrained by time. In essence, in the realm of God everything is in the present tense. http://t.co/y9mI4qDW46"
128,598557119529385984,Wed May 13 18:35:12 +0000 2015,2,0,"My prayer is that we all choose to see the beauty in God’s creation, to see a leaf dance; to ask the question, are we dancing for God?"
129,598164093678129152,Tue May 12 16:33:27 +0000 2015,0,0,"As I go through life I know that I will have some days will be horrific, almost unbearable. I also know that God is with me everyday."
130,597888032377675779,Mon May 11 22:16:29 +0000 2015,0,0,"Lord, As I slip into judgment, give me that gentle nudge to stop and take a closer look where I need to change. http://t.co/usESgh4Lgn"
131,596795424536530944,Fri May 08 21:54:51 +0000 2015,1,1,"Father, 
Give me Your words to give others comfort and to know that You want to be with them. http://t.co/HQQv1g7wWb"
132,596085906135625730,Wed May 06 22:55:29 +0000 2015,1,2,"Lord, please help us and remind us that you are there to talk with, keep our thoughts on the things above. http://t.co/556unsNq3Y"
133,595712790473605123,Tue May 05 22:12:51 +0000 2015,1,0,"Why can’t we show people more of the Love of Christ, and less of the Wrath of God? http://t.co/wUtfYCwP1T"
134,595364910860619776,Mon May 04 23:10:30 +0000 2015,0,0,"""God means for you to live life to the fullest for His glory. He does not want you to stand by the side of the road as life goes by."""
135,594285066424950784,Fri May 01 23:39:35 +0000 2015,0,1,"It is one thing to talk about Grace, it is quite another to truly feel it in your heart. http://t.co/jFPtLjen2S"
136,593523601946451969,Wed Apr 29 21:13:48 +0000 2015,2,0,"God is not constrained by our time either. In fact, God has eternal life, a life that Christ has given to us. http://t.co/Gtik35yMkF"
137,593134112665276417,Tue Apr 28 19:26:07 +0000 2015,0,0,"Have we adapted to the point where our souls are cushioned from the pecking and picking from God, can we still feel His proddings?"
138,592850676536999936,Tue Apr 28 00:39:50 +0000 2015,0,0,My prayer is that we do not miss any more opportunities to let those that we love how much they mean to us. http://t.co/FtYb7Th0Xw
139,591730415121006593,Fri Apr 24 22:28:19 +0000 2015,1,1,Excited to learn if children can actually fly tmrw at Healthy Kids Day! Bring the little ones out to The Y 10am-1pm! http://t.co/mh4WfhHTQ4
140,591386268732248065,Thu Apr 23 23:40:48 +0000 2015,0,0,"Jesus heals people, and healed people heal people. I pray my healing will continue to bring healing to others. I pray the same for you."
141,590943830964211713,Wed Apr 22 18:22:43 +0000 2015,0,1,"If you have a kid or are a kid, you need to be here at The Y this Saturday from 10am-1pm!

It's Healthy Kids Day! http://t.co/IqD7LvNckv"
142,590591099930025984,Tue Apr 21 19:01:05 +0000 2015,0,1,"“Here am I, Lord. Send me.” Father, I am only human. It is hard to wait, but I am waiting. Forgive my impatience. http://t.co/X7MRdyHTIk"
143,590245362910138368,Mon Apr 20 20:07:15 +0000 2015,0,0,"Father, thank You for getting into the water first and showing me it is okay by saying, “Come on in. The water is just fine."""
144,589159201303199744,Fri Apr 17 20:11:14 +0000 2015,1,1,It is easy to see God in a blue sky with puffy clouds. It is harder to see God in the mud puddles. http://t.co/oKNrMp6SuC
145,588773608660447233,Thu Apr 16 18:39:01 +0000 2015,0,0,"I know that some days will be horrific, almost unbearable. I also know that God is with me every day. He will never leave me or forsake me."
146,588418103920304128,Wed Apr 15 19:06:22 +0000 2015,1,0,"As much as we would like to think otherwise, we do not live in an Instamatic world, and our faith walk is a marathon, not a sprint."
