,id_str,created_at,retweet_count,favorite_count,text
147,588054822278062080,Tue Apr 14 19:02:49 +0000 2015,0,2,It is good to contemplate the things of God. It is good to daydream of heaven and being in relationship with Him. http://t.co/5B7CpHt6Fg
148,587669179525808128,Mon Apr 13 17:30:25 +0000 2015,3,3,"Love and forgiveness, two concepts that we need to put into practice! http://t.co/K0UsiQEf4D"
149,586583086550290432,Fri Apr 10 17:34:40 +0000 2015,2,3,"If I am to be an ambassador of Christ, I must not allow myself to be caught up in the noise of the day. http://t.co/4TgWp7Lta0"
150,586216535921799169,Thu Apr 09 17:18:08 +0000 2015,0,0,"Go into the great unknown.
Give God the opportunity to show you great things. http://t.co/47d30jEnV8"
151,585893576858472448,Wed Apr 08 19:54:48 +0000 2015,1,4,"God made the stillness of the early morning for Himself. It ought
to belong to God. http://t.co/8alizolSN7"
152,585545780297084928,Tue Apr 07 20:52:47 +0000 2015,1,2,"As I endeavor to keep my focus on You, Lord, give me nudges when my attention drifts. I have been saved by Your grace. Help me grow in You."
153,585133468264325122,Mon Apr 06 17:34:24 +0000 2015,0,0,"He can take us to places, confront us w/ our fears, &amp; show us that w/ Him we can overcome the things that inhibit us &amp; live fearless lives."
154,584060931799252992,Fri Apr 03 18:32:32 +0000 2015,0,0,Our life w/ &amp; in Christ is filled w/ simplexity. Conversion is simple. It takes a moment. Transformation is complex. It takes a lifetime.
155,583696623349268480,Thu Apr 02 18:24:54 +0000 2015,0,0,"My Prayer: Do we choose to see the beauty in God’s creation, or are we dancing with God or allowing ourselves to be blown out of control?"
156,583366755113836544,Wed Apr 01 20:34:07 +0000 2015,1,4,"Let us not be content with what we already know. Be filled with the wonder of a child &amp; allow Christ to teach us at a deeper, higher plane."
157,582904213518184448,Tue Mar 31 13:56:08 +0000 2015,0,3,"Lord, I pray that You continue to give me grace as I do my best to abide in You as you are abiding in me. http://t.co/dyE0IBrVBY"
158,582597010584305664,Mon Mar 30 17:35:26 +0000 2015,0,2,"Christ gives us the ability to see things differently and not to get
upset over trivialities. http://t.co/z8vB6ZRiuT"
159,581580816536375298,Fri Mar 27 22:17:26 +0000 2015,1,2,"Go into the great unknown.
Give God the opportunity to show you great things. http://t.co/wwZ3dYPu5U"
160,581150877995515904,Thu Mar 26 17:49:01 +0000 2015,0,1,I like being a conduit that Jesus can use to speak to with people who have never or at least seldom come to church. http://t.co/85ouaHmCbF
161,580852230607212545,Wed Mar 25 22:02:18 +0000 2015,0,4,Formation and transformation in Christ are not stagnant processes; they involve constant movement. http://t.co/jBI0R9BdOJ
162,580476973778079746,Tue Mar 24 21:11:09 +0000 2015,0,0,"Heaven is bigger and better than I can ever imagine; even though I do not know all the ins and outs, and the ifs, ands or buts of Heaven."
163,580106518529380352,Mon Mar 23 20:39:06 +0000 2015,1,0,"If I love Christ but keep it a secret, does that make Christ my mistress? http://t.co/hb3OLlKDRB"
164,579030507813400576,Fri Mar 20 21:23:25 +0000 2015,0,1,"Lord, show me the areas in my life that I have not submitted. Give me your heart so I may better serve you. http://t.co/uKpvLAwoWf"
165,578658429264404481,Thu Mar 19 20:44:55 +0000 2015,0,2,"Father, help me to be intentional in all that I do. Help me to be intentional in my thought life &amp; not let random thoughts clutter my mind."
166,578242244836085760,Wed Mar 18 17:11:09 +0000 2015,1,2,"Father, I am only human. It is hard to wait, but I am waiting. Forgive my impatience, forgive my nagging. http://t.co/LC2Z8y4TYM"
167,577879365129670656,Tue Mar 17 17:09:11 +0000 2015,2,1,"Father, give me eyes to see what it is that you are providing. You know what I want you to provide. Not my will, but your will be done."
168,577698052888100864,Tue Mar 17 05:08:43 +0000 2015,0,3,"Father, thank you for getting into the water first to show me it is OK saying, ""Come on in, the water is just fine."" http://t.co/ERdUfPfGst"
169,576526859644489728,Fri Mar 13 23:34:49 +0000 2015,2,2,"Soon, this lap pool will help raise $20K for the Christian Mission of The Y &amp; provide 200 swim lessons to local kids! http://t.co/4xAV13ngcq"
170,576144488172670976,Thu Mar 12 22:15:24 +0000 2015,1,1,God has extended Grace to us and it is only by this Grace that our sins are forgiven. http://t.co/DIlGmvyBaN
171,575786560160821248,Wed Mar 11 22:33:08 +0000 2015,1,2,Everyday we have the opportunity to do “good work.” http://t.co/GW3NZIqZuy
172,574986805721763840,Mon Mar 09 17:35:11 +0000 2015,1,3,"Sometimes God shows up in the funniest places.
Sometimes we see Him in the blue sky and clouds. http://t.co/YMUjXcBIDU"
173,573926315167875072,Fri Mar 06 19:21:11 +0000 2015,0,2,Always make them count. http://t.co/jWnslT6nDJ
174,573596953784623105,Thu Mar 05 21:32:25 +0000 2015,0,2,It's fun to stay at the... http://t.co/mIjH6HeUbT
175,573150312057344001,Wed Mar 04 15:57:37 +0000 2015,2,6,"If you do something for someone and expect something in return you aren’t doing good, you're doing business. Do Good. http://t.co/SlSyLV0bdH"
176,572918741878484992,Wed Mar 04 00:37:27 +0000 2015,1,2,"Brothers/sisters, since God has forgiven us so many times, let us take advantage of that friendship with the Lord. http://t.co/oEvr1OFm66"
177,572525412279971840,Mon Mar 02 22:34:29 +0000 2015,1,1,"Ready, set...
Do Good! http://t.co/CYe5VgSWL0"
178,571437680212320256,Fri Feb 27 22:32:14 +0000 2015,0,0,One of the dangers of living your calling is that it does not feel like work. http://t.co/nBBrPSMhoY
179,571030763677700098,Thu Feb 26 19:35:17 +0000 2015,0,0,A Christian theist is not just an intellectual worldview; its to be committed to the personal Lord of the universe. http://t.co/zLLZAWxM4K
180,570709674363760641,Wed Feb 25 22:19:24 +0000 2015,0,1,"Lord, let us not be so busy patting ourselves on the back for the good we are doing that we forget to say thank you! http://t.co/JKWa8qeHDd"
181,570355638322089987,Tue Feb 24 22:52:35 +0000 2015,0,2,"One thing that I have found is that God will, if you let Him, use your hurts to help others. http://t.co/vNJspXJ6zh"
182,570013518985961473,Tue Feb 24 00:13:07 +0000 2015,0,0,"I'm excited to roll out something that will certainly put the ""FUN"" in Fundraiser at The Y!

Stay tuned! http://t.co/vLxSNXiKL9"
183,568901306787635200,Fri Feb 20 22:33:35 +0000 2015,0,0,"Father, help me to be intentional in all that I do. Help me to be intentional in my thought life &amp; not let random thoughts clutter my mind."
184,568458760089255938,Thu Feb 19 17:15:04 +0000 2015,0,1,"Guide me, be my GPS if You will and continue to teach me so that I can present my best self to others so that they may know you."
185,568174273661173760,Wed Feb 18 22:24:37 +0000 2015,0,1,"Lord, continue to give me strength. Continue to give me the courage to be in the midst of tough situations. http://t.co/38FQ9HT8KL"
186,567777099034959872,Tue Feb 17 20:06:23 +0000 2015,0,0,"Its always fun and very humbling to watch Christ in action. I will ruminate on, ""The hands and feet of Christ today."" http://t.co/qNY2PDHfbW"
187,567415494278262784,Mon Feb 16 20:09:30 +0000 2015,0,0,"Salvation begins with the human person, with human dignity, with saving every person form sin. http://t.co/gzFmFKpev1"
188,566351615641141248,Fri Feb 13 21:42:02 +0000 2015,0,0,God means for us to live life to the fullest for His glory. He does not want us to stand by the side of the road as life goes by.
189,565994281781841920,Thu Feb 12 22:02:07 +0000 2015,0,0,Formation and transformation in Christ is more like a river and less like a pond or lake. http://t.co/TREpdjuhVs
190,565662456614506496,Thu Feb 12 00:03:33 +0000 2015,0,0,The Best of Clark County voting is going on right now! Nominate the Y with me at http://t.co/h1DdS8N0Kw! http://t.co/E0nMAcp0Yc
191,565239945070395393,Tue Feb 10 20:04:39 +0000 2015,0,0,Let us not be so concerned about the “others” fault or shortfall that we do not recognize our own. http://t.co/AlCBTZeDun
192,564904333003603969,Mon Feb 09 21:51:03 +0000 2015,0,1,"I know that God is with me everyday. 
He will never leave me or forsake me. http://t.co/fai9E97Cf7"
193,563796269798158336,Fri Feb 06 20:28:00 +0000 2015,0,1,"When you find something that takes your focus off Christ, wash your hands of it. Unhealthy spirituality is not good. http://t.co/TTAk25IJtp"
194,563445472862273538,Thu Feb 05 21:14:03 +0000 2015,1,0,May I suggest that you measure your success in the little things &amp; take peace in the fact that God is using you to help people for His sake.
195,563051316587823105,Wed Feb 04 19:07:49 +0000 2015,0,0,"If my job is to present the Good News to people, I better make sure that I am communicating well. http://t.co/e7a1SjX4Jn"
196,562701574120935424,Tue Feb 03 19:58:04 +0000 2015,0,0,"My prayer is:
Lord, continue to give me Your heart. Continue to give me Your guidance. Continue to give me Your wisdom."
197,562367182881832960,Mon Feb 02 21:49:19 +0000 2015,0,0,Good things happen at the Y everyday! http://t.co/P3QMaG0OMG
198,561308109197422594,Fri Jan 30 23:40:56 +0000 2015,1,1,"Let us not waste another year of doing nothing while we wait for God to do something.
Let us be better than that. http://t.co/pXG4ix60Pg"
199,560561839571214337,Wed Jan 28 22:15:31 +0000 2015,0,0,Grace can't be bought or earned by oneself. It has to be extended. God has extended his Grace to us. http://t.co/R42cBPcHOc
