,id_str,created_at,retweet_count,favorite_count,text
0,502489028898222081,Thu Aug 21 16:14:54 +0000 2014,0,0,@WWENostalgia @SteveAustinBSR @StephMcMahon http://t.co/zb3Jpok5i0  @REALKURTANGLE destroyed @SteveAustinBSR Party http://t.co/Uxlcb1WPT6
1,502488922807472128,Thu Aug 21 16:14:29 +0000 2014,0,0,@OldSchoolRaw  @SteveAustinBSR @StephMcMahon http://t.co/zb3Jpok5i0  @REALKURTANGLE destroyed @SteveAustinBSR Party http://t.co/Uxlcb1WPT6
2,502488367963983873,Thu Aug 21 16:12:17 +0000 2014,6,0,RT @GillesMarini: Here @NancyODell and I benefiting #bettysbattle in 09. Nancy a true warrior against #ALS for a long time. http://t.co/KT2…
3,502488204696489984,Thu Aug 21 16:11:38 +0000 2014,0,0,@SteveAustinBSR @StephMcMahon http://t.co/zb3Jpok5i0  @REALKURTANGLE destroyed @SteveAustinBSR Party http://t.co/Uxlcb1WPT6
4,502359693533003777,Thu Aug 21 07:40:58 +0000 2014,0,0,AKSHAY KUMAR FLYING KICK TO PALAK AT CNWK: http://t.co/JNyraV9bJP
5,392199521326731265,Mon Oct 21 08:03:47 +0000 2013,0,0,THE MOST MOTIVATIONAL VIDEO MUST WATCH http://t.co/WKFT8Na6n2
6,389344910760873984,Sun Oct 13 11:00:35 +0000 2013,0,0,@THEROCK VS @TRIPLEH HBK @ShawnMichaels SPECIAL REF. @WWE CHAMPIONSHIP JUDGEMENT DAY 60 ...: http://t.co/Vgici1VT7G
7,387214582269231104,Mon Oct 07 13:55:25 +0000 2013,0,0,Conspiracy of all the paid media channels against Asharam Bapu: http://t.co/1qar3sD0yu
8,386920371292622851,Sun Oct 06 18:26:19 +0000 2013,1,0,RT @AntonioZepedaa: @TNAWWEGuy @SupportingBryan @Luke_Foreman @_PaulHeyman @PunkerForeverr @TheShieldWWE
9,386920360190283778,Sun Oct 06 18:26:17 +0000 2013,1,0,RT @Shay10of7: @_PaulHeyman how many clients have you got and who's next #im not  a Paul Heyman guy
10,386920345338249216,Sun Oct 06 18:26:13 +0000 2013,1,0,RT @wassim65249031: @IAmJericho  hhhh  see you in chicago @_PaulHeyman  you're really epic :D
11,386920329232134144,Sun Oct 06 18:26:09 +0000 2013,1,0,RT @19Eddie2: damn @_PaulHeyman kills on that mic!! this guy is legendary!!
12,386920294998220800,Sun Oct 06 18:26:01 +0000 2013,1,0,RT @shufflethecards: WOW!!! MATCH OF THE YEAR-THE BEST V THE BEAST!!! #SUMMERSLAM! #NODQ @wwe @WWEUniverse @BrockLesnar @CMPunk @_PaulHeyman
13,386920267022204928,Sun Oct 06 18:25:54 +0000 2013,1,0,RT @BillRabe34: @bobwojnowski are you a @ZebColterWWE guy? Or @_PaulHeyman ?
14,386920253663354881,Sun Oct 06 18:25:51 +0000 2013,1,0,RT @EZOE_BRUH: I have lost all respect for @TripleH last night was bad but tonight was just the straw that took it you've become @_PaulHeym…
15,386920239427883008,Sun Oct 06 18:25:48 +0000 2013,1,0,RT @wwerocks261: man @_PaulHeyman is sooooooooooooooooooooooooooooo dead
16,386920228539473922,Sun Oct 06 18:25:45 +0000 2013,1,0,RT @shufflethecards: Tonight its all about @CMPunk AND @WWEUsos . I love The @WWEUsos and tonight it is there time to shine. As for @_PaulH…
17,386920218284396544,Sun Oct 06 18:25:43 +0000 2013,1,0,RT @shufflethecards: #shouldbeamazing!!. Match of the night is about to start!! @WWEUniverse @CMPunk @RealCurtisAxel @_PaulHeyman
18,386919558574915584,Sun Oct 06 18:23:06 +0000 2013,0,0,#ASHARAMBAPU #NIRDOSH HAI: http://t.co/zZb7Jy4iRA
19,341484012788932608,Mon Jun 03 09:18:27 +0000 2013,0,0,COMMANDO 2013 STARTING BUS STAND FIGHT SCENE OF (@VidyutJammwal) http://t.co/psymhWzQaS
20,338907039726182400,Mon May 27 06:38:29 +0000 2013,1,0,RT @matthew_pomeroy: A disturbing end to Monday Night Raw. Thoughts going out to The Game... @WWE @WWEUniverse @TripleH @_PaulHeyman @Steph…
21,338906976799043584,Mon May 27 06:38:14 +0000 2013,1,0,RT @ViceralViceral: #welcomeTweet @JedPearsonPhoto @san119018 @TALKSHITis @_PaulHeyman @aseplintang22 @CristinaGil_ @_Profesionales (via ht…
22,338906960147656705,Mon May 27 06:38:10 +0000 2013,2,0,RT @ongki_putra: #welcomeTweet @iParvesh @Meko_wahyudi @HaHaMeDanKaLi @MR_Royen @MacWizdom @codeaweb @zaidragie @_PaulHeyman (via http://t.…
23,338906816224321536,Mon May 27 06:37:36 +0000 2013,0,0,THE REAL POWER OF HANUMAN CHALISA http://t.co/sKoj5NzolH
24,336154885026361344,Sun May 19 16:22:24 +0000 2013,0,0,THE ROCK (@TheRock) &amp; EDGE (@EdgeRatedR)  SEGMENT AT @WWE #SMACKDOWN BACKSTAGE 22ND AUGUST 2002 http://t.co/VzyJkf8p99
25,334895444217966592,Thu May 16 04:57:50 +0000 2013,0,0,"minute to pay tribute to our Kargil Heroes.
Respect 
Never forget, Never forgive, 
Jai Hind"
26,334895426195050496,Thu May 16 04:57:46 +0000 2013,0,0,"all were wounded. The bodies of Captain Bhardwaj and Havildar Singh were recovered after 57 days. 

Indian Army Fans urges you to take a"
27,334895393081024513,Thu May 16 04:57:38 +0000 2013,0,0,"enemy &amp; ordered his Second-in-Command to get the men out of the battle area. The two gallant men were killed, the others survived, though"
28,334895356846407681,Thu May 16 04:57:29 +0000 2013,0,0,"Pakistani soldiers armed with light &amp; medium weaponry. With the help of Havildar Rajbir Singh, he decided to divert the attention of the"
29,334895321584906242,Thu May 16 04:57:21 +0000 2013,0,0,"they were surrounded and captured.

Capt. Amit Bhardwaj was leading the reinforcement column of 30 men when they were ambushed en route by"
30,334895238223126528,Thu May 16 04:57:01 +0000 2013,0,0,"Lt. Kalia and his team fought back, but soon ran out of ammunition. Hours later, long before the reinforcements could arrive,"
31,334895176608796672,Thu May 16 04:56:46 +0000 2013,0,0,"occupied the Bajrang Post. They reported the incident back to battalion headquarters, seeking urgent reinforcements."
32,334895136905506818,Thu May 16 04:56:37 +0000 2013,0,0,"patrol the day after. But as they neared their objective around 3.30 pm May 15, they were suddenly fired upon by the intruders who had"
33,334895095528697856,Thu May 16 04:56:27 +0000 2013,0,0,"Moola Ram and Naresh Singh.

But once again, heavy snow prevented them from reaching Bajrang post on that day, and they resumed their"
34,334895035852152832,Thu May 16 04:56:13 +0000 2013,0,0,"like a true Indian Army officer, Lt Kalia volunteered to lead the 5 man patrol, comprising sepoys Arjun Ram, Bhanwar Lal Bagaria, Bhikha Ram"
35,334894984446754816,Thu May 16 04:56:00 +0000 2013,0,0,"Jat Regiment decided to send another patrol to check the strategically important Bajrang post. A junior officer was to lead the patrol, but"
36,334894889483501568,Thu May 16 04:55:38 +0000 2013,0,0,"Saurabh Kalia of the 4 th Jat Regiment led a patrol in the Kaksar area. But Lt. Kalia had to return due to heavy snow.

On May 14, the 4 th"
37,334894833204355072,Thu May 16 04:55:24 +0000 2013,0,0,"strangers on a ridgeline in the Batalik sector. On May, 4, the 3 rd Punjab Regiment sent out a patrol to verify the report, while Lt."
38,334894748877864960,Thu May 16 04:55:04 +0000 2013,0,0,"But the intrusion was detected long before that, on May 3, when two local shepherds named Tashi Namgyal &amp; Tresing Morup reported seeing"
39,334894698554605568,Thu May 16 04:54:52 +0000 2013,0,0,"started on May 26, 1999, when the Indian Army &amp; Air Force decided to launch joint a offensive to throw out the Pakistani intruders."
40,334894644078997504,Thu May 16 04:54:39 +0000 2013,0,0,"almost 22 days, before they were shot dead on June 6-7, and their mutilated remains returned to India.

The Kargil war may have officially"
41,334894591482396673,Thu May 16 04:54:27 +0000 2013,0,0,"and his five member team were captured by Pakistani intruders in Kargil.

These young men were subjected to brutal and inhuman torture for"
42,334894537367486466,Thu May 16 04:54:14 +0000 2013,0,0,"15, not one newspaper, not one television channel, not one website, remembered that it was on this day 14 years ago, that Lt Saurabh Kalia"
43,334894492614279168,Thu May 16 04:54:03 +0000 2013,0,0,"Public memory is short-lived.

What else can explain the fact that as we debated, discussed and disseminated news about Sanjay Dutt on May"
44,334592992948133888,Wed May 15 08:56:00 +0000 2013,1,0,"RT @Sin_HeavyGrind: Shouts To @_PaulHeyman For The Follow! Pls Listen &amp; RT My Remake Of The Fugees Classic ""Ready Or Not"" http://t.co/wu9Ob…"
45,334541316098777088,Wed May 15 05:30:39 +0000 2013,0,0,"Nana Patekar's Best Ever Dialogue From The Movie""Krantiveer"" https://t.co/S04Zz4IcLH"
46,334537777016340480,Wed May 15 05:16:36 +0000 2013,2,0,"RT @grattonboy: The wife just said, ""You've got a very short attention span!"" I said, ""What parcel?"""
47,334537498464231425,Wed May 15 05:15:29 +0000 2013,0,0,"Terry Funk vs. @BretHart: Hardcore Match - January 6, 2000 https://t.co/eehdDcEz9V"
48,334536986448785408,Wed May 15 05:13:27 +0000 2013,0,0,https://t.co/eehdDcEz9V #TERRYFUNK VS @BretHart
49,334270352576360448,Tue May 14 11:33:57 +0000 2013,74,0,"RT @sonakshisinha: Went to a theatre after soooo long!! Go goa gone - super funny, like a mad videogame!! Had fun! Also caught the Loot… ht…"
50,334151821763432449,Tue May 14 03:42:57 +0000 2013,0,0,COMMANDO 2013 STARTING BUS STAND FIGHT SCENE OF VIDYUT JAMWAAL / JAMWAL: http://t.co/s53zYS6OFP via @youtube
51,334150752249462784,Tue May 14 03:38:42 +0000 2013,0,0,Aashiqui 2 2013 SUN RAHA HAI NA TU (FEMALE) BY SHREYA GHOSHAL: http://t.co/t7E79c3afC via @youtube
52,334150285754785793,Tue May 14 03:36:50 +0000 2013,0,0,High School Student Gives Teacher a Lesson!: http://t.co/5I36oXniod via @youtube
53,334149799723008000,Tue May 14 03:34:55 +0000 2013,0,0,STONE COLD STEVE AUSTIN &amp; MIKE TYSON SEGMENT AT WWE RAW IS WAR: http://t.co/PuvcPL6NRE via @youtube
54,334149387452293120,Tue May 14 03:33:16 +0000 2013,0,0,WONDERFUL RKO BY RANDY ORTON TO DEL RIO: http://t.co/lImgVIlJq2 via @youtube
55,334149208393265153,Tue May 14 03:32:34 +0000 2013,0,0,MICK FOLEY AKA MANKIND BECOMES THE WWE CHAMPION FOR THE FIRST TIME: http://t.co/sRoJf9pZWL via @youtube
56,334149014410891264,Tue May 14 03:31:47 +0000 2013,0,0,CM PUNK CASH HIS MONEY IN BACK ON EDGE FOR WHC TITLE: http://t.co/363IwkDU0S via @youtube
57,334148784034557952,Tue May 14 03:30:52 +0000 2013,0,0,EDGE SPEARS JEFF HARDY FROM TOP OF THE LADDER AT WWE WRESTLEMANIA: http://t.co/llSjgrUlRe via @youtube
58,334148640669052930,Tue May 14 03:30:18 +0000 2013,0,0,JEFF JARRETT HIT WITH GUITAR TO MOOLLA &amp; FIGURE FOUR MAY YOUNG: http://t.co/trH8Ojkbc0 via @youtube
59,334148261227143168,Tue May 14 03:28:48 +0000 2013,0,0,STONE COLD STEVE AUSTIN SAVES STEPHANIE MCMAHON FROM THE UNDERTAKER: http://t.co/eNDQIUxRpK via @youtube
60,334148128452272128,Tue May 14 03:28:16 +0000 2013,0,0,THE BIG SHOW DEFEATED SHEAMUS IN A CHAIRS MATCH: http://t.co/vWryWFMzJN via @youtube
61,334147953805643777,Tue May 14 03:27:35 +0000 2013,0,0,STONE COLD STEVE AUSTIN DESTROYED THE DX BUS: http://t.co/J0rcUfKEdy via @youtube
62,334147731620757504,Tue May 14 03:26:42 +0000 2013,0,0,AJ LEE SCREWED JOHN CENA AT WWE TLC PPV: http://t.co/NPGPjrfVLr via @youtube
63,334147563857014785,Tue May 14 03:26:02 +0000 2013,0,0,JOHN CENA PICK UP THE BIG SHOW &amp; EDGE AT THE SAME TIME AT WWE WRESTLEMANIA: http://t.co/Op0KGqbdzX via @youtube
64,334147449260236801,Tue May 14 03:25:34 +0000 2013,0,0,STONE COLD STEVE AUSTIN BRING A BEER TRUCK TO THE CORPORATION: http://t.co/SwxtS4G3Hr via @youtube
65,334147320012750848,Tue May 14 03:25:03 +0000 2013,0,0,BROCK LESNAR JUST F5 500 POUNDS THE BIG SHOW AT SURVIVOR SERIES: http://t.co/g4wFLKX4YN via @youtube
66,334147184821944321,Tue May 14 03:24:31 +0000 2013,0,0,BIG SHOW JUST TOSS 3400 POUNDS JEEP UP SIDE DOWN: http://t.co/e3xuAgLwJ0 via @youtube
67,334146119422582785,Tue May 14 03:20:17 +0000 2013,0,0,think i've just found my new favourite directory site! http://t.co/meJDkIzc64
68,334145115574640640,Tue May 14 03:16:18 +0000 2013,0,0,"New post! You won't believe your eyes: 30 incredibly beautiful animal sculptures made out of everyday objects

http://t.co/4oGVoLJtxT"
69,334144991163215872,Tue May 14 03:15:48 +0000 2013,0,0,"more entertaining. 
-Chris"
70,334144975954644994,Tue May 14 03:15:45 +0000 2013,0,0,probably won't see much wrestling just a spot fest. I feel that the Triple Threat Ladder Match has better build and that the match will be
71,334144945357205504,Tue May 14 03:15:37 +0000 2013,0,0,"the build up is just lazy and I honestly can't even take this feud seriously. As for the actual match I feel that it's going to be a dud, we"
72,334144904047513601,Tue May 14 03:15:27 +0000 2013,0,0,"Who is actually looking forward to Cena vs Ryback at Extreme Rules?
I'm personally not looking forward to this match one bit. I feel that"
73,334144582809944064,Tue May 14 03:14:11 +0000 2013,0,0,have a good job to get a good proposal.
74,334144563126099969,Tue May 14 03:14:06 +0000 2013,0,0,"Today's world has become competitive for girls which was earlier confined to boys only, girls now need to be highly educated and"
75,334144485678256128,Tue May 14 03:13:48 +0000 2013,0,0,"Queen, (Not Secular)"
76,334144471140823043,Tue May 14 03:13:44 +0000 2013,0,0,"should not bow)
To thee I call Mother and Lord! (Symbolizes Worship)
In our temples is but thine. ( Not secular)
Thou art Durga, Lady and"
77,334144444850900993,Tue May 14 03:13:38 +0000 2013,0,0,"Vande Mahataram Controversial Lines.
Mother I kiss thy feet, (Mother is a human being)
Mother, to thee I bow. (Mother is a human being you"
78,334144333957718016,Tue May 14 03:13:11 +0000 2013,0,0,doctors left. Unless the ones remaining have crores to spare.
79,334144319013388288,Tue May 14 03:13:08 +0000 2013,0,0,emphasize on NEET so much when it has been reduced to just a voluntary exam with no teeth?? The time is not far when India will have no
80,334144289858781184,Tue May 14 03:13:01 +0000 2013,0,0,So the Supreme Court gives a verdict where all exam results are valid. Be it NEET or private college exams. Then why the hell did they
81,334144071570448384,Tue May 14 03:12:09 +0000 2013,0,0,"In 1947 1 dollar was = 1 Rupee, today it's above 55, British handled India's Economy better even though they looted."
82,334143945279946752,Tue May 14 03:11:39 +0000 2013,0,0,"Boy: Ya ! But She is not replying, so
m texting U ! :P"
83,334143927894552576,Tue May 14 03:11:35 +0000 2013,0,0,"A Boy texts a girl.
Boy: Hey !
.
Girl: Hi ! What u doing ?
.
Boy: texting the most beautiful girl
in the world..
Girl: Aww How cute"
84,334143464293953536,Tue May 14 03:09:44 +0000 2013,0,0,"for 1 reason - so that my favourite ""RCB"" still has a chance to the Top 4 :D"
85,334143448326234112,Tue May 14 03:09:40 +0000 2013,0,0,"Pollard you beauty!!! WooH!! Go MI Gooo! What an innings What an innings 

Ok, enough of the pseudo cheering for MI. Wanted MI to win only"
86,334143353476243456,Tue May 14 03:09:18 +0000 2013,0,0,And they said hyderabad had the best bowling attack :/ :P carribean storm hits mumbai coasts!!!
87,334143300313440256,Tue May 14 03:09:05 +0000 2013,0,0,"Apki Khusi K Liye Hum
Mar Jayenge.♥."
88,334143278909890560,Tue May 14 03:09:00 +0000 2013,0,0,"Do Ek Bar Ki Khush Rahoge
Humare Bina Hum Apki Is Duniya Se
Chale Jayenge......
Maut Bhi Mile Apki Khusi Ki Keemat
Par ♥ ♥ ♥
Apki Kasam"
89,334143235524030466,Tue May 14 03:08:50 +0000 2013,0,0,"Tere Pyar Ko Paane K Khatir ♥♥
Hum Har Had Se Guzar Jayege.....
Tujhe Pane Ki Koshish Me Shayad
Apna Sab Kuch Hum Kho Jayenge......
Ager Keh"
90,334142895231750145,Tue May 14 03:07:28 +0000 2013,0,0,"worth it to you or not. 

UFC and numerous other companies are doing the same thing as TNA with paid http://t.co/35TjKR2b5x channels."
91,334142880455213056,Tue May 14 03:07:25 +0000 2013,0,0,"There is a free 14-day trial with every subscription to ""TNA Wrestling Plus"", so you will have time to se if the service is"
92,334142854035296256,Tue May 14 03:07:19 +0000 2013,0,0,of $4.99 per month. The company has added several pay-per-view events as well as superstar &amp; compilation DVDs to the channel.
93,334142797248618496,Tue May 14 03:07:05 +0000 2013,0,0,"As a reported yesterday, TNA iMPACT! Wrestling has launched a paid YouTube channel, ""TNA Wrestling Plus"", for a subscription fee"
94,334142709382135808,Tue May 14 03:06:44 +0000 2013,0,0,is currently undergoing medical testing.
95,334142690981711872,Tue May 14 03:06:40 +0000 2013,0,0,Dolph Ziggler is no longer listed for this weekend's house shows. Ziggler suffered a concussion during the SmackDown tapings on Tuesday and
96,334142619737280513,Tue May 14 03:06:23 +0000 2013,0,0,plans for the World Title match at Extreme Rules in case Ziggler isn't medically cleared
97,334142604235120640,Tue May 14 03:06:19 +0000 2013,0,0,"remember Monday into Tuesday and was diagnosed with retrograde amnesia stemming from the incident.

The company is working on alternative"
98,334142558437507073,Tue May 14 03:06:08 +0000 2013,0,0,Dolph Ziggler was interviewed by http://t.co/yhtrz0Pwlb about his concussion suffered at the Smackdown tapings. Dolph said he doesn't
