,id_str,created_at,retweet_count,favorite_count,text
166,663244324583403520,Sun Nov 08 06:39:04 +0000 2015,1,0,Remember That You’re Not Here to Make Friends https://t.co/VYq7pC1aLd https://t.co/eLVk90sVeO
167,663151711108866048,Sun Nov 08 00:31:03 +0000 2015,1,1,What Improv Comedy Can Teach Salespeople https://t.co/IbasmWS3Oj https://t.co/4dGfoRNsje
168,663133878249459713,Sat Nov 07 23:20:11 +0000 2015,2,1,At Spiro we’re all about sales guys making a sick amount of money. https://t.co/bHAsKIqQK0 https://t.co/uFtrDFhhLQ
169,663117535215128576,Sat Nov 07 22:15:15 +0000 2015,0,0,Don't Waste Your Time On Just One Buyer https://t.co/PhxkuakOEe https://t.co/ZSXv16X5tN
170,663074985104273409,Sat Nov 07 19:26:10 +0000 2015,0,1,Stop Thinking Negatively https://t.co/YudkQ0U5sK https://t.co/lDR7HkeEyf
171,663057609629540352,Sat Nov 07 18:17:07 +0000 2015,0,0,"Like Shakespeare said, we’re all players on a stage, and, especially in this business... https://t.co/ykGEHVbmdZ https://t.co/t9CP0CBu7H"
172,663046524759330820,Sat Nov 07 17:33:04 +0000 2015,0,0,Explained: What is happening at Bank of Baroda  https://t.co/55YrMBReZd
173,663023879879852032,Sat Nov 07 16:03:06 +0000 2015,2,2,"If you’re really scared about being replaced by a robot, start acting more human!  https://t.co/RukuvRnu32 https://t.co/33GyfFoiea"
174,662991399021895680,Sat Nov 07 13:54:01 +0000 2015,0,0,The High Cost of Instagram Modeling https://t.co/JMmjght7oM
175,662908375219458049,Sat Nov 07 08:24:07 +0000 2015,0,0,Entropy is Your Enemy https://t.co/jPaXSupeYM https://t.co/r7B067Vj3w
176,662881957395701760,Sat Nov 07 06:39:09 +0000 2015,1,0,Go Over Heads If You Need To https://t.co/SpgdIhprK4 https://t.co/yqApjzlxKG
177,662789326540009473,Sat Nov 07 00:31:04 +0000 2015,0,0,you should think twice before clicking submit on that claim form... https://t.co/HaUknsdysZ https://t.co/W4yEwtUx8A
178,662771503306563584,Fri Nov 06 23:20:14 +0000 2015,0,1,Have the Budget Talk With Prospects Now and Thank Me Later https://t.co/KUxdINUgfB https://t.co/6ZS5lYu7X8
179,662755132334055424,Fri Nov 06 22:15:11 +0000 2015,0,2,"Salespeople, Try This: Be Transparent https://t.co/Cbb1bEZtuP https://t.co/trpOToWh4a"
180,662712630566649856,Fri Nov 06 19:26:18 +0000 2015,1,0,Improv Teaches You How to Deal with the Unexpected https://t.co/ZBYiJWBiRx https://t.co/jmaGk8x7Ck
181,662695196392620032,Fri Nov 06 18:17:01 +0000 2015,3,2,"No Matter What Those Guys in Silicon Valley Tell You, Robots Won't Steal Your Sales Job https://t.co/zKmZTBitxE https://t.co/knEe3qzOfb"
182,662684233056567297,Fri Nov 06 17:33:27 +0000 2015,7,3,You can choose how to interpret every situation – as positive or negative.  https://t.co/YXcb6lnYjl https://t.co/WBoA2VxyQV
183,662626495014297601,Fri Nov 06 13:44:02 +0000 2015,2,2,Being the Most Popular Sales Guy is Seriously Underrated  https://t.co/R1B8FJ9n7a https://t.co/8fNTH2sy2v
184,662626436960899072,Fri Nov 06 13:43:48 +0000 2015,0,0,3 Reasons Why Millennials are the Best Sales Reps Ever https://t.co/KISbQcrSuj
185,662623978461229056,Fri Nov 06 13:34:02 +0000 2015,0,1,"""I'm not a sucker so I don't need a bodyguard"" ♫ https://t.co/oTNmkTs4y5"
186,662540088547647488,Fri Nov 06 08:00:41 +0000 2015,2,4,"Love him or hate him, Donald Trump knows how to win. https://t.co/wcJneMVlSG https://t.co/KqVirYnTnT"
187,662478318550302724,Fri Nov 06 03:55:14 +0000 2015,1,0,"Let's Not Go Suing LinkedIn, Salespeople https://t.co/aDjI7hK9Yl https://t.co/gcjJYlHVlS"
188,662462707204005889,Fri Nov 06 02:53:12 +0000 2015,1,3,Use Psychology To Build Rapport With Customers https://t.co/rORN6KXwR7 https://t.co/xuZ5TCTcFc
189,662442559067824128,Fri Nov 06 01:33:08 +0000 2015,2,0,What sort of signals are you sending with your body language? https://t.co/UV8NVcToNN https://t.co/XlGFijDFo7
190,662423448795389952,Fri Nov 06 00:17:12 +0000 2015,2,2,Salespeople: 3 Signs You’re Not Working Hard Enough https://t.co/ZCzxypbuBC https://t.co/W4DxHP7zkm
191,662405122471936001,Thu Nov 05 23:04:22 +0000 2015,0,0,Stop being so easy. https://t.co/nnPi8Q4jp9 https://t.co/bjbRZL78Pf
192,662378635786100736,Thu Nov 05 21:19:07 +0000 2015,2,2,"If you’re really shaking about being replaced by a robot, then start acting more human! https://t.co/I7DRidpZZt https://t.co/pMWEOXWX9y"
193,662340126828269568,Thu Nov 05 18:46:06 +0000 2015,0,0,One Trick To Selling Big F*ing Deals https://t.co/dqEAiJgUp5 https://t.co/qnttw5lCNJ
194,662318234792783872,Thu Nov 05 17:19:07 +0000 2015,0,1,Salespeople don’t dial it back https://t.co/tZkpFsPcbF https://t.co/A7n58dCKjY
195,662264124471181312,Thu Nov 05 13:44:06 +0000 2015,0,1,"Sales Guys, Take a Cue from The Donald https://t.co/r9N2TAD4nj https://t.co/KiaPeSH3Kj"
196,662260699645784064,Thu Nov 05 13:30:29 +0000 2015,0,2,New blog post: What Improv Comedy Can Teach Salespeople https://t.co/88LYeNV9MU https://t.co/IVCyQRlaq6
197,662258604238487553,Thu Nov 05 13:22:10 +0000 2015,1,2,What Improv Comedy Can Teach Salespeople https://t.co/ngKUhv9f61 https://t.co/xWm2CByvyb
198,662177728003776512,Thu Nov 05 08:00:47 +0000 2015,0,0,3 Tips to Prevent Price Negotiations from Jeopardizing Your Deals https://t.co/22t8VhtJOj https://t.co/AwH3Z7m7aR
199,662115921209765888,Thu Nov 05 03:55:11 +0000 2015,3,3,I’m a big fan of asking budget questions early. https://t.co/MI3z2q7onY https://t.co/6HtaSZebV1
