,id_str,created_at,retweet_count,favorite_count,text
0,669069001050427392,Tue Nov 24 08:24:15 +0000 2015,0,1,"No Matter What Those Guys in Silicon Valley Tell You, Don't Worry!!  https://t.co/tw9CFT8FIE https://t.co/MmYPvLH7Ob"
1,669042519645274112,Tue Nov 24 06:39:01 +0000 2015,0,0,5 Things That New Sales Reps Need To Do https://t.co/3HCRlPpb8B https://t.co/GMQ7tWfPjd
2,668949987536060416,Tue Nov 24 00:31:20 +0000 2015,1,0,Asking “what’s your budget for this” often isn’t effective because... https://t.co/5qMroQ9X0D https://t.co/vUpqjPNhiH
3,668932189925597184,Mon Nov 23 23:20:36 +0000 2015,0,0,"Most technologies aren’t smart enough to schedule a meeting, let alone steal your sales job. https://t.co/TUmOKUyP9u https://t.co/dteOF7ZNa9"
4,668915758978768896,Mon Nov 23 22:15:19 +0000 2015,0,0,Sales Manager Steals All the Credit? https://t.co/LMSwjWQhxq https://t.co/7GloXWl5PZ
5,668890537479507968,Mon Nov 23 20:35:06 +0000 2015,0,0,FAA task force recommends pilots of drones be registered  https://t.co/63TW97kFPH
6,668873169411964928,Mon Nov 23 19:26:05 +0000 2015,2,3,The Three Magic Numbers for you next Sales job interview! https://t.co/03pbstDcoq https://t.co/nufj6PXi5J
7,668855806700462081,Mon Nov 23 18:17:05 +0000 2015,1,1,Did u ever kick urself for not seeing an opportunity that was right in front of your eyes?  https://t.co/zJMJ9qagcX https://t.co/mY2TTVbJPQ
8,668844744664088582,Mon Nov 23 17:33:08 +0000 2015,0,2,Find a Way to Enjoy Working Hard https://t.co/C0mnf25qCe https://t.co/roFfSS5H8t
9,668822153270308866,Mon Nov 23 16:03:22 +0000 2015,1,0,Being the Most Popular Sales Guy is Seriously Underrated  https://t.co/8HZB8zAuJo https://t.co/FgAwffYcHt
10,668789695556542464,Mon Nov 23 13:54:23 +0000 2015,0,0,Flip The Script on Your Next Sales Job Interview https://t.co/cjlSOVAklS https://t.co/59nVNj5cKm
11,668780318736965632,Mon Nov 23 13:17:07 +0000 2015,0,1,"@CoachSchroeds thanks! We have a ""coach"" persona in the app"
12,668706579202637824,Mon Nov 23 08:24:07 +0000 2015,0,0,"No, Amy is not a person, Amy is a robot. https://t.co/G9BShxWlfZ https://t.co/oJNnLd7Eym"
13,668680129955143680,Mon Nov 23 06:39:01 +0000 2015,1,0,3 Tips to Prevent Price Negotiations from Jeopardizing Your Deals https://t.co/j4V1WKXVLb https://t.co/pDBbSCrvPj
14,668587539301842945,Mon Nov 23 00:31:05 +0000 2015,0,0,You can’t avoid the dreaded phone call in sales https://t.co/T4XzCI0vP6 https://t.co/JSjqIb5biL
15,668569660837769216,Sun Nov 22 23:20:03 +0000 2015,0,0,Phone Calls Are the Lifebread of Sales https://t.co/qzKeMTDMry https://t.co/q4lbzeBeiS
16,668553303941361670,Sun Nov 22 22:15:03 +0000 2015,1,0,How To Stay In Touch With Your Prospects https://t.co/qEjwdCmsyS https://t.co/pa5Rubxhed
17,668528316945719298,Sun Nov 22 20:35:46 +0000 2015,2,2,"Chicago Becomes the First Big City to Enact Drone Regulations, Nails Them  https://t.co/lqaBsnMbZt"
18,668519231772848128,Sun Nov 22 19:59:39 +0000 2015,0,2,The Knicks' win in Houston was their first in a decade  https://t.co/2qlLTaGBaF
19,668512717473505281,Sun Nov 22 19:33:46 +0000 2015,0,0,@edwardlife how about a more modern reference:  https://t.co/MkJXyiyAR8
20,668510781605048321,Sun Nov 22 19:26:05 +0000 2015,0,2,I would rather people hate me or love me – it’s indifference I can’t stand. https://t.co/ypYGoSvTvI https://t.co/zagVQDUXIi
21,668493399339753472,Sun Nov 22 18:17:01 +0000 2015,2,2,Don't Let Your Sales Engineer Ruin Your Meetings https://t.co/YkviUlJmd0 https://t.co/XfwEBi2aQZ
22,668482405385269248,Sun Nov 22 17:33:19 +0000 2015,0,0,Do you remember life before LinkedIn? https://t.co/ZGoP9n56YM https://t.co/teak2Gvbs5
23,668459694428672000,Sun Nov 22 16:03:05 +0000 2015,0,0,It’s important to walk the walk AND talk the talk. https://t.co/1Ee1Rx5Uqb https://t.co/ndGT6m3Vp4
24,668443892308643841,Sun Nov 22 15:00:17 +0000 2015,0,0,@adamhonig thanks! If they were using Spiro the app would guide them that way too
25,668427234428985344,Sun Nov 22 13:54:06 +0000 2015,1,3,Take a cue from Jerry Maguire and ask your prospects to show you the money. https://t.co/lbEMPOKHje https://t.co/9lPHdZFnAe
26,668417624825548800,Sun Nov 22 13:15:55 +0000 2015,1,4,"The Economist | The industrial internet of things: Machine learning
https://t.co/6dvk2wDn1Z via @TheEconomist"
27,668344166179577856,Sun Nov 22 08:24:01 +0000 2015,1,2,Just because you’re chattering away doesn’t mean anyone’s listening. https://t.co/Dt0x08WJjx https://t.co/Tr7qHgr4CV
28,668317767251173376,Sun Nov 22 06:39:07 +0000 2015,3,3,"If your prospects aren’t a good fit or are dragging you along, move on.  https://t.co/o0qGaVdVuf https://t.co/ZRQ14UJkyS"
29,668225207266508802,Sun Nov 22 00:31:19 +0000 2015,1,2,"Rome wasn’t built in a day, and neither is your next sale.  https://t.co/7MaOFgpMZy https://t.co/ZhUqDb0GM3"
30,668207330123730944,Sat Nov 21 23:20:16 +0000 2015,0,1,Have the Budget Talk With Prospects Now and Thank Me Later https://t.co/lhYTs4P1no https://t.co/gqye2Qh7bH
31,668190941564530689,Sat Nov 21 22:15:09 +0000 2015,0,1,What Improv Comedy Can Teach Salespeople https://t.co/Wj0VX4ARde https://t.co/dwA8AiU9Xg
32,668184942942298112,Sat Nov 21 21:51:19 +0000 2015,0,0,@pkieldog amazing!
33,668156371796389889,Sat Nov 21 19:57:47 +0000 2015,0,0,@pkieldog really? Sales jobs?
34,668148376689577984,Sat Nov 21 19:26:01 +0000 2015,1,1,Millennials Might Make the Best Sales Reps Ever https://t.co/KTNDdGoHwD https://t.co/ncQ9tYCtY2
35,668131037977960448,Sat Nov 21 18:17:07 +0000 2015,3,0,The first step is doing your homework so you know your prospect. https://t.co/N48FHbL6v6 https://t.co/BwZtJSFcB9
36,668120003292565504,Sat Nov 21 17:33:16 +0000 2015,0,0,You should think twice before clicking submit on that claim form for LinkedIn. https://t.co/S9SEe2bJAv https://t.co/6qvrwEOJG5
37,668097319280201729,Sat Nov 21 16:03:08 +0000 2015,3,2,If your sales engineer won’t let your customer get a word in – STOP THEM. https://t.co/rR2pctLYAb https://t.co/fmauiWPuu9
38,668064845112188929,Sat Nov 21 13:54:05 +0000 2015,1,1,Should A Salesperson Ever Leave A Voicemail? https://t.co/0toSbfK1he https://t.co/SpWp5WpcDc
39,667981829513846784,Sat Nov 21 08:24:13 +0000 2015,0,1,What is Sandbagging? https://t.co/y9bajknFUc https://t.co/IMhjmpRA3o
40,667955397525954560,Sat Nov 21 06:39:11 +0000 2015,1,1,Three Tips To Help You Achieve 150% Of Your Quota https://t.co/DAEaJvL7Qf https://t.co/oNHH4eYHsH
41,667862745543520258,Sat Nov 21 00:31:01 +0000 2015,0,0,"Sales Guys, Take a Cue from The Donald https://t.co/vtfx1yIj09 https://t.co/LYdLq1np27"
42,667844878064308229,Fri Nov 20 23:20:01 +0000 2015,0,0,Turn Networking Inside Out https://t.co/IfRVJNnsaZ https://t.co/bt0QTPOfh8
43,667828602910601216,Fri Nov 20 22:15:21 +0000 2015,0,0,"Let's Not Go Suing LinkedIn, Salespeople https://t.co/q4nWYcVnhB https://t.co/xvdr0zdVc7"
44,667811767481856000,Fri Nov 20 21:08:27 +0000 2015,2,0,RT @SpiroHQ: Who told the @NewYorker about Spiro?  Perhaps they're using Spiro's R-Rated personality. https://t.co/Rk4jkwmqyq https://t.co/…
45,667786077244145664,Fri Nov 20 19:26:22 +0000 2015,0,2,Your deals can be this big if you play your cards right. https://t.co/F9ybNACqk7 https://t.co/hmnIIEVTaE
46,667768626070560769,Fri Nov 20 18:17:01 +0000 2015,0,0,5 Traits of a Bad Sales Manager https://t.co/dBGezkD030 https://t.co/at9WOLISxL
47,667757606077898752,Fri Nov 20 17:33:14 +0000 2015,0,0,When Is It Okay To Leave A Voicemail? https://t.co/8Ii5SkfxJk https://t.co/guq0oAEOZk
48,667734953459851265,Fri Nov 20 16:03:13 +0000 2015,0,1,Work Harder to Close More Deals and get More Money https://t.co/D3TrsrDDCj https://t.co/3KEKWn7IIH
49,667702465207377920,Fri Nov 20 13:54:07 +0000 2015,0,1,Improv Teaches You How to Deal with the Unexpected https://t.co/J8XSFcZC9Z https://t.co/xx4Ja3WicC
50,667619458920378368,Fri Nov 20 08:24:17 +0000 2015,0,2,Again: Phone calls are the best way to get in touch and keep in touch with prospects. https://t.co/6IbOxjGpGp https://t.co/02jkE1Xj40
51,667593000000843776,Fri Nov 20 06:39:09 +0000 2015,0,0,Don't Waste Your Time On Just One Buyer https://t.co/k3BS0PllJQ https://t.co/uIXxRqNmzC
52,667500408076660736,Fri Nov 20 00:31:13 +0000 2015,1,2,The five most important things I would teach a new sales rep. https://t.co/TUcQSgmU4l https://t.co/JI0wLeEJHz
53,667482526164848640,Thu Nov 19 23:20:10 +0000 2015,2,2,How do you make sales without sounding like a salesperson?  https://t.co/5K8oRUA1Qv https://t.co/oqKSNfXppU
54,667466189447282688,Thu Nov 19 22:15:15 +0000 2015,0,0,The Donald Uses The Authority Principle to Gain Influence https://t.co/hHUqKqBkIf https://t.co/XbLN18MpFb
55,667428916454408192,Thu Nov 19 19:47:08 +0000 2015,1,0,RT @SteveDaniels_BG: @adamhonig @NewYorker I've been going back and forth between R Rated and Surfer lately!
56,667423605995741184,Thu Nov 19 19:26:02 +0000 2015,0,0,Don't Waste Your Time On Just One Buyer https://t.co/sRne1wtZ2Q https://t.co/HQvmNmaUcP
57,667406258945794050,Thu Nov 19 18:17:06 +0000 2015,1,3,Who told the @NewYorker about Spiro?  Perhaps they're using Spiro's R-Rated personality. https://t.co/aVrjvL0SIA https://t.co/JjSw0fnVef
58,667405883731779585,Thu Nov 19 18:15:37 +0000 2015,2,0,"RT @PlayBiggerBook: Some companies play by the rules, leaders play bigger by creating and dominating markets"
59,667395170242068481,Thu Nov 19 17:33:02 +0000 2015,0,2,One Trick To Selling Big F*ing Deals https://t.co/CyUSFb8wlR https://t.co/HFPoKncAF8
60,667374789938556929,Thu Nov 19 16:12:03 +0000 2015,0,0,"""Give me all your money, and I'll make some origami, honey."" Great lyric @courtneymelba #awesome ♫ https://t.co/UQbBWJffKu"
61,667372574314209281,Thu Nov 19 16:03:15 +0000 2015,0,2,When Is It Time For Salespeople To Push Past No (And When Not To) https://t.co/0w1ofrtQEn https://t.co/W1UUd4SUPL
62,667343729817202688,Thu Nov 19 14:08:38 +0000 2015,1,1,How ‘Treat Yourself’ Became a Capitalist Command  https://t.co/MGREHmIbXu
63,667340139262275584,Thu Nov 19 13:54:22 +0000 2015,0,1,"In sales, it’s always possible to up the ante and dream bigger, especially with Spiro! https://t.co/wmbXfCmWfO https://t.co/c78EsppO9V"
64,667339207866757120,Thu Nov 19 13:50:40 +0000 2015,0,1,New blog post: The Best Sales Networking Opportunities Are Right In Front of Your Face https://t.co/X856c5vCVL https://t.co/MTehJSncrs
65,667336806052970496,Thu Nov 19 13:41:07 +0000 2015,1,2,The Best Sales Networking Opportunities Are Right In Front of Your Face https://t.co/697X3Xv5PY https://t.co/elB6rwk9cy
66,667257043322068992,Thu Nov 19 08:24:10 +0000 2015,3,2,Sherlock Holmes' Secret Sales Power https://t.co/MwsNSMmE0v https://t.co/Pd32xUxwGM
67,667230592778547201,Thu Nov 19 06:39:04 +0000 2015,1,3,Nothing would make us happier than to hear you’re making half a mill... https://t.co/BKFhY483rE https://t.co/sWFEonkHUm
68,667138007896559618,Thu Nov 19 00:31:10 +0000 2015,2,1,...we were watching a sales engineer absolutely BOMB a meeting. https://t.co/Not0aZXjyk https://t.co/CRZltBYBTj
69,667126018394693632,Wed Nov 18 23:43:32 +0000 2015,0,0,@Clientologist true but working smarter is often working harder
70,667120151268089856,Wed Nov 18 23:20:13 +0000 2015,0,0,A lot of sales is about reading between the lines https://t.co/Bj54RoYeMV https://t.co/P1tvUoxAGB
71,667103803724972032,Wed Nov 18 22:15:15 +0000 2015,0,1,A Powerful Psychological Trigger https://t.co/Qu7Cu9MoW3 https://t.co/vSUKI4Sl5f
72,667061251458146304,Wed Nov 18 19:26:10 +0000 2015,3,5,Salespeople: 3 Signs You’re Not Working Hard Enough https://t.co/2lzvaixNMp https://t.co/TEx9PlJ0sb
73,667043897575649285,Wed Nov 18 18:17:12 +0000 2015,0,1,Salespeople don’t operate under the same rules as everyone else. https://t.co/Ly64tiGCjp https://t.co/PcFn9sa7hs
74,667032842577268738,Wed Nov 18 17:33:17 +0000 2015,0,2,"“So whatta you got for me, sport? Why are you here?” https://t.co/Cpu3xFpyUX https://t.co/7CLLvp9LFk"
75,667010157948313600,Wed Nov 18 16:03:08 +0000 2015,0,0,"Bad sales managers can not only drain your morale, they can also drain your paycheck https://t.co/1UNdqzC7WZ https://t.co/m0RLHD7GMu"
76,667007358242045954,Wed Nov 18 15:52:01 +0000 2015,3,0,RT @AskForensics: 3 Reasons Why Millennials are the Best Sales Reps Ever | https://t.co/tpb8zYMcOk https://t.co/bf5VrQ6iVX Great read @adam…
77,666977709000642560,Wed Nov 18 13:54:12 +0000 2015,0,0,Would You Wear a Suit to a Surf Shop?  https://t.co/D3z0umhdn3 https://t.co/rC6N1hLJvu
78,666968243828060161,Wed Nov 18 13:16:35 +0000 2015,0,2,Make today your day. It's your day most likely to be successful getting a prospect on the phone. https://t.co/IYav2idw4h
79,666894614989832192,Wed Nov 18 08:24:01 +0000 2015,0,0,Use Positive Psychology to Strengthen Your Sales Career https://t.co/6hgHyUiUZF https://t.co/c7hJG11A0h
80,666868215444856832,Wed Nov 18 06:39:07 +0000 2015,0,1,Everything you need to know to make MORE MONEY. https://t.co/l1W9QzOBTW https://t.co/F8jW392kc3
81,666816705218396161,Wed Nov 18 03:14:26 +0000 2015,0,0,Barack Obama can’t remember the names of ‘Game of Thrones’ characters either https://t.co/SAIDROoHfT
82,666775610807689217,Wed Nov 18 00:31:08 +0000 2015,2,0,What distinguishes good salespeople from great https://t.co/PV1g6iKZ97 https://t.co/92BhVYJbF0
83,666757760135110659,Tue Nov 17 23:20:12 +0000 2015,0,0,How To Get Away With Sandbagging https://t.co/9FnDtJUeQu https://t.co/4PwhpcPema
84,666741396284510208,Tue Nov 17 22:15:10 +0000 2015,3,3,Salespeople love money and – surprise! – that’s not a bad thing. https://t.co/QiOvOhzNQD https://t.co/by8R4N91Ms
85,666698888326328321,Tue Nov 17 19:26:16 +0000 2015,1,2,There’s No Way Around It: You Need To Learn How to Manage Stress https://t.co/ZxEPKw7k22 https://t.co/FtsZO69Dat
86,666681489262837760,Tue Nov 17 18:17:08 +0000 2015,0,0,We’re all about sales guys making a sick amount of money. https://t.co/SxCO1bA7tY https://t.co/Y3oERYlwkM
87,666670419416625153,Tue Nov 17 17:33:08 +0000 2015,1,4,"Now on the #Salesforce @AppExchange: Spiro, personal sales assistant for @Salesforce https://t.co/QQF1qsz7VC https://t.co/4yAXS05WBV"
88,666647830086422528,Tue Nov 17 16:03:23 +0000 2015,1,0,Millennials are coming in and doing so boldly. https://t.co/4B6LlJmK7O https://t.co/rNYOQxIsM9
89,666622417440231424,Tue Nov 17 14:22:24 +0000 2015,3,0,RT @alevi: We wouldn’t be where we are today without a platform like #Heroku @SpiroHQ @heroku  https://t.co/luTeUxqLEJ
90,666616069268877313,Tue Nov 17 13:57:10 +0000 2015,3,3,New blog post: Millennials Might Make the Best Sales Reps Ever https://t.co/bZpCDHJw8T https://t.co/b5kuog438r
91,666615301698621440,Tue Nov 17 13:54:07 +0000 2015,0,0,"Salespeople, What Would You Do With More Money? https://t.co/NTdSP9NiO2 https://t.co/SfaxGm7sgC"
92,666613568406577152,Tue Nov 17 13:47:14 +0000 2015,1,1,Millennials Might Make the Best Sales Reps Ever https://t.co/tM2CmWX8NN https://t.co/eeHWAUi7JV
93,666571798943801344,Tue Nov 17 11:01:15 +0000 2015,0,0,#Heroku Customer Success: Spiro Technologies https://t.co/5tkB3CrIy5 #salesforce
94,666532250276769792,Tue Nov 17 08:24:06 +0000 2015,0,0,Use the Authority Principle To Boost Your Sales https://t.co/uBAwEyzZRo https://t.co/XvLFe8FjHj
95,666505805152301056,Tue Nov 17 06:39:01 +0000 2015,1,0,Is Swearing the Secret Sauce to Successful Sales Relationships?  https://t.co/OEZGAnzjTK https://t.co/fMlE1gONjg
96,666413218626199554,Tue Nov 17 00:31:07 +0000 2015,2,5,"Remember that sales is not about you, it’s about your customer. https://t.co/HFlwQSbaJd https://t.co/QcIFGNAooM"
97,666395367093764096,Mon Nov 16 23:20:11 +0000 2015,0,1,Here at Spiro we’re all about sales guys making a sick amount of money. https://t.co/A1r3kalsDQ https://t.co/9ekCoDBasH
98,666379035006619654,Mon Nov 16 22:15:17 +0000 2015,2,3,You Got the Prospect On the Phone. Now What? https://t.co/qBBUlqWtU2 https://t.co/NlbEW1Vddh
99,666344291430735874,Mon Nov 16 19:57:13 +0000 2015,0,1,Why the US government is right to want to register drones  https://t.co/S8aRDcgDGr
100,666343325247610880,Mon Nov 16 19:53:23 +0000 2015,0,0,Shake Shack and the Rising Wages-Rising Prices Infinity Loop  https://t.co/r1QNhQT15L
101,666336462661623811,Mon Nov 16 19:26:07 +0000 2015,0,2,SPIRO IS FOR YOU (and for f r e e)  https://t.co/AYqylS2tYD https://t.co/XTGjcJ9ZNJ
102,666319112105271296,Mon Nov 16 18:17:10 +0000 2015,0,0,Find a Way to Enjoy Working Hard https://t.co/Oe9mYJAeNa https://t.co/cInpVdZLJI
103,666308009140834305,Mon Nov 16 17:33:03 +0000 2015,0,0,NO more data entry with Spiro!!!  https://t.co/AnIjee66Pn https://t.co/sSKJot5tBw
104,666285365892931585,Mon Nov 16 16:03:04 +0000 2015,0,2,"Spiro, your personal sales assistant for https://t.co/VqmXXr4M48 https://t.co/8yaJxlboRS https://t.co/w6bf8AZIoU"
105,666252905821941760,Mon Nov 16 13:54:05 +0000 2015,1,2,Salespeople Love Money... So What? https://t.co/PLoV4GDzZt https://t.co/MQ596XP7ZQ
106,666169841829679104,Mon Nov 16 08:24:01 +0000 2015,0,1,Salespeople like money and they need to own up to it.  https://t.co/74dfMKCoNQ https://t.co/tbfeAzBuOA
107,666143426912587776,Mon Nov 16 06:39:03 +0000 2015,2,1,Use Positive Psychology to Strengthen Your Sales Career https://t.co/MPGnI2UObz https://t.co/qiSanE8A9c
108,666050805062090752,Mon Nov 16 00:31:01 +0000 2015,1,2,How to Not Screw It Up When You Send Sales Emails https://t.co/psaZ9lcsNf https://t.co/PFGiSrql0v
109,666032960316030977,Sun Nov 15 23:20:06 +0000 2015,1,1,"No Matter What Those Guys in Silicon Valley Tell You, Don't Worry... https://t.co/4fNIrWisWA https://t.co/WcLUIPhwl6"
110,666016614786195456,Sun Nov 15 22:15:09 +0000 2015,1,0,Stop Thinking Negatively https://t.co/ZHUsXzGqr2 https://t.co/O1PzN1mC5Y
111,665974089035743232,Sun Nov 15 19:26:10 +0000 2015,0,0,Back Up Confidence with Capability https://t.co/12Gw5uAn9r https://t.co/pBGBYrUHyD
112,665956684397985795,Sun Nov 15 18:17:01 +0000 2015,1,0,5 Traits of a Bad Sales Manager https://t.co/QZ5tOS0yau https://t.co/Z8YLvQIpZc
113,665945632457232384,Sun Nov 15 17:33:06 +0000 2015,0,0,"Garbage In, Garbage Out https://t.co/9qk6s2nXZs https://t.co/PJkwLqZS6D"
114,665922985841336321,Sun Nov 15 16:03:06 +0000 2015,1,0,"Salespeople, Are You Ready For Q4? https://t.co/1bX4gTzgVI https://t.co/SytBZy5HE5"
115,665890503297249280,Sun Nov 15 13:54:02 +0000 2015,0,0,Slow Down and Observe https://t.co/tgcTbdX1oJ https://t.co/YqzFc3yxEp
116,665807493487067137,Sun Nov 15 08:24:11 +0000 2015,0,0,What Improv Comedy Can Teach Salespeople https://t.co/U8tXJSKdDd https://t.co/4NLi9E1nS9
117,665781032470335488,Sun Nov 15 06:39:02 +0000 2015,1,0,A Powerful Psychological Trigger https://t.co/zxuU0dv14M https://t.co/r7Y1U7Ex7c
118,665688417360039936,Sun Nov 15 00:31:01 +0000 2015,2,0,Spiro is Out of Beta!!  https://t.co/fa12Kippmt https://t.co/WP0zodE3Qr
119,665670612749299712,Sat Nov 14 23:20:16 +0000 2015,2,2,I'll say it again -  Calls are the best way to get in touch and keep in touch with prospects https://t.co/3h2ZiSqgSr https://t.co/DqINRlXsa3
120,665654216111890432,Sat Nov 14 22:15:07 +0000 2015,0,1,Go Over Heads If You Need To https://t.co/T4Ygppn58Q https://t.co/R5sDrkVkzn
121,665611678332149761,Sat Nov 14 19:26:05 +0000 2015,1,3,Determine Your Own Reality https://t.co/gzZRuF4DAp https://t.co/kl9irz5RQJ
122,665594300122734592,Sat Nov 14 18:17:01 +0000 2015,0,1,Take Notes and Meditate... https://t.co/gNc5mUvSbQ https://t.co/WYTvmDS18S
123,665583258239942656,Sat Nov 14 17:33:09 +0000 2015,0,1,Keep your socks on: Spiro is out of Beta and ready to rock your world. https://t.co/nhLN4DExZM https://t.co/FRsuJRT1TO
124,665560579730460672,Sat Nov 14 16:03:02 +0000 2015,0,0,Improv might help you! https://t.co/vpMJvxGU5M https://t.co/TvkVkhAjCJ
125,665528111333814272,Sat Nov 14 13:54:01 +0000 2015,0,0,Have the Budget Talk With Prospects Now and Thank Me Later https://t.co/c5NARLcveT https://t.co/BP1c650GKW
126,665445062269132800,Sat Nov 14 08:24:00 +0000 2015,1,2,How to Not Screw It Up When You Send Sales Emails https://t.co/m7KoyVQpBK https://t.co/h3DN3cueK2
127,665418636450996224,Sat Nov 14 06:39:00 +0000 2015,1,1,"Google Self-Driving Car Gets Pulled Over, Doesn't Get a Ticket https://t.co/FwNn8Vfkwx"
128,665326060964327424,Sat Nov 14 00:31:08 +0000 2015,2,1,Is Your Sales Manager Never Around? https://t.co/xfNUnrXSVs https://t.co/6czbByDrBp
129,665308166922485761,Fri Nov 13 23:20:02 +0000 2015,3,1,Use the Authority Principle To Boost Your Sales https://t.co/aIZHWlM0s5 https://t.co/6wmi1FmOrl
130,665291858390753280,Fri Nov 13 22:15:14 +0000 2015,1,2,Sherlock Holmes' Secret Sales Power https://t.co/DefT344tVx https://t.co/mLRLkNHEDe
131,665249310997667840,Fri Nov 13 19:26:10 +0000 2015,1,1,Sales Manager Steals All the Credit? https://t.co/HSkTmRbiFi https://t.co/LbgrhXoatq
132,665231932549111808,Fri Nov 13 18:17:06 +0000 2015,1,1,Don't Waste Your Time On Just One Buyer https://t.co/cTzxP7Ev5I https://t.co/w8tx7wVka3
133,665227754971885568,Fri Nov 13 18:00:30 +0000 2015,0,0,@paulcastain @SPMconsulting @SpiroHQ Hell yeah!
134,665220851193745410,Fri Nov 13 17:33:04 +0000 2015,0,2,“predictive intelligence”  https://t.co/i9YRcYF0Oz https://t.co/3SUEJCtV1Q
135,665198262664732673,Fri Nov 13 16:03:19 +0000 2015,1,1,Take a cue from Jerry Maguire and ask your prospects to show you the money. https://t.co/zV0j9XOeB8 https://t.co/YZekDGKTRP
136,665165793362071552,Fri Nov 13 13:54:17 +0000 2015,0,1,A lot of sales is about reading between the lines https://t.co/VSgqLlObJr https://t.co/UWPWCJX2S3
137,665082678337736704,Fri Nov 13 08:24:01 +0000 2015,0,2,...we’re all players on a stage https://t.co/1tn6Rd9R6Y https://t.co/koC6bVMrYi
138,665056270462898176,Fri Nov 13 06:39:05 +0000 2015,0,1,Emails are a dime a dozen. https://t.co/by2mdITwS9 https://t.co/5H5NqoaBPk
139,664963719634505728,Fri Nov 13 00:31:19 +0000 2015,1,0,Remember That You’re Not Here to Make Friends https://t.co/IwYoriIz9u https://t.co/nQdzp4qmPg
140,664945807943143424,Thu Nov 12 23:20:09 +0000 2015,1,1,Keep the Question Open-Ended https://t.co/qwhY4PKp5O https://t.co/c6xhVk2Vwq
141,664929448521805824,Thu Nov 12 22:15:08 +0000 2015,1,2,Does Your Sales Manager Know How To Lead? https://t.co/hT99h4vI5r https://t.co/VrSGsRmuBk
142,664886916882554881,Thu Nov 12 19:26:08 +0000 2015,1,1,It's Time To Get Excited: Spiro is Out of Beta https://t.co/o7qMbzGkCq https://t.co/RmCjG8osds
143,664869547690840064,Thu Nov 12 18:17:07 +0000 2015,1,1,"Let's Not Go Suing LinkedIn, Salespeople https://t.co/JdSlclIHGk https://t.co/tQZJAnWfiB"
144,664858511063588864,Thu Nov 12 17:33:16 +0000 2015,1,1,Use Positive Psychology to Strengthen Your Sales Career https://t.co/GB4ygbeq2Q https://t.co/75dNskgB24
145,664835830612156416,Thu Nov 12 16:03:08 +0000 2015,0,2,What Improv Comedy Can Teach Salespeople https://t.co/IO6We8sdOv https://t.co/fSvRdmI1a9
146,664803349494108161,Thu Nov 12 13:54:04 +0000 2015,0,1,It's Time To Get Excited: Spiro is Out of Beta https://t.co/lTWopqBn0r https://t.co/oXSRkJHgrc
147,664800081133064192,Thu Nov 12 13:41:05 +0000 2015,0,3,"New blog post: Salespeople, What Would You Do With More Money? https://t.co/2yfADdEYbO https://t.co/qo5TLemyAg"
148,664797885288943616,Thu Nov 12 13:32:21 +0000 2015,2,0,"Salespeople, What Would You Do With More Money? https://t.co/AoxHJMlcfp https://t.co/kiSGICpv1W"
149,664720315768045568,Thu Nov 12 08:24:07 +0000 2015,1,0,Google’s New “About Me” Page Lets You Control… https://t.co/Udu0sScpQT
150,664693871692095488,Thu Nov 12 06:39:03 +0000 2015,0,0,"Philosophers Don’t Get Much Respect, But Their Earnings Don’t Suck https://t.co/yT0dZOi3XE"
151,664601336449773569,Thu Nov 12 00:31:20 +0000 2015,2,0,RT @NinJoan: Low confidence use @SpiroHQ R-Rated Settings he will give you the boost that you need. @adamhonig https://t.co/B0ZpqsgXgz
152,664578137859235840,Wed Nov 11 22:59:09 +0000 2015,4,0,RT @SalesMktMgmt: 3 Reasons Why Millennials are the Best Sales Reps Ever article @adamhonig @SpiroHQ https://t.co/AuHtgAnvAF
153,664505656150499328,Wed Nov 11 18:11:09 +0000 2015,1,1,LinkedIn is setting daily and monthly limits on notifications for users https://t.co/P5FxFIMd3w
154,664186922407849984,Tue Nov 10 21:04:36 +0000 2015,0,0,@mbellows were happy to come by and give you a demo whenever you like. We're based in Boston.
155,664092598492127232,Tue Nov 10 14:49:48 +0000 2015,2,1,It's Time To Get Excited: Spiro is Out of Beta https://t.co/M6WdQx6HRR
156,664085339083055104,Tue Nov 10 14:20:57 +0000 2015,0,2,New blog post: It’s Time To Get Excited: Spiro is Out of Beta https://t.co/KjmZAhQwbK https://t.co/vecOEj16WG
157,664083914110189568,Tue Nov 10 14:15:17 +0000 2015,0,1,"Spiro is serious about its R-rated, joke-laden sales assistant app  https://t.co/9r1DmR8bjb"
158,663781217951752192,Mon Nov 09 18:12:29 +0000 2015,0,0,New blog post: What Improv Comedy Can Teach Salespeople https://t.co/K9ZISSgDyS https://t.co/D4uDnhzKy4
159,663479886565285888,Sun Nov 08 22:15:06 +0000 2015,2,4,Salespeople Love Money... So What? https://t.co/8tBCLV50w2 https://t.co/oFdagNr7zK
160,663437349154607105,Sun Nov 08 19:26:04 +0000 2015,1,2,Take a cue from Jerry Maguire and ask your prospects to show you the money. https://t.co/KCSeUdngLG https://t.co/GzYUVsosRa
161,663420015421599746,Sun Nov 08 18:17:12 +0000 2015,4,7,“Money is not going to make itself.” https://t.co/1B1cvLQm4p
162,663409027238526976,Sun Nov 08 17:33:32 +0000 2015,2,2,How to Not Screw It Up When You Send Sales Emails https://t.co/fnNIffEkfW https://t.co/0Duo24oVGN
163,663386280873566208,Sun Nov 08 16:03:09 +0000 2015,0,1,"Let's Not Go Suing LinkedIn, Salespeople https://t.co/EInE8eR485 https://t.co/kbRIH5HmEE"
164,663353779853656064,Sun Nov 08 13:54:00 +0000 2015,1,0,How to Stop Swearing so Damn Much  https://t.co/9vJ5DOXYs0
165,663270759134048256,Sun Nov 08 08:24:06 +0000 2015,1,4,Use Positive Psychology to Strengthen Your Sales Career https://t.co/yCtndRdwDq https://t.co/1UrukIqNGu
