,id_str,created_at,retweet_count,favorite_count,text
153,631234771998257153,Tue Aug 11 22:44:32 +0000 2015,14,22,If your relationship is strained maybe you're not communicating the information they need in the way they need to hear it. #BeAccoutable
154,631107138262208512,Tue Aug 11 14:17:21 +0000 2015,0,1,@Yannick_Ilunga I'm having a great week and I hope you are also.
155,631106995395801089,Tue Aug 11 14:16:47 +0000 2015,0,1,@CEOEffectivenes Great!  Have a wonderful day too!
156,631106339356307461,Tue Aug 11 14:14:11 +0000 2015,17,19,"Accountable leaders care about the people they lead, not because they have to, because they want to. #BeAccountable"
157,630769931181686784,Mon Aug 10 15:57:25 +0000 2015,19,27,"People want to connect to authentic people. Share your whole story, good and bad. #KeepItReal #BeAccountable"
158,630590741253783552,Mon Aug 10 04:05:23 +0000 2015,12,15,Want to change what you're getting? Change what you*re thinking. #BeAccountable
159,630590390949666817,Mon Aug 10 04:03:59 +0000 2015,1,0,@VibeOne379 Thank you Kerry!
160,630590309529878528,Mon Aug 10 04:03:40 +0000 2015,0,0,@to_steen Thanks Tommy.
161,630590003538563072,Mon Aug 10 04:02:27 +0000 2015,0,0,@XpandYourBrand Thank you. Stay well.
162,630589798835576832,Mon Aug 10 04:01:38 +0000 2015,0,1,@theaussieauthor Yep. We gotta live it.
163,630589705805955072,Mon Aug 10 04:01:16 +0000 2015,0,0,@orlyzeewy Me too!
164,630589626785214464,Mon Aug 10 04:00:57 +0000 2015,0,0,@Kerry_Engmark You too and stay well.
165,630589417715990529,Mon Aug 10 04:00:07 +0000 2015,1,4,"@podiumwisdom People are accountable when they are inspired to be accountable, not told to be. Discuss what you value and live it always!"
166,630588827866796032,Mon Aug 10 03:57:46 +0000 2015,0,0,@Amber_DeLaGarza Thanks for the feedback and for sharing.
167,630588203670462464,Mon Aug 10 03:55:18 +0000 2015,0,0,@kentheduffer Thank you Ken. I always enjoy hearing that. Non-Negotiable is the follow-up book. Very powerful!
168,630587644813033473,Mon Aug 10 03:53:04 +0000 2015,0,0,@aunee47 Great! Check into http://t.co/R4nteuexL5
169,630587424234573824,Mon Aug 10 03:52:12 +0000 2015,24,27,Make it your business to help the people around you achieve their goals. You'll have an army of people helping you with yours #BeAccountable
170,630439816325283840,Sun Aug 09 18:05:39 +0000 2015,6,8,"When delivering honest feedback to people, how you say it is as important as whet you say. Be supportive. #BeAccountable"
171,630097168808808448,Sat Aug 08 19:24:06 +0000 2015,12,10,When you find the good in other people you will also discover and focus what's good in you. #BeAccountable
172,629762516864774144,Fri Aug 07 21:14:19 +0000 2015,4,11,"""Accountability Is Flowing"" by @SamSilverstein on @LinkedIn https://t.co/84XvahENtE"
173,629637088393035776,Fri Aug 07 12:55:54 +0000 2015,19,30,When you really care about people you create a more meaningful relationship. That kind of relationship births accountability. #BeAccountable
174,629437995255336960,Thu Aug 06 23:44:47 +0000 2015,25,26,"We all make mistakes. When you do, fix them fast and keep your commitments to the people around you. #BeAccountable"
175,628937433007067137,Wed Aug 05 14:35:43 +0000 2015,13,15,Build accountability in your relationships and in your life. #BeAccountable http://t.co/9hxnusRp7F
176,628584814052929536,Tue Aug 04 15:14:32 +0000 2015,28,32,"Don't hold someone accountable, help them be accountable. It's a whole different attitude and you get a different result. #BeAccountable"
177,628583866777927680,Tue Aug 04 15:10:47 +0000 2015,14,16,"Get upset with people who don't act right, not because they don't look right. #BeAccountable"
178,628581445955551232,Tue Aug 04 15:01:09 +0000 2015,19,19,There are great interviews daily at http://t.co/hRGBX2cig0  @leislooski http://t.co/B1Hp3nOOa9
179,628213862052044800,Mon Aug 03 14:40:31 +0000 2015,27,31,Accountability is keeping your commitments to people. When you stop thinking about people you stop being accountable. #BeAccountable
180,627896006567313408,Sun Aug 02 17:37:28 +0000 2015,4,4,"@MDavisMedia Stay on that journey. It will talk you to amazing places,"
181,627859025993056256,Sun Aug 02 15:10:31 +0000 2015,13,18,If you don’t grow your people you can’t grow your organization. #BeAccountable
182,627578829091942400,Sat Aug 01 20:37:07 +0000 2015,1,1,"@MsFrenchy06 It's a virtual gathering taking place daily, now through August 16th.  Different speakers every day."
183,627562407913590784,Sat Aug 01 19:31:52 +0000 2015,5,3,"Great lineup of speakers for the virtual gathering, The Art of Mindful Wealth Summit! http://t.co/z7NOnpTgZu"
184,627543558979850240,Sat Aug 01 18:16:58 +0000 2015,12,10,The problem isn’t that your workers aren’t accountable. The problem is you don’t know why your workers aren’t accountable. #BeAccountable
185,627537502790746112,Sat Aug 01 17:52:54 +0000 2015,7,9,It is an honor to participate in this program. Check it out. http://t.co/dGdTourBBc
186,627491517981151233,Sat Aug 01 14:50:10 +0000 2015,10,14,People don’t do what they’re supposed to do because you pay them. If that were true we wouldn’t have companies with problems. #BeAccountable
187,627121635548659712,Fri Jul 31 14:20:23 +0000 2015,35,29,"Real change always starts with a change in thinking, not a change in doing. #BeAccountable"
188,626768329412206592,Thu Jul 30 14:56:29 +0000 2015,16,19,When people believe in the purpose and mission of the organization they commit to achieving the goals of the organization. #BeAccountable
189,626428020224438272,Wed Jul 29 16:24:13 +0000 2015,20,23,Some times things aren't what they seem. Get all of the information before passing judgement and making decisions. #BeAccountable
190,626402581498036224,Wed Jul 29 14:43:08 +0000 2015,10,6,What you think about drives what decisions you make and the results you get. #BeAccountable http://t.co/AfurUhod12
191,626244534804975616,Wed Jul 29 04:15:06 +0000 2015,14,17,The better you build relationships with the people you lead the better you know how to serve them. #BeAccountable
192,626040815077466112,Tue Jul 28 14:45:36 +0000 2015,17,14,When I see how you treat other people I know what you think about me. #BeAccountable
193,625636043388256258,Mon Jul 27 11:57:11 +0000 2015,29,22,"We face challenges every day. Focus on what you can control in the situation, make decisions and get results. #BeAccountable"
194,625437920992694273,Sun Jul 26 22:49:55 +0000 2015,1,1,@BarbaraKimmel You're right. Consistency is critical!
195,625331467166486528,Sun Jul 26 15:46:54 +0000 2015,21,20,It's easier to make excuses. It's better to keep your commitments. #BeAccountable
196,625079777586589696,Sat Jul 25 23:06:47 +0000 2015,1,4,@upixmusic Hi Christopher. Just help spread our message of accountability. Stay well.
197,625053908491202560,Sat Jul 25 21:23:59 +0000 2015,22,23,If you want people to help you reach your goals you better make it a priority to help them reach theirs. #BeAccountable
198,624717889774460928,Fri Jul 24 23:08:46 +0000 2015,9,13,If you see a difference in people then you will see a difference in need to be accountable to all people. #BeAccountable
199,624319174966312961,Thu Jul 23 20:44:25 +0000 2015,15,16,Accountability is keeping your commitments to people. #BeAccountable
