,id_str,created_at,retweet_count,favorite_count,text
134,600301410878660608,Mon May 18 14:06:24 +0000 2015,0,0,800 MI young adults exiting foster care a/year must have opportunities they deserve. @MichChildren's Issues Report http://t.co/MOoKQfLDiK
135,600299870772137984,Mon May 18 14:00:16 +0000 2015,0,0,National Foster Care Month: @MichChildren connects children in foster care with policymakers since 1996. http://t.co/MOoKQfLDiK
136,600299614294671360,Mon May 18 13:59:15 +0000 2015,0,0,Get to Know the Many Faces of Foster Care' during National Foster Care Month. U.S. Health &amp; Human Services report: http://t.co/wX6wtDYuZy
137,597806399767314432,Mon May 11 16:52:07 +0000 2015,1,0,Let's strengthen MI's foster care system -- foster families and families of origin -- to help  all kids thrive.http://t.co/o8saxYx2VO
138,597509619804672000,Sun May 10 21:12:49 +0000 2015,42,0,RT @Campaign4Kids: Ending Youth Homelessness | @WhiteHouse - http://t.co/RX4Z56f34S Administration should support @SenFeinstein's #HCYA htt…
139,597030587967246337,Sat May 09 13:29:19 +0000 2015,0,0,"Post Prop 1, @MichChildren is keeping eye on impact other road-fix plans will have on programs for kids &amp; families http://t.co/fdMsE0vdbK"
140,596343748981817346,Thu May 07 16:00:03 +0000 2015,1,0,@MichChildren invites you to learn more about foster care &amp; improving policies during National Foster Care Month http://t.co/wX6wtDYuZy
141,595540724029857792,Tue May 05 10:49:07 +0000 2015,0,0,It's Election May in MI. Polls open 7 a.m. to 8 p.m. Want to know where your voting place is?  See:  https://t.co/chL3x7Wg9O
142,595292980266807296,Mon May 04 18:24:41 +0000 2015,0,0,Mayor Duggan says Prop 1 is good for Detroit. It's good for Michigan. On the Good Roads Tour @MichChildren http://t.co/AnoZHEgS4m
143,595286248039776256,Mon May 04 17:57:56 +0000 2015,0,0,"Getting ready for Safe Roads Yes remarks at Eastern Market, Detroit. http://t.co/dHBZkIGhGM"
144,595260336049135617,Mon May 04 16:14:58 +0000 2015,0,0,"'If you're a supporter of education, this is an outstanding proposal. Let's get it done.' Governor tells a school official."
145,595259672828977152,Mon May 04 16:12:20 +0000 2015,0,0,"Taking Q&amp;A, Snyder says there's no Plan B. This one got 2/3rd vote in the Legislature, an extraordinary thing"
146,595256590984413184,Mon May 04 16:00:05 +0000 2015,0,0,"With Gov. Snyder and Coalition in Howell. ""If we don't do this we're back to the drawing board."""
147,595253145355321344,Mon May 04 15:46:23 +0000 2015,0,0,@MichChildren
148,595229535848759296,Mon May 04 14:12:34 +0000 2015,0,0,E.Lansing mayor Triplett says Prop 1 last best chance to fix roads w/o threatening other groups like education
149,595227833909309441,Mon May 04 14:05:49 +0000 2015,0,0,Gov. Snyder campaigns in Lansing for Prop 1. We need people to turn out to vote and to vote yes http://t.co/7crg0OfE6b
150,595187328697507841,Mon May 04 11:24:51 +0000 2015,0,0,"@MichChildren's Matt Gillard on 'Let it Rip' in Detroit for investing in Prop 1, roads and education  http://t.co/M3bGU3dTYA"
151,594874508814618624,Sun May 03 14:41:49 +0000 2015,0,0,@MichChildren Social media users: Read &amp; use these sample Prop 1 posts &amp; tweets before Tuesday's statewide election http://t.co/T6mXjhYotK
152,594858838118899713,Sun May 03 13:39:33 +0000 2015,0,0,@MichChildren Sandbox Party will be on the bus for Prop 1 Monday. Look for us. http://t.co/8AZmfppsJz
153,594141094398414848,Fri May 01 14:07:30 +0000 2015,4,1,"Better wages for #ECE teachers = better-qualified teachers, less turnover, better quality care #WorthyWages @MichChildren"
154,594123088016449536,Fri May 01 12:55:57 +0000 2015,0,1,"We need livable, equitable and dependable wages for ECE teachers, of whom we expect so much but to whom we provide so little #WorthyWages"
155,594121538820964352,Fri May 01 12:49:47 +0000 2015,0,0,@MichChildren supports worthy wages for child care educators. Join today's Twitter Storm. Hashtag #WorthyWages  Info http://t.co/ebIxBw5g0B
156,593825883326009344,Thu Apr 30 17:14:57 +0000 2015,0,1,#SafeRoadsYES Check out our sample posts &amp; tweets and help promote Proposal 1 for strong investments in kids &amp; roads http://t.co/T6mXjhYotK
157,593822173753511936,Thu Apr 30 17:00:13 +0000 2015,0,0,Read and share our latest Speaking for Kids e-bulletin about Tuesday's statewide election &amp; Proposal 1 http://t.co/8lEcVtZftE #SafeRoadsYES
158,593513690646712322,Wed Apr 29 20:34:25 +0000 2015,0,0,Your vote counts on May 5th -- vote on behalf of Michigan kids #SafeRoadsYES http://t.co/L6ZPU7Y9cw
159,593025391121436672,Tue Apr 28 12:14:05 +0000 2015,0,0,"@MichChildren 's Matt Gillard in today's Detroit News:   'Yes' on Prop 1 is good for roads and kids, too. http://t.co/SFs1PNNFaV"
160,590935806245675009,Wed Apr 22 17:50:49 +0000 2015,0,1,Matt Gillard and Michael Foley: Help fight child abuse and neglect http://t.co/OT9NdWFoZ1 via @LSJnews
161,590893307967836160,Wed Apr 22 15:01:57 +0000 2015,0,0,"Alert: Ask MI lawmakers for more FY16 funds for challenged learners http://t.co/AlVrPH4VWk  
@MIHOUSEGOP @MISENATE @MISENDEMS  @MIHOUSEDEMS"
162,590556099465584641,Tue Apr 21 16:42:00 +0000 2015,0,0,@MichChildren 's recs on safe and stable homes for all kids during Child Abuse Prevention Month http://t.co/KzQ3PapEvJ
163,590527004446949376,Tue Apr 21 14:46:23 +0000 2015,1,0,Matt Gillard &amp; Jane Zehnder-Merrell speak up for new resources for early literacy in MI's budget. Read their op ed http://t.co/6hoHrbmpzX
164,588336996956811265,Wed Apr 15 13:44:05 +0000 2015,1,0,Today's Speaking for Kids bulletin outlines state budget plans as they impact young children and youth. Read it here: http://t.co/QM4vna6ZVk
165,585118244094246912,Mon Apr 06 16:33:55 +0000 2015,7,0,RT @educationweek: Senate education leaders are closeing in on a bipartisan ESEA rewrite: http://t.co/NHVby8YqqC
166,585116774603042816,Mon Apr 06 16:28:04 +0000 2015,1,0,@MichChildren appreciates law enforcement perspective on 3rd grade reading support cited in Muskegon op ed http://t.co/0zRXZ7JKw8.
167,585115873612009472,Mon Apr 06 16:24:29 +0000 2015,1,0,@MichChildren's Matt Gillard talks about 3rd grade reading in Tribune article. MI's kids need lawmakers' support!  http://t.co/Gl9XmmiAF0
168,583719677957931008,Thu Apr 02 19:56:30 +0000 2015,0,0,Read our special issue of Speaking for Kids for an outline of different budget plans before the state Legislature. http://t.co/qM0AmI8RSz
169,582926428796260352,Tue Mar 31 15:24:25 +0000 2015,0,0,@MichChildren is traveling the state w/ other advocates to promote state investment in 3rd grade reading. One op ed: http://t.co/N6yudrP10B
170,581519513851674625,Fri Mar 27 18:13:50 +0000 2015,2,0,"To help kids, it's clear we should be improving Early On. Read the second part of Mina's blog series. http://t.co/kirBgna0Oa"
171,581516440299261952,Fri Mar 27 18:01:38 +0000 2015,0,0,@MichChildren is busy traveling to newspaper edit boards this week &amp; next to urge strong state investment in 3rd grade reading improvement.
172,581181892889825280,Thu Mar 26 19:52:15 +0000 2015,0,0,MIECHV (home visiting) programs for high-risk families will expire 3-31.  Funding is critical to prevent child abuse. Contact Congress!
173,580100684357320704,Mon Mar 23 20:15:55 +0000 2015,0,0,Expanded learning is getting more help in Michigan but there's trouble on the national front. Read our blog and act: http://t.co/PnTFQxfjpp
174,578626415907721217,Thu Mar 19 18:37:42 +0000 2015,0,0,"In 2014, 1 in 10 MI students left high school without a diploma; among Black students, 1 in 5 didn't graduate. Read: http://t.co/v5MFKGZE85"
175,578554524551393281,Thu Mar 19 13:52:02 +0000 2015,3,1,3rd Grade Reading Scores won't improve without parents' involved in children's learning. Read @MichChildren 's Report:http://t.co/Otk1aZnyui
176,578243373254905857,Wed Mar 18 17:15:38 +0000 2015,0,0,Our friends at CTF help raise awareness for prevention of abuse &amp; neglect.by supporting local programs such as: http://t.co/KYuBpYvIyO
177,578225582988750848,Wed Mar 18 16:04:56 +0000 2015,1,1,@MichChildren Why is family literacy important for children's reading proficiency?  Read our newest Issues brief.  http://t.co/Otk1aZF9SS
178,577571826324369408,Mon Mar 16 20:47:08 +0000 2015,0,0,March is Reading Month. Learn why a Birth-to-3rd-Grade framework matters for reducing the academic achievement gap. http://t.co/hPobvjqs92
179,577558188179869696,Mon Mar 16 19:52:57 +0000 2015,0,0,Intervention from Early On services can sharply reduce the need for special education later on. @MichChildren Issues:http://t.co/5Wka2MRcKz
180,577536259633070080,Mon Mar 16 18:25:49 +0000 2015,1,0,"Here's an empowering story of youths in foster care who spoke up at KidSpeak:  ""Youth Voices Have Impact"" http://t.co/vdcxcEaCMj"
181,576412276795768832,Fri Mar 13 15:59:30 +0000 2015,0,0,@CTF_Michigan funds programs that teach child safety is an adult's responsibility. Full story at http://t.co/aPuz7smBdA  #CTFsuccessStory
182,576402563936944128,Fri Mar 13 15:20:54 +0000 2015,0,0,@MichChildren 's Michele Corey outlines priorities for the next school superintendent. Read her blog today at http://t.co/VlJtozPWS0
183,575685414649901056,Wed Mar 11 15:51:13 +0000 2015,0,0,It's National Reading Month. See our report http://t.co/hPobvj8QKs to learn how high-quality early childhood builds literacy skills.
184,575615753442865152,Wed Mar 11 11:14:24 +0000 2015,0,0,"@MichChildren's bulletin, Speaking for Kids, is out with a new Capitol Corner report, links to new blogs &amp;  more.  http://t.co/92vj2xwEHY"
185,575359519162679296,Tue Mar 10 18:16:13 +0000 2015,0,0,"Our ""Issues for Michigan's Children"" report applies Kids Count data to opportunities for improving state's policies.http://t.co/2gxJGkUFJ4"
186,575344958581899264,Tue Mar 10 17:18:22 +0000 2015,0,0,Read why @MichChildren supports Early On services for our youngest children with development delays and disabilities http://t.co/5Wka2N8O99
187,574959601545797632,Mon Mar 09 15:47:05 +0000 2015,0,0,Michigan's below national average for children in after-school programs. See http://t.co/EJU25o0IfW to send Congress message #Invest3to6
188,573943834389934081,Fri Mar 06 20:30:48 +0000 2015,0,1,@MichChildren supports the Thunderclap #Invest3to6.  Join in Tuesday &amp; speak up for afterschool programs. Learn more: http://t.co/KRqcKA0N5T
189,573938684170391552,Fri Mar 06 20:10:20 +0000 2015,0,0,It's National Reading Month! Read @MichChildren's report on importance of 3rd grade reading proficiency http://t.co/Asi5q3BQR4
190,573869037811286017,Fri Mar 06 15:33:35 +0000 2015,0,0,Learn more about Michigan Proposal 1 and its impact on education funding on the Sandbox Party website!. http://t.co/aBJOwC4UI6
191,573179294773587968,Wed Mar 04 17:52:47 +0000 2015,0,0,"Join @MichChildren 's Action Networks and become involved in advocating for children, youth and families. http://t.co/cZrQW13Wxl"
192,572861498072018945,Tue Mar 03 20:49:59 +0000 2015,0,0,·       #HomeVisiting is a bipartisan success story that will end this month without help from you.  Send your members of Congress a message
193,572796911490629632,Tue Mar 03 16:33:20 +0000 2015,0,0,#HomeVisiting improves outcomes for vulnerable kids and parents &amp; saves tax dollars. Help retain MIECHV funding: http://t.co/1iNdEngjK9
194,572793455317028864,Tue Mar 03 16:19:36 +0000 2015,1,1,Take part in #HomeVisiting day of action today! Contact your Congress members in support of MIECHV. Use this toolkit http://t.co/aXH0EYIg6U
195,572489432466522112,Mon Mar 02 20:11:31 +0000 2015,0,0,"K-zoo teens host roundtable w/ @JonHoadley, @BrandtIden, @aricnesbitt &amp; Sen. O'Brien. Read our forum follow-up story: http://t.co/i1I3gua1Nu"
196,572424061336219648,Mon Mar 02 15:51:46 +0000 2015,1,0,"@CTF_Michigan ACE study assesses effects of child abuse &amp; neglect as leading cause of illness, even death. Read – http://t.co/FE8V7ifw4j"
197,571345207288930304,Fri Feb 27 16:24:47 +0000 2015,3,2,#HomeVisiting day of action is March 3. Plan to contact your members of Congress to urge reauthorizing #MIECHV before it expires next month.
198,571295113550307329,Fri Feb 27 13:05:43 +0000 2015,0,0,"As a partner w/ CTF in Prevent Child Abuse America, we invite you to join us in Lansing on April 23 for this rally! http://t.co/rA02EBXvYu"
199,571073441316675584,Thu Feb 26 22:24:53 +0000 2015,0,1,"The governor's budget offers $100,000 more for most challenged students. Read the Budget Basics' outline of the plan. http://t.co/4rXmpuMeTY"
