,id_str,created_at,retweet_count,favorite_count,text
0,668845487903121408,Mon Nov 23 17:36:05 +0000 2015,1,0,"Rd. how youth struggling w/ foster care, mental illness &amp;homelessness earned h.s.diplomas. https://t.co/3KeIQyiDqF https://t.co/pXscYBHwS1"
1,668829441968234496,Mon Nov 23 16:32:19 +0000 2015,0,0,"Michele Corey -- We're thankful for our partners! Making kids a priority in Mich.
https://t.co/qj9hSt9D6h https://t.co/wo2AI7Lwri"
2,668827698052136960,Mon Nov 23 16:25:24 +0000 2015,0,0,@childfindmich Mina Hong advises Early On parents and providers on ways to advocate. https://t.co/lbPerVC0sH https://t.co/4Kx7Cn5eE4
3,666287668926529536,Mon Nov 16 16:12:13 +0000 2015,0,0,https://t.co/qSlpvVCrvw  Michele talks about strategies to counter bullying in our schools in this Talk Radio program
4,665193054580686849,Fri Nov 13 15:42:37 +0000 2015,1,1,Listen to Michele Corey's talk on the @tonytrupiano show in which she outlines solutions to school bullying. https://t.co/fecX93MGmH
5,664470617299685376,Wed Nov 11 15:51:55 +0000 2015,0,0,Michele discusses solutions to school bullying with Tony @tonytrupiano on blog talk radio. See https://t.co/N6LaRIbylu for link.
6,662360238893326337,Thu Nov 05 20:06:01 +0000 2015,1,0,"Rd. Michele Corey's Op-Ed in the Detroit News on bullying &amp; what to do about it in schools: 
https://t.co/N0FlVtjaZE"
7,662357515196239872,Thu Nov 05 19:55:12 +0000 2015,0,0,Our e-bulletin Speaking for Kids is out w/ a new Capitol Corner blog and great advocacy info about kids &amp; families. https://t.co/u80ipRtJH1
8,661269391267471360,Mon Nov 02 19:51:23 +0000 2015,3,0,Mina Hong blogs today about My Brother's Keeper &amp; needed policy change to help boys of color https://t.co/9P47a23bqp
9,659454250238345216,Wed Oct 28 19:38:39 +0000 2015,0,0,"Thank you for attending #FamilySpeakMi staffers for Sen. Hildenbrand, 
@SenBertJohnson &amp; @andyschor &amp; listening to families on adult ed"
10,659452249416925184,Wed Oct 28 19:30:42 +0000 2015,1,2,Thank you to our co-sponsor @MACAEToday for a great #FamilySpeakMI &amp; for being there - @RepHooker @RepGreigMI37 @adamzemke @rephoveywright
11,659421081153966080,Wed Oct 28 17:26:51 +0000 2015,0,0,#FamilySpeakMI Bob Steeh w/ MACAE: 'This event (on adult ed) is a great start to bring this issue to the forefront for our Legislators!'
12,659412046950330372,Wed Oct 28 16:50:57 +0000 2015,0,0,"#FamilySpeakMI Rep.Tom Hooker on adult ed: It's generational. If we can change the parents' lives, we can change their children's lives."
13,659395094244630528,Wed Oct 28 15:43:36 +0000 2015,0,0,#FamilySpeakMI Speakers say more resources needed to connect adult ed w/ workforce development &amp; career tech. One pilot is in the works.
14,659393774813061120,Wed Oct 28 15:38:21 +0000 2015,0,0,#FamilySpeakMI Troy ed provider says would love to take in &gt; students but already at cap and funds not there to educate &gt; adults
15,659392427992723456,Wed Oct 28 15:33:00 +0000 2015,0,0,#FamilySpeakMI Providers bemoan decline of adult ed programs in MI past 10 years. Access is big problem. Students drive 50 miles to find one
16,659389497877135360,Wed Oct 28 15:21:21 +0000 2015,0,0,"#FamilySpeakMI Mom Justine Geiger attends Novi, 'I believe in alternative and adult educ and I will fight for it' https://t.co/GlDyYvuoka"
17,659381018152054784,Wed Oct 28 14:47:40 +0000 2015,0,0,"#FamilySpeakMI Yojana, 29, Mex. native now US citizen earning diploma: 'I want to be a good role model for my kids' https://t.co/ZrnR71Egcq"
18,659376383857184772,Wed Oct 28 14:29:15 +0000 2015,0,0,#FamilySpeakMi Single mom Michele tearfully says returning to school for h.s. diploma gives her hope for a better future for self &amp; her kids
19,659374642478608384,Wed Oct 28 14:22:20 +0000 2015,0,0,"#FamilySpeakMI Antonio Binns of Detroit was tagged spec ed in school, but Dominican Lit Center changed his life and now has opty for jobs"
20,659371912079003648,Wed Oct 28 14:11:29 +0000 2015,0,0,#FamilySpeakMI Matt welcomes adults from around the state to talk about importance of adult/literacy programs in their communities.
21,659364536525455360,Wed Oct 28 13:42:10 +0000 2015,0,0,"#FamilySpeakMI Segal Khalif, a Lansing mom, is learning English to talk w/ her kids' teachers and help with h'work. https://t.co/kLgDQICHbJ"
22,659360336450080768,Wed Oct 28 13:25:29 +0000 2015,0,0,#FamilySpeakMI  Prepping to talk to Lawmakers this a.m. about need for &gt; adult ed programs to help parents help kids https://t.co/picjvdlfUV
23,659041554795925504,Tue Oct 27 16:18:45 +0000 2015,0,0,"#FamilySpeakMI Join us. We're live tweeting Wed. as FamilySpeak goes to the Capitol to talk adult literacy, helping young kids learn &amp; 2 gen"
24,659029315301060608,Tue Oct 27 15:30:07 +0000 2015,0,0,Gongwer's storytoday quotes Matt Gillard on how to eliminate bullying in MI schools. Must provide trauma-support https://t.co/T6saaVZN5X
25,658733176580349952,Mon Oct 26 19:53:22 +0000 2015,0,0,"By supporting policies, initiatives and appropriate investments, we can prevent bullying in Michigan. #bullying https://t.co/T9dPiI4enW"
26,658670212158500864,Mon Oct 26 15:43:10 +0000 2015,1,2,"@John_C_Austin: More work needed in MI so that students can learn, thrive in schools free of #bullying @scha-mi.org"
27,658668162410524672,Mon Oct 26 15:35:02 +0000 2015,3,2,"Matt Gillard at press event: Prevent bullying w/ new state investment, &gt; help for kids in trauma #bullying @SCHA_MI https://t.co/EZpetqLgLq"
28,658645240052645888,Mon Oct 26 14:03:56 +0000 2015,0,0,Matt Gillard addressing need for new school anti-bullying policies in AA today with SCHA-MI &amp; WSU researchers. https://t.co/QUrUnmKwFS
29,657218496561065984,Thu Oct 22 15:34:34 +0000 2015,0,1,It's #LightsOnAfterschool Day and support in MI is growing for after school! 331 MI towns hosting recogition events https://t.co/Kdsfo7J7bD
30,656914388037816321,Wed Oct 21 19:26:09 +0000 2015,2,3,AfterSchool learning is critical to close achievement gaps. Oct.22 is #LightsOnAfterschool day. Let's grow support! https://t.co/w3FuYL2Ib6
31,656890629671092224,Wed Oct 21 17:51:45 +0000 2015,1,1,Ideas do bubble up from the people. Rd. about a bill on child care from @RepMoolenaar &amp; talk to your lawmakers too! https://t.co/6pCXeYq1cF
32,656529821703536641,Tue Oct 20 17:58:01 +0000 2015,1,0,"Rd Matt Gillard's Capitol Corner today on issues child &amp; family advocates care about, now moving through the Capitol https://t.co/vW8fDzhnLF"
33,655122177017163776,Fri Oct 16 20:44:33 +0000 2015,0,0,@RepDanKildee talks equity in educ.&amp; after-school at Bay City stop: http://t.co/FL5Spxid8F. Rd @MichChildren Issues:http://t.co/DocFSAXFTX
34,654372454391902209,Wed Oct 14 19:05:25 +0000 2015,0,0,The trauma of bullying keeps kids from learning. @MichChildren supports trauma-informed practice for education https://t.co/15Ha3TgxaE
35,654370277908811776,Wed Oct 14 18:56:46 +0000 2015,0,0,@MichChildren 's Matt Gillard on @MichiganRadio today talking early childhood advocacy &amp; what's next http://t.co/FkFlfcWKjA
36,654313184032108544,Wed Oct 14 15:09:54 +0000 2015,0,0,Hamtramck educator Tim Constant guest blogs about students living with trauma for @MichChildren http://t.co/S0vjx0xmEe
37,651426197021327361,Tue Oct 06 15:58:02 +0000 2015,0,0,@MichChildren 's Cainnear Hogan (right) calls caregivers stars of FamilySpeak.Read her blog: http://t.co/7dhESXFCJS http://t.co/jPs1g9Ci8Q
38,649950361382338560,Fri Oct 02 14:13:36 +0000 2015,0,1,#AmGrad airs on WGVU-TV in Grand Rapids Sat. Oct. 3 at noon. See our facts on MI grad rates: http://t.co/v5MFKGI2Jv http://t.co/yLpMRx0SqU
39,649581156392927232,Thu Oct 01 13:46:30 +0000 2015,0,0,@MichChildren Kids in foster care prone to identity theft. One remedy is to use state ID cards to limit exposure. http://t.co/n2UgikXvNQ
40,649269739903168512,Wed Sep 30 17:09:03 +0000 2015,0,0,"See @MichChildren story on FamilySpeak &amp; what families said about helping kids in foster care, kinship care,adoption http://t.co/g6RTzC9Cn2"
41,649268808302116864,Wed Sep 30 17:05:21 +0000 2015,0,0,@MichChildren Michele Corey blogs about hearing from caregivers in child welfare at our FamilySpeak &amp; why it matters http://t.co/K03aZfaVok
42,648943783258791936,Tue Sep 29 19:33:49 +0000 2015,0,0,@MichChildren's Speaking for Kids bulletin is out. Read it here now! http://t.co/qnYf8Soubv  @MIHOUSEGOP @MISENATE @MISENDEMS @MIHOUSEDEMS
43,646721877323481088,Wed Sep 23 16:24:45 +0000 2015,0,0,Michele Corey &amp; Rep. Jim Runestad talk to Current State's Sue Carter about foster care on WKAR this a.m. http://t.co/LRYY0mw1Zo
44,646701985010323456,Wed Sep 23 15:05:43 +0000 2015,0,0,Caregivers packed the room at the Capitol for @MichChildren FamilySpeak &amp; WLNS-TV6 was there.http://t.co/GlixVC8v0C http://t.co/JWWV4wUkWZ
45,646672349983567872,Wed Sep 23 13:07:57 +0000 2015,0,0,Michele Corey on WKAR's Current State 90.5 FM this morning to discuss challenges in the foster care system and caregiver experiences
46,646379459235475456,Tue Sep 22 17:44:06 +0000 2015,0,0,@MichChildren Matt Gillard tells FamilySpeak on foster care: We're committed w/ our partners to a legislative package aimed at these issues
47,646378872766861312,Tue Sep 22 17:41:47 +0000 2015,0,0,Rep. Hooker on FamilySpeak today: It was definitely an eyeopener for me. This did not fall on deaf ears. The state system moves so slowly.
48,646342817233641472,Tue Sep 22 15:18:30 +0000 2015,0,0,"We have a system that's broken, especially when we adopt these children. Services are hard to find -- Iosco County foster mom at FamilySpeak"
49,646335387636514817,Tue Sep 22 14:48:59 +0000 2015,0,0,"FamilySpeak this a.m.:Kinship families need training, trauma support, and help and guidance through the system."
50,646331059622256641,Tue Sep 22 14:31:47 +0000 2015,0,0,Ypsilanti mom says children come with history of trauma &amp; abuse. Need more than love. Need access to therapy.
51,646330578426535936,Tue Sep 22 14:29:52 +0000 2015,0,0,FamilySpeak on foster care in Lansing. Families say more services needed to help children --  child care and mental health services critical
52,646301411664375808,Tue Sep 22 12:33:58 +0000 2015,0,0,Michele discusses investing in families and kids in foster care in this story on today's FamilySpeak at the Capitol. http://t.co/jUt5EroGrY
53,644899606069923840,Fri Sep 18 15:43:42 +0000 2015,0,0,@MichChildren hosts foster care FamilySpeak w/caregivers before lawmakers 9-22. Come listen! @MIHOUSEGOP @MISENATE @MISENDEMS @MIHOUSEDEMS
54,644534762258825216,Thu Sep 17 15:33:56 +0000 2015,0,0,@MichChildren Read Matt Gillard's testimony on the 3rd Grade Reading bill provided to a House Educ. panel today: http://t.co/yCGdBppmnr
55,644515198976585728,Thu Sep 17 14:16:12 +0000 2015,0,0,HB 4822: Matt gives shout out to successful GR summer learning pilot (chartered by Grand Valley) that helps kids start school ahead
56,644514234928398336,Thu Sep 17 14:12:22 +0000 2015,0,0,HB 4822:  Matt suggests we use expertise of literacy coaches housed at ISD's to help parents make read-at-home plans work
57,644513493660631040,Thu Sep 17 14:09:26 +0000 2015,0,0,HB 4822 testimony: Matt suggests read-at-home plans be expanded to include others who care for kids --after-school and child care providers
58,644512679168749569,Thu Sep 17 14:06:11 +0000 2015,0,0,"Matt on HB 4822: For read-at-home plan to be effective,need data showing barriers parents face, ie working late hours, own reading struggles"
59,644511701669408768,Thu Sep 17 14:02:18 +0000 2015,1,0,Matt testifies before state Education Committee about 3rd Grade Reading Bill w/ suggestions to 'make the bill stronger'
60,642049710736412672,Thu Sep 10 18:59:14 +0000 2015,0,0,"@MichChildren 's e-bulletin, Speaking for Kids, is now out with important news on educ.policy &amp; reform http://t.co/lnNeDd2Rd6"
61,642000256725557248,Thu Sep 10 15:42:43 +0000 2015,0,0,MI's most vulnerable kids miss more school than national average -- blog by Teri Banas http://t.co/pq77kc50AR http://t.co/ye7x0Mbs2O
62,641963911588245504,Thu Sep 10 13:18:18 +0000 2015,0,0,@MichChildren 's Matt Gillard &amp; Mina Hong testifying this a.m. before House Ed.Policy panel on improving 3rd grade reading
63,641719507048886272,Wed Sep 09 21:07:07 +0000 2015,0,0,@NathanTriplett
64,641322437133647872,Tue Sep 08 18:49:18 +0000 2015,1,2,Gillard to School Board: Improve education by creating equitable opportunities for all kids http://t.co/SusdOAWGDZ http://t.co/GE4cjh27tz
65,641317608281784321,Tue Sep 08 18:30:07 +0000 2015,0,0,"Michele Corey blogs about summer learning, a new school year &amp; crossing the Mackinac Bridge http://t.co/jAteAMTE6U http://t.co/CpQilrGqvd"
66,641316297394028544,Tue Sep 08 18:24:55 +0000 2015,0,0,@MichChildren 's Michele Corey blogs on summer learning &amp; starting a new school year while crossing the Mackinaw Br. http://t.co/bKLzFIKKVZ
67,641248486747410432,Tue Sep 08 13:55:27 +0000 2015,0,0,@MichChildren 's Matt Gillard testifies on closing learning gap before State Board of Ed at 11 a.m. Watch him at http://t.co/mvlPBF0kbo
68,641247651430854657,Tue Sep 08 13:52:08 +0000 2015,0,0,Matt Gillard says key to making MI a top 10 educ. state is closing the learning gap. Rd his piece in Bridge mag. http://t.co/SofMhRLBx9
69,638695540050522112,Tue Sep 01 12:50:57 +0000 2015,2,1,Attendance gaps turn into achievement gaps. @MichChildren recommends reading this new report: http://t.co/KQefRQHlNi #schooleveryday
70,638397722375122945,Mon Aug 31 17:07:32 +0000 2015,0,0,September is Attendance Awareness Month #SchoolEveryDay. Follow @MichChildren this month to learn more. http://t.co/2aAORGdxA6
71,636949236626624512,Thu Aug 27 17:11:46 +0000 2015,4,2,Join @MichChildren by sharing your views on how to make MI a top 10 education state again. Send comments to MDE at http://t.co/thCzbGVN53
72,635828931275309057,Mon Aug 24 15:00:05 +0000 2015,0,0,"Trauma and adverse childhood experiences in early years are linked to school expulsions. See @MichChildren blog, http://t.co/2xlYl8xeEO"
73,634774203170967552,Fri Aug 21 17:08:58 +0000 2015,0,0,"Keep up on policy issues impacting kids and families. Read @MichChildren 's Speaking for Kids e-bulletin, new today. http://t.co/CwhSLitp23"
74,634401102465601540,Thu Aug 20 16:26:24 +0000 2015,2,0,@MichChildren Michele Corey discusses what it will take to make MI a top 10 education state in her blog today!  http://t.co/xyzmc3FJ3E
75,634393994211016704,Thu Aug 20 15:58:09 +0000 2015,0,0,"@MichChildren Matt Gillard speaks out about the EITC, support for tax-paying working families.   http://t.co/YnaJjElcFQ"
76,633340667310149633,Mon Aug 17 18:12:36 +0000 2015,0,0,"Learn about a unique WSU summer employment program for youth in foster care in a new @MichChildren 's Focus report, http://t.co/0kGMlt03qp"
77,633254836079693824,Mon Aug 17 12:31:32 +0000 2015,0,0,Help promote positive parenting. Submit an entry in the Parenting Awareness Michigan poster contest. For all ages. http://t.co/Dc4DccIJRo
78,630735339653476353,Mon Aug 10 13:39:58 +0000 2015,0,0,@MichChildren at Wayne State today raising voices &amp; facilitating KidSpeak on youth employment for children in foster care.
79,629290615855943680,Thu Aug 06 13:59:09 +0000 2015,1,0,"Use this Take Action tool to contact lawmakers about saving the EITC, a proven two-gen strategy to help families http://t.co/9yBH3roTbe"
80,628261821703696384,Mon Aug 03 17:51:05 +0000 2015,0,0,"Mich's EITC is being threatened here, but as a two-gen strategy is so successful. Read more: http://t.co/l0O3Jw0nvl http://t.co/i48N3DGWhW"
81,628247530128732160,Mon Aug 03 16:54:18 +0000 2015,0,0,@MichChildren 's  Mina Hong at BCDI convening in Detroit Sat: We need budget advocacy year-round for family issues http://t.co/PBha32drlv
82,626767280999784448,Thu Jul 30 14:52:19 +0000 2015,1,1,@MichChildren 's Mina Hong will discuss two-gen strategies at Black Child Development Institute in Detroit Saturday http://t.co/p5rKeBacRq
83,626412890518454272,Wed Jul 29 15:24:05 +0000 2015,0,0,@MichChildren supports #readwhereyouare to get ready for school. Parents need literacy too:http://t.co/fUsAjSlN6d http://t.co/i1zOW52w9a
84,626084453777936384,Tue Jul 28 17:39:00 +0000 2015,0,2,"On July 30, join us in support of nutrition and summer learning as Congress considers new child nutrition legislation.http://t.co/k7u59vdWwe"
85,626082675611152384,Tue Jul 28 17:31:56 +0000 2015,0,0,Congrats to Rep.Runestad for bill removing fees for adopting parents.Hope to see more positive bills for MI families http://t.co/hlBl2qvbH6
86,625682777208295424,Mon Jul 27 15:02:53 +0000 2015,0,0,Support changes to the federal child nutrition program for 3 million U.S. kids in child care. Contact Congress http://t.co/oeGMuUfsM5
87,624273388509507585,Thu Jul 23 17:42:28 +0000 2015,0,0,Why should the fed govt. take a role in ensuring education equity? Read Michele Corey's blog at @MichChildren http://t.co/kirBgna0Oa
88,623958769337106432,Wed Jul 22 20:52:17 +0000 2015,0,0,"Read it in @MichChildren 's latest e-bulletin, Speaking for Kids. See Capitol Corner, Kids Count news and more http://t.co/ccKg44lqb5"
89,623839307606835200,Wed Jul 22 12:57:35 +0000 2015,0,0,"As lawmakers look to budget cuts to fix roads, we need year-round budget advocacy for families &amp; kids -- Matt Gillard http://t.co/eLciPeqYpe"
90,623581518741409792,Tue Jul 21 19:53:14 +0000 2015,1,0,New Kids Count report points out more MI kids living in poverty today than during the end of the Great Recession http://t.co/g98gkXv2lH
91,620941892037931008,Tue Jul 14 13:04:18 +0000 2015,0,0,Read @MichChildren's report on why MI should invest in afterschool &amp; summer learning programs http://t.co/DocFSBfgLv http://t.co/vK2UXQ1cOR
92,620601823506771968,Mon Jul 13 14:32:59 +0000 2015,0,0,"For literacy readiness in kids, we must invest public resources in helping parents improve their literacy skills. See http://t.co/fUsAjSlN6d"
93,619489717235617792,Fri Jul 10 12:53:52 +0000 2015,0,0,We need to do better for the 800 Michigan youth in foster care who turn 18 each year. See @MichChildren’s report: http://t.co/Q7Id2SE3FR
94,619154354948472832,Thu Jul 09 14:41:16 +0000 2015,0,0,Students lose several months of academic progress during the summer. Rd how to prevent it in @MichChildren report:  http://t.co/DocFSAXFTX
95,618768786175324160,Wed Jul 08 13:09:09 +0000 2015,0,0,MI must redouble efforts to provide stable homes for older youths in foster care @MichChildren http://t.co/Q7Id2Smshh http://t.co/klw43Mx09k
96,618098253507248128,Mon Jul 06 16:44:42 +0000 2015,0,0,A child’s first teacher is their parent.Family literacy is key for improved 3rd grade literacy.http://t.co/fUsAjS4ceF http://t.co/XrxSKh05PV
97,616964756302245888,Fri Jul 03 13:40:35 +0000 2015,0,0,"Your support makes a difference! Donate to @MichChildren,an independent fighter for families!  http://t.co/T0I63AQu5o http://t.co/CZ3xvqyL0s"
98,616676690643800064,Thu Jul 02 18:35:55 +0000 2015,0,0,2/3rds MI voters polled say EITC shouldn't be cut to fund roads.Gilda Jacobs calls the state's limited credit vital for struggling families.
99,616614099384930304,Thu Jul 02 14:27:12 +0000 2015,0,0,Donate this July 4 &amp; keep @MichChidlren’s Independent voice alive for programs like Early On. http://t.co/T0I63B85tY http://t.co/Bdzr08uezc
100,616294771527528448,Wed Jul 01 17:18:18 +0000 2015,0,0,"@MichChildren's Mina Hong writes the approved FY2016 in MI has good aspects for kids, not so for struggling families. http://t.co/HDPbCawWgC"
101,616270595102105600,Wed Jul 01 15:42:14 +0000 2015,0,0,"Have you seen the latest Speaking for Kids e-bulletin by @MichChildren?  Read it today &amp; advocate for kids, too!. http://t.co/8TFbUSILk9"
102,615875201339801601,Tue Jun 30 13:31:05 +0000 2015,0,0,"Celebrate kids this July 4. Pledge support for @MichChildren, a fighter for equity for all  http://t.co/T0I63AQu5o http://t.co/839j9whuVA"
103,615704906238812161,Tue Jun 30 02:14:23 +0000 2015,0,0,What's the impact of the newly signed FY2016 state budget on MI youth? Read @MichChildren's new Budget Basics Report http://t.co/HCYm3u5Aw7
104,615507114702737408,Mon Jun 29 13:08:26 +0000 2015,0,0,Light up the sky w/ your support for@MichChildren. Contribute to a proven advocate for MI kids http://t.co/L11nW45GR9 http://t.co/esBpKMXBXC
105,614489689299378176,Fri Jun 26 17:45:33 +0000 2015,0,0,@MichChildren Check out our partners at Afterschool Alliance &amp; learn how to bring afterschool to families in need.http://t.co/E9ivi9uPd4
106,614157771429130240,Thu Jun 25 19:46:37 +0000 2015,1,0,Fed investments in #childwelfare down 2.9% v/ @First_Focus Children’s Budget 15: http://t.co/eY6p3mie2a http://t.co/Lb7UNZ8wGX
107,614104753375555584,Thu Jun 25 16:15:57 +0000 2015,0,0,@MichChildren Pledge support today &amp; keep an independent advocate for MI kids &amp; families.   http://t.co/T0I63AQu5o http://t.co/Fg7bjQAFWM
108,613773359168421888,Wed Jun 24 18:19:06 +0000 2015,0,1,Numbers paint a clear picture. Congress targeting kids for cuts: http://t.co/eY6p3mie2a @First_Focus #InvestInKids
109,613693968484802560,Wed Jun 24 13:03:38 +0000 2015,0,0,"Kids are 25% population, 100% of our future, 8% of fed spending: http://t.co/eY6p3m0DaC v/ @First_Focus #InvestInKids"
110,613373230712119296,Tue Jun 23 15:49:08 +0000 2015,0,0,"Afterschool&amp;summer learning close the achievement gap, yet MI fails to provide enough programs http://t.co/6JXNQzlJi2 http://t.co/z2hDCIMbIK"
111,613341856328368128,Tue Jun 23 13:44:28 +0000 2015,0,0,@MichChildren Ask your Members of Congress to co-sponsor important #summermeals legislation. Visit http://t.co/KLaN2Q0RuE via @fractweets
112,613005072868376577,Mon Jun 22 15:26:13 +0000 2015,0,0,Congress is working on Child Nutrition Re-authorization. Make sure they know how important summer meals are! http://t.co/qnpI5N5MDx #CNR2015
113,612968004473622528,Mon Jun 22 12:58:55 +0000 2015,0,0,Only 24% of MI kids are enrolled in summer learning -- below national average.  See research from America After 3 pm http://t.co/3Nwm0TWMcq
114,611893695848185856,Fri Jun 19 13:50:00 +0000 2015,1,0,#KeepKidsLearning It's Summer Learning Day! Advocate for expanded learning &amp; education equity! Hear the First Lady at http://t.co/BaXJdPAWMA
115,611871767552901120,Fri Jun 19 12:22:52 +0000 2015,0,0,"Read 'Issues for @MichChildren "" today to learn ""What's Next"" for Improving 3rd Gr. Reading in our state. http://t.co/uN4LnXSxs0"
116,611869128396111872,Fri Jun 19 12:12:22 +0000 2015,0,0,Help support @MichChildren as it give voices to kids facing the most challenges in MI. Become a monthly contributor http://t.co/9TQAyzFq5R
117,611217947340763136,Wed Jun 17 17:04:49 +0000 2015,0,0,@MichChildren Low-income kids lose 2 - 3 mos reading while higher-income make gains during summer. #KeepKidsLearning http://t.co/N5OuNbxGfe
118,610895832787742721,Tue Jun 16 19:44:51 +0000 2015,0,0,"Read latest @MichChildren's ""Speaking for Kids"" e-bulletin with Matt Gillard's newest Capitol Corner report! http://t.co/rqCjJCsVxy"
119,610529027401486336,Mon Jun 15 19:27:17 +0000 2015,0,0,Learn what's in store for MI's young kids and families in FY2016. See @MichChildren's latest Budget Basics report. http://t.co/QiaupBkkCd
120,610501130972348417,Mon Jun 15 17:36:26 +0000 2015,0,0,@MichChildren's intern Cainnear Hogan reflects on putting needs of children first in MI's newly signed adoption bill. http://t.co/4uagkOWAcQ
121,609367793759207424,Fri Jun 12 14:32:58 +0000 2015,0,0,"Join National Summer Learning Association's @ThunderclapIt on June 17, at 1PM &amp; tell everyone to #KeepKidsLearning! http://t.co/Maahbyksi3 …"
122,608728379194392576,Wed Jun 10 20:12:09 +0000 2015,0,2,National #SummerLearning Day is June 19th! Pledge to #KeepKidsLearning at http://t.co/Jwl0x1ntSM !
123,606196971196411904,Wed Jun 03 20:33:15 +0000 2015,0,0,Nice to see Gongwer News Service today reference @MichChildren in an article outlining highlights in the 2016's School Aid Budget
124,606183287946514432,Wed Jun 03 19:38:52 +0000 2015,0,0,@MichChildren's Speaking for Kids e-bulletin details MI's 2016 budget actions involving our most challenged learners http://t.co/jv13tWbYy9
125,606122024734441472,Wed Jun 03 15:35:26 +0000 2015,0,0,"@MichChildren thanks advocates Gilda Jacobs, Kyle DuBuc &amp; Tom Hickson for speaking out against House plan to cut EITC
http://t.co/HQ0AkzUwEE"
126,605458376735080448,Mon Jun 01 19:38:20 +0000 2015,0,0,"So proud of @MichChildren's Terry Murphy, national award winner for work in at-risk schools! http://t.co/5e3GtwNPMr http://t.co/1vyldxumxp"
127,603561373608488960,Wed May 27 14:00:19 +0000 2015,1,1,"@MichChildren's Matt Gillard &amp; Mina Hong to speak at the CMU summit, Early Childhood:  Shifting Mindsets.To register: http://t.co/W92Gnb4NtE"
128,603531591785127937,Wed May 27 12:01:59 +0000 2015,0,0,Michele Corey on MI's new educational goal-setting priorities: Will they bring success for our kids and communities?  http://t.co/jHyu4zGfuX
129,603225806198865921,Tue May 26 15:46:54 +0000 2015,0,0,"Every kid needs a family, esp. those in foster care. Read Michele's blog on how to reform foster care. @MichChildren http://t.co/gtnkvjxxCf"
130,600672381187846145,Tue May 19 14:40:30 +0000 2015,1,1,Read our lastest Speaking for Kids Guest blog: Ronnie Stephenson blogs about Foster Care Policy. http://t.co/Lpf83y1JcN
131,600302136526798848,Mon May 18 14:09:17 +0000 2015,0,0,Foster Care Month: See @MichChildren policy recommendations to improve outcomes for youth &amp; families in foster care http://t.co/MOoKQfLDiK
132,600302063956971520,Mon May 18 14:08:59 +0000 2015,0,0,Foster Care Month: Stability in home life is key concern of youth in foster care. See report @MichChildren http://t.co/MOoKQfLDiK
133,600301972210745344,Mon May 18 14:08:37 +0000 2015,0,0,"28,000 US youths 'age out' of foster care each year w/ few resources to transition ahead. Up to 37 % become homeless http://t.co/poqT51Ituv"
