,id_str,created_at,retweet_count,favorite_count,text
0,346809819111497728,Tue Jun 18 02:01:18 +0000 2013,0,1,I posted a new photo to Facebook http://t.co/ierIqOfaED
1,344252939063422976,Tue Jun 11 00:41:11 +0000 2013,0,0,You can watch her walk. Go here --&gt; http://t.co/0JlR14x7fl http://t.co/SmkSvoaz3A
2,344237392758185986,Mon Jun 10 23:39:24 +0000 2013,1,1,Marissa's graduation
3,343572949850267649,Sun Jun 09 03:39:09 +0000 2013,0,0,I posted a new photo to Facebook http://t.co/TgbotJstrW
4,343566810060316672,Sun Jun 09 03:14:45 +0000 2013,0,0,The winner http://t.co/G0JNWuU6m0
5,343547992558682112,Sun Jun 09 01:59:58 +0000 2013,0,0,I posted a new photo to Facebook http://t.co/1d2bjSsVTG
6,14502662556876800,Tue Dec 14 02:11:18 +0000 2010,0,1,Another great blog post: Out and About: Chargers Vs. Chiefs http://www.fierceugly.com/home/2010/12/13/out-and-about-chargers-vs-chiefs/
7,10868556530974722,Sat Dec 04 01:30:40 +0000 2010,0,0,"Follow @sdutChargers. If they get 10K followers by 12/13, someone will win tix to 12/16 game at Q. Deets: http://t.co/b3dW7VG"
8,8536774351519744,Sat Nov 27 15:05:00 +0000 2010,0,0,Another great blog post: Best Buy guy rocks the Kinect  http://www.fierceugly.com/home/2010/11/27/best-buy-guy-rocks-the-kinect/
9,4529921477058560,Tue Nov 16 13:43:12 +0000 2010,0,0,Another great blog post: TSA Encounter trying to leave SAN http://www.fierceugly.com/home/2010/11/16/tsa-encounter-trying-to-leave-san/
10,3464098247348224,Sat Nov 13 15:08:00 +0000 2010,0,0,Another great blog post: Homemade Spacecraft  http://www.fierceugly.com/home/2010/11/13/homemade-spacecraft/
11,3463219880394752,Sat Nov 13 15:04:30 +0000 2010,0,0,Another great blog post: TRON GIRL! Key of Awesome #25 http://www.fierceugly.com/home/2010/11/13/tron-girl-key-of-awesome-25/
12,3462923833843712,Sat Nov 13 15:03:20 +0000 2010,0,0,Another great blog post: Fox 4 DFW Roast of Social Media http://www.fierceugly.com/home/2010/11/13/fox-4-dfw-roast-of-social-media/
13,3461067363590144,Sat Nov 13 14:55:57 +0000 2010,0,0,Another great blog post: What's a Meme? http://www.fierceugly.com/home/2010/11/13/whats-a-meme/
14,29310475055,Sun Oct 31 21:06:01 +0000 2010,1,0,Another great blog post: PEOPLE ARE AWESOME http://www.fierceugly.com/home/2010/10/31/people-are-awesome/
15,27694890072,Mon Oct 18 02:05:33 +0000 2010,0,0,Brett Favre’s Cellphone Seduction Of Jenn Sterger Update http://bit.ly/bqPBeW
16,26961487311,Sun Oct 10 18:48:15 +0000 2010,1,0,RT @pileofpoop: Got some poop you want to share?  Email us poop@pileofpoop.com
17,26958095170,Sun Oct 10 18:00:59 +0000 2010,0,0,Another great blog post:  Horse poops on woman's head http://www.fierceugly.com/home/2010/10/10/horse-poops-on-womans-head/
18,26140724618,Sat Oct 02 03:06:16 +0000 2010,0,0,Another great blog post: What do you have in common? http://www.fierceugly.com/home/2010/10/01/what-do-you-have-in-common/
19,25735515375,Tue Sep 28 00:07:19 +0000 2010,0,0,Another great blog post: The Joy of a Salesman http://www.fierceugly.com/home/2010/09/27/the-joy-of-a-salesman/
20,25602261758,Sun Sep 26 16:01:53 +0000 2010,0,0,Another great blog post: Navy Chopper stunt on Lake Tahoe http://www.fierceugly.com/home/2010/09/26/navy-chopper-stunt-on-lake-tahoe/
21,25599672987,Sun Sep 26 15:31:25 +0000 2010,0,0,Another great blog post: That's not gay! http://www.fierceugly.com/home/2010/09/26/thats-not-gay/
22,25599488357,Sun Sep 26 15:29:21 +0000 2010,0,0,Another great blog post: Lazy Guy WIN http://www.fierceugly.com/home/2010/09/26/lazy-guy-win/
23,25599271719,Sun Sep 26 15:26:54 +0000 2010,0,0,Another great blog post: YouTube - Shopping Cart FAIL http://www.fierceugly.com/home/2010/09/26/youtube-shopping-cart-fail/
24,25599115113,Sun Sep 26 15:25:10 +0000 2010,0,0,Another great blog post: The Power of the Hand http://www.fierceugly.com/home/2010/09/26/the-power-of-the-hand-3/
25,19251414015,Thu Jul 22 12:41:17 +0000 2010,0,0,Another great blog post: Very Interesting Factoids http://www.fierceugly.com/home/2010/07/22/very-interesting-factoids/
26,15215085746,Wed Jun 02 00:40:56 +0000 2010,0,0,Another great blog post: I won!  I won! http://www.fierceugly.com/home/2010/06/01/i-won-i-won/
27,14806366196,Thu May 27 02:35:03 +0000 2010,0,0,Another great blog post: The difference between potentially and realistically http://bit.ly/94ePbt
28,14533068836,Sun May 23 03:19:21 +0000 2010,0,0,Another great blog post: Wal-Mart vs The Morons http://www.fierceugly.com/home/2010/05/22/wal-mart-vs-the-morons/
29,14264986678,Wed May 19 01:46:57 +0000 2010,0,0,Another great blog post: And that's why you should always wear a cup http://bit.ly/bcOYdc
30,14050794964,Sat May 15 17:58:56 +0000 2010,0,0,Another great blog post: Another pretty good chat roulette improv http://bit.ly/aMcrhN
31,13787652168,Tue May 11 13:09:53 +0000 2010,0,0,Another great blog post: Los Angeles DWP Workers caught Drinking & driving and at the Strip Club on City Time  http://bit.ly/99Wvj5
32,13261297762,Sun May 02 19:13:41 +0000 2010,0,0,Another great blog post: Michael Jackson's Punch-Out!  http://www.fierceugly.com/home/2010/05/02/michael-jacksons-punch-out/
33,12769769251,Sat Apr 24 15:56:41 +0000 2010,0,0,Another great blog post: This is why I love NASCAR http://www.fierceugly.com/home/2010/04/24/this-is-why-i-love-nascar/
34,12698655822,Fri Apr 23 12:20:14 +0000 2010,0,0,Another great blog post: This Is Why Copying is not Theft http://www.fierceugly.com/home/2010/04/23/this-is-why-copying-is-not-theft/
35,12698420475,Fri Apr 23 12:14:48 +0000 2010,0,0,Another great blog post: Brethalyzer Test - Or maybe a flask test? http://bit.ly/a6uRwZ
36,12698021449,Fri Apr 23 12:05:21 +0000 2010,0,0,Another great blog post: Ben At Work http://www.fierceugly.com/home/2010/04/23/ben-at-work/
37,12401709000,Sun Apr 18 15:06:47 +0000 2010,0,0,Another great blog post: Little Black Girl http://www.fierceugly.com/home/2010/04/18/little-black-girl/
38,12281988920,Fri Apr 16 13:15:48 +0000 2010,0,0,Another great blog post: Chat Roulette Funny Piano Improv #2  http://www.fierceugly.com/home/2010/04/16/chat-roulette-funny-piano-improv-2/
39,11992347010,Sun Apr 11 14:09:51 +0000 2010,0,0,Another great blog post: How to Make Videos that Mix Live Action with Video - Brief Tutorial  http://bit.ly/a6gnXZ
40,11992300086,Sun Apr 11 14:08:43 +0000 2010,0,0,Another great blog post: April Fools: Math Class Shadow  http://www.fierceugly.com/home/2010/04/11/april-fools-math-class-shadow/
41,11555053384,Sat Apr 03 22:04:19 +0000 2010,0,0,Another great blog post: Sound From Only One iPhone Speaker http://www.fierceugly.com/home/2010/04/03/sound-from-only-one-iphone-speaker/
42,11554840614,Sat Apr 03 21:58:32 +0000 2010,0,0,"When the going gets tough, the tough use Brizzly: http://bit.ly/bO7Eeq"
43,11224322163,Mon Mar 29 01:41:29 +0000 2010,0,0,Another great blog post: Living with First-Person Shooter Disease http://bit.ly/9j34WK
44,10847321690,Mon Mar 22 01:02:43 +0000 2010,0,1,Another great blog post: More Chatroulette Hilarity http://www.fierceugly.com/home/2010/03/21/more-chatroulette-hilarity/
45,10832965874,Sun Mar 21 18:50:02 +0000 2010,0,0,Another great blog post: Top 10 reasons why there are no black NASCAR drivers http://bit.ly/9DQzbs
46,10550652353,Tue Mar 16 03:09:23 +0000 2010,0,0,Another great blog post: Chatroulette Improv - One way to pass some time http://bit.ly/a5UIsQ
47,9511868040,Tue Feb 23 04:45:44 +0000 2010,0,0,Another great blog post: Old Spice fills up my senses http://www.fierceugly.com/home/2010/02/22/old-spice-fills-up-my-senses/
48,9370454076,Sat Feb 20 05:00:37 +0000 2010,0,0,#BonJoviOnUstream live at http://ustre.am/cPwT
49,9186220046,Tue Feb 16 14:14:57 +0000 2010,0,0,Another great blog post: Suburban Housewife - Weekend Rap http://www.fierceugly.com/home/2010/02/16/suburban-housewife-weekend-rap/
50,9186086665,Tue Feb 16 14:11:10 +0000 2010,0,0,Another great blog post: Suburban Housewife - Rap AWESOME! http://www.fierceugly.com/home/2010/02/16/suburban-housewife-rap-awesome/
51,8456435728,Sun Jan 31 16:04:23 +0000 2010,0,0,Another great blog post: The Best Web Cam Break Up Ever http://www.fierceugly.com/home/2010/01/31/the-best-web-cam-break-up-ever/
52,8279348086,Wed Jan 27 13:46:19 +0000 2010,0,0,Another great blog post: Some Thoughts About My Dog http://www.fierceugly.com/home/2010/01/27/some-thoughts-about-my-dog/
53,8120271263,Sat Jan 23 19:02:47 +0000 2010,1,0,Another great blog post: What would your fine be? http://www.fierceugly.com/home/2010/01/23/what-would-your-fine-be/
54,7564437375,Sat Jan 09 18:17:34 +0000 2010,0,0,Total was $4.22. I gave her $10.27. Totally through her for a loop. We are doomed!
55,7425043672,Wed Jan 06 02:19:28 +0000 2010,0,0,Another great blog post: Google announces the new Nexus one http://www.fierceugly.com/home/2010/01/05/google-announces-the-new-nexus-one/
56,7405229743,Tue Jan 05 14:53:42 +0000 2010,0,0,Another great blog post: Crazy Nuts Illusion! http://www.fierceugly.com/home/2010/01/05/crazy-nuts-illusion/
57,7352906276,Mon Jan 04 02:47:38 +0000 2010,0,0,Another great blog post: Jasper Ruins Christmas http://www.fierceugly.com/home/2010/01/03/jasper-ruins-christmas/
58,7352148042,Mon Jan 04 02:22:29 +0000 2010,0,0,About to go live --&gt;  http://www.fierceugly.com/home/live-video/
59,7288873057,Sat Jan 02 03:55:33 +0000 2010,0,0,"Another great blog post: Fat Guy, Frozen Lake - Not a Good Combination http://bit.ly/7gGaeS"
60,7142581493,Tue Dec 29 01:40:54 +0000 2009,0,0,Another great blog post: I'm on a Mac (I'm on a Boat spoof) ft. PC-Pain - SwitchToMac.com http://bit.ly/7XFmd5
61,7062100509,Sat Dec 26 14:46:03 +0000 2009,0,0,Another great blog post: Ice skating cars: Some advice for icy roads http://bit.ly/50UzCy
62,7007591242,Thu Dec 24 18:34:49 +0000 2009,0,0,Another great blog post: Why Male Elk Have Long Antlers  http://www.fierceugly.com/home/2009/12/24/why-male-elk-have-long-antlers/
63,6797906886,Fri Dec 18 14:48:09 +0000 2009,0,0,Another great blog post: Christmas Light Hero http://www.fierceugly.com/home/2009/12/18/christmas-light-hero/
64,6752663094,Thu Dec 17 03:23:02 +0000 2009,0,0,Another great blog post: Free Nobel Piece Prize http://www.fierceugly.com/home/2009/12/16/free-nobel-piece-prize/
65,6486530150,Wed Dec 09 04:03:03 +0000 2009,0,0,Another great blog post: Ever Wonder What Hitler Thinks of Tiger Woods? http://bit.ly/6Hhn02
66,6376271068,Sat Dec 05 18:47:02 +0000 2009,0,0,Another great blog post: The Poll Numbers Slip Sliding Away http://www.fierceugly.com/home/2009/12/05/the-poll-numbers-slip-sliding-away/
67,6374756454,Sat Dec 05 17:44:24 +0000 2009,0,0,Another great blog post: Girlfriend Destroys a PS3 http://www.fierceugly.com/home/2009/12/05/girlfriend-destroys-a-ps3/
68,6371813794,Sat Dec 05 15:41:28 +0000 2009,0,1,Another great blog post: Tiger Woods Voicemail Slow Jam Remix http://bit.ly/5walqQ
69,6361060052,Sat Dec 05 04:56:52 +0000 2009,0,0,Another great blog post: Here's the Deal Kid http://www.fierceugly.com/home/2009/12/04/heres-the-deal-kid/
70,6360921668,Sat Dec 05 04:50:36 +0000 2009,0,0,Another great blog post: Living Manequins http://www.fierceugly.com/home/2009/12/04/living-manequins/
71,6359846788,Sat Dec 05 04:03:46 +0000 2009,0,0,Another great blog post: What is war godd for? http://www.fierceugly.com/home/2009/12/04/what-is-war-godd-for/
72,6359797621,Sat Dec 05 04:01:45 +0000 2009,0,0,Another great blog post: It's Probably safe to Say... http://www.fierceugly.com/home/2009/12/04/its-probably-safe-to-say/
73,6359602663,Sat Dec 05 03:53:43 +0000 2009,0,0,Another great blog post: Need a good realtor? http://www.fierceugly.com/home/2009/12/04/need-a-good-realtor/
74,6356694240,Sat Dec 05 01:57:09 +0000 2009,0,0,Another great blog post: Tom Brokaw Involved in Fatal Car Crash http://bit.ly/6qMYCo
75,6356077069,Sat Dec 05 01:32:51 +0000 2009,0,0,Another great blog post: Monkey Swinging and Peeing at the same time http://bit.ly/56lDXi
76,6344078004,Fri Dec 04 17:57:56 +0000 2009,0,0,Another great blog post: Greg Grunberg is Putting on Some Pounds http://bit.ly/4pPNn6
77,6222801083,Tue Dec 01 03:01:19 +0000 2009,0,0,Another great blog post: Episode #55 11-30-2009 http://www.fierceugly.com/home/2009/11/30/episode-55-11-30-2009/
78,6220594749,Tue Dec 01 01:46:15 +0000 2009,0,0,"About to record live, yes we are a day late... http://bit.ly/56ga1w"
79,6158637280,Sun Nov 29 02:42:39 +0000 2009,0,0,Another great blog post: The Muppets: Bohemian Rhapsody http://www.fierceugly.com/home/2009/11/28/the-muppets-bohemian-rhapsody/
80,6155666633,Sun Nov 29 00:36:12 +0000 2009,0,0,Another great blog post: Twilight Moms http://www.fierceugly.com/home/2009/11/28/twilight-moms/
81,6151313093,Sat Nov 28 21:26:03 +0000 2009,0,0,Another great blog post: iJustine Does a Black Friday Rap http://www.fierceugly.com/home/2009/11/28/ijustine-does-a-black-friday-rap/
82,6148513817,Sat Nov 28 19:22:29 +0000 2009,0,0,"Another great blog post: Mr. Farkas, crazy old man http://www.fierceugly.com/home/2009/11/28/mr-farkas-crazy-old-man/"
83,6147206666,Sat Nov 28 18:24:03 +0000 2009,0,0,Another great blog post: Compilation of Some Pretty Funny Videos http://bit.ly/5nDrk8/
84,6145902454,Sat Nov 28 17:26:30 +0000 2009,0,0,Another great blog post: Funniest Video in the World http://www.fierceugly.com/home/2009/11/28/funniest-video-in-the-world/
85,6144530146,Sat Nov 28 16:26:45 +0000 2009,0,0,Check out Brizzly – more than just a cute mascot: http://bit.ly/6OjMFf
86,6116607403,Fri Nov 27 16:55:44 +0000 2009,0,0,Another great blog post: All we're trying to do is win the Mother Fucking game - Josh McDaniels http://bit.ly/6O56RI/
87,6056568462,Wed Nov 25 18:08:24 +0000 2009,0,0,Another great blog post: Amazon River Woodpecker vs Snake - A fight over woodpecker nest http://bit.ly/4oenZ1/
88,6053281758,Wed Nov 25 16:03:51 +0000 2009,0,0,Another great blog post: Google is expanding into all kinds of new markets http://bit.ly/6BE9FM/
89,6023862247,Wed Nov 25 00:00:45 +0000 2009,0,0,Another great blog post: Balloon Bass and Box http://www.fierceugly.com/home/2009/11/24/balloon-bass-and-box/
90,6020707995,Tue Nov 24 22:03:47 +0000 2009,0,0,Another great blog post: Polar Bears Falling From the Sky http://www.fierceugly.com/home/2009/11/24/polar-bears-falling-from-the-sky/
91,6017596723,Tue Nov 24 20:03:52 +0000 2009,0,0,Another great blog post: Officer Breaks Window With Drunks Face http://bit.ly/4BIuxQ/
92,6014394523,Tue Nov 24 17:54:55 +0000 2009,0,0,Another great blog post: That's One Way to Channel the Music http://www.fierceugly.com/home/2009/11/24/thats-one-way-to-channel-the-music/
93,5992921713,Tue Nov 24 00:30:03 +0000 2009,0,0,We are live - http://bit.ly/56ga1w
94,5928960102,Sat Nov 21 21:44:45 +0000 2009,0,0,"I'm streaming my Band Hero concert, come watch --&gt; http://bit.ly/56ga1w"
95,5829633910,Wed Nov 18 16:02:31 +0000 2009,0,0,Another great blog post: Call of Duty Modern Warfare 2 on Three Monitors - AMD Eyefinity http://bit.ly/3IMGR0/
96,5765822910,Mon Nov 16 14:18:21 +0000 2009,0,0,$2.4 Million Bugatti Veyron Crashes Into the Water | FierceUgly.com http://bit.ly/3tAi9d
97,5765818038,Mon Nov 16 14:18:08 +0000 2009,0,0,Talk About Putting Lip Stick on a Pig | FierceUgly.com http://bit.ly/2itiVE
98,5756116045,Mon Nov 16 04:09:11 +0000 2009,0,0,Another great blog post: Episode #53 11-15-2009 http://bit.ly/1O0CMe
99,5746696968,Sun Nov 15 21:45:31 +0000 2009,0,0,Another great blog post: Tweetin On A Jet Plane http://bit.ly/Ync7O
100,5743566826,Sun Nov 15 19:37:10 +0000 2009,0,0,Another great blog post: That is one Naughty Elmo http://bit.ly/1WfRMF
101,5742409795,Sun Nov 15 18:46:18 +0000 2009,0,0,Another great blog post: That's One Way To Feed Your Cat http://bit.ly/1fhDhV
102,5740613791,Sun Nov 15 17:24:06 +0000 2009,0,0,Another great blog post: Interesting Barbie Pose http://bit.ly/39QpQs
103,5724578972,Sun Nov 15 01:48:35 +0000 2009,0,0,Another great blog post: The Robot Bartender and Your IQ http://bit.ly/9XWE8
104,5574980208,Tue Nov 10 00:57:40 +0000 2009,0,0,Another great blog post: Monkey peeing in his own mouth http://bit.ly/3XU05S
105,5549797222,Mon Nov 09 03:39:21 +0000 2009,0,0,Another great blog post: Episode #52 11-08-2009 http://bit.ly/3XWu9
106,5548663627,Mon Nov 09 02:49:18 +0000 2009,0,0,We are live --&gt;  http://www.fierceugly.com/live
107,5534105160,Sun Nov 08 15:50:55 +0000 2009,0,0,Another great blog post: Watch where you stick your head http://bit.ly/XFKpf
108,5534022626,Sun Nov 08 15:46:31 +0000 2009,0,0,Another great blog post: Need a boost?  Pucs to Inflate http://bit.ly/3V28q1
109,5533974749,Sun Nov 08 15:44:01 +0000 2009,0,0,Another great blog post: Coming twice in the backdoor? http://bit.ly/1Y8ir
110,5381344067,Tue Nov 03 02:56:21 +0000 2009,0,0,How to make a bootable ISO / DVD from the Windows 7 download http://bit.ly/12uCUp
111,5353587741,Mon Nov 02 02:51:56 +0000 2009,0,0,Recording live http://www.fierceugly.com/live
112,5350125238,Mon Nov 02 00:18:09 +0000 2009,0,0,"Your ISP, if Net Neutrality disappears http://bit.ly/3ihbES"
113,5163639279,Mon Oct 26 03:03:34 +0000 2009,0,1,Another great blog post: Episode #50 10-25-2009 http://bit.ly/DDnpL
114,5162344562,Mon Oct 26 02:04:05 +0000 2009,0,0,Live now http://www.fierceugly.com/live
115,5131471911,Sat Oct 24 21:12:24 +0000 2009,0,0,Another great blog post: Inspiration for Older Folks http://bit.ly/1QANBs
116,5047639750,Wed Oct 21 16:55:26 +0000 2009,0,0,"Hey dude in the other stall, ever heard of a courtesy flush? Sheesh!"
117,4959254221,Sun Oct 18 03:56:27 +0000 2009,0,0,Another great blog post: Some people just don't learn http://bit.ly/10op6T
118,4904115166,Fri Oct 16 01:25:07 +0000 2009,0,0,Another great blog post: Randommel Does it Her Way http://bit.ly/yIxwb
119,4851083401,Wed Oct 14 01:50:09 +0000 2009,0,0,The very first bomb dropped by the Allies on Berlin during World War II killed the only elephant in the Berlin Zoo.
120,4851059694,Wed Oct 14 01:49:13 +0000 2009,0,0,RT @OGOchoCinco www.ochocinco.com/iphone&lt;--- 1st athlete with an iPhone app! If you cant fly here to chill with me you can with this app
121,4824500115,Tue Oct 13 02:13:54 +0000 2009,0,0,Another great blog post: Laserguided dog http://bit.ly/1PF9f4
122,4800303247,Mon Oct 12 03:25:01 +0000 2009,0,0,My computer just beat me at chess...but it was no match for me at kick boxing.
123,4800242939,Mon Oct 12 03:22:05 +0000 2009,0,0,Another great blog post: Episode #49 10/11/2009 http://bit.ly/40jha3
124,4798381882,Mon Oct 12 01:56:47 +0000 2009,0,0,Recording live in a few minutes http://bit.ly/fyRmc #fierceugly
125,4763948751,Sat Oct 10 16:52:10 +0000 2009,0,0,Another great blog post: Meredith Vieira needs to get some action http://bit.ly/nS7dx
126,4734107159,Fri Oct 09 13:25:22 +0000 2009,0,0,#FollowFriday @sdutchargers @fabio26 @InRev_Buzzom @CarlsJr @jerzegurl @mountainkat
127,4721652028,Fri Oct 09 00:34:06 +0000 2009,0,0,Another great blog post: Cop Socks Girl In Face and Is Confronted By Family http://bit.ly/6Izsu
128,4699438589,Thu Oct 08 02:43:20 +0000 2009,0,0,Another great blog post: Amish boy gets caught with porn! http://bit.ly/1HG3vB
129,4644202408,Tue Oct 06 01:46:33 +0000 2009,0,0,RT @sdutChargers: The U-T knows the Chargers. Stay connected w/ @sdutChargers. RT & you could win dinner w/ Kevin Acee. http://bit.ly/OfOCn
130,4543550593,Fri Oct 02 03:06:17 +0000 2009,0,0,I used Shazam to discover Keep On Loving you by REO Speedwagon #shazam
131,4434514484,Mon Sep 28 03:56:37 +0000 2009,0,0,@ReDoubleD click what?
132,4433981030,Mon Sep 28 03:30:02 +0000 2009,0,0,"Google ""Where is Chuck Norris"" and click I'm Feeling Lucky"
133,4433971041,Mon Sep 28 03:29:32 +0000 2009,0,0,Another great blog post: Episode #48 09-27-2009 http://bit.ly/13USrO
134,4433380922,Mon Sep 28 03:01:22 +0000 2009,0,0,Live Video Stream FierceUgly.com weekly podcast http://bit.ly/PIqUX
135,4432163465,Mon Sep 28 02:05:30 +0000 2009,0,0,Recording live in about 5 min http://www.fierceugly.com/live
136,4417754524,Sun Sep 27 14:40:39 +0000 2009,0,0,Another great blog post: He stuck it in the wrong hole http://bit.ly/3PeFct
137,4417264909,Sun Sep 27 14:12:00 +0000 2009,0,0,Another great blog post: Surprise your man http://bit.ly/3aAjgJ
138,4358996842,Fri Sep 25 02:50:00 +0000 2009,0,0,Another great blog post: You better put a ring on it http://bit.ly/EkJzb
139,4332140342,Thu Sep 24 02:30:11 +0000 2009,0,0,Any chance I can get some snow flurries in Pittsburgh next Sunday night?
140,4314616767,Wed Sep 23 12:58:39 +0000 2009,0,0,Another great blog post: Crazy Low Fly By http://bit.ly/2awyZe
141,4057308112,Thu Sep 17 16:22:30 +0000 2009,0,0,Another great blog post: Gather round boys and girls....story from the streets http://bit.ly/XYN8r
142,3928457763,Sat Sep 12 04:50:02 +0000 2009,0,0,"I'm not ashamed to admit it, I carry a lighter......I don't smoke..... I just really likes certain songs"
143,3928425012,Sat Sep 12 04:47:40 +0000 2009,0,1,"Please help my daughter's Orchestra go to San Francisco, buy something http://bit.ly/ZEYtm"
144,3928293194,Sat Sep 12 04:38:43 +0000 2009,0,0,"Another great blog post: ""Grabbing testicles and squeezing"" http://bit.ly/14GcDg"
145,3876569606,Thu Sep 10 01:04:29 +0000 2009,0,0,Another great blog post: Watch out for that ... http://bit.ly/W4C9t
146,3832953129,Tue Sep 08 03:30:45 +0000 2009,0,0,Another great blog post: If Tarzan Was Jewish http://bit.ly/2ay8J
147,3821503346,Mon Sep 07 16:50:01 +0000 2009,0,0,Whoever thinks nothing is impossible has never tried to slam a revolving door
148,3821411951,Mon Sep 07 16:44:59 +0000 2009,0,1,"Hey baby, wanna come over to myspace so i can twitter ur yahoo til u google all over my facebook?"
149,3808674845,Mon Sep 07 00:47:49 +0000 2009,0,0,Another great blog post: I'm on a boat - US Navy Style http://bit.ly/16wieh
150,3808583944,Mon Sep 07 00:42:10 +0000 2009,0,0,Another great blog post: Never let a crackhead sing at your funeral http://bit.ly/oovyj
151,3769998452,Sat Sep 05 01:18:21 +0000 2009,0,0,#FollowFriday @valenzetti @icandysensation @thejessicadrake @Reavel @ThomasLierzer @vastmuscle
152,3769989229,Sat Sep 05 01:17:51 +0000 2009,0,0,#FollowFriday @mountainkat @fabio26 @casalinda @InRev_Buzzom @CarlsJr @jerzegurl
153,3767830925,Fri Sep 04 23:17:13 +0000 2009,0,0,Another great blog post: REASONS TO CALL AN AMBULANCE http://bit.ly/14W3pr
154,3748723855,Fri Sep 04 02:55:03 +0000 2009,0,0,Life is like a jar of jalapenos... What you do today might burn your @$$ tomorrow.
155,3732843688,Thu Sep 03 12:51:53 +0000 2009,0,0,Another great blog post: Airplane invades Dodgers Stadium http://bit.ly/35CAZp
156,3724167006,Thu Sep 03 01:41:38 +0000 2009,0,0,"Another great blog post: I wear a coat (""I'm on a boat"" parody) http://bit.ly/DLtOl"
157,3724155713,Thu Sep 03 01:41:04 +0000 2009,0,0,Another great blog post: Ever wonder how to make a flute out of a hot dog? http://bit.ly/Qndg6
158,3724063463,Thu Sep 03 01:36:37 +0000 2009,0,0,Another great blog post: Talk about a circus clown http://bit.ly/12lM9n
159,3710539053,Wed Sep 02 12:50:06 +0000 2009,0,1,A dawrf got pick-pocketed the other day............ How could anyone stoop so low?
160,3687755115,Tue Sep 01 13:05:02 +0000 2009,0,0,The problem with being punctual is that there is rarely anyone there to appreciate it.
161,3687553663,Tue Sep 01 12:51:26 +0000 2009,0,0,@CarlsJr I need to try the Big Carl.  Is it available at the new Denton location?
162,3658583436,Mon Aug 31 03:24:30 +0000 2009,0,0,Another great blog post: Episode #47 08-29-2009 http://bit.ly/mR9ut
163,3658054346,Mon Aug 31 02:53:58 +0000 2009,0,0,RT @CarlsJr Who wants a t-shirt? http://bit.ly/3Rjw7 Giving away 5 @ random today! Just post a pic of your lunch or dinner at Carls Jr.
164,3658032336,Mon Aug 31 02:52:40 +0000 2009,0,0,RT @CarlsJr Who wants a t-shirt? http://bit.ly/3Rjw7Giving away 5 @ random today! Just post a pic of your lunch or dinner at Carls Jr.
165,3657606993,Mon Aug 31 02:28:42 +0000 2009,0,0,Talking DJ AM http://bit.ly/fyRmc #fierceugly
166,3657284885,Mon Aug 31 02:11:05 +0000 2009,0,0,Live Video Stream FierceUgly.com weekly podcast | FierceUgly.com http://bit.ly/PIqUX
167,3657142707,Mon Aug 31 02:03:25 +0000 2009,0,0,It’s time for Jen’s Box http://bit.ly/fyRmc #fierceugly
168,3656849715,Mon Aug 31 01:47:57 +0000 2009,0,0,"All I have ever wanted, all I have ever needed http://bit.ly/fyRmc #fierceugly"
169,3632834847,Sat Aug 29 21:50:20 +0000 2009,0,0,"Some ppl have 2 b Permanently together
Lovers devoted to Each other forever Now I've got things to do &I've said before that I know u have"
170,3628122950,Sat Aug 29 17:09:48 +0000 2009,0,0,Another great blog post: Hitler and the real estate downfall http://bit.ly/100TCO
171,3628074784,Sat Aug 29 17:06:59 +0000 2009,0,0,RT @fierceugly It Ain’t America No More | FierceUgly.com http://bit.ly/17O919
172,3628057017,Sat Aug 29 17:05:59 +0000 2009,0,1,Another great blog post: Err duh http://bit.ly/2lQylB
173,3628004586,Sat Aug 29 17:02:57 +0000 2009,0,0,Another great blog post: Girls make huge mess in kitchen http://bit.ly/Dg0zK
174,3627971778,Sat Aug 29 17:01:07 +0000 2009,0,0,Another great blog post: I Liked Tetherball When I was in 8th Grade http://bit.ly/koqJ9
175,3627006867,Sat Aug 29 16:05:39 +0000 2009,0,0,"Vows are spoken To be broken Feelings are intense Words are trivial Pleasures remain
So does the pain Words are meaningless And forgettable"
176,3624692859,Sat Aug 29 13:25:01 +0000 2009,0,0,"Build a man a fire and he is warm for a day. Set him on fire, and he is warm for the rest of his life."
177,3566962754,Wed Aug 26 23:13:24 +0000 2009,0,0,@johnnyridgeboy fierceugly.com
178,3555610833,Wed Aug 26 12:55:01 +0000 2009,0,0,Tip of the day: before you use the bathroom in someones house make sure you check they have toilet paper!!
179,3526451540,Tue Aug 25 02:32:09 +0000 2009,0,0,Just added myself to the http://wefollow.com twitter directory under:  #dallas #tech #podcast #blogger
180,3504643641,Mon Aug 24 02:46:48 +0000 2009,0,0,New blog post: Episode #46 08-23-2009 http://bit.ly/nSqjo
