,id_str,created_at,retweet_count,favorite_count,text
181,3503764063,Mon Aug 24 02:00:41 +0000 2009,0,0,Time for the #Bigbrother recap on Jen’s box http://bit.ly/fyRmc #fierceugly
182,3503635194,Mon Aug 24 01:54:09 +0000 2009,0,0,"Rise up and gather around, we are going to rock this place to the ground.  http://bit.ly/fyRmc #fierceugly"
183,3485198234,Sun Aug 23 03:30:01 +0000 2009,0,0,"Some days you are the pigeon, some days you are the statue.  Which are you today?"
184,3484771207,Sun Aug 23 03:04:52 +0000 2009,0,0,New blog post: What Have We Done? http://bit.ly/1ay4ad
185,3483497363,Sun Aug 23 01:50:01 +0000 2009,0,0,"It is just about time for some exciting #Chargers pre-season football.  I got my jersey on, all set!"
186,3475315208,Sat Aug 22 17:34:49 +0000 2009,0,0,"""False start, everyone except the center"". Now that is classic #NFL refereeing"
187,3458356737,Fri Aug 21 21:07:17 +0000 2009,0,0,@BMS1021 we've been messing around with it for about a year or so. Just something fun to do in our spare time.
188,3454377124,Fri Aug 21 17:44:09 +0000 2009,0,0,RT @MrMilestone @FierceUgly Congrats! You just reached 6000 followers!! Spread the word! http://bit.ly/roDP
189,3454367060,Fri Aug 21 17:43:38 +0000 2009,0,0,"@TheDavidBowers Why do you say ""a bit unusual""?"
190,3454310154,Fri Aug 21 17:40:44 +0000 2009,0,0,#FollowFriday @fabio26 @casalinda @mountainkat @rayrayangel @InRev_Buzzom @jerzegurl
191,3453914722,Fri Aug 21 17:20:44 +0000 2009,0,0,New blog post: Best reference letter of all time -- good tips to use in your next letter... http://bit.ly/3FJ1sw
192,3450492419,Fri Aug 21 14:25:13 +0000 2009,0,0,"Kinda cool show on Ustream, Billy Madison show live from Dallas http://bit.ly/XrWfz"
193,3441480989,Fri Aug 21 02:40:02 +0000 2009,0,0,Def Leppard and Poison tomorrow.  Good times!
194,3419103519,Thu Aug 20 02:33:51 +0000 2009,0,0,New blog post: Stay Seated When the Bus is in Motion http://bit.ly/u6Ird
195,3418944740,Thu Aug 20 02:25:38 +0000 2009,0,0,New blog post: I Guess That is One Way to Keep People Off http://bit.ly/RfEqy
196,3389855007,Tue Aug 18 20:24:59 +0000 2009,0,0,New blog post: Ever Seen A Horse Get Hit By a Car? http://bit.ly/2j6p93
197,3376557637,Tue Aug 18 04:29:28 +0000 2009,0,0,New blog post: Some Are So Special They Can Bless You With Anything http://bit.ly/5Shhj
198,3376502871,Tue Aug 18 04:25:48 +0000 2009,0,0,New blog post: Porta-potty In a Golf Club - wow http://bit.ly/3z0NOX
199,3376423686,Tue Aug 18 04:20:34 +0000 2009,0,0,"@InRev_Buzzom I just found the direct operation button, nice feature"
