,id_str,created_at,retweet_count,favorite_count,text
139,655107227770970112,Fri Oct 16 19:45:09 +0000 2015,10,20,"Make your #EDC bolder, beefier, and better with our newest giveaway: http://t.co/qGlRMKqE1u http://t.co/5jKKC3gVx2"
140,655072223263256576,Fri Oct 16 17:26:03 +0000 2015,10,27,Gideon in Fort Campbell always has this rugged #EDC when he’s in uniform http://t.co/KVrXuBaRhR http://t.co/PJF0TmJqfj
141,654797413027155968,Thu Oct 15 23:14:03 +0000 2015,1,26,"Jiro, an architect in Japan, carries a slim wallet and notebook for sketching in their #EDC http://t.co/Th83vPo2cM http://t.co/WeNvwCd1ku"
142,654751605862981633,Thu Oct 15 20:12:02 +0000 2015,4,20,"Phil, a pastor, protects their #EDC notebook with a custom leather cover http://t.co/HpbmZwllXb http://t.co/NXN9jH41A7"
143,654719661330690048,Thu Oct 15 18:05:06 +0000 2015,4,18,The EDCer’s Guide to Glasses on a Budget http://t.co/RiRY8nIXgn #sponsored http://t.co/yXgvuba6oI
144,654705559761891328,Thu Oct 15 17:09:03 +0000 2015,6,22,This business owner shares the minimal #EDC they bring to their leather goods shop http://t.co/4pN5dqAEtX http://t.co/t1jfQtMSgU
145,654444844429893632,Wed Oct 14 23:53:04 +0000 2015,5,28,Jay in Honolulu made some awesome mods to his #EDC gear http://t.co/AJnJOFOCxL http://t.co/S5FWnx3K3W
146,654391733187297280,Wed Oct 14 20:22:01 +0000 2015,2,22,NJR shares their bare minimum #EDC for studying law http://t.co/9Id2UVC5m0 http://t.co/o7ltSDgSrG
147,654372708906586112,Wed Oct 14 19:06:26 +0000 2015,1,20,Gear Gripz is like grip tape on steroids for your slicker-than-average #EDC gear http://t.co/PKCMtlWmUk #sponsored http://t.co/d1v48ltdMh
148,654344194241114112,Wed Oct 14 17:13:07 +0000 2015,4,25,Griffen’s blacked-out #EDC features some of the best value essentials for minimalists http://t.co/waRZb4jkGL http://t.co/EaUGy7L1NG
149,654079189352493056,Tue Oct 13 23:40:05 +0000 2015,6,34,Simple and basic #EDC gear gets the job done for this police officer in Norway http://t.co/4YEa9rnSHU http://t.co/NJa1bn6LbG
150,654027334849196032,Tue Oct 13 20:14:02 +0000 2015,9,29,This lawyer from Poland carries a weatherproof writing setup and versatile #EDC flashlights http://t.co/0QYzyCPvnS http://t.co/HYFdLzshEL
151,653980290596016128,Tue Oct 13 17:07:06 +0000 2015,3,17,"Patrick, an operations manager, keeps a dressy #EDC with gear polished to a mirror finish http://t.co/xu7w5csJQV http://t.co/LV2xhQqLla"
152,653715044048367618,Mon Oct 12 23:33:06 +0000 2015,4,34,"Ron’s #EDC has a bit of old and new, blending traditional and modern gear http://t.co/cAG5Wx9gHu http://t.co/5M8rkKqD87"
153,653662447769792512,Mon Oct 12 20:04:06 +0000 2015,2,24,"Ian in NY shares his #EDC, favorite knife of all time, and the best way to carry cash http://t.co/ItXlwfJ2Lx http://t.co/A1n9sUinhE"
154,653622427193184256,Mon Oct 12 17:25:05 +0000 2015,3,24,"J, a QA tech, packs plenty of #EDC gear onto his keychain and into his wallet http://t.co/NJGIcO7mZ8 http://t.co/XvNrukTDwP"
155,652993020766220288,Sat Oct 10 23:44:02 +0000 2015,3,23,"Ashley, an editorial photographer, keeps a versatile #EDC for a constantly changing workflow http://t.co/MyhTUC1H1C http://t.co/aOV0cYlTsy"
156,652945202496147456,Sat Oct 10 20:34:02 +0000 2015,3,27,"Ivan’s ready for the New Jersey fall with this durable, weather resistant #EDC http://t.co/tVusutSmeL http://t.co/nzxfu4g69f"
157,652899162065760256,Sat Oct 10 17:31:05 +0000 2015,6,29,Liam’s set for school with quality writing gear and #EDC gear http://t.co/Z7SJARV5c0 http://t.co/2mjSiOPhTu
158,652631909994921984,Fri Oct 09 23:49:07 +0000 2015,2,27,This artist carries a bolt-action pen and RFID-blocking wallet in their well-rounded #EDC http://t.co/90ISoEH6Fx http://t.co/RKc0q9PRhk
159,652578538269184000,Fri Oct 09 20:17:02 +0000 2015,1,12,"Peter, a technologist, only adds compact, functional #EDC gear to his ever-evolving keyring http://t.co/KwP287zrLr http://t.co/bo3otAFxvL"
160,652564245712867328,Fri Oct 09 19:20:14 +0000 2015,0,4,"@Doug_Stryker Hey doug, it’s a Kershaw Amplitude 3.25. More info at the original post here: http://t.co/0ITTXAxjbI

Hope that helps!"
161,652561193949749248,Fri Oct 09 19:08:07 +0000 2015,3,15,Some classy #EDC gear for the dapper crowd is up for grabs in our new giveaway! Enter here: http://t.co/kBsIq9ZsJG http://t.co/4RzlMJyEZo
162,652532751845879808,Fri Oct 09 17:15:06 +0000 2015,3,30,This marketing exec’s #EDC covers bases without much bulk thanks to the right keychain gear http://t.co/pMQglg3lGj http://t.co/2qt6hLeziD
163,652502374595043328,Fri Oct 09 15:14:23 +0000 2015,0,4,Signal boost! What’s your go-to badge wallet for #EDC? https://t.co/QxVsPyU8J2
164,652268260583276544,Thu Oct 08 23:44:06 +0000 2015,4,25,This consultant shares his essential #EDC kit for biking through the streets of Paris http://t.co/aYDDziZd5E http://t.co/DDb73yULwe
165,652219182809944064,Thu Oct 08 20:29:05 +0000 2015,4,27,Roy in Israel shows us how he packs his #EDC organizer http://t.co/caAcsgCwtE http://t.co/5as9ghkLBt
166,652182423703318528,Thu Oct 08 18:03:01 +0000 2015,0,0,"@itseddiepease you got it, Eddie! Thanks for sharing. very slick for your first! keep it up"
167,652168351699959808,Thu Oct 08 17:07:06 +0000 2015,5,21,Antony in Australia updates his sturdy set of well-selected gear with a new #EDC watch http://t.co/o7BMNAgNzh http://t.co/aYwYGqBias
168,651895536308457478,Wed Oct 07 23:03:02 +0000 2015,5,19,Christian brings this minimal woodworker #EDC when hitting the lumberyard http://t.co/fpmUNv9S1x http://t.co/y87WLoXjxu
169,651809732424896512,Wed Oct 07 17:22:04 +0000 2015,7,19,Sam swapped in a bigger light and other stormproof #EDC gear to weather the recent rain: http://t.co/6j3Hjx9pOJ http://t.co/r05cHb6W0W
170,651760540231049216,Wed Oct 07 14:06:36 +0000 2015,0,2,"@xaeromarine gonna tap @edjelleydotcom for this, he should know!"
171,651543484315205634,Tue Oct 06 23:44:06 +0000 2015,4,28,"Andrew, a wind turbine tech, battles pocket bulge by carrying only simple, slim #EDC items http://t.co/A6eKMFSvtU http://t.co/ZFKElw8THh"
172,651491371686039552,Tue Oct 06 20:17:01 +0000 2015,10,29,"This mechanical engineer’s design #EDC helps him sketch, build and make http://t.co/wxosECgW3j http://t.co/VAEnTLl0Zu"
173,651472278711074816,Tue Oct 06 19:01:09 +0000 2015,2,23,We’re looking for creatives who are passionate about #EDC to join our remote team: http://t.co/U65aCliToc http://t.co/Oha44tpZVV
174,651444316116643841,Tue Oct 06 17:10:02 +0000 2015,3,26,Alex is ready for the fall with these pocket-friendly #EDC essentials http://t.co/YEZcqQZerJ http://t.co/AWet047JpS
175,651185225918099456,Tue Oct 06 00:00:30 +0000 2015,0,1,@chongalong same
176,651179832680648704,Mon Oct 05 23:39:05 +0000 2015,4,30,"This designer in the UK assembled a light, portable #EDC for navigating a big, bustling city http://t.co/3pNGaIBX1b http://t.co/k70mbvpDQN"
177,651125483585716225,Mon Oct 05 20:03:07 +0000 2015,5,22,How important is it to have a themed #EDC? Mike in CA shares his insightful take on it: http://t.co/KZV9oTOxvN http://t.co/XAJdEVe16E
178,651080940815413249,Mon Oct 05 17:06:07 +0000 2015,2,18,Adam shares the result of refining his #EDC to work best for him as a copywriter http://t.co/S7i2nnQMBr http://t.co/BiPO7L17eo
179,651075971550945280,Mon Oct 05 16:46:22 +0000 2015,4,0,RT @xaeromarine: Girls like tools too. My #xLab #EDC @everydaycarry @SOGKnives @Streamlight @CRKTweet 😊 http://t.co/DV40irTiFw
180,650447005429293056,Sat Oct 03 23:07:05 +0000 2015,6,24,"This business owner’s #EDC is super simple, clean, and purposeful http://t.co/vqmm0BQFsv http://t.co/8oyIrXRnfT"
181,650405466414055425,Sat Oct 03 20:22:01 +0000 2015,5,26,"William, a retired soldier in Colorado, shares the minimum  essentials of his #EDC http://t.co/L0atcBCVPe http://t.co/pXOROYuoWF"
182,650355407941038080,Sat Oct 03 17:03:06 +0000 2015,5,15,Everything in Pete’s #EDC gets used on a daily basis on the job as a researcher http://t.co/sRAxVqokO8 http://t.co/zUGimBjqHf
183,650086887617499137,Fri Oct 02 23:16:06 +0000 2015,4,18,This architect in Thailand’s well-rounded #EDC features great value gear http://t.co/hwNFzn8mne http://t.co/4OXI6XfAxO
184,650047864274419712,Fri Oct 02 20:41:02 +0000 2015,7,27,Melvin in Berlin shares his newly updated #EDC of sleek black and silver gear http://t.co/VQsojwGBMN http://t.co/4estDKJf2h
185,650023211883630592,Fri Oct 02 19:03:05 +0000 2015,3,29,Think outside the pocket. Win functional #EDC accessories you can wear in our new giveaway: http://t.co/aitTmVCf9j http://t.co/DQO4x0zHnC
186,650012626181709824,Fri Oct 02 18:21:01 +0000 2015,0,10,"Congrats to Barclay R, winner of our Weekender Travel Essentials giveaway! 

New #EDC gear to win coming up soon 🔜 http://t.co/Wq4CPDUy4G"
187,649995028861812738,Fri Oct 02 17:11:05 +0000 2015,1,8,Taylor in Atlanta thinks their watch and blade combo make for the perfect #EDC http://t.co/f7FwNzwsaO http://t.co/n91ZEnL6Pv
188,649955714555846657,Fri Oct 02 14:34:52 +0000 2015,8,22,@xaeromarine I'm excited for the upcoming navy @SwissArmy Cadet alox 👀 http://t.co/yJdk8JcNBG
189,649955051952279552,Fri Oct 02 14:32:14 +0000 2015,0,1,"@xaeromarine @HamiltonWatch @CrossPens Navy is such a beautiful color, great choices!"
190,649725741068763136,Thu Oct 01 23:21:02 +0000 2015,2,24,"Jake, a radiographer in Illinois, opts for a more timeless, traditional #EDC http://t.co/QODtLWYo04 http://t.co/QFFEQ7eRfj"
191,649683461880463361,Thu Oct 01 20:33:02 +0000 2015,5,40,"Micah, a software engineer, themed their #EDC around sleek and sturdy carbon fiber https://t.co/1G2cv1MsOJ https://t.co/4jta6QCMUF"
192,649669154409160704,Thu Oct 01 19:36:11 +0000 2015,3,16,Check out our 6 favorite #EDC submissions from September: https://t.co/Sf5LQLYGQD https://t.co/pLUgPSu008
193,649631886961078272,Thu Oct 01 17:08:06 +0000 2015,5,16,This railroader’s #EDC serves double duty for work and home tasks http://t.co/oLG4wvWeAi http://t.co/vzpknDyd1P
194,649367123857309696,Wed Sep 30 23:36:01 +0000 2015,1,20,"Ryan, a medical clerk, relies on this #EDC to tackle the daily grind in the ward and ER http://t.co/5NiwDytk0h http://t.co/J6jHCRferZ"
195,649317800759029761,Wed Sep 30 20:20:02 +0000 2015,3,19,"For Christian, a photographer, not a day goes by where he doesn’t #EDC these basic tools http://t.co/9SvkNZg1FJ http://t.co/O2SE73ocq1"
196,649269752725028864,Wed Sep 30 17:09:06 +0000 2015,2,22,"This composer in Greece can write, cut, and comb on the go with their slim #EDC http://t.co/cC5rId5OUU http://t.co/VRD7nw1eZi"
197,649000227798515712,Tue Sep 29 23:18:06 +0000 2015,9,31,This mechanical engineer 3D printed their keychain and made their own notebook cover to #EDC http://t.co/zN311zr897 http://t.co/aWtk9zUx8p
198,648957700919832576,Tue Sep 29 20:29:07 +0000 2015,2,10,"Nick in New Orleans carries slim, classy #EDC essentials to his business meetings http://t.co/wBj1QrPULm http://t.co/pjI9cNUFQg"
199,648905345809518592,Tue Sep 29 17:01:05 +0000 2015,14,32,This designer slimmed down their #EDC by combining a wallet and survival tools into one kit http://t.co/VE8d1OQRqt http://t.co/WpCY1raUL6
