,id_str,created_at,retweet_count,favorite_count,text
0,669261483134464000,Tue Nov 24 21:09:06 +0000 2015,0,10,This shipping agent gearing up for the holidays with this red and green #EDC https://t.co/OaAVemKWGD https://t.co/3VecgYdxiX
1,669220953201602560,Tue Nov 24 18:28:03 +0000 2015,2,16,"Jason, a restaurant manager, keeps thin, strong, and light #EDC gear in his suit pockets https://t.co/kdMALUZkaD https://t.co/tzoRrd3yon"
2,668947664973598720,Tue Nov 24 00:22:06 +0000 2015,5,23,Brian put together this #EDC with essentials for the urban commuter https://t.co/Zn0pnVcIcw https://t.co/ykvww4Rws7
3,668900100794511360,Mon Nov 23 21:13:06 +0000 2015,3,33,Dennis in Germany empties his #EDC bag full of gear for photography and design https://t.co/6Lg36BnErn https://t.co/nD1sjHmcFg
4,668893710952873984,Mon Nov 23 20:47:42 +0000 2015,0,1,"@websuspect No worries, thanks for your EDC. Feel better soon!"
5,668858095385321473,Mon Nov 23 18:26:11 +0000 2015,3,31,"For Dave, a doctor, too much titanium #EDC gear still isn’t enough https://t.co/enK9V0wGKv https://t.co/qtdQEaSQh0"
6,668487903425798145,Sun Nov 22 17:55:10 +0000 2015,0,0,"@BewilderBrains Thanks! You can check our beginner’s guide here, I hope it helps:  https://t.co/Xjyya7vKOz"
7,668129510114525184,Sat Nov 21 18:11:03 +0000 2015,2,27,"This #EDC from John in Colorado might be small, but it’s effective for daily tasks https://t.co/cOJQV8ZEUT https://t.co/eBciLN3HMX"
8,667894736561262592,Sat Nov 21 02:38:08 +0000 2015,1,0,RT @AdamHann: Some great tips in this article! // How to Take Better EDC Photos in 7 Easy Steps https://t.co/dg0xiDkcYD via @everydaycarry
9,667866034003533825,Sat Nov 21 00:44:05 +0000 2015,2,17,KB’s understated #EDC features high end gear for enjoying tunes and keeping track of time https://t.co/I60wsNU5gr https://t.co/KEPZleryz7
10,667815961160880128,Fri Nov 20 21:25:07 +0000 2015,3,37,"If you’re a fan of leather goods, journals, and portfolios, you’ll enjoy Dale’s #EDC https://t.co/07TuKqnszG https://t.co/DVVQCwhSha"
11,667769898790064129,Fri Nov 20 18:22:05 +0000 2015,4,51,"From sketching ideas to visualizing data, this industrial design student is always prepared https://t.co/d6P9Hzybyv https://t.co/gz2CcJXFvf"
12,667499855892234240,Fri Nov 20 00:29:01 +0000 2015,4,23,This teacher in Wyoming’s techy #EDC has plenty of color and character https://t.co/eRTZs4dbJS https://t.co/WxrBJmDb3v
13,667452306326093824,Thu Nov 19 21:20:05 +0000 2015,1,16,"Anas in Dubai covers their bases with compact tools, keychain kits and functional wristwear https://t.co/CwjO5VJuca https://t.co/ra3dZSOdlv"
14,667418332593676288,Thu Nov 19 19:05:05 +0000 2015,10,37,How to Take Better #EDC Photos in 7 Easy Steps https://t.co/eipgbRlgrd #CarrySmarter https://t.co/AbDSv2j33m
15,667405759794163712,Thu Nov 19 18:15:07 +0000 2015,2,18,Parker empties his #EDC bag of essentials for his day to day as a student https://t.co/SCY7mumWNx https://t.co/sGlB2P4f7C
16,667321368367632385,Thu Nov 19 12:39:47 +0000 2015,0,1,"@chetstead Ouch, sorry to hear that. RIP indeed. OP’s is a Delica 4, though"
17,667140500676210688,Thu Nov 19 00:41:04 +0000 2015,5,44,"Steve’s #EDC is full of carefully chosen items to cover his needs, without excess https://t.co/FXK4WztjGI https://t.co/F5uEnkgupM"
18,667087639632179200,Wed Nov 18 21:11:01 +0000 2015,2,20,This landscape architect’s #EDC is a minimal solution that’s easy to grab and go https://t.co/INJJsT3f85 https://t.co/50zTfxHKFc
19,667047599648735232,Wed Nov 18 18:31:55 +0000 2015,1,22,Gear up with #EDC-worthy glasses that won’t break the bank: https://t.co/RiRY8o0yEX #sponsored https://t.co/tMaLmW4REB
20,667046893529141248,Wed Nov 18 18:29:07 +0000 2015,3,18,"LaVan, a photographer, mastered their #EDC for recording interviews, speeches, and concerts https://t.co/q1YFccNo0z https://t.co/duDo4jxE2G"
21,666773341504540672,Wed Nov 18 00:22:07 +0000 2015,2,28,"Daniel in Montreal’s #EDC features gear made from bronze, titanium, and leather https://t.co/wTCJTOjdwP https://t.co/gsbeImTG8k"
22,666725769515692033,Tue Nov 17 21:13:05 +0000 2015,1,23,Mark shares his #EDC of everything he needs to commute into the city for work  https://t.co/XuDD3tWQVh https://t.co/bvT2ZTwKdV
23,666677449967603712,Tue Nov 17 18:01:04 +0000 2015,4,26,This IT engineer in Australia’s #EDC is simple and effective enough for the office https://t.co/R6PDoiSaD7 https://t.co/WXtxjF6qn1
24,666649754705653761,Tue Nov 17 16:11:01 +0000 2015,5,15,"With the Cerberus titanium multitool, three heads are better than one: https://t.co/zZSLCjgZyV #EDC #sponsored https://t.co/k2h6wrouAQ"
25,666415228112928769,Tue Nov 17 00:39:06 +0000 2015,7,30,"Carlo, a digital nomad in Rome, keeps his tools and tech organized in #EDC pouches https://t.co/MThz9Sncbv https://t.co/Ny4FUzkFjM"
26,666362868942528512,Mon Nov 16 21:11:03 +0000 2015,5,46,This artist’s #EDC is full of beautifully aged leather goods and mixed metal tools https://t.co/eM5eKyAJIi https://t.co/6Sc7dY3fM3
27,666319831394717696,Mon Nov 16 18:20:02 +0000 2015,5,23,This product designer’s eye for gear shows in this well-selected #EDC https://t.co/lxdVCVQaIK https://t.co/8q5MsAoN7u
28,666051313407397888,Mon Nov 16 00:33:02 +0000 2015,1,23,"Curtis bases his #EDC around these lightweight, convenient essentials https://t.co/YLL5kSEDFh https://t.co/ZhuMOJEQVk"
29,666001991160606721,Sun Nov 15 21:17:03 +0000 2015,4,26,"Fernando, an analys, considers this lightweight, non-bulky gear his essential #EDC https://t.co/fTtCW15Dq9 https://t.co/pb2H9VmEuI"
30,665960977779658752,Sun Nov 15 18:34:04 +0000 2015,12,58,"Jing, a journalist in the Philippines, doesn’t leave the house without this expansive #EDC https://t.co/3ryEFmFvAk https://t.co/nsGWaAV1ye"
31,665682904563888128,Sun Nov 15 00:09:06 +0000 2015,12,42,Jacob’s all-around #EDC is well-suited for daily tasks as well as a day spent outdoors https://t.co/no7k95iXCT https://t.co/kc4BbB5Oes
32,665642622824804352,Sat Nov 14 21:29:02 +0000 2015,5,26,Ian in California’s all-black #EDC fits in his pockets and serves him well every day https://t.co/KqpT23fGv3 https://t.co/ygZ8AjpQ1o
33,665593061175525377,Sat Nov 14 18:12:06 +0000 2015,1,29,"Jake, a chef, relies on this #EDC for commuting through both rural and urban areas https://t.co/X5DeGOQV5y https://t.co/kAtdY9GpRO"
34,665284523031052288,Fri Nov 13 21:46:05 +0000 2015,6,35,"Arran’s well-curated, casual #EDC has the right functionality for most daily tasks https://t.co/RrzzWLafXN https://t.co/9tGVxxqpzo"
35,665235957747023873,Fri Nov 13 18:33:06 +0000 2015,3,18,Matt turns to traditional #EDC gear and leather goods to streamline his pockets https://t.co/XvVwGnQA3i https://t.co/I1Dwem44ej
36,665218166843305985,Fri Nov 13 17:22:24 +0000 2015,0,0,"@sebastianleones @nashp It’s a possibility, but for now we’re focused on launching the site smoothly. We’ll keep it in mind. Thanks!"
37,665217916762066945,Fri Nov 13 17:21:25 +0000 2015,0,5,"And the winner is… Jonathan S! Congrats! To everyone else who wasn’t so lucky, stay tuned for more chances to win new #EDC gear on our site."
38,665160300656590848,Fri Nov 13 13:32:28 +0000 2015,0,0,"@MariusQusnerius Opinels are great, but many of the larger ones have Virobloc locks on the collar. Without modding they’d be illegal :("
39,664990833398050816,Fri Nov 13 02:19:04 +0000 2015,7,31,10 Non-Locking #EDC Knives to Carry (Almost) Anywhere https://t.co/Tl1NXk6fYd #CarrySmarter https://t.co/TwXM1erdH4
40,664958626306457600,Fri Nov 13 00:11:05 +0000 2015,14,46,"Micah in Seattle says he’s a software engineer, but his #EDC makes us think Stormtrooper https://t.co/DP2uazJ5V4 https://t.co/X79ZKYU636"
41,664913817000808448,Thu Nov 12 21:13:02 +0000 2015,2,24,This well-executed dress #EDC for the office combines old and new https://t.co/6Mh0HmBCU9 https://t.co/C0qB9F8KFW
42,664907288453353472,Thu Nov 12 20:47:05 +0000 2015,2,20,"We’re excited to announce our new companion site, WAYWT! It’s like EDC for men’s fashion: https://t.co/vkDeNB9QoH https://t.co/WDGRpCu6Gy"
43,664897234543112192,Thu Nov 12 20:07:08 +0000 2015,14,41,Locking knives not allowed where you live? Our newest #CarrySmarter guide has you covered: https://t.co/Tl1NXk6fYd https://t.co/ptaJZyKpet
44,664866522385395712,Thu Nov 12 18:05:06 +0000 2015,3,19,This physicist’s #EDC includes a versatile keychain setup to keep their bases covered https://t.co/cmOSmF3GFD https://t.co/TAWjQTldu0
45,664598760085811200,Thu Nov 12 00:21:06 +0000 2015,9,36,"Thomas, a film student, designed this redundant #EDC of tools for handling tasks on set https://t.co/oLyGUCVavB https://t.co/QHoAid3krN"
46,664583087376830464,Wed Nov 11 23:18:50 +0000 2015,0,1,"@seoulfully check out the prometheus beta QR: https://t.co/cQ6Bvw6xci

-bern"
47,664552955597582338,Wed Nov 11 21:19:06 +0000 2015,3,19,"Jon, a photographer in San Diego, shares his minimal #EDC as one of our new contributors https://t.co/42kg61GRpP https://t.co/AvmoTlVH7W"
48,664506130773643265,Wed Nov 11 18:13:02 +0000 2015,1,19,Elan shows off his collection of crowdfunded gear in this #EDC https://t.co/XfFjVNlynW https://t.co/6AmbgpAjLx
49,664233836285292544,Wed Nov 11 00:11:02 +0000 2015,4,20,"Chad is ready for the fall with this simple, beautiful #EDC of brass and leather https://t.co/UxscQNt1Ae https://t.co/53YvfTn7od"
50,664190801044307968,Tue Nov 10 21:20:01 +0000 2015,1,24,This doctor in Hong Kong set up their casual #EDC to have functionality without extra bulk https://t.co/cBP2LEIjoP https://t.co/xPlmBukwu3
51,664142239061250048,Tue Nov 10 18:07:03 +0000 2015,1,15,Matt in Alaska enjoys his weekends off with this #EDC featuring a handcrafted fixed blade https://t.co/Pdd4RvvJ9z https://t.co/5IZBtSiyUx
52,664112308000460800,Tue Nov 10 16:08:07 +0000 2015,2,15,"No pain, all gain: the 1up #EDC tool opens bottles cleanly and comfortably.  https://t.co/k490Nz7ESb #sponsored https://t.co/SBvaF4aaKb"
53,663880773393514496,Tue Nov 10 00:48:05 +0000 2015,8,30,"Thomas, a pottery studio manager, opts for a classy leather, wood, and steel themed #EDC https://t.co/n20pMKJysC https://t.co/79tUrZZR3R"
54,663823901332402176,Mon Nov 09 21:02:05 +0000 2015,2,16,"John shares his new #EDC gear, including a waterproof match case for outdoors use https://t.co/3fGZOcFF9y https://t.co/YZPrQ5JRM0"
55,663780855379136512,Mon Nov 09 18:11:03 +0000 2015,5,26,"This urban #EDC has plenty of great tools, but the titanium bolt action pen is a standout https://t.co/R8qtxOrSRc https://t.co/KPkXGiJyk5"
56,663519125562482690,Mon Nov 09 00:51:01 +0000 2015,6,23,"Justin, a landscaper, keeps a well-rounded, classic #EDC with tons of functionality https://t.co/cLpmhCsSvn https://t.co/fjLlS3hV83"
57,663466548695166976,Sun Nov 08 21:22:06 +0000 2015,5,21,The few items in this webmaster from Florida’s #EDC are tough as nails https://t.co/va8q5QmdwV https://t.co/15p4MX80ht
58,663418719687700481,Sun Nov 08 18:12:03 +0000 2015,5,28,Kevin in Indianapolis mixes traditional #EDC pocket knives with modern tech devices https://t.co/FbENAc3aez https://t.co/BJXmf0az6L
59,663151954164449281,Sun Nov 08 00:32:01 +0000 2015,3,14,"When Drew’s not working at the pharmacy, he keeps this #EDC with a focus on survival https://t.co/GoIW9JulSI https://t.co/5IQB58q5ns"
60,663109192257933312,Sat Nov 07 21:42:06 +0000 2015,4,17,"Bomin, an architect in Boston, keeps her #EDC functional and refined for daily design https://t.co/B51FKRzFBJ https://t.co/KZRLZ15lIz"
61,663055570774003713,Sat Nov 07 18:09:01 +0000 2015,3,27,"This graphic artist is never without their pocket rule, precision pencil, and #EDC tools https://t.co/zebjMbGR2I https://t.co/AQEiIcmHfv"
62,662784295426113536,Sat Nov 07 00:11:04 +0000 2015,5,26,"Andrew’s #EDC is full of his favorite gear, blending budget items and high-end gear https://t.co/n9ROnF0aLG https://t.co/yeSOCgfOS1"
63,662738240961536000,Fri Nov 06 21:08:04 +0000 2015,4,23,Ronald assembled this cool grey #EDC to be both functional and inexpensive: https://t.co/sB1QoQkJAJ https://t.co/SPMxQ5JgcV
64,662721881825406976,Fri Nov 06 20:03:04 +0000 2015,5,24,Pockets feeling empty? Win all the #EDC gear shown here in our newest giveaway! Enter here: https://t.co/ZQLino4DjE https://t.co/k0KqXjSil4
65,662692691445026818,Fri Nov 06 18:07:04 +0000 2015,5,24,"Maciej studies mechanical engineering, and it shows in this functional, playful #EDC https://t.co/ePw8kkJlEm https://t.co/aykwiDMuRl"
66,662633867392786432,Fri Nov 06 14:13:19 +0000 2015,0,0,"@TomBevan yo, it’s the pry/open large SS from OBSTRUCTURES. Cop it here: https://t.co/sYHFpEXL8v

hope that helps!"
67,662421154146074624,Fri Nov 06 00:08:04 +0000 2015,5,24,"Sean’s #EDC features minimalist gear with a green and black theme 
https://t.co/c4GoBEmKtN https://t.co/WEEIGlLCM3"
68,662381753798029312,Thu Nov 05 21:31:31 +0000 2015,2,24,This civil engineering student’s #EDC keeps the tools minimal and the accessories stylish https://t.co/clLKAf3GNF https://t.co/K7tC6nzL0i
69,662329307415490560,Thu Nov 05 18:03:07 +0000 2015,5,19,"James, a fire protection designer, carries this #EDC day in and day out https://t.co/ajrrugUWZK https://t.co/j9NYPiHJuP"
70,662292548547837953,Thu Nov 05 15:37:03 +0000 2015,11,31,These #EDC-minded packing tips will save you a headache this travel season: https://t.co/hc2GhCK049 #sponsored https://t.co/dYGjxASa5O
71,662068578502316032,Thu Nov 05 00:47:04 +0000 2015,4,12,"Marc, a civil engineering draftsman, shares his essentials for drawing and sketching https://t.co/tAr3FzNqhE https://t.co/UrDpirqJmJ"
72,662014733483008000,Wed Nov 04 21:13:06 +0000 2015,6,20,This IT admin keeps their #EDC of quality tools and backups in their pockets and bag https://t.co/UulOAA0pMC https://t.co/6GwdCmblDA
73,661968427330834433,Wed Nov 04 18:09:06 +0000 2015,4,22,Aileen in the Philippines streamlined her #EDC down to just the essentials: https://t.co/YiccHINsI2 https://t.co/jxXEM3zKks
74,661940020153098240,Wed Nov 04 16:16:13 +0000 2015,13,34,Leave your tool box at home and #EDC one of these multitools instead: https://t.co/n3z9oYtEAi #everydaycarry https://t.co/SDhWSMxb8X
75,661697131514740736,Wed Nov 04 00:11:04 +0000 2015,3,25,Greg’s got the right tech essentials in his #EDC for managing digital media in style https://t.co/XTgXn6KXg8 https://t.co/m66f95rV9s
76,661652599465078785,Tue Nov 03 21:14:07 +0000 2015,6,19,Destiny keeps her #EDC organized with her clever use of packing pouches https://t.co/UE7xGgtLyS https://t.co/xpDsWQY5op
77,661611333608062976,Tue Nov 03 18:30:08 +0000 2015,4,21,"Stan brings it back to the basics with this handsome, well-curated #EDC https://t.co/1tfY4cEExv https://t.co/ikM5k0Mlbz"
78,661569827207688192,Tue Nov 03 15:45:12 +0000 2015,9,36,The B102T titanium #EDC tool’s functional curves are sure to catch your eye: https://t.co/D8BQrwWSbx #sponsored https://t.co/YL3Ygr5jF5
79,661340797204357120,Tue Nov 03 00:35:07 +0000 2015,0,0,"@AirWrekWuu Looks like she wrapped one gate to prevent accidental opening, a DIY lock kinda. Imagine pressing in, the cord would stop it"
80,661340283078967299,Tue Nov 03 00:33:05 +0000 2015,9,25,"Zach, an operations manager, keeps this steel blue #EDC on him day and night https://t.co/2qKOXbGElS https://t.co/UHzu4dSdX6"
81,661291726171037696,Mon Nov 02 21:20:08 +0000 2015,2,21,"This #EDC from Lisa, an artist in Canada, has plenty of functionality and character https://t.co/we9mV6kBZi https://t.co/QVQjEKQ7ph"
82,661247930871869440,Mon Nov 02 18:26:06 +0000 2015,3,23,This digital marketer in Singapore travels compact with her all black everything #EDC https://t.co/rk033SLXG3 https://t.co/FSjlNZw7tt
83,661213399037190154,Mon Nov 02 16:08:53 +0000 2015,7,25,These #EDC submissions from last month are definitely worth a second look: https://t.co/goYYugWL4S https://t.co/sfqwvkHyMs
84,660972603784335360,Mon Nov 02 00:12:03 +0000 2015,6,32,"When he’s not at school, Noah keeps his bases covered with this #EDC https://t.co/CLEWI6qEgX https://t.co/7UkER9z01l"
85,660932599972429825,Sun Nov 01 21:33:06 +0000 2015,9,23,Orange accents set off this attorney’s minimal commuter #EDC https://t.co/jjo43GjKk9 https://t.co/axxot1ZNbx
86,660884516186120192,Sun Nov 01 18:22:01 +0000 2015,8,36,This marketing manager’s #EDC isn’t complete without their droid https://t.co/TsdkapVJ5O https://t.co/qw4QnLXSRk
87,660595372125896704,Sat Oct 31 23:13:04 +0000 2015,11,40,"Davison in Brazil’s got a solid, well-rounded black and silver themed #EDC https://t.co/UyVnVV2Muo https://t.co/GDlfmOgfIc"
88,660552337577000961,Sat Oct 31 20:22:04 +0000 2015,5,17,Jarrett in San Francisco gets from the office to the gym to the bar with this #EDC https://t.co/i1ino6VLZE https://t.co/JUDBBakUJP
89,660503643750137856,Sat Oct 31 17:08:34 +0000 2015,2,23,This restaurant owner brings some warmth to their #EDC with copper and leather #essentials https://t.co/McdD8GfNRL https://t.co/k3RVJSwJyG
90,660494361424064513,Sat Oct 31 16:31:41 +0000 2015,4,14,"The practical reason for carrying orange #EDC gear, and 13 picks to get you started: https://t.co/l1DDogOOEs https://t.co/9Rfeu2zKLa"
91,660234240840175616,Fri Oct 30 23:18:04 +0000 2015,4,16,"Roy in Israel keeps his minimal #EDC, down to a handsome chrono, leather wallet, and blade https://t.co/CWM924Qvgv https://t.co/xjsbclr4EU"
92,660189339339526144,Fri Oct 30 20:19:38 +0000 2015,6,17,"This #EDC from Serkan in Turkey includes a titanium coated knife, brass lighter, and more https://t.co/hgJwvF8p7B https://t.co/cDLlckEKeo"
93,660158016860254209,Fri Oct 30 18:15:11 +0000 2015,7,17,You could win #EDC gear that’s #WorthHoldingOnto from our friends @TannerGoods! Enter here: https://t.co/Wuuao8i88Y https://t.co/5e1YEqIMpY
94,660147755294269440,Fri Oct 30 17:34:24 +0000 2015,2,14,"For this maintenance worker and DJ, a pair of headphones is a must-have #EDC https://t.co/5CuIx2vgHj https://t.co/dAv8kFuvVG"
95,659870343780143105,Thu Oct 29 23:12:04 +0000 2015,5,23,This lawyer’s #EDC gives a traditional feel to more modern gear https://t.co/e2nh43awja https://t.co/JAEX6ukfVO
96,659836993661104129,Thu Oct 29 20:59:33 +0000 2015,6,21,"This student’s #EDC packs tools, essentials, and school supplies for studying engineering https://t.co/qjqEDAl7nw https://t.co/3rVm2Y0nv8"
97,659783680878100482,Thu Oct 29 17:27:42 +0000 2015,5,14,Jason in Florida uses this well-rounded #EDC to get from point A to point B https://t.co/PKsRGgQkcI https://t.co/arqSys3dgH
98,659754983697612800,Thu Oct 29 15:33:40 +0000 2015,14,53,The 5 Best Pocket-Friendly Multitools for #EDC https://t.co/QAJDE99WLA #everydaycarry https://t.co/qnvEEJKgEk
99,659508699317211136,Wed Oct 28 23:15:01 +0000 2015,7,22,"Antoine, a front-end developer from Canada, keeps their #EDC super minimal https://t.co/ZKsmlMDFyU https://t.co/aOXeRNR90J"
100,659470702324518912,Wed Oct 28 20:44:02 +0000 2015,6,23,"On their day off, this contractor carries their favorite #EDC items https://t.co/naj9PjO8FK https://t.co/CQ95vmXgkC"
101,659435975051902976,Wed Oct 28 18:26:02 +0000 2015,11,31,"13 Hi-Vis Orange #EDC Essentials (to get in the #Halloween spirit, y’know?) https://t.co/l1DDogOOEs https://t.co/o8u39Fwdzt"
102,659417367542304768,Wed Oct 28 17:12:06 +0000 2015,9,33,"In the city or in nature, this editor keeps their #EDC with them on every excursion https://t.co/Esxx0q48Gb https://t.co/WjhYKE1OYl"
103,659153625340506112,Tue Oct 27 23:44:05 +0000 2015,12,43,CJ’s current #EDC lets him take great photos and videos in a much less bulky rig https://t.co/JfBSEDBpw2 https://t.co/qsHGJgj9Ud
104,659099770829475840,Tue Oct 27 20:10:05 +0000 2015,9,30,This #EDC from Ryan in Texas has tools for making music and working with audio on the go https://t.co/Ci9ZWHBYOB https://t.co/YbTc5fjOIH
105,659058506306224129,Tue Oct 27 17:26:07 +0000 2015,4,17,"Kael, a medical professional, carries plenty of weatherproof gear to #EDC in Portland https://t.co/LZyREdbxPl https://t.co/q6jrkp9V80"
106,658787704998498304,Mon Oct 26 23:30:03 +0000 2015,4,31,"Joshua, a manager in Louisiana, enjoys his weekends with this #EDC on him https://t.co/r3B1pjP0SB https://t.co/TFF4zuM2cL"
107,658738127037575169,Mon Oct 26 20:13:02 +0000 2015,7,33,"Mason’s blacked out #EDC takes it back to basics, including a tricked out keychain https://t.co/hkNeO3fO1P https://t.co/mr2UvwBHtd"
108,658695105176473600,Mon Oct 26 17:22:05 +0000 2015,8,26,"This engineering student’s #EDC keeps their bases covered with simple, quality gear https://t.co/tWvcW1MhqP https://t.co/KQXWEgK4sp"
109,658423304491958272,Sun Oct 25 23:22:03 +0000 2015,4,19,Kalle’s minimal #EDC is just enough for a regular day at the office as a marketing manager https://t.co/SDDGPZTLLB https://t.co/U5ns5BGQ8T
110,658376741908447233,Sun Oct 25 20:17:01 +0000 2015,3,20,"Christian in Canada revamped their #EDC with stylish, understated tools https://t.co/JEk5xthBf5 https://t.co/NmxdC0yKDa"
111,658330187092783104,Sun Oct 25 17:12:02 +0000 2015,10,31,This insurance broker’s classy #EDC features timeless materials like leather and brass https://t.co/qIKkeb1GIy https://t.co/5AMA5BqNH1
112,658057636307275781,Sat Oct 24 23:09:01 +0000 2015,5,37,Levi’s got a great outdoors #EDC setup for work as an environmental field tech https://t.co/LXZ7RO4MXQ https://t.co/xemnVc2tIX
113,658015634723201025,Sat Oct 24 20:22:07 +0000 2015,12,36,This draftsman keeps their #EDC plain and simple with a focus on quality materials https://t.co/jqqBFUZsN6 https://t.co/PkRKRjYKXv
114,657966559864815616,Sat Oct 24 17:07:06 +0000 2015,8,25,John updates his #EDC with shiny new gear like a carbon fiber multitool and titanium pen https://t.co/6GieCsCfDu https://t.co/C5YazquVaq
115,657696014954983424,Fri Oct 23 23:12:04 +0000 2015,1,38,"Inspired by his current book, Alex assembled this nautical themed #EDC https://t.co/C2o0huZ7ZG https://t.co/zbPrNS6b3T"
116,657657270155677696,Fri Oct 23 20:38:06 +0000 2015,8,21,"Sean, a CNC programmer, pockets a few prototype tools he developed to test in his #EDC https://t.co/u6dZMRKRuO https://t.co/Chtokwv71s"
117,657636397495377921,Fri Oct 23 19:15:10 +0000 2015,4,13,Gear up and go far with the #EDC essentials in our newest giveaway! Enter to win here: https://t.co/iMDGwXNRfr https://t.co/7v7AIXM5aT
118,657604157876998144,Fri Oct 23 17:07:03 +0000 2015,7,30,"Ed in Utah keeps an expansive #EDC of blacked out, overbuilt gear https://t.co/wVKFtxLh7l https://t.co/HaVUmi9L2e"
119,657333893595426816,Thu Oct 22 23:13:07 +0000 2015,3,24,This sys admin in Manila covers their bases well with this urban office #EDC https://t.co/yaPpwd9iav https://t.co/MT9MMDviX9
120,657290849303134208,Thu Oct 22 20:22:05 +0000 2015,5,14,Trey’s minimal #EDC features a clever way to carry keys and a great value dive watch https://t.co/9lmgzN8uvY https://t.co/c9SsLAbGih
121,657240505399377920,Thu Oct 22 17:02:02 +0000 2015,2,13,Denis’s #EDC multitool has just the right features for his work as a computer technician https://t.co/s4pQhxAHJ2 https://t.co/H0zdAwI26e
122,657195590577688576,Thu Oct 22 14:03:33 +0000 2015,0,0,"@KippesRuns hmm, LunchBots are stainless steel, might be the robust bento box youre looking for?"
123,656978291379712000,Wed Oct 21 23:40:05 +0000 2015,4,14,Erich’s minimal #EDC has a custom toothpick holder in it https://t.co/ndFjqoSfQq https://t.co/Ty6teyP3Vu
124,656927948755222528,Wed Oct 21 20:20:02 +0000 2015,7,37,Jennelle shares her carefully considered #EDC for traveling in Korea and the Philippines https://t.co/DV0TWrgEp6 https://t.co/KQRYx58oeH
125,656885688042844160,Wed Oct 21 17:32:07 +0000 2015,5,22,"John, a machinist, sticks to these no-frills #EDC tools at the shop https://t.co/X63RrVMdu1 https://t.co/GBbUQY7mdW"
126,656610611699167233,Tue Oct 20 23:19:03 +0000 2015,10,34,"Ed, a software engineer in London, stays organized with #EDC pouches https://t.co/Uzw3tEe5pi https://t.co/Eh24MCS1Rz"
127,656567085561049088,Tue Oct 20 20:26:06 +0000 2015,4,24,This photographer in Texas shares their tactical gent’s #EDC https://t.co/tNPw9y3gZI https://t.co/jFou0wLr4M
128,656529550814220288,Tue Oct 20 17:56:57 +0000 2015,0,0,"@MillerTime393 You might find an organizer pouch handy? Like from Maxpedition, for example"
129,656529427623358464,Tue Oct 20 17:56:27 +0000 2015,0,0,@EdcDaylyPhoto It’s a Kershaw Blur!
130,656521538091352064,Tue Oct 20 17:25:06 +0000 2015,2,22,Diamantino in the UK shares his #EDC supplies for work as a chemotherapy nurse https://t.co/mxDa7T9n9L https://t.co/FoUPGY7qGD
131,656251743450173440,Mon Oct 19 23:33:02 +0000 2015,1,9,"Andrew, a college student, shares his first #EDC for work in sales. How’d he do? https://t.co/kCol8SZFKu https://t.co/Kaa0qZOWMZ"
132,656200158040854528,Mon Oct 19 20:08:03 +0000 2015,5,28,"Thomas, a designer, packs this #EDC in his bag for traveling in Asia https://t.co/s0hzfUt3Cb https://t.co/h1TUxlDofh"
133,656158126136123392,Mon Oct 19 17:21:02 +0000 2015,3,23,This #EDC is all Steve needs to get work done as an electrician http://t.co/R91tZS33RY http://t.co/WzRWombNqe
134,655519421734096896,Sat Oct 17 23:03:03 +0000 2015,3,23,"When he’s not operating heavy machinery, Elden pockets this #EDC of high-end tools http://t.co/iIJyMsljsJ http://t.co/XhG5XowYur"
135,655478159270240258,Sat Oct 17 20:19:06 +0000 2015,5,23,This grad student in DC keeps a collapsible water bottle and wood notebook in their #EDC http://t.co/DyXMM591aa http://t.co/qmU2mXgu8k
136,655432088351477760,Sat Oct 17 17:16:01 +0000 2015,8,24,This restaurant owner’s #EDC combines timeless designs with exotic materials http://t.co/laoqZ4s5db http://t.co/8XxZnrjynD
137,655161811805667328,Fri Oct 16 23:22:02 +0000 2015,4,21,M. Hunke’s first attempt at a pocket-only #EDC uses lanyards for easy retrieval http://t.co/PAenT66ZeE http://t.co/pSByAxpH4I
138,655118542266757121,Fri Oct 16 20:30:06 +0000 2015,2,13,"Joseph, a natural resources student, takes this #EDC with him when he’s birdwatching 🐦👀 http://t.co/w6412G51ro http://t.co/35MYQU9sBD"
