,id_str,created_at,retweet_count,favorite_count,text
160,606631706804781056,Fri Jun 05 01:20:44 +0000 2015,0,0,STEM Curriculum Resources by Dr. Wesley Fryer | @scoopit via @kbonanno http://t.co/zpRObbf4TE
161,606631540764868608,Fri Jun 05 01:20:04 +0000 2015,0,0,25 STEM Education Apps You Need in 2015 | @scoopit via @kbonanno http://t.co/Z10pPeZPoa
162,606631438784598017,Fri Jun 05 01:19:40 +0000 2015,0,0,Back to School with STEM {5 Great Curriculum Resources} - Inspiration Laboratories | @scoopit via @kbonanno http://t.co/4ozmGb6eAO
163,606625081675022336,Fri Jun 05 00:54:24 +0000 2015,0,0,Zoo teach for educators share quality lesson plans/resources that complement the Zooniverse citizen science projects:http://t.co/uugHUt4nNZ
164,606623435481964547,Fri Jun 05 00:47:52 +0000 2015,0,0,"Meet authors Graeme Base and Gary Crew at the National Convention Centre, Sat. 4/07/15 @12:00 – 1:00 pm; author talks and book signings!"
165,606605048999759872,Thu Jun 04 23:34:48 +0000 2015,0,0,"World Environment Day,with Italian chef, Carlo Cracco's focus the impact of climate change on traditional foods: http://t.co/kVfwdsOPtW"
166,606599302002057218,Thu Jun 04 23:11:58 +0000 2015,0,0,Some Differences Between Friends and Best Friends http://t.co/u22eLpkdjZ
167,606589530263556096,Thu Jun 04 22:33:08 +0000 2015,0,0,Bad to the Bone: The Worst Children in Literature: http://t.co/Tx8BgdHobl
168,606013665632907264,Wed Jun 03 08:24:51 +0000 2015,0,0,June at the NLA is focused on revealing the Rothschild Prayer Book c. 1505–1510 from the Kerry Stokes Collection#CGSLibrary
169,605154319055192065,Sun May 31 23:30:07 +0000 2015,4,0,"RT @text_publishing: Yes, you really can read anywhere http://t.co/U7bxn1UEya #fridayfrivolity http://t.co/OyGcHMEsd8"
170,605154236385484800,Sun May 31 23:29:47 +0000 2015,17,0,RT @text_publishing: Who writes novels? by @tomgauld http://t.co/oGNfV4E1r3 #fridayfrivolity http://t.co/vCUr4fC2bW
171,605154176666968064,Sun May 31 23:29:33 +0000 2015,3,0,"RT @abcconvos: New #podcast: Linda Jaivin's #China, ancient &amp; modern; incl. her recollection of events at Tiananmen Sq. http://t.co/pf2gSpO…"
172,604165569311465472,Fri May 29 06:01:11 +0000 2015,0,0,Youtube of ABC Miniseries of Kate Grenville's; Secret River begins Sunday June 14th:https://t.co/q6kyKdFs5c
173,603814280077664257,Thu May 28 06:45:17 +0000 2015,0,0,Whichbook
174,603756408602009600,Thu May 28 02:55:19 +0000 2015,0,0,Hannah Fry: The Mathematics of Love by Prezi Team on Prezi https://t.co/l3Am9ukJZX
175,603752685247004672,Thu May 28 02:40:32 +0000 2015,1,1,Whichbook is a new way of choosing what book to read next. Use the sliders to express your  reading preferences: http://t.co/p5OWl4VBYC
176,603708552490971136,Wed May 27 23:45:09 +0000 2015,0,0,Google makes us all dumber: The neuroscience of search engines http://t.co/cwjtDK7f2B via @scoopit
177,603401218275188738,Wed May 27 03:23:55 +0000 2015,0,0,Barnum the musical under the circus tent was spectacular. Congratulations to the CGS and CGGS student cast! http://t.co/qpOrOd07lF
178,603394985531060224,Wed May 27 02:59:09 +0000 2015,0,0,"CGS Library decorating its space for National Reconciliation Week, 27 May-3rd June http://t.co/Ap1LZ6pCfn"
179,603391370146029568,Wed May 27 02:44:47 +0000 2015,25,0,RT @PenguinTeachers: We think @neilhimself said it best when he said... #LIW15 http://t.co/lF9P7lm7eX
180,603391284691247104,Wed May 27 02:44:27 +0000 2015,63,0,"RT @ABCSplash: It's Library and Information Week, so here are 7 great reasons to visit a library: http://t.co/oLS9IbmpT6 #LIW2015 http://t.…"
181,603391181888692225,Wed May 27 02:44:02 +0000 2015,0,0,Dashiell Hammett was born on this day in 1894. One enduring character he created is Sam Spade (The Maltese Falcon)via @lovereadinguk
182,603370404611162112,Wed May 27 01:21:29 +0000 2015,0,0,Children’s book council of Australia have published the Book of the Year Awards Short List 2015:http://t.co/lOr8HxqTtK
183,603368958666739714,Wed May 27 01:15:44 +0000 2015,0,0,An entire life told through one artwork:Sir Henry Unton is the NPG's weekly focus: http://t.co/tyLPmptn0h  http://t.co/rSLPKFUALM
184,603363040226975744,Wed May 27 00:52:13 +0000 2015,0,0,What’s new in our Questia online database? Ans: a research tool extension: http://t.co/4i2IG5CsWf
185,603362470808268802,Wed May 27 00:49:57 +0000 2015,8,0,"RT @ALIANational: National Simultaneous Storytime is TODAY at 11am. Over 500,000 participants will read The Brothers Quibble by Aaron Blabe…"
186,603351313422749696,Wed May 27 00:05:37 +0000 2015,0,0,Love Reading geo-locates books being read based on geographic settings:http://t.co/3EVxwUw8i5
187,602974812093304832,Mon May 25 23:09:32 +0000 2015,0,0,"Ramayana New Delhi miniatures exhibition on at the NGA. Epic tales of of love, loyalty, betrayal and good over evil:http://t.co/eckaFiJXrA"
188,601618847733387266,Fri May 22 05:21:25 +0000 2015,4,0,"RT @ForrestHotel: Revealing the Rothschild Prayer Book.  c 1505-1510 
Kerry Stokes Collection.
22 May -9 Aug @nlagovau http://t.co/6JWaQYEe…"
189,601615318327296001,Fri May 22 05:07:24 +0000 2015,6,0,RT @nlagovau: 'Tea and Sugar Christmas' wins @ABIA_Awards Small Publishers' Chn's Book of the Year—Congrats NLA Publishing http://t.co/OXmz…
190,601614787164774400,Fri May 22 05:05:17 +0000 2015,0,0,2015-Sydney-writers-festival - ABC Radio National (Australian Broadcasting Corporation) http://t.co/zhC4n4LUb6
191,601568759250223104,Fri May 22 02:02:23 +0000 2015,9,0,"RT @ShiftParadigm: #799 There are no extra pieces in the universe... Deepak Chopra

#whatisschool http://t.co/RjyGeXwn2v"
192,601568297306300417,Fri May 22 02:00:33 +0000 2015,3,0,RT @21cli: 150+ participants in #whatisschool chat with @burgessdave @mrkempnz so busy couldn't keep up! http://t.co/g2lwy30f74
193,601567611499884544,Fri May 22 01:57:49 +0000 2015,0,0,Edgar Allen Poe master of mystery! https://t.co/JLTVSquLIH
194,601545689256960000,Fri May 22 00:30:43 +0000 2015,0,0,'The Empire Strikes Back' came out 35 years ago today  --  watch the original trailer (via @BusInsiderAU) http://t.co/7nwWsLA5OM
195,601545114129838080,Fri May 22 00:28:26 +0000 2015,0,0,VIVID SYDNEY SNEAK PEEK PHOTOS: The amazing water and light sculpture in Darling Harbour (via @BusInsiderAU) http://t.co/mhEBZhD8tF
196,600470583273390080,Tue May 19 01:18:37 +0000 2015,37,0,"RT @ChrisSullivanNZ: The stages of learning: surface to deep, deep to transfer. Combining the will, the skill and thrill of learning http:/…"
197,600106909262159873,Mon May 18 01:13:31 +0000 2015,0,0,Library of the future: technologies we would love to see http://t.co/Ltc8NzdP4A
198,600104520065003521,Mon May 18 01:04:01 +0000 2015,8,0,"RT @schoolscatinfo: ""All that is necessary for a student is access to a library"" - Thomas Jefferson"
