,id_str,created_at,retweet_count,favorite_count,text
0,668969978045960192,Tue Nov 24 01:50:46 +0000 2015,0,0,Proven health benefits of 10 mins. walking per day:https://t.co/ocCLkYncmg
1,668638746795884544,Mon Nov 23 03:54:34 +0000 2015,3,0,RT @lichuckik: Using Twitter in the Classroom https://t.co/v8qx8fK8TU via HstryOrg #CaneClassroom
2,668638106568949760,Mon Nov 23 03:52:01 +0000 2015,0,0,Splash and Bell Shakespeare bring Shakespeare's most famous scenes to life set in the modern day:https://t.co/rO5Re3WBot
3,667124937396629504,Wed Nov 18 23:39:14 +0000 2015,0,0,Visit ABC Splash's teacher resources classified by curriculum and grade level:https://t.co/tnmd9BlzHB
4,666775618420387840,Wed Nov 18 00:31:10 +0000 2015,0,0,Details | Asia Education Foundation | @scoopit https://t.co/9AuuIZMRJD
5,666774494153973760,Wed Nov 18 00:26:42 +0000 2015,0,0,"Vietnamese Water Puppet Show in Ho Chi Minh City (Saigon), Vietnam | @scoopit https://t.co/cWXIbop03X"
6,666774429054185474,Wed Nov 18 00:26:26 +0000 2015,0,0,BBC NEWS | Asia-Pacific | Vietnam's water puppets make social waves | @scoopit https://t.co/uvmkPh6OGj
7,666773962672775170,Wed Nov 18 00:24:35 +0000 2015,0,0,Flooding in Asia's Megacities | In Asia | @scoopit https://t.co/FfqqvWUOQV
8,666773786591629312,Wed Nov 18 00:23:53 +0000 2015,0,0,PM - New documentary on Afghan camel drivers in Australia 12/04/2013 | @scoopit https://t.co/MjgmvXcgig
9,666773722834067457,Wed Nov 18 00:23:38 +0000 2015,0,0,"Origins: History of immigration from Afghanistan - Immigration Museum, Melbourne Australia | @scoopit https://t.co/w9QDmrSjwD"
10,666773581800546304,Wed Nov 18 00:23:04 +0000 2015,0,0,Culture Victoria - Burke and Wills: Have Camels Will Travel - FUSE - Department of Education &amp; Trai... | @scoopit https://t.co/6niqOUbbKx
11,666729613935034368,Tue Nov 17 21:28:21 +0000 2015,0,0,"Microsoft, https://t.co/uCQsXRZ6b7 Will Use Minecraft to Teach Kids Programming https://t.co/aFkrmdbTXo via @business"
12,666727578950987777,Tue Nov 17 21:20:16 +0000 2015,0,0,5 important tips for educators on editing video and Youtube clips:https://t.co/vOUmK7Psr3
13,666118823590961152,Mon Nov 16 05:01:18 +0000 2015,10,0,RT @aitsl: Learn more about your leadership. Use the 360 Reflection Tool to dive into you practice. https://t.co/Th4acymi3Z https://t.co/Nd…
14,666118759829008385,Mon Nov 16 05:01:02 +0000 2015,0,0,aitsl's Mathematics and Science: a national snapshot of inspirational teaching: https://t.co/om3np0BjOg
15,665047328483471360,Fri Nov 13 06:03:33 +0000 2015,0,1,Academy of Interactive Entertainment Open Day 21st November:https://t.co/fd8e1APPBb
16,664927335510970368,Thu Nov 12 22:06:45 +0000 2015,0,0,Graeme Base on children's picture books in the digital age on RN Afternoons:https://t.co/Y9qCwkKxUs
17,664916508452061184,Thu Nov 12 21:23:43 +0000 2015,2,0,RT @CGSHead: Latest sculpture addition to the grounds @CanberraGrammar. Made of Yr 7 Art pieces by CGS Art teacher Trevor Dunbar https://t.…
18,664914725617012736,Thu Nov 12 21:16:38 +0000 2015,0,0,Well done Mr Dunbar. We love the way it invites a visitor to enjoy the creativity at our school. @CGSHead @CanberraGrammar
19,664600071485464579,Thu Nov 12 00:26:19 +0000 2015,0,0,"Diwali - Wikipedia, the free encyclopedia | @scoopit https://t.co/FFXzbQTiap"
20,664591511049379841,Wed Nov 11 23:52:18 +0000 2015,0,0,Is this the world's wildest library? Geelong's $45 million 'big brain' about to open up to the world https://t.co/6I0SMuraRn via @smh
21,664261784388374528,Wed Nov 11 02:02:05 +0000 2015,0,0,Details | Asia Education Foundation | @scoopit https://t.co/tQTlMgVVWr
22,664203244919373824,Tue Nov 10 22:09:28 +0000 2015,0,0,Top 5 resources to commemorate Rememberance Day: https://t.co/gabGlHpSA3
23,664202231076380672,Tue Nov 10 22:05:26 +0000 2015,0,0,CGS Library commemorating Remembrance Day https://t.co/1tlSYG9nM2
24,664201063562547200,Tue Nov 10 22:00:48 +0000 2015,0,0,Offline Navigation Comes To Google Maps https://t.co/Dt2ru41SQZ via @techcrunch
25,664198761124487168,Tue Nov 10 21:51:39 +0000 2015,0,1,Chrome is making a big impact in ACT schools https://t.co/LvXjAn8T94
26,663872234990100480,Tue Nov 10 00:14:09 +0000 2015,0,0,Book launch @Paperchain of 'Manuka_History and People:1914-2014 by Nick Swain and Meryl Hunter': Thursday November 19@ 5.45
27,663617336084008960,Mon Nov 09 07:21:16 +0000 2015,0,1,"Collection of inspirational 60's library posters, discovered by Flickr user Enokson:https://t.co/tUAN7WxL1r"
28,662391053375270912,Thu Nov 05 22:08:28 +0000 2015,30,0,"RT @LEAD_Coalition: This day and every day, remember the beauty in each person living with #dementia. #Alzheimers #EndAlz #EndStigma https:…"
29,662159804547207168,Thu Nov 05 06:49:34 +0000 2015,11,0,RT @leighsales: My guest tonight is the Treasurer Scott Morrison #abc730
30,662152710335041536,Thu Nov 05 06:21:23 +0000 2015,0,0,"For National Recycling Week this year, Planet Ark tests your recycling knowledge with the 2015 Recycle Right Quiz:https://t.co/XTiqfN8Sjy!"
31,662136212908412929,Thu Nov 05 05:15:49 +0000 2015,26,0,RT @britishlibrary: Gain insights into West Africa's fascinating heritage through articles by leading experts. #BLwestafrica https://t.co/E…
32,661665250681294848,Tue Nov 03 22:04:23 +0000 2015,0,30,10 essestial skills students will need to succeed in their future workplace? https://t.co/ltPY69gT1W via @visually #Visually #infographic
33,661308027052519424,Mon Nov 02 22:24:54 +0000 2015,0,0,Experience the work of legendary Australian artist Tom Roberts. Opening 4 December at the NGA.
34,661307646822125570,Mon Nov 02 22:23:24 +0000 2015,0,0,Awesome Stories that occurred in the month of November: https://t.co/LTzBnl8teE
35,661300285600493568,Mon Nov 02 21:54:09 +0000 2015,0,0,World's longest continental volcanic chain found in Australia https://t.co/gC6OVAQp5J via @ABCNews
36,660929857270902784,Sun Nov 01 21:22:12 +0000 2015,0,0,Solar power race across Australia:https://t.co/91wi5uv3qC
37,659637177807060993,Thu Oct 29 07:45:33 +0000 2015,0,1,51 Of The Most Beautiful Sentences In Literature https://t.co/3UUenpStJg via @jmschaff @buzzfeed
38,659258904207953920,Wed Oct 28 06:42:25 +0000 2015,0,0,"Urban Foraging Walk is on in Canbera on November 21st, 2015:https://t.co/n7qafJn1eh"
39,659188285235855360,Wed Oct 28 02:01:48 +0000 2015,0,0,Science resources on many topics:https://t.co/GjK1dIIwGW
40,658880472261357569,Tue Oct 27 05:38:40 +0000 2015,0,0,"Let’s Write! Resources for Young people who are reading and writing more than ever,using computers / mobile  phones: https://t.co/cdHeEfllDI"
41,658795808238628864,Tue Oct 27 00:02:15 +0000 2015,1,0,"RT @CentreYouthLit: Read (UK): Nielsen Book releases its 2015 Understanding the
Children’s &amp; YA Book Consumer report: 
https://t.co/uOltVj1…"
42,658795704165371904,Tue Oct 27 00:01:50 +0000 2015,7,0,RT @ABCscience: Musicians' brain waves dance to the beat https://t.co/mRhL95RNpj
43,658795539216146432,Tue Oct 27 00:01:11 +0000 2015,0,0,10 things classroom teachers need to know about  modern school librarians:https://t.co/k04AAbGd8p
44,658529131773059072,Mon Oct 26 06:22:34 +0000 2015,10,0,RT @theage: Office politics: which Australian PM had the best #interiordesign taste?  https://t.co/fsK12VP3tS #auspol https://t.co/cCsb6cDy…
45,658419294242365441,Sun Oct 25 23:06:07 +0000 2015,0,0,Your 7-step research paper checklist so you meet the grading criteria https://t.co/4pYJEL0SIN
46,658415617490333697,Sun Oct 25 22:51:30 +0000 2015,0,0,CGS community are contributing family and friends' names to our  'Poppies for Remembrance Day'  library display. https://t.co/hmHonxgzMS
47,658413811561447424,Sun Oct 25 22:44:20 +0000 2015,0,0,"Why digital natives prefer reading in print. Yes, you read that right. https://t.co/LCZ1ZNLMbU"
48,658409431378472960,Sun Oct 25 22:26:55 +0000 2015,0,0,"Maximize Learning, Not Technology: https://t.co/tXiFI7AH9n via @ReadByExample"
49,657431025249710080,Fri Oct 23 05:39:05 +0000 2015,0,0,"Science,Technology,Engineering and Mathematics (STEM) video resources have been created /shared on ABC Splash’s site:https://t.co/0pJmZXXf8e"
50,657334729939681280,Thu Oct 22 23:16:26 +0000 2015,0,0,FlippedClassrooms promise deeper learning as long as #HigherEd has a handle on tech https://t.co/qKPDmbSvun via @EdTech_HigherEd
51,657016720670879744,Thu Oct 22 02:12:47 +0000 2015,0,0,"Xavier Herbert free seminar examines his novels: Friday 20 /11, 9.30 am–4 pm NLA Theatre.  Bookings: 02 6262 1271 (Mon–Fri, 9 am–12 pm)"
52,656286038386540544,Tue Oct 20 01:49:19 +0000 2015,0,0,Truck crashes in Parkes Way tunnel destroying roof and access to this potential way home today!: https://t.co/xGXMdqCqv2
53,656247234988670976,Mon Oct 19 23:15:07 +0000 2015,0,0,"Literacy has always been defined by technology. Pre-printing press, one's ability to  recite  defined literacy: https://t.co/CAVJj38vqK.” –"
54,656246385407234048,Mon Oct 19 23:11:45 +0000 2015,0,0,"Teacher Librarian Day will be celebrated on Monday, October 19th. This  online event is sponsored by CISSL: https://t.co/oo0D8ZyO12"
55,655861133417410560,Sun Oct 18 21:40:54 +0000 2015,0,1,Gray Matters: Too Much Screen Time Damages the Brain http://t.co/dBPPuBkifH via @scoopit
56,654835208303153152,Fri Oct 16 01:44:14 +0000 2015,0,0,How our bodies repair DNA:https://t.co/L5vugJnldC
57,654834060414488576,Fri Oct 16 01:39:40 +0000 2015,0,0,Putting Australian fungi on the map:http://t.co/b8YC8MMdCm
58,654528926304202753,Thu Oct 15 05:27:11 +0000 2015,8,0,"RT @schoolscatinfo: Here's a great opportunity to nominate and recognise #GreatSchoolLibraries across Australia. Pls share!
https://t.co/J4…"
59,654522794273730560,Thu Oct 15 05:02:49 +0000 2015,0,0,Why Libraries remain essential to our schools:http://t.co/XES2Te5Mc2
60,654185343076294656,Wed Oct 14 06:41:54 +0000 2015,4,0,"RT @kiamalibrary: Stella Maria Sarah Miles Franklin aka Miles Franklin born today in 1879. Best known for novel ""My Brilliant Career"" http:…"
61,654183709541732352,Wed Oct 14 06:35:25 +0000 2015,1,0,RT @heyjudeonline: Here we go at  #aisitic15 learning about Flubaroo. Learning analytics in the classroom ##inf537 http://t.co/wMVH5oJLX3
62,654152136746401793,Wed Oct 14 04:29:57 +0000 2015,0,0,The Front Gallery exhibition Back to The Front Againfrom October 15 to November 1 2015:http://t.co/Wi0PILENbO
63,654043287049732096,Tue Oct 13 21:17:25 +0000 2015,0,0,Breakfast | Nutrition Australia http://t.co/NvZhLMEgtW
64,654042822081810432,Tue Oct 13 21:15:34 +0000 2015,4,0,RT @ABCSplash: What's the deal with #carbon and how does it affect #climate? Excellent lil video explains: http://t.co/QAb2l0sfU0 http://t.…
65,653785740212441088,Tue Oct 13 04:14:01 +0000 2015,47,0,RT @abcnews: #ICYMI: A New Zealand fur seal is still squatting on the #OperaHouse stairs one year on http://t.co/Xyb0vdyd8Z http://t.co/hpm…
66,653785296463491073,Tue Oct 13 04:12:16 +0000 2015,13,0,RT @ANMMuseum: Calling all artists! Submit your proposal to create a new public artwork about submarine #AE2 http://t.co/fWxtooKF7x http://…
67,652239876910268416,Thu Oct 08 21:51:19 +0000 2015,0,0,2015 top 100 tools for learning  : http://t.co/V3iX8gbzLY
68,646471108594544640,Tue Sep 22 23:48:17 +0000 2015,1,2,ABC Splash's interviews with 10 Australian authors:http://t.co/J0XxfRsjLp
69,646470347944947713,Tue Sep 22 23:45:16 +0000 2015,0,0,20 research apps for iPads:http://t.co/Bm18FBpWe0
70,644743367708938240,Fri Sep 18 05:22:52 +0000 2015,0,0,Capital Magazine has been digitised to Daily Capital. View events and news from period from: 26/09/2015-6/09/2015:http://t.co/L6MhjGUcxI
71,644042895398338560,Wed Sep 16 06:59:26 +0000 2015,0,0,2015 Australian of the Year - Rosie Battey speaks of her memoir: A Mother’s Story - at the NLA on 25th September: http://t.co/4MLdDQuPgw
72,643301751349612544,Mon Sep 14 05:54:24 +0000 2015,2,1,"ABC Splash lets you chat LIVE with author Sally Rippin, on Thursday 17 September at 2pm:http://t.co/v1RQaSGC5r"
73,643239488471216128,Mon Sep 14 01:46:59 +0000 2015,0,0,Australian Teachers of Media (ATOM) announces the finalists for the 2015 ATOM Awards: http://t.co/CYaW6Z5q7A
74,643213321986949120,Mon Sep 14 00:03:00 +0000 2015,0,0,Importance of Arts and Music to children’s development and to the classroom learning environment:http://t.co/1SMGMn7qUc
75,642225704755597312,Fri Sep 11 06:38:34 +0000 2015,0,0,Shoalhaven Library Staff Rhapsody videot:http://t.co/DDdtHLH8wO
76,642109443920953346,Thu Sep 10 22:56:35 +0000 2015,0,1,Special Event: Speculative fiction event:The Cabinet of Oddities http://t.co/byx0RtQK75
77,641487040752693249,Wed Sep 09 05:43:23 +0000 2015,0,0,Check out the latest new #IB resources: http://t.co/SPCeAmaKZd
78,641486230740275201,Wed Sep 09 05:40:10 +0000 2015,0,0,Announcing Global Collaboration Day! Join the activities online on September 17th! http://t.co/Mw9CE3T6OB
79,641149398047551488,Tue Sep 08 07:21:43 +0000 2015,0,0,RUOK? Day and World Suicide Prevention Day are the focus for Thursday 10 Sept:  https://t.co/RW1hmA3AK8 and  http://t.co/iNzhk8Oi4t
80,641122152008122368,Tue Sep 08 05:33:27 +0000 2015,0,0,10 critical thinking exerrcises for students: http://t.co/hiU7CJXKPI
81,637055946175332352,Fri Aug 28 00:15:48 +0000 2015,0,0,the power of hashtags:http://t.co/L4uFuzq52Q
82,636337525175545856,Wed Aug 26 00:41:03 +0000 2015,0,0,"Google has added new features to Google Classroom, for creating, sharing and grading assignments. All set to roll out in coming weeks"
83,635974534554750976,Tue Aug 25 00:38:39 +0000 2015,0,0,"TES 4 evenings of interviews, on Google Hangouts on Air (recorded on YouTube) start tonight:https://t.co/lUXdbVNfiS"
84,635964460079804416,Mon Aug 24 23:58:37 +0000 2015,0,0,Tech companies suffering as stocks  around the world plummet following concerns over China:http://t.co/lYJYGwmIN7
85,635949845879123969,Mon Aug 24 23:00:33 +0000 2015,0,0,Tropfest Junior is now open: http://t.co/kFpmOhB1HU
86,635631738299899904,Mon Aug 24 01:56:30 +0000 2015,0,0,Teach Digital Citizenship resources:http://t.co/CRn2UXhnHv
87,635624113323638784,Mon Aug 24 01:26:12 +0000 2015,0,0,Returned like a book comic: http://t.co/Vj2qii14LU via @unshelfeed
88,635623519586418690,Mon Aug 24 01:23:51 +0000 2015,0,0,Digital health SkinVision using smartphone tech and vision algorithms to allow one to track changes to their moles:http://t.co/dY1MD0VElZ
89,634616760474308608,Fri Aug 21 06:43:20 +0000 2015,0,0,BBC News - Ebola vaccine is 'potential game-changer' http://t.co/OS98YfxXuU
90,634537706043895808,Fri Aug 21 01:29:12 +0000 2015,0,0,Tom Roberts exhibition opens at the NGA on 4th December: http://t.co/n3s3cxoChU
91,634532202718621696,Fri Aug 21 01:07:20 +0000 2015,0,0,TOUCH this image: 20 Ways to Transform Learning with Technology! https://t.co/3355NWN0mR
92,633885005593243648,Wed Aug 19 06:15:37 +0000 2015,0,0,New online shop which specialises in books and quirky stationery and gifts for which Electric Shadows was renowned:http://t.co/tuM2WFZDeb
93,633184194466721792,Mon Aug 17 07:50:50 +0000 2015,0,0,Creative Destruction in Teaching (and the Ongoing Relevance of Teachers) | Edutopia http://t.co/E2aIG2ohsO
94,633085643107635201,Mon Aug 17 01:19:14 +0000 2015,1,2,Interested 18-30 yrs.  in Leadership/Cross-Cultural Awareness. Ship for World Youth Leaders is fully-funded 6 week: http://t.co/8Qes1LUAJh
95,633083418297810944,Mon Aug 17 01:10:23 +0000 2015,0,0,2015 Horizon report outlines technological developments likely to upon K-12 education over the next 5 years:  http://t.co/qJxa12I911
96,633072846210756608,Mon Aug 17 00:28:23 +0000 2015,0,0,The Promise Of 5G http://t.co/yAvVfOk2sU via @techcrunch
97,633066648698642432,Mon Aug 17 00:03:45 +0000 2015,0,0,"Chris Williams in conversation with Andrew Ford on Radio National’s Music Show: Saturday, 15 August, from 11am: http://t.co/9jOpTu0sYI"
98,633059911442673664,Sun Aug 16 23:36:59 +0000 2015,153,0,RT @khanacademy: What could the school of tomorrow look like? See Sal Khan discuss the future of education on @BloombergTV. | http://t.co/e…
99,631279275597938688,Wed Aug 12 01:41:22 +0000 2015,0,0,Guide: Using the SAMR Model to Guide Learning: http://t.co/Tdt251MEXc via @ThatEdTechGuy
100,631252216280678400,Tue Aug 11 23:53:51 +0000 2015,0,1,How Will Technology Transform Digital Learning In The Next Decades? - eLearning Industry http://t.co/o1x7TH0UC8 via @elearnindustry
101,630963318828613632,Tue Aug 11 04:45:52 +0000 2015,0,0,Google Hangout for National Science Week  http://t.co/S8rLPJf4ql
102,630527868586438656,Sun Aug 09 23:55:33 +0000 2015,0,0,Teach Writing with Digital Tools by @ShellTerrell #educationtechnology #mooc http://t.co/WBIIkqLzF2 via @SlideShare
103,630525232722214912,Sun Aug 09 23:45:04 +0000 2015,0,0,"Creative Arts Fellowship Lecture by composer Chris Williams at the NLA: Tuesday 18 August, 6 pm"
104,629473018381627393,Fri Aug 07 02:03:57 +0000 2015,0,0,Steve Hargadon: Save the Dates - Teacher Entrepreneurship Week Int... http://t.co/z9qUbyh9tk
105,629191870053101568,Thu Aug 06 07:26:46 +0000 2015,0,0,There are some interesting social media competitions running through the Australian Booksellers Association: http://t.co/dweS6gITax
106,628716071747485697,Tue Aug 04 23:56:07 +0000 2015,8,0,"RT @schoolscatinfo: Science week is coming soon, and @ABCSplash has some fantastic *free* resources for use. Enjoy. http://t.co/RpA7guwjot"
107,628439896261144577,Tue Aug 04 05:38:41 +0000 2015,0,0,Personal Learning Network | Edutopia http://t.co/eqe0vGDpmv
108,628434593993986048,Tue Aug 04 05:17:37 +0000 2015,0,0,Best Education Podcasts | Edutopia http://t.co/i77lcSL1zT
109,628434362841694208,Tue Aug 04 05:16:42 +0000 2015,0,0,"21st-Century PD: Retention, Reflection, and Redistribution of Knowledge | Edutopia http://t.co/ogVstEiVyB"
110,628432159158566912,Tue Aug 04 05:07:57 +0000 2015,0,0,5 easy ways to curate content for your blog:http://t.co/HmSg0dHsja
111,628071867232813056,Mon Aug 03 05:16:16 +0000 2015,0,0,Smart Copying have a quick guide to Creative Commons: http://t.co/jk5sRZxt81
112,628069706230927360,Mon Aug 03 05:07:41 +0000 2015,0,1,"Khan Academy looks at cells that carry out mitosis, to produce cells genetically identical to themselves:https://t.co/yZtcNGwUIY"
113,628066060470747136,Mon Aug 03 04:53:12 +0000 2015,2,0,RT @SJBetteridge: How To Make Your Bookish LEGO Dreams Come True | #tlchat @scoopit http://t.co/WTykIiMlKS
114,628065877905141761,Mon Aug 03 04:52:28 +0000 2015,3,0,"RT @aitsl: RT @scootle: The new look Scootle features over 20,000 resources to help meet the Australian curriculum http://t.co/O3iNar6wA6"
115,628065317319606272,Mon Aug 03 04:50:15 +0000 2015,0,0,Finnish schools are phasing out cursive handwriting classes in favour of keyboard skills: http://t.co/qWLITLn1XG
116,627974942865293312,Sun Aug 02 22:51:08 +0000 2015,0,0,State of Australia’s Birds report details serious population decline in willie wagtails;kookaburras and magpies:http://t.co/dRHYvyeH9f
117,626180518116093952,Wed Jul 29 00:00:44 +0000 2015,0,0,How to set up a group Blog in Posterous:http://t.co/sSGXIxTSpH
118,626179915780468736,Tue Jul 28 23:58:20 +0000 2015,0,0,Free Technology for Teachers: How to Create a Rubric in Google Sheets - Video De... http://t.co/fpIKlSqc5W
119,626179414737313792,Tue Jul 28 23:56:20 +0000 2015,1,0,RT @SJBetteridge: Stages of Being a Maker Learner | #makerspace #austl #tlchat @scoopit http://t.co/aAi1pOCD6y
120,626179124994772992,Tue Jul 28 23:55:11 +0000 2015,3,0,RT @HelenStower1: 9 Ways to Plan Transformational Lessons: Planning the Best Curriculum Unit Ever | Edutopia http://t.co/e5a9pk8gF6
121,626177130871721984,Tue Jul 28 23:47:16 +0000 2015,0,0,San Diego State Physics Prof Uses Transparent Whiteboard To Reach Students https://t.co/fz86r59AsO via @sharethis
122,626176446050926592,Tue Jul 28 23:44:33 +0000 2015,2,0,RT @abbylineberry: How do educators embrace students who have always lived with wifi? @jcasap #googlefest #charleston
123,626175692783247360,Tue Jul 28 23:41:33 +0000 2015,258,0,RT @scalzi: I'm worried you'll die before your series gets finished. #TenThingsNotToSayToAWriter
124,626169705196171264,Tue Jul 28 23:17:46 +0000 2015,0,0,National Aboriginal and Torres Strait Islander Children's Day2015 is on Sunday: https://t.co/banHrtYinl
125,625429141546872832,Sun Jul 26 22:15:01 +0000 2015,0,1,"Oxford Dictionary word for today is: sorosis:a fleshy multiple fruit, e.g. a pineapple/mulberry, derived from the ovaries of several flowers"
126,624467060509126656,Fri Jul 24 06:32:03 +0000 2015,3,0,"RT @DonDymocks: FLASH UPDATE: the winner of this year's Miles Franklin award, Sofie Laguna, is on her way to us to sign copies of her award…"
127,624466841289691136,Fri Jul 24 06:31:11 +0000 2015,48,0,"RT @text_publishing: Keyboard shortcuts for novelists, by @tomgauld http://t.co/k96buMQPu0 #fridayfrivolity http://t.co/fSeDvOXfVb"
128,624466691691425792,Fri Jul 24 06:30:35 +0000 2015,24,0,RT @TroveAustralia: Desperately seeking your stories! Share them with Trove and win a badge! #familyhistory http://t.co/aO0owFTjpS http://t…
129,624466626423881728,Fri Jul 24 06:30:20 +0000 2015,62,0,RT @WeAreTeachers: 200+ Bulletin Boards We Love http://t.co/LPCMTvIUa8 #edchat #elemchat http://t.co/E1D6SAXwxQ
130,624466535470383104,Fri Jul 24 06:29:58 +0000 2015,241,0,RT @WeAreTeachers: Truth! #quote #edchat http://t.co/UXD3pLYwoM
131,624019363025129472,Thu Jul 23 00:53:04 +0000 2015,0,0,NGA  will be opening a new Sepik River exhibition:Myth and Magic on 7th August.
132,623760092446339073,Wed Jul 22 07:42:49 +0000 2015,2,0,RT @Bibliothecaire3: Missed my Pop Up Makerspace attend http://t.co/k7EGhqonst online
133,623721051667587072,Wed Jul 22 05:07:41 +0000 2015,0,0,NLA celebrating 150 years of W.B.Yeats poetry on Sunday 2 August at 2pm.
134,614197758723895296,Thu Jun 25 22:25:31 +0000 2015,0,0,Recent apps for any budget: http://t.co/aBXxp3hZvf
135,614195070305239041,Thu Jun 25 22:14:50 +0000 2015,1,1,How Teachers Can Empower Students for deeper learning in Algebra: http://t.co/pwafHcuN20
136,613489529454903296,Tue Jun 23 23:31:16 +0000 2015,0,0,"With Aurora Australis + the prominence of Venus and Jupiter, enjoy this night sky  download from Paul Floyd: http://t.co/70m70N5j4v"
137,611682797594415104,Thu Jun 18 23:51:58 +0000 2015,0,0,Tropfest Jr calling for entries for short film making competition entries for students aged 15 years and younger:http://t.co/FLqL9OWTD3
138,611440336112521216,Thu Jun 18 07:48:30 +0000 2015,0,0,"The City of Sydney 1888 by MS Hill, courtesy City of Sydney Archives /Historical Atlas of Sydney http://t.co/Q8Zke0kMAE"
139,610968038851117056,Wed Jun 17 00:31:46 +0000 2015,0,0,Download ABC Splash's free iPad app for Primary or Secondary students http://t.co/rEIY93EvvG
140,610944374340497408,Tue Jun 16 22:57:44 +0000 2015,0,0,Reading and research is a pathway to knowledge. Thank you to Canberra sculptor John Murphy for this masterpiece. http://t.co/MJbVJBfOmZ
141,610937529160847360,Tue Jun 16 22:30:32 +0000 2015,0,0,CGS Library values ABC Curriculum resource links: http://t.co/D6XfIzM1PI
142,610936732972937216,Tue Jun 16 22:27:22 +0000 2015,0,0,Explore how Palaeontologists piece together what ancient life looked via fossilised remains:http://t.co/hqhDEgX0H9
143,610935205864603648,Tue Jun 16 22:21:18 +0000 2015,1,0,"RT @BrainHQ: Stroke ages the brain by up to 8 years ""overnight"" http://t.co/ilSAGinguQ"
144,610930710174691328,Tue Jun 16 22:03:26 +0000 2015,2,0,RT @CanberraGrammar: CGS students participating in the discussion on last night's @qanda in #CBR - what a great experience. http://t.co/zat…
145,610326945000067073,Mon Jun 15 06:04:17 +0000 2015,0,0,"5 #simple, often overlooked, ways for you to improve your #brain power: http://t.co/O9gHytzG0p"
146,610268327408066560,Mon Jun 15 02:11:22 +0000 2015,0,0,Parent attitudes towards Asian language learning in schools survey report now available:http://t.co/XTiShzDktk
147,610242414905724929,Mon Jun 15 00:28:24 +0000 2015,0,0,Friends of the NLA will screen Hitchcock classic: Psycho on Wednesday 17 June at 6 pm at NLA theatre:109 mins. http://t.co/T4UwcJd5PD
148,610227421447454720,Sun Jun 14 23:28:49 +0000 2015,0,0,Follow NASA's Curiosity Rover on Mars:http://t.co/ura2SmOo2b
149,610225604072353792,Sun Jun 14 23:21:36 +0000 2015,0,0,The bluffer's guide to the Magna Carta: http://t.co/70s4YdTp57
150,610219876058161154,Sun Jun 14 22:58:50 +0000 2015,0,1,"Digital Readiness: nearly 1/3 of Americans lack the skills to use next-generation ""Internet of things"" applications:http://t.co/BvXim0VMUc"
151,610218629238427650,Sun Jun 14 22:53:53 +0000 2015,0,0,Transforming the Library Profession http://t.co/Fp87eNRMkc
152,608404400101539841,Tue Jun 09 22:44:47 +0000 2015,9,0,RT @TyC_GG: Teaching handwriting more effectively using technology http://t.co/kzsyJI3bBX #edchat #chromebook #GoogleEdu
153,606690263524769792,Fri Jun 05 05:13:25 +0000 2015,0,0,Excerpt: Australian cartoonist Michael Leunig by ABCRadioNational via #soundcloud https://t.co/fJb4uTqw2x
154,606688219330011136,Fri Jun 05 05:05:17 +0000 2015,0,0,Download Michael Leunig interview:http://t.co/uaBXgfKeOl
155,606686686722977792,Fri Jun 05 04:59:12 +0000 2015,0,0,Four Practical Principles for Enhancing Vocabulary Instruction from Wiley Library: http://t.co/lATBRUFb8V
156,606682389192974336,Fri Jun 05 04:42:07 +0000 2015,0,0,Wellbeing Resources: http://t.co/9HcTU5SRGY via @danhaesler
157,606682018026389504,Fri Jun 05 04:40:39 +0000 2015,0,0,"ABC Bookclub on Tuesday night discusses Discreet Hero by Mario Vargas Llosa,+Enid Blyton's Five on a Treasure Island:http://t.co/XWVmssvkV0"
158,606631824329199616,Fri Jun 05 01:21:12 +0000 2015,0,0,STEM Curriculum Resources | @scoopit via @kbonanno http://t.co/E7n3Z8vh8z
159,606631779777314816,Fri Jun 05 01:21:01 +0000 2015,0,0,iPad Coding - STEM Curriculum Resources by Dr. Wesley Fryer | @scoopit via @kbonanno http://t.co/0K0cXDoBEB
