,id_str,created_at,retweet_count,favorite_count,text
0,369908765015146496,Tue Aug 20 19:48:16 +0000 2013,0,0,the quickest way to lose some weight: http://t.co/nteVcCwJG6
1,369580742952882177,Mon Aug 19 22:04:50 +0000 2013,0,0,this is the quickest method to shed stomach fat http://t.co/VxxPWFoVYm
2,369533567103033344,Mon Aug 19 18:57:22 +0000 2013,0,0,the quickest method to shed fat http://t.co/jLIPx2ePgC :)
3,367290938445791232,Tue Aug 13 14:25:58 +0000 2013,0,0,here it says how you can get some http://t.co/rDSpMpvZSZ
4,366296995431841792,Sat Aug 10 20:36:23 +0000 2013,0,0,this is perfect http://t.co/UQYdP7rJzw
5,366252721944272897,Sat Aug 10 17:40:28 +0000 2013,0,0,Try This http://t.co/Qiozcv7kKz
6,354722010871513088,Tue Jul 09 22:01:32 +0000 2013,0,0,"Google Alerts RSS delivery is temporarily not available. To keep receiving Google Alerts in the meantime, you c..."
7,352038261826404354,Tue Jul 02 12:17:16 +0000 2013,0,0,Google Alerts no longer supports RSS delivery
8,295998537190223872,Mon Jan 28 20:55:25 +0000 2013,0,2,Bought a new Lexus es350.  Awesome car. http://t.co/mwDaXWac via @kellens
9,295384619002511360,Sun Jan 27 04:15:55 +0000 2013,0,0,AAA Motor Club is obsolete.  Now you could have Roadside Assistance that pays you Cash Back.  See how:  http://t.co/wciXf7OV
10,290624857895497729,Mon Jan 14 01:02:20 +0000 2013,0,0,Internet marketing could be difficult without proper marketing skills.  Here's the online training you need: http://t.co/DqQvx6B9
11,288088156039958529,Mon Jan 07 01:02:23 +0000 2013,0,0,Internet marketing could be difficult without proper marketing skills.  Here's the online training you need: http://t.co/DqQvx6B9
12,285551524288032770,Mon Dec 31 01:02:43 +0000 2012,0,0,Internet marketing could be difficult without proper marketing skills.  Here's the online training you need: http://t.co/DqQvx6B9
13,283014778484576256,Mon Dec 24 01:02:36 +0000 2012,0,0,Internet marketing could be difficult without proper marketing skills.  Here's the online training you need: http://t.co/DqQvx6B9
14,274654697233719296,Fri Nov 30 23:22:37 +0000 2012,0,0,This rocks! I earned $167.35 so far doing surveys. http://t.co/RJsticto
15,274279253120532480,Thu Nov 29 22:30:44 +0000 2012,0,0,This rocks! I made $166.40 so far taking some surveys. http://t.co/XGSs2w2K
16,273172267704389632,Mon Nov 26 21:11:58 +0000 2012,0,0,Aweesomeee! I got $171.69 this week so far just taking a couple of surveys. http://t.co/HjaswCKf
17,272822343896817665,Sun Nov 25 22:01:30 +0000 2012,0,0,I love this! I earned $199.14 this week so far taking surveys. http://t.co/7OfXJ3cq
18,272051865087246338,Fri Nov 23 18:59:53 +0000 2012,0,1,I love this! I got $172.53 this week so far taking some surveys. http://t.co/RfGes0ZL
19,271686679276953600,Thu Nov 22 18:48:46 +0000 2012,0,0,Awesome! I got $103.27 this week so far filling out some surveys. http://t.co/qGjbMrNM
20,271319400970321921,Wed Nov 21 18:29:20 +0000 2012,0,0,Sweeeet! I earned $194.95 this week so far just filling out some surveys. http://t.co/jZ7lg0eM
21,270940415975378945,Tue Nov 20 17:23:23 +0000 2012,0,0,I love this! I got $175.44 this week just filling out surveys. http://t.co/qanU3moK
22,270678523415515136,Tue Nov 20 00:02:43 +0000 2012,0,0,Aweesomeee! I earned $176.11 so far doing a couple of surveys. http://t.co/3ZTwuGeh
23,270571839221297152,Mon Nov 19 16:58:48 +0000 2012,0,0,Sweeeet! I earned $191.37 so far doing some surveys. http://t.co/E0cC04hq
24,270216578086338561,Sun Nov 18 17:27:07 +0000 2012,0,0,Aweesomeee! I made $165.15 so far just taking some surveys. http://t.co/0xABiSBq
25,268835921296760832,Wed Nov 14 22:00:53 +0000 2012,0,0,Internet Marketing has never been so simple.  Start earning Holiday Cash online.  http://t.co/M3R5bIeR
26,266915632904294400,Fri Nov 09 14:50:20 +0000 2012,0,0,Internet Marketing dream.  Very workable home based income opportunity worth checking out: http://t.co/eqFmcjPD
27,151969278080466944,Wed Dec 28 10:14:34 +0000 2011,0,1,Could social network talk get you in trouble with the boss? http://t.co/3lbe70d9
28,151863453802438656,Wed Dec 28 03:14:03 +0000 2011,0,0,Feature: Social networking security http://t.co/JvXf3dto
29,151767828154957825,Tue Dec 27 20:54:04 +0000 2011,0,0,Do you belong to employers of people you follow on Twitter? Who owns your account? http://t.co/s76XDxWz
30,151673420445270016,Tue Dec 27 14:38:56 +0000 2011,0,0,Does E-Commerce On Social Networks Pay Yet? http://t.co/Vr4QXEOp
31,151560758973579264,Tue Dec 27 07:11:15 +0000 2011,0,0,Arab Social Media Report http://t.co/eaClQpkL
32,151464169143676928,Tue Dec 27 00:47:26 +0000 2011,0,0,Twitter more popular than Facebook in 2011 http://t.co/80BPJcZU
33,151355215705157633,Mon Dec 26 17:34:30 +0000 2011,0,0,Film-Makers Tap Social Media for Funds http://t.co/A7dAq1BJ
34,151243976551301120,Mon Dec 26 10:12:28 +0000 2011,0,0,What role social media and networks? http://t.co/CCHC5Fav
35,151144586100748288,Mon Dec 26 03:37:32 +0000 2011,0,0,"It's a social, social, social world http://t.co/IKCsxoZJ"
36,150996779482099713,Sun Dec 25 17:50:12 +0000 2011,0,0,Parents can protect kids from online bullies http://t.co/IySblV7W
37,150540259753607170,Sat Dec 24 11:36:09 +0000 2011,0,0,Social media site Facebook tops search charts http://t.co/BTITNlZa
38,150389550924046336,Sat Dec 24 01:37:17 +0000 2011,0,0,Why Blogging and Social Networking in Mexico Can Turn Deadly http://t.co/uyL9aTZz
39,150294354307727360,Fri Dec 23 19:19:01 +0000 2011,0,0,Social networking websites pulled up by Delhi court - India News ... http://t.co/KR0t6P4J
40,150197510235893761,Fri Dec 23 12:54:11 +0000 2011,0,0,Study Shows Pinterest Will Compete with Top 10 Social Networks ... http://t.co/TZu1inHF
41,150104276436402177,Fri Dec 23 06:43:42 +0000 2011,0,0,Pinterest Stakes Out Social Networking Turf [VIDEO] http://t.co/WSVRSrV4
42,149987590660046849,Thu Dec 22 23:00:02 +0000 2011,0,0,The Top 9 Facebook Games Of 2011 http://t.co/R2DrpZW9
43,149896969656078339,Thu Dec 22 16:59:57 +0000 2011,0,0,"Media attention, traditional social networks responsible for Twitter growth: MIT http://t.co/ZiJH4aWq"
44,149788188225974272,Thu Dec 22 09:47:41 +0000 2011,1,0,Absolutely no social networking integration http://t.co/CEnW0iG8
45,149691623280885760,Thu Dec 22 03:23:58 +0000 2011,0,0,PHL is 6th worldwide in social media engagement —ComScore http://t.co/4bgzglMo
46,149583176308768769,Wed Dec 21 20:13:03 +0000 2011,0,0,TUAW Best of 2011: Vote for the best iPhone social networking app http://t.co/sOUgmyqk
47,149479005165338625,Wed Dec 21 13:19:06 +0000 2011,0,0,New Study Links Social Media Popularity to Polling Numbers http://t.co/RPSEyrjj
48,149373797626150913,Wed Dec 21 06:21:03 +0000 2011,0,0,Use winter downtime to visit social-media sites http://t.co/3sewKpuO
49,149250519788036098,Tue Dec 20 22:11:11 +0000 2011,0,0,Peter Greenberg Worldwide – Travel Tip: New Social Networking ... http://t.co/JZhXsN6L
50,149149020751794176,Tue Dec 20 15:27:52 +0000 2011,0,0,Jive Unveils Free Social Media Monitoring Tool http://t.co/IWXkF4jz
51,149030032730365953,Tue Dec 20 07:35:03 +0000 2011,0,0,Social Media and Syria's Revolution http://t.co/7zRcXlxd
52,148930736525807617,Tue Dec 20 01:00:29 +0000 2011,0,0,Anti-Social http://t.co/OcmmVAmB
53,148830550168309761,Mon Dec 19 18:22:22 +0000 2011,0,0,Social Media Won't Work For This Business! http://t.co/TgHBLocq
54,148699614827134978,Mon Dec 19 09:42:05 +0000 2011,0,0,Are The 4 Leading Social Stocks A Buy? http://t.co/a9l6o06t
55,148501058010890240,Sun Dec 18 20:33:05 +0000 2011,0,0,More Companies Recruit Via Social Networks - The BrainYard ... http://t.co/iA3TFK1b
56,148384973097943043,Sun Dec 18 12:51:49 +0000 2011,0,0,KLM to let airline travelers choose seating partners based on social media ... http://t.co/4ZSRkAre
57,148285850445291520,Sun Dec 18 06:17:56 +0000 2011,0,0,Travellers warned about social media http://t.co/jpwLhGx6
58,148107745441234944,Sat Dec 17 18:30:12 +0000 2011,0,0,5 Tips To Build A Big Network In Social Networking Sites http://t.co/5ZYHB2TA
59,148015011707625473,Sat Dec 17 12:21:43 +0000 2011,0,0,Yahoo! Contributor Network http://t.co/Ekyz5zPH
60,147829803112873985,Sat Dec 17 00:05:46 +0000 2011,1,0,Microsoft Goes Public With Its New Social Network So.cl http://t.co/jDekGsra
61,147723623279505409,Fri Dec 16 17:03:51 +0000 2011,0,0,"KLM, Facebook Timeline, Google+... top social network trends for 2012 http://t.co/5IZcGBrO"
62,147629569527132160,Fri Dec 16 10:50:06 +0000 2011,0,0,MarketTarget Releases 2012 Guide to Social Media http://t.co/S5mo5Uid
63,147475636582223872,Fri Dec 16 00:38:26 +0000 2011,0,0,Consumers Not Turning to Social Media Sites for Local Business Info [STUDY] http://t.co/FcVVdyhi
64,147367521618628609,Thu Dec 15 17:28:49 +0000 2011,0,0,"Explore jobs, social media at Kennesaw Career Training Expo http://t.co/CzNzhTGn"
65,147252848839753728,Thu Dec 15 09:53:09 +0000 2011,0,0,"Ex-MySpace International Exec Launches IdeaPlane, an Enterprise Social Network ... http://t.co/IioDu5z4"
66,147113538605944832,Thu Dec 15 00:39:35 +0000 2011,0,0,Social media guru joins Starbucks board http://t.co/jHTvsbQi
67,147017417753767936,Wed Dec 14 18:17:38 +0000 2011,0,0,"From social media abuse to mobile malware to major busts, past year filled ... http://t.co/prhft4y8"
68,146904613923205120,Wed Dec 14 10:49:23 +0000 2011,0,0,Terrorists using social networks to further their designs http://t.co/HyNPdNcN
69,146785333697183744,Wed Dec 14 02:55:25 +0000 2011,0,0,Moscow Protests Get Legs with Social Media http://t.co/u4JlGx9i
70,146662896707969024,Tue Dec 13 18:48:54 +0000 2011,0,0,Nearly Half of Teen Internet Users Have Lied About Their Age http://t.co/WsbTef43
71,146556590810599424,Tue Dec 13 11:46:28 +0000 2011,0,0,Yachting WA gets into the world of social networking http://t.co/fvMA9w69
72,146445442132086785,Tue Dec 13 04:24:48 +0000 2011,0,0,Social networking is about to get exponentially more annoying ... http://t.co/GuL9eN3G
73,146333813465817088,Mon Dec 12 21:01:14 +0000 2011,0,0,Facebook Cites Gingrich As Social Media 'Savvy' Politician http://t.co/eHfs9WHp
74,146205551838244864,Mon Dec 12 12:31:34 +0000 2011,0,0,Social Networking in Nursing http://t.co/TtmrJ3Zb
75,146104753850548225,Mon Dec 12 05:51:02 +0000 2011,0,0,"Enforce law, don't gag social networking sites: Experts http://t.co/CQiAJtmK"
76,146008731702927361,Sun Dec 11 23:29:29 +0000 2011,0,0,Swedbank says ATM queues in Latvia due to false rumours http://t.co/RnC1ij1v
77,145917974124052480,Sun Dec 11 17:28:50 +0000 2011,0,0,Social media minefield http://t.co/mAPb8Ozw
78,145668320123817984,Sun Dec 11 00:56:48 +0000 2011,0,0,E-media: no place to hide http://t.co/bsnMhnr0
79,145556589015875584,Sat Dec 10 17:32:49 +0000 2011,0,0,Social Media Crucial in Recent Wave of Russian Protests http://t.co/XEjBalAK
80,145445177505484800,Sat Dec 10 10:10:07 +0000 2011,0,0,Social Media Gaming Company Kliqo to Give Away a Fiat 500 http://t.co/zQua7AL7
81,145340610927267840,Sat Dec 10 03:14:36 +0000 2011,0,0,Social Networking for Business - Creativity And Innovation Driving ... http://t.co/frQ2vAHQ
82,145240588680314880,Fri Dec 09 20:37:09 +0000 2011,0,0,Social Networking Left Without Strategy http://t.co/3d0S0Str
83,145147462070439936,Fri Dec 09 14:27:06 +0000 2011,0,0,Govt has no intention of interfering with social media: Kapil Sibal http://t.co/mLbfCCq1
84,145023087950311426,Fri Dec 09 06:12:53 +0000 2011,0,0,Social Networking Is About to Get Exponentially More Annoying http://t.co/Ya65RVhx
85,144881876161667072,Thu Dec 08 20:51:45 +0000 2011,0,0,S. Korea tightens monitoring of social media http://t.co/CcaUMBFl
86,144776143596294144,Thu Dec 08 13:51:37 +0000 2011,0,0,"CMO Council Study Reveals Consumers Want Better Experiences, Deeper Engagement ... http://t.co/ATYnJwr2"
87,144649219171553280,Thu Dec 08 05:27:15 +0000 2011,0,0,WVUP beta testing social network program http://t.co/x3DWtjk0
88,144558335352508416,Wed Dec 07 23:26:07 +0000 2011,0,0,Facebook use 'lowers GPA' over prolonged sessions http://t.co/LJrCH5B8
89,144451311302230016,Wed Dec 07 16:20:51 +0000 2011,0,0,How Social Networking Relates to Online Learning | Online College ... http://t.co/6ZXw9T10
90,144352277455585281,Wed Dec 07 09:47:19 +0000 2011,0,0,Microsoft unveils CRM with in-built social network http://t.co/RdXWyzxR
91,144255272007897088,Wed Dec 07 03:21:51 +0000 2011,0,0,Power of social media too much for some consumers to handle responsibly http://t.co/yPHehqEj
92,144123159317192704,Tue Dec 06 18:36:53 +0000 2011,0,0,"Xbox 360 mashes up games, live TV, social media, and more in a major update http://t.co/C2yNsnNp"
93,144013047328018432,Tue Dec 06 11:19:20 +0000 2011,0,0,"Just in Time for Holiday Shopping, Business Guide Book for Social Commerce http://t.co/F62Pzo7u"
94,143897416645611520,Tue Dec 06 03:39:52 +0000 2011,0,0,What Boards Should Know About Social Media http://t.co/Oo2eQQcR
95,143742969470660608,Mon Dec 05 17:26:09 +0000 2011,0,0,Facebook Analytics Service Goes Beyond Likes http://t.co/7ZsAhHDr
96,143627688966488068,Mon Dec 05 09:48:04 +0000 2011,0,0,Yammer Appoints EMEA Leadership Team in London http://t.co/LjSTLBtx
97,143527958722772993,Mon Dec 05 03:11:46 +0000 2011,0,0,Alibaba enters social network arena http://t.co/lu9p0NGr
98,143436394679906304,Sun Dec 04 21:07:56 +0000 2011,0,0,Social media website offers food for thought http://t.co/zwvUALXR
99,143320065633296384,Sun Dec 04 13:25:41 +0000 2011,0,0,Rumors: Facebook buys location based Social Network Gowalla http://t.co/3cANcLeZ
100,143178203140341760,Sun Dec 04 04:01:58 +0000 2011,0,0,Apple's internal employee social media policies leaked http://t.co/pEo1loaW
101,143080216342953984,Sat Dec 03 21:32:36 +0000 2011,0,0,The Most Popular Social Networks and Who Is On Them ... http://t.co/VvHUoOcE
102,142872616951230464,Sat Dec 03 07:47:40 +0000 2011,0,0,Solar Charging Meets Social Networking With Changers : TreeHugger http://t.co/VW9J91T4
103,142769639825489920,Sat Dec 03 00:58:29 +0000 2011,0,0,Similar friends may spread healthy behaviors http://t.co/2NRaHTDo
104,142655276489781249,Fri Dec 02 17:24:02 +0000 2011,0,0,"Alibaba tests its own social network for China (ALBIY, AAPL, YHOO) http://t.co/TPPwNalC"
105,142539497043804161,Fri Dec 02 09:43:59 +0000 2011,0,1,"Obama's social network, NationalField, tackles the NHS (Wired UK) http://t.co/5tXLpYYv"
106,142436466021236736,Fri Dec 02 02:54:34 +0000 2011,0,0,Social networking - or social and not working? http://t.co/pYG4DXTm
107,142312941646127104,Thu Dec 01 18:43:43 +0000 2011,0,0,Brands Get 'High' on Social Media at the Marcus Evans Social Media Conference http://t.co/O3VO4g6d
108,142155972050288640,Thu Dec 01 08:19:59 +0000 2011,0,0,3 Ways Social Media Affects Brands http://t.co/JVQsHS6C
109,142031552421953536,Thu Dec 01 00:05:35 +0000 2011,0,0,The Lantern: Social Network Twitter becomes more popular http://t.co/5aueP2xp
110,141814595617701888,Wed Nov 30 09:43:29 +0000 2011,0,0,Revolutionizing Social Networking One Chick at a Time http://t.co/7wdKUxgc
111,141692681767223299,Wed Nov 30 01:39:02 +0000 2011,0,0,Social Networking Stats: Tumblr Grows 900% Globally In One Year ... http://t.co/gc0DgBfs
112,141594154173087744,Tue Nov 29 19:07:31 +0000 2011,0,0,"COMMENTARY: The power, and abuse, of Social Media http://t.co/pYc31UTt"
113,141493727960117248,Tue Nov 29 12:28:28 +0000 2011,0,0,Social Network Games will soar as internet penetration and incomes rise http://t.co/KzfW1lYN
114,141368417256083456,Tue Nov 29 04:10:31 +0000 2011,0,0,Top 10 Social Web Products of 2011 http://t.co/HICXobql
115,141266575998193664,Mon Nov 28 21:25:50 +0000 2011,0,0,Business Owners Manage And Convert Social Network Followers Into Customers http://t.co/Te4QkAaG
116,141141001740894211,Mon Nov 28 13:06:51 +0000 2011,0,0,Want to get stand out in a job search? Upload a photo http://t.co/bFuC4m5E
117,141044315043540992,Mon Nov 28 06:42:39 +0000 2011,0,0,Social media use poses professional risks for doctors http://t.co/rVBU8bzK
118,140944667184340995,Mon Nov 28 00:06:41 +0000 2011,0,0,Scarlett Johansson Talks Social Media: 'I Can't Think Of Anything I'd Rather ... http://t.co/h0ey8kwn
119,140849472522563584,Sun Nov 27 17:48:25 +0000 2011,0,0,Social Gaming on the Sky-Rise: Fluke or Future? http://t.co/zMu0as0y
120,140718082963410946,Sun Nov 27 09:06:20 +0000 2011,0,0,Facebook Frictionless Sharing Frightens http://t.co/ghVbz7jr
121,140608393059643393,Sun Nov 27 01:50:27 +0000 2011,0,0,Cyworld hopes to make comeback with redesigned global service http://t.co/LDurh0iG
122,140504052478906368,Sat Nov 26 18:55:51 +0000 2011,0,0,5 LinkedIn Tips For The Laid-Off http://t.co/gmLE9kC0
123,140373329172373504,Sat Nov 26 10:16:24 +0000 2011,0,0,Face to face Networking is more than social media http://t.co/sxCHtshU
124,140221321580785664,Sat Nov 26 00:12:22 +0000 2011,0,0,TerpAMA - “The Hands We Shake” with Bennett Resnik http://t.co/dBRgfV74
125,140128111923703808,Fri Nov 25 18:01:59 +0000 2011,0,0,Surprise Police working on code to guide social-media use http://t.co/WvyTLTdK
126,140036096137494528,Fri Nov 25 11:56:21 +0000 2011,0,0,Media attention needed for cyber abuses http://t.co/wulk9TMa
127,139938411229347840,Fri Nov 25 05:28:11 +0000 2011,0,0,B2B Marketers Can Engage More Customers with Social Media http://t.co/e7Z0JOX6
128,139845687994101762,Thu Nov 24 23:19:44 +0000 2011,0,0,Social revolution http://t.co/ydbNyxoj
129,139673612125872129,Thu Nov 24 11:55:58 +0000 2011,0,0,"US lawmakers, Twitter dispute over Taliban tweets http://t.co/mAkMTVv2"
130,139582552255119360,Thu Nov 24 05:54:08 +0000 2011,0,0,Blasdell board adopts resolution to protect residents within social networking http://t.co/yEFDJ6DH
131,139426992264200192,Wed Nov 23 19:36:00 +0000 2011,0,0,Social Networking For Couples From Cupple » 148Apps » iPhone ... http://t.co/rroeZgg4
132,139322462667153409,Wed Nov 23 12:40:38 +0000 2011,0,0,Bayonne High School students use social media to support history teacher ... http://t.co/qkGc9i0t
133,139231739313799169,Wed Nov 23 06:40:08 +0000 2011,0,0,"SunGard Launches Ambit MyMoney, a Social Media-Enabled Online and Mobile ... http://t.co/C51MJ9Jr"
134,139098053872328704,Tue Nov 22 21:48:55 +0000 2011,0,0,Can Social Shopping Finally Take Off? | Adweek http://t.co/kg3fUXAp
135,138959979548913664,Tue Nov 22 12:40:15 +0000 2011,0,0,Crazy Friends | Facebook Tags | Social Network http://t.co/NAMGbFCF
136,138843014981353472,Tue Nov 22 04:55:29 +0000 2011,0,0,Using Social Media To Land A Job http://t.co/TlhWQm23
137,138727668391755777,Mon Nov 21 21:17:08 +0000 2011,0,0,How social media is changing laws & investigations http://t.co/FWq1JA9O
138,138617571820847104,Mon Nov 21 13:59:39 +0000 2011,0,0,"Retailers Miss Opportunity to Reach Shoppers with Social, Mobile Media http://t.co/QwEE9KNP"
139,138512052485492736,Mon Nov 21 07:00:21 +0000 2011,0,0,Global X's Social Media ETF Attempts to Capitalize on Latest Internet Fervor http://t.co/YYTJyeRz
140,138408145776148480,Mon Nov 21 00:07:28 +0000 2011,0,0,Six ways to brand your business on Google+ http://t.co/cZp4w7YZ
141,138249955088404480,Sun Nov 20 13:38:52 +0000 2011,0,0,Sony gets social to launch 'new era' of media consumption http://t.co/LLZGm5JB
142,138155336434589696,Sun Nov 20 07:22:53 +0000 2011,0,0,Jobvite Social Job Seeker Survey: One in Six Used Social Networks ... http://t.co/LDljkRbL
143,138015157212291072,Sat Nov 19 22:05:52 +0000 2011,0,0,Passionate Fans and Fire-Hazard Fans http://t.co/AWR2hAVU
144,137899475208388608,Sat Nov 19 14:26:11 +0000 2011,0,0,Is Social Media Marketing Right for Small Business? http://t.co/5mCzKl2K
145,137785230403698688,Sat Nov 19 06:52:13 +0000 2011,0,0,Social Networking And Obessive-Compulsive Disorder http://t.co/jEoop0Y7
146,137691238303404032,Sat Nov 19 00:38:44 +0000 2011,0,0,Social media ETF deserves the brush-off http://t.co/3zqtHlhz
147,137587089683398656,Fri Nov 18 17:44:53 +0000 2011,0,0,"Will the Future of Social Business Networking be Google, Facebook? http://t.co/7SYtuWbx"
148,137495536805740544,Fri Nov 18 11:41:05 +0000 2011,0,0,Sony launches Play Community social network http://t.co/WJgcedVx
149,137305210623238144,Thu Nov 17 23:04:47 +0000 2011,0,0,A Socially Awkward ETF? http://t.co/DGwtTKxU
150,137201523997417473,Thu Nov 17 16:12:47 +0000 2011,0,0,Social Media ETFs: Time To Buy? http://t.co/BDum8nV7
151,137073684178419714,Thu Nov 17 07:44:47 +0000 2011,0,0,"Occupy Wall Street (OWS), Social Networking, and the 1%: Systemic Risk to ... http://t.co/D7MgQuO2"
152,136967123640655872,Thu Nov 17 00:41:21 +0000 2011,0,0,Techonomy: Sean Parker Reflects on Social Networks & Social Business http://t.co/O2IjHwh3
153,136874149292421121,Wed Nov 16 18:31:54 +0000 2011,0,0,Social Networking Quiz http://t.co/IEEGTZ4l
154,136747475963871232,Wed Nov 16 10:08:33 +0000 2011,0,0,Active social media celebrities ask Clinton http://t.co/OLR2chy2
155,136641960885747712,Wed Nov 16 03:09:16 +0000 2011,0,0,Investacorp Elects Erado's Social Media Strategy for their Advisors http://t.co/0TMwjYoQ
156,136533555126874112,Tue Nov 15 19:58:30 +0000 2011,0,0,TV Station Groups Unite To Offer Social Networking And Info … http://t.co/cxXR9Api
157,136417471732269056,Tue Nov 15 12:17:14 +0000 2011,0,0,The Social Network Magazine Reveals Its Launch Pad Status in Radio Interview http://t.co/4B4hRAT9
158,136286325681819650,Tue Nov 15 03:36:06 +0000 2011,0,0,Salesforce acquires Model Metrics for social networking push http://t.co/wMjMLSH5
159,136150727717425152,Mon Nov 14 18:37:17 +0000 2011,0,0,Social-networking sites click with neighborhood groups http://t.co/CEUqJTc9
160,136045743852093441,Mon Nov 14 11:40:07 +0000 2011,0,0,Untangling the Web: The social media-news site ecosystem http://t.co/lGBeF0DX
161,135930221495992320,Mon Nov 14 04:01:04 +0000 2011,0,0,"Dentist in Virginia Beach, VA Expands Dental Practice Via Social Network http://t.co/0Zmyhqg9"
162,135828267973345280,Sun Nov 13 21:15:57 +0000 2011,0,0,Social networking site http://t.co/1AnO5wnm reportedly hacked | Office... http://t.co/oQjK657B
163,135726197941346304,Sun Nov 13 14:30:21 +0000 2011,0,0,Google Joins Social Network Fund http://t.co/ZJZBalfv
164,135629357011042304,Sun Nov 13 08:05:33 +0000 2011,0,0,What Kind of Social Networking Does Your Business Need? – Part 1 ... http://t.co/WRA3HBa8
165,135466939240816641,Sat Nov 12 21:20:09 +0000 2011,0,0,Bullies use anonymity provided by Facebook and social networking sites to ... http://t.co/8DCMVNV6
166,135285774311632896,Sat Nov 12 09:20:16 +0000 2011,0,0,"“JAZZ LIVES” and SOCIAL NETWORKING, TENTATIVELY | JAZZ ... http://t.co/sbKN4mxz"
167,135087472450351104,Fri Nov 11 20:12:17 +0000 2011,0,0,Social Media? Get Serious with the Twitter Web Analytics Tool http://t.co/Q1GjgXFU
168,134989197936312320,Fri Nov 11 13:41:47 +0000 2011,0,0,LinkedIn now the social media platform of choice http://t.co/a77pDEWe
169,134881591024553984,Fri Nov 11 06:34:11 +0000 2011,0,0,Women better than men at social media http://t.co/GoiCeDp1
170,134740596865773568,Thu Nov 10 21:13:56 +0000 2011,0,0,Convonix to Talk About Evolution of Social Media and Offer Insights to Leading ... http://t.co/hTU5G2bp
171,134610657239777280,Thu Nov 10 12:37:36 +0000 2011,0,0,"http://t.co/J5DCWwF1, a Social Networking Site for Movie Lovers, Named a To... http://t.co/ThhFpodE"
172,134489913507848192,Thu Nov 10 04:37:48 +0000 2011,0,0,"Workers, employers clash on social media http://t.co/Dnh3nLfD"
173,134378687813533696,Wed Nov 09 21:15:50 +0000 2011,0,0,Feds: Social network for kids violated privacy law http://t.co/wD215Y8v
174,134276718432223233,Wed Nov 09 14:30:39 +0000 2011,0,0,Controlling the uncontrollable: The inherent risks of social media http://t.co/RroJnruX
175,134175157936861185,Wed Nov 09 07:47:05 +0000 2011,0,0,"Facebook, Twitter Show Teens Social Networking's Unfriendly Side http://t.co/aUEta8bI"
176,134055199756140544,Tue Nov 08 23:50:24 +0000 2011,0,0,"Facebook, social networks, businesses 'must adhere' to EU law http://t.co/HyBjWjD5"
177,133963727790809088,Tue Nov 08 17:46:56 +0000 2011,0,0,The role of social media in journalism http://t.co/nIOjAB0v
178,133872585732665344,Tue Nov 08 11:44:46 +0000 2011,0,0,The Wisdom of the Crowd: Social Networking Meets Capital Formation http://t.co/GcxIqZUU
179,133770771016323072,Tue Nov 08 05:00:11 +0000 2011,0,0,Google social network opens doors to businesses | FP Tech Desk ... http://t.co/40VKNmjV
180,133669955781656576,Mon Nov 07 22:19:35 +0000 2011,0,0,Badgeville Takes Cue From Facebook With 'Behavior Graph' http://t.co/EJi8E4yE
181,133541387495931904,Mon Nov 07 13:48:42 +0000 2011,0,0,Just What Is Social Media Integration? http://t.co/6bzlfZAb
182,133441648330940416,Mon Nov 07 07:12:22 +0000 2011,0,0,Call of Duty's Social Network Launch Delayed http://t.co/eTlHglPE
183,133335260107784192,Mon Nov 07 00:09:37 +0000 2011,0,0,Social networking in spotlight at Young Beef Producers Forum http://t.co/uAnv9qci
184,133230937495453696,Sun Nov 06 17:15:05 +0000 2011,0,0,"Information Cascade, Tipping Points, and How Social Networking ... http://t.co/JPqBtwit"
185,133061699744972802,Sun Nov 06 06:02:36 +0000 2011,0,0,Unforseen consquences of social media http://t.co/CXtvFs6U
186,132953038464892928,Sat Nov 05 22:50:49 +0000 2011,0,0,Online social networks: Malware launch pads http://t.co/L1eohc36
187,132745956046286850,Sat Nov 05 09:07:56 +0000 2011,0,0,Are social networks a vital part of modern life? Or just a waste of ... http://t.co/FpUdgOyw
188,132605123624046593,Fri Nov 04 23:48:19 +0000 2011,0,0,Balancing Social Networking with Network Security Objectives http://t.co/vJhosKWG
189,132494385043611648,Fri Nov 04 16:28:17 +0000 2011,0,0,"Use of Social Media, Digital Newspaper Editions: Survey http://t.co/esXNibTT"
190,132401027130458112,Fri Nov 04 10:17:19 +0000 2011,0,0,Social media open new chapter in 2012 campaign http://t.co/4yzSAM5f
