,id_str,created_at,retweet_count,favorite_count,text
191,132277966934786049,Fri Nov 04 02:08:19 +0000 2011,0,0,"New Raymond James Social Media Platform Lets Advisors Use LinkedIn, Facebook ... http://t.co/FceJUETY"
192,132145345286258689,Thu Nov 03 17:21:20 +0000 2011,0,0,Strategy Analytics: Facebook and Emerging Markets to Double Global Social ... http://t.co/1AIvEaIo
193,132030732586582016,Thu Nov 03 09:45:54 +0000 2011,0,0,Social networking spat ends in arson charges for woman http://t.co/08nbxWmm
194,131918043067592706,Thu Nov 03 02:18:07 +0000 2011,0,0,Posting Negative Comments On Social Media Sites Will Get You Fired At Apple http://t.co/p6Qqdjml
195,131810188545105920,Wed Nov 02 19:09:32 +0000 2011,0,0,"Cisco study finds young workers want access, not money http://t.co/PDy35uFM"
196,131703656671219713,Wed Nov 02 12:06:13 +0000 2011,0,0,UK: Disorder no excuse to clamp down on Internet http://t.co/RLyPkdPv
197,131577792612675584,Wed Nov 02 03:46:05 +0000 2011,0,0,Unthink's “Anti-Facebook” Social Network Reaches 100000 Users ... http://t.co/r3brBtKW
198,131482795385171970,Tue Nov 01 21:28:35 +0000 2011,0,0,Social media - The new rules http://t.co/WlAwR1y2
199,131372520476651520,Tue Nov 01 14:10:24 +0000 2011,0,0,How's your social security? Burglars monitor Facebook and Twitter to see when ... http://t.co/EzqmYDtv
