,id_str,created_at,retweet_count,favorite_count,text
0,662676216139358212,Fri Nov 06 17:01:36 +0000 2015,0,0,Agbani derego my star https://t.co/MeTeAPXcwh
1,662675985381400576,Fri Nov 06 17:00:41 +0000 2015,0,0,She's a true beauty agbani derego https://t.co/aT9l333R3i
2,662675404939857922,Fri Nov 06 16:58:23 +0000 2015,0,0,I luv abgani derego so much she a model indeed looking forward to having her model for my musical video https://t.co/SnaaDpowxK
3,662675032590581760,Fri Nov 06 16:56:54 +0000 2015,0,0,Just pick d new location for new video will let all my fans to join me. Looking to having abgani derego model for it https://t.co/dtaakR0a4M
4,662666995423420416,Fri Nov 06 16:24:58 +0000 2015,0,0,He is very smart his name is Ransy https://t.co/8kGOTepJw7
5,662666675863609344,Fri Nov 06 16:23:41 +0000 2015,0,0,He is smart and his name is RAnsy https://t.co/rUG6xZvbDj
6,660768061876772864,Sun Nov 01 10:39:17 +0000 2015,0,0,"Time to resume, conclude from hidingTo reform myself and all my grounds"
7,660767557570441217,Sun Nov 01 10:37:16 +0000 2015,0,0,"I have one too many personalities, I don't know which one is really me, So if I'm nice at first, and then I'm mean, don't feel I hate u"
8,656346964737458176,Tue Oct 20 05:51:25 +0000 2015,0,0,Me and beyonce https://t.co/uxPwLpdWHN
9,656345115909296128,Tue Oct 20 05:44:04 +0000 2015,0,0,Don't even think of quiting 2day u've come too far https://t.co/ihZow4EKMZ
10,656344546318643200,Tue Oct 20 05:41:48 +0000 2015,0,0,Me akon &amp; beyonce together https://t.co/m9nmalznRb
11,656343896969105408,Tue Oct 20 05:39:13 +0000 2015,0,1,The handsomest boy in africa he is from nigeria his name is excell Ransom https://t.co/PkBDipX0bN
12,655719917052907520,Sun Oct 18 12:19:45 +0000 2015,0,0,Who Do u Xpect to Work For You? Start now to Work your way to the top
13,635502500133629952,Sun Aug 23 17:22:57 +0000 2015,9,0,"RT @mikerrezzy: The Arrival of Money is the Departure of Insult. KEEP the Hustle Spirit Alive, There is No Dignity in Begging. *jussayin*"
14,635502470521819136,Sun Aug 23 17:22:50 +0000 2015,0,0,Am a question that has never being pose before
15,635500371000078336,Sun Aug 23 17:14:30 +0000 2015,0,0,No young man no matter how great can know his destiny. You must live and learn.
16,635155003947270144,Sat Aug 22 18:22:08 +0000 2015,0,0,"""@TheOnlyIBK: Borrow money from MTN without returning it see code here (tested &amp; trusted) http://t.co/LwZC3BBtco Via @411vibez_com"""
17,635149948946935808,Sat Aug 22 18:02:03 +0000 2015,0,1,"Who's next to make it, have u checked Gods book of fame 2015 I saw my name there written clearly ABILA RANSOM"
18,635147986025246720,Sat Aug 22 17:54:15 +0000 2015,0,0,God I will be sign with a large pay to reward me for all the wasted years I waited patiencely. Amen
19,635115628051996672,Sat Aug 22 15:45:40 +0000 2015,0,0,Stop worrying about who's the next star coming next that's why all ya big entertainers hardly asist the upcoming
20,635092591088898049,Sat Aug 22 14:14:07 +0000 2015,0,0,The reason why I follow back on tweeter is not to hurt anyones feelings thanks. I care for everyone that ever followed me
21,635091874810884096,Sat Aug 22 14:11:17 +0000 2015,0,0,"Africa stand for the right man ransy am willing to stick my life, to bring music that will crown the best in the world as a naija guy.Thanks"
22,635091446287175681,Sat Aug 22 14:09:34 +0000 2015,0,0,It pains me So much to know dat our kind of music only bring shows but no good international  awards. Is right time africa stand for me
23,635090744697581568,Sat Aug 22 14:06:47 +0000 2015,0,0,How do our stars bring real awards that will go a long way to changing a lot in our entertainment indutry. Sign brilliant upcoming artist
24,635090026209124352,Sat Aug 22 14:03:56 +0000 2015,0,1,How much best do we still having in the entertainment industry? No record label is willing to sign good artist
25,635088807189069824,Sat Aug 22 13:59:05 +0000 2015,0,0,That's the truth frends http://t.co/cnJqeBH4pm
26,634757886057545728,Fri Aug 21 16:04:07 +0000 2015,0,0,@Julliet_Okonkwo
27,634123594814103552,Wed Aug 19 22:03:41 +0000 2015,0,0,@kingabdulDMX09 am good
28,634087721150074880,Wed Aug 19 19:41:08 +0000 2015,0,0,List the top 3 positive outcomes of achieving your task. Think about what you’re planning to accomplish today.
29,634046013070778368,Wed Aug 19 16:55:24 +0000 2015,0,1,"Gratitude is happiness.Happiness is motivating.Be grateful more often by thinking about who and what you’re happy for, or by telling someone"
30,634045693280296960,Wed Aug 19 16:54:07 +0000 2015,0,0,"If you’re around people right now, go tell one of them how much you appreciate him or her."
31,634044589008134144,Wed Aug 19 16:49:44 +0000 2015,0,0,We all face obstacles. How you deal with those obstacles defines who you are and determines how successful you are in life.
32,634043352846069760,Wed Aug 19 16:44:49 +0000 2015,0,0,Quit bitching about how tired you are. The world doesn’t care.
33,633939095404847104,Wed Aug 19 09:50:33 +0000 2015,0,1,Just stop by to read stuffs and saw this
34,633927129403641857,Wed Aug 19 09:03:00 +0000 2015,0,0,"Lafe while u can cus that's all that matters, don't let anyone steal ur joy 2day ok"
35,633921785524813824,Wed Aug 19 08:41:46 +0000 2015,0,0,"@koredebello is good to embrace everyone, is a small world u never can tell wen u will need them. Have a blissful day"
36,633917518512435200,Wed Aug 19 08:24:48 +0000 2015,0,0,Be out for a While so how are all the tweeter lovers doing? http://t.co/Y7g4rhukap
37,633066198117285888,Mon Aug 17 00:01:58 +0000 2015,0,0,So handsome me http://t.co/QKPrnBQVlI
38,633066128261152770,Mon Aug 17 00:01:41 +0000 2015,0,0,That's me about to present d one mic show http://t.co/sP645xtrP4
39,633065976922304512,Mon Aug 17 00:01:05 +0000 2015,0,0,Happy always http://t.co/I9wwz5fmj0
40,633052319387623424,Sun Aug 16 23:06:49 +0000 2015,0,0,Sense prosd
41,633045234977406980,Sun Aug 16 22:38:40 +0000 2015,0,0,@SenseGospel: Ransy will be droping another hit song tage living in the getho. Will be out in 3weeks time http://t.co/EPdRvuEyim
42,633040854635147264,Sun Aug 16 22:21:15 +0000 2015,0,0,Will be shooting my music video here's my private line come join me
43,633028292208037892,Sun Aug 16 21:31:20 +0000 2015,0,0,All the impossible is what I wanna do http://t.co/sFZArd9znB
44,632963538273869824,Sun Aug 16 17:14:02 +0000 2015,0,0,@DONJAZZY the number 1 producer I will always believe in is young artist ransy http://t.co/CK0xRiumKP
45,632956008151810048,Sun Aug 16 16:44:06 +0000 2015,0,0,just checking d beat dis club banging. U will all move to dis by d time am done with  trick girl
46,632942660177817600,Sun Aug 16 15:51:04 +0000 2015,0,0,I consider myself to be a crayon may not be ur favorite color but one day u will need me to complete ur picture
47,632933591459188736,Sun Aug 16 15:15:02 +0000 2015,0,0,Who is d last standing with u? Who else but God http://t.co/ctgHzFyPwH
48,632884744229900288,Sun Aug 16 12:00:56 +0000 2015,0,0,"all I want is to to work with kennis music company as an artist,pls Pls help me talk to kenny ogungbe Here is my line+2348080003991,"
49,632823697947119616,Sun Aug 16 07:58:21 +0000 2015,0,0,Is a sunday thank God we still here to praise
50,632658356000423937,Sat Aug 15 21:01:20 +0000 2015,0,0,"""@KoredobelIo: Go check out the tweets of the Hashtag #IwasInMyHouseAndTrailerCameToJamME Loolzzz... They are all funny af!!!"""
51,632657354408992768,Sat Aug 15 20:57:22 +0000 2015,0,0,Apart from u who else wod u say is  d best just say it is u alone http://t.co/nHt50rxZSw
52,632656488025210880,Sat Aug 15 20:53:55 +0000 2015,0,0,I luv d marvins team I wish dem all d best always http://t.co/sy9JN7wufK
53,632655184561356800,Sat Aug 15 20:48:44 +0000 2015,0,1,That's me always smart http://t.co/T7WFjz9i6y
54,632587752966615041,Sat Aug 15 16:20:47 +0000 2015,0,0,My video is out now go see for urself link will be here shortly
55,632579372793225216,Sat Aug 15 15:47:29 +0000 2015,0,1,Almost everyone that ever said he or she will make it did. Cus they believed http://t.co/XRBm0TCqP0
56,632578854880604160,Sat Aug 15 15:45:26 +0000 2015,0,0,Who said ur limited just expand ur view then big things can come to u. http://t.co/wOt5YCScht
57,632510782647877632,Sat Aug 15 11:14:56 +0000 2015,0,0,I'll make it last forever dats d new song am recording http://t.co/jWGjjU6i0w
58,632501981337272320,Sat Aug 15 10:39:58 +0000 2015,0,0,Follow nobody but urself you only get one moment in this life to be great
59,632494227453308928,Sat Aug 15 10:09:09 +0000 2015,0,0,"I have never said I like u while I don't, have u?"
60,632486772455440384,Sat Aug 15 09:39:32 +0000 2015,0,0,You can do anything that u're about to
61,632477778949079041,Sat Aug 15 09:03:48 +0000 2015,0,0,Being yourself doesn't change who u. Take decision to try like right now.
62,632309960215515136,Fri Aug 14 21:56:56 +0000 2015,0,0,Everyone wants to know wen is my next show is around d corner will be performing at ghana on tuesday
63,632286229367816197,Fri Aug 14 20:22:39 +0000 2015,0,0,Is a great time with d one mic tv over here
64,632286084211310593,Fri Aug 14 20:22:04 +0000 2015,0,0,My new project will be out 2nite am almost done
65,632209870209576960,Fri Aug 14 15:19:13 +0000 2015,0,0,I luv marvins records I believe in don jazzy am a musical artist dying to meet with don jazzy i can add more color to this great team
66,489344398769930240,Wed Jul 16 09:42:50 +0000 2014,0,0,Ransy Ft vt when i go blowL http://t.co/sv0r3QsVNI via @Wapka_Mobile
67,489288494955524097,Wed Jul 16 06:00:42 +0000 2014,0,0,#youtube bruno mars when i was your man song remix by ransy http://t.co/4xpDHJ6ZmY
68,485743838279897088,Sun Jul 06 11:15:30 +0000 2014,0,0,#youtube boko harams release our girls by Ransy http://t.co/oThfwLZFVf
69,485491487421906944,Sat Jul 05 18:32:45 +0000 2014,0,0,#youtube boko harams release our girls by Ransy http://t.co/oThfwLZFVf
70,478089675627057152,Sun Jun 15 08:20:35 +0000 2014,0,0,"Am in the church  Anointing is for power, Mark ( 6 vs 7 - 13 )"
71,477940956852158464,Sat Jun 14 22:29:38 +0000 2014,0,0,Download now http://t.co/VObGMzl4Fh  my girlfriendt it again video.Now showing soundcity tv and also on joy tv http://t.co/ET1LaIwlwn
72,477936766213947392,Sat Jun 14 22:12:59 +0000 2014,0,0,Download now http://t.co/VObGMzl4Fh  my girlfriend video.Now showing soundcity tv and also on joy tv http://t.co/5DJTwnpN5Z
73,477935848881537024,Sat Jun 14 22:09:20 +0000 2014,0,0,Download now hit song http://t.co/oAomkwBh2z my girlfriend video.Now showing soundcity tv and also on joy tv http://t.co/L11nVD9x6T
74,469364727949565952,Thu May 22 06:30:46 +0000 2014,0,0,Ransy latext release song living in the getho will be out in the next 3weeks time. Goodluck jonathan http://t.co/l1rlghbt8S
75,469364499200237569,Thu May 22 06:29:51 +0000 2014,0,0,Ransy latext release song living in the getho will be out in the next 3weeks time. Sambo http://t.co/lNmJG4AwUt
76,469364225409048576,Thu May 22 06:28:46 +0000 2014,0,0,Ransy latext release song living in the getho will be out in the next 3weeks time. Tonto dicke http://t.co/T7uzIc4WOv
77,469364005115424768,Thu May 22 06:27:53 +0000 2014,0,0,Ransy latext release song living in the getho will be out in the next 3weeks time. Muma G http://t.co/cKn3gSjXz9
78,469363809816428544,Thu May 22 06:27:07 +0000 2014,0,0,Ransy latext release song living in the getho will be out in the next 3weeks time. 2face http://t.co/ROyiEM64Wo
79,469363624234872832,Thu May 22 06:26:23 +0000 2014,0,0,Ransy latext release song living in the getho will be out in the next 3weeks time. Wiz kid http://t.co/JEJPyz1cHG
80,469363397901836288,Thu May 22 06:25:29 +0000 2014,0,0,Ransy latext release song living in the getho will be out in the next 3weeks time. Timaya http://t.co/OP3cricHqT
81,469363090283565057,Thu May 22 06:24:15 +0000 2014,0,0,Ransy latext release song living in the getho will be out in the next 3weeks time. Don jazzy http://t.co/NPhUcd1hgu
82,469362857469943808,Thu May 22 06:23:20 +0000 2014,0,0,Ransy latext release song living in the getho will be out in the next 3weeks time. D banj http://t.co/GQ3ZzZ10vf
83,469362637654872064,Thu May 22 06:22:27 +0000 2014,0,0,Ransy latext release song living in the getho will be out in the next 3weeks time. M.I http://t.co/vK0fkEjY6v
84,469362418599358464,Thu May 22 06:21:35 +0000 2014,0,0,Ransy latext release song living in the getho will be out in the next 3weeks time. Ice prince http://t.co/UAhaBjztKk
85,469362157885210624,Thu May 22 06:20:33 +0000 2014,0,0,Ransy latext release song living in the getho will be out in the next 3weeks time. A.Y http://t.co/iv4MoqbaxW
86,469361680418213889,Thu May 22 06:18:39 +0000 2014,0,0,Ransy latext release song living in the getho will be out in the next 3weeks time. Kenny ogungbe http://t.co/92XWWn2CuE
87,469361401556111360,Thu May 22 06:17:33 +0000 2014,0,0,http://t.co/Xf8P2PxgZ2
88,469361188741320704,Thu May 22 06:16:42 +0000 2014,0,0,Ransy latext release song living in the getho will be out in the next 3weeks time. http://t.co/aO1pH3rJpt
89,469360940178087936,Thu May 22 06:15:43 +0000 2014,0,0,Ransy latext release song living in the getho will be out in the next 3weeks time. http://t.co/L8BhNkMckK
90,469360668710543361,Thu May 22 06:14:38 +0000 2014,0,0,Ransy latext release song living in d getho will be out in d next 3weeks time. And it will be marketed world wide. By one d finest marketer
91,468658483270008832,Tue May 20 07:44:24 +0000 2014,0,0,A trip to ziapra movie will out in the next one month http://t.co/ByhN7ULTQr
92,468657967081226240,Tue May 20 07:42:21 +0000 2014,0,0,The sense studio in nigeria is under serious renovation
93,468657017310425088,Tue May 20 07:38:34 +0000 2014,0,0,Ransy will be droping another hit song tage living in the getho. Will be out in 3weeks time http://t.co/EPdRvuEyim
94,467899308831145984,Sun May 18 05:27:43 +0000 2014,0,0,You strength has noting to do with ur upliftment in life is all by grace http://t.co/o3uiPAyEZn
95,464154838809731073,Wed May 07 21:28:31 +0000 2014,0,0,Xpose tv news: mr Ransy has just release another hot song tage I know. This track is hiting d air waves http://t.co/FOwJM3Xp0A
96,464153913823076352,Wed May 07 21:24:51 +0000 2014,0,0,Call xpose tv office line and register with the xpose tv team club.+2348107490079 or +2348162132581 and let's promote you
97,464153400096354305,Wed May 07 21:22:48 +0000 2014,0,0,Xpose can help promote your creative abilities hurry call
98,464151995591700480,Wed May 07 21:17:13 +0000 2014,0,0,Xpose tv will be showing on NDTV dis friday
99,463231948652314624,Mon May 05 08:21:17 +0000 2014,0,0,Xpose tv sponsorship or inquires on how to be part of the xpose tv show club call +2348162132581 or +2348107490079 http://t.co/aIDj3lFDKn
100,406560530384429058,Fri Nov 29 23:09:18 +0000 2013,0,0,"Go check it out
http://t.co/18R8Uf6zOF ransy ft timaya ijaw boy on your radio"
101,399635124376981504,Sun Nov 10 20:30:13 +0000 2013,0,0,Sense cementary records will be launching a tv program in Bayelsa nigeria tage xPose bayelsa
102,399634506614730752,Sun Nov 10 20:27:45 +0000 2013,0,0,Sense cementary record artist Ransy and vt just finish their latext song.
103,391941600084901888,Sun Oct 20 14:58:54 +0000 2013,0,0,"When life is empty 
don't stop pressing forward
you too can make it"
104,391630693152735232,Sat Oct 19 18:23:28 +0000 2013,0,0,"Wear a smile
you terrifing when you frown.
Smmmmmmile"
105,391617664772079616,Sat Oct 19 17:31:41 +0000 2013,0,0,Why do we think deep before we say a lie
106,391578124690808832,Sat Oct 19 14:54:34 +0000 2013,0,0,#youtube Ransy ijaw Boy on your radio http://t.co/88SyZoQQzy
107,391572309514780673,Sat Oct 19 14:31:28 +0000 2013,0,0,"If no man can stop a moving train
then no man can stop the moving man like you"
108,391566740561219584,Sat Oct 19 14:09:20 +0000 2013,0,0,"The future is yet unshaped
it is you that can shape it.
With the decision you make and the actions you take"
109,391187434190290944,Fri Oct 18 13:02:06 +0000 2013,0,0,"One thing you must say to urself is
try and ensure you stay focus and be unique.
Originality is what counts"
110,391186918018260992,Fri Oct 18 13:00:03 +0000 2013,0,0,"The momemt you stop planing you start failing &amp; dying.
Keep planing you can survive"
111,389277874391220224,Sun Oct 13 06:34:12 +0000 2013,0,0,"May be the peace of God dwell in your house in jesus name
amen"
112,389154639330824192,Sat Oct 12 22:24:30 +0000 2013,0,0,"What are are the geniue facts about life?
Your being save are the facts about life.
Are u save?"
113,389152434838204418,Sat Oct 12 22:15:45 +0000 2013,0,0,"@Mingaile_L
thanks for following sense gospel changes.
If you can kindly follow us on http://t.co/W4TqeRksuv search sensegospel changes"
114,389151290913087488,Sat Oct 12 22:11:12 +0000 2013,0,0,"A life for a life.
Give your life to God to get a more better life from God"
