,id_str,created_at,retweet_count,favorite_count,text
0,669307591353233408,Wed Nov 25 00:12:19 +0000 2015,0,2,“Does Trying to Be Happy Make Us Unhappy?” by .@AdamMGrant https://t.co/SrGOAGB0ov
1,669238443382181888,Tue Nov 24 19:37:33 +0000 2015,0,0,RT Half of Your Employees Are Shopping Instead of Working: A new study finds that office worke... https://t.co/wwV9wCC2l1 #Innovation #hr
2,669172993113722880,Tue Nov 24 15:17:28 +0000 2015,1,0,"RT @Avionte: 10 years, 10,000 users and one continuously evolving #staffing software solution: that's Avionte Staffing Software. https://t.…"
3,669115582340460544,Tue Nov 24 11:29:21 +0000 2015,0,0,"RT What if…: Stop asking, “What about?” Start asking, “What if?” What if the people you’re trying ... https://t.co/NBhKMGmNy6 #leadership"
4,668905520967774208,Mon Nov 23 21:34:38 +0000 2015,0,1,"PG2 Blog HR and the Trends for 2016: Every year, businesses are faced with new challenges that w... https://t.co/J0DGtROvha @peopleg2 #hr"
5,668898183804645376,Mon Nov 23 21:05:29 +0000 2015,2,1,HR and the Trends for 2016 https://t.co/M3iNkxdd2U via @peopleg2
6,668874800530501632,Mon Nov 23 19:32:34 +0000 2015,0,2,"RT A Navy SEAL's 7 Tips for Managing Fear Through Adaptive Change: ""The ability to control my ... https://t.co/FWAhxjIeEU #Innovation #hr"
7,668835560123817986,Mon Nov 23 16:56:38 +0000 2015,0,0,Loved being a part of the project and contributing a few parts!!! #book #business #hr #employment #recruiting  https://t.co/cCaX9YXNO1
8,668835061945380864,Mon Nov 23 16:54:39 +0000 2015,0,2,The Virtue of Contradicting Ourselves https://t.co/GGzhPLNOEF .@AdamMGrant #leadership #goodread #hr #talenttalk #flipflop
9,668797598187155457,Mon Nov 23 14:25:47 +0000 2015,0,0,RT 3 Strategies to Fuel Vitality and Eliminate Gossip: Gossip makes weak leaders feel powerful. It... https://t.co/64gdNMyPiE #leadership
10,668666136389488641,Mon Nov 23 05:43:24 +0000 2015,1,0,"RT Will MacAskill on Effective Altruism, Y Combinator, and Artificial Intelligence: Will Mac... https://t.co/zaCuYlW1TF @chrisdyer7 #4HWW"
11,668666136351801345,Mon Nov 23 05:43:24 +0000 2015,1,0,"RT Will MacAskill on Effective Altruism, Y Combinator, and Artificial Intelligence: Will Mac... https://t.co/FtwAYg3UBm @chrisdyer7 #4HWW"
12,668645117264138241,Mon Nov 23 04:19:53 +0000 2015,1,0,RT @alisecortez: @peopleG2 @chrisdyer7 gave an interesting and thought-provoking interview. An absolute pleasure to connect with him!
13,668644764124745728,Mon Nov 23 04:18:29 +0000 2015,1,0,"RT @peopleG2: Get your copy of ""Get Scrappy"" today  https://t.co/YsoyMLDgIx @daveberkus @kimshepherd_DT @chrisdyer7"
14,668539086961967104,Sun Nov 22 21:18:33 +0000 2015,0,1,RT The 7 Powers of Weakness: Don’t wait until you have it “all together” to lead. Arrogant leaders... https://t.co/VABU0Xr8qY #leadership
15,668532717974241280,Sun Nov 22 20:53:15 +0000 2015,0,1,Who will win? https://t.co/7Xv2k4Eiu8
16,668532688840585216,Sun Nov 22 20:53:08 +0000 2015,0,1,Chargers!!! https://t.co/Lsfg8ZnW50
17,668503191680454656,Sun Nov 22 18:55:55 +0000 2015,0,1,RT Here's Proof That Many CEOs Are A Waste Of Money: Researchers at the London School of Econo... https://t.co/7lJtYtjws9 #Innovation #hr
18,668124906563833856,Sat Nov 21 17:52:45 +0000 2015,1,3,"RT 7 Surprising Strategies that Elevate Leaders: Fools see lack of wisdom in others, not in themse... https://t.co/9QqT6SLkNd #leadership"
19,667868200172830720,Sat Nov 21 00:52:41 +0000 2015,1,3,RT Mark Zuckerberg Plans to Take 2 Months of Paternity Leave: The Facebook CEO called the deci... https://t.co/EmJA1O1qvD #Innovation #hr
20,667800912103100416,Fri Nov 20 20:25:19 +0000 2015,0,0,Here is the latest #TalentTalk podcast. https://t.co/gI4yEE1t0D on #Podbean
21,667754247715352576,Fri Nov 20 17:19:53 +0000 2015,1,0,How Friendships Change When You Become an Adult https://t.co/4iyvXDzkWs
22,667738664391192576,Fri Nov 20 16:17:58 +0000 2015,2,0,RT @fifthlawband: Socal fans join us Dec 5th for our EP release party and concert: https://t.co/KS0hAfyTFW #newmusic #oc #livemusic #concer…
23,667504005291966465,Fri Nov 20 00:45:31 +0000 2015,0,0,"RT How to Become a Household Name in Your Niche: The more well known you are, the more money y... https://t.co/k2nK2SSE8j #Innovation #hr"
24,667470833116299265,Thu Nov 19 22:33:42 +0000 2015,1,1,Are you Generous? https://t.co/5hb8vZ7MeV #life #ExampleLeadership #hiring #jobs
25,667376241889034241,Thu Nov 19 16:17:49 +0000 2015,1,1,Google Has Discovered The 5 Key Traits Employees Need To Succeed https://t.co/0NVzPEI2I1
26,667359683640868864,Thu Nov 19 15:12:02 +0000 2015,0,0,"RT One Key Practice that Develops Character: Character is repetition. Aristotle said, “We are what... https://t.co/H6kMqHuujg #leadership"
27,667141251460784128,Thu Nov 19 00:44:03 +0000 2015,0,4,RT De Gustibus Cooking School’s Recipe for Success.: Learn how continuity stayed on the menu a... https://t.co/MteFWRfqIR #Innovation #hr
28,667015722145550336,Wed Nov 18 16:25:15 +0000 2015,0,0,Here is the latest #TalentTalk podcast. https://t.co/C6XnPiIpcO on #Podbean
29,666980169870131200,Wed Nov 18 14:03:59 +0000 2015,0,1,"RT The 7 Practices of Curious Leaders: Lack of curiosity is deadly in changing times. Vision, cour... https://t.co/Z9QkrgtyvB #leadership"
30,666793799931158528,Wed Nov 18 01:43:24 +0000 2015,0,1,RT 7 Surprising Question to Measure Your Leadership: You can’t know how you’re doing until you’re ... https://t.co/21daHlluAE #leadership
31,666775871315771393,Wed Nov 18 00:32:10 +0000 2015,0,2,"RT The Marketing Mastery of Missy Elliott: As an artist, she nails the details--and puts her o... https://t.co/KRcgDIrcge #Innovation #hr"
32,666664205513175042,Tue Nov 17 17:08:27 +0000 2015,0,0,Does being self-deprecating help or harm you socially? https://t.co/Y7uZm1mRGn via @hopesandfearsHQ #really #life #getbetter
33,666505765218222080,Tue Nov 17 06:38:52 +0000 2015,0,0,"RT Kevin Costner: The Near-Death Audition, Work Ethic, and The Explorers Guild: 
“When I art... https://t.co/ntaFwANfll @chrisdyer7 #4HWW"
34,666505765184602112,Tue Nov 17 06:38:52 +0000 2015,0,0,"RT Kevin Costner: The Near-Death Audition, Work Ethic, and The Explorers Guild: 
“When I art... https://t.co/NgLnU0Eq0H @chrisdyer7 #4HWW"
35,666434224866459648,Tue Nov 17 01:54:35 +0000 2015,0,0,@mgrossi1 my tweets tend to be about business and employee engagement.  For some reason the politics seem to be left for Facebook.
36,666412951234998275,Tue Nov 17 00:30:03 +0000 2015,0,2,RT Equity Crowdfunding by the Numbers: A dive into the statistics and lessons from the first t... https://t.co/8C3Gl27wTN #Innovation #hr
37,666397615542538240,Mon Nov 16 23:29:07 +0000 2015,0,0,RT Sudden Breakthroughs in Subtle Blind Spots: Successful leaders have the wonderful capacity to t... https://t.co/uL4ezJys7e #leadership
38,666363946039775233,Mon Nov 16 21:15:19 +0000 2015,0,0,"PG2 Blog Ban the Box Movement Comes to Nashville, TN: If you are hiring in Nashville, TN, it’s i... https://t.co/CZJfZJSyPr @peopleg2 #hr"
39,666343352229429248,Mon Nov 16 19:53:29 +0000 2015,0,1,"Ban the Box Movement Comes to Nashville, TN https://t.co/J63U1sUbEz via @peopleg2 #nashville #hr #employment #law #hrnews"
40,666301705278001152,Mon Nov 16 17:08:00 +0000 2015,1,0,So glad it is finally permeating into the education scene such small changes have such a gigantic impact in others.  https://t.co/OdMNqZgFnH
41,666084566327648256,Mon Nov 16 02:45:10 +0000 2015,4,5,Nobody Cares How Hard You Work https://t.co/7Kc0BgQPtn via .@99u #work #employment #hr #engagement
42,666072107319586816,Mon Nov 16 01:55:40 +0000 2015,2,1,RT Secrets That Elevate the Journey to Adventure: Stop giving your future away. Own your journey. ... https://t.co/Bi0w4kQF03 #leadership
43,666049247708491776,Mon Nov 16 00:24:49 +0000 2015,1,1,RT How Online Reputation Management Is Giving You a Second Chance Thanks to This Company: One ... https://t.co/3tw57bzl5t #Innovation #hr
44,665655415154147329,Sat Nov 14 22:19:52 +0000 2015,3,2,"RT With the Release of the iPhone 6, are Other Cameras Still Needed?: Our phone can do more th... https://t.co/P2OB7Zrmin #Innovation #hr"
45,665580221127495680,Sat Nov 14 17:21:05 +0000 2015,2,1,RT The 10 Strategies of Obnoxious Leaders: Don’t expect people the people you complain about to fo... https://t.co/tme0oAVdF9 #leadership
46,665292519530303488,Fri Nov 13 22:17:51 +0000 2015,1,2,RT Why You Need to Avoid Conformity in Your Workplace: If you want a company that pulses with ... https://t.co/17CTxjH1Fp #Innovation #hr
47,665262550347452416,Fri Nov 13 20:18:46 +0000 2015,0,0,PG2 Blog On the Job Promotion and Training with Rick Gillis and Robert David: Hosted by Chris Dy... https://t.co/EDXTLy3p9o @peopleg2 #hr
48,665241161192222720,Fri Nov 13 18:53:47 +0000 2015,0,1,On the Job Promotion and Training with @rickgillis and Robert David https://t.co/gEXGcAJlc0 via .@peopleg2 #hr #jobs #getbetter #talenttalk
49,665210170532757505,Fri Nov 13 16:50:38 +0000 2015,1,2,RT How to Eliminate Stupid Rules: The stupid things I’ve done were done sincerely. I thought I was... https://t.co/9dUoQXWYZn #leadership
50,665180909625176065,Fri Nov 13 14:54:21 +0000 2015,0,0,Do you like your job?
51,664930722260611072,Thu Nov 12 22:20:12 +0000 2015,0,0,Here is the latest #TalentTalk podcast. https://t.co/phpQ6nqPM1 on #Podbean
52,664929463998771204,Thu Nov 12 22:15:12 +0000 2015,0,0,Here is the latest #TalentTalk podcast. https://t.co/QXcTk8MNr2 on #Podbean
53,664928212992917504,Thu Nov 12 22:10:14 +0000 2015,2,2,RT 5 Ways to Get More Leads From Speaking: Turn thought leadership into lead gen https://t.co/fk5mMRp13a #Innovation #hr
54,664818564415684608,Thu Nov 12 14:54:32 +0000 2015,0,0,RT 7 Ways to Defeat Complexity: The simplest way to get something done is do it yourself. Don’t de... https://t.co/86tAaZCAJS #leadership
55,664537835190415360,Wed Nov 11 20:19:01 +0000 2015,0,0,RT Don't Underestimate the Value of your Brand: You must always remember that the brand is mor... https://t.co/1Dip2lkkST #Innovation #hr
56,664485338669146112,Wed Nov 11 16:50:24 +0000 2015,0,0,"RT You Have What You Seek: To get where you want to go, move toward your authentic leadership. The... https://t.co/VxJ8UrP0hU #leadership"
57,664265283389886465,Wed Nov 11 02:15:59 +0000 2015,2010,13,A great book by .@KimShepherd_DT @daveberkus Get Scrappy: Business insights to make your company more agile https://t.co/J4Z7KmMQRF #hr #CEO
58,664193585483374592,Tue Nov 10 21:31:05 +0000 2015,1,1,"RT How Philosophy Can Change Your Life, Alain de Botton: 
“We’re not very good at understand... https://t.co/VL2LYJ12Y8 @chrisdyer7 #4HWW"
59,664172612780556288,Tue Nov 10 20:07:45 +0000 2015,0,0,"RT Here's How Facebook's Product Design Head Gets All Her Work Done: Julie Zhuo, director of p... https://t.co/5JN17l3eYd #Innovation #hr"
60,664057956233687040,Tue Nov 10 12:32:09 +0000 2015,0,0,"RT 7 Ways to Stop Being Hardheaded: Failure is the result of inflexibility, but so is success. Tho... https://t.co/8CscMt5CBd #leadership"
61,663811367384670208,Mon Nov 09 20:12:17 +0000 2015,2,0,RT @fifthlawband: Surrender me getting some final touches. https://t.co/QV6MIJVH1V
62,663804637133180929,Mon Nov 09 19:45:33 +0000 2015,0,1,PG2 Blog FCRA Violations Cost Two Companies $13 million: Two well-known background check compani... https://t.co/clSmD7W2CD @peopleg2 #hr
63,663780152925548544,Mon Nov 09 18:08:15 +0000 2015,0,0,RT 4 Reasons to Push Fears Aside and Change Your Story: Push past your fears and own your future. https://t.co/VjGEhSLw42 #Innovation #hr
64,663742139654799360,Mon Nov 09 15:37:12 +0000 2015,2,0,RT Only 15% of Top Performers are High Potentials: Your ability to cultivate people determines you... https://t.co/aMjiESPkZD #leadership
65,663626099633491968,Mon Nov 09 07:56:06 +0000 2015,0,1,"RT I Felt on the Spot During Q&amp;A: I felt on the spot after a recent presentation. During the Q&amp;A, ... https://t.co/0IAOvZz1AN #leadership"
66,663578078635884544,Mon Nov 09 04:45:17 +0000 2015,2,0,RT @fifthlawband: Almost there! #unsignedartist #fundaysunday #music #newmusic https://t.co/IGMUkAX4g0
67,663578066329800705,Mon Nov 09 04:45:14 +0000 2015,2,0,RT @fifthlawband: More studio time. https://t.co/6mND4HI5hX
68,663578053654638592,Mon Nov 09 04:45:11 +0000 2015,1,0,RT @fifthlawband: .@chrisdyer7 getting his acoustic on https://t.co/EqnViBEiUz
69,663578037271683072,Mon Nov 09 04:45:07 +0000 2015,1,0,"RT @fifthlawband: Shhhhh, Chris is concentrating. https://t.co/jsCgNIR25I"
70,663578002370904064,Mon Nov 09 04:44:59 +0000 2015,1,0,RT @fifthlawband: Let’s get the final touches done https://t.co/SbrOkLDSxu
71,663577983815258113,Mon Nov 09 04:44:54 +0000 2015,1,0,RT @fifthlawband: Surrender me sounds great! #music #unsignedartist #fundaysunday #recording #rad #band #oc #alternative #altnation https:/…
72,663416042815787008,Sun Nov 08 18:01:24 +0000 2015,0,0,"RT Flakka: The New Illegal Drug You Need To Know About: A dangerous, new drug is spreading acr... https://t.co/qXIOx3rfbP #Innovation #hr"
73,663086792984236032,Sat Nov 07 20:13:05 +0000 2015,0,0,RT Solution Saturday: Stress Free Problem-Solving: Too much problem-solving is a problem. Dis-empo... https://t.co/BDOerZcVgg #leadership
74,663052358901850112,Sat Nov 07 17:56:15 +0000 2015,1,1,RT 12 Little Steps That Lead You to Your Happy Place: Happy people are more successful people.... https://t.co/fmFO1GIWCy #Innovation #hr
75,663044907418808320,Sat Nov 07 17:26:39 +0000 2015,2,0,RT @fifthlawband: Our next show is December 5th.  Join us: https://t.co/KS0hAfyTFW #music #fullerton #oc #concert https://t.co/ypirnkmokY
76,663044811352469504,Sat Nov 07 17:26:16 +0000 2015,1,0,RT @fifthlawband: We should be recording.  But day 1 is a lot of setup #studio #rock #music #recording #orangecounty https://t.co/VumCeKHWiQ
77,662790803916390400,Sat Nov 07 00:36:56 +0000 2015,0,3,Can't wait.  Tonight we begin recording our first EP .@fifthlawband I have the best band mates in the world.
78,662688945449230336,Fri Nov 06 17:52:11 +0000 2015,2,0,RT 3 Tips for Ensuring a Smooth Maternity Leave: Address any concerns you may have with your e... https://t.co/NJ3myP59ri #Innovation #hr
79,662643224956108807,Fri Nov 06 14:50:30 +0000 2015,0,1,"Play this in the car.  .@Coldplay has gone #disco, and I love it: https://t.co/DV1PxUUa6T"
80,662601655536349185,Fri Nov 06 12:05:19 +0000 2015,2,2,RT 12 Ways to Rise After Being Thrown Under the Bus: Every leader has a few tread-marks on their b... https://t.co/HUTpMoMFIM #leadership
81,662483637082820608,Fri Nov 06 04:16:22 +0000 2015,0,0,Congrats Mike.  Proud of you! https://t.co/ICDSRK8hFe
82,662469871465172992,Fri Nov 06 03:21:40 +0000 2015,0,2,Congrats to my little brother Michael!  Officially a sheriff.  Way to work hard and reach your goal!! https://t.co/zx5cSyCJZZ
83,662325243256504320,Thu Nov 05 17:46:58 +0000 2015,1,2,RT 10 Secret Communication Skills of Top Leaders: Poor communication trickles down through org... https://t.co/L9dfJLnIVa #Innovation #hr
84,662321541128974336,Thu Nov 05 17:32:15 +0000 2015,2,0,"RT How to Travel the World for Free (And Win $4,000+ Worth of Prizes, Plus a Private Q&amp;A): 
... https://t.co/2FLXX1tWQA @chrisdyer7 #4HWW"
85,662290834134405124,Thu Nov 05 15:30:14 +0000 2015,2,0,"RT @peopleG2: A great article regarding the challenges of a virtual work environment.
https://t.co/7VPfj42RNd @tkalogeropoulos @chrisdyer7 …"
86,662252888991764480,Thu Nov 05 12:59:27 +0000 2015,2,1,RT The CEO of Ace® Hardware on Leadership: I asked the CEO of the largest home improvement franchi... https://t.co/964776PhkB #leadership
87,661959567903887360,Wed Nov 04 17:33:54 +0000 2015,1,0,"RT 3 Signs It’s Time To Automate: Some things can't be avoided, but they can be automated. https://t.co/kU0u2naNOG #Innovation #hr"
88,661906617898700800,Wed Nov 04 14:03:29 +0000 2015,0,2,RT You Don’t Have to be Man’s Best Friend: Everyone disdains leaders who are in it just for themse... https://t.co/pdz1h06QsU #leadership
89,661683251119951872,Tue Nov 03 23:15:55 +0000 2015,1,2,"PG2 Blog Ban the Box for Federal Government Employees: On November 2, President Obama issued an ... https://t.co/5koMHkIqVV @peopleg2 #hr"
90,661640390823378944,Tue Nov 03 20:25:36 +0000 2015,0,0,Ban the Box for Federal Government Employees https://t.co/81AiixNLjv via @peopleg2 #employment #hr #government #POTUS
91,661596110289575936,Tue Nov 03 17:29:39 +0000 2015,0,2,"RT Why Your Company's Name Isn't Important at All: Gary Vaynerchuk, CEO of digital agency Vayn... https://t.co/G2qFpapZkM #Innovation #hr"
92,661591135303786496,Tue Nov 03 17:09:53 +0000 2015,0,0,"RT Dom D’Agostino on Fasting, Ketosis, and the End of Cancer: 
“The FDA may see ketones as a... https://t.co/aWN9b0GhTR @chrisdyer7 #4HWW"
93,661232365155454976,Mon Nov 02 17:24:15 +0000 2015,1,1,RT How this Startup Secured a Partnership with Facebook: https://t.co/JWXeK5BHgc CEO Matt Willia... https://t.co/M3AISr65Xp #Innovation #hr
94,661221884025896960,Mon Nov 02 16:42:36 +0000 2015,1,0,RT Rethinkers Are Stinkers: One member of my team called my ability to rethink decisions frustrati... https://t.co/y3BoXRC6fA #leadership
95,660869130812133376,Sun Nov 01 17:20:53 +0000 2015,0,0,RT Startup Jargon You Should Stop Using Now: Here are some of the jargon words that we use in ... https://t.co/W5IxL1nuxT #Innovation #hr
96,660661997634064385,Sun Nov 01 03:37:49 +0000 2015,0,0,Happy Halloween! https://t.co/gJftds9l5t
97,660553404943499264,Sat Oct 31 20:26:18 +0000 2015,0,0,"RT Solution Saturday: Afraid to Leap: Dear Dan, How can I overcome my fear of taking on new challe... https://t.co/j7Mmxi3L1s #leadership"
98,660475757861302272,Sat Oct 31 15:17:46 +0000 2015,1,2,"RT 7 Things Well-Liked People Always Do: They like you, they really like you! Or do they? Like... https://t.co/EOTjreqTY0 #Innovation #hr"
99,660208950051115008,Fri Oct 30 21:37:34 +0000 2015,0,3,PG2 Blog Employee Engagement and Company Culture with Dr. Karen Robinson and Rodd Wagner: Hosted... https://t.co/C3p2Y6M25r @peopleg2 #hr
100,660113015769968641,Fri Oct 30 15:16:21 +0000 2015,1,1,RT 14 Things Successful People Do First Thing in the Morning: Early mornings can make people f... https://t.co/fo9FnQwwUL #Innovation #hr
101,660061294590980096,Fri Oct 30 11:50:50 +0000 2015,0,0,RT The 4 Powers of Respect and How to Earn Them: Being respected is better than being liked. Those... https://t.co/icEGpTuzYO #leadership
102,659933344025587712,Fri Oct 30 03:22:24 +0000 2015,0,0,"@SurfaceSupport I called, they said no more in stock and to call AMAZON."
103,659933175251013632,Fri Oct 30 03:21:44 +0000 2015,0,0,@BestBuySupport surface pro 2
104,659917215957843969,Fri Oct 30 02:18:19 +0000 2015,0,1,RT How to Say “No” When It Matters Most (or “Why I’m Taking a Long ‘Startup Vacation'”): (Ph... https://t.co/SYZlZsjoVL @chrisdyer7 #4HWW
105,659917215915859968,Fri Oct 30 02:18:19 +0000 2015,0,0,RT How to Say “No” When It Matters Most (or “Why I’m Taking a Long ‘Startup Vacation'”): (Ph... https://t.co/eN4Yd5pbnA @chrisdyer7 #4HWW
106,659856154575532032,Thu Oct 29 22:15:41 +0000 2015,0,0,"@SurfaceSupport Best Buy, all told me they had none and to go to AMAZON.  I bought several generics as no exact replacement was being sold"
107,659855948047974404,Thu Oct 29 22:14:52 +0000 2015,0,0,@SurfaceSupport plugged it into the wall and the adapter started crackling and smoking.  Had it for close to a year.  Called stores and
108,659839677696987136,Thu Oct 29 21:10:13 +0000 2015,0,0,Here is the latest #TalentTalk podcast. https://t.co/JOc1ieSdzC on #Podbean
109,659749645011152899,Thu Oct 29 15:12:27 +0000 2015,2,0,RT How to Start a Company That Doesn’t Suck: Majority of the startups are doomed to fail. This... https://t.co/B28rVGB5lY #Innovation #hr
110,659686146050424833,Thu Oct 29 11:00:08 +0000 2015,0,0,RT Solving The 12 Dumbest Things Leaders Do: The most important thing you do happens after you do ... https://t.co/50mf8vaQxo #leadership
111,659531716474736640,Thu Oct 29 00:46:29 +0000 2015,2,4,"PG2 Blog HR Strategies and Entrepreneurship: Hosted by Chris Dyer, the CEO of PeopleG2 – TalentT... https://t.co/YPoKAV60WG @peopleg2 #hr"
112,659510060356210688,Wed Oct 28 23:20:26 +0000 2015,1,1,HR Strategies and Entrepreneurship https://t.co/kFTd14cr9Z via @peopleg2
113,659501383133978624,Wed Oct 28 22:45:57 +0000 2015,0,1,"@Avionte Wish I could have been there, we could have jammed a few songs!"
114,659385019656343553,Wed Oct 28 15:03:34 +0000 2015,1,1,RT Stop Neglecting the One Investment That Can Kickstart Your Business: Early-stage entreprene... https://t.co/xQo2LP0LAZ #Innovation #hr
115,659352166977503232,Wed Oct 28 12:53:01 +0000 2015,1,1,"RT I’m Afraid I’ll Be Alone: I asked a group about their fears. She said, “I’m afraid I’ll be alon... https://t.co/afgcgtBtDc #leadership"
116,659156207437934592,Tue Oct 27 23:54:21 +0000 2015,1,1,#TalentTalk with Bjorn Erland and Pamela Wasley A great past show.  Here how Taco Bell is engaging its workforce.  https://t.co/CDdr3bCLCs
117,659129212213657601,Tue Oct 27 22:07:04 +0000 2015,0,1,"RT How Casey Neistat Gets Away With Murder: 
“What is the ultimate quantification of success... https://t.co/U8ObY4LfP1 @chrisdyer7 #4HWW"
118,659040642035638272,Tue Oct 27 16:15:08 +0000 2015,0,0,"RT How to Stop Bristling at Feedback: Leaders rarely say, “I’d like your feedback.” It’s even more... https://t.co/ox8wLyFxfR #leadership"
119,659040407028809728,Tue Oct 27 16:14:12 +0000 2015,0,0,My surface AC adapter broke.  I'm relegated to working on the iPad.  I feel like it is 2009.
120,659029340072448000,Tue Oct 27 15:30:13 +0000 2015,0,0,"Always good to see a list of what not to do, every so often: https://t.co/DBVRXoMLQc #leader #behavior #CEO #BetterStartsNow @superbetter"
121,659021163964686337,Tue Oct 27 14:57:44 +0000 2015,0,0,"RT How to Reach More Customers Without Taking on Risk: Alli Webb, founder of Drybar, explained... https://t.co/QU4SBKVgGm #Innovation #hr"
122,658679462137999360,Mon Oct 26 16:19:56 +0000 2015,2,0,RT @fifthlawband: Track Fifth Law on Bandsintown for local concert alerts! https://t.co/Ypx1c1xs0R
123,658658446267445248,Mon Oct 26 14:56:25 +0000 2015,2,3,RT 3 Reasons You Shouldn't Fear Your Competitors: How many of your business decisions are driv... https://t.co/1dVepf69hT #Innovation #hr
124,658652563206615040,Mon Oct 26 14:33:02 +0000 2015,0,0,"RT The Leadership Pursuit that Enhances All Others: Short-sighted leaders love giving feedback, bu... https://t.co/9Dh9i0gELI #leadership"
125,658418287785586688,Sun Oct 25 23:02:07 +0000 2015,1,1,"RT Trust is Given Not Earned: I’m trying to navigate an offensive idea. Bob Chapman* told me, “Tru... https://t.co/jEYPWIBNwg #leadership"
126,658294046910119936,Sun Oct 25 14:48:25 +0000 2015,1,1,"RT Let's Now Mourn a Man Whose Company Served Millions of Entrepreneurs: Tom Stemberg, founder... https://t.co/4yLZZGjkp8 #Innovation #hr"
127,658098988554448897,Sun Oct 25 01:53:20 +0000 2015,0,1,"RT Thinking About Extra Dimensions with Physicist Lisa Randall: Physics professor, Lisa Rand... https://t.co/Kb3SbtMFd6 @chrisdyer7 #4HWW"
128,657931160526282752,Sat Oct 24 14:46:27 +0000 2015,2,1,RT 15 Cheap Work-Life Hacks for Small Businesses: A set of cool tech-tools to make your life a... https://t.co/q7NtgehhZ8 #Innovation #hr
129,657641477229707265,Fri Oct 23 19:35:21 +0000 2015,1,0,Here is the latest #TalentTalk podcast. https://t.co/SpoEcqh5R8 on #Podbean
130,657533088461778946,Fri Oct 23 12:24:39 +0000 2015,2,0,RT How Sincere Leaders Sabotage Organizations: You are engaged in harmful behaviors that don’t ser... https://t.co/1yPsJPMpS8 #leadership
131,657447531220066304,Fri Oct 23 06:44:40 +0000 2015,1,1,RT 3 Ways Millennial Solopreneurs Are Different: Young workers might be flocking to freelancin... https://t.co/76qQRzdWrf #Innovation #hr
132,657303937926586368,Thu Oct 22 21:14:05 +0000 2015,1,0,RT @peopleG2: Thank you @CHRMA for having @chrisdyer7 speak at your Conference. Happy to help with further events or activities. #hr
133,657255155876954112,Thu Oct 22 18:00:15 +0000 2015,0,1,Here is the latest #TalentTalk podcast. https://t.co/9lcg6I22n0 on #Podbean
134,657253573370122240,Thu Oct 22 17:53:57 +0000 2015,0,1,"PG2 Blog The Art of Talent Acquisition and the Science of Learning: Hosted by Chris Dyer, the CE... https://t.co/0anoejU5jf @peopleg2 #hr"
135,657242389594005504,Thu Oct 22 17:09:31 +0000 2015,0,0,Appreciate the .@ocregister mentioning my recent executive hire Jim Hall @peopleg2 https://t.co/tNQP6EuY8y
136,657214445408514048,Thu Oct 22 15:18:28 +0000 2015,0,1,"RT Nicknames Your Boss Deserves But You Don’t Dare to Use: Before you read this post, let me offer... https://t.co/CPGJdMyU0m #leadership"
137,657083156164579328,Thu Oct 22 06:36:47 +0000 2015,0,0,RT 100 Things Unprofessional People Never Stop Saying (Ever): Others judge you by what you say... https://t.co/Rvt2GjVWTE #Innovation #hr
138,657007162200166400,Thu Oct 22 01:34:48 +0000 2015,1,0,RT @peopleG2: CEO Chris Dyer &amp; Nat. Sales Manager Beth Mirsky at the @CHRMA Conference. @chrisdyer7 #PeopleG2 @shrm #hr https://t.co/mUI9gU…
139,656987879856443392,Thu Oct 22 00:18:11 +0000 2015,0,0,Background Check Lawsuits Continue to Grow https://t.co/bERFVUqSop via @peopleg2 #hr #backgroundcheck #compliance #legal #business
140,656913630227632128,Wed Oct 21 19:23:08 +0000 2015,0,0,"PG2 Blog Background Check Lawsuits Continue to Grow: A background check is a small, but integral... https://t.co/9n5XPNgCYu @peopleg2 #hr"
141,656841341930876928,Wed Oct 21 14:35:54 +0000 2015,1,1,RT How to Develop Feelings of Curiosity: In order to develop a quality or skill it must be distill... https://t.co/5KLUqfdyKb #leadership
142,656732904773423104,Wed Oct 21 07:25:00 +0000 2015,0,1,"RT The Athlete (And Artist) Who Cheats Death, Jimmy Chin: 
“I’m the laziest motivated person... https://t.co/uHfjbyjemV @chrisdyer7 #4HWW"
