,id_str,created_at,retweet_count,favorite_count,text
0,666337548394983426,Mon Nov 16 19:30:26 +0000 2015,2,7,"Don't strive to be better than someone, instead, strive to be better than your former self."
1,664125095527489541,Tue Nov 10 16:58:56 +0000 2015,1,1,"Remember, that when you ask for advice, the carrot farmer will always point the way with a carrot. ↗"
2,660850263918551040,Sun Nov 01 16:05:55 +0000 2015,7,8,"If at first you don't succeed,  skydiving probably isn't for you."
3,660157406257762304,Fri Oct 30 18:12:45 +0000 2015,8,6,"When you can fully trust yourself, then you'll truly know how to live."
4,659804877938364417,Thu Oct 29 18:51:56 +0000 2015,9,17,"""Only he who can see the invisible can do the impossible."" - Frank Gaines #motivation #quotes #goals https://t.co/3xza2ta7wZ"
5,651506057160749056,Tue Oct 06 21:15:23 +0000 2015,7,17,"""We travel not to escape life, but for life not to escape us."" -Unknown http://t.co/K70r0yLV3p"
6,631904716163710976,Thu Aug 13 19:06:39 +0000 2015,23,21,"""If you don't build your dream, someone else will hire you to help them build theirs.""

-- Dhirubhai Ambani,"
7,628739298762838016,Wed Aug 05 01:28:24 +0000 2015,8,7,"""All great things are simple, and many can be expressed in single words:  freedom, justice, honor, duty, mercy, and hope."" Winston Churchill"
8,626540766119096320,Wed Jul 29 23:52:13 +0000 2015,3,8,"I once had perfect and it was fun, but now I want fun, it'll be perfect!
#marcsalveson #quote #fun #perfect #perfection"
9,613377928148160512,Tue Jun 23 16:07:48 +0000 2015,11,21,We must live the truths we uncover. It won't do any good to keep reading the treasure map. We must dig!
10,608472195136933889,Wed Jun 10 03:14:10 +0000 2015,15,36,"We are like the deep sea. Even though a storm is on the surface, we can always find that deep calm stillness. And all storms eventually pass"
11,595621548234547201,Tue May 05 16:10:17 +0000 2015,19,26,Your #life will shrink or expand in direct proportion to your #courage .
12,593238234450284544,Wed Apr 29 02:19:51 +0000 2015,17,33,"The world breaks everyone and afterward many are strong at the broken places.""

-- Ernest Hemingway,"
13,589427470987874304,Sat Apr 18 13:57:14 +0000 2015,17,29,"""If you are irritated by every rub, how will your mirror be polished?""

-- Rumi,

#rumi #quote"
14,573949239363047425,Fri Mar 06 20:52:16 +0000 2015,11,30,"Most people never run far enough on their first wind, to ever find their second one."
15,569972171247902721,Mon Feb 23 21:28:49 +0000 2015,22,38,"If you don't believe in magic, then you live in a world with no magic."
16,567766727808819200,Tue Feb 17 19:25:11 +0000 2015,19,29,There are stars whose radiance is visible on Earth long after they've been extinct. There are people who light the world the same way.
17,566076264893935616,Fri Feb 13 03:27:53 +0000 2015,27,39,Nothing can bother you as much as your own mind. http://t.co/zr3Sx7mxSh
18,561246793317777408,Fri Jan 30 19:37:17 +0000 2015,47,49,"I love Bruce Lee's recipe for life:  ""Absorb what is useful. Discard what is not. Add what is uniquely your own.""
-- Bruce Lee, #BruceLee"
19,560164255488819200,Tue Jan 27 19:55:40 +0000 2015,34,50,Change can be beautiful. Just ask the butterfly.
20,557902886865088512,Wed Jan 21 14:09:48 +0000 2015,18,39,#GoodMorning #Dallas #today  #aviation #jet #travel #texas #sunrise http://t.co/CAH5KQXXia
21,555393098231332864,Wed Jan 14 15:56:47 +0000 2015,14,39,An amazing #sunrise through the undercast of #fog and clouds today. #sky #igers #justwingingit #Tampa http://t.co/WdGKnBZ8jk
22,553710770488610816,Sat Jan 10 00:31:49 +0000 2015,24,31,The fear of death follows from a fear of life. The man who lives fully is prepared to die at anytime.
23,553312262635921409,Thu Jan 08 22:08:18 +0000 2015,4,26,Check out the view I had over Tampa today. http://t.co/tcZph1aKCM
24,552908618589540352,Wed Jan 07 19:24:21 +0000 2015,28,37,"This is the Ripley's Believe it or Not! Jet. 
#Ripley #BelieveItorNot #privatejet #jet http://t.co/HmMTswqFPj"
25,552560601340596226,Tue Jan 06 20:21:28 +0000 2015,16,25,"""When I saw you I fell in love, and you smiled because you knew""  -- William Shakespeare   #williamshakespeare #Shakespeare #love"
26,551761366701592577,Sun Jan 04 15:25:35 +0000 2015,34,52,When I look into the eyes of an animal. . . http://t.co/l9EP79p1xh
27,550394226429931520,Wed Dec 31 20:53:04 +0000 2014,6,14,"Happy New Year Everyone!  ""Tomorrow, is the first blank page of a 365 page book. Write a good one."" ―Brad Paisley #HappyNewYear #BradPaisley"
28,548933431191945216,Sat Dec 27 20:08:23 +0000 2014,17,50,"Religion vs Spirituality. Which one are you?
#Religion #Spirituality #Hell #BeenThere http://t.co/k8LaH4Gryc"
29,545365656750030848,Wed Dec 17 23:51:19 +0000 2014,7,15,I dwell in the possibility!
30,543901992138313729,Sat Dec 13 22:55:14 +0000 2014,3,13,"""Every knot can be gracefully untied so that our souls may fly."" #MichaelSinger 

#quotes #inspiration #flying"
31,542400030389186560,Tue Dec 09 19:26:59 +0000 2014,15,36,Knowing your own darknes. . . #CarlJung http://t.co/w3cKSUpxgo
32,541392704559939584,Sun Dec 07 00:44:14 +0000 2014,37,51,http://t.co/RojhhNgdOE
33,541332536119795712,Sat Dec 06 20:45:08 +0000 2014,25,33,Find joy in everything you do. . . http://t.co/LGHT8fW1oU
34,540657015006461952,Fri Dec 05 00:00:51 +0000 2014,4,25,"It's cold in #Montreal tonight, but I love this city!"
35,540655352011034624,Thu Dec 04 23:54:15 +0000 2014,5,21,Here's a pic of us trying to beat the fog to #Atlanta the other day. #beautiful http://t.co/cKQ9xKh8Ek
36,539505754823487488,Mon Dec 01 19:46:10 +0000 2014,5,25,"The soul that can speak through the eyes, can also kiss with a gaze. - 
#GustavoAdolfoBécquer"
37,538407420406820864,Fri Nov 28 19:01:46 +0000 2014,25,39,"To find your Success, look for your Passion. I hear they are inseparable lovers!"
38,537989009562406912,Thu Nov 27 15:19:09 +0000 2014,7,20,"Happy Thanksgiving! Remember that feeling thankful for all the blessings that we all ready have, is one of the true keys to being happy."
39,535857636437397504,Fri Nov 21 18:09:50 +0000 2014,38,39,"We are not the sum of our intentions, but we are the sum of our actions."
40,534397057835237376,Mon Nov 17 17:26:01 +0000 2014,21,29,"This candle melted in such a strange, beautiful way. I call it, ""The Birth of Light""
#birthoflight #birth #light http://t.co/PrQICySWES"
41,532993438393044992,Thu Nov 13 20:28:32 +0000 2014,30,31,"When facing any tough challenge, just remember. . . http://t.co/zeBfVxZsLn"
42,531892848158056448,Mon Nov 10 19:35:11 +0000 2014,12,36,I love #photography!  I call this one #50shadesofgrey at the #beach ! http://t.co/f7DN5A6J3z
43,531148848279080960,Sat Nov 08 18:18:48 +0000 2014,26,33,You always get a second chance.  . . It's called tomorrow. 😊
44,530789425840533504,Fri Nov 07 18:30:35 +0000 2014,2,18,"My children got to join me on my trip this weekend. We are on our way to Hilton Head Island, SC.… http://t.co/iXMfi3w0GK"
45,530521544376999937,Fri Nov 07 00:46:07 +0000 2014,20,36,Never rush anything you want to last forever.
46,530016231467003905,Wed Nov 05 15:18:11 +0000 2014,39,53,"The laborer, craftsman, and artist. . . http://t.co/fW9bxQwh97"
47,529407307809959936,Mon Nov 03 22:58:32 +0000 2014,42,59,Don't wait too long! Enjoy the ride! :) http://t.co/FqI4ZRbyxV
48,527885965596319744,Thu Oct 30 18:13:16 +0000 2014,28,52,"Shhh!  Don't tell anyone, but I am into nictophilia. http://t.co/4CDzY9PgyX"
49,526028336947298304,Sat Oct 25 15:11:43 +0000 2014,25,34,Never outsource.  .  . http://t.co/pFyt54U0WC
50,523892607387455488,Sun Oct 19 17:45:05 +0000 2014,52,70,"Everything was impossible,  until . . . http://t.co/GD5O9crgfB"
51,522452698806108160,Wed Oct 15 18:23:24 +0000 2014,24,52,"When you take your time, a weird thing happens, you end up with more of it."
52,521850942631981056,Tue Oct 14 02:32:14 +0000 2014,16,66,I snapped this picture of the #sunset flying over #Dallas #Texas today.  We were about 5000 feet high. http://t.co/WHHVGMrywW
53,521731641707098113,Mon Oct 13 18:38:11 +0000 2014,34,40,"""If you want to be successful, you must respect one rule: Never lie to yourself.""
-- Paulo Coelho #success #quotes #PauloCoelho"
54,519535974745776129,Tue Oct 07 17:13:23 +0000 2014,50,54,"It's true, time flies.  But guess what? You're the pilot! http://t.co/MeKpRJ8vQt"
55,518818523054096384,Sun Oct 05 17:42:29 +0000 2014,31,47,"The #power of #focus and #simplicity.  . . 
#SteveJobs #quotes http://t.co/iz67dQhDRX"
56,516798458683211777,Tue Sep 30 03:55:28 +0000 2014,3,7,Being #silly with my son. The #zombies are coming! Maybe he is a #mummy ? #igers #fun #family http://t.co/YHuRIdc6fk
57,516683465149145088,Mon Sep 29 20:18:32 +0000 2014,30,51,"Unless it's real, passionate, extraordinary.  . . http://t.co/CiionyeEgm"
58,516310390884818944,Sun Sep 28 19:36:04 +0000 2014,33,47,"""Find what you love and let it kill you.""

#quotes #love #kill #life #success 
# Charles Bukowski #poet http://t.co/R4MjlkorrF"
59,515267248697917441,Thu Sep 25 22:30:59 +0000 2014,26,31,"It is never too late . . . 

#quotes #GeorgeElliot http://t.co/HV4ribGM3t"
60,514121460718501889,Mon Sep 22 18:38:02 +0000 2014,34,37,"""It's not what you look at that matters, it's what you see.""
-- Henry David Thoreau,

#quotes #HenryDavidThoreau"
61,513033734791368705,Fri Sep 19 18:35:48 +0000 2014,17,37,Promises made during the storm. . . http://t.co/8bnrGsHJqj
62,512337830140719104,Wed Sep 17 20:30:32 +0000 2014,14,20,How do you aim for #success? Do what you love and work hard. #hardthingsaresimple
63,511583739881996288,Mon Sep 15 18:34:03 +0000 2014,48,51,"The two most important days . . . 

#marktwain #quotes #inspiration http://t.co/QNXbpzeRT2"
64,510435749402259456,Fri Sep 12 14:32:20 +0000 2014,24,32,"You only live once is BS! The truth is, you only die once! You live every single day, so make it count! Help an animal or make someone smile"
65,510131938422956032,Thu Sep 11 18:25:06 +0000 2014,7,14,Let's make a living with what we earn and a life by what we #give.
66,509483062405894144,Tue Sep 09 23:26:42 +0000 2014,33,88,"I snapped a picture of the #supermoon from 40,000 feet. The sun was rising behind us as the #moon was setting. http://t.co/6cYASetOeH"
67,508781603905351680,Mon Sep 08 00:59:21 +0000 2014,9,24,"Sometime, when you least expect it . . . 

#love #relationships #breakup #divorce #startingover http://t.co/sI8I5si5lF"
68,508012904772169728,Fri Sep 05 22:04:49 +0000 2014,21,29,Love it or change it. . . http://t.co/rVy8lw5xWk
69,506832444797235200,Tue Sep 02 15:54:06 +0000 2014,16,0,RT @Cayleepugh: “The bad news: There is no key to the universe. The good news: It was never locked.” ― Swami Beyondananda #quoteoftheday #B…
70,506124067431522305,Sun Aug 31 16:59:15 +0000 2014,9,12,"There are no limits, only plateaus."
71,505738283234897920,Sat Aug 30 15:26:17 +0000 2014,44,57,"If you're searching for that one person that will change your life, take a look in the mirror. http://t.co/qLMcJb8OzI"
72,505422205136961536,Fri Aug 29 18:30:18 +0000 2014,20,36,I have the deepest affection for . . . http://t.co/1iWb5g3xe2
73,505352928530804736,Fri Aug 29 13:55:01 +0000 2014,5,12,"I invented a new word, Airgasm. It's the highly euphoric feeling I get when flying through the air.  #airgasm #newword"
74,504599035706376192,Wed Aug 27 11:59:19 +0000 2014,9,10,"You can have what you want, if you brave what you fear and do what you can."
75,504447848961036288,Wed Aug 27 01:58:34 +0000 2014,14,15,"""The pessimist complains about the wind; the optimist expects it to change; the realist adjusts the sails."" --  William Arthur Ward"
76,504309910050701312,Tue Aug 26 16:50:26 +0000 2014,13,16,"""Life would be boring if it was easy."" #TaylorSwift http://t.co/pXi289hroS"
77,503978145545220096,Mon Aug 25 18:52:08 +0000 2014,8,12,Never be afraid to give up the good to go for the great!
78,503560177522843648,Sun Aug 24 15:11:16 +0000 2014,29,30,The good thing about #science is. . . http://t.co/iIiBj68SB0
79,503383888639827968,Sun Aug 24 03:30:46 +0000 2014,2,8,"I just saw a tattoo that read, ""Wounds into Wisdom"" - How true is that!"
80,503219754350698496,Sat Aug 23 16:38:33 +0000 2014,3,16,"It's such a beautiful day in Charleston,  SC today. I think I'll go downtown for lunch, then explore."
81,502514534800953345,Thu Aug 21 17:56:16 +0000 2014,1,0,Super funny reviews of BIC for Her pens!!! I am rolling on the floor! -- Check them out here: ---&gt; http://t.co/fAi857bklJ
82,502142060301156352,Wed Aug 20 17:16:11 +0000 2014,23,32,"Truly the best #revenge . . . 
#chuckpalahniuk http://t.co/XcN3CzpYFI"
83,501942176470036481,Wed Aug 20 04:01:55 +0000 2014,12,13,"I hate when you offer a friend a sincere compliment on their mustache and suddenly, she's not your friend anymore."
84,501787150095249409,Tue Aug 19 17:45:53 +0000 2014,10,15,"You're going to be with yourself all your life. So, you'd better be as interesting as possible. #read #travel #explore #play"
85,501378300351352832,Mon Aug 18 14:41:16 +0000 2014,14,17,Don't take life too seriously. .. @joerogan #joerogan #perspective http://t.co/iWF51q1qHj
86,500993264200462336,Sun Aug 17 13:11:16 +0000 2014,18,26,When creative people sleep. . . http://t.co/pBNNSg4otk
87,500128889898020865,Fri Aug 15 03:56:33 +0000 2014,12,33,Recently I flew #CharlieCrist . He was a true pleasure to meet. Very nice guy. http://t.co/mHsxGAfzOm
88,499725029312311296,Thu Aug 14 01:11:46 +0000 2014,16,25,My favorite #StarWars #quote : http://t.co/lkzHROjZQw
89,499605598577905664,Wed Aug 13 17:17:11 +0000 2014,9,9,Thought of the day:  Plan to die with your great memories and NOT your dreams.
90,499292801415532544,Tue Aug 12 20:34:14 +0000 2014,10,11,"If you ever have trouble waiting for success, just go forward without it."
91,498583584673124353,Sun Aug 10 21:36:04 +0000 2014,16,18,An unbelievable fact I never knew. A #hangover saved @SethMacFarlane 's life. http://t.co/5TgCfbHxSg
92,498523596441276417,Sun Aug 10 17:37:42 +0000 2014,19,22,#Fear - The real definition! http://t.co/inNN3v1iyz
93,497828629771223040,Fri Aug 08 19:36:09 +0000 2014,23,14,The truth is rarely pure and never simple. -Oscar Wilde
94,497421706416627712,Thu Aug 07 16:39:11 +0000 2014,2,1,@Cayleepugh You could always just keep a journal and blog about your experiences when you get back.
95,496993857339273216,Wed Aug 06 12:19:03 +0000 2014,33,37,You are not IN the Universe . . . http://t.co/EPrUhHneP3
96,496750442119176192,Tue Aug 05 20:11:49 +0000 2014,5,0,"RT @DereckCurry: May there be many a summer morning when, with what pleasure, what joy, you come into harbors seen for the first time. - C.…"
97,496306407021756416,Mon Aug 04 14:47:23 +0000 2014,2,20,Having fun in Orlando! Doing my yearly recurrent systems and emergency training. #flightsafety #pilot #training http://t.co/jH2x5Y8bOH
98,495923643743227904,Sun Aug 03 13:26:25 +0000 2014,11,15,Interesting fact:  Disney World is larger than 17 countries. http://t.co/PoKrqFFOe5
99,494969557035913216,Thu Jul 31 22:15:13 +0000 2014,9,14,"You can take life by the horns, just be prepared for the ride."
100,494554199598694401,Wed Jul 30 18:44:44 +0000 2014,9,14,"Once you awaken, it's hard to go back to sheep."
101,494354821357391873,Wed Jul 30 05:32:28 +0000 2014,30,36,You are the collection of every experience... http://t.co/EmDa6jv1Gu
102,493254033419689984,Sun Jul 27 04:38:20 +0000 2014,45,51,Be the reason someone smiles today. http://t.co/u0AZrDPrDX
103,492753460765270016,Fri Jul 25 19:29:14 +0000 2014,13,12,"In life (and poker) it's not about the hand your dealt, it's about how well you play it."
104,491711340948381697,Tue Jul 22 22:28:13 +0000 2014,14,9,"It's easy to fill the mind with words, but the heart can't read. -say Buddha Marc"
105,491703661546831872,Tue Jul 22 21:57:42 +0000 2014,9,10,"As Woody Allen once said, “If you’re not failing every now and again, it’s a sign you’re not doing anything very innovative.”"
106,491224548889862144,Mon Jul 21 14:13:53 +0000 2014,25,27,Because in the end... http://t.co/hi6yMErVIe
107,490985908959584257,Sun Jul 20 22:25:37 +0000 2014,1,6,I went #paddleboarding today through the mangroves. It was awesome! #Tampa #Florida
108,490175554562183169,Fri Jul 18 16:45:33 +0000 2014,6,10,The #time you enjoy wasting is NOT wasted time.
109,489487911923224576,Wed Jul 16 19:13:07 +0000 2014,3,12,I always strive for #success because nonsuccess comes naturally.
110,487836954889699328,Sat Jul 12 05:52:48 +0000 2014,22,22,The man on top. . . http://t.co/T1TxFmkwpY
111,487635457841184770,Fri Jul 11 16:32:07 +0000 2014,0,3,"@MLuxAlyssa If I ever fly for the airlines, Southwest will be my first choice! I'm glad to connect with you."
112,486591604799438848,Tue Jul 08 19:24:13 +0000 2014,11,19,The best kisses. . . http://t.co/GzJMVGowZ1
113,486238145524924418,Mon Jul 07 19:59:42 +0000 2014,9,13,"“My grandmother started walking five miles a day when she was sixty. She's ninety-seven now, and we dont know where the heck she is.” #Ellen"
114,486207241536552961,Mon Jul 07 17:56:54 +0000 2014,4,23,My little copilots. :) http://t.co/7gE7HMsa4x
115,486095603374776320,Mon Jul 07 10:33:17 +0000 2014,0,2,#goodmorning time to #fly #sunrise http://t.co/26fgfY6wVP
116,485483492038287360,Sat Jul 05 18:00:59 +0000 2014,66,65,Success is . . . http://t.co/KfyTkGrQoV
117,485261883864150017,Sat Jul 05 03:20:23 +0000 2014,15,21,This is me for sure! A true #nightowl . http://t.co/6kHCIsj1NW
118,484855086363836417,Fri Jul 04 00:23:55 +0000 2014,7,28,Taking off with @justinbieber http://t.co/LwfyoN8uST
119,484402464515301376,Wed Jul 02 18:25:21 +0000 2014,0,3,"I'll admit that it's hard failing, but it's so much worse to never have tried!"
120,484145367261270016,Wed Jul 02 01:23:45 +0000 2014,5,11,We should only look upon our neighbor's bowl to see if they have enough. Not to compare that we have more.
121,484061399904038912,Tue Jul 01 19:50:05 +0000 2014,3,2,"The curious thing about inspiration is that it usually comes during work, not before it."
122,484048741658161153,Tue Jul 01 18:59:47 +0000 2014,3,6,Aging gracefully means that our #beauty moves from our face and into our #heart.
123,483743401116856320,Mon Jun 30 22:46:29 +0000 2014,30,26,"People often say,,, http://t.co/KvXujAp3KX"
124,483312155526037504,Sun Jun 29 18:12:52 +0000 2014,10,13,People are to be #loved and things should be #used. Never confuse those.
125,482997213023326208,Sat Jun 28 21:21:23 +0000 2014,1,2,Hot day in Tampa today!!
126,482929471960256517,Sat Jun 28 16:52:13 +0000 2014,1,8,"I used to dream ABOUT flying. 

Now, I dream WHILE I'm flying."
127,482644711098707969,Fri Jun 27 22:00:40 +0000 2014,3,6,You must have chaos in your soul to burst into a star.
128,482185860805185537,Thu Jun 26 15:37:22 +0000 2014,9,20,Don't be too proud of your beliefs. They are nothing more than opinions you refuse to reconsider. Cultivate an open mind and a kind heart.
129,482185438317142018,Thu Jun 26 15:35:41 +0000 2014,1,0,@mjallen812 Same to you my friend. :-)
130,482107872340221952,Thu Jun 26 10:27:28 +0000 2014,6,9,"Feel the power that comes from focusing on what excites you.

-- Oprah Winfrey,"
131,482080841753841664,Thu Jun 26 08:40:03 +0000 2014,2,4,Expectations are the building blocks of resentment.
132,482080024627916800,Thu Jun 26 08:36:49 +0000 2014,695,0,RT @awkwardposts: People need to realize this http://t.co/am1Ug5aey6
133,482016550438727680,Thu Jun 26 04:24:35 +0000 2014,2,2,"Recent research indicates one of the oldest humans, the Neanderthals, ate plenty of vegetables."
134,481275535331323905,Tue Jun 24 03:20:03 +0000 2014,4,7,A smile is a curve that can set everything straight. :-)
135,480834838371397632,Sun Jun 22 22:08:53 +0000 2014,7,12,"If you are ever the victim of someone's bitterness or rudeness, things could be worse. You could be them!"
136,480762721273528320,Sun Jun 22 17:22:19 +0000 2014,7,5,"#Love is a canvas furnished by nature and embroidered by imagination.""

-- #Voltaire"
137,480431186242568192,Sat Jun 21 19:24:55 +0000 2014,6,3,Live like you mean it!!
138,480040396446109696,Fri Jun 20 17:32:04 +0000 2014,13,0,RT @Vivadivine: “The best way to predict your future is to create it”  ― Abraham Lincoln
139,480038835921747968,Fri Jun 20 17:25:51 +0000 2014,0,1,@jkosiri  It's going to be a great journey. Glad to connect with you.
140,479986665985814528,Fri Jun 20 13:58:33 +0000 2014,0,0,@SisyphusJournal Thank you.  Best of luck with the old house.
141,479986280583815169,Fri Jun 20 13:57:01 +0000 2014,0,0,@RebeccaClaxton Thank you Rebecca! My pleasure!
142,479986000140050433,Fri Jun 20 13:55:54 +0000 2014,0,0,@TjLatinajames44 Thank you Tina!
143,479985762557915136,Fri Jun 20 13:54:58 +0000 2014,0,0,"@Famellot Thank you!  Btw, wear shorts anytime you want, you're beautiful!"
144,479800337998422016,Fri Jun 20 01:38:09 +0000 2014,0,3,My birthday #sunset ! :-) http://t.co/zDIg1yatTs
145,479678269558882305,Thu Jun 19 17:33:06 +0000 2014,0,0,Ha ha #aviationhumor #aviation #pilot #fbo #bdsm #igers http://t.co/OPhqT5EctX
146,479328859650031617,Wed Jun 18 18:24:40 +0000 2014,6,10,"Failure is temporary,  giving up is forever!"
147,479326880110493696,Wed Jun 18 18:16:48 +0000 2014,33,21,This is interesting. The number of people killed each year by various animals. http://t.co/d8ljEN2Ey4
148,478935078039322624,Tue Jun 17 16:19:55 +0000 2014,3,3,"Mood follows action. If you want to feel better, first you have to change what you are doing."
149,478561441889259521,Mon Jun 16 15:35:13 +0000 2014,7,10,"I don't care what kind of car you drive. I want to know, WHAT DRIVES YOU??

 #whatdrivesyou #inspiration #quotes #motivation"
150,478422268595281920,Mon Jun 16 06:22:12 +0000 2014,0,0,@LieveFransen Thank you! I try to be :)
151,478319575843356673,Sun Jun 15 23:34:08 +0000 2014,1,4,Beautiful day in #downtown #Tampa - #fountain #city #architecture #design #summer #igers http://t.co/6zDEpl2gQB
152,477910191774519296,Sat Jun 14 20:27:23 +0000 2014,0,3,"Just in time for Father's Day. Rules for dating my daughter T-Shirt. Pretty funny, but I'm not sure about number 10. http://t.co/4cSof67ypA"
153,477764724491169792,Sat Jun 14 10:49:21 +0000 2014,6,11,Never give up on something you can't go a day without thinking about.
154,477749044815478784,Sat Jun 14 09:47:03 +0000 2014,2079,0,"RT @UberFacts: If you have no debt and $10 in your pocket, you are wealthier than 25% of Americans."
155,477748274346983424,Sat Jun 14 09:43:59 +0000 2014,4,0,"RT @LiletteAtienza: Use your voice for kindness, your ears for compassion, and your hands for charity, always. #payitforward"
156,477194904280391680,Thu Jun 12 21:05:05 +0000 2014,1,4,"It's an exploration, she's made of outer space, and her lips are like the galaxy's edge, and her kiss the colour of a constellation... -AM"
157,477168009673707520,Thu Jun 12 19:18:13 +0000 2014,1,1,@reynaangelical It sure is!
158,477167677988159490,Thu Jun 12 19:16:54 +0000 2014,0,1,@AimanAnis Very true. We make our own.
159,477167583418789888,Thu Jun 12 19:16:31 +0000 2014,0,0,@Oscarmond My pleasure. Glad to connect.
160,477167515814998016,Thu Jun 12 19:16:15 +0000 2014,1,1,@reynaangelical ;-)
161,477167420881534977,Thu Jun 12 19:15:53 +0000 2014,0,0,@dorinamorelli Nice! So true.
162,477167299523141632,Thu Jun 12 19:15:24 +0000 2014,0,0,@Angelia2cute1 Thanks! You too!
163,476823977428791297,Wed Jun 11 20:31:09 +0000 2014,4,5,"I don't believe much in luck, I believe in being prepared!"
164,476099337714270209,Mon Jun 09 20:31:42 +0000 2014,3,7,"""If the path be beautiful, let us not ask where it leads.""
-- Anatole France,"
165,476031718290620417,Mon Jun 09 16:03:00 +0000 2014,9,5,What you think about most gets larger in your life. Try to keep your thoughts positive and in the direction of your goals. #inspiration
166,475682385028464642,Sun Jun 08 16:54:53 +0000 2014,17,24,Don't do this! http://t.co/TZ8A9j7uRi
167,475389411501154304,Sat Jun 07 21:30:42 +0000 2014,0,1,"I love Internet marketing, but sometimes,  I spend the longest time on the smallest technical things."
168,474997637150953472,Fri Jun 06 19:33:56 +0000 2014,1,3,Ariana Grande is a rising star! She is beautiful and talented. #ArianaGrande
169,474646373195735040,Thu Jun 05 20:18:08 +0000 2014,41,39,Three simple rules for growth and success.  #threesimplerules #motivation #success #keepitsimple #ifollowback http://t.co/K6OhMjiNkr
170,474424701024890880,Thu Jun 05 05:37:17 +0000 2014,1,4,I Like Big Bucks and I Can Not Lie!  #RedneckASong
171,474043922143256576,Wed Jun 04 04:24:13 +0000 2014,1,6,I cooked up some chili lime #kale chips. So #healthy and very #delicious http://t.co/spvEIPzJyW
172,474033251812536321,Wed Jun 04 03:41:49 +0000 2014,0,0,@Wendybrass Thank you so much for letting me know that it lifted your spirits. It did for me too when I found it. :-)
173,473934723723431938,Tue Jun 03 21:10:18 +0000 2014,18,36,"""I am a thousand winds that blow. "" I love this poem about death from Mary Elizabeth Frye. http://t.co/d8R9kanHoE"
174,473850269952786432,Tue Jun 03 15:34:42 +0000 2014,1,1,"@veerle_ronsse Yes, I think you're right! We have much in common."
175,473639274680569857,Tue Jun 03 01:36:17 +0000 2014,0,3,"#Love, #truth,  and #enlightenment. The door, the key, and the inevitable. 

Thanks #tut"
176,473613962718625792,Mon Jun 02 23:55:42 +0000 2014,17,0,RT @BuddhaBrian: Your Acts of #Kindness are #Iridescent #WINGS of #Divine #LOVE.....#Rumi @DeepakChopra  #CosmicConsciousness http://t.co/U…
177,473597815558770688,Mon Jun 02 22:51:32 +0000 2014,1,2,"@veerle_ronsse No need to apologize, I love being funny. Life is a game and I keep score with smiles!  :-))))"
178,473513458563293185,Mon Jun 02 17:16:20 +0000 2014,4,7,"""The nitrogen in our DNA the calcium in our teeth the iron in our blood the carbon in our apple pies were made in the interiors of stars."""
179,473332780181774336,Mon Jun 02 05:18:23 +0000 2014,0,0,"@f_diaz0 I couldn't be better, and you?"
