,id_str,created_at,retweet_count,favorite_count,text
0,10416966648,Sat Mar 13 10:28:26 +0000 2010,0,0,"Ready to EXPLODE your Web by hamranka - Free classifieds in 600 US cities and 60 countries, and 50+ categories http://bit.ly/a4h70G"
1,7189164038,Wed Dec 30 07:26:22 +0000 2009,0,0,Just added myself to the http://wefollow.com twitter directory under:  #malaysia_kuala_lumpur #music #http_guitar_chord_lyrics #specialneeds
2,3748195915,Fri Sep 04 02:28:18 +0000 2009,0,0,Signed up at OnlyWire.com http://onlywire.com
3,2714511772,Sun Jul 19 01:05:46 +0000 2009,0,0,Just added myself to the http://wefollow.com twitter directory under:  #blogger #music #special
4,1530836200,Thu Apr 16 03:06:26 +0000 2009,0,0,"I got a pain killer..im just buy it.
&lt;a href=""http://hamrankasi.acnefree.hop.clickbank.net/?tid=97244921"" target=""_top""&gt;Click Here!&lt;/a&gt;"
5,1498838449,Sat Apr 11 20:14:03 +0000 2009,0,0,"RT @brad_callen has a cool, new FREE tool to massively increase the number of Twitter followers you have! http://www.twiveaway.com"
6,1454338647,Sun Apr 05 00:18:43 +0000 2009,0,0,hello guys...im just buy my anti virus from my friends..mr hamrankasim http://smartspyware.blogspot.com   tq.
7,1247664900,Wed Feb 25 02:49:47 +0000 2009,0,0,Thanks guys for supporting me...http://guitar-chord-free.blogspot.com
8,1246867632,Tue Feb 24 22:59:36 +0000 2009,0,0,thanks guys for visiting my blog...http://guitar-chord-free.blogspot.com
