,id_str,created_at,retweet_count,favorite_count,text
0,573176416134676480,Wed Mar 04 17:41:21 +0000 2015,0,2,Living life to it's fullest!
1,396872044828061696,Sun Nov 03 05:30:43 +0000 2013,2,5,"I distrust camels, and anyone else who can go a week without a drink. -- Joe E. Lewis"
2,396846082728022016,Sun Nov 03 03:47:33 +0000 2013,2,2,Do not trust people. They are capable of greatness. -- Stanislaw Lem
3,396830876606017536,Sun Nov 03 02:47:08 +0000 2013,0,1,"Drawing on my fine command of the English language, I said nothing. -- Robert Benchley"
4,396778840518705152,Sat Nov 02 23:20:22 +0000 2013,2,1,The good news about computers is that they do what you tell them to do. The bad news is that they do what you tell them to do. -- Ted Nelson
5,396755242450046976,Sat Nov 02 21:46:35 +0000 2013,1,0,I don't think anyone should write their autobiography until after they're dead. -- Samuel Goldwyn
6,396738119535296513,Sat Nov 02 20:38:33 +0000 2013,3,2,"Whenever you find yourself on the side of the majority, it is time to pause and reflect. -- Mark Twain"
7,391441818073591808,Sat Oct 19 05:52:56 +0000 2013,1,5,I was married by a judge. I should have asked for a jury. -- Groucho Marx
8,391421665613074432,Sat Oct 19 04:32:52 +0000 2013,1,1,"Get your facts first, then you can distort them as you please. -- Mark Twain"
9,380194709915713536,Wed Sep 18 05:00:57 +0000 2013,0,2,He taught me housekeeping; when I divorce I keep the house. -- Zsa Zsa Gabor
10,374334004213731328,Mon Sep 02 00:52:36 +0000 2013,2,0,"I was sleeping the other night, alone, thanks to the exterminator. -- Emo Philips"
11,374305596893188096,Sun Sep 01 22:59:43 +0000 2013,2,0,"Don't forget Mother's Day. Or as they call it in Beverly Hills, Dad's Third Wife Day. -- Jay Leno"
12,373884303551107072,Sat Aug 31 19:05:39 +0000 2013,5,0,"Can you find anything better?  If so, please let me know - http://t.co/FZfarNKCSy"
13,354705694437543940,Tue Jul 09 20:56:42 +0000 2013,9,0,"Google Alerts RSS delivery is temporarily not available. To keep receiving Google Alerts in the meantime, you c..."
14,352976643645648897,Fri Jul 05 02:26:04 +0000 2013,6,0,Ministry of Youth and Sports introduces health and fitness programme http://t.co/rF4hv6xUHn
15,352563827965042688,Wed Jul 03 23:05:41 +0000 2013,6,0,Argus app brings all your health and fitness information into one place http://t.co/9lJUXmedlm
16,352216281509924865,Wed Jul 03 00:04:40 +0000 2013,12,0,"Bay Area health and fitness events, June 3 http://t.co/scoWiNTg3A"
17,351800167021809666,Mon Jul 01 20:31:10 +0000 2013,5,0,July Must Haves For Health and Fitness http://t.co/SSfnoZ6BgV
18,351522624679059458,Mon Jul 01 02:08:19 +0000 2013,6,0,Health-and-fitness trips for adventurous travelers http://t.co/DO3Ooq6bqf
19,351315807634075648,Sun Jun 30 12:26:30 +0000 2013,4,0,Health and fitness testing at Syracuse University http://t.co/o1KZyUqGph
20,350041034903920640,Thu Jun 27 00:01:00 +0000 2013,3,0,TOPS encourages making health and fitness a family affair http://t.co/JpzlCEguy5
21,349898122434056192,Wed Jun 26 14:33:07 +0000 2013,4,0,Michelle Heaton dishes out health and fitness tips at OK! party http://t.co/mzd2PKjRTZ
22,349760447907495936,Wed Jun 26 05:26:03 +0000 2013,5,0,Bay Area health and fitness events http://t.co/RKXYNj6zWa
23,348967980899635201,Mon Jun 24 00:57:04 +0000 2013,6,0,Health and fitness calendar http://t.co/iTn7Nvg3Wr
24,348546390311448576,Sat Jun 22 21:01:49 +0000 2013,0,0,Health and Fitness Expo http://t.co/2GxEasQ5lx
25,348073357884919808,Fri Jun 21 13:42:10 +0000 2013,0,0,Quick Transportation to the Health and Fitness Expo http://t.co/v4QE60H9oH
26,347960046338052096,Fri Jun 21 06:11:54 +0000 2013,3,0,A beginner's guide to health and fitness http://t.co/Ke3RcWLq47
27,347811529846050816,Thu Jun 20 20:21:45 +0000 2013,0,0,Fun All-Day Activities at the Health and Fitness Expo http://t.co/7SHYedcLP8
28,347313818306740225,Wed Jun 19 11:24:01 +0000 2013,0,1,KidCheck Children's Check-In Integrates with Leading Health and Fitness ... http://t.co/8YpSj5z1hM
29,347100305349033985,Tue Jun 18 21:15:36 +0000 2013,0,1,Get a Lot of Health and Fitness Benefits Together with Weight Reduction http://t.co/PnbF6dORRd
30,346952179493519360,Tue Jun 18 11:27:00 +0000 2013,0,0,Gymtopia Harnesses Global Health and Fitness Clubs to Help Good Causes http://t.co/G5eEtCiyAo
31,346745462809833472,Mon Jun 17 21:45:35 +0000 2013,0,0,Celebrating Senior Health and Fitness Day http://t.co/bMdXTFydxn
32,346590196504092672,Mon Jun 17 11:28:36 +0000 2013,0,0,Health and fitness: Napping has many health benefits http://t.co/jKD7yir012
33,346450634305839104,Mon Jun 17 02:14:02 +0000 2013,0,0,Health and fitness calendar http://t.co/w9qISS81xF
34,345615533204439040,Fri Jun 14 18:55:38 +0000 2013,1,0,HealthBuy - Online Source for Health and Fitness Products http://t.co/j3IZRAoMVr
35,345388785414057984,Fri Jun 14 03:54:38 +0000 2013,1,0,25 years of inspiration for Edward Health and Fitness Center http://t.co/2Di6liW4Oc
36,345245335913897984,Thu Jun 13 18:24:37 +0000 2013,1,0,Bruce Sanford – Health and Fitness – Stanford Who's Who Certified http://t.co/e4zbGj6vHz
37,345023593383596033,Thu Jun 13 03:43:29 +0000 2013,0,0,Tea or coffee?
38,345005393702948864,Thu Jun 13 02:31:10 +0000 2013,4,0,"Between two evils, I always pick the one I never tried before. -- Mae West"
39,344995986151706624,Thu Jun 13 01:53:47 +0000 2013,0,0,Using Technology to Power Your Fitness http://t.co/rBDJZIQu2A
40,344713500112867328,Wed Jun 12 07:11:17 +0000 2013,0,0,Visiting Hours: Tips For Seniors' Health And Fitness http://t.co/QavDk0QyAr
41,344504457276579840,Tue Jun 11 17:20:37 +0000 2013,0,0,Over 0.5B mobile health and fitness sensor shipments in 2017 – report http://t.co/9KZfc32MiV
42,344301145050738689,Tue Jun 11 03:52:44 +0000 2013,0,0,Ever have plastic surgery?
43,344285651581149185,Tue Jun 11 02:51:10 +0000 2013,2,1,"O Lord, help me to be pure, but not yet. -- Saint Augustine"
44,344261190907752448,Tue Jun 11 01:13:58 +0000 2013,0,0,I never said most of the things I said. -- Yogi Berra
45,343991868889120769,Mon Jun 10 07:23:47 +0000 2013,0,0,BRIAN PARR'S HEALTH AND FITNESS: Shannon's remodeling project http://t.co/NK26ApJTBB
46,343897205423357953,Mon Jun 10 01:07:37 +0000 2013,0,1,"Money is better than poverty, if only for financial reasons. -- Woody Allen"
47,343874843734863872,Sun Jun 09 23:38:46 +0000 2013,0,0,"Nothing interferes with my concentration. You could put on an orgy in my office and I wouldn't look up. Well, maybe once. -- Isaac Asimov"
48,343845900856197122,Sun Jun 09 21:43:45 +0000 2013,0,0,An economist's guess is liable to be as good as anybody else's. -- Will Rogers
49,343608531724947456,Sun Jun 09 06:00:32 +0000 2013,0,1,I looked up my family tree and found out I was the sap. -- Rodney Dangerfield
50,343134573217058816,Fri Jun 07 22:37:12 +0000 2013,1,1,Health and Fitness Day is Saturday at farmers market http://t.co/LK8zWYw7Gd
51,342871303151300608,Fri Jun 07 05:11:03 +0000 2013,1,0,'Senior Health and Fitness Day' observed locally with honors http://t.co/H1B5bUzxdP
52,342841348690427905,Fri Jun 07 03:12:01 +0000 2013,1,1,There is no time for cut-and-dried monotony. There is time for work. And time for love. That leaves no other time!. -- Coco Chanel
53,342825733078515713,Fri Jun 07 02:09:58 +0000 2013,0,0,Airline travel is hours of boredom interrupted by moments of stark terror. -- Al Boliska
54,342703908629655552,Thu Jun 06 18:05:53 +0000 2013,1,0,8 New Technologies Revolutionising Health And Fitness http://t.co/2VLN4rqu1x
55,342515375214321664,Thu Jun 06 05:36:43 +0000 2013,0,1,Black Fitness Today Launches First Nationwide Health and Fitness Campaign http://t.co/yl8CnRt4mK
56,342193641739153408,Wed Jun 05 08:18:16 +0000 2013,1,0,Makita Gabriel – Health and Fitness – Stanford Who's Who Certified http://t.co/FPqYHAGo5q
57,341890383598460928,Tue Jun 04 12:13:14 +0000 2013,0,0,Health and Fitness Fair a Success http://t.co/KePokApwDe
58,341740256099454977,Tue Jun 04 02:16:40 +0000 2013,0,0,HEALTH AND FITNESS NEWS AND NOTES http://t.co/xoou3rvzEN
59,341440891183054848,Mon Jun 03 06:27:06 +0000 2013,0,1,BRIAN PARR'S HEALTH AND FITNESS: Weight loss and quality of life http://t.co/XmLLGTQ6i0
60,341403005649838081,Mon Jun 03 03:56:34 +0000 2013,1,1,High achievement always takes place in the framework of high expectation. -- Charles Kettering
61,341376170161479680,Mon Jun 03 02:09:56 +0000 2013,0,1,"If you owe the bank $100 that's your problem. If you owe the bank $100 million, that's the bank's problem. -- J. Paul Getty"
62,341356507570515970,Mon Jun 03 00:51:48 +0000 2013,0,0,"For your information, I would like to ask a question. -- Samuel Goldwyn"
63,341062306249207809,Sun Jun 02 05:22:45 +0000 2013,2,1,A friend doesn't go on a diet because you are fat. -- Erma Bombeck
64,341031133645000704,Sun Jun 02 03:18:52 +0000 2013,1,0,Informed decision-making comes from a long tradition of guessing and then blaming others for inadequate results. -- Scott Adams
65,341006633448640512,Sun Jun 02 01:41:31 +0000 2013,2,0,Time is the scarcest resource and unless it is managed nothing else can be managed. -- Peter Drucker
66,340981562906669057,Sun Jun 02 00:01:54 +0000 2013,0,0,"Almost all quality improvement comes via simplification of design, manufacturing... layout, processes, and procedures. -- Tom Peters"
67,340958086607028224,Sat Jun 01 22:28:37 +0000 2013,0,0,We learn from experience that men never learn anything from experience. -- George Bernard Shaw
68,340941002971947008,Sat Jun 01 21:20:44 +0000 2013,2,1,A business that makes nothing but money is a poor business. -- Henry Ford
69,340919756959928320,Sat Jun 01 19:56:18 +0000 2013,0,0,"Don't worry about people stealing your ideas. If your ideas are any good, you'll have to ram them down people's throats. -- Howard Aiken"
70,340842341936025600,Sat Jun 01 14:48:41 +0000 2013,0,0,June 1st 2013 - Launch of the First Annual National Health and Fitness Day http://t.co/Ewgsf6vt5y
71,340695887720378369,Sat Jun 01 05:06:44 +0000 2013,0,2,I love life because what more is there. -- Anthony Hopkins
72,340679932868956162,Sat Jun 01 04:03:20 +0000 2013,0,0,"Go to Heaven for the climate, Hell for the company. -- Mark Twain"
73,340620353581764608,Sat Jun 01 00:06:35 +0000 2013,0,0,City of Swift Current encouraging activity during National Health and Fitness ... http://t.co/Go8IiVELny
74,340472889973301248,Fri May 31 14:20:37 +0000 2013,0,0,Phuket Health and Fitness: Learn to feel good http://t.co/tlh3BXpK0T
75,340321217284292608,Fri May 31 04:17:55 +0000 2013,2,0,The City celebrates National Health and Fitness Day with free swims http://t.co/DAf23jwesF
76,340162079975686144,Thu May 30 17:45:34 +0000 2013,1,0,National Senior Health And Fitness Day A Reminder To Shed Bad Habits http://t.co/cEhhUwPZ3K
77,340011173728645121,Thu May 30 07:45:55 +0000 2013,1,1,Assisted Living Wellness Programs Promote Senior Health and Fitness http://t.co/vcQaCudZRM
78,339712376108617730,Wed May 29 11:58:36 +0000 2013,1,0,National Senior Health and Fitness Day set for today http://t.co/E5JwsIxilW
79,339497320288747521,Tue May 28 21:44:03 +0000 2013,1,0,Los Angeles Health And Fitness Company Strongman Enterprises Ventures Into ... http://t.co/1D3aAzHYc3
80,339348566839554048,Tue May 28 11:52:57 +0000 2013,0,1,Health and Fitness Calendar http://t.co/47Lxdcark4
81,339155684606234625,Mon May 27 23:06:31 +0000 2013,0,0,"The best Twitter Marketing software, period!  http://t.co/FZfarNKCSy"
82,339135259717275648,Mon May 27 21:45:21 +0000 2013,0,0,HEALTH AND FITNESS NEWS AND NOTES http://t.co/kyEMWsF69U
83,338989969446170626,Mon May 27 12:08:01 +0000 2013,0,0,The word on health and fitness http://t.co/Fx2PROWt14
84,338850507185594369,Mon May 27 02:53:51 +0000 2013,0,0,Health and fitness calendar http://t.co/iWzlSHbatt
85,338640426103873536,Sun May 26 12:59:03 +0000 2013,0,0,The KID-FIT Preschool Health and Fitness Organization is Coming to Precious ... http://t.co/YQT9jnvtXl
86,338134952522690561,Sat May 25 03:30:29 +0000 2013,0,0,TweetAdder is now even BETTER!  I've made thousands using this incredible tool.  Free to Try! http://t.co/FZfarNKCSy
87,338078489934692354,Fri May 24 23:46:07 +0000 2013,0,1,RiverMarket features health and fitness http://t.co/ua8WfV8l9D
88,337931039412482048,Fri May 24 14:00:12 +0000 2013,0,0,Tasty way to health and fitness http://t.co/6kNZbzbQIw
89,337779936930713601,Fri May 24 03:59:47 +0000 2013,0,1,"My computer beat me at checkers, but I sure beat it at kickboxing. -- Emo Philips"
90,337746645049565184,Fri May 24 01:47:29 +0000 2013,0,0,"Can you find anything better?  If so, please let me know - http://t.co/FZfarNKCSy"
91,337635647655387137,Thu May 23 18:26:26 +0000 2013,1,0,Cross-Training With Trail Yoga http://t.co/h981DJZh7L
92,337544545011105792,Thu May 23 12:24:25 +0000 2013,0,0,15 Sneaky Duct Tape Hacks For Better Health And Fitness http://t.co/ErL27oae9T
93,337415046021922817,Thu May 23 03:49:50 +0000 2013,0,1,I will not eat oysters. I want my food dead. Not sick. Not wounded. Dead. -- Woody Allen
94,337385078210584576,Thu May 23 01:50:45 +0000 2013,1,0,Computer science is no more about computers than astronomy is about telescopes. -- Edsger Dijkstra
95,337288689648533504,Wed May 22 19:27:44 +0000 2013,1,0,Rider Nation community challenge on health and fitness http://t.co/UvNnDPnXCV
96,337172454155894784,Wed May 22 11:45:52 +0000 2013,0,0,New health and fitness classes launched in Fishburn http://t.co/2l0c0Mb8GP
97,337039528424513538,Wed May 22 02:57:40 +0000 2013,0,0,Bay Area health and fitness events http://t.co/uP6WvyXBb7
98,336897919162658817,Tue May 21 17:34:57 +0000 2013,1,0,Mattoon YMCA to offer Senior Health and Fitness Day http://t.co/uYvT2nts18
99,336672222548721664,Tue May 21 02:38:07 +0000 2013,0,1,My fake plants died because I did not pretend to water them. -- Mitch Hedberg
100,336529816910180352,Mon May 20 17:12:15 +0000 2013,0,0,Orange County Celebrates Senior Health and Fitness Day http://t.co/14hnOjLTeV
101,336252094640164864,Sun May 19 22:48:41 +0000 2013,1,2,Health and fitness calendar http://t.co/F6fEuYwivw
102,336245767721332736,Sun May 19 22:23:32 +0000 2013,0,0,The reason there are two senators for each state is so that one can be the designated driver. -- Jay Leno
103,335884597374115840,Sat May 18 22:28:23 +0000 2013,0,0,Bay Area Health and Fitness Events http://t.co/eUpYQj5hdw
104,335527256321572865,Fri May 17 22:48:26 +0000 2013,0,0,Senior Health Fair Makes Connections At Trolley Square http://t.co/oTsYMMY7Kl
105,335510737382432770,Fri May 17 21:42:47 +0000 2013,1,2,If God wanted us to bend over he'd put diamonds on the floor. -- Joan Rivers
106,335482543761661952,Fri May 17 19:50:46 +0000 2013,2,0,"Nothing interferes with my concentration. You could put on an orgy in my office and I wouldn't look up. Well, maybe once. -- Isaac Asimov"
107,335271020913123328,Fri May 17 05:50:15 +0000 2013,0,0,I have a simple philosophy: Fill what's empty. Empty what's full. Scratch where it itches. -- Alice Roosevelt Longworth
108,335252229852368896,Fri May 17 04:35:34 +0000 2013,0,0,"Can you find anything better?  If so, please let me know - http://t.co/FZfarNKCSy"
109,335235180019208192,Fri May 17 03:27:49 +0000 2013,0,0,I buy when other people are selling. -- J. Paul Getty
110,334954568012152833,Thu May 16 08:52:46 +0000 2013,0,0,New Health and Fitness Talk Show “Fitness From The Ground Up” to Shoot Pilot ... http://t.co/ALtKBJcLYC
111,334814881285038080,Wed May 15 23:37:42 +0000 2013,0,0,Free Health and Fitness Fair Will Take Place in Sea Isle City http://t.co/BiGIG25Ltn
112,334675225901928449,Wed May 15 14:22:46 +0000 2013,1,0,Health and Fitness: Get the Zoe Saldana looks http://t.co/p5JWWbucDW
113,334537340196356096,Wed May 15 05:14:51 +0000 2013,0,0,"Bay Area health and fitness events, May 15 http://t.co/WAygY6G72L"
114,334397527388467202,Tue May 14 19:59:17 +0000 2013,0,0,Online Registration For Matt's Mission 5K Closes Friday http://t.co/GTp068PgbB
115,334257694280134656,Tue May 14 10:43:39 +0000 2013,0,0,Nadia Taher – Health and Fitness – Stanford Who's Who Certified http://t.co/mBqsqZw0q8
116,334056233998880768,Mon May 13 21:23:07 +0000 2013,2,1,Going Natural with Medicine http://t.co/c2fm7AyMpT
117,333775128368390144,Mon May 13 02:46:06 +0000 2013,1,0,Kylie Madden – Health and Fitness – Stanford Who's Who Certified http://t.co/Ufu14Aa7wz
118,333300680121004033,Sat May 11 19:20:49 +0000 2013,2,0,"Tulsa Pulse, health and fitness festival, at Guthrie Green in downtown; Event ... http://t.co/ZhAJsyEiuQ"
119,333027812330045440,Sat May 11 01:16:32 +0000 2013,0,0,Oak Brook school focuses on health and fitness http://t.co/cmFWvdlyWx
120,332811568486162432,Fri May 10 10:57:15 +0000 2013,0,0,You Can Save A Life On Saturday http://t.co/luBaOZlkV0
121,332422359418032128,Thu May 09 09:10:41 +0000 2013,0,0,Council on Aging plans Senior Health and Fitness Fair http://t.co/J6IyQunSAs
122,332283803009708034,Thu May 09 00:00:06 +0000 2013,1,1,Royal Fidelity sponsors Rotary health and fitness event http://t.co/ntAr3HFbDq
123,332142245375508480,Wed May 08 14:37:36 +0000 2013,1,1,Coca-Cola pledges money for programs aimed at improving health and fitness of ... http://t.co/mBiVDLlFGX
124,332002480655302656,Wed May 08 05:22:14 +0000 2013,1,1,Bay Area Health and Fitness Events http://t.co/UDb2GLlGWW
125,331989387049066497,Wed May 08 04:30:12 +0000 2013,0,0,"The best Twitter Marketing software, period!  http://t.co/2cAhZfyK8w"
126,331789434125180928,Tue May 07 15:15:40 +0000 2013,0,2,Your Take: How Are Your Allergies? http://t.co/p9JyfEjD8W
127,331578432158834688,Tue May 07 01:17:13 +0000 2013,1,0,Countdown to 2013 Matt's Mission 5K http://t.co/ahSQfy5FvJ
128,331436374521683969,Mon May 06 15:52:44 +0000 2013,0,0,Boston's Fitness Flash Mob http://t.co/3OW0xH3KYc
129,331226187051433985,Mon May 06 01:57:31 +0000 2013,0,0,Health and fitness calendar http://t.co/xtqPCyWKhr
130,331172675269558273,Sun May 05 22:24:53 +0000 2013,5,0,One of the tests of leadership is the ability to recognize a problem before it becomes an emergency. -- Arnold H. Glasow
131,331091083352223745,Sun May 05 17:00:40 +0000 2013,0,0,24-hour health and fitness center opens in Lampasas http://t.co/2vtQ54hQVa
132,330947695369924610,Sun May 05 07:30:53 +0000 2013,1,1,"When in doubt, mumble; when in trouble, delegate; when in charge, ponder. -- James H. Boren"
133,330923067918389248,Sun May 05 05:53:02 +0000 2013,0,0,I was married by a judge. I should have asked for a jury. -- Groucho Marx
134,330561775135227905,Sat May 04 05:57:23 +0000 2013,1,1,I don't have a bank account because I don't know my mother's maiden name. -- Paula Poundstone
135,330541803122077699,Sat May 04 04:38:01 +0000 2013,1,0,"The leader who exercises power with honor will work from the inside out, starting with himself. -- Blaine Lee"
136,330394591754854400,Fri May 03 18:53:03 +0000 2013,0,0,Top 25 Health and Fitness Apps http://t.co/wNIpqTYeiu
137,330250593685864448,Fri May 03 09:20:51 +0000 2013,0,0,Health and Fitness Equipment Makes Fitness Equipment Available http://t.co/waqRiG2w8L
138,330193250755432448,Fri May 03 05:33:00 +0000 2013,1,0,"Auto-Follow, Auto-Tweet, Auto-Reply, Auto- ... Shall I go on? http://t.co/2cAhZfyK8w"
139,330177311657832448,Fri May 03 04:29:40 +0000 2013,0,0,TweetAdder is now even BETTER!  I've made thousands using this incredible tool.  Free to Try! http://t.co/2cAhZfyK8w
140,330111609869570048,Fri May 03 00:08:35 +0000 2013,0,2,Health and Fitness - What Dr. Seuss Might Have to Say About Those Questions ... http://t.co/2CgVqfXoKY
141,329835236751970304,Thu May 02 05:50:23 +0000 2013,0,0,Summer Day Camp at Princeton Health and Fitness http://t.co/lM7RaX9izg
142,329700369003327488,Wed May 01 20:54:28 +0000 2013,0,0,Summer Day Camp at Princeton Health and Fitness http://t.co/Wp6ggQ1xZk
143,329496597769629697,Wed May 01 07:24:45 +0000 2013,0,0,Healthy Alternatives http://t.co/hBumYIqdVg
144,329357595385135104,Tue Apr 30 22:12:24 +0000 2013,0,1,Some health and fitness fads can endanger your life http://t.co/jl3GQNF6Iq
145,329149766200090624,Tue Apr 30 08:26:34 +0000 2013,0,0,Health Reviser Acquires Mobile Health and Fitness Developer Company FitPal ... http://t.co/kaGr4nS8mO
146,329094659739619329,Tue Apr 30 04:47:35 +0000 2013,1,0,I never drink water because of the disgusting things that fish do in it. -- W. C. Fields
147,328875508530024449,Mon Apr 29 14:16:46 +0000 2013,0,1,BRIAN PARR'S HEALTH AND FITNESS: Casual Dining Restaurants vs. Fast Food. http://t.co/eJmVOJx6q0
148,328729156017848322,Mon Apr 29 04:35:12 +0000 2013,0,1,All you need is love. But a little chocolate now and then doesn't hurt. -- Charles M. Schulz
149,328698926343520258,Mon Apr 29 02:35:05 +0000 2013,0,0,Do you want to get married?
150,328680905155686400,Mon Apr 29 01:23:29 +0000 2013,0,1,Every man has his follies - and often they are the most interesting thing he has got. -- Josh Billings
151,328605932533723138,Sun Apr 28 20:25:34 +0000 2013,0,1,WTHR Health and Fitness Expo: Day Two http://t.co/4y1SDzHLGt
152,328392978584436736,Sun Apr 28 06:19:21 +0000 2013,1,0,"I rant, therefore I am. -- Dennis Miller"
153,328373595912941569,Sun Apr 28 05:02:20 +0000 2013,0,0,I love to go to Washington - if only to be near my money. -- Bob Hope
154,328354158375747585,Sun Apr 28 03:45:06 +0000 2013,2,0,My fake plants died because I did not pretend to water them. -- Mitch Hedberg
155,328324367157194752,Sun Apr 28 01:46:43 +0000 2013,0,0,Can you hold your breath without holding your nose?
156,328294629080453120,Sat Apr 27 23:48:33 +0000 2013,1,1,"Treat your password like your toothbrush. Don't let anybody else use it, and get a new one every six months. -- Clifford Stoll"
157,328272912228429824,Sat Apr 27 22:22:15 +0000 2013,1,0,"My father would take me to the playground, and put me on mood swings. -- Jay London"
158,328269876407984128,Sat Apr 27 22:10:12 +0000 2013,0,0,WTHR Health and Fitness Expo kicks off http://t.co/9md4Qp9BCA
159,328243329160585217,Sat Apr 27 20:24:42 +0000 2013,1,1,"It is not length of life, but depth of life. -- Ralph Waldo Emerson"
160,328000904013942784,Sat Apr 27 04:21:24 +0000 2013,0,1,Health and Fitness: The basics on how to get strong http://t.co/MLzE6Blaif
161,327794125653024769,Fri Apr 26 14:39:44 +0000 2013,0,0,Health and Fitness: Get the Anna Friel look http://t.co/IBNG1GNHNr
162,327516116614279169,Thu Apr 25 20:15:01 +0000 2013,0,0,Walk Your Way to Health and Fitness http://t.co/KrgwvoKe0y
163,327175547669061632,Wed Apr 24 21:41:43 +0000 2013,0,0,Health and Fitness Equipment Launches Website for Shopping and News http://t.co/mLLTEY3N1W
164,326972576314294272,Wed Apr 24 08:15:11 +0000 2013,1,0,"Bay Area health and fitness events, April 24 http://t.co/PfxUUJgN6I"
165,326772815288229889,Tue Apr 23 19:01:24 +0000 2013,1,1,"U.S. Army, Perry High School to present Health and Fitness expo Wednesday http://t.co/AT7zC09mV7"
166,326565223916007425,Tue Apr 23 05:16:31 +0000 2013,0,1,"If one does not know to which port one is sailing, no wind is favorable. -- Lucius Annaeus Seneca"
167,326541836200067075,Tue Apr 23 03:43:35 +0000 2013,5,2,There is no sadder sight than a young pessimist. -- Mark Twain
168,326433031768379393,Mon Apr 22 20:31:14 +0000 2013,0,0,Free health and fitness expo to run Saturday http://t.co/t68F1WE8Bw
169,326293298090229761,Mon Apr 22 11:15:59 +0000 2013,1,0,Grants help to transform pupils' health and fitness http://t.co/7F5mLpKHs8
170,326096374552752128,Sun Apr 21 22:13:28 +0000 2013,0,0,Does Weed Belong in the Health and Fitness Debate? http://t.co/R3sPjmjdgB
171,325827895031365633,Sun Apr 21 04:26:38 +0000 2013,1,1,"A budget tells us what we can't afford, but it doesn't keep us from buying it. -- William Feather"
172,325507474041995264,Sat Apr 20 07:13:24 +0000 2013,0,0,Navajo prep students learn about health and fitness http://t.co/ZtqZL85Jk3
173,325457606225309696,Sat Apr 20 03:55:14 +0000 2013,1,1,"If truth is beauty, how come no one has their hair done in the library? -- Lily Tomlin"
174,325375014734024707,Fri Apr 19 22:27:03 +0000 2013,0,0,"Spring into shape with these simple, useful health and fitness tips http://t.co/i3BipmZN4h"
175,325109969001259009,Fri Apr 19 04:53:51 +0000 2013,0,0,The wheel that squeaks the loudest is the one that gets the grease. -- Josh Billings
176,325085097965527044,Fri Apr 19 03:15:01 +0000 2013,2,0,I get to play golf for a living. What more can you ask for - getting paid for doing what you love. -- Tiger Woods
177,324813254369099776,Thu Apr 18 09:14:49 +0000 2013,0,0,Dragonboat team's new fund promotes health and fitness http://t.co/mq9jDO4tBX
178,324613015632740352,Wed Apr 17 19:59:08 +0000 2013,0,0,Peak Total Fitness Offers Personal Trainer &amp; Health and Fitness Program in ... http://t.co/lPkKexuwi4
179,324403300550205440,Wed Apr 17 06:05:48 +0000 2013,0,0,Bay Area health and fitness events http://t.co/x6dGwTtzYI
180,324380723958128640,Wed Apr 17 04:36:05 +0000 2013,0,0,"The fastest way to succeed is to look as if you're playing by somebody else's rules, while quietly playing by your own. -- Michael Korda"
181,324115324981092352,Tue Apr 16 11:01:29 +0000 2013,0,0,Oklahoma health and fitness briefs http://t.co/MY7992syA2
182,323919029238632449,Mon Apr 15 22:01:29 +0000 2013,0,0,"The pros, cons and complications of Coumadin | HEALTH AND FITNESS http://t.co/LXycUfwIZx"
183,323645374935998465,Mon Apr 15 03:54:05 +0000 2013,0,0,Health and fitness calendar http://t.co/kgDzvFdSy3
184,323635124807798784,Mon Apr 15 03:13:21 +0000 2013,1,0,"I'm an idealist. I don't know where I'm going, but I'm on my way. -- Carl Sandburg"
185,323610454188494848,Mon Apr 15 01:35:19 +0000 2013,0,0,Only a monopolist could study a business and ruin it by giving away products. -- Scott McNealy
186,323323972819238912,Sun Apr 14 06:36:56 +0000 2013,0,0,HEALTH AND FITNESS: Candy and soda for breakfast http://t.co/jrxDHqK843
