,id_str,created_at,retweet_count,favorite_count,text
187,323320813350694912,Sun Apr 14 06:24:23 +0000 2013,1,0,"A lot of people are afraid of heights. Not me, I'm afraid of widths. -- Steven Wright"
188,323272132400410624,Sun Apr 14 03:10:57 +0000 2013,2,1,"Older people shouldn't eat health food, they need all the preservatives they can get. -- Robert Orben"
189,323256253096800256,Sun Apr 14 02:07:51 +0000 2013,0,0,What does it mean to pre-board? Do you get on before you get on? -- George Carlin
190,323227789048311808,Sun Apr 14 00:14:44 +0000 2013,0,0,"Supercomputers will achieve one human brain capacity by 2010, and personal computers will do so by about 2020. -- Ray Kurzweil"
191,323201275086901248,Sat Apr 13 22:29:23 +0000 2013,0,0,Who was your HS crush?
192,323196855020310528,Sat Apr 13 22:11:49 +0000 2013,0,0,Health and Fitness Assessment http://t.co/IyrO65W1RB
193,322938285372604419,Sat Apr 13 05:04:21 +0000 2013,0,0,The final test of a leader is that he leaves behind him in other men the conviction and the will to carry on. -- Walter Lippmann
194,322802734690627585,Fri Apr 12 20:05:43 +0000 2013,0,0,Health and fitness tools for all http://t.co/t9mSyDUpOv
195,322802734623498240,Fri Apr 12 20:05:43 +0000 2013,0,0,Health and fitness tools for all http://t.co/E6P1NHaO6R
196,322581333589254144,Fri Apr 12 05:25:57 +0000 2013,1,0,A government that robs Peter to pay Paul can always depend on the support of Paul. -- George Bernard Shaw
197,322467472450150400,Thu Apr 11 21:53:31 +0000 2013,0,0,Fitness Website http://t.co/WMxkahHsmS Changes Profile to Health and Fitne... http://t.co/Kl81sIsPjp
198,322263751082512384,Thu Apr 11 08:24:00 +0000 2013,0,0,Prepare for Global Employee Health and Fitness Month http://t.co/M2vlYZ2Kdy
199,321859572098813952,Wed Apr 10 05:37:56 +0000 2013,0,0,"My computer beat me at checkers, but I sure beat it at kickboxing. -- Emo Philips"
