,id_str,created_at,retweet_count,favorite_count,text
0,443865813506727936,Wed Mar 12 21:47:11 +0000 2014,0,0,Tony pouring the post-summit toast! #cfsummit http://t.co/wsPLTMZ7Xp
1,443858084805357568,Wed Mar 12 21:16:28 +0000 2014,1,0,"Lloyd Provost: ""when you're lost, any map will do"". #cfsummit"
2,443851934756110336,Wed Mar 12 20:52:02 +0000 2014,0,0,Lean process improvement: Lloyd P. debunking the negative connotation (it's not just about reducing number of employees) #cfsummit
3,443850207663386624,Wed Mar 12 20:45:10 +0000 2014,0,0,"@MCFC need an improvement strategy if they are to beat Barca tonight. 10 minutes to brainstorm change ideas, then 45 to do it #cfsummit"
4,443849210903801856,Wed Mar 12 20:41:12 +0000 2014,0,0,"In long term improvement methods, relationships matter (and not just between researchers)! #cfsummit #edchat"
5,443847666594611201,Wed Mar 12 20:35:04 +0000 2014,0,0,Q from audience: it's not RCT versus improvement. Aren't matter &amp; antimatter. #cfsummit Depends on question being asked
6,443842937684635648,Wed Mar 12 20:16:17 +0000 2014,0,0,"Parsing quality planning, quality control, quality improvement with the man Lloyd Provost #cfsummit. Love it!"
7,443842406513770496,Wed Mar 12 20:14:10 +0000 2014,0,0,"Chris Thorn, Lloyd Provost on various improvement methods. But wait, they're not all improvement (I'm looking at you, Prog Eval) #cfsummit"
8,443822040026341376,Wed Mar 12 18:53:14 +0000 2014,1,0,Bryk's wish: let us all become improvers. Make it better. #cfsummit
9,443820864157409280,Wed Mar 12 18:48:34 +0000 2014,0,0,Not-really-closing remarks from Pres. Bryk @ #cfsummit @CarnegieFdn Shout out to Board member support. But summit rolls on.
10,443819985945624576,Wed Mar 12 18:45:05 +0000 2014,0,0,#cfsummit trending now! Great keynote by Clay Shirky. @CarnegieFdn #edchat
11,443819266010136576,Wed Mar 12 18:42:13 +0000 2014,1,2,"Clay Shirky arguing for a reorienting of quality to include communal aspect of education experience, not just content #cfsummit #edchat"
12,443816589276614656,Wed Mar 12 18:31:35 +0000 2014,0,1,Culture of awesome is not enough in ed opportunities to learn. Need social engagement. #cfsummit
13,443815530944675840,Wed Mar 12 18:27:22 +0000 2014,0,0,Students know they can't get by w/o inward facing culture of education. They'll create it if it's not provided. #cfsummit
14,443814644835045376,Wed Mar 12 18:23:51 +0000 2014,2,0,RT @glee_glo: Funny: clay shirky offering support for throwing out carnegie units at #cfsummit. (not in so many words)
15,443814501536628736,Wed Mar 12 18:23:17 +0000 2014,1,0,Only way learning happens: change in thought or action by the student. Can't project learning outward #cfsummit
16,443814039802499072,Wed Mar 12 18:21:27 +0000 2014,1,0,Learning is anything that is internalized and that increases peoples' capabilities #cfsummit #capabilities http://t.co/nQXanrH1XO
17,443813328230445057,Wed Mar 12 18:18:37 +0000 2014,0,0,#Clay shirky: no such thing as a special edu  tech. Internet can and should be used to teach. #cfsummit #edchat
18,443812385980030977,Wed Mar 12 18:14:53 +0000 2014,0,0,Clay Shirky on media use in ed #cfsummit http://t.co/Q940H7Pc7s
19,443811862761570304,Wed Mar 12 18:12:48 +0000 2014,0,0,Risk of recreating outward facing culture of ed and ignoring the community oriented culture when scaling up: clay shirky #cfsummit
20,443800884137316352,Wed Mar 12 17:29:10 +0000 2014,1,0,"Hearing the word ""iterate"" a lot when chatting about innovation w/Alicia from @CarnegieFdn &amp; Sandy from @ideo #cfsummit #edchat"
21,443799791596630016,Wed Mar 12 17:24:50 +0000 2014,1,1,"Good Q: how to get around hierarchical nature of ed orgs when innovating? Ask forgiveness later, says @ideo #cfsummit"
22,443798732862001152,Wed Mar 12 17:20:37 +0000 2014,0,0,#cfsummit chat should be part of #edchat - expanding the audience
23,443798270519689216,Wed Mar 12 17:18:47 +0000 2014,0,0,Lesson about innovation cycles: in IDEO speak 'get out of your office and go and see.' Do a gemba walk. #cfsummit #gembawalk
24,443792124731867136,Wed Mar 12 16:54:22 +0000 2014,0,0,Alicia Grunow on the 90 day cycle innovation process at @CarnegieFdn #cfsummit http://t.co/ju2TaIDki2
25,443790377149927424,Wed Mar 12 16:47:25 +0000 2014,0,0,IDEO: you can't dictate when people can be creative and when they can't.  #cfsummit
26,443789421171601409,Wed Mar 12 16:43:37 +0000 2014,0,0,Part of being inspired is created micro-processes for communicating with each other #cfsummit @ideo
27,443788766423949312,Wed Mar 12 16:41:01 +0000 2014,0,0,Things to help innovation: leverage analogous situations outside of education. Who else has solved a similar problem? #cfsummit
28,443788142630277120,Wed Mar 12 16:38:33 +0000 2014,0,1,Design thinking from IDEO: http://t.co/yuavWSaHZV #cfsummit
29,443787866783498241,Wed Mar 12 16:37:27 +0000 2014,0,0,Things to help innovation: have a process #cfsummit
30,443787389899526144,Wed Mar 12 16:35:33 +0000 2014,0,0,"Bandwidth constraint: hard to be optimistic about the future when resources (time, people, etc.) #cfsummit"
31,443787108386213888,Wed Mar 12 16:34:26 +0000 2014,3,1,How can we routinely innovate? Avoid insta-system thinking ( thinking things can't change because the system is messed up) #cfsummit
32,443786269743542272,Wed Mar 12 16:31:06 +0000 2014,0,0,IDEO: understand the viewpoint of people you're attempting to serve #cfsummit
33,443785823691878400,Wed Mar 12 16:29:20 +0000 2014,0,0,IDEO: approach design through the lens of people and what meets their needs #cfsummit #usercentered
34,443785079014187008,Wed Mar 12 16:26:22 +0000 2014,1,1,Good question from audience: how to get around culture of fear to support innovation &amp; risk taking? #cfsummit
35,443782707290468353,Wed Mar 12 16:16:57 +0000 2014,0,0,White caps on the SF bay this morning. Watch out for flying squid #cfsummit #flyingmollusk
36,443781662032142336,Wed Mar 12 16:12:47 +0000 2014,0,0,San Ramon room @ #cfsummit has great view over the bay. Why didn't I hang out here yesterday?
37,443780585798897665,Wed Mar 12 16:08:31 +0000 2014,0,0,I'm gearing up for day 2 at the #cfsummit - Design firm IDEO on where new ideas come from. Fresh! @ideo
38,443530395233964032,Tue Mar 11 23:34:21 +0000 2014,0,0,Networking reception @ #cfsummit http://t.co/nfoYGf1Ybk
39,443525501231980544,Tue Mar 11 23:14:54 +0000 2014,0,0,Excellence: doing the right thing when nobody is watching. -Hubby Rao #cfsummit @huggyrao
40,443521363731415040,Tue Mar 11 22:58:28 +0000 2014,0,0,No talk yet about the role of standard work in ed #improvement @#cfsummit - or have it missed it?
41,443519035364229120,Tue Mar 11 22:49:12 +0000 2014,0,0,"7 ""scaling mantras"" from Huggy &amp; Sutton in Scaling Up Excellence: Huggy churning through them now @ #cfsummit #feartheclusterfug"
42,443518109639405569,Tue Mar 11 22:45:32 +0000 2014,0,0,"Huggy Rao: scaling up so often ends in a ""clusterfug"". #cfsummit #clusterfug"
43,443514705202524161,Tue Mar 11 22:32:00 +0000 2014,0,1,"Best nickname at the #cfsummit so far? Hayagreeva ""Huggy"" Rao @huggyrao"
44,443513121731117058,Tue Mar 11 22:25:42 +0000 2014,2,0,"Final keynote of the day: Hayagreeva ""Huggy"" Rao, @StanfordEd CASBS Fellow, now @ #cfsummit. Bio here: http://t.co/905XF1DI7P"
45,443508728201883648,Tue Mar 11 22:08:15 +0000 2014,1,2,"The Black Keys are playing @ the #cfsummit! But just in the background, not live. Oh well. Next time."
46,443505833532342273,Tue Mar 11 21:56:45 +0000 2014,0,0,"Secret sauce for improvement? Doesn't exist, but if it did it would be the mindset of a rigorous inquiry cycle #cfsummit"
47,443505256811352066,Tue Mar 11 21:54:27 +0000 2014,0,0,Long Beach State - Long Beach Unified partnership shows district-university collaboration possible #cfsummit
48,443504176941654016,Tue Mar 11 21:50:10 +0000 2014,0,0,"Questioning our assumptions about ""teacher quality"" - why not include ability to engage in inquiry cycle in this definition? #cfsummit"
49,443502611627384833,Tue Mar 11 21:43:57 +0000 2014,0,0,"#ChampionsLeague matches over for tonight. All you mournful Arsenal fans, time to tune in to the #cfsummit Twitter feed. Yes?"
50,443500174199885824,Tue Mar 11 21:34:16 +0000 2014,2,1,J. Solomon of Boston Teacher Residency: combining teacher prep and PD into one continuum w/same instructor #cfsummit #ideas @BTRupdates
51,443499545498902529,Tue Mar 11 21:31:46 +0000 2014,0,0,Ambitious instruction: high on rigor &amp; engagement. Not collages of Paradise Lost. #cfsummit #JohnMilton
52,443499145555234817,Tue Mar 11 21:30:10 +0000 2014,1,1,"J. Solomon of @BTRupdates - student learning should be our ultimate outcome metric, backward map from there. #cfsummit"
53,443497809484869633,Tue Mar 11 21:24:52 +0000 2014,0,0,Developing teacher human capital won't by itself get you to improve the instructional core #cfsummit #teaching
54,443497452084011008,Tue Mar 11 21:23:27 +0000 2014,0,0,"Jesse Solomon of Boston Teacher Residency @ #cfsummit talking about teacher apprenticeship programs. Tackling shortage of teachers, turnover"
55,443495706137878529,Tue Mar 11 21:16:30 +0000 2014,2,0,"If you can't draw a picture of your education system, you don't understand it. Same with a process #cfsummit #processmap #systemsthinking"
56,443494725329227776,Tue Mar 11 21:12:36 +0000 2014,0,0,"Teacher human capital development can't happen w/o attending to social capital - trust, norms, collaborative relationship #cfsummit"
57,443493837227315200,Tue Mar 11 21:09:05 +0000 2014,0,0,"Achievement First: district career ladder is clear for teachers, but what about leadership while staying in the classroom? #cfsummit"
58,443492955106471936,Tue Mar 11 21:05:34 +0000 2014,0,0,Lots of interaction at #cfsummit breakout LM3: professional teacher learning. Nice and boisterous! http://t.co/1hJtrlKibw
59,443491827711111168,Tue Mar 11 21:01:06 +0000 2014,0,0,Heather K of @aspire public schools: school culture (social capital) happens by accident or purposefully. The latter is better #cfsummit
60,443489051908116480,Tue Mar 11 20:50:04 +0000 2014,2,0,"Jeannie Myung: to focus on human capital is too simplistic. Interacts w/instructional infrastructure, social capital in schools #cfsummit"
61,443488673472868352,Tue Mar 11 20:48:34 +0000 2014,0,1,"Getting the best at getting better: intentional professional learning. Aspire PS, Boston TR &amp; Hendy Ave Consulting. Now @ #cfsummit"
62,443482673084784641,Tue Mar 11 20:24:43 +0000 2014,1,0,Partners in School Innovation: Great org doing great work supporting lowest-performing schools #cfsummit @PartnersSI @PartnersSIDerek
63,443481943389118464,Tue Mar 11 20:21:49 +0000 2014,0,0,"Derek Mitchell: W/o deliberate improvement method, all you can do is change your mind about what you're doing @PartnersSI @PartnersSIDerek"
64,443480350920945664,Tue Mar 11 20:15:29 +0000 2014,1,0,"Love hearing stories of improvement work in context. @NewVisionsNYC, Partners in School Innovation &amp; Jim Shipley. #cfsummit"
65,443477953779748864,Tue Mar 11 20:05:58 +0000 2014,0,0,"Ted Mitchell: ""So much reform, so little change."" Luncheon keynote @ #cfsummit"
66,443439255516626944,Tue Mar 11 17:32:11 +0000 2014,0,0,Park at #cfsummit - starting small with pdsa cycles to learn fast what works for whom under what conditions in principal-teacher feedback
67,443438115114332160,Tue Mar 11 17:27:39 +0000 2014,3,1,Sandra Park presenting BTEN theory of change. Improving teacher feedback #cfsummit #driverdiagram http://t.co/Ntm4azkB8G
68,443437674590785536,Tue Mar 11 17:25:54 +0000 2014,1,0,Provost: network principle = competing to be the best cooperating ind or group in the network #cfsummit #networks
69,443436465662353408,Tue Mar 11 17:21:06 +0000 2014,1,0,"Multiple measures required for improvement cycles, not just outcomes: Lloyd Provost #cfsummit"
70,443428847040479233,Tue Mar 11 16:50:50 +0000 2014,0,0,Baseline data critical to measuring for improvement #cfsummit http://t.co/njB2iRa96b
71,443427816504164352,Tue Mar 11 16:46:44 +0000 2014,1,0,"RT @bwileyone: Love approach taken in Menomonee Falls, WI - develop ""Plan, Do, Study"" plans. short cycle review/reflection of goals #cfsumm…"
72,443427739316797440,Tue Mar 11 16:46:26 +0000 2014,0,0,Modeling model for improvement at #cfsummit Predicting and testing changes http://t.co/5mx1CgmobH
73,443424551729250304,Tue Mar 11 16:33:46 +0000 2014,0,0,"How do we turn hunches, ideas into improvements? Provost explaining the model for improvement. #cfsummit"
74,443424250234277888,Tue Mar 11 16:32:34 +0000 2014,0,0,What are we trying to accomplish? How do we know change=improvement? What changes =&gt; improvement. #modelforimprovement #cfsummit
75,443418160029376512,Tue Mar 11 16:08:22 +0000 2014,0,0,Variability in outcomes is the natural state of things. How do you know change is an improvement?#improvement #cfsummit
76,443412873125974016,Tue Mar 11 15:47:21 +0000 2014,0,0,Gawande: making systems work is the great task of our time #cfsummit
77,443412070759821313,Tue Mar 11 15:44:10 +0000 2014,0,0,Integrating 2 big ideas: disciplined improvement science + structured networks #cfsummit #NICs
78,443411262383206401,Tue Mar 11 15:40:57 +0000 2014,1,0,Achieving sustained reform is fundamentally a system coordination problem.  #cfsummit
79,443410628649041920,Tue Mar 11 15:38:26 +0000 2014,0,0,M.O. in #edreform: going fast but learning slow #cfsummit
80,443409508912488448,Tue Mar 11 15:33:59 +0000 2014,2,0,"Bryk: that we fail is not problematic, but that we fail to learn from it is #cfsummit"
81,443405015323926528,Tue Mar 11 15:16:08 +0000 2014,0,0,Systematic inquiry of practice with practitioners can accelerate improvement #cfsummit #partners
82,443404218305507328,Tue Mar 11 15:12:58 +0000 2014,0,0,Ed can learn from other industries while appreciating critical differences - Tony Bryk #cfsummit
83,443403800276004864,Tue Mar 11 15:11:18 +0000 2014,0,0,Inspiration from quality improvement in healthcare: getting to continuously improving is what we do here #cfsummit
84,443403178042601472,Tue Mar 11 15:08:50 +0000 2014,0,0,Tony Bryk describing chasm between aspirations for ed &amp; what is currently possible to achieve #cfsummit http://t.co/3PeNlbsYUl
85,443402231857958912,Tue Mar 11 15:05:04 +0000 2014,4,4,Much more can be accomplished together than even the best of us can accomplish alone #cfsummit #networks
86,443401473959792640,Tue Mar 11 15:02:04 +0000 2014,0,0,Gay Clyburn introducing Tony Bryk #cfsummit http://t.co/HukCccoEjT
87,443400415413940224,Tue Mar 11 14:57:51 +0000 2014,1,0,Capacity crowd filling up for improvement in ed #cfsummit http://t.co/3hYJeweVBY
88,443399254308970497,Tue Mar 11 14:53:14 +0000 2014,0,0,Bryk keynote in 10 min at #cfsummit. It begins! http://t.co/GaOGTBgeHI
89,443397816715452416,Tue Mar 11 14:47:32 +0000 2014,0,0,Networking at #cfsummit. Busy morning already! http://t.co/Lzix7kXss2
90,443131212232523776,Mon Mar 10 21:08:08 +0000 2014,4,0,Lloyd Provost: layering tech on top of a bad system enables us to more quickly and efficiently get bad outcomes #cfsummit @CarnegieFdn
91,443125734702190593,Mon Mar 10 20:46:22 +0000 2014,1,0,"Data for ed improvement is about processes in teaching &amp; learning, not just outcomes. #cfsummit"
92,443092068911439873,Mon Mar 10 18:32:36 +0000 2014,0,0,"""All improvement requires change, but not all change is an improvement"" #cfsummit #improvementbasics"
93,443086860374388736,Mon Mar 10 18:11:54 +0000 2014,3,3,R. Rothman: so-called 'non-cognitive' skills not really non-cognitive &amp; need another name. #Productivepersistence? #cfsummit @CarnegieFdn
94,443076901003743232,Mon Mar 10 17:32:19 +0000 2014,0,0,#greenshirts everywhere at #cfsummit. Looking classy! http://t.co/nrHvlLzjak
95,443074638285770752,Mon Mar 10 17:23:20 +0000 2014,0,0,Question for US ed systems: how to get past 'solutionitis' in #edreform and towards systems thinking? #cfsummit @usedgov
96,443074035451060224,Mon Mar 10 17:20:56 +0000 2014,0,0,Pre-conf courses up and running. Student success driven by tenacity+psychological strategies. #cfsummit #improvement http://t.co/rbB8StlScy
97,443070090104172544,Mon Mar 10 17:05:16 +0000 2014,0,0,Hanging in the VIP room at the #cfsummit on improvement in education. Party starting already!
98,443068645921419264,Mon Mar 10 16:59:31 +0000 2014,2,0,Site of Carnegie education summit: overlooking SF bay. Beautiful! #cfsummit @CarnegieFdn http://t.co/97s24SXtpZ
99,443067604127604738,Mon Mar 10 16:55:23 +0000 2014,1,0,1st national summit on improvement in education #cfsummit @CarnegieFdn @edweekevents http://t.co/tNoXkCGVlE
100,443066876797517824,Mon Mar 10 16:52:29 +0000 2014,1,0,"Day 1 of Carnegie Summit: Tony Bryk, Dan Heath, Huggy Rao, Ted Mitchell, Clay Shirky keynotes.  Pumped! #cfsummit @CarnegieFdn"
101,432610894812426240,Sun Feb 09 20:24:09 +0000 2014,0,0,"This is nice: Adam Gopnik on ""Why I don't tweet"". And I just tweeted it! http://t.co/EmgSoJP054"
102,428311279074160640,Tue Jan 28 23:39:01 +0000 2014,0,0,"Background paper for @EFAReport compares teacher training in Ethiopia, Pakistan &amp; Tanzania
http://t.co/zXcsHeZvwB"
103,428310812902445056,Tue Jan 28 23:37:10 +0000 2014,0,0,"Check out new @EFAReport on teaching &amp; learning. 
http://t.co/A3XrauZHfY"
104,425383421062307840,Mon Jan 20 21:44:45 +0000 2014,0,0,It's dry here: 6 Scary Facts About California's Drought http://t.co/VMOd6aYHMv via @motherjones
105,425377746663915520,Mon Jan 20 21:22:12 +0000 2014,200,0,RT @UNICEF: Wealth of half world’s population the same as that of 85 richest people. Via @oxfam http://t.co/Iw1JkuvDpr  #inequality
106,423220045561335808,Tue Jan 14 22:28:16 +0000 2014,0,0,"“@nprnews: In California, Alarm Grows Over Shrinking Water Levels http://t.co/reVVwd4AQt”"
107,422118612669714433,Sat Jan 11 21:31:34 +0000 2014,0,0,The Raleigh Experiment http://t.co/Jcz2HRZaUb
108,422109040986951681,Sat Jan 11 20:53:32 +0000 2014,0,0,Marc Tucker uses words sophistry and poppycock in same blog = excellent! http://t.co/qZJaxWC2Ou
109,422077515964751872,Sat Jan 11 18:48:16 +0000 2014,0,0,@CarnegieFdn pres Tiny Bryk: We need smarter systems in Ed capable of learning. #improvement #summit http://t.co/tNoXkCXYnE
110,422060778271682560,Sat Jan 11 17:41:45 +0000 2014,9,0,RT @macfound: Research psychologist &amp; #MacFellow Angela Duckworth's work on #grit cited in @NYTmag - http://t.co/af6lLice4d #learning #kids…
