,id_str,created_at,retweet_count,favorite_count,text
0,476374055130382337,Tue Jun 10 14:43:20 +0000 2014,0,0,Please don't be like the rest.
1,468341795101765633,Mon May 19 10:45:59 +0000 2014,0,0,"No matter how good or bad you think life is, wake up each day and be thankful for your life."
2,468313445859721216,Mon May 19 08:53:20 +0000 2014,0,0,"I just need a day off from reality, just a day without people, problems, and all the bullshit that runs through my mind."
3,457273716611633152,Fri Apr 18 21:45:24 +0000 2014,0,0,"I know I'm not alone, but I constantly feel like I am."
4,457259189383880704,Fri Apr 18 20:47:40 +0000 2014,0,0,"Smile, it makes a world of difference."
5,457244630535249921,Fri Apr 18 19:49:49 +0000 2014,0,0,1 text 1 song 1 mistake 1 lie 1 phone call 1 word 1 truth 1 place 1 person 1 movie could change your mood in 1 second.
6,457229995979448320,Fri Apr 18 18:51:40 +0000 2014,0,0,"""I had a dream about you last night."" ""Awww!"" ""Yeah, you died..."""
7,457215569205264384,Fri Apr 18 17:54:21 +0000 2014,0,0,guy sweatpants &gt; girl sweatpants 👌
8,457200766168465408,Fri Apr 18 16:55:31 +0000 2014,0,0,It's hard to find someone that actually sticks around for a while.
9,457186339910197249,Fri Apr 18 15:58:12 +0000 2014,0,0,"Teacher: ""You think it's funny!?"" Of course I do bitch, that's why I laughed..."
10,457171892613287937,Fri Apr 18 15:00:47 +0000 2014,0,0,I wanted you to fight for me. And tell me that you would rather be alone than with anyone else.
11,457157345265451008,Fri Apr 18 14:02:59 +0000 2014,0,0,"If we talk, then we talk. If we don't, then we don't. If it goes somewhere, then it goes somewhere. If it doesn't, then it doesn't."
12,457142693320069120,Fri Apr 18 13:04:46 +0000 2014,0,0,"If your makeup isn’t done, your hair is a mess and he still can’t resist taking you into his arms, he’s a keeper."
13,457128259927306240,Fri Apr 18 12:07:24 +0000 2014,0,0,Your relationship ended. Not your life. So wipe your tears and keep living.
14,457113762281975808,Fri Apr 18 11:09:48 +0000 2014,0,0,"Don’t be the girl who needs a man, be the girl a man needs."
15,457099287449464834,Fri Apr 18 10:12:17 +0000 2014,0,0,"Don't wait too long, you might miss your chance."
16,457084758489432064,Fri Apr 18 09:14:33 +0000 2014,0,0,"I like to being alone, listening to music in my own world, away from all the bullshit in life."
17,457070308269101056,Fri Apr 18 08:17:08 +0000 2014,0,0,"I don't need a perfect relationship, I just need someone who won't give up on me."
18,457055203615723521,Fri Apr 18 07:17:06 +0000 2014,0,0,"If you don't want a sarcastic answer, don't ask a stupid question."
19,457040178247249920,Fri Apr 18 06:17:24 +0000 2014,0,0,"I'm breathing, so I'm blessed."
20,457025541040644096,Fri Apr 18 05:19:14 +0000 2014,0,0,"Phone: *ringing* Me: *picks up* Friend: ""Hey dude, are you home? :)"" Me: ""Oh no way bro, I just picked up my home phone from McDonalds."""
21,457010857969348608,Fri Apr 18 04:20:54 +0000 2014,0,0,Sometimes the best moments are the ones you didn't plan at all.
22,456996261795606528,Fri Apr 18 03:22:54 +0000 2014,0,0,"Be who you are, atleast you're real."
23,456981627239804929,Fri Apr 18 02:24:44 +0000 2014,0,0,A real man ends a relationship before starting another one.
24,456966965731397632,Fri Apr 18 01:26:29 +0000 2014,0,0,"""K"" is the shortest way to spell ""Fuck you."""
25,456952090305110016,Fri Apr 18 00:27:22 +0000 2014,0,0,"The moment my eyes meet yours, I believed in love at first sight."
26,456937224173809664,Thu Apr 17 23:28:18 +0000 2014,0,0,"I have a date tonight, with my bed. We're totally gonna sleep together."
27,456922555316588546,Thu Apr 17 22:30:01 +0000 2014,0,0,Life goes on... with or without you.
28,456907869758443520,Thu Apr 17 21:31:39 +0000 2014,0,0,✔ Food ✔ Bed ✔ Music ✔ Twitter ✔ Cellphone = Perfect day.
29,456893239841128448,Thu Apr 17 20:33:31 +0000 2014,0,0,"No matter how many times I've been done wrong, I'll continue to be faithful, honest, &amp; loving. Sooner or later someone will appreciate it."
30,456878402977284097,Thu Apr 17 19:34:34 +0000 2014,0,0,I want someone who will stay with me no matter how hard I am to be with.
31,456863588066398208,Thu Apr 17 18:35:42 +0000 2014,0,0,"Roses are niggas. Violets are niggas. I'm Lil Wayne, And niggas ryhmes with niggas."
32,456848797084041216,Thu Apr 17 17:36:55 +0000 2014,0,0,Don't give up on things that make you smile...
33,456833759237513216,Thu Apr 17 16:37:10 +0000 2014,0,0,"“Lets stay up all night!” “Fuck yeah! :D” *2 hours later* “Man, I'm tired.”"
34,456818182276526080,Thu Apr 17 15:35:16 +0000 2014,0,0,"Being in a relationship is a full-time job, don't apply if you're not ready."
35,456803039718825984,Thu Apr 17 14:35:06 +0000 2014,0,0,Can we start over again? Do it right this time?
36,456786615927439361,Thu Apr 17 13:29:50 +0000 2014,0,0,"U, R, 2, 6, C, I, 1, 2, 4, Q. Retweet if you get."
37,456771571995377664,Thu Apr 17 12:30:03 +0000 2014,0,0,When boys text you first. ❤
38,456756071948759040,Thu Apr 17 11:28:28 +0000 2014,0,0,"The best nights are usually unplanned, random, and spontaneous."
39,456739329809735682,Thu Apr 17 10:21:56 +0000 2014,0,0,"Stay strong, make them wonder how you're still smiling."
40,456724114313871360,Thu Apr 17 09:21:29 +0000 2014,0,0,"I love waking up to your ""good morning"" text. ❤☀"
41,456693733614837761,Thu Apr 17 07:20:45 +0000 2014,0,0,RT if you can't sleep because that one person is on your mind… ❤
42,456678810130198528,Thu Apr 17 06:21:27 +0000 2014,0,0,"That awkward moment when a package says ""Easy open"" and you end up using scissors, a knife, a hammer and a lightsaber to open it."
43,450753921766535168,Mon Mar 31 21:58:04 +0000 2014,0,0,"If you can learn from the worst times of your life, you'll be ready to go into the best times of your life."
44,450732998661390336,Mon Mar 31 20:34:55 +0000 2014,0,0,"The only people worthy to be in your life are the ones that help you through hard times, and laugh with you after the hard times pass."
45,450712724482179072,Mon Mar 31 19:14:22 +0000 2014,0,0,RT if you wanna win the Samsung Galaxy Tab! #TattAwards2013
46,450692382116167680,Mon Mar 31 17:53:32 +0000 2014,0,0,"I'm tired of people saying they care of me , when they don't care of me."
47,450530814644600835,Mon Mar 31 07:11:31 +0000 2014,0,0,"Find partners who encourage you to grow, who won't cling to you, who will let you go out into the world, and trust that you will come back."
48,450510494571323393,Mon Mar 31 05:50:46 +0000 2014,0,0,I never know how to define love until you came into my life.
49,450490260951011328,Mon Mar 31 04:30:22 +0000 2014,0,0,"Don't be the girl who needs a man, be the girl a man needs."
50,450469890411859969,Mon Mar 31 03:09:25 +0000 2014,0,0,S.I.N.G.L.E. = Strong. Independent. Nice. Generous. Loving. Energetic.
51,450449685870698496,Mon Mar 31 01:49:08 +0000 2014,0,0,Sometimes I can't stop thinking about you but other times I wonder why I even waste my time.
52,450429436353990656,Mon Mar 31 00:28:40 +0000 2014,0,0,"I'm mature enough to forgive you, but I'm not dumb enough to trust you again."
53,450409113931902977,Sun Mar 30 23:07:55 +0000 2014,0,0,"#iHateWhenPeopleSay: ""I'm always here for you"" but they're nowhere to be found when I need someone."
54,450388760903966720,Sun Mar 30 21:47:03 +0000 2014,0,0,"Before you try to change others, remember how hard it is to change yourself."
55,450368790144901120,Sun Mar 30 20:27:41 +0000 2014,0,0,"I just want the pain to go away, I just want to end it."
56,450348569069748224,Sun Mar 30 19:07:20 +0000 2014,0,0,"Easy to say "" I love you "" but so hard to make it in someone's heart."
57,450328262095286272,Sun Mar 30 17:46:39 +0000 2014,0,0,"Either you choose me, or you loose me because I am not a second option."
58,450307707908546560,Sun Mar 30 16:24:58 +0000 2014,0,0,"""You can never change people, they are who they are, accept that. But you can always change how you feel about them."""
59,450287475177443328,Sun Mar 30 15:04:34 +0000 2014,0,0,"Every girl has that one guy, that she'll never lose feelings for."
60,450267104596357121,Sun Mar 30 13:43:37 +0000 2014,0,0,"Being with no one is better than being with the wrong one. Sometimes, those who fly solo have the strongest wings."
61,450246917188890624,Sun Mar 30 12:23:24 +0000 2014,0,0,Don't worry about me or what I do. This is my life not yours.
62,450226650504916992,Sun Mar 30 11:02:52 +0000 2014,0,0,I hate when I'm always the first person texting someone. I feel like I'm being annoying.
63,450206522522341376,Sun Mar 30 09:42:54 +0000 2014,0,0,"I just wanted you to know, I think about you every night. When I fall asleep, You are in my dreams."
64,450166481322401792,Sun Mar 30 07:03:47 +0000 2014,0,0,Emotionally: done. Mentally: drained. Spiritually: strong. Physically: smile.
65,450146431295160320,Sun Mar 30 05:44:07 +0000 2014,0,0,Damaged people are dangerous. They know they can survive.
66,450126046197608448,Sun Mar 30 04:23:07 +0000 2014,0,0,Delete your message? Done. Delete your contact? Done. Delete you of my life? Sorry I can't promise.
67,449965783704018944,Sat Mar 29 17:46:17 +0000 2014,0,0,"I thought watching you leave was hard, but knowing you weren't coming back was even harder."
68,449945602902597632,Sat Mar 29 16:26:05 +0000 2014,0,0,In relationships: 1) Don't lie. 2) Don't cheat. 3) Don't make promises you can't keep.
69,449925571099643904,Sat Mar 29 15:06:30 +0000 2014,0,0,"Just because something ends doesn't mean it never should've been. Remember, you lived, you learned, you grew and you moved on."
70,449905455112781826,Sat Mar 29 13:46:34 +0000 2014,0,0,Never lie to the person you love. Its not worth it and they don't deserve it.
71,449743957543493632,Sat Mar 29 03:04:49 +0000 2014,0,0,"Maturity has nothing to do with age. Maturity comes from experiences, mistakes, learning, and understanding."
72,449723728423710720,Sat Mar 29 01:44:26 +0000 2014,0,0,Experience is the name everyone gives to their mistakes
73,449703389299896320,Sat Mar 29 00:23:37 +0000 2014,0,0,"I've seen a baby cry and seconds later he laughs. The beauty of pain, is pain never lasts."
74,449682983327264768,Fri Mar 28 23:02:32 +0000 2014,0,0,One of the happiest moments ever is when you feel the courage to let go of what you can't change.
75,449662484312383488,Fri Mar 28 21:41:05 +0000 2014,0,0,#10peopleItreasure: GOD ❤
76,449642286863757312,Fri Mar 28 20:20:49 +0000 2014,0,1,"Don't making someone's heart being bad, remember dude because karma does exist in here."
77,449621949220548608,Fri Mar 28 19:00:00 +0000 2014,0,0,Seeing my parents smile because proud of me is like the best thing ever.
78,449601897272315904,Fri Mar 28 17:40:20 +0000 2014,0,0,"I'm not mad, I'm hurt there's a difference."
79,449582215543128065,Fri Mar 28 16:22:07 +0000 2014,0,0,"The 3 C's of life: choices, chances and changes. You must make a choice to take a chance or your life will never change."
80,449561427263492096,Fri Mar 28 14:59:31 +0000 2014,0,0,"When you stop trying to find the right man and become the right woman, the right man will find his way to you."
81,449541309825445888,Fri Mar 28 13:39:34 +0000 2014,0,0,"People make mistakes, but if they're willing to put the past behind them, then we should too."
82,449521092076400640,Fri Mar 28 12:19:14 +0000 2014,0,0,"A relationship should be between two people, not the whole world."
83,449360312043442176,Fri Mar 28 01:40:21 +0000 2014,0,0,Sometimes the only person you can trust is yourself.
84,449339626579181568,Fri Mar 28 00:18:09 +0000 2014,0,0,Always hoping today is gonna be better and always better than yesterday.
85,449319360406896640,Thu Mar 27 22:57:38 +0000 2014,0,0,"Working hard is the basis of any success in life, in every job and every aspect of life."
86,449276697217470464,Thu Mar 27 20:08:06 +0000 2014,0,0,"Being with no one is better than being with the wrong one. Sometimes, those who fly solo have the strongest wings."
87,449254805303599104,Thu Mar 27 18:41:06 +0000 2014,0,0,"Best friends is always beside you when you are in sadness, not only when you are in happiness."
88,449234262248521728,Thu Mar 27 17:19:29 +0000 2014,0,0,#10peopleItreasure: My schoolmates and my teachers.
89,449212555475439617,Thu Mar 27 15:53:13 +0000 2014,0,0,It's hard to find people who will love you no matter what.
90,449191540238204928,Thu Mar 27 14:29:43 +0000 2014,0,0,Pain is nothing compared to what it feels like to quit.
91,449170958780076032,Thu Mar 27 13:07:56 +0000 2014,0,1,You can't expect things to be the same after so much has changed.
92,449150584118345728,Thu Mar 27 11:46:58 +0000 2014,0,0,"Even some of the greatest people in life, started out as nothing."
93,449130402846744577,Thu Mar 27 10:26:47 +0000 2014,0,0,Sometimes the only person you can trust is yourself.
94,449109592010547200,Thu Mar 27 09:04:05 +0000 2014,0,0,"Dear boys, when a girl says ""I'm fine."" talk to her until the real truth comes out."
95,449068674234605568,Thu Mar 27 06:21:29 +0000 2014,0,0,"The most beautiful line is, ""but, I love you."" and the most painful is ""I love you, but.."""
96,449047414603673600,Thu Mar 27 04:57:01 +0000 2014,0,0,I really hate when teachers give me a home work even in holidays.
97,449025878949756929,Thu Mar 27 03:31:26 +0000 2014,0,0,"Best friend is a friend who always belong to you no matter what happen, when you are happy or sad."
98,449005222241644544,Thu Mar 27 02:09:21 +0000 2014,0,0,"Don't forget your worth. Once you do, you lose what you deserve."
99,448964252607340544,Wed Mar 26 23:26:33 +0000 2014,0,0,Love is a strong wall put in front of you to see if you will run into it or tear it down.
100,448943094432407552,Wed Mar 26 22:02:29 +0000 2014,0,0,Pain doesn't just show up in our lives for no reason. It's a sign that something in our lives needs to change.
101,448922892667871232,Wed Mar 26 20:42:12 +0000 2014,0,0,"People make mistakes, and sometimes, a second chance can make things right."
102,448902405787111424,Wed Mar 26 19:20:48 +0000 2014,0,0,"When I'm in my badmood, all I want to see is you. All I want to hear is you, and all I want to hold is you."
103,448881650202464256,Wed Mar 26 17:58:19 +0000 2014,0,0,You can't be happy if you're still holding onto people that have already moved on.
104,448861435699818496,Wed Mar 26 16:38:00 +0000 2014,0,0,"There's a big difference between who we love, who we settle for, and who we're meant for."
105,448841628103372801,Wed Mar 26 15:19:17 +0000 2014,0,0,It's scary how much one person can mean so much to you.
106,448820437812641792,Wed Mar 26 13:55:05 +0000 2014,0,0,"I am quite certain that given a nice guitar and a recording contract, I could save the world."
107,448798985197608960,Wed Mar 26 12:29:51 +0000 2014,0,0,"I wanna be the girl you brag to your friends about, the girl you show off to the world, and the girl you love unconditionally."
108,448778527156887552,Wed Mar 26 11:08:33 +0000 2014,0,0,You can't blame someone for walking away if you didn't do anything to make them stay.
109,448615311768420352,Wed Mar 26 00:19:59 +0000 2014,0,0,#10peopleItreasure: HATERS. They made me stronger.
110,448594348641243136,Tue Mar 25 22:56:41 +0000 2014,0,0,"Either you choose me, or you loose me because I am not a second option."
111,448574076882149376,Tue Mar 25 21:36:08 +0000 2014,0,0,"Take your relationship as a test. If he cheats on you, then he has failed in getting the perfect person."
112,448552856530870273,Tue Mar 25 20:11:49 +0000 2014,0,0,"I'm scared of losing you, but then again........You're not even mine."
113,448531843109777408,Tue Mar 25 18:48:19 +0000 2014,0,0,"Being nice to those you don't particularly like is not being two-faced, it's called growing up."
114,448509781058527232,Tue Mar 25 17:20:39 +0000 2014,0,0,The best feeling comes when you realize you're perfectly happy without the people you thought you needed the most.
115,448467799904501760,Tue Mar 25 14:33:50 +0000 2014,0,0,"""Sometimes we expect more from others just because we would be willing to do that much for them."""
116,448446747707052033,Tue Mar 25 13:10:11 +0000 2014,0,0,"Maturity has nothing to do with age. Maturity comes from experiences, mistakes, learning, and understanding."
117,448426378283610113,Tue Mar 25 11:49:14 +0000 2014,0,0,Sometimes I wish I could read your mind to find out how you feel about me.
118,448405353558843392,Tue Mar 25 10:25:41 +0000 2014,0,0,I don't hate you. I've just lost all my respect for you.
119,448384750760099840,Tue Mar 25 09:03:49 +0000 2014,0,0,ReTweet if you’re a Filipino! ❤ #TattAwards2013
120,448364503021785088,Tue Mar 25 07:43:22 +0000 2014,0,1,"It doesn't matter who hurt you, or broke you down, what matters is who made you smile again."
