,id_str,created_at,retweet_count,favorite_count,text
0,669361553901121536,Wed Nov 25 03:46:45 +0000 2015,0,0,"""being patient doesn't get you what you want."""
1,669356466361372672,Wed Nov 25 03:26:32 +0000 2015,0,1,"""arm-ageddon"" lol #Limitless"
2,669234478309593088,Tue Nov 24 19:21:48 +0000 2015,28,0,"RT @MicrosoftStore: This year, #BlackFriday starts early. Our Black Friday deals are coming Thursday, 12 AM EST. Check back &amp; save big. htt…"
3,669183040996950016,Tue Nov 24 15:57:24 +0000 2015,0,0,2nd half of 2015 hasn't been going well at all
4,669182221828415489,Tue Nov 24 15:54:09 +0000 2015,0,0,"I doubt that's roundtrip.

#teef"
5,669182025262305281,Tue Nov 24 15:53:22 +0000 2015,0,0,"In order to use a ticket I have on hold with Caribbean Airlines, I have to USD $150 plus the difference of the cost of ticket..."
6,669170662691479553,Tue Nov 24 15:08:13 +0000 2015,0,0,Now I won't get to capitalize on these Black Friday deals.
7,669170277381709825,Tue Nov 24 15:06:41 +0000 2015,0,0,Still trying to figure out why the UWI has not paid me yet.
8,668980004064206848,Tue Nov 24 02:30:36 +0000 2015,0,0,i wonder who wrote this article? https://t.co/uKDvJtGUEE
9,668957328603910144,Tue Nov 24 01:00:30 +0000 2015,0,0,Either this is contouring at the highest level or... buccal fat removal.
10,668787276135157760,Mon Nov 23 13:44:46 +0000 2015,0,0,surface 3.
11,668489224220315648,Sun Nov 22 18:00:25 +0000 2015,9,0,RT @JamaicaGleaner: Dr Herbert Gayle is firing back - Researcher defends claim about abusive mothers https://t.co/VxCxVJts4D https://t.co/S…
12,668443071118311424,Sun Nov 22 14:57:01 +0000 2015,17,0,"RT @EleanorAnn_: Over time you ride the waves of your lows in silence. Everyone has their struggle, yours isn't more important. You know th…"
13,668423267384823809,Sun Nov 22 13:38:20 +0000 2015,0,0,"We ought to start using social media to improve those ""mind yo business"" skills."
14,668422139821731840,Sun Nov 22 13:33:51 +0000 2015,0,0,Rolled over a slice of cake in bed this morning and started eating it. Nom nom.
15,668160496604811264,Sat Nov 21 20:14:10 +0000 2015,200,0,"RT @UN_Women: According to a new report by @WEF, at current rates it will be 118yrs until we close gender pay gap: https://t.co/tqD67c2Oq5 …"
16,667918251473547264,Sat Nov 21 04:11:35 +0000 2015,0,0,@barringtonjr watching #theoriginals now and #tvd has a better plot twist for real
17,667874909800960001,Sat Nov 21 01:19:21 +0000 2015,0,0,@alicat791 @Mona_PostGrads @UWIMonaGuild @UWImona @FSSConnect interested
18,667742497372663808,Fri Nov 20 16:33:12 +0000 2015,169,0,"RT @lifehacker: If you installed the Windows 10 November update, run Disk Cleanup to clean 20GB+ of space: https://t.co/mKRZoTwrz8 https://…"
19,667449331755053056,Thu Nov 19 21:08:15 +0000 2015,0,0,"""sex is always better when u connect with someone on an intellectual level"" - Marissa"
20,667401516081221632,Thu Nov 19 17:58:15 +0000 2015,0,0,"Former is a broader category of criminals, latter is one group of mass murderers #buildingpeace #philosophy2015"
21,667401229283123200,Thu Nov 19 17:57:07 +0000 2015,0,0,Question: What's the difference between mass murderers and serial killers? #philosophy2015 #buildingpeace
22,667399588244918272,Thu Nov 19 17:50:36 +0000 2015,0,0,Peers reach is greater (100 others) than that of adults (10 others) #buildingpeace #philosophy2015 #herbertgayle
23,667398620765888512,Thu Nov 19 17:46:45 +0000 2015,1,0,Some of our problems are no longer social but neurobiological due to repeated exposure to violence #herbertgayle #philosophyday2015
24,667398033814892544,Thu Nov 19 17:44:25 +0000 2015,0,0,All this preaching tho... Reminds me of an aggressive church environment.
25,667397392145100801,Thu Nov 19 17:41:52 +0000 2015,0,0,"Dr. Herbert Gayle - cause of abusers: Mothers, community, fatherless homes (and partners) #philosophyday2015 https://t.co/yg0GY8vfhb"
26,667347092415713280,Thu Nov 19 14:22:00 +0000 2015,4,0,RT @Mona_PostGrads: Good morning! Are you ready for your milkshakes? We start at 11! https://t.co/IcQGBwKgbA
27,667195649746558976,Thu Nov 19 04:20:13 +0000 2015,0,0,Desperate times for boo kitty. I guess she ain't about that regular 9-5 life. I get it.
28,667156060424179718,Thu Nov 19 01:42:54 +0000 2015,0,1,I finally get what it means to have mommy and daddy issues #rosewood
29,667147330492088320,Thu Nov 19 01:08:13 +0000 2015,0,0,Relationship a bit volatile...
30,667146977046495232,Thu Nov 19 01:06:48 +0000 2015,0,0,Dont you have a storage unit or somethin? lol #Rosewood
31,667146171287076864,Thu Nov 19 01:03:36 +0000 2015,0,0,Saang @GabrielleDennis  #rosewood #talented
32,667123334073618432,Wed Nov 18 23:32:52 +0000 2015,0,0,Will be eating lunch at Chilitos for the next 2 days out of utter laziness... https://t.co/wwwmE3nnjI
33,667122101271310336,Wed Nov 18 23:27:58 +0000 2015,15,0,RT @RosewoodFOX: Don't miss tonight's exclusive #Empire scene you can only watch during #Rosewood! https://t.co/cboeFlNXci
34,667108395632214016,Wed Nov 18 22:33:30 +0000 2015,4,0,RT @qcjwomyn: Setting up for tonight's screening of Taboo Yardies @BrowardCollege Health Sciences Simulation Center @TABOOYARDIES https://t…
35,666861621898293248,Wed Nov 18 06:12:55 +0000 2015,0,0,Where Are You Now That I Need You (to buy groceries)
36,666831240117559296,Wed Nov 18 04:12:11 +0000 2015,0,0,"Apparently the ""limitless"" tablets are a thing..."
37,666676267777937408,Tue Nov 17 17:56:23 +0000 2015,0,0,"Facebook keeps reminding me of people, places and things I'd rather forget..."
38,666659398899662848,Tue Nov 17 16:49:21 +0000 2015,0,0,@ImmortalCritic Let's see if it takes a White Heterosxual Male Celebrity to change this perspective.
39,666569735522271232,Tue Nov 17 10:53:03 +0000 2015,0,0,I have no words.
40,666533128148643840,Tue Nov 17 08:27:35 +0000 2015,0,0,Been falling asleep before I can watch any of my fav tv shows. Wah kinda life mi ah live?
41,666403020117176320,Mon Nov 16 23:50:35 +0000 2015,0,0,"There's always a lady ready to sweep around your feet while u eat at juici patties, campus. That is NOT ok."
42,666384999126573057,Mon Nov 16 22:38:59 +0000 2015,0,0,I've accomplished so much today. I deserve and will get some kind of reward.
43,666306592246075392,Mon Nov 16 17:27:25 +0000 2015,0,0,Today name progess.
44,666304727911534592,Mon Nov 16 17:20:01 +0000 2015,0,0,@alsgong yesss
45,666271458046382081,Mon Nov 16 15:07:48 +0000 2015,0,0,"I swear, ""dropping asleep"" is a real thing. 

Like, mi just drap-ah-sleep."
46,666255399591391232,Mon Nov 16 14:04:00 +0000 2015,0,0,Keep forgetting to avoid ice-cream because... sinus woes.
47,665796116785459200,Sun Nov 15 07:38:58 +0000 2015,68,0,"RT @caitylotz: ""Whatever happened to Tom from Myspace"" @RattyBurvil"
48,665701948260155393,Sun Nov 15 01:24:47 +0000 2015,1,0,tiyad ah dis hair combing ting...
49,665701472999309312,Sun Nov 15 01:22:53 +0000 2015,0,0,Low afro in a few weeks...
50,665700866821767169,Sun Nov 15 01:20:29 +0000 2015,0,0,@mzmizerable89 uh oh... https://t.co/Qcl0yV5Fdo lol
51,665675861694091264,Sat Nov 14 23:41:07 +0000 2015,229,0,RT @idriselba: Can you be too honest? Just curious what you think. Research.
52,665665658655367168,Sat Nov 14 23:00:35 +0000 2015,0,0,"There's an awful cost to getting a PhD that no one talks about https://t.co/vV9f7mMY3O via @qz --&gt; or, just going to grad school."
53,665612584440098818,Sat Nov 14 19:29:41 +0000 2015,0,0,It don't make no sense unless I'm doin it with u 🎶
54,665612239387258881,Sat Nov 14 19:28:19 +0000 2015,0,0,Justin Bieber - No Sense (PURPOSE : The Movement) ft. Travi$ Scott https://t.co/kuYp3dl8EQ via @YouTube -
55,665608317390073856,Sat Nov 14 19:12:43 +0000 2015,0,0,Justin Bieber - I’ll Show You (PURPOSE : The Movement) https://t.co/Mi1cwBJAso via @YouTube --&gt; choreography on point
56,665604581947129856,Sat Nov 14 18:57:53 +0000 2015,0,0,Brené Brown on Empathy https://t.co/4imTA679ou via @YouTube - The fundamental difference between empathy and sympathy.
57,665556358771683328,Sat Nov 14 15:46:16 +0000 2015,0,0,Finally seeing the light at the end of the tunnel...
58,665355435495452672,Sat Nov 14 02:27:52 +0000 2015,0,0,"""The Problem With Calling Women 'Females' https://t.co/hqZtEDpHMZ"
59,665194522997972992,Fri Nov 13 15:48:27 +0000 2015,0,0,I am stressed.
60,665191706296389633,Fri Nov 13 15:37:16 +0000 2015,0,0,"I mean, these pranksters are sociopaths... living on the edge. I really shouldn't find them hilarious..."
61,665190148011765760,Fri Nov 13 15:31:04 +0000 2015,0,0,Am I the only one that likes watching those ridiculous/crazy Spanish and Russian prank videos? Can't be.
62,665054890952003584,Fri Nov 13 06:33:36 +0000 2015,0,0,"If these mosquitoes could get to my cornea, they would. Vicious little shits."
63,665054707900026881,Fri Nov 13 06:32:53 +0000 2015,0,0,Thanking the creators of Cutter... wherever you are and whomever you may be.
64,665015287159218176,Fri Nov 13 03:56:14 +0000 2015,0,0,What is happening?
65,664996172289847297,Fri Nov 13 02:40:17 +0000 2015,0,0,Hayley needs to work on her screams and howls.
66,664944529875664896,Thu Nov 12 23:15:04 +0000 2015,1,0,@Mona_PostGrads @EleanorAnn_ @D3RNS @D_Mills27 @Scottycus @melkayreid @Rona_Brad just being there helped with the stress... Thank u!
67,664944240028323840,Thu Nov 12 23:13:55 +0000 2015,4,0,RT @Mona_PostGrads: What a great interactive stress relief session we just had! @EleanorAnn_ @D3RNS @D_Mills27 @Scottycus @melkayreid @izen…
68,664901894431608832,Thu Nov 12 20:25:39 +0000 2015,0,0,"That being said, I might just be too comfortable with that reality."
69,664901265705463809,Thu Nov 12 20:23:09 +0000 2015,0,1,"@kimoneforbidden this is what i do when i have a crush (tell everybody) bcuz i'm only used 2 ppl havin a crush on me. it's a big deal. 
lols"
70,664900055946563584,Thu Nov 12 20:18:21 +0000 2015,0,0,"My phone effin itself today... I won't have it, Windows."
71,664899262392627200,Thu Nov 12 20:15:12 +0000 2015,0,0,@EleanorAnn_ try Express
72,664796400903852032,Thu Nov 12 13:26:27 +0000 2015,0,0,A spontaneous trip to hollywell this morning would be great
73,664645022743048192,Thu Nov 12 03:24:56 +0000 2015,0,0,Supportive and passionate inebriated people...
74,664627676863328256,Thu Nov 12 02:16:01 +0000 2015,0,0,I'm quite distracted by it.
75,664627549062885376,Thu Nov 12 02:15:30 +0000 2015,0,0,"I guess the information/discussion is more important the overall concept/layout of All Angles. 

Interesting."
76,664609398895996928,Thu Nov 12 01:03:23 +0000 2015,0,0,#Rosewood
77,664450748797730816,Wed Nov 11 14:32:58 +0000 2015,0,0,I feel there's no need for me to be this dedicated considering the lack of pay...
78,664279478588280833,Wed Nov 11 03:12:24 +0000 2015,0,0,"I kinda downloaded a copy of ""The Sociopath Next Door"" based on a reference made in The Good Wife"
79,664275605207302144,Wed Nov 11 02:57:00 +0000 2015,1,0,"""my mom said I was a prodigy at firing nannies"" #ScreamQueens"
80,664273646018367488,Wed Nov 11 02:49:13 +0000 2015,0,0,This girl is a sociopath.
81,664272329682386944,Wed Nov 11 02:43:59 +0000 2015,1,0,Chanel deserved more than a slap for that #ScreamQueens
82,664265213466845185,Wed Nov 11 02:15:42 +0000 2015,1,0,#DeniseHemphill taken aback #ScreamQueens
83,664263120408432640,Wed Nov 11 02:07:23 +0000 2015,1,0,I don't think these pledges know the difference between facts and opinions #ScreamQueens
84,664262460338212864,Wed Nov 11 02:04:46 +0000 2015,1,0,Dean Munsch kicking some royal Red Devil(s) ass... #ScreamQueens
85,664253049318191104,Wed Nov 11 01:27:22 +0000 2015,0,0,VSFS  = Dec 8
86,664252828118945792,Wed Nov 11 01:26:30 +0000 2015,0,0,Waiting for the Spectre hype to die down. Less hype = less crowd. Less crowd = some personal space at the theatre
87,664231333418299392,Wed Nov 11 00:01:05 +0000 2015,0,0,It hasn't been a particularly productive day...
88,664195459561295872,Tue Nov 10 21:38:32 +0000 2015,0,0,"I find the use and overuse of the word ""female"" cringe worthy. Also, using female and woman interchangeably. #thegreatleadershipdebate #uwi"
89,664194923076292608,Tue Nov 10 21:36:24 +0000 2015,9,0,RT @Mona_PostGrads: Our call for papers for the MAPS Postgraduate Journal is now open. Please see attached for details for submission. http…
90,663507960262361088,Mon Nov 09 00:06:39 +0000 2015,1,0,A toastmasters club.
91,663507876145573888,Mon Nov 09 00:06:19 +0000 2015,0,0,Our PM needs to join a toastmaster asap.
92,663245543309639680,Sun Nov 08 06:43:54 +0000 2015,0,0,Lovin the fact that fame95 is streaming one of Armin van Buuren's State of Trance episodes 💃#trance #edm #armada
93,663167547160723456,Sun Nov 08 01:33:58 +0000 2015,0,0,Liking someone so intensely but knowing they don't deserve you...
94,663058152334581760,Sat Nov 07 18:19:17 +0000 2015,0,0,The 16 Most Outrageous Pieces in the Balmain x H&amp;M Collection via @forbes https://t.co/66vT3WpmlR
95,663052695700271104,Sat Nov 07 17:57:36 +0000 2015,0,0,"Express yourself, don't repress yourself."
96,663022392759873537,Sat Nov 07 15:57:11 +0000 2015,0,0,Master of None - Main Trailer - Netflix [HD] https://t.co/c4GJ4AWbdh via @YouTube  -- watching way more shows than i should w.e tho
97,662761371407372288,Fri Nov 06 22:39:59 +0000 2015,0,0,goodness... I say the most hurtful things when i'm upset.
98,662618522980233216,Fri Nov 06 13:12:21 +0000 2015,0,0,Classroom door lack. Had to go hunting for info. Classroom key laas. Oh. Ok
99,662371844528455680,Thu Nov 05 20:52:08 +0000 2015,0,0,"LAWL: 

Broke: The Yeezys are Coming.

- Buzzfeed Motion Pictures Production"
100,662304582874169344,Thu Nov 05 16:24:52 +0000 2015,0,0,Tweeting my stress away.
101,662301352073162752,Thu Nov 05 16:12:01 +0000 2015,0,0,"Here wondering what purpose flies serve (other than to terrorize people) and it makes me want to cry, really."
102,662154404070473728,Thu Nov 05 06:28:06 +0000 2015,0,0,The unending struggles of boo kitty...
103,662103771070242816,Thu Nov 05 03:06:54 +0000 2015,0,0,The cuteness of it all.
104,662103426944270336,Thu Nov 05 03:05:32 +0000 2015,0,0,"And the stress continues... submission deadline tomorrow, with a day-before-the-deadline notice. 

I aint mad."
105,662099058849222656,Thu Nov 05 02:48:11 +0000 2015,0,0,That's how my relationships usually end. When I say I am done... I am done.
106,662098859187789824,Thu Nov 05 02:47:23 +0000 2015,0,0,"I am done wid unnuh BBC, @FLOWJamaica. Finito!"
107,662097970423140352,Thu Nov 05 02:43:51 +0000 2015,0,0,Ok. Imma accept the fact this terrible service will never change. Constantly talking abt it only adds yrs to my prepubescent looking face.
108,662096562831491072,Thu Nov 05 02:38:16 +0000 2015,0,0,We need something better than @flowjamaica
109,662095608841302016,Thu Nov 05 02:34:28 +0000 2015,0,0,But look how @flowjamaica seh TVJ bought the rights for Empire and all I'm seeing in TVJ is a black screen. #tacky
110,662078686007439360,Thu Nov 05 01:27:14 +0000 2015,0,0,This citi mobile app ad so hilarious
111,662075077207310336,Thu Nov 05 01:12:53 +0000 2015,1,1,"he should be with himself, really #Rosewood  https://t.co/IKV4zbCTge"
112,662072372141273088,Thu Nov 05 01:02:08 +0000 2015,0,0,#Rosewood
113,662060848840507392,Thu Nov 05 00:16:21 +0000 2015,0,0,Dont trust a person who isn't comfortable disclosing their age. #redflag
114,662059055855235072,Thu Nov 05 00:09:14 +0000 2015,0,0,Can't totally avoid social media because it's the quickest way to stay informed.
115,662058862355197952,Thu Nov 05 00:08:27 +0000 2015,0,0,Millennials understand the importance of balance.
116,662058736551264258,Thu Nov 05 00:07:57 +0000 2015,0,0,This is why Diane Lockhart was complaining. Millennials prioritizing relationships over jobs lol
117,661742535941885952,Wed Nov 04 03:11:29 +0000 2015,0,0,"Not blind or dumb, @FLOWJamaica but definitely contemptuous."
118,661738980161904640,Wed Nov 04 02:57:22 +0000 2015,0,0,"There's no escaping death in KKT. In the meantime, you will need a strong self-esteem."
119,661730318529925120,Wed Nov 04 02:22:56 +0000 2015,0,0,LAWL @ Dean Munsch
120,661725643135029248,Wed Nov 04 02:04:22 +0000 2015,0,0,LAWL. This show is so silly
121,661725279644069888,Wed Nov 04 02:02:55 +0000 2015,0,0,Completing this paper and watching Scream Queens because... FOMO
122,661718309281226752,Wed Nov 04 01:35:13 +0000 2015,0,0,upset.
123,661717733545938944,Wed Nov 04 01:32:56 +0000 2015,0,0,"As soon as TVJ find out which tv show jamaica twitter like, dem purchase the ""rights"". Confuse."
124,661716823440658432,Wed Nov 04 01:29:19 +0000 2015,0,0,Next ting dem stawt block streaming websites. I doh put it pass dem.
125,661716465213505536,Wed Nov 04 01:27:54 +0000 2015,0,0,Local tv ah try force wi fi watch dem gud fi nuhting channel. It nah work doah.
126,661716001222889472,Wed Nov 04 01:26:03 +0000 2015,0,0,Truly only need internet service.
127,661714294199861252,Wed Nov 04 01:19:16 +0000 2015,0,0,"I'm sorry, @flowjamaica . I forgot I'm not paying but begging for your cable tv service. I am so sorry. https://t.co/ktkoMgR4mn"
128,661700876906590208,Wed Nov 04 00:25:57 +0000 2015,0,0,Apparently I can't properly break words into syllables but that's ok... I'm a work in progress.
129,661684499348979712,Tue Nov 03 23:20:52 +0000 2015,0,0,@ImmortalCritic him soooh accept himself
130,661684337067163648,Tue Nov 03 23:20:14 +0000 2015,0,0,"I'm one of those ""please don't waste my fucking time"" advocates."
131,661675982072385536,Tue Nov 03 22:47:02 +0000 2015,0,0,@ImmortalCritic how convenient.
132,661673393339547648,Tue Nov 03 22:36:44 +0000 2015,0,0,That's what I'm guessing...In-teres-ting
133,661673225361866752,Tue Nov 03 22:36:04 +0000 2015,0,0,Imma see what this fame twitter mixer is abt 2nite. A twitter mixer inside the spot. Face-to -face interaction will only b 4 liquor n fd
134,661672193852506112,Tue Nov 03 22:31:58 +0000 2015,0,0,@ImmortalCritic imma google the keywords to find out who u tauuukn-bout lol
135,661603133550780416,Tue Nov 03 17:57:33 +0000 2015,0,0,Justin Bieber - I'll Show You https://t.co/U6fRgG3sZv via @YouTube
136,661582255706390528,Tue Nov 03 16:34:36 +0000 2015,0,0,Have you ever been or seen inside a pubic restroom ? It is quite literally much like a scary scene in a horror/thriller movie.
137,661469870672900096,Tue Nov 03 09:08:01 +0000 2015,0,0,"""a perm is a commitment... Hence the name perm""I should use this."
138,661467360398696448,Tue Nov 03 08:58:02 +0000 2015,0,0,Fall Trash tv...
139,661463612309925888,Tue Nov 03 08:43:09 +0000 2015,0,1,"""you HATE me, Lisa"" ""you're not important enough to hate. Sit down.""Vanderpumprules is back!"
140,661321505523961856,Mon Nov 02 23:18:28 +0000 2015,0,0,I wrote a paragraph today. Not only do I feel accomplished... I feel capable.
141,661247857471586305,Mon Nov 02 18:25:49 +0000 2015,0,0,@kreemy1983 fact: He's a DDS (Dr. Of Dental Surgery)
142,661153903619284992,Mon Nov 02 12:12:28 +0000 2015,0,0,@ImmortalCritic can't wait... it's like a perfect movie day lol.
143,661144839287734273,Mon Nov 02 11:36:27 +0000 2015,0,0,It's gloomy as hell outside...
144,661045463047516161,Mon Nov 02 05:01:34 +0000 2015,0,0,"Is this guy ""astrologer on sakhti"" for real? I can imagine the poor people ringing off him phone. S M H"
145,661026096754896896,Mon Nov 02 03:44:37 +0000 2015,0,0,"""This is how it feels to be eighty"""
146,661001744663515136,Mon Nov 02 02:07:51 +0000 2015,0,0,I feel like Eli could rearrange his office so entering is less dramatic #TGW
147,661001640745508864,Mon Nov 02 02:07:26 +0000 2015,0,0,Lol @ me
148,660992793322614784,Mon Nov 02 01:32:17 +0000 2015,0,0,"Correction: Think, speak or act sensibly..."
149,660991613880152064,Mon Nov 02 01:27:36 +0000 2015,0,1,@kevinspirit89 when u no longer have a problem thinking sensibly around them
150,660976911389077504,Mon Nov 02 00:29:10 +0000 2015,0,0,Trying to recall the last time I read an academic book like a novel. https://t.co/bYnohgsIki
151,660956148409876484,Sun Nov 01 23:06:40 +0000 2015,0,0,I'm happy to have discovered Shirley Anne Tate.
152,660917533277450240,Sun Nov 01 20:33:13 +0000 2015,0,0,"In a post-apocalyptic world, Black people do not exist. #madmax"
153,660600848515338240,Sat Oct 31 23:34:50 +0000 2015,0,0,A highly anticipated event. https://t.co/XV0rRP4eKc
154,660535568359493633,Sat Oct 31 19:15:26 +0000 2015,0,0,All this negative energy.
155,660319128729718785,Sat Oct 31 04:55:23 +0000 2015,0,0,O K.
156,660319106688675840,Sat Oct 31 04:55:17 +0000 2015,0,0,"""it's not her fault she's just reacting to me"""
157,660318001288212480,Sat Oct 31 04:50:54 +0000 2015,0,0,"""i never understood the human desire to procreate. I mean, children... hideous little creates... terrible taxing burdens"""
158,660317470532591616,Sat Oct 31 04:48:47 +0000 2015,0,0,"""was your offspring planned or a mistake?"""
159,660309603389837312,Sat Oct 31 04:17:32 +0000 2015,0,0,"police: do u knw y i pulled u over?

guy: well obviously u felt the nd 2 exercise ur limited powers and punish me 4 ignoring the speed limit"
160,660230431858642948,Fri Oct 30 23:02:56 +0000 2015,0,0,The only thing i've accomplished today is getting food
161,660230071354003456,Fri Oct 30 23:01:30 +0000 2015,0,0,Had.to.get.a.burrito.
162,660090946793574406,Fri Oct 30 13:48:40 +0000 2015,0,0,"Finding my equal will be hard. But hey, who's looking?"
163,660089706521079808,Fri Oct 30 13:43:44 +0000 2015,0,0,I think I'm ok... Lol.
164,660089626007220225,Fri Oct 30 13:43:25 +0000 2015,0,0,"As far as I can tell, in the dating pool, you either have to be willing to mother, teach and discipline or... All of the above."
165,660088981875363840,Fri Oct 30 13:40:51 +0000 2015,0,0,@LeChevz how about city guide(less) or never on-time taxi service?
166,660087516427476992,Fri Oct 30 13:35:02 +0000 2015,0,0,"Mi neck ""kinda brown"" suh mi clearly pass di litmus test"
167,660087080404434944,Fri Oct 30 13:33:18 +0000 2015,0,0,"I was even pointed to a black shirt for emphasis. Like, strike 1 but I was fascinated to see where this was going."
168,660086425644232704,Fri Oct 30 13:30:42 +0000 2015,0,0,"Cannot say I'm the least bit surprised as this same individual spoke emphatically that they don't like ""dark-skinned girls"""
169,660085215109353472,Fri Oct 30 13:25:53 +0000 2015,0,0,"Can't believe that this early in the morning and in 2015, I'm being asked if I can cook. I'm intolerant of this type of questioning."
170,660071194754834432,Fri Oct 30 12:30:11 +0000 2015,0,0,Trevor Noah: That's Racist - Surfing AIDS https://t.co/s1TXNZpTDN via @YouTube
171,659922743970803712,Fri Oct 30 02:40:17 +0000 2015,0,0,Lost interest halfway thru #HTGAWM tonight and possibly forever but I feel as tho Analise's conviction will end with the needle.
172,659907508362850304,Fri Oct 30 01:39:45 +0000 2015,0,0,Just sinking in that the Mikealsons were once peasants.
173,659903021355167744,Fri Oct 30 01:21:55 +0000 2015,0,0,"""despite our refinement... we're still a violent bunch"""
174,659875508423757824,Thu Oct 29 23:32:35 +0000 2015,0,0,@Nicolette_JA sas chrise... mi glad yuh finally mek it truu
175,659861298591633408,Thu Oct 29 22:36:07 +0000 2015,0,0,It's not far-fetched considering no one answers the UWI phones... basically.
176,659861033281015808,Thu Oct 29 22:35:04 +0000 2015,0,0,"They should have a ""very important"" event that causes ""the closure of UWI offices"" at least once a week."
177,659859027686395904,Thu Oct 29 22:27:06 +0000 2015,0,0,I'd be lying if I wasn't ecstatic that there's no class tomorrow.
178,659858666086993920,Thu Oct 29 22:25:40 +0000 2015,0,0,*s
179,659858258526646272,Thu Oct 29 22:24:03 +0000 2015,3,0,RT @eLoElz: I hope everyone finds what they were born to do and they find joy in doing it every single day. Its really magical.
180,659854335820611584,Thu Oct 29 22:08:27 +0000 2015,3,0,@equality_JA empowerment thru awareness building drives passion. Being young and passionate increase access #UpWidAdvocacy
181,659848042976256000,Thu Oct 29 21:43:27 +0000 2015,2,0,#UpWidAdvocacy  https://t.co/LSCXAokXUQ
182,659847849765548033,Thu Oct 29 21:42:41 +0000 2015,1,0,"@equality_JA Q3 acknowledging their ideas and more importantly, actualizing them"
183,659670821611278336,Thu Oct 29 09:59:14 +0000 2015,0,0,"If you go on and on about giving ""zero"" fvkz... Some of us would believe otherwise."
184,659526413477777408,Thu Oct 29 00:25:25 +0000 2015,0,0,That's an insider's perspective on abandonment.
185,659525649472749568,Thu Oct 29 00:22:22 +0000 2015,0,0,I don't know why i'm laughing because this really isn't funny... thanks for retweeting @KhadineHillary  https://t.co/lHn5ss0Ix6
186,659524086675079168,Thu Oct 29 00:16:10 +0000 2015,0,0,This is truly depressing.
187,659523939232681984,Thu Oct 29 00:15:35 +0000 2015,0,0,So is it me or is it that there's no @RosewoodFOX tonight?
188,659521701416337408,Thu Oct 29 00:06:41 +0000 2015,0,0,"Dr. Ferguson is truly embarrassing to watch. As a matta ah fak, di whole lot a dem."
189,659519595624071168,Wed Oct 28 23:58:19 +0000 2015,0,0,I need to get away for a bit.I need nature.
190,659514002037321728,Wed Oct 28 23:36:05 +0000 2015,0,0,i... can't. https://t.co/EWTgQoHxOD
191,659498961657425920,Wed Oct 28 22:36:20 +0000 2015,0,0,when will it end? https://t.co/9oW2CuhMsf
192,659232728391389184,Wed Oct 28 04:58:25 +0000 2015,0,0,"I will love you, no matter how ugly your truth is."
193,659182360810901504,Wed Oct 28 01:38:16 +0000 2015,1,0,"Also, self-control."
194,659182191872708608,Wed Oct 28 01:37:36 +0000 2015,1,0,Skipping and jumping jacks are now a part of my daily routine.
195,659181922426425346,Wed Oct 28 01:36:31 +0000 2015,0,0,Itchy legs...
196,659181666762641408,Wed Oct 28 01:35:31 +0000 2015,0,0,I almost regret taking these supplements... i'm just eating like a cow.
197,659146227099893760,Tue Oct 27 23:14:41 +0000 2015,3,0,RT @emilymshields: Hope springs eternal &gt; https://t.co/gzJ60JjCOE
198,659134226684481536,Tue Oct 27 22:27:00 +0000 2015,0,0,"Government: If it makes money, it makes sense"
