,id_str,created_at,retweet_count,favorite_count,text
0,355582438359048194,Fri Jul 12 07:00:34 +0000 2013,1,0,RT @JanStringer: Everyone enjoys doing the kind of work for which he is best suited. - Napoleon Hill
1,349560083815989249,Tue Jun 25 16:09:53 +0000 2013,2,3,We are still buzzing from such a great conference on Saturday. Thank you to all involved with organising @winwritersconf Feeling inspired!
2,348536988229570561,Sat Jun 22 20:24:28 +0000 2013,1,0,RT @ClaireDyer1: Fab day at Winchester Writers' Conference; I heartily recommend it! @winwritersconf @LynnMSmith
3,348536953647538176,Sat Jun 22 20:24:19 +0000 2013,1,0,RT @agentmilburn: LOVED the audience at my final talk for the Winchester Writers' Conference this year. Great note to leave on @winwritersc…
4,348536657982656512,Sat Jun 22 20:23:09 +0000 2013,0,0,Winchester Writers' Conference was excellent today. Morning kicked off with an inspiring talk from Julian and Emma Fellowes
5,345225484000452608,Thu Jun 13 17:05:44 +0000 2013,0,2,Looking forward to the Winchester Writers' Conference. Anyone else going?
6,343808666815827969,Sun Jun 09 19:15:48 +0000 2013,2,0,"RT @matthewhill: I think there are loads of people writing, me included, who might not be writing (or at least writing the same) without Ia…"
7,339651385463279617,Wed May 29 07:56:15 +0000 2013,0,0,"@MadgeEekal thank you, will do. Let us know how you get on too!"
8,339651236041211904,Wed May 29 07:55:39 +0000 2013,1,0,RT @MadgeEekal: @Getoninwriting Good luck! Let me know how you get on :-)
9,339459136276283392,Tue May 28 19:12:19 +0000 2013,1,0,RT @MadgeEekal: @Getoninwriting Posted all my 121 submissions. *wipes brow* Hoping for useful feedback to move 4 different projects on. *tr…
10,339459023826989056,Tue May 28 19:11:52 +0000 2013,0,0,Submissions in the post today. No turning back.
11,338908491626475520,Mon May 27 06:44:15 +0000 2013,0,0,@MadgeEekal well done and lots of luck! Hope you get some good feedback :-)
12,338726993413672962,Sun May 26 18:43:03 +0000 2013,0,0,Not long left to get our writing ready for the Winchester Writers' Conference. How's everyone getting on?
13,337641952281509888,Thu May 23 18:51:29 +0000 2013,4,0,RT @winwritersconf: Retweet if you are attending the Winchester Writers' Conference 2013!
14,336967698934284289,Tue May 21 22:12:14 +0000 2013,0,0,Need to promote your book?  Win PR consultation and DIY PR Toolkit in Facebook Sweepstakes http://t.co/CV4YyFHd1A
15,335402624440479745,Fri May 17 14:33:11 +0000 2013,0,0,"@Follow_Farmer Thanks, yes they mysteriously reappeared earlier!"
16,335400413383761921,Fri May 17 14:24:24 +0000 2013,0,0,@Follow_Farmer I thought the same as followers disappeared but got no notification. Contacted support who said it had not been suspended???
17,335396001215049728,Fri May 17 14:06:52 +0000 2013,0,0,@Follow_Farmer Twitter say not
18,335314322869850113,Fri May 17 08:42:19 +0000 2013,0,0,@Follow_Farmer Um no...
19,335313340018614272,Fri May 17 08:38:24 +0000 2013,0,0,How's the writing going today everyone?
20,334667309337686019,Wed May 15 13:51:19 +0000 2013,0,0,@support Hi All our followers and people we're following have disappeared. Would you be able to look in to this please?
21,334430756485074945,Tue May 14 22:11:20 +0000 2013,0,0,Looking to do your own PR but don't know where to begin? Check out these sweepstakes to win PR consult &amp; toolkit http://t.co/NthwDAmUMi
22,332759668193632257,Fri May 10 07:31:01 +0000 2013,0,0,3 Marietta Students Among Winners of State Creative Writing Competition http://t.co/dH6FIXcGCG
23,332560028328398848,Thu May 09 18:17:44 +0000 2013,0,0,How to write a grade A piece of creative writing ? - Yahoo! Answers http://t.co/JD92MWdJ47
24,332557401838473217,Thu May 09 18:07:17 +0000 2013,0,0,4 Easy Ways to Get Children Writing for Teacher Appreciation ... http://t.co/eiS7BgUGyo
25,332557400777293824,Thu May 09 18:07:17 +0000 2013,0,0,Vermont College of Fine Arts Writing for Children and Young Adults ... http://t.co/lum1L8QuW9
26,332439476821446656,Thu May 09 10:18:42 +0000 2013,0,0,Creative Writing students to be honored At Carnegie Hall http://t.co/txmlQwZG1s
27,332223129109798912,Wed May 08 19:59:01 +0000 2013,0,0,The Creative Writing MFA Blog: MFA Application Online Course http://t.co/GYleI0lXDY
28,332014746633138177,Wed May 08 06:10:58 +0000 2013,0,0,The Weirdest Tweets From NYU Creative Writing Professors NYU Local http://t.co/3RRBtgm4n0
29,331887277649305600,Tue May 07 21:44:27 +0000 2013,0,0,Ideas on creative writing!? - Yahoo! Answers http://t.co/86nTIoSGwR
30,331887257441157120,Tue May 07 21:44:22 +0000 2013,0,0,Writing for Children - Honeysmoke http://t.co/TFGQt4aEyV
31,331675530866876416,Tue May 07 07:43:03 +0000 2013,0,0,Helping Your Child with Creative Writing Assignments | http://t.co/Fdyc7m2Ved
32,331553093797937155,Mon May 06 23:36:32 +0000 2013,0,1,New 'Homemade' Book Showcases Graduating U.Va. Students ... http://t.co/pHruBv0uNG
33,331459018537197568,Mon May 06 17:22:42 +0000 2013,0,0,Whatcom poet illuminates the value of creative writing http://t.co/qoca57bSF5
34,331218721018351616,Mon May 06 01:27:51 +0000 2013,0,0,Help with GCSE Creative Writing Controlled Assessment and IGCSE ... http://t.co/TgtL8hNHSY
35,330822317561229312,Sat May 04 23:12:41 +0000 2013,0,0,Kindergarde Experimental Writing for Children backers also backed http://t.co/ap7BkyzHND
36,330693421813604353,Sat May 04 14:40:30 +0000 2013,0,1,UNCA creative writing program for high school students returns in June http://t.co/IyK2tRoVSK
37,330551249101537282,Sat May 04 05:15:33 +0000 2013,0,0,conjunction vs comma for creative writing - English Language ... http://t.co/MyOdsIHgSL
38,330550323171168256,Sat May 04 05:11:53 +0000 2013,0,0,Cuneiform Writing for Children - News - Bubblews http://t.co/oOwD3LJPW1
39,330337847305461760,Fri May 03 15:07:34 +0000 2013,0,1,"5 Things: Braintree High Senior Prom, Teen Creative Writing http://t.co/43TlteGG6Q"
40,330198805024755713,Fri May 03 05:55:04 +0000 2013,0,0,Fay Weldon speaks up for creative writing http://t.co/Ze6qYa7ixK
41,329962202712899584,Thu May 02 14:14:54 +0000 2013,0,0,Fay Weldon speaks up for creative writing | Opinion | Times Higher ... http://t.co/j3eKmAcnkF
42,329884051517362176,Thu May 02 09:04:21 +0000 2013,0,0,Things to Monitor When Writing for Children | Write4Kids! http://t.co/AkS2oO7rTq
43,329852440549658625,Thu May 02 06:58:44 +0000 2013,0,0,GAC creative writing classes http://t.co/t3YesTZ4f1
44,329717824195026944,Wed May 01 22:03:49 +0000 2013,0,0,Ashland creative writing program for teens starts May 15 http://t.co/KzF4yazGTc
45,329629244164562945,Wed May 01 16:11:50 +0000 2013,0,1,Writing competition for primary school children launched http://t.co/N7BOWFgpE4
46,329501264423571456,Wed May 01 07:43:17 +0000 2013,0,0,Write Now Creative Writing Program for High School Students ... http://t.co/QZkvStQQPN
47,329309963417698304,Tue Apr 30 19:03:08 +0000 2013,0,0,Cambridge Launches Master's Degree in Creative Writing | Postgrad ... http://t.co/lrnGsIvF2y
48,329218175646445568,Tue Apr 30 12:58:24 +0000 2013,0,0,Alumnus of FSU creative writing program wins 2013 Pulitzer Prize in ... http://t.co/L3yypl25Hp
49,329217981982842881,Tue Apr 30 12:57:38 +0000 2013,0,0,Kindergarde: Experimental Writing for Children by Marthe Reed ... http://t.co/mCF2Ig94LV
50,329080777784557569,Tue Apr 30 03:52:26 +0000 2013,0,0,How to Format a Children's or Teen Book ManuscriptWriting for ... http://t.co/NnIAvtSHJQ
51,329031729677467649,Tue Apr 30 00:37:32 +0000 2013,0,0,"READER SUBMITTED: A ""Fairy Tale"" Project For Creative Writing Students http://t.co/HN1nCcdXCy"
52,328884199429914625,Mon Apr 29 14:51:18 +0000 2013,1,0,Creative Writing: On Characterization through Dialogue | Creative ... http://t.co/JMnSzFFzyR
53,328549393655537664,Sun Apr 28 16:40:54 +0000 2013,0,0,MSc in Creative Writing (online learning) Course | Guardian Jobs http://t.co/sXqricc57p
54,328421532726595584,Sun Apr 28 08:12:49 +0000 2013,0,0,Creative writing workshop at Davis Art Center http://t.co/ZJeC7HgccY
55,328216174053711872,Sat Apr 27 18:36:48 +0000 2013,0,0,Love James Joyce? This creative writing contest is for you | syracuse ... http://t.co/Vx5S2cQdae
56,327808880715378691,Fri Apr 26 15:38:22 +0000 2013,0,0,Paris Junior College celebrates 38 years of creative writing http://t.co/nFPSmDuQnF
57,327705580246532096,Fri Apr 26 08:47:53 +0000 2013,0,0,ForWord: A free creative writing workshop for El Paso teens http://t.co/e2u9hwWEu0
58,327547028034961409,Thu Apr 25 22:17:51 +0000 2013,0,0,Visiting Assistant Professor of English (Creative Writing) - One year ... http://t.co/iAk62YAhMS
59,327459194687078400,Thu Apr 25 16:28:50 +0000 2013,1,0,RT @jcx27: Now FREE on Amazon - RYANN - http://t.co/Vqnrc6lba4 - YA Fantasy @DryerBuzz @SAtrium @Getoninwriting @AL_FORSYTH
60,327450328716955649,Thu Apr 25 15:53:36 +0000 2013,0,0,UA ninth Arty Party spotlights creative writing program ... http://t.co/3IMgkEc1XI
61,327212447196913665,Thu Apr 25 00:08:21 +0000 2013,0,0,WVU creative writing graduate students to give graduation reading http://t.co/LDaiCsovff
62,327212447087882241,Thu Apr 25 00:08:21 +0000 2013,0,0,WVU creative writing graduate students to give graduation reading http://t.co/PGqELsuh4L
63,327144009950703618,Wed Apr 24 19:36:24 +0000 2013,0,0,Jason Segel | Nightmares Jason Segel Writing New Children's Book ... http://t.co/UXimheEuwO
64,327021829015343104,Wed Apr 24 11:30:54 +0000 2013,0,0,Love James Joyce? This creative writing contest is for you http://t.co/Y0yDWkPZmV
65,326820473306509312,Tue Apr 23 22:10:47 +0000 2013,0,0,Creative writing out of the garret into the classroom and ... http://t.co/SAy2sPStAJ
66,326725840291373057,Tue Apr 23 15:54:45 +0000 2013,0,0,"Creative writing: out of the garret, into the classroom and workplace http://t.co/VNFdRKujXD"
67,326541820655988736,Tue Apr 23 03:43:31 +0000 2013,0,0,"Writers' Workshop: Writing for Children - Events Event, Arts ... http://t.co/iSkVy8YGx7"
68,326515182794846210,Tue Apr 23 01:57:40 +0000 2013,0,0,Creative writing contest deadline nears http://t.co/nxOhW9DRjN
69,326380438945939459,Mon Apr 22 17:02:15 +0000 2013,0,0,Buckeye Creative Writing winners http://t.co/ADYG0WVzmo
70,326208451766255617,Mon Apr 22 05:38:50 +0000 2013,0,0,Creative writing alumnus wins Pulitzer Prize in fiction / More FSU ... http://t.co/V0LMAVsUcW
71,325985735784161280,Sun Apr 21 14:53:50 +0000 2013,0,0,Assistant Professor Of Creative Writing http://t.co/yNmbtYL2s4
72,325960010012168192,Sun Apr 21 13:11:37 +0000 2013,0,0,"Local artist shares inspiration for writing, illustrating ... http://t.co/7celW22RaT"
73,325874873748570114,Sun Apr 21 07:33:19 +0000 2013,0,0,Creative Writing Program's Reading Series to Feature Sam Lipsyte ... http://t.co/Nzk3moVECH
74,325540506803245058,Sat Apr 20 09:24:39 +0000 2013,0,0,English Literature and Creative Writing BA(Hons) | undergraduate ... http://t.co/5gcMUh8ERm
75,325393332299767808,Fri Apr 19 23:39:50 +0000 2013,0,0,Creative Writing Doctoral Students to Read at Writers in the Library http://t.co/iQL3d5gUfM
76,325266101070086144,Fri Apr 19 15:14:16 +0000 2013,0,0,Prada launches creative writing contest NY Daily News http://t.co/nYlRuSk4xR
77,325118827958501377,Fri Apr 19 05:29:03 +0000 2013,0,0,Workshop Creative Writing for Wine Lovers The Frederick NewsPost ... http://t.co/NglXq2r98Z
78,324765790572273664,Thu Apr 18 06:06:12 +0000 2013,0,0,Topic matches for creative writing http://t.co/56hlIUml1T
79,324557521840914434,Wed Apr 17 16:18:37 +0000 2013,0,0,Bartleman Aboriginal Youth Creative Writing Award submissions sought http://t.co/JQBq6LHbSd
80,324422220724195328,Wed Apr 17 07:20:59 +0000 2013,0,0,Creative writing classes http://t.co/3ACfsFomDH
81,324374228856102912,Wed Apr 17 04:10:17 +0000 2013,0,0,Award Winning Children's Author To Teach Beginners Writing for ... http://t.co/GB7yCyYhoz
82,324210959029772289,Tue Apr 16 17:21:30 +0000 2013,0,0,Creative Writing for Children | Friend For The Ride http://t.co/vCzYMjp9qG
83,324143264561246208,Tue Apr 16 12:52:31 +0000 2013,0,0,Creative Writing Masterclass | Scottish Refugee Council http://t.co/Az2VxHmbCm
84,324002983652233217,Tue Apr 16 03:35:05 +0000 2013,0,0,Stanford creative writing professor wins Pulitzer for fiction http://t.co/a2WtR09f8R
85,323877574101045249,Mon Apr 15 19:16:45 +0000 2013,0,0,William and Mary Announces Creative Writing Scholarship ... http://t.co/fRrDDQOsH9
86,323846008524132352,Mon Apr 15 17:11:19 +0000 2013,2,0,RT @creawritstuds: Creative Writing Studies Weekly is out! http://t.co/9H8RIa7TTT ▸ Top stories today via @emma_darwin @PassagesNorth @G ...
87,323726798342995968,Mon Apr 15 09:17:37 +0000 2013,0,0,Room to be used for creative writing workshops http://t.co/xOl5sD26jM
88,323585346405298176,Sun Apr 14 23:55:33 +0000 2013,0,0,Writing a children's book Yahoo7 Answers http://t.co/FrILf9b9yh
89,323539106997088257,Sun Apr 14 20:51:48 +0000 2013,0,0,Every Word Counts: Can Creative Writing Be Taught? | The Rivard ... http://t.co/TUVin0Xwne
90,323405605048045569,Sun Apr 14 12:01:19 +0000 2013,0,1,William and Mary Announces Creative Writing Scholarship http://t.co/Qw84Btpvr4
91,323340965379198976,Sun Apr 14 07:44:28 +0000 2013,1,0,RT @ArchEditing: The Writing &amp; Editing Daily is out! http://t.co/Awgkx3lFlN ▸ Top stories today via @Getoninwriting
92,323207229350215680,Sat Apr 13 22:53:03 +0000 2013,0,0,Apply to be a Creative Writing Intern for 2013-14 http://t.co/XcfDEjyXOm
93,323207040711393280,Sat Apr 13 22:52:18 +0000 2013,0,0,Kindergarde: Experimental Writing for Children by ... - Kickstarter http://t.co/f1jo1p9lxX
94,323084075596394496,Sat Apr 13 14:43:40 +0000 2013,0,0,Creative writing contest winners announced http://t.co/H2PY3FXpJs
95,322875057481326593,Sat Apr 13 00:53:07 +0000 2013,0,0,Master of Fine Arts in Creative Writing | Augsburg Now http://t.co/B5w7mpfuuu
96,322874989068025857,Sat Apr 13 00:52:50 +0000 2013,1,0,Kindergarde: Experimental Writing for Children by ... - Kickstarter http://t.co/TEGnR1E4SY
97,322753891714342912,Fri Apr 12 16:51:38 +0000 2013,0,0,Assistant Professor of Creative Writing http://t.co/GKHnjLhpxR
98,322541391861403649,Fri Apr 12 02:47:15 +0000 2013,0,0,Creative Writing Portfolio Guidelines | Department of English http://t.co/eb0Lgisvf6
99,322541391748161537,Fri Apr 12 02:47:14 +0000 2013,0,0,Creative Writing Portfolio Guidelines | Department of English http://t.co/sRAHigirdU
100,322418495763656705,Thu Apr 11 18:38:54 +0000 2013,0,0,Students to Teach Creative Writing at the Washington State Penitentiary http://t.co/ZwsCDweB6x
101,322282133722918912,Thu Apr 11 09:37:03 +0000 2013,0,0,School Tool: BoomWriter Democratizes Creative Writing http://t.co/jvJpcxtqLn
102,322157394148876288,Thu Apr 11 01:21:22 +0000 2013,0,0,British Council announces summer creative writing ... - Ekathimerini http://t.co/udBe0v5bbp
103,322017437421805568,Wed Apr 10 16:05:14 +0000 2013,0,0,British Council announces summer creative writing courses in Athens http://t.co/QLHr3gE1xj
104,321873880488751105,Wed Apr 10 06:34:47 +0000 2013,0,0,Creighton University : Creative Writing http://t.co/NHF6kldh0g
105,321873880438431744,Wed Apr 10 06:34:47 +0000 2013,0,0,Creighton University : Creative Writing http://t.co/qRtPPeOuWB
106,321541945656758272,Tue Apr 09 08:35:48 +0000 2013,0,0,Embarking on a new creative writing project | Multnomah County ... http://t.co/CrjV4fqJib
107,321276835705024512,Mon Apr 08 15:02:21 +0000 2013,1,0,getlearning: Creative writing clears the mind http://t.co/tpmUHIDEzA
108,320868009021419521,Sun Apr 07 11:57:49 +0000 2013,0,0,Military children express sacrifices through art writing http://t.co/SOut7Do6Or
109,320633796829511680,Sat Apr 06 20:27:08 +0000 2013,0,0,@MadgeEekal brilliant! Hope to see you there!
110,320633548480598016,Sat Apr 06 20:26:09 +0000 2013,1,0,RT @AskewVision: Australian Event Magazine is out! http://t.co/Ad1a2xcYFP ▸ Top stories today via @teyvrodriguez @GrattanInst @Getoninwr ...
111,320543598221332480,Sat Apr 06 14:28:43 +0000 2013,0,0,English Department announces 2013 creative writing contest winners http://t.co/A9AFgLlHQa
112,320542130378506240,Sat Apr 06 14:22:53 +0000 2013,0,0,Teaching learn Writing for Children | Eko_Noverio_web http://t.co/toaZcwL0TI
113,320477070008410112,Sat Apr 06 10:04:22 +0000 2013,0,0,We're going to the Winchester Writers Conference in June-so excited! Lots of work to be done before but should be an amazing day! N
114,320451841454403584,Sat Apr 06 08:24:07 +0000 2013,0,0,"WNDAAC hosting creative writing, spoken word workshop http://t.co/Bd3K5Wv5rw"
115,320338532587683840,Sat Apr 06 00:53:52 +0000 2013,0,0,Have you booked yet for the Winchester Writers' Conference in June. Programme looks great this year!
116,319993592573734913,Fri Apr 05 02:03:12 +0000 2013,0,0,Creative Writing Workshop with Helen Limon http://t.co/S3hjeuy74B
117,319874471773229056,Thu Apr 04 18:09:51 +0000 2013,0,0,The Anti-Creative Writing Program Campaign - The http://t.co/ZMd2hVkoHd http://t.co/z7dAoHkyQc
118,319873793734619136,Thu Apr 04 18:07:10 +0000 2013,0,0,Summer Writing Camp for Children and Teens http://t.co/ZAc19Nruk7
119,319731673749147648,Thu Apr 04 08:42:26 +0000 2013,0,0,UBC opens creative writing courses to all students with new minor http://t.co/LnI0c5oRP8
120,319539891719528450,Wed Apr 03 20:00:21 +0000 2013,0,0,writing for children | Writing Like a Mother http://t.co/VrmoFDPhPr
121,319492863941541888,Wed Apr 03 16:53:29 +0000 2013,0,0,Creative Writing Workshop The Writopia Method | The New York ... http://t.co/0bDoS4MDKU
122,319358614554947585,Wed Apr 03 08:00:01 +0000 2013,0,0,"""I've been writing this column for 14 years. I have children who ... http://t.co/R0rggmu65h"
123,319255518218702849,Wed Apr 03 01:10:21 +0000 2013,0,0,Creative Writing Masterclass with Sandy Curtis http://t.co/DwgeQ9sRJx
124,319032408160731136,Tue Apr 02 10:23:48 +0000 2013,0,0,TCU Creative Writing Awards celebrate written talent http://t.co/8XyddOKh4w
125,318912771741863937,Tue Apr 02 02:28:24 +0000 2013,0,0,"#SciAmBlogs Monday – Squamozoic, Superiority Illusion, Creative ... http://t.co/vGjj8LrsSA"
126,318720038175645696,Mon Apr 01 13:42:33 +0000 2013,0,0,From Chess to Dreams: Interview on the Creative Writing Process ... http://t.co/UXUwASUlJS
127,318448465011171329,Sun Mar 31 19:43:25 +0000 2013,0,0,Happy Easter!
128,318354849974587392,Sun Mar 31 13:31:25 +0000 2013,0,0,creative writing | Cedar Sinai Park http://t.co/IHBwHZcKGu
129,317780641477427200,Fri Mar 29 23:29:43 +0000 2013,0,0,Visual art and creative writing collide at new Austin Peay State ... http://t.co/Vi5VRQDgGM
130,317525904396005376,Fri Mar 29 06:37:29 +0000 2013,0,0,Austin Peay State University : Visual art and creative writing collide ... http://t.co/2DGBL3e4YY
131,317170482958983169,Thu Mar 28 07:05:10 +0000 2013,0,0,Creative writing table opens http://t.co/imPveibaDF
132,316868099066458112,Wed Mar 27 11:03:36 +0000 2013,0,0,The Next Thing: Professionalization in Creative Writing | Cathy Day http://t.co/Szsl4DloLd
133,316733444447166465,Wed Mar 27 02:08:32 +0000 2013,0,0,The Egg Creative writing contest finalists http://t.co/HAsC8IErPS
134,316539300013555713,Tue Mar 26 13:17:04 +0000 2013,0,0,writing for children | Wordcraft http://t.co/2q4lyNx6rY
135,316520246888505344,Tue Mar 26 12:01:22 +0000 2013,0,0,WWE Creative Needs More Fans on Its Writing Team http://t.co/NI6WMzfGQT
136,316304558953488384,Mon Mar 25 21:44:18 +0000 2013,0,0,Creative Writing Challenge Asks Kids to Write About the Library http://t.co/ajCNrBAxIe
137,316180326437253122,Mon Mar 25 13:30:38 +0000 2013,2,0,RT @ThinkGrowRiches: Discipline is the bridge between goals and accomplishment. ~ Jim Rohn http://t.co/IaeRzaoTXH #JimRohn #Success #Quo ...
138,315745528640061440,Sun Mar 24 08:42:54 +0000 2013,0,0,Undergraduate prize for creative writing Win $4000 http://t.co/ohoaimBRM4
139,315559980474458113,Sat Mar 23 20:25:36 +0000 2013,0,0,Syracuse University News » » Creative Writing Alumni Participate in ... http://t.co/VqOfWR2NTt
140,315530618119282688,Sat Mar 23 18:28:56 +0000 2013,1,0,RT @AllAboutBinky: What a great idea! @Getoninwriting Meet Binky and the little Binkys http://t.co/9OjcT6pcIH
141,315304245714882560,Sat Mar 23 03:29:24 +0000 2013,0,0,Join 1 Person skilled in Creative Writing http://t.co/IXd6FUAg0N
142,315233252103303168,Fri Mar 22 22:47:18 +0000 2013,0,0,Why Writing for Children is Important – Guest Blog By Darlene ... http://t.co/3F0A7HqFkR
143,315203010554896384,Fri Mar 22 20:47:08 +0000 2013,0,0,Comedic poet inspires creative writing students http://t.co/SAFy2yXaxd
144,314930873881468930,Fri Mar 22 02:45:46 +0000 2013,0,0,An Introduction to Creative Writing http://t.co/ZIA4RQbkgW
145,314727609701388288,Thu Mar 21 13:18:04 +0000 2013,0,0,Creative writing classes http://t.co/IPtDNKwqX9
146,314726521388531714,Thu Mar 21 13:13:44 +0000 2013,0,0,Anyone else find the Sookie Stackhouse books addictive?
147,314726252638519296,Thu Mar 21 13:12:40 +0000 2013,2,0,RT @jcx27: Wonderful Paranormal Thriller NEW BLOOD free on Amazon Prime http://t.co/tsOGPLzsGs &lt;- get it today!
148,314582135287734272,Thu Mar 21 03:40:00 +0000 2013,0,0,Creative Writing Prompts! - http://t.co/94qrVCkitI http://t.co/2D3qBJdLVT
149,314393639868579840,Wed Mar 20 15:10:59 +0000 2013,0,0,Creative writing club proves the pen is as mighty as the tackle at Cwmtawe ... http://t.co/R4wzUDffqr
150,314282352492826624,Wed Mar 20 07:48:46 +0000 2013,1,0,"RT @CassidyJonesAdv: ""Well written with an intriguing and captivating plot."" CASSIDY JONES ➤ Over 100 5★! US http://t.co/XGP77Zirk1 UK h ..."
151,314282027107102720,Wed Mar 20 07:47:28 +0000 2013,10,0,"RT @AnnPearlman: So excited to learn what you think of my first illustrated short story, Other Lives.  Get it for free: http://t.co/Ft3k ..."
152,314256122221576194,Wed Mar 20 06:04:32 +0000 2013,0,0,"The Creative Writing MFA Blog: Applications, Etc. Part 6 http://t.co/eiV4EQam0P"
153,314148857858633728,Tue Mar 19 22:58:18 +0000 2013,0,0,"Love the way Stephen King writes. Amazing detail, Enjoying reading Under the Dome"
154,314061998524608513,Tue Mar 19 17:13:10 +0000 2013,0,0,Mid Somerset Festival 2013 - Creative Writing Short Story winner http://t.co/IWLKU82e8z
155,313943205697712129,Tue Mar 19 09:21:07 +0000 2013,0,0,@LandieChappell look forward to your tweets
156,313909865351364609,Tue Mar 19 07:08:38 +0000 2013,0,0,"Ruskin Bond, Sudha Murthy discuss writing for children http://t.co/WkfDIpjEL2"
157,313892865480740864,Tue Mar 19 06:01:05 +0000 2013,0,0,Mid Somerset Festival 2013 - Creative Writing Short Story winner http://t.co/QG2brVaHRu
158,313758945258897408,Mon Mar 18 21:08:56 +0000 2013,1,0,RT @TimGreaton: Tips And Resources To Create The Professional Looking Home-Made Book Trailer http://t.co/bvNQuY6HfZ via @epublishabook
159,313717295920857088,Mon Mar 18 18:23:26 +0000 2013,0,0,Creative Writing Challenge 2AM Photo | The Daily Post http://t.co/QS7pen1pVW
160,313604131510165504,Mon Mar 18 10:53:46 +0000 2013,0,0,Thoughts on MFAs in Writing for Children and Young Adults - Page 2 ... http://t.co/iuEEY666NS
161,313535114548224001,Mon Mar 18 06:19:31 +0000 2013,0,0,Sunnyside students get creative with writing http://t.co/ejbZ4LfzVa
162,313178534376009728,Sun Mar 17 06:42:35 +0000 2013,0,0,Urban LegendCreative Writing http://t.co/U0InfXY3i6
163,312949602808651777,Sat Mar 16 15:32:54 +0000 2013,0,0,Creative writing workshop at Birstall Library and Information Centre http://t.co/U8VhUwrRhB
164,312633734203596800,Fri Mar 15 18:37:45 +0000 2013,0,0,The Metropolitan Museum of Art - Sights and Insights: Creative ... http://t.co/iMNtdJ0aal
165,312488368397250560,Fri Mar 15 09:00:07 +0000 2013,0,0,"Pupils happy with creative writing exam, but Parents' views mixed on new SEA ... http://t.co/Uok3mqx2Rk"
166,312309891664576512,Thu Mar 14 21:10:55 +0000 2013,0,0,Thoughts on MFAs in Writing for Children and Young Adults ... http://t.co/nIgiZQspgU
167,312296681695744000,Thu Mar 14 20:18:25 +0000 2013,1,0,"Kenyon College creative writing professor, author to give free talk at Furman http://t.co/QXLHOwIvLl"
168,312058390543216641,Thu Mar 14 04:31:32 +0000 2013,0,0,Writing for Children This is a MUST Read | Writingie http://t.co/XelKxhea9D
169,311911155390091265,Wed Mar 13 18:46:29 +0000 2013,0,0,Creative writing workshop in Stonehaven http://t.co/u0w7PG2kDI
170,311780680055025664,Wed Mar 13 10:08:01 +0000 2013,0,0,ADEC organizes Saard Creative Writing Contest Workshops http://t.co/tS0MW803FM
171,311662605787865088,Wed Mar 13 02:18:50 +0000 2013,0,0,Creative Writing Celebration: 'Storytelling is for everybody' ‹ Cochise ... http://t.co/hOLoVsldFy
172,311338452358668288,Tue Mar 12 04:50:46 +0000 2013,0,0,Creative Writing ideas? - Yahoo! Answers http://t.co/zNJgHdabYh
173,311201346764279809,Mon Mar 11 19:45:57 +0000 2013,1,0,RT @kathykulig: Reclaiming Your Readers: Proven Methods for Reader-Focused Writing http://t.co/PwB1LUrYJV via @MasqCrew
174,311201288706740224,Mon Mar 11 19:45:43 +0000 2013,4,0,RT @AlgonquinBooks: GIVEAWAY MONDAY: A Wedding in Haiti paperback. Enter here: http://t.co/lYUPwfT8ZF
175,311145153031180289,Mon Mar 11 16:02:39 +0000 2013,0,0,Magnolia students win awards at SAU Creative Writing Festival http://t.co/DAnP6S2dqL
176,311015530788159488,Mon Mar 11 07:27:35 +0000 2013,0,1,Alumna Helen Zell donates $50 million to Creative Writing Program http://t.co/ikmv7i7oiM
177,310782495035621376,Sun Mar 10 16:01:35 +0000 2013,0,0,English GCSE creative writing help with ending Yahoo Answers http://t.co/u1EgqpZhHB
178,310671460521881603,Sun Mar 10 08:40:22 +0000 2013,1,0,"RT @barry_baines: I wonder if you'd like to write about #theSECRET, #NLP, #hypnosis or #mindpower: http://t.co/MPY4PCLFZE"
179,310645414812602368,Sun Mar 10 06:56:53 +0000 2013,0,0,Sweet Briar to hold Creative Writing Conference http://t.co/K1M1tKdFgf
