,id_str,created_at,retweet_count,favorite_count,text
180,310371571799838720,Sat Mar 09 12:48:43 +0000 2013,0,0,There is no standard procedure for creative writing - Los Angeles ... http://t.co/IkUK47BKwC
181,310014632012169218,Fri Mar 08 13:10:22 +0000 2013,0,0,"5 Things: Freshmen and Sophomore Dance, Teen Creative Writing http://t.co/HDE9WxLwLH"
182,309889161060569088,Fri Mar 08 04:51:48 +0000 2013,0,0,Can Creative Writing Be Taught? http://t.co/5ZbfPoADgO
183,309661266883014656,Thu Mar 07 13:46:13 +0000 2013,0,0,"Be In WWE's WrestleMania Music Video, WWE Hiring VP Of Creative Writing ... http://t.co/CHqcU7SFfJ"
184,309537029920808960,Thu Mar 07 05:32:33 +0000 2013,0,0,Creative Writing Class http://t.co/xJ8biTbdcM
185,309408073712295936,Wed Mar 06 21:00:07 +0000 2013,0,0,creative writing Archives - Warren Public Library http://t.co/ctbHiHXjMW
186,307832524002959360,Sat Mar 02 12:39:27 +0000 2013,0,0,Creative writing workshop to be presented Saturday in Charleston ... http://t.co/lUWC25ExDt
187,307270085700108290,Thu Feb 28 23:24:31 +0000 2013,0,0,Curtis Brown Creative Writing for Children course with Curtis ... http://t.co/cdy2LF5S9c
188,307270084584435714,Thu Feb 28 23:24:31 +0000 2013,0,0,Children's author visits Hainesport School to stir passion for ... http://t.co/bAjMeHS0r7
189,307266599189114882,Thu Feb 28 23:10:40 +0000 2013,0,0,Creative writing workshop to be presented Saturday in Charleston http://t.co/8ZEsadbjOz
190,303217708894388225,Sun Feb 17 19:01:49 +0000 2013,0,0,Creative Writing Workshops http://t.co/orVJY46S
191,303077679589117952,Sun Feb 17 09:45:24 +0000 2013,0,0,Formal Letter Writing For Children http://t.co/Zx3G8TmC
192,303077678620213248,Sun Feb 17 09:45:24 +0000 2013,0,0,Writers Toolkit some words on writing for children | Rich Lakin's Blog http://t.co/R12Ymwuq
193,298351684407681024,Mon Feb 04 08:45:59 +0000 2013,0,0,------ideas? creative writing------? - Yahoo! Answers http://t.co/v2gL9HUS
194,298340172431491072,Mon Feb 04 08:00:14 +0000 2013,0,0,Writing for Children &amp; Young Adults Premium Collection ... http://t.co/6Bo5x6Wr
195,298030503435567104,Sun Feb 03 11:29:43 +0000 2013,0,0,Creative Writing and Loss - Yahoo! Voices - http://t.co/qb48RlC9 http://t.co/9uEZaV1e
196,297685678324600833,Sat Feb 02 12:39:31 +0000 2013,0,0,8B: Creative Writing | Mrs Holovecz-Harte http://t.co/1ansQjmW
197,297421472576700416,Fri Feb 01 19:09:39 +0000 2013,0,0,Creative writing tips for teachers: ideas and activities to ... http://t.co/dvU7EWvL
198,297309513789341696,Fri Feb 01 11:44:46 +0000 2013,0,0,Pam Houston Comes to CSU | Creative Writing http://t.co/RlgLMTpP
199,296786373598380032,Thu Jan 31 01:06:00 +0000 2013,0,0,Improve writing for children - 15 ebooks - free download http://t.co/WVktJbOX
