,id_str,created_at,retweet_count,favorite_count,text
0,299248244469420032,Wed Feb 06 20:08:35 +0000 2013,1,2,This account will be closed in two weeks - make sure you follow us @Mortons!
1,163005823335936000,Fri Jan 27 21:09:51 +0000 2012,1,0,"Our founder Klaus is sharing his ""Secret Chili Recipe"". Something to make for your #SuperBowl Sunday party:) http://t.co/m8yEoBTE"
2,162964984022831104,Fri Jan 27 18:27:34 +0000 2012,0,0,Happy National Chocolate Cake Day! For your viewing pleasure here is our Legendary Hot Chocolate Cake http://t.co/tBB7qNl2
3,162222142958743552,Wed Jan 25 17:15:47 +0000 2012,0,0,"BLOG: Winter White Series Finale: ""Rum For It"" by @SommelierSara http://t.co/Ue1IbLnd #WineWednesday. Happy Hump Day!"
4,161577538458615809,Mon Jan 23 22:34:21 +0000 2012,0,0,Interview with a Morton's Sommelier: 60 Seconds with Brian Kerr http://t.co/QEMl6lwT
5,159764490152456194,Wed Jan 18 22:29:57 +0000 2012,0,0,"From high-octaine suds to coriander-loving Belgians, @SommelierSara has the perfect beer to suit ever palate & pairing  http://t.co/ZcFzye66"
6,159704450641051648,Wed Jan 18 18:31:22 +0000 2012,1,1,It's ok. Anyone want Bone-in Ribeye? @JakisBuzz @Arts_Center_CT @Warner_Gallery @SugarloafCrafts @SilvermineArts http://t.co/QnBhwwc2
7,157510709851340801,Thu Jan 12 17:14:14 +0000 2012,0,0,"Thank you @davepex and the New England Regional Volleyball Association for coming in! Happy to ""serve"" you:) http://t.co/6FT7fb3t"
8,154970003710550017,Thu Jan 05 16:58:22 +0000 2012,1,0,"After Friday’s WWE RAW at XL Center, pro wrestlers John Cena & CM Punk came for dinner at Morton's Hartford! http://t.co/EazKYl2H"
9,153690846653456384,Mon Jan 02 04:15:27 +0000 2012,0,0,@kumhocd3 We're glad you joined us today. Happy New Year!
10,153690668965957632,Mon Jan 02 04:14:45 +0000 2012,0,0,@zomorodimgbt7 Thanks for coming!
11,153690352589606912,Mon Jan 02 04:13:30 +0000 2012,0,0,Happy New Year's from Morton's The Steakhouse in Downtown Hartford!
12,153149509248102401,Sat Dec 31 16:24:23 +0000 2011,0,0,"Celebrate! We're open tonight + New Year's Day w/ prime steaks, excellent seafood. Bar Bites start at $6! 860-724-0044, http://t.co/aNDjbxiN"
13,152942521301999617,Sat Dec 31 02:41:53 +0000 2011,0,0,"We're open New Year's Eve + New Year's Day w/ prime steaks, excellent seafood. Bar Bites start at $6! 860-724-0044, Mortons.com/hartford"
14,152417436195491840,Thu Dec 29 15:55:23 +0000 2011,0,0,"We're open New Year's Eve + New Year's Day w/ prime steaks & fresh seafood. Bar Bites start at $6! Call 860-724-0044, http://t.co/1HmqlNtb"
15,152412359657402368,Thu Dec 29 15:35:12 +0000 2011,0,0,Last chance to come in + buy: $300 of our #giftcards + we give you $50 more; Buy $500 for $100 bonus. Stop in to purchase deadline by 12/31.
16,152040121519185920,Wed Dec 28 14:56:04 +0000 2011,1,0,"Wrap up 2011 or start 2012 w/ prime steaks + excellent seafood. Open New Year's Eve, New Year's Day! Call 860-724-0044, http://t.co/1HmqlNtb"
17,150964616145534976,Sun Dec 25 15:42:23 +0000 2011,0,0,To all of our friends from the staff at Morton's in Downtown Hartford: Have a Merry Christmas and the Happiest of Holidays!
18,150607002664574976,Sat Dec 24 16:01:22 +0000 2011,0,0,Come to our place for dinner tonght/Christmas Eve. Make reservations 860-724-0044 or Mortons.com/hartford
19,150334464654979072,Fri Dec 23 21:58:24 +0000 2011,0,0,"Craving a special holiday dinner? We're open Christmas Eve, New Year's Eve + New Year's Day! 860-724-0044 or mortons.com/hartford"
20,150235457194704896,Fri Dec 23 15:24:58 +0000 2011,0,0,Today is final day to enjoy LUNCH at Morton's Hartford. We serve dinners year-round. Make reservations 860-724-0044 or http://t.co/pW8Au5rO
21,149931895021502464,Thu Dec 22 19:18:44 +0000 2011,0,0,"Join us on Christmas Eve, New Year's Eve and New Year's Day. 
Open at 5 p.m. each day. 
Reservations: 860-724-0044 or http://t.co/1HmqlNtb"
22,149509471125774336,Wed Dec 21 15:20:10 +0000 2011,0,0,@HartforddotCom Glad you enjoyed your holiday lunch with us. You are welcome anytime!!!
23,149509340141850624,Wed Dec 21 15:19:39 +0000 2011,2,0,RT @HartforddotCom: The verdict: lunch @MortonsHART was crazy good. We took advantage of the $35 prix fix menu w/ filet mignon. So full. ...
24,149509288317030401,Wed Dec 21 15:19:26 +0000 2011,2,0,Still time to enjoy a LUNCH at Morton's Today & Thurs only. Dinners all year-round. Make reservations 860-724-0044 or http://t.co/1HmqlNtb
25,149135795888988161,Tue Dec 20 14:35:19 +0000 2011,0,0,Want Lunch today at Morton's? This Wed. & Thurs. too. Make reservations + bring a toy for #Toysfortots. 860-724-0044 or http://t.co/1HmqlNtb
26,148935034961801216,Tue Dec 20 01:17:34 +0000 2011,0,0,Sure-fire top gift: buy $300 of our #giftcards + we give you $50 more; Buy $500 for $100 bonus. Stop in + buy. Use at any Morton's.
27,148810834112548864,Mon Dec 19 17:04:02 +0000 2011,0,0,Our Asst GM Marinka just whipped up Smoked Salmon Pizza at NBC Conn 30 w/ @yvonnenava Yum! http://t.co/EZuD8dzn
28,148776520763187200,Mon Dec 19 14:47:41 +0000 2011,0,0,"Book your holiday LUNCH this Tues, Wed, Thur Only + bring a toy for #Toysfortots. Reserve now: 860-724-0044 or http://t.co/1HmqlNtb"
29,148774652112683008,Mon Dec 19 14:40:15 +0000 2011,0,0,Watch NBC Connecticut 30 11:30 a.m. half-hour TODAY as we prepare our Smoked Salmon Pizza! http://t.co/2FK4R2DH
30,148403871394430976,Sun Dec 18 14:06:54 +0000 2011,0,0,Thanks @heatherhegedus for inviting us to prepare Mini Prime Burgers today on Channel 3 News http://t.co/HotKYej9
31,148061576044347393,Sat Dec 17 15:26:45 +0000 2011,1,0,"Join us on Christmas Eve, New Year's Eve and New Year's Day. Open 5 p.m. each day. Reservations: 860-724-0044, http://t.co/pW8Au5rO"
32,147761657098158080,Fri Dec 16 19:34:58 +0000 2011,0,0,"Toys for Tots in desperate need of new, unwrapped toys. Join our staff's effort. At 30 State House Sq. in Hartford http://t.co/jx2Dxu7E"
33,147721321718099969,Fri Dec 16 16:54:42 +0000 2011,1,1,"Hartford Courant's ""Java"" loves ESPN ""Fantasy Football"" dinner story at Morton's Hartford. See http://t.co/7RSMwUD9"
34,147666781421576193,Fri Dec 16 13:17:58 +0000 2011,0,0,Easy holiday giving: Buy $300 of our #giftcards + we give you $50 More; Buy $500 for $100 bonus. Stop in + buy. You can use at any Morton's
35,147429552879177728,Thu Dec 15 21:35:19 +0000 2011,0,0,"Special only for the holidays: LUNCH at Morton's! Tomorrow/Fri 12/16 & Dec. 20, 21 + 22. Reserve now: 860-724-0044 or http://t.co/1HmqlNtb"
36,147377072615079936,Thu Dec 15 18:06:46 +0000 2011,0,0,"YUM! Holiday Sparkling Cinnamon Apple Cocktail w/ Bar Bites that start @ $6. Celebrate after work! Stop by, right next to Old State House."
37,147361847425777665,Thu Dec 15 17:06:16 +0000 2011,1,0,Be the host with the most! We'll give you a comp. reward gift card when you book a private dining event. Details here: http://t.co/ekpMSBl5
38,147334535758098432,Thu Dec 15 15:17:45 +0000 2011,0,0,"Today is last day for our #ToysforTots collection! Bring a new, unwrapped toy to Morton's @ State House Square/Hartford from 11:30am to 10pm"
39,147319041789411330,Thu Dec 15 14:16:11 +0000 2011,0,0,"Book your holiday celebrations with us! In our private Boardrooms, elegant Dining Room or comfy Bar: http://t.co/1HmqlNtb or 860-724-0044"
40,147147263544799232,Thu Dec 15 02:53:36 +0000 2011,1,0,Great holiday gift: Learn how to cook like a steakhouse? Our Steak Bible by co-founder Klaus Fritsch has the answers http://t.co/LSnq9CwO
41,147059073785921537,Wed Dec 14 21:03:10 +0000 2011,0,0,Thanks to @Stephania_ESPN @MatthewBerryTMR @NateRavitz @TheRealPodVader for choosing us for last night's celebration. Come back anytime...
42,147006809310363649,Wed Dec 14 17:35:29 +0000 2011,0,0,Congrats to #ESPN #StephaniaBell for winning #fantasyfootball steak bet w/pals. Pic-last night @ Morton’s Hartford http://t.co/UKHJsJoe
43,146989456451313664,Wed Dec 14 16:26:32 +0000 2011,1,0,"For the holidays - LUNCH at Mortons'! Today, Thu 12/15, Fri 12/16 & Dec. 20,21+22. PrIx fixe or order off menu. Reserve now - 860-724-0044."
44,146987085046349824,Wed Dec 14 16:17:06 +0000 2011,2,0,RT @MatthewBerryTMR: Paying off the dinner bet w/ @nateravitz @Stephania_ESPN @TheRealPodVader. I'm tweeting instead of talking to them. ...
45,146627892175052801,Tue Dec 13 16:29:48 +0000 2011,0,0,"#ToysforTots particularly needs items for Girls 7-14. We're a Drop-Off site! Next to Old State House. For info/menu, http://t.co/pW8Au5rO"
46,146430364905259008,Tue Dec 13 03:24:54 +0000 2011,0,0,"Seeking Downtown Htfd drop off for #ToysforTots? Bring new, unwrapped toys to us at 30 State House Sq. - Tue 5pm & on, Wed/Thu 11:30am & on."
47,146352697753341952,Mon Dec 12 22:16:16 +0000 2011,0,0,Treat Yourself! Buy $300 of our #giftcards + we give you $50 More; Buy $500 for $100 Bonus. Stop in + purchase. Can be used at any Morton's.
48,146340615066619904,Mon Dec 12 21:28:16 +0000 2011,0,0,"Book your holiday celebrations with us! In our private Boardrooms, elegant Dining Room or comfy Bar: http://t.co/1HmqlNtb or 860-724-0044"
49,145657564351299584,Sun Dec 11 00:14:04 +0000 2011,0,0,"@_WillSmith_ . We'll come anytime, just let us know."
50,145657277192474624,Sun Dec 11 00:12:55 +0000 2011,0,0,Thanks Shirley + Darren at NBC Connecticut for hosting holiday drink/food demo today. Reserve dinner/lunches now! http://t.co/NBw3KIrW
51,145583504531529729,Sat Dec 10 19:19:46 +0000 2011,1,0,Our Asst. GM Marinka with Shirley Chan today at NBC 30. Whipped up our Sparkling Cinnamon Apple Cocktail! http://t.co/VlrMrfwP
52,145581866110554112,Sat Dec 10 19:13:16 +0000 2011,3,0,Holiday fun! Our Asst. GM Marika served up Sparkling Cinnamon Apple Cocktail today on NBC Connecticut. Thanks Ch.  http://t.co/PPNdAyaL
53,145268395204554752,Fri Dec 09 22:27:39 +0000 2011,1,0,Easy holiday giving: Buy $300 of our #giftcards + we give you $50 More; Buy $500 for $100 bonus. Stop in + purchase. Use at any Morton's!
54,145244707096772608,Fri Dec 09 20:53:31 +0000 2011,1,0,"Morton's for Holiday LUNCH! Next Wed 12/14, Thu 12/15, Fri 12/16 AND Dec. 20,21+22. PrIx fixe or order off menu. Reserve now - 860-724-0044."
55,145209557004726273,Fri Dec 09 18:33:50 +0000 2011,0,0,"Celebrate a Morton's #ChristmasEve, #NewYearsEve + NewYearsDay dinner with us! Make reservations now at http://t.co/pW8Au5rO or 860-724-0044"
56,144813399111503872,Thu Dec 08 16:19:39 +0000 2011,1,0,"Reserve a meal or party at Morton's Hartford for the holidays! Dinner + special luncheon days. 860-724-0044, www.mortons.com/Hartford"
57,144101714310602753,Tue Dec 06 17:11:40 +0000 2011,0,0,"Make reservations now! Special for the holidays - Dec.9,14,15,16, 20,21+22 only. PrIx fixe or order off menu. Reserve now - 860-724-0044."
58,144095704187543552,Tue Dec 06 16:47:47 +0000 2011,0,0,Easy holiday giving: Buy $300 of our #giftcards + we give you $50 More; Buy $500 for $100 bonus. Stop in + purchase. Use at any Morton's.
59,143699919876796416,Mon Dec 05 14:35:05 +0000 2011,0,0,"And bring a new, unwrapped toy with you for our #toysfortots collection drive..now thru mid-December."
60,143699681531281409,Mon Dec 05 14:34:08 +0000 2011,0,0,"Morton's for LUNCH! Special for the holidays! Dec.8,9,14,15,16, 20,21+22 only. PrIx fixe or order off menu. Reserve now - 860-724-0044."
61,143438940387557376,Sun Dec 04 21:18:03 +0000 2011,0,0,@Lessonplanqueen - It is delicious!
62,143438639593029633,Sun Dec 04 21:16:51 +0000 2011,0,0,@Lessonplanqueen  It is!
63,143438438669094912,Sun Dec 04 21:16:03 +0000 2011,0,0,"It's easy & will cheer a child! We're collecting toys for the Marines #ToysforTots - Bring a new, unwrapped toy during restaurant hours."
64,143376645540163584,Sun Dec 04 17:10:30 +0000 2011,0,0,"Special for the holidays! Lunch at Morton's Hartford: Reserve now for Dec.8,9,14,15,16, 20,21+22. PrIx fixe or order off menu. 860-724-0044."
65,142664856552742913,Fri Dec 02 18:02:07 +0000 2011,0,0,"HUGE: Morton's Customer's Tweet makes  ""Top 10 Tweets of the Year!"" Check out: http://t.co/rXmDiyxr"
66,142635675336982528,Fri Dec 02 16:06:09 +0000 2011,0,0,"Our staff & guests are collecting toys for the Marines #ToysforTots - Bring a new, unwrapped toy during restaurant hours. Season for giving!"
67,142365808167890944,Thu Dec 01 22:13:48 +0000 2011,0,0,"Our holiday Sparkling Cinnamon Apple Cocktail + Bar Bites. Great way to celebrate after work! Stop by, right next to Old State House."
68,142256106041917440,Thu Dec 01 14:57:53 +0000 2011,0,0,Easy holiday giving: Buy $300 of our #giftcards + we give you $50 More; Buy $500 for $100 bonus. Stop in + purchase. Use at any Morton's.
69,142195102088040449,Thu Dec 01 10:55:28 +0000 2011,1,0,"Special for Holidays! LUNCH at Morton's Hartford on Dec.8,9,14,15,16, 20,21+22. PrIx fixe or order off menu. Reserve Now: 860-724-0044."
70,141860983751712769,Wed Nov 30 12:47:48 +0000 2011,1,0,"Tonite/final eve. for Morton's $45 Steak Dinner! You MUST ASK/ Not on menu: Iceberg Salad, Filet Mignon, Potato or Veg, Double Choc Mousse."
71,141623147018465280,Tue Nov 29 21:02:44 +0000 2011,0,0,"Tonite & Wed. only - Morton's $45 Steak Dinner! You MUST ASK/ Not on menu: Iceberg Salad, Filet Mignon, Potato or Veg, Double Choc Mousse."
72,141594915313434624,Tue Nov 29 19:10:33 +0000 2011,1,0,"Our staff & guests are collecting toys for the Marines #ToysforTots - Bring a new, unwrapped toy during restaurant hours. Season for giving!"
73,141541531189387264,Tue Nov 29 15:38:25 +0000 2011,0,0,"Special for Holidays: Lunch at Morton's Hartford on Dec.8,9,14,15,16, 20,21+22. PrIx fixe or order off menu. For reservations 860-724-0044."
74,141293814408163328,Mon Nov 28 23:14:05 +0000 2011,1,0,Today only: our online shop is offering special prices for #CyberMonday! #Grill #Cookbook #PrimeHolidays
75,141248751636463616,Mon Nov 28 20:15:01 +0000 2011,0,0,"Now through Wed. - Morton's $45 Steak Dinner! You MUST ASK/ Not on menu: Iceberg Salad, Filet Mignon, Potato or Veg, Double Choc Mousse."
76,141217934692466688,Mon Nov 28 18:12:33 +0000 2011,0,0,"#CyberMonday deal: Morton's Grilling Kit http://t.co/7f4ZCaZT on sale today only.
http://t.co/lQfQTA4X #PrimeHolidays"
77,140893969767858176,Sun Nov 27 20:45:14 +0000 2011,0,0,"Now through Wed. - Morton's $45 Steak Dinner! You MUST ASK/ Not on menu: Iceberg Salad, Filet Mignon, Potato or Veg, Double Choc Mousse."
78,140083571456094208,Fri Nov 25 15:05:00 +0000 2011,0,1,"Tired of Cooking? Enjoy our $45 Meal: You Must Ask/ Not on menu: Iceberg Salad, Filet Mignon, Potato or Veg, Double Choc Mousse - Until Wed."
79,139766677356298241,Thu Nov 24 18:05:47 +0000 2011,1,0,"If u r Tired of Turkey: $45 Meal - You Must Ask/ Not on menu: Iceberg Salad, Filet Mignon, Potato or Veg, Double Choc Mousse! Fri. til 11/30"
80,139361187275096065,Wed Nov 23 15:14:30 +0000 2011,0,0,Stop in for our 2011 Holiday Cocktail: Sparkling Cinnamon Apple - Celebrate! http://t.co/inGcbPDf
81,139069722825203712,Tue Nov 22 19:56:20 +0000 2011,0,0,"Bar Bites & Drinks at Morton's -- All the time! After a long day in the office, before the game, whenever the mood strikes...starting at $6."
82,138713621730574336,Mon Nov 21 20:21:19 +0000 2011,0,0,"Contest! ENTER to win Morton’s Gift Bag (Steak Bible, aprons & more) by using hashtag #PrimeHolidays. Winner announced Tuesday/tomorrow."
83,138667422126309376,Mon Nov 21 17:17:44 +0000 2011,1,0,"Contest: Enter to win a Morton’s Gift Bag (Steak Bible, aprons & more) by using hashtag #PrimeHolidays. Winner will be announced Tuesday."
84,137256808610926592,Thu Nov 17 19:52:27 +0000 2011,0,0,"Special for Holidays: Lunch at Morton's Hartford on Dec.8,9,14,15,16, 20,21+22. PrIx fixe or order off menu. For reservations 860-724-0044."
85,137248443952398337,Thu Nov 17 19:19:13 +0000 2011,0,0,"$45 Dinner! You Must Ask/ Not on menu: Iceberg Salad, Filet Mignon, Potato or Veg, Double Choc Mousse! Ends 11/30. See: http://t.co/LrqelkdP"
86,136930047054446592,Wed Nov 16 22:14:01 +0000 2011,1,0,"Special for Holidays: Lunch at Morton's Hartford on Dec.8,9,14,15,16, 20,21 +22. PrIx fixe or menu. Call for reservations 860-724-0044."
87,136533563175743488,Tue Nov 15 19:58:32 +0000 2011,1,0,Make $$ while Holiday Gift Giving: Buy $300 of gift cards + we add $50 more; buy $500 for $100 bonus. Stop in & purchase.Good @ any Morton's
88,136140072604012544,Mon Nov 14 17:54:57 +0000 2011,0,0,CONTEST: Enter to win Morton's #PrimePlatters assortment for 10. Enter by using hashtag #PrimeHolidays. Winner to be announced tomorrow/Tues
89,136138358706540544,Mon Nov 14 17:48:08 +0000 2011,1,0,"RT @MortonsPHL: Our signature menu items on party trays can make the host a hero for in-home
celebrations/office parties http://t.co/96h ..."
90,136138182587723776,Mon Nov 14 17:47:26 +0000 2011,0,1,"$45 Morton's Hartford Meal. You Must Ask/Not on menu: $45 for Iceberg Salad, Filet Mignon, Potato or Veg, Double Choc. Mousse! Thru 11/30"
91,135053502815805440,Fri Nov 11 17:57:18 +0000 2011,1,0,"Hartford Dinner at Morton's for $45? You Must Ask/Not on menu: $45 Special: Iceberg Salad, Filet Mignon, Potato or Veg, Double Choc. Mousse!"
92,134751874875273216,Thu Nov 10 21:58:45 +0000 2011,1,0,RT @deckerjh: Day 10: Power finally on. We need to celebrate w/a great steak dinner & bottle of wine @MortonsHART #PrimeHolidays #ctstorm
93,134751712274690050,Thu Nov 10 21:58:06 +0000 2011,1,0,Easy Holiday Gift Giving: Buy $300 of our gift cards + we give you $50 more; buy $500 for $100 bonus. Stop in & purchase. Use @ any Morton's
94,134051615933079553,Tue Nov 08 23:36:10 +0000 2011,0,0,#November is National #Pomegranate Month. Check out our Antioxidant Me Spatini - 200 calorie cocktail with Pom jui http://t.co/6wpbBFv3
95,133666158070071296,Mon Nov 07 22:04:30 +0000 2011,3,1,A Treat for our Twitter followers: Enter to win a Private Dining Reception for 15 - Use #PrimeHolidays hashtag. Winner announced tomorrow.
96,133299783354945536,Sun Nov 06 21:48:39 +0000 2011,1,0,Wonderful day in Hartford! UConn wins! Veterans Parade terrific! Come in for great priced Bar Bites and dinner tonite. 860-724-0044
97,132894074087809026,Sat Nov 05 18:56:30 +0000 2011,0,0,@hartfordbuzz @klout Thanks!
98,132893986351349761,Sat Nov 05 18:56:10 +0000 2011,0,0,"@deckerjh Bring kids and we can provide chicken fingers, small burgers....just ask."
99,132893032965087233,Sat Nov 05 18:52:22 +0000 2011,0,0,"Tomorrow/Sunday - Big Day in #Hartford: #CTVeteransParade, #Uconn Basketball at #XLCenter - Stop in for Bar Bites and/or dinner 5pm-10pm!"
100,132892534199431169,Sat Nov 05 18:50:23 +0000 2011,1,0,RT @UCMB: We're back at Rentschler Field tomorrow for #UConnFootball vs. Syracuse - & in Hartford on Sunday for the #CTVeteransParade
101,131483208477966336,Tue Nov 01 21:30:14 +0000 2011,0,0,This Sunday in Hartford: 12:30 CT Vets Parade thru Downtown Hartford +  UConn BBall at XL Center. Great weather too. Finally-some good news!
102,131433583624724483,Tue Nov 01 18:13:02 +0000 2011,0,0,Stop in for Bar Bites or a hot delicious steak dinner before your trip home. Treat yourself! Right next to Hartford's Old State House.
103,131187445155901440,Tue Nov 01 01:54:58 +0000 2011,1,0,RT @DennisHouseWFSB: Connecticut Veterans Day Parade still on for this Sunday at 12:30 in Downtown Hartford  http://t.co/DDVaPunN
104,131172954838011904,Tue Nov 01 00:57:24 +0000 2011,0,0,"We're open again till10PM tonite. Great food, drinks, special Bar Bites + more. Next to Hartford's Old State House. Come on down..."
105,130779015861649408,Sun Oct 30 22:52:01 +0000 2011,0,0,Ex. Gov. Rowland on WTIC-AM mentioned that Morton's Hartford is open tonite and loves it here!
106,130774371915661312,Sun Oct 30 22:33:34 +0000 2011,0,0,"We're open reg hours til 10 tonite. Great food, drinks, heat! Next to Old State House in Hartford. 860-724-0044"
107,130040449535713280,Fri Oct 28 21:57:13 +0000 2011,0,0,"Today also is the Second Annual Champagne Day....who knew? 
Chocolate & Champagne, Steak & Seafood...Morton's Bar Bites and more..."
108,130038667740856320,Fri Oct 28 21:50:09 +0000 2011,0,0,It's National Chocolate Day! Try our Double #ChocolateMousse or Morton's Legendary Hot Chocolate Cake - Yum! http://t.co/m4BPfdKz
109,129640779353309184,Thu Oct 27 19:29:05 +0000 2011,1,0,Connecticut! Enter contest to win a Prime Platter for 4 from Morton's by using hashtag #MortonsSeafood. Winner will be notified tomorrow!
110,129605756398997504,Thu Oct 27 17:09:54 +0000 2011,34,0,RT @Mortons: Contest: Enter to win a Prime Platter for four from Morton's by using the hashtag #MortonsSeafood. Winner will be notified  ...
111,126821711999012865,Thu Oct 20 00:47:07 +0000 2011,1,0,RT @anissaladd: Just found out - its 3 minutes from the @ctconventionctr to @MortonsHART - at a #conventioneers pace of course!
112,126821139673661440,Thu Oct 20 00:44:50 +0000 2011,0,0,Today is National Seafood #Bisque Day - who knew? But you can have our velvety lobster bisque every day. Our menu: http://t.co/b4IXO2sQ
113,126710096267984896,Wed Oct 19 17:23:35 +0000 2011,0,0,Planning a Fall event + want it to be perfect and delicious? We've got a special bonus for private parties. Learn more: http://t.co/T5UuNpYn
114,125253492595097600,Sat Oct 15 16:55:34 +0000 2011,0,0,Love #Golf + Morton's? MON. 10/17: Birdies for the Brave Charity Tourn at #TPC River Highlands & meal at @MortonsHART. http://t.co/o8mb4kCc
115,124551461836304385,Thu Oct 13 18:25:57 +0000 2011,0,0,"Sign up to play - Mon 10/17 Birdies for the Brave Charity Golf at  TPC River Hghlnds. Great golf & food, great cause.  http://t.co/o8mb4kCc"
116,124249706615410688,Wed Oct 12 22:26:53 +0000 2011,0,0,@otherdesigns Great way to start a New Year!
117,124249611429875712,Wed Oct 12 22:26:30 +0000 2011,1,0,RT @otherdesigns: Will see @MortonsHART on the 25th for my birthday! #dinner
118,124249414649921536,Wed Oct 12 22:25:43 +0000 2011,0,0,What's your favorite wine pairing @Morton's? Here's what one of our sommeliers like: http://t.co/nkwqTi6Q
119,123516665710379008,Mon Oct 10 21:54:02 +0000 2011,0,0,"Welcome, Libardo Casas, our new Food & Bev Manager - in CT's hospitality industry for more than a decade & is a great addition to our team!"
120,123190862514634753,Mon Oct 10 00:19:25 +0000 2011,0,0,"Love  this weather, Connecticut? Stop in for delicious Bar Bites + cool Spatinis. Our popular Power Hour in our bar is EVERY hour!"
121,122047879438270464,Thu Oct 06 20:37:36 +0000 2011,1,0,"Still Time to reserve seat for our exclusive Wine Pairing Dinner w/ Anderson's Conn Valley Vineyards -Thur., Oct. 20.  http://t.co/o8mb4kCc"
122,121669197108477952,Wed Oct 05 19:32:51 +0000 2011,0,0,"What's new at Morton's? ""Wines By the Glass Menu"" w/ 15 new wines. Find out why we've received the Wine Spectator ""Award of Excellence""!"
123,121345890651877376,Tue Oct 04 22:08:09 +0000 2011,0,0,"Too rainy/cool to cook. Stop in our Bar for cool drinks and variety of comfy, delicious Bar Bites, starting at just $5. http://t.co/rnXgbSZl"
124,120971873830977536,Mon Oct 03 21:21:56 +0000 2011,0,0,"@CTStorytelling 
Contact Lauren Zilka at Morton's directly at 860-724-0078"
125,120962011243880448,Mon Oct 03 20:42:45 +0000 2011,0,0,"RSVP now for our Wine Pairing Dinner w/ Anderson's Conn Valley Vineyards on Oct. 20. First-come, first-served. See: http://t.co/o8mb4kCc"
126,118367655722889216,Mon Sep 26 16:53:42 +0000 2011,0,0,"RSVP now for our exclusive Wine Pairing Dinner w/ Anderson's Conn Valley Vineyards on Oct. 20. First-come, first-served. See: bit.ly/nvLEbO"
127,118367061448732673,Mon Sep 26 16:51:21 +0000 2011,0,0,"RSVP now for our exclusive Wine Pairing Dinner w/ Anderson's Conn Valley Vineyards on Oct. 20. First-come, first-served. See: bit.ly/pbylZn"
128,117774529278902272,Sun Sep 25 01:36:50 +0000 2011,0,0,Tooooooo hot and humid in Hartford...stop in for a cool drink and Bar Bite
129,117328156637151232,Fri Sep 23 20:03:07 +0000 2011,0,0,Great to meet Aircraft Owners & Pilots Assn. #AOPA Convention members who've been coming in for drinks & dinner. Welcome to Hartford!
130,117327887375400961,Fri Sep 23 20:02:02 +0000 2011,0,0,Great to meet Aircraft Owners & Pilots Assn. (AOPA) convention members who've been coming in for drinks & dinner. Welcome to Hartford!
131,117293907926196225,Fri Sep 23 17:47:01 +0000 2011,0,0,"RSVP now for our exclusive Wine Pairing Dinner w/ Anderson's Conn Valley Vineyards on Oct. 20. First-come, first-served. See: bit.ly/pbylZn"
132,116973585561690113,Thu Sep 22 20:34:10 +0000 2011,0,0,"You can be Hartford's ""Host of the Town"" - We're offering a special bonus for private parties this fall. Learn more: http://t.co/T5UuNpYn"
133,114804824016551936,Fri Sep 16 20:56:17 +0000 2011,0,0,Be Hartford's Host of the Town - We're offering a special bonus for private parties this fall. Learn more: http://t.co/T5UuNpYn
134,113695587894951936,Tue Sep 13 19:28:35 +0000 2011,0,0,"#Pats, #Giants + #Jets fans! Today's final day to enter to win comp. appetizer reception at @Mortons during #NFL game 

http://t.co/V3RyJwu"
135,113694623574147072,Tue Sep 13 19:24:45 +0000 2011,0,0,http://t.co/V3RyJwu
136,111922983643250689,Thu Sep 08 22:04:53 +0000 2011,0,0,Cheers to #Football Season! Enter to win complimentary appetizer reception at @Mortons during #NFL game http://t.co/V3RyJwu
137,111922724632403968,Thu Sep 08 22:03:51 +0000 2011,0,0,http://t.co/V3RyJwu
138,110490784087801856,Sun Sep 04 23:13:50 +0000 2011,1,0,RT @JasonKasprzak: At XL Center for @Cirque #Quidam thx to tix from @MortonsHART
139,110370271608848388,Sun Sep 04 15:14:57 +0000 2011,0,0,Don't feel like grilling tonight? Too muggy..... WE'LL DO IT for you. Just call for reservations 860-724-0044....enjoy the weekend
140,109694004857290752,Fri Sep 02 18:27:43 +0000 2011,0,0,"Served petit filet mignon sandwchs at Channel 3 Kids Camp golf tourn at Gillette Ridge. Great day, Greater cause! http://t.co/eELm9uN"
141,109391500651139072,Thu Sep 01 22:25:40 +0000 2011,0,0,A Hartford Bienvenue to Cirque du Soleil's #Quidam! We're just 1 block from #XLCenter - easy for pre- or post- show Bar Bites and/or Dinner.
