,id_str,created_at,retweet_count,favorite_count,text
0,642679204128104448,Sat Sep 12 12:40:37 +0000 2015,0,0,"MD of Enviro discusses the benefits o f having a CHMS installed: 
https://t.co/s147wEebth"
1,640838846343725056,Mon Sep 07 10:47:41 +0000 2015,2,0,RT @AspenWindows: Some great ways to save money! Thanks for sharing @Enviro__! https://t.co/FrUfj1WFXN
2,640838803280801792,Mon Sep 07 10:47:31 +0000 2015,3,0,RT @copycei: Getting ready to raise the #solar curve.  @GreenerNewsNow @planetgreen @Enviro__ @EnvironmentNC @EnviroNewsTV #gree http://t.c…
3,631827377111347200,Thu Aug 13 13:59:20 +0000 2015,1,1,"Careful In The Kitchen
You can save over £43 by just using your kitchen appliances more carefully.
Set your washing machine to wash at 30°C."
4,631122078587072512,Tue Aug 11 15:16:43 +0000 2015,4,3,"Switch to greener energy today to secure a longer lasting sustainable future, find out more about our products here: http://t.co/68VdtCX2cd"
5,629632208081420288,Fri Aug 07 12:36:31 +0000 2015,3,0,"The benefits of having A Solar Assisted Heat Pump installed in your home.
Solar Assisted Heat Pump installed. http://t.co/MXn6KaC2cu"
6,628200797495537664,Mon Aug 03 13:48:36 +0000 2015,7,5,Having loft insulation installed in your home can save you up to 80% on your heating bill. http://t.co/JqJIywiRBp
7,627431459024994304,Sat Aug 01 10:51:31 +0000 2015,1,1,We are pleased to bring you the latest of our product range the new British made Little Magic Thermodynamic Box:http://t.co/uioE2Ee1sE
8,627063092166426624,Fri Jul 31 10:27:46 +0000 2015,0,1,"Hot water both Night and Day up to 55°c with our Little Magic Thermodynamic Box, find out more here: http://t.co/uioE2Ee1sE"
9,626352247442657280,Wed Jul 29 11:23:07 +0000 2015,0,0,Book a free visit with us and see how much money you can save with our unique energy saving products: http://t.co/V7oaVXUZwC
10,626023977140506624,Tue Jul 28 13:38:41 +0000 2015,0,0,Check out The Little Magic Thermodynamic Box installed on Grand Designs with Kevin McLeod: https://t.co/TYWGRKyNmZ
11,625607372745146368,Mon Jul 27 10:03:15 +0000 2015,0,0,Check out our Grand Designs coverage on The LMB what can save you up to 80% on fuel used to heat your hot water: https://t.co/xNH7HxN0y5
12,623915994864611329,Wed Jul 22 18:02:19 +0000 2015,0,0,Check out our latest video: https://t.co/puvy26sxkP
13,623565959652057088,Tue Jul 21 18:51:24 +0000 2015,0,0,"Check out all our latest charity events in the local area of Chelmsford, Essex: http://t.co/euuUTTmB5E"
14,623177896614608896,Mon Jul 20 17:09:23 +0000 2015,0,0,"By installing new heating controls you can save £70 - £150.
You can find more energy saving tips on our website: http://t.co/aPT4xkopCR"
15,622366262367232000,Sat Jul 18 11:24:14 +0000 2015,0,0,"Want to find out more about the Little Magic Thermodynamic Box, click here to view our online brouchure: http://t.co/ArQDVYh9AO"
16,622005907099123712,Fri Jul 17 11:32:19 +0000 2015,0,0,Check out our Little Magic Thermodynamic Box Grand Designs coverage: https://t.co/TYWGRKyNmZ
17,621641834385772544,Thu Jul 16 11:25:37 +0000 2015,0,0,The Thermodynamic Panel can generate your hot water day &amp; night find out more information here: http://t.co/uioE2Ee1sE
18,620617068673679361,Mon Jul 13 15:33:34 +0000 2015,1,1,"You can save over £43 by just using your kitchen appliances more carefully.
Set your washing machine to wash at 30°C. http://t.co/Z1BL4XmWhT"
19,619822748353843200,Sat Jul 11 10:57:13 +0000 2015,2,0,"You're likely to be losing heat through draughts, gaps in and around the floor, or through the chimney. http://t.co/U1lRo8P2tP"
20,619465684301516801,Fri Jul 10 11:18:22 +0000 2015,0,0,Homes built in 1920 will have a gap between walls. Cavity insulation can save up to £450 a year with a payback of 4 years. #energyeffciency
21,619462200672059392,Fri Jul 10 11:04:32 +0000 2015,0,1,@SHINEUKCharity This is something we could look at please PM us to discuss pricing.
22,619160656667897856,Thu Jul 09 15:06:18 +0000 2015,0,0,"@ShineGobiR @SHINEUKCharity 
We were informed of your mission to help fight hydrocephalus so we were intrigued and wanted to know more :-)"
23,619132851989184513,Thu Jul 09 13:15:49 +0000 2015,1,0,"Would you like the opportunity to save up to 30% on your heating bill?
Request a free call back here: http://t.co/V7oaVXUZwC"
24,618747711622397952,Wed Jul 08 11:45:24 +0000 2015,1,0,Managing director David Noriss discussing the benefits of having a CHMS installed : https://t.co/s147wEebth
25,618742620651700224,Wed Jul 08 11:25:11 +0000 2015,2,0,RT @UtilitySal: Hi @Enviro__ Many thanks for follow - I've already got solar panels - they're great ! Our Government should do more to subs…
26,618035675116498944,Mon Jul 06 12:36:02 +0000 2015,1,0,We we proud to sponsor Our Lady Immaculate primary school summer fate prize draw this year. http://t.co/YuR1CFayG1
27,616664464373497857,Thu Jul 02 17:47:20 +0000 2015,1,1,An average family can save 150kg of CO2 a year just by turning things off? This accounts for 10% of your energy bill and saves £40 a year.
28,615898241612292096,Tue Jun 30 15:02:38 +0000 2015,1,1,"By turning down your thermostat by 1°C can save you up to £75 per year, more tips on our site: http://t.co/0IaqPXV2qk http://t.co/ZQNkBWCLET"
29,615479919427125248,Mon Jun 29 11:20:22 +0000 2015,1,2,By installing Cavity Wall Insulation you could save up to £130 a year with a pay back time of 3 years. #energysaving http://t.co/iu1ng4AhXx
30,614376082167496704,Fri Jun 26 10:14:07 +0000 2015,0,0,Install a voltage optimiser the voltage fed into your home and what a standard appliance consumes 4pc almost 9pc more energy save up to 10%
31,613710456931393536,Wed Jun 24 14:09:09 +0000 2015,0,0,"Enviro Solar customer satisfactory of 96%, read more about our great reviews here on Review Centre: http://t.co/IReYpVaO8q"
32,613410827744509952,Tue Jun 23 18:18:32 +0000 2015,0,0,Enviro Solar MD David Norris takes part in orchid 100 mile charity cycle event read more here: http://t.co/u1Q6rdCBif
33,612207074391531520,Sat Jun 20 10:35:15 +0000 2015,0,0,Could you get into the habit of turning lights off when you leave a room? You could save between £50 to £90 a year just by turning off
34,611849623016243203,Fri Jun 19 10:54:52 +0000 2015,0,0,"Why choose Enviro Solar
1. Customer satisfaction of 95%
2. Unique energy saving products for hot water and heating.
http://t.co/VdkWW6WRRD"
35,611222223765000192,Wed Jun 17 17:21:48 +0000 2015,1,0,"Use the kettle to boil water for cooking, instead of heating the stove. Not only will this be more efficient. http://t.co/NHX6cp5dWI"
36,610764055226253312,Tue Jun 16 11:01:12 +0000 2015,0,0,"Our Little magic Thermodynamic Box only draws 450watts when being used, running 4 hours daily costs 24p.
Read more: http://t.co/dgzbNvdRQJ"
37,610509715009880064,Mon Jun 15 18:10:33 +0000 2015,0,0,Sales Director Andrew Tilley CHMS Testimonial: http://t.co/5o3x35YJBw #renewables
38,608934859327844353,Thu Jun 11 09:52:38 +0000 2015,0,0,"You can save over £43 by just using your kitchen appliances more carefully.
Set your washing machine to wash at 30°C.
#energysavingtips"
39,608674834915164160,Wed Jun 10 16:39:23 +0000 2015,0,0,"Dont replace a burnt-out light bulb. With a compact fluorescent bulb. Fluorescent bulbs use 75% less energy, and last 10 times longer."
40,608222302854094849,Tue Jun 09 10:41:11 +0000 2015,0,0,"By 2020 10% of the worlds power will be supplied from renewables, join the #revolution by having a system fitted!
http://t.co/wuj6wTruRm"
41,608194030359453696,Tue Jun 09 08:48:51 +0000 2015,1,0,"By 2020 10% of the worlds power will be supplied from renewables, join the #revolution by having a system fitted!
http://t.co/VdkWW6WRRD"
42,607965010481016833,Mon Jun 08 17:38:48 +0000 2015,0,1,"The most efficient appliance in your kitchen in your microwave, which uses just 1/3 of the wattage of most ovens.
#energyhour"
43,606458832513056768,Thu Jun 04 13:53:47 +0000 2015,0,0,#energysavingtips approximately 30% of energy used in buildings is used inefficiently stop this by installing a CHMS: http://t.co/C2Aep1HUnm
44,606071441960878080,Wed Jun 03 12:14:26 +0000 2015,0,0,Stay Worm cut costs turning down your thermostat by 1°C could save you as much as £60 a year. #energyefficiency
45,605730372421332992,Tue Jun 02 13:39:09 +0000 2015,0,0,"Why have Solar Thermal installed when you can have a Solar Assisted Heat Pump Installed which works day &amp; night.
http://t.co/UE3e3DzCKZ"
46,604281219812036609,Fri May 29 13:40:44 +0000 2015,0,0,"Great news you can now book an appointment online, book your appointment now: http://t.co/0tGBoDkRh5"
47,603529268790992897,Wed May 27 11:52:45 +0000 2015,0,0,always wanted to own a renewable product? Well good news you can pay buy finance when you shop with enviro solar: http://t.co/ybRjSjmANY
48,603492377890783232,Wed May 27 09:26:09 +0000 2015,0,0,"@eastholme_tanks Hi Trevor thanks for your reply, all our numbers are screened against the TPS list but in this case we will require details"
49,603148843530739713,Tue May 26 10:41:04 +0000 2015,0,0,96% of our customers are satisfied with our innovative products to read more click here: http://t.co/lPKuMJ8cMY http://t.co/2A7hiWyHGi
50,603133819538042880,Tue May 26 09:41:22 +0000 2015,0,0,@eastholme_tanks Hi Trevor could you please provide us with a the contact number you wish us to blacklist Thanks.
51,601700152135520256,Fri May 22 10:44:29 +0000 2015,0,0,"Little Magic Thermodynamic Box generates up to 80% on your domestic hot water no maintenance is required.
Cal for a free quote: 08001974508"
52,600325432618147841,Mon May 18 15:41:51 +0000 2015,0,0,"Want to reduce your energy bills without breaking the bank?
Well you can by calling 08001974508 to find more information on our products"
53,599192251734986753,Fri May 15 12:38:59 +0000 2015,0,0,"How much can renewable energy save you?
call now to receive a free quote for one of our unique products now 30% off.
Call: 08001974508"
54,597745619302752256,Mon May 11 12:50:35 +0000 2015,0,0,"The 4 steps off an installation of one of our products, find out more here: http://t.co/VjRSJUBWMa http://t.co/erpgU6gJ7U"
55,597741680880656384,Mon May 11 12:34:56 +0000 2015,0,0,"Come check out our new company introductory video:
http://t.co/zzIZd3D1Io"
56,596660091878780928,Fri May 08 12:57:05 +0000 2015,0,0,Watch our introductory video to learn more about what we do and who we are: http://t.co/z28BeC87CT
57,595919752507326464,Wed May 06 11:55:15 +0000 2015,0,0,@SustEngineer Hi if you would be able to supply a contact number to us we will give you a call to discuss pricing and installation.
58,594441282002538497,Sat May 02 10:00:20 +0000 2015,0,0,"Energy Bills continuing to rise by 37% in the next 3 years, prevent this by installing a CHMS http://t.co/lywcBVNZAc"
59,594071278216224768,Fri May 01 09:30:04 +0000 2015,0,0,"650,000 renewable energy systems have been installed in UK homes.
By 2020 an estimate of 20% of energy will be supplied by renewable energy"
60,593762020454957056,Thu Apr 30 13:01:11 +0000 2015,0,0,"Have you always wanted to save money on your utility bills?
you now can find out more by going to: http://t.co/mvmkS2VXXY"
61,592665702915506177,Mon Apr 27 12:24:49 +0000 2015,0,0,"Sales director of Enviro has just had our CHMS installed in his own home, read the full review here:
http://t.co/GMShM979zI"
62,590515051343257600,Tue Apr 21 13:58:54 +0000 2015,0,0,"Energy Saving Tip- By turning down your thermostat by 1 degree you can save up to 10% on your annualc heating bill.
#energysavingtips"
63,590077666356764672,Mon Apr 20 09:00:53 +0000 2015,0,0,"Looking to save money on energy bills?
All energy saving products are now 30% off to find out more ghttp://buff.ly/1J1L78w"
64,588673715388420097,Thu Apr 16 12:02:05 +0000 2015,0,0,"Energy Bills continue to rise, to prevent your energy bills increasing call us to receive a free quote on all products: 08001974508"
65,588009369087901696,Tue Apr 14 16:02:12 +0000 2015,0,0,"CHMS can save you up to 30% on your central heating bills and cure common heating problems.
http://t.co/UFryeejssI http://t.co/iEjXCb1HXx"
66,587565594066685952,Mon Apr 13 10:38:48 +0000 2015,0,0,"Call today for a quotation on our energy saving products using code 57612 for our spring promotion!

#callnow #saving http://t.co/aO5FN9a5wm"
67,585017275759075328,Mon Apr 06 09:52:42 +0000 2015,7,1,"Follow us &amp; RT for a chance of winning a Sonos play bar, winner is announced in 10 days
#giveaway http://t.co/r09ghKcipB"
68,580335280579874816,Tue Mar 24 11:48:07 +0000 2015,2,0,"Only 22 days remaining of our amazing give away of our Sonos play bar, for a chance of winning follow &amp; RT."
69,578141779033227264,Wed Mar 18 10:31:56 +0000 2015,3,0,"Only 28 days remain on our great give away of our Sonos playbar.
To take part follow us &amp; RT
#giveaway http://t.co/Tdm33es3jo"
70,576326476049567744,Fri Mar 13 10:18:34 +0000 2015,4,1,"Only 29 days remain on our give away of our Sonos sound bar worth over £599, for a chance to win Follow us &amp; RT. #GiveawayFriday"
71,575592235179380736,Wed Mar 11 09:40:57 +0000 2015,0,0,"By installing a thermodynamic system it does not require any maintenance.
To find out more go to:http://t.co/VdkWW6WRRD
#renewables"
72,573463167893921793,Thu Mar 05 12:40:48 +0000 2015,1,1,By installing cavity wall insulation you can save up to 40% on heat loss #heatingtips
73,572343824896401408,Mon Mar 02 10:32:56 +0000 2015,0,0,"David Norris MD talks on BBC radio http://t.co/CwYZD1d7Gx
Listen now!"
74,571253495904534528,Fri Feb 27 10:20:21 +0000 2015,0,0,"Go check out David Noriss MD of Enviro speak about energy bills rising:
http://t.co/K2mSD8SqWe #energysaving"
75,570600753032638464,Wed Feb 25 15:06:35 +0000 2015,0,0,"#giveaway We are giving away a day trip to drive in your favourite sports car!
For a chance of winning all you have to do is follow &amp; RT"
76,570223520904560640,Tue Feb 24 14:07:36 +0000 2015,0,0,"The Little Magic Thermodynamic Box can save you up to 80% on your hot water, find out more at http://t.co/uioE2Ee1sE 
#energyefficiency"
77,570163246470184960,Tue Feb 24 10:08:05 +0000 2015,5,1,"#giveaway We are giving away an all day super car experience, for a chance to win follow us &amp; RT this tweet. http://t.co/3tZLVTdHQ7"
78,569875974705307649,Mon Feb 23 15:06:34 +0000 2015,0,0,"Is a Solar Assisted Heat Pump suitable for your home?
Find out now by calling: 08001974508 #renewableenergy"
79,569798802078453760,Mon Feb 23 09:59:55 +0000 2015,0,0,"Great savings on our renewable energy products now 30% off.
http://t.co/68VdtCFqND #renewableenergy"
80,568813249493229568,Fri Feb 20 16:43:41 +0000 2015,0,0,"You can save over £43 by setting kitchen appliances correctly set your washing machine to 30, more energy saving tips:http://t.co/aPT4xk6Oeh"
81,568706530067013632,Fri Feb 20 09:39:37 +0000 2015,0,0,Ever thought about loft insulation? It can save you up to £300 a year.
82,568438201532043264,Thu Feb 19 15:53:22 +0000 2015,0,0,"The average cost for cavity wall insulation is between £450 to £500 and can save up to £145 a year.
#energyefficiency"
83,568121812070109184,Wed Feb 18 18:56:09 +0000 2015,0,0,Great news our Thermodynamic system will be featured at ecobuild go check it out stand number N2200
84,567992782813581312,Wed Feb 18 10:23:26 +0000 2015,0,0,Tired of high energy bills? We'll contact us and we can reduce this for you: 01245407331
85,567728656860975104,Tue Feb 17 16:53:54 +0000 2015,0,0,Come check out our great deals on our Renewable Energy products: http://t.co/68VdtCFqND
86,567256531616669696,Mon Feb 16 09:37:50 +0000 2015,0,0,Save money on hot water by having a thermodynamic system installed. #savings http://t.co/E2wTK4cfUP
87,566533164177567744,Sat Feb 14 09:43:26 +0000 2015,0,0,Go check out our website for great offers and energy saving tips. enviro http://t.co/stHmfo8vk8
88,566265869568061440,Fri Feb 13 16:01:18 +0000 2015,0,0,"Set your washing machine to 30.C to save money on energy bills and reduce CO2 emitted. 
#saving #energyconsertvation"
89,566170769684979712,Fri Feb 13 09:43:25 +0000 2015,0,1,Looking to save money on energy bills. Good news we are giving away free quotes for saving energy. Call us on: 01245407331 #savings
90,565531771190935552,Wed Feb 11 15:24:15 +0000 2015,0,0,The average household spends around £70 a year keeping household electronic devices on standby. Be sure to turn them all off. #energy
91,565446233675010049,Wed Feb 11 09:44:22 +0000 2015,0,0,Use energy saving light bulbs or install a voltage optimiser to reduce electricity bills. #savings
92,565167658556198913,Tue Feb 10 15:17:24 +0000 2015,1,1,#energyefficiency #EnergySavingTips http://t.co/LlwuWfG4Vp
93,565166590782885888,Tue Feb 10 15:13:10 +0000 2015,0,0,"We are pleased to bring you  our product  the British made Little Magic Thermodynamic Box, this will save you up to 80% on your hot water"
94,565161096794112000,Tue Feb 10 14:51:20 +0000 2015,0,0,"UK Prime Minister Tweets @Enviro__ #enviroglaze#
#davidcameron #primeministergr http://t.co/ueXelITGEr"
95,565152833318555649,Tue Feb 10 14:18:30 +0000 2015,0,0,Managing Director David Norris featured on Phoenix98 Fm http://t.co/GfCRpWvikl
96,565150829255352320,Tue Feb 10 14:10:32 +0000 2015,0,0,Managing Director David Norris On BBC Essex Radio #BBC #renewable http://t.co/wr8DfiMNRJ
97,565149540291215361,Tue Feb 10 14:05:25 +0000 2015,0,0,"You can save over £43 by just using your kitchen appliances more carefully.
Set your washing machine to wash at 30°C rather than 40c"
98,565082881643782145,Tue Feb 10 09:40:32 +0000 2015,0,1,30% discount on all products until the rest of the month. #savings #renewableenergy
99,564007165732864000,Sat Feb 07 10:26:01 +0000 2015,0,0,"Great winter offers now available on our website on all products, hurry before sale ends:
http://t.co/68VdtCX2cd"
100,563272538290388992,Thu Feb 05 09:46:52 +0000 2015,0,0,"Energy saving tip of the day. The more you fill you kettle the more energy is used, only hear what you require. #savings #energyefficiency"
101,562655825525997571,Tue Feb 03 16:56:17 +0000 2015,1,0,RT @cheekychicco: @Enviro__ this would be a driver dream to remember
102,562177334506446848,Mon Feb 02 09:14:55 +0000 2015,12,4,"All day supercar challenge, for a chance to win follow &amp; RT. #cars #giveaway #funtimes"
103,561089613000097792,Fri Jan 30 09:12:42 +0000 2015,10,1,Would you like the chance to win an all day super car experience. All you have to do is follow &amp; RT this tweet for a chance to win good luck
104,560861084127481856,Thu Jan 29 18:04:37 +0000 2015,0,0,Happy Customer Review: Had the MHB for a year and have seen a 30% saving in gas consumption. The underfloor heating is faster to warm.
105,560728458431832065,Thu Jan 29 09:17:36 +0000 2015,1,0,We are currently giving away a day trip to go and drive a super car for the day. For a chance to win follow and RT.
106,560491450119757824,Wed Jan 28 17:35:49 +0000 2015,0,0,"We have over 545 reviews with a 96% customer satisfactory rate.
http://t.co/DFD3YT0fwq 
#reviews #reviewcentre"
107,560382005746335744,Wed Jan 28 10:20:56 +0000 2015,2,0,We are currently giving away a day trip to go and drive a super car for the day. For a chance to win follow and RT. http://t.co/Ur4XllX5Bg
108,560111238244741120,Tue Jan 27 16:25:00 +0000 2015,1,0,We are currently giving away a day trip to go and drive a super car for the day. For a chance to win follow and RT #goodluck
109,559804581971255297,Mon Jan 26 20:06:27 +0000 2015,0,0,Most of tour home heat is lost by the roof. By insulating you can save up to £300 a year and stay warm too. #enviro tips
110,559773028025114624,Mon Jan 26 18:01:04 +0000 2015,0,0,"Director David Norris discusses the benefits of The Magic Heating Box #energysaving
https://t.co/s147wEvMBl"
111,559630452236230656,Mon Jan 26 08:34:31 +0000 2015,4,0,We are currently giving away a day trip to go and drive a super car for the day. For a chance to win follow and RT http://t.co/rQVEj4iITa
112,558928554386522112,Sat Jan 24 10:05:26 +0000 2015,0,0,http://t.co/9ouBpGYIbZ
113,558917371650650112,Sat Jan 24 09:21:00 +0000 2015,1,0,We are currently giving away a day trip to go and drive a super car for the day. For a chance to win follow and RT http://t.co/rQVEj4iITa
114,558645361263521795,Fri Jan 23 15:20:07 +0000 2015,0,1,"Happpy Customer J Wood
Installation was straight forward. We are now getting much more hot water than before, we are very pleased. #savings"
115,558552061273731074,Fri Jan 23 09:09:23 +0000 2015,0,0,It's so cold today dropping at -2 in Essex make sure your heating is working as February is going to be just as cold
116,558333048274841601,Thu Jan 22 18:39:06 +0000 2015,0,0,"#happycustomer 
A Yates
6 months down the line working very well. Full tank of hot water continuously so perfectly happy with performance."
117,558234892757368832,Thu Jan 22 12:09:04 +0000 2015,0,1,"Happy Customer
A Oates
Very happy that we decided to install this product. great heat output on radiators. very happy with system"
118,557952981724057600,Wed Jan 21 17:28:51 +0000 2015,0,0,"Come check out our Reviews on Review Centre 96% customer satisfactory:
http://t.co/JKM3b1qIb7 #happycustomers"
119,557952511282536450,Wed Jan 21 17:26:59 +0000 2015,0,0,"Happy Customer Review
B Everitt
Installation went well, installers very helpful. Pleased with the system so far with the heating output."
120,557931437731885056,Wed Jan 21 16:03:15 +0000 2015,0,0,By adding 270mm of loft insulation to your property you could save up to £150 a year.
121,557553140032356352,Tue Jan 20 15:00:02 +0000 2015,0,0,"Install cavity wall and loft insulation. This is an effective way to cut your energy costs, and feel warmer too.
#saving"
122,557217993978281984,Mon Jan 19 16:48:17 +0000 2015,0,0,"David Norris MD of Enviro discusses benefits of the CHMS #energyefficiency 
https://t.co/s147wEvMBl"
123,557188284452200448,Mon Jan 19 14:50:13 +0000 2015,0,0,"90% of a washing machine's energy is spent on heating the water, if you wash your clothes at 30-40 °C you're saving money."
124,556442343940030464,Sat Jan 17 13:26:07 +0000 2015,0,0,"Losing Money on heating bills here is a usefull article on 19 top ways to save money:
http://t.co/tHoyb2UY3n #saving"
125,555814684629434368,Thu Jan 15 19:52:02 +0000 2015,0,0,"Some of the top 10 ways to save money on your heating bills:
http://t.co/AD3pKkJMv0"
126,542706226707304448,Wed Dec 10 15:43:42 +0000 2014,0,0,Go check out our new &amp; improved Christmas themed website! http://t.co/GyIip7z5Rv
127,542384221424087040,Tue Dec 09 18:24:10 +0000 2014,0,1,"Go check out our exclusive offers on our Renewable Energy systems.
http://t.co/IJShIkM5sG"
128,540210043841687553,Wed Dec 03 18:24:45 +0000 2014,0,0,Go check out our latest winter deals: http://t.co/iSgu0eWJKr
129,523441008525443074,Sat Oct 18 11:50:36 +0000 2014,0,0,go check out wayne featured in the latest your money issue http://t.co/TNP60E2IP3
130,510390227278385153,Fri Sep 12 11:31:27 +0000 2014,0,0,"check out MR Orkwood this times winner of the £25 voucher, you could be next!
http://t.co/8viSOFOuLw-"
131,507580644637958144,Thu Sep 04 17:27:10 +0000 2014,0,0,Check out our amazing deals at: http://t.co/IJShIkuukC
132,501395256076931072,Mon Aug 18 15:48:39 +0000 2014,0,0,we are a home improvement company ranging from windows to central heating systems check us out: http://t.co/JpaQQZQdMO
133,494873636474724352,Thu Jul 31 15:54:03 +0000 2014,0,0,Hello Twitter! #myfirstTweet
