,id_str,created_at,retweet_count,favorite_count,text
0,654116630062956544,Wed Oct 14 02:08:52 +0000 2015,7,0,RT @abc7newsBayArea: Do you agree or disagree with Hillary Clinton's statement: “The economy does better when you have a Democrat in the Wh…
1,654094532179460096,Wed Oct 14 00:41:03 +0000 2015,0,0,Watching the democratic debate #DemocraticDebate
2,650908165257625600,Mon Oct 05 05:39:34 +0000 2015,0,0,How can people remain clueless in a age of revolution #wakeup
3,551877854267310080,Sun Jan 04 23:08:28 +0000 2015,0,0,It's a new year! What are you doing differently ?
4,549446174810189824,Mon Dec 29 06:05:50 +0000 2014,0,0,Reading is a great way to stimulate your mind!!
5,545331115976708096,Wed Dec 17 21:34:04 +0000 2014,0,0,Everyday can be successful with the right mindset #success #HustleGang #HustleBelieveReceive
6,539601218377908224,Tue Dec 02 02:05:30 +0000 2014,0,1,Timing is everything #TheProfit
7,539600872624652289,Tue Dec 02 02:04:07 +0000 2014,0,0,"@marcuslemonis knows how to take sucess to another level ""phenomenal"" #TheProfit"
8,538223616098197504,Fri Nov 28 06:51:24 +0000 2014,0,0,I just want to have a positive impact on society!
