,id_str,created_at,retweet_count,favorite_count,text
0,655483172763869184,Sat Oct 17 20:39:01 +0000 2015,0,1,How will you stay in touch with your clients? An email newsletter is a great way to touch base with your audience http://t.co/VN49rKEzYn
1,655120860395753472,Fri Oct 16 20:39:19 +0000 2015,0,0,"Tag, pin, post, share, tweet, gram. Integrating social media into your website is critical. http://t.co/HIFrjEf9ig"
2,654396084886863872,Wed Oct 14 20:39:19 +0000 2015,0,0,SEO ensures that your site is accessible to a search engine and improves the chances that you’ll be found. http://t.co/8n9gzWwsDp
3,653671240750755841,Mon Oct 12 20:39:03 +0000 2015,0,0,Everyone online needs an e-commerce solution into their website. Let us install a solution for you. http://t.co/xycy63UglD
4,652946455771136000,Sat Oct 10 20:39:00 +0000 2015,0,0,"Need a new site? Our web design platforms are fully responsive, and operate on both desktop and mobile applications. http://t.co/YH7dOk5lpt"
5,652584098368778240,Fri Oct 09 20:39:08 +0000 2015,0,0,"We can make any type of brochure or flyer you may need to keep on-hand in your office, or use as a mailer. http://t.co/ULv1oQrRcV"
6,651859329054846976,Wed Oct 07 20:39:09 +0000 2015,0,0,"We often get asked, “do I really need a business card?” Our answer, is a resounding YES! http://t.co/G7jyh6aDA3"
7,651134562110607360,Mon Oct 05 20:39:11 +0000 2015,0,0,Your logo is the face of your brand. Let us refresh yours or create a new one from scratch. http://t.co/hZDURWvqxg
8,650409762388054016,Sat Oct 03 20:39:06 +0000 2015,0,0,"We're located in sunny Southern California, but can help you no matter where you are in the world! http://t.co/hmbJgjFbrE"
9,650047364087042048,Fri Oct 02 20:39:03 +0000 2015,0,0,We love helping our clients grow! Check our our online portfolio and see how we've helped others. http://t.co/j2KMhv4fbo
10,649322635642425344,Wed Sep 30 20:39:14 +0000 2015,0,0,Blogging is one of the most direct ways of interacting with your audience. Learn more at http://t.co/Jkn8oYiiDh http://t.co/i1u4s8cO5o
11,648597811563491328,Mon Sep 28 20:39:03 +0000 2015,0,0,How do you keep in touch with your client base? Our newsletter service can automate the process for you. http://t.co/pF4CJV9piS
12,647873084070973440,Sat Sep 26 20:39:14 +0000 2015,1,0,Want to be on social media but don't have the time to keep up with postings? We can manage all your accounts for you. http://t.co/1RUTaWODsk
13,647510660771917824,Fri Sep 25 20:39:06 +0000 2015,1,0,So you have a website..but are people actually seeing it? Our SEO techniques makes your site more visible. http://t.co/pcgqCAsbzm
14,646785868846333952,Wed Sep 23 20:39:02 +0000 2015,0,0,Are you a retailer who still doesn't accept e-commerce? We can change that and provide another revenue stream for you http://t.co/U7JE2gTzqz
15,646061197234671616,Mon Sep 21 20:39:27 +0000 2015,0,1,"Responsive Web Design? Yes we can! Whether you need to refresh an existing site, or need one developed from scratch. http://t.co/EwDWZOXe1W"
16,645336460682489856,Sat Sep 19 20:39:36 +0000 2015,0,0,Need a business card? Check us out at http://t.co/CpYotYJsdV http://t.co/ylDcC2Kkoi
17,644973976951787520,Fri Sep 18 20:39:13 +0000 2015,0,1,"Have you visited us online lately? See how our branding, website, and social media strategies can help you grow! http://t.co/zAU9ItxGzw"
18,643524404744441856,Mon Sep 14 20:39:08 +0000 2015,0,0,Another great Maatee product. http://t.co/xiZV3NTFMb
19,642799599661490177,Sat Sep 12 20:39:01 +0000 2015,0,1,"Orange &amp; Tangerine foaming liquid soap, made with organic ingredients from Maatee. http://t.co/s2V8qGWxcM"
20,642437229995032576,Fri Sep 11 20:39:06 +0000 2015,0,0,"Our client Maatee artfully creates natural, organic soaps. Friendly for the environment and Mother Earth. http://t.co/hgzESCkzFg"
21,641712454402187264,Wed Sep 09 20:39:06 +0000 2015,0,0,Sage lemongrass &amp; spearmint. Sounds delicious! Product shoot for Maatee. http://t.co/ALsh4qU6ts
22,640987658987114496,Mon Sep 07 20:39:01 +0000 2015,0,0,Natural plant based foaming liquid soap from Maatee. http://t.co/7sLxmPJQom
23,640262884233211905,Sat Sep 05 20:39:01 +0000 2015,0,0,Organic foaming handsoap anyone? More from our product photoshoot with Maatee. http://t.co/Ud9L5TbnEA
24,639900498825478144,Fri Sep 04 20:39:02 +0000 2015,0,0,"Here's what's inside the box: Orange &amp; Tangerine. Another product from our client photoshoot, Maatee. http://t.co/EPThmpA4SA"
25,639175791427895297,Wed Sep 02 20:39:18 +0000 2015,0,0,More soapbars from Maatee. Environmentally friendly products and packaging. http://t.co/IOxKzqpcCH
26,638450943353331712,Mon Aug 31 20:39:01 +0000 2015,0,1,Product photoshoot for Maatee. Organic foaming soaps - Oatmeal &amp; Clove. http://t.co/cH5ZvZCuyV
27,637726207509954560,Sat Aug 29 20:39:10 +0000 2015,0,1,Product photoshoot for Maatee. All natural ingredients. http://t.co/UKsAPxjkwV
28,637363784009523200,Fri Aug 28 20:39:02 +0000 2015,0,1,Product photoshoot for Maatee. Organic soaps! This one is blood orange bergamot &amp; lemongrass. http://t.co/ENQhgQ5fcs
29,617432454786338816,Sat Jul 04 20:39:03 +0000 2015,0,0,"Happy Birthday America! From our family to yours, wishing you a happy and safe 4th of July celebration!"
30,617070102454910976,Fri Jul 03 20:39:11 +0000 2015,0,0,One more from our photoshoot with Cohesive. http://t.co/OOK2FWhOi5
31,616345338895564800,Wed Jul 01 20:39:14 +0000 2015,0,2,Cohesive photoshoot. Gotta love their take on fashion. http://t.co/rGF4X6J9fu
32,615620532046856192,Mon Jun 29 20:39:07 +0000 2015,0,1,Fabulous shot from Lanzabeauty http://t.co/cMOrkbt8LU
33,614895779753381889,Sat Jun 27 20:39:12 +0000 2015,1,0,Check out the Ellahi boys. http://t.co/x7r0cgOlpz
34,614533356039077888,Fri Jun 26 20:39:04 +0000 2015,0,0,Another great shot with Cohesive. http://t.co/8nttuSeKGo
35,613808603296829441,Wed Jun 24 20:39:09 +0000 2015,0,1,We love playing with color! http://t.co/QAMkoJ1SxI
36,613083847819939841,Mon Jun 22 20:39:14 +0000 2015,0,0,Another great shot with Ellahi Ltd. http://t.co/DcSSFCCkvu
37,612359032716836864,Sat Jun 20 20:39:05 +0000 2015,0,0,"Photoshoot with our latest client, Cohesive. http://t.co/4Ih309gv3y"
38,611996659711614976,Fri Jun 19 20:39:08 +0000 2015,0,0,On-location for a corporate photoshoot with Lanzabeauty. http://t.co/of6rxMM5v8
39,611271857937981440,Wed Jun 17 20:39:02 +0000 2015,0,0,Photoshoot for Elahi Ltd. http://t.co/ss890r4EiJ
40,606198482643353601,Wed Jun 03 20:39:15 +0000 2015,0,2,"Clean, classic look with this photo for FreeSparringFinder. http://t.co/X7tKBWNDHU"
41,605473644106653697,Mon Jun 01 20:39:00 +0000 2015,0,0,We love showing off our creative side. Another photo from our shoot with FreeSparringFinder. http://t.co/buSNJPoTCb
42,604748896594722816,Sat May 30 20:39:07 +0000 2015,0,2,We had a really great time at our photoshoot for Lanzabeauty. http://t.co/RAG9DL2kLp
43,604386480241446912,Fri May 29 20:39:00 +0000 2015,0,2,Here's a great shot from our photoshoot with FreeSparringFinder http://t.co/Uqyg6W3xvp
44,604024116274937856,Thu May 28 20:39:06 +0000 2015,0,0,Meet DJ Riamu of Riamu Entertainment. http://t.co/wVuc68w2Sr
45,603661723288117248,Wed May 27 20:39:04 +0000 2015,1,2,Lanzabeauty photoshoot. http://t.co/DAlODIAw7k
46,603299320021000192,Tue May 26 20:39:01 +0000 2015,0,1,Proposal brochure cover for FreeSparringFinder http://t.co/2x4iQfim9O
47,602936967509213185,Mon May 25 20:39:09 +0000 2015,0,1,Photoshoot for Riamu Entertainment - excellent vendor for Wedding and Event DJ and Uplighting! http://t.co/G8UH0rYYfI http://t.co/A2Zt6CAyCs
48,602574554632970240,Sun May 24 20:39:03 +0000 2015,0,1,Another great shot from our photoshoot with Lanzabeauty. http://t.co/rhPvj9i31B
49,602212153521774592,Sat May 23 20:39:00 +0000 2015,0,1,"Rock climbing wall with our friends in Big Bear, California http://t.co/jPxoKnmhw7"
50,601849784748605440,Fri May 22 20:39:05 +0000 2015,0,1,More from our photoshoot with Lanzabeauty. What you see here is the ancient art of eyebrow threading. http://t.co/DlCC2Lq7pr
51,601487377958305794,Thu May 21 20:39:00 +0000 2015,0,1,Proposal brochure we created exclusively for FreeSparringFinder. http://t.co/YyIOEu1oS5
52,601125015749337089,Wed May 20 20:39:06 +0000 2015,0,1,"Photoshoot for one of our clients, Lanzabeauty. http://t.co/0CwrYIW2iM"
53,600762620413661184,Tue May 19 20:39:04 +0000 2015,0,3,"Another magical shot our photographers captured in Big Bear, California. http://t.co/tcjSKVd7AM"
54,600400275262812162,Mon May 18 20:39:15 +0000 2015,0,2,Threading shot for Lanza Beauty. Need photos of your business? Let us know! http://t.co/aFaQE8t3Am
55,600037886864531456,Sun May 17 20:39:15 +0000 2015,0,2,"We were in the local mountains last weekend, and guess what? Snow! http://t.co/cxBsRSmPxo"
56,599675444351348736,Sat May 16 20:39:02 +0000 2015,0,1,Product shoot for Lanza Beauty. http://t.co/ewBON3g6Dt
57,599313070213693440,Fri May 15 20:39:05 +0000 2015,0,0,Yes! We GoPro! Do you? http://t.co/PYSTNQw2V7
58,598950685862924288,Thu May 14 20:39:06 +0000 2015,0,0,"On location shoot in Big Bear, California http://t.co/nerDN3KgIH"
59,598588309703622656,Wed May 13 20:39:08 +0000 2015,0,0,"Photo retouching we did for one of our clients, Lanza Beauty. http://t.co/YFOJLVoOKH"
60,597138749038960640,Sat May 09 20:39:06 +0000 2015,0,0,Google’s Mobile Friendly Algorithm A Week Later: Was It Really Mobilegeddon? http://t.co/v0WsOz7bIV
61,596776347160174592,Fri May 08 20:39:03 +0000 2015,0,2,"Social media marketing, blogging, photography, videography, and more. How can we help you succeed? http://t.co/8fieHU8Ocw"
62,596413975060951040,Thu May 07 20:39:07 +0000 2015,0,1,"Where are you taking your summer vacation? A look back at a resort photoshoot in Cabo San Lucas, Mexico. http://t.co/fdMhovRLfD"
63,596051645957578753,Wed May 06 20:39:21 +0000 2015,0,0,See what Amniamedia can do to help your business grow. http://t.co/7gnuQDf1uD
64,595689196871909377,Tue May 05 20:39:06 +0000 2015,0,2,Have a business that needs product #photography? #Branding? #Marketing? We do all the above and more. http://t.co/thJTCsFbaV
65,595326784876478465,Mon May 04 20:39:00 +0000 2015,0,1,On-location shoot for a hotel in Cabo San Lucas http://t.co/d2Y1XZqKHJ
66,594964401490436096,Sun May 03 20:39:01 +0000 2015,0,0,"Need us to do a company photoshoot? We can arrange to in-studio or destination shoots, as you need them. #amniamedia http://t.co/8zGPGLYXqE"
67,594602009002672128,Sat May 02 20:39:00 +0000 2015,0,1,"Hotel in Cabo. Need us to come to you - we can do that. Plus, we love vacations! Where are you headed this summer? http://t.co/EKNutwv5rz"
68,594239681652490240,Fri May 01 20:39:15 +0000 2015,0,0,Blogging not your thing? Amniamedia's trained staff can help keep your #blogs current and up to date.
69,593877252577894400,Thu Apr 30 20:39:05 +0000 2015,0,0,Google Mobile Algorithm Update: What A Layman Needs To Know http://t.co/qFVTAn5KAn
70,593514850065584129,Wed Apr 29 20:39:01 +0000 2015,0,1,"More from the Limo photoshoot in Cancun, Mexico. We travel to meet our customer's needs. http://t.co/AXE7fYJUQX"
71,593152585978249217,Tue Apr 28 20:39:31 +0000 2015,0,2,Considering a new website for your business? Amniamedia specializes in WordPress Theme Website building with mobile optimization and #seo
72,592790110673973249,Mon Apr 27 20:39:10 +0000 2015,0,0,From a cafe photoshoot in Cancun. http://t.co/ZLO2H8hfTK
73,592427717376798720,Sun Apr 26 20:39:09 +0000 2015,0,0,Here's some tools for managing all your social media accounts. Or..you could just let us do it. http://t.co/dZY89ZBSBN
74,592065297412132864,Sat Apr 25 20:39:01 +0000 2015,0,0,More Cancun work! Shot this for a hotel. Need photos and/or branding work done? Let us know! http://t.co/Pgo6fzWyzf
75,591702905708748801,Fri Apr 24 20:39:00 +0000 2015,0,2,50 Best Marketing Strategies for Small Business http://t.co/HQr0KO8yHv
76,591340533630500865,Thu Apr 23 20:39:04 +0000 2015,0,0,Amniamedia is global! Check out some of our work in Cancun! This was for a limo company. http://t.co/leLOSlYmot
77,590978155072073729,Wed Apr 22 20:39:06 +0000 2015,0,0,"What does ""branding"" mean and why do you need it? http://t.co/PfBCMrI4Fi"
78,589166190968360960,Fri Apr 17 20:39:00 +0000 2015,0,0,Need product photography for your business? Here's another shot from Ellahi Ltd http://t.co/k5d2rbuT3L
79,588803809549365248,Thu Apr 16 20:39:02 +0000 2015,0,0,Ellahi Ltd has some really cool stuff! http://t.co/buZH1kL6ZR
80,588441457113038848,Wed Apr 15 20:39:10 +0000 2015,0,0,Another shot from our product shoot with Ellahi Ltd. http://t.co/QsFWTHsEnX
81,588079029363863552,Tue Apr 14 20:39:01 +0000 2015,0,0,We did a product shoot for Ellahi Ltd. Check out some of their cool gear! http://t.co/omQ3Dm1wQS
82,584455155988430848,Sat Apr 04 20:39:02 +0000 2015,0,0,The 3rd and final logo for CMF Urgent Care &amp; Family Practice. http://t.co/fqXdXCoVsg
83,584092831582658561,Fri Apr 03 20:39:17 +0000 2015,0,0,The 2nd logo we created for CMF Urgent Care &amp; Family Practice. Like what you see? http://t.co/57nkFhw391
84,583730386406084608,Thu Apr 02 20:39:03 +0000 2015,0,0,We gave our client CMF Urgent Care &amp; Family Practice a choice of 3 logos. Which do you like most? Here's the 1st one. http://t.co/0JwnEzc1cj
85,583368007788994561,Wed Apr 01 20:39:06 +0000 2015,0,0,"We've got another series of logos for you to check out! First, the original from CMF Urgent Care &amp; Family Practice. http://t.co/jMYEbotbES"
86,583005637501669376,Tue Mar 31 20:39:10 +0000 2015,0,0,We also do closeups. #impactcanopy http://t.co/EWXf7GxYzD
87,582643236763746304,Mon Mar 30 20:39:07 +0000 2015,0,1,Here's another product placement shot we did for Impact Canopy. http://t.co/EW0G3VqQ6T
88,582280852098420736,Sun Mar 29 20:39:08 +0000 2015,0,0,Let's get started with your brand new life today! #Amniamedia is here to support you whether it's a brand refresh or a brand creation.
89,581918435665440768,Sat Mar 28 20:39:01 +0000 2015,0,0,Playing with colors and design is all part of the fun! #logodesign http://t.co/sRYsyW7CId
90,581556078187548672,Fri Mar 27 20:39:08 +0000 2015,0,0,"We take your concept, and play around with it. Exploring different looks. http://t.co/RCwdtgc4g2"
91,581193683283914753,Thu Mar 26 20:39:06 +0000 2015,1,0,"How does a logo go from start to finish? First, our client gives us a rough idea of what they have in mind. http://t.co/52iRA4pFGu"
92,580831281652588544,Wed Mar 25 20:39:03 +0000 2015,0,2,Need a logo redesign? We created these for Free Sparring Finder. Which one do you prefer? http://t.co/I5F3zsRcem
93,580520347734315010,Wed Mar 25 00:03:31 +0000 2015,0,1,"Need product placement photos? Yeah, we do that. Here's a sample of our work for Impact Canopy. http://t.co/38OM52cJn0"
94,573209811061510145,Wed Mar 04 19:54:03 +0000 2015,1,1,We’ll develop a style guide to be used in print and online. Don’t spend countless hours with the nitty-gritty. How can we help you grow?
95,572846673904455680,Tue Mar 03 19:51:04 +0000 2015,0,1,"Ultimately, the folks over at SmartThingKing decided on this one. http://t.co/b8kXUMje1x"
96,572480753289854976,Mon Mar 02 19:37:02 +0000 2015,0,1,"At Amniamedia, we give our clients a variety of options to choose from. http://t.co/ic6nDAmYGr"
97,572121628139753473,Sun Mar 01 19:50:00 +0000 2015,0,0,Here's a sample of our work. http://t.co/pdNytO7IOA
98,571758756599599104,Sat Feb 28 19:48:04 +0000 2015,1,2,"Your brand is everything. Whether you’re just starting out or need a brand refresh, our team can create a logo that represents you."
99,571395622818988032,Fri Feb 27 19:45:07 +0000 2015,0,0,"We’re passionate about our clients, offering an array of services to fit today’s modern business environment. See how we can help you grow."
100,571033730359414784,Thu Feb 26 19:47:05 +0000 2015,0,0,"""If you have good thoughts they will shine out of your face like sunbeams and you will always look lovely."" - Roald Dahl"
101,571032704038400000,Thu Feb 26 19:43:00 +0000 2015,0,0,"At Amniamedia, your business is our business! Business leaders come to us when they demand results."
102,570712894121254912,Wed Feb 25 22:32:11 +0000 2015,1,0,RT @joolie9421: The American Internet Landscape: The Top Cities for Wifi http://t.co/ggc9r4bcG3 http://t.co/2ZwiV6n2b8
103,570670067693817856,Wed Feb 25 19:42:01 +0000 2015,0,0,Did we mention we also create logos for your business? http://t.co/o3kyFOeOK1 is wearing our creation!
104,570322295245418497,Tue Feb 24 20:40:05 +0000 2015,0,1,Check out http://t.co/o3kyFOeOK1  - we completely revamped their website and implemented our marketing strategy.
105,569965006168727552,Mon Feb 23 21:00:21 +0000 2015,0,0,Amniamedia is your one-stop solution for your management consulting needs. Check out our new website for more info: http://t.co/eqSQbAIy4M
