,id_str,created_at,retweet_count,favorite_count,text
0,668904367093862400,Mon Nov 23 21:30:03 +0000 2015,0,0,"(11/23) In 1644, John Milton publishes Areopagitica, a pamphlet decrying censorship. #todayinhistory https://t.co/9JiqB80LbS"
1,668527028363227137,Sun Nov 22 20:30:38 +0000 2015,0,0,"(11/22) In 1975, Juan Carlos is declared King of Spain following the death of Francisco Franco. #todayinhistory https://t.co/jJRHMm7Mqn"
2,668149423453642752,Sat Nov 21 19:30:10 +0000 2015,0,0,"(11/21) In 1877, Thomas Edison announces his invention of the phonograph. #todayinhistory https://t.co/oGeKfNJOUg"
3,667817336112459776,Fri Nov 20 21:30:35 +0000 2015,0,0,"(11/20) In 1985, Microsoft Windows 1.0 is released. #todayinhistory https://t.co/25FdXVSUuh"
4,667439743349714945,Thu Nov 19 20:30:09 +0000 2015,0,0,"(11/19) In 1816, Warsaw University is established in Poland. #todayinhistory https://t.co/ZhKvL84A1w"
5,667062271814860800,Wed Nov 18 19:30:13 +0000 2015,0,0,"(11/18) In 1493, Christopher Columbus first sights the island now known as Puerto Rico. #todayinhistory https://t.co/JasxNFE8pk"
6,666695561198874628,Tue Nov 17 19:13:03 +0000 2015,0,0,"(11/17) In 1800, the United States Congress holds its first session in Washington, D.C. #todayinhistory https://t.co/ltSqSn2yxf"
7,666363365187584001,Mon Nov 16 21:13:01 +0000 2015,3,0,"(11/16) In 1914, the Federal Reserve Bank of the United States officially opens. #todayinhistory https://t.co/kHAdOqtcJP"
8,665985889290625024,Sun Nov 15 20:13:04 +0000 2015,1,1,"(11/15) In 1955, the first part of Saint Petersburg Metro is opened. #todayinhistory #russia #stpetersburg https://t.co/QUr3UtWXZF"
9,665622766561964032,Sat Nov 14 20:10:08 +0000 2015,1,0,"(11/14) In 1916, the Battle of the Somme ends during WW1. #todayinhistory https://t.co/EFM0WSclfy"
10,665247810774827008,Fri Nov 13 19:20:12 +0000 2015,0,0,"(11/13) In 1916, Prime Minister of Australia Billy Hughes is expelled from the Labor Party. #todayinhistory https://t.co/oGILyhn4zD"
11,664900513553588224,Thu Nov 12 20:20:10 +0000 2015,0,0,"(11/12) In 1905, Norway holds a referendum in favor of monarchy over republic. #todayinhistory https://t.co/pB3DcDUASj"
12,664523087057154048,Wed Nov 11 19:20:24 +0000 2015,0,0,"(11/11) In 1831, in Jerusalem, Virginia, Nat Turner is hanged after inciting a slave uprising. #todayinhistory https://t.co/NMjLgRzmDi"
13,664198153739046913,Tue Nov 10 21:49:14 +0000 2015,0,0,"(11/10) In 1871, Henry Morton Stanley locates missing missionary, Dr. David Livingstone in Ujiji. #todayinhistory https://t.co/kO7nKRc5Wn"
14,663805532428492800,Mon Nov 09 19:49:06 +0000 2015,0,1,"(11/9) In 1857, the Atlantic, a literary and cultural magazine, is founded in Boston, Massachusetts. #todayinhistory https://t.co/cRfxfpnBnu"
15,663458269470564352,Sun Nov 08 20:49:12 +0000 2015,0,0,"(11/8) In 1519, Hernán Cortés enters Tenochtitlán and Aztec ruler Moctezuma welcomes him. #todayinhistory https://t.co/7P3RmnbmT2"
16,663051356278808576,Sat Nov 07 17:52:16 +0000 2015,0,0,"(11/7) In 680 CE, the Sixth Ecumenical Council commences in Constantinople. #todayinhistory https://t.co/Eku6MjDP92"
17,662688902826823681,Fri Nov 06 17:52:01 +0000 2015,0,0,"(11/6) In 1844, the first constitution of the Dominican Republic is adopted. #todayinhistory https://t.co/bh9NilmNIk"
18,662311474212315136,Thu Nov 05 16:52:15 +0000 2015,0,0,"(11/5) In 1895, George B. Selden is granted the first U.S. patent for an automobile. #todayinhistory https://t.co/w4kUKQFUsK"
19,661964130090426368,Wed Nov 04 17:52:01 +0000 2015,0,0,"(11/4) In 2008, Barack Obama becomes the first person of African-American descent to be President. #todayinhistory https://t.co/NnvBtyPpYC"
20,661571545119203328,Tue Nov 03 15:52:02 +0000 2015,0,0,"(11/3) In 1783, John Austin is the last person to be publicly hanged at London's Tyburn gallows. #todayinhistory https://t.co/qlfBMYTE2V"
21,661239420180422656,Mon Nov 02 17:52:17 +0000 2015,0,0,"(11/2) In 1795, the French Directory, a five-man revolutionary government, is created. #todayinhistory https://t.co/2ER1CjQq1p"
22,660861883340169216,Sun Nov 01 16:52:05 +0000 2015,0,0,"(11/1) In 1179, Philip II is crowned King of France. #todayinhistory https://t.co/U1vY2XsaDN"
23,660544844394315776,Sat Oct 31 19:52:17 +0000 2015,0,0,"(10/31) In 2011, the global population of humans reaches seven billion. #todayinhistory https://t.co/zhAyBjugEf"
24,660167289568935936,Fri Oct 30 18:52:01 +0000 2015,0,0,"(10/30) In 1905, Czar Nicholas grants Russia's first constitution, creating a legislative assembly. #todayinhistory https://t.co/617NuUID9A"
25,659835122892558337,Thu Oct 29 20:52:07 +0000 2015,0,0,"(10/29) In 1787, Mozart's opera Don Giovanni receives its first performance in Prague. #todayinhistory https://t.co/0wIFlRhvzI"
26,659449573581180928,Wed Oct 28 19:20:04 +0000 2015,0,0,"(10/28) In 1449, Christian I is crowned king of Denmark. #todayinhistory https://t.co/lqpTEfq7Fw"
27,659072077983563776,Tue Oct 27 18:20:03 +0000 2015,0,0,"(10/27) In 1682, Philadelphia, Pennsylvania is founded. #todayinhistory https://t.co/VhTGPLflUL"
28,658746708063559680,Mon Oct 26 20:47:08 +0000 2015,0,0,"(10/26) In 1936, the first electric generator at Hoover Dam goes into full operation. #todayinhistory https://t.co/Q9og3oBLCE"
29,658369204614221824,Sun Oct 25 19:47:04 +0000 2015,0,1,"(10/25) In 1861, the Toronto Stock Exchange is created. #todayinhistory https://t.co/OhsaB5243G"
30,657991759012757504,Sat Oct 24 18:47:14 +0000 2015,0,0,"(10/24) In 1648, the Peace of Westphalia is signed, marking the end of the Thirty Years' War. #todayinhistory https://t.co/5RDW9zmigS"
31,657619102824050688,Fri Oct 23 18:06:26 +0000 2015,0,0,"(10/23) In 1642, the Battle of Edgehill, a major battle of the English Civil War, takes place. #todayinhistory https://t.co/YsKnkuZlIb"
32,657271715962163201,Thu Oct 22 19:06:03 +0000 2015,0,0,"(10/22) In 1877, the Blantyre mining disaster in Scotland kills 207 miners. #todayinhistory https://t.co/cW0eILSVPk"
33,656909376020725761,Wed Oct 21 19:06:14 +0000 2015,0,0,"(10/21) In 1209, Otto IV is crowned emperor of the Holy Roman Empire by Pope Innocent III. #todayinhistory https://t.co/JRadmBsYpi"
34,656531863109021696,Tue Oct 20 18:06:08 +0000 2015,0,0,"(10/20) In 1873, Yale, Princeton, Columbia, and Rutgers draft the code of American football rules. #todayinhistory https://t.co/veGIwxd7K7"
35,656199683153506304,Mon Oct 19 20:06:10 +0000 2015,0,1,"(10/19) In 1912, Italy takes possession of Tripoli, Libya from the Ottoman Empire. #todayinhistory https://t.co/XJfrb3kifa"
36,655822169516167168,Sun Oct 18 19:06:04 +0000 2015,0,0,"(10/18) In 1016, the Danes defeat the Saxons in the Battle of Assandun. #todayinhistory http://t.co/pz6avLNwGF"
37,655444679853481984,Sat Oct 17 18:06:03 +0000 2015,1,0,"(10/17) In 1662, Charles II of England sells Dunkirk to France for 40,000 pounds. #todayinhistory http://t.co/BK3hrswRBa"
38,655091885996974080,Fri Oct 16 18:44:11 +0000 2015,0,1,"(10/16) In 1905, the Partition of Bengal in India takes place. #todayinhistory http://t.co/UsV00Zko1z"
39,654729472998961154,Thu Oct 15 18:44:05 +0000 2015,0,0,"(10/15) In 1888, the ""From Hell"" letter sent by Jack the Ripper is received by investigators. #todayinhistory http://t.co/XxBhMpxQMe"
40,654397317416660994,Wed Oct 14 20:44:13 +0000 2015,0,0,"(10/14) In 1840, the Maronite leader Bashir II surrenders to the British Army, and sent into exile. #todayinhistory http://t.co/ZrvGsrq4EF"
41,654019879176175620,Tue Oct 13 19:44:24 +0000 2015,0,0,"(10/13) In 1773, the Whirlpool Galaxy is discovered by Charles Messier. #todayinhistory http://t.co/GTBxivMFAa"
42,653642291719106560,Mon Oct 12 18:44:01 +0000 2015,0,0,"(10/12) In 1492, Christopher Columbus's expedition makes landfall in the Caribbean.  #todayinhistory http://t.co/TMYpHm6uxW"
43,653322460998311936,Sun Oct 11 21:33:07 +0000 2015,0,0,"(10/11) In 1929, J. C. Penney becomes a nationwide company with stores in all 48 U.S. states. #todayinhistory http://t.co/XRA6pXk7UO"
44,652914524002086912,Sat Oct 10 18:32:07 +0000 2015,0,0,"(10/10) In 1973, US Vice President Spiro Agnew resigns after being charged with evasion of taxes. #todayinhistory http://t.co/lm3NusgG5X"
45,652582062109671424,Fri Oct 09 20:31:02 +0000 2015,0,0,"(10/9) In 1771, the Dutch merchant ship Vrouw Maria sinks near the coast of Finland. #todayinhistory http://t.co/DIeg2pzWag"
46,652204581594791940,Thu Oct 08 19:31:04 +0000 2015,0,0,"(10/8) In 1856, the Second Opium War begins with the Arrow Incident on the Pearl River. #todayinhistory http://t.co/Plu2Me8QUe"
47,651872176673542144,Wed Oct 07 21:30:12 +0000 2015,0,0,"(10/7) In 1691, the English royal charter for the Province of Massachusetts Bay is issued. #todayinhistory http://t.co/NGjL3gnpHR"
48,651494414750228480,Tue Oct 06 20:29:07 +0000 2015,0,0,"(10/6) In 1876, the American Library Association was founded. #todayinhistory http://t.co/x9dqrBfF0V"
49,651116947321393152,Mon Oct 05 19:29:12 +0000 2015,0,0,"(10/5) In 456 CE, Visigoths under king Theodoric II, acting on orders of the Avitus, invade Iberia. #todayinhistory http://t.co/CZHdYiDCK0"
50,650769462359035904,Sun Oct 04 20:28:25 +0000 2015,1,0,"(10/4) In 1876, Texas A&amp;M University opens as the Agricultural and Mechanical College of Texas. #todayinhistory http://t.co/6AVflJmTPa"
51,650406781382955008,Sat Oct 03 20:27:15 +0000 2015,0,0,"(10/3) In 1778, Captain James Cook lands in Alaska. #todayinhistory http://t.co/3Pfe099SkW"
52,650013650800013317,Fri Oct 02 18:25:05 +0000 2015,0,0,"(10/2) In 1950, ""Peanuts"" by Charles M. Schulz is first published. #todayinhistory http://t.co/FMoIDZrHXK"
53,649695821353644033,Thu Oct 01 21:22:09 +0000 2015,0,0,"(10/1) In 1847, German inventor Werner von Siemens founds Siemens AG &amp; Halske. #todayinhistory https://t.co/QaPl6m5tS0"
54,649304264657997824,Wed Sep 30 19:26:14 +0000 2015,0,0,"(9/30) In 1947, the World Series (NY Yankess vs Brooklyn Dodgers) is televised for the first time. #todayinhistory http://t.co/eol198Whkn"
55,649064052744957952,Wed Sep 30 03:31:43 +0000 2015,0,0,"New post: Mark Michael Astarita elaborates on the artistic influence of the ""The Holy Trinity"":
http://t.co/i2LYuyrIib"
56,648926727801073665,Tue Sep 29 18:26:03 +0000 2015,0,0,"(9/29) In 1829, the Metropolitan Police of London, later also known as the Met, is founded. #todayinhistory http://t.co/NHlvsXHy6P"
57,648577187923234816,Mon Sep 28 19:17:06 +0000 2015,0,0,"(9/28) In 1066, William the Conqueror invades England beginning the Norman conquest of England. #todayinhistory http://t.co/InUPYuwUel"
58,648244989101776897,Sun Sep 27 21:17:03 +0000 2015,0,0,"(9/27) In 1529, the Siege of Vienna begins when Suleiman I attacks the city. #todayinhistory http://t.co/3azAdfxR8X"
59,647837303885443072,Sat Sep 26 18:17:04 +0000 2015,0,0,"(9/26) In 1914, the United States Federal Trade Commission (FTC) is established by the eponymous act. #todayinhistory http://t.co/syRDikCoP4"
60,647490072829370368,Fri Sep 25 19:17:17 +0000 2015,0,0,"(9/25) In 1911, ground is broken for Fenway Park in Boston. #todayinhistory http://t.co/IZtYJBIK8e"
61,647144481100333056,Thu Sep 24 20:24:02 +0000 2015,0,0,"(9/24) In 1890, the Church of Jesus Christ of Latter-day Saints officially renounces polygamy. #todayinhistory http://t.co/q6FPq0DQZ1"
62,646751894061367296,Wed Sep 23 18:24:02 +0000 2015,0,0,"(9/23) In 1889, Nintendo Koppai (Later Nintendo Company) is founded by Fusajiro Yamauchi. #todayinhistory http://t.co/NZYnXErC7r"
63,646416951603003392,Tue Sep 22 20:13:05 +0000 2015,0,0,"(9/22) In 1957, François Duvalier is elected president of Haiti. #todayinhistory http://t.co/qDvmSXaF3u"
64,646038209705676800,Mon Sep 21 19:08:06 +0000 2015,0,1,"(9/21) In 1792, the National Convention declares France a republic and abolishes absolute monarchy. #todayinhistory http://t.co/bJz1WJ10dv"
65,645660770072702977,Sun Sep 20 18:08:18 +0000 2015,0,0,"(9/20) In 1977, the Socialist Republic of Vietnam is admitted to the United Nations. #todayinhistory http://t.co/GW5A6yFmKt"
66,645304363397857280,Sat Sep 19 18:32:04 +0000 2015,1,0,"(9/19) In 1959, USSR Secretary General Nikita Khrushchev is barred from visiting Disneyland. #todayinhistory http://t.co/GPofzGbWtB"
67,644957061546147840,Fri Sep 18 19:32:00 +0000 2015,0,0,"(9/18) In 1850, the U.S. Congress passes the Fugitive Slave Act of 1850. #todayinhistory http://t.co/gUN3ybXm5E"
68,644579631182553088,Thu Sep 17 18:32:14 +0000 2015,0,1,"(9/17) In 1630, the city of Boston, Massachusetts is founded. #todayinhistory http://t.co/51SuZz30Or"
69,644230824645292032,Wed Sep 16 19:26:12 +0000 2015,0,0,"(9/16) In 1959, the first successful photocopier, the Xerox 914, is introduced on live television . #todayinhistory http://t.co/zsLzY3TXiS"
70,643898588184117248,Tue Sep 15 21:26:01 +0000 2015,0,0,"(9/15) In 2008, Lehman Brothers files for Chapter 11 bankruptcy, the largest filing in U.S. history. #todayinhistory http://t.co/Ebg99ZPSCe"
71,643506010011889664,Mon Sep 14 19:26:03 +0000 2015,0,1,"(9/14) In 1741, George Frideric Handel completes his oratorio ""Messiah."" #todayinhistory http://t.co/sImy6qWacv"
72,643128543665328128,Sun Sep 13 18:26:08 +0000 2015,0,0,"(9/13) In 1541, John Calvin returns from exile to reform the church under the doctrine, Calvinism.
 #todayinhistory"" http://t.co/SzxIyExJxm"
73,642801165391020032,Sat Sep 12 20:45:15 +0000 2015,0,0,"(9/12) In 1185, Emperor Andronikos I Komnenos is brutally put to death in Constantinople. #todayinhistory http://t.co/YyRSqGjYUj"
74,642423644950528000,Fri Sep 11 19:45:07 +0000 2015,0,0,"(9/11) In 1988, the St. Jean Bosco massacre takes place in Port-au-Prince, Haiti. #todayinhistory http://t.co/0Pk6WuCcJj"
75,642091490274099200,Thu Sep 10 21:45:15 +0000 2015,0,0,"(9/10) In 2002, Switzerland, traditionally a neutral country, joins the United Nations. #todayinhistory http://t.co/AGIwf8zXyC"
76,641834860399734784,Thu Sep 10 04:45:30 +0000 2015,0,0,"(9/9) In 1791, Washington, D.C., the capital of the US, is named after President George Washington. #todayinhistory http://t.co/NJzfTLTl7s"
77,641321430555209728,Tue Sep 08 18:45:18 +0000 2015,0,0,"(9/8) In 1862, the Millennium of Russia monument unveiled in Novgorod. #todayinhistory http://t.co/jPd0CpxOcC"
78,640989204051292161,Mon Sep 07 20:45:09 +0000 2015,2,0,"(9/7) In 70 CE, a Roman army under Titus occupies and plunders Jerusalem. #todayinhistory http://t.co/GBXanCiYFq"
79,640611728972251136,Sun Sep 06 19:45:12 +0000 2015,0,0,"(9/6) In 1968, Swaziland declares its independence following its status as a Protected State. #todayinhistory http://t.co/A36msf3SmO"
80,640241002830299137,Sat Sep 05 19:12:04 +0000 2015,0,0,"(9/5) In 1882, the first United States Labor Day parade is held in New York City. #todayinhistory http://t.co/QpANqV9RSz"
81,639893715520225281,Fri Sep 04 20:12:05 +0000 2015,0,0,"(9/4) In 1774, New Caledonia is first sighted by Europeans, during the second voyage of Captain Cook. #todayinhistory http://t.co/JdJPUTP84J"
82,639500862461767681,Thu Sep 03 18:11:01 +0000 2015,0,0,"(9/3) In 1260, the Mamluks defeat the Mongols at the Battle of Ain Jalut in present-day Palestine. #todayinhistory http://t.co/4y09BYvl2i"
83,639153609649864704,Wed Sep 02 19:11:10 +0000 2015,0,0,"(9/2) In 44 BCE, Cicero launches the first of his Philippics (oratorical attacks) on Mark Antony. #todayinhistory http://t.co/rlMCYu8SDZ"
84,638715466958155777,Tue Sep 01 14:10:08 +0000 2015,0,0,"(9/1) In 1449, the Tumu Crisis occurs, where the Mongols capture the Emperor of China. #todayinhistory http://t.co/N5amU3VfYb"
85,638376453046960128,Mon Aug 31 15:43:01 +0000 2015,0,0,"(8/31) In 1945, the Liberal Party of Australia is founded by Robert Menzies. #todayinhistory http://t.co/yVAZC8v0bc"
86,638014113197785089,Sun Aug 30 15:43:12 +0000 2015,0,0,"(8/30) In 1967, Thurgood Marshall is sworn in as the first African American Justice of the Supreme Court. http://t.co/PKklWljAmM"
87,637666538464669696,Sat Aug 29 16:42:04 +0000 2015,0,0,"(8/29) In 1825, the Kingdom of Portugal recognizes the Independence of Brazil. #todayinhistory http://t.co/jazehrGAKb"
88,637334082737848321,Fri Aug 28 18:41:01 +0000 2015,0,0,"(8/28) In 1953, Nippon Television broadcasts Japan's first television show. #todayinhistory http://t.co/ndDdJJ74g7"
89,636941521200279552,Thu Aug 27 16:41:07 +0000 2015,0,0,"(8/27) In 1991, the European Community recognizes the independence of the Baltic states. #todayinhistory http://t.co/goQivzn55q"
90,636564120184209408,Wed Aug 26 15:41:27 +0000 2015,0,0,"(8/26) In 1920, the 19th amendment takes effect, giving women the right to vote. #todayinhistory http://t.co/6X0uBE7QPr"
91,636518287162109952,Wed Aug 26 12:39:20 +0000 2015,8,22,"New Post: @Dmrtt13 expounds upon the rise of Evangelism, and the implications for the Conservative party today. http://t.co/I5AMxnXvk0"
92,636202886930800640,Tue Aug 25 15:46:02 +0000 2015,0,1,"(8/25) In 1944, Paris is liberated by the Allies. #todayinhistory http://t.co/CNWMNLhxv3"
93,635931132245213185,Mon Aug 24 21:46:11 +0000 2015,1,1,"(8/24) In 410 CE, the Visigoths under king Alaric I begin to pillage Rome. #todayinhistory http://t.co/u0j45SS6d2"
94,635523460333207552,Sun Aug 23 18:46:15 +0000 2015,0,0,"(8/23) In 1927, Italian Anarchists Sacco and Vanzetti are executed after a lengthy trial. #todayinhistory http://t.co/5aG9DcQd8S"
95,635161058366345216,Sat Aug 22 18:46:11 +0000 2015,0,1,"(8/22) In 1952, the penal colony on Devil's Island is permanently closed. #todayinhistory http://t.co/HHaG0QNuQc"
96,634813491044552704,Fri Aug 21 19:45:05 +0000 2015,0,0,"(8/21) In 1888, the first successful adding machine is patented by William Seward Burroughs. #todayinhistory http://t.co/0cZBAnlMKb"
97,634436092134060033,Thu Aug 20 18:45:26 +0000 2015,0,0,"(8/20) In 1882, Tchaikovsky's ""1812 Overture"" debuts in Moscow, Russia. #todayinhistory http://t.co/Z83vkb5l1g"
98,634067113943126016,Wed Aug 19 18:19:15 +0000 2015,0,0,"(8/19) In 1964, Syncom 3, the first geostationary communication satellite, was launched. #todayinhistory http://t.co/6cmTaRbCoy"
99,633719852478398464,Tue Aug 18 19:19:21 +0000 2015,0,0,"(8/18) In 1958, Vladimir Nabokov's controversial novel ""Lolita"" is published in the United States. #todayinhistory http://t.co/FhPrvvpsCS"
100,633357492710457344,Mon Aug 17 19:19:28 +0000 2015,0,0,"(8/17) In 1560, Protestantism is established as the national religion in Scotland. #todayinhistory http://t.co/i9jATvFsdg"
101,632979908906590208,Sun Aug 16 18:19:05 +0000 2015,0,1,"(8/16) In 1954, the first issue of Sports Illustrated is published. #todayinhistory http://t.co/0ihb5svdtq"
102,632612889254301696,Sat Aug 15 18:00:40 +0000 2015,1,1,"(8/15) In 1281, Kublai Khan of the Mongols was destroyed by a ""divine wind"" for the second time. #todayinhistory http://t.co/KmrahBZfV0"
103,632271474473222144,Fri Aug 14 19:24:01 +0000 2015,0,0,"(8/14) In 1935, Franklin D. Roosevelt signs the Social Security Act, creating a retirement system. #todayinhistory http://t.co/PoTVUeth6l"
104,631917187800940544,Thu Aug 13 19:56:12 +0000 2015,0,0,"(8/13) In 1899, English-American director and producer Alfred Hitchcock is born. #todayinhistory http://t.co/8nrdjk38nc"
105,631554793916493824,Wed Aug 12 19:56:11 +0000 2015,0,0,"(8/12) In 1851, Isaac Singer is granted a patent for his sewing machine. #todayinhistory http://t.co/UoIRlIt32W"
106,631177282577657856,Tue Aug 11 18:56:05 +0000 2015,0,1,"(8/11) In 1919, the constitution of the Weimar Republic is adopted. #todayinhistory http://t.co/PgTei1aYPg"
107,630860248602017792,Mon Aug 10 21:56:18 +0000 2015,0,0,"(8/10) In 2003, Yuri Malenchenko becomes the first person to marry in space. #todayinhistory http://t.co/RwmiCHCKgE"
108,630452496062918656,Sun Aug 09 18:56:02 +0000 2015,0,0,"(8/9) In 1854, American philosopher Henry David Thoreau publishes ""Walden"". #todayinhistory http://t.co/oFlTxWcWcU"
109,630105236087115777,Sat Aug 08 19:56:09 +0000 2015,0,0,"(8/8) In 1967, the Association of Southeast Asian Nations (ASEAN) is founded. #todayinhistory http://t.co/pQi3C68enD"
110,629716409170415616,Fri Aug 07 18:11:06 +0000 2015,0,0,"(8/7) In 1960, Côte d'Ivoire becomes independent from France. #todayinhistory http://t.co/FYkWPwRVJg"
111,629354026044399616,Thu Aug 06 18:11:07 +0000 2015,0,0,"(8/6) In 1988, the Tompkins Square Park Riot in New York City spurs a call for reform of the NYPD. #todayinhistory http://t.co/wN4l6sv5bZ"
112,629021855496728577,Wed Aug 05 20:11:11 +0000 2015,0,0,"(8/5) In 1620, the Mayflower departs from Southampton on its first attempt to reach North America. #todayinhistory http://t.co/77tqu2PWLK"
113,628659427646808065,Tue Aug 04 20:11:02 +0000 2015,0,0,"(8/4) In 1902, the Greenwich foot tunnel under the River Thames opens. #todayinhistory http://t.co/kiyodoEzzO"
114,628281941645750272,Mon Aug 03 19:11:02 +0000 2015,0,0,"(8/3) In 1860, the Second Maori War begins between the New Zealand government and indigenous Māori. #todayinhistory http://t.co/JwOIagkHWV"
115,627964878708449280,Sun Aug 02 22:11:08 +0000 2015,0,0,"(8/2) In 1790, the first United States Census is conducted. #todayinhistory http://t.co/51JMLaY6nJ"
116,627575323266314244,Sat Aug 01 20:23:11 +0000 2015,0,0,"(8/1) In 527, Justinian I becomes the sole ruler of the Byzantine Empire. #todayinhistory http://t.co/WagAOHaDGC"
117,627182695509041152,Fri Jul 31 18:23:01 +0000 2015,0,2,"(7/31) In 2012, Michael Phelps breaks the record for the most medals won at the Olympics. #todayinhistory http://t.co/YbZKk7KY74"
118,626880768460091392,Thu Jul 30 22:23:16 +0000 2015,0,0,"(7/30) In 762, Baghdad is founded by caliph Al-Mansur and under the supervision of the Barmakids. #todayinhistory http://t.co/tBbhZyDFN1"
119,626457960340934656,Wed Jul 29 18:23:11 +0000 2015,2,0,"(7/29) In 1921, Adolf Hitler becomes leader of the National Socialist German Workers Party. #todayinhistory http://t.co/P9WJso0yF9"
120,626140828625432576,Tue Jul 28 21:23:01 +0000 2015,0,0,"(7/28) In 1943, Italian Facist dictator Benito Mussolini resigns. #todayinhistory http://t.co/HBeIELZkiX"
121,625748255054413825,Mon Jul 27 19:23:04 +0000 2015,0,0,"(7/27) In 1890, Vincent van Gogh shoots himself and dies two days later. #todayinhistory http://t.co/iHHeNSDIob"
122,625675686825566208,Mon Jul 27 14:34:42 +0000 2015,0,0,@RetrospectHCA Submit your work in our first article exchange!: https://t.co/O5CI5XY8EL
123,625370780247961600,Sun Jul 26 18:23:07 +0000 2015,0,1,"(7/26) In 1887, the Unua Libro is published, marking the beginning of the Esperanto movement. #todayinhistory http://t.co/25MLbD07Dd"
124,625038575529291781,Sat Jul 25 20:23:03 +0000 2015,0,0,"(7/25) In 2007, Pratibha Patil is sworn in as India's first female president. #todayinhistory http://t.co/PotL3zRmzu"
125,624645977593499648,Fri Jul 24 18:23:01 +0000 2015,0,0,"(7/24) In 1866, Tennessee was the first state to be readmitted to the Union following the Civil War. #todayinhistory http://t.co/VNodnOcPFA"
126,624344039467393028,Thu Jul 23 22:23:13 +0000 2015,0,0,"(7/23) In 1952, the European Coal and Steel Community, the predecessor to the EU, is established. #todayinhistory http://t.co/LbOIfr6iLj"
127,624042428241199104,Thu Jul 23 02:24:43 +0000 2015,0,0,We encourage everyone to check out and maybe even submit a piece to @RetrospectHCA today! https://t.co/eYdrroYjly
128,623936318079377408,Wed Jul 22 19:23:05 +0000 2015,0,0,"(7/22) In 1942, the systematic deportation of Jews from the Warsaw Ghetto begins. #todayinhistory http://t.co/5td6YgWD1N"
129,623604169153359872,Tue Jul 21 21:23:14 +0000 2015,0,0,"(7/21) In 356 BCE, the Temple of Artemis, one of the Seven Wonders of the World, is destroyed. #todayinhistory http://t.co/EouMQhpCE1"
130,623196458347593728,Mon Jul 20 18:23:08 +0000 2015,0,0,"(7/20) In 70, the Siege of Jerusalem occurs, where Titus' armies storm the Fortress of Antonia. #todayinhistory http://t.co/vyyw8inoZr"
131,622879619834867712,Sun Jul 19 21:24:08 +0000 2015,0,0,"(7/19) In 1979, the Sandinista rebels overthrow the government of the Somoza family in Nicaragua. #todayinhistory http://t.co/S9JeZe6mDQ"
132,622486769540431872,Sat Jul 18 19:23:05 +0000 2015,0,1,"(7/18) In 1968, Intel is founded in Mountain View, California. #todayinhistory http://t.co/RGJGT4l5Lt"
133,622139245180899328,Fri Jul 17 20:22:09 +0000 2015,0,0,"(7/17) In 1918, Tsar Nicholas II and his family are murdered by Bolsheviks in Yekaterinburg, Russia. #todayinhistory http://t.co/fQVA3TViUf"
134,621746420740161536,Thu Jul 16 18:21:12 +0000 2015,0,0,"(7/16) In 622, the beginning of the Islamic calendar is marked. #todayinhistory http://t.co/5Ensol4JXD"
135,621398914747494400,Wed Jul 15 19:20:20 +0000 2015,0,0,"(7/15) In 1834, the Spanish Inquisition is officially disbanded after nearly 356 years. #todayinhistory http://t.co/7AHUMLyCcm"
136,620991171838517248,Tue Jul 14 16:20:07 +0000 2015,0,0,"(7/14) In 1923, the Hollywood Sign is dedicated in the hills above Los Angeles, California. #todayinhistory http://t.co/XTpGsEaPKL"
137,620696227135496192,Mon Jul 13 20:48:07 +0000 2015,0,0,"(7/13) In 1793, Jean-Paul Marat is assassinated in his bathtub during the French Revolution. #todayinhistory http://t.co/zOy4PQPV6X"
138,620348921987137539,Sun Jul 12 21:48:03 +0000 2015,0,0,"(7/12) In 1962, the Rolling Stones perform their first concert at the Marquee Club in London. #todayinhistory http://t.co/hP9ZxEEuz6"
139,619940997473173504,Sat Jul 11 18:47:06 +0000 2015,0,0,"(7/11) In 1995, the Srebrenica massacre is carried out where more than 8000 Bosniaks are killed. #todayinhistory http://t.co/c1SKB54C04"
140,619608822068445186,Fri Jul 10 20:47:09 +0000 2015,0,0,"(7/10) In 1973, John Paul Getty III, grandson of oil magnate J. Paul Getty, is kidnapped in Rome. #todayinhistory http://t.co/Cy2OCDhR2U"
141,619170666034634752,Thu Jul 09 15:46:05 +0000 2015,1,0,"(7/9) In 1816, Argentina declares independence from Spain. #todayinhistory http://t.co/veW7jtUW4L"
