,id_str,created_at,retweet_count,favorite_count,text
142,618804779486179328,Wed Jul 08 15:32:10 +0000 2015,0,0,"(7/8) In 1889, the first issue of The Wall Street Journal is published. #todayinhistory http://t.co/e8FwcRsQbw"
143,618562912202924032,Tue Jul 07 23:31:05 +0000 2015,0,0,"(7/7) In 1937, the Battle of Lugou Bridge marks the beginning of the Second Sino-Japanese War. #todayinhistory http://t.co/8iXGQTbmtz"
144,618094833211699200,Mon Jul 06 16:31:06 +0000 2015,0,0,"(7/6) In 1933, the first Major League Baseball All-Star Game is played in Chicago's Comiskey Park. #todayinhistory http://t.co/PTqqnv4neo"
145,617792589224411136,Sun Jul 05 20:30:05 +0000 2015,0,0,"(7/5) In 1996, Dolly the sheep becomes the first mammal cloned from an adult cell. #todayinhistory http://t.co/EYvkIStJLS"
146,617415141244710912,Sat Jul 04 19:30:15 +0000 2015,0,1,"(7/4) In 1914, the funeral of Archduke Franz Ferdinand and wife Sophie takes place in Vienna. #todayinhistory http://t.co/3M8z57vfPW"
147,617052446397997056,Fri Jul 03 19:29:02 +0000 2015,1,0,"(7/3) In 1035, William the Conqueror becomes the Duke of Normandy, reigning until 1087. #todayinhistory http://t.co/6cR5vIbVdL"
148,616688873331146752,Thu Jul 02 19:24:19 +0000 2015,0,0,"(7/2) In 1890, Congress passes the Sherman Anti-Trust Act to ban businesses from monopolistic status. #todayinhistory http://t.co/4IPPxmUxp9"
149,616266090495221760,Wed Jul 01 15:24:20 +0000 2015,0,0,"(7/1) In 1921, the Communist Party of China is founded. #todayinhistory http://t.co/XlnUVpNdKT"
150,615964018285637632,Tue Jun 30 19:24:00 +0000 2015,0,0,"(6/30) In 1908, the Tunguska event occurs in Siberia due to a possible burst an asteroid. #todayinhistory http://t.co/zeEbafwG2l"
151,615616490885283841,Mon Jun 29 20:23:03 +0000 2015,0,0,"(6/29) In 1613, the Globe Theatre in London, which showcased many Shakespeare plays, burns down. #todayinhistory http://t.co/SaUu7lI0hO"
152,615223678138232833,Sun Jun 28 18:22:09 +0000 2015,0,0,"(6/28) In 1919, the Treaty of Versailles is signed, ending the war between Germany and the Allies. http://t.co/Grjiy3V00o"
153,614870351168802816,Sat Jun 27 18:58:10 +0000 2015,0,1,"(6/27) In 1880, Helen Keller becomes the first deaf-blind person to earn a  bachelor of arts degree. #todayinhistory http://t.co/wQfLODWqTv"
154,614523024314920960,Fri Jun 26 19:58:00 +0000 2015,1,0,"(6/26) In 1870, the holiday of Christmas is declared a federal holiday in the United States. #todayinhistory http://t.co/jeNALKxIqH"
155,614099996993028096,Thu Jun 25 15:57:03 +0000 2015,0,1,"(6/25) In 1910, Igor Stravinsky's ballet, The Firebird, is premiered in Paris. #todayinhistory http://t.co/fdqy8MctKe"
156,613770591695413248,Wed Jun 24 18:08:07 +0000 2015,0,0,"(6/24) In 2010, Julia Gillard assumes office as the first female Prime Minister of Australia. #todayinhistory http://t.co/fYCOWMprRU"
157,613377513088225280,Tue Jun 23 16:06:09 +0000 2015,0,0,"(6/23) In 1180, the First Battle of Uji occurs, starting the Genpei War in Japan. #todayinhistory http://t.co/9F0FrtEGV2"
158,613090618047361024,Mon Jun 22 21:06:08 +0000 2015,0,0,"(6/22) In 1870, the US Congress creates the United States Department of Justice. #todayinhistory http://t.co/t4TJfHnwGg"
159,612697785155067904,Sun Jun 21 19:05:10 +0000 2015,0,0,"(6/21) In 2006, Pluto's newly discovered moons are officially named Nix and Hydra. #todayinhistory http://t.co/lTf3emiGSE"
160,612320019029073920,Sat Jun 20 18:04:03 +0000 2015,0,0,"(6/20) In 1837, Queen Victoria succeeded to the British throne where she reigned for over 60 years. #todayinhistory http://t.co/D212LJl2RH"
161,611964430956560384,Fri Jun 19 18:31:04 +0000 2015,0,0,"(6/19) In 1910, the first #Father'sDay is celebrated in Spokane, Washington. #todayinhistory http://t.co/VYzGgQuHjw"
162,611617218145746945,Thu Jun 18 19:31:22 +0000 2015,0,0,"(6/18) In 1940, the ""Finest Hour"" speech by Winston #Churchill was presented to the House of Commons. #todayinhistory http://t.co/9vHyz2sAxD"
163,611163922071179264,Wed Jun 17 13:30:08 +0000 2015,0,0,"(6/17) In 1789, the Third Estate declares itself the National Assembly, an assembly of ""the People."" #todayinhistory http://t.co/mt0mesIvKB"
164,610906707024179200,Tue Jun 16 20:28:03 +0000 2015,0,0,"(6/16) In 1903, the #Ford Motor Company is incorporated with $28,000 in cash from twelve investors. #todayinhistory http://t.co/aAw7h2YMKV"
165,610528721699794944,Mon Jun 15 19:26:04 +0000 2015,0,1,"(6/15) In 1775, George Washington is appointed commander-in-chief of the Continental Army. #America #todayinhistory http://t.co/FF8aIFnMSH"
166,610145198774046720,Sun Jun 14 18:02:05 +0000 2015,0,0,"(6/14) In 1967, the People's Republic of #China tests its first hydrogen bomb. #todayinhistory http://t.co/814CjXQcLs"
167,609797653619187712,Sat Jun 13 19:01:04 +0000 2015,0,0,"(6/13) In 1381, the Peasants' Revolt led by Wat Tyler culminated in the burning of the Savoy Palace in England. http://t.co/B5yjyzeUXP"
168,609464715039916032,Fri Jun 12 20:58:06 +0000 2015,0,0,"(6/12) In 1860, the State Bank of the Russian Empire is established. #Russia #todayinhistory http://t.co/miRV41FaPj"
169,609087215419990016,Thu Jun 11 19:58:03 +0000 2015,0,1,"(6/11) In 1509, Henry VIII of #England marries Catherine of Aragon, his first of six wives. #todayinhistory http://t.co/IieuY2Hnaz"
170,608709481657151488,Wed Jun 10 18:57:04 +0000 2015,0,1,"(6/10) In 1793, the Jardin des Plantes #museum opens in #Paris. #todayinhistory http://t.co/OdnGwlUBvo"
171,608331740269133825,Tue Jun 09 17:56:03 +0000 2015,0,1,"(6/9) In 68 AD, Roman Emperor Nero commits suicide, after quoting Homer's ""Iliad"", ending the Julio-Claudian dynasty. http://t.co/B4Wiiek7Bl"
172,608013655649751040,Mon Jun 08 20:52:06 +0000 2015,0,0,"(6/8) In 1968, Robert F. Kennedy's funeral takes place at the St. Patrick's Cathedral in New York City. http://t.co/WurL57Xtwu"
173,607666344142753792,Sun Jun 07 21:52:00 +0000 2015,0,0,"(6/7) In 1099, the Siege of Jerusalem begins as part of the First Crusade. http://t.co/j3v2duK62S"
174,607283584676843520,Sat Jun 06 20:31:04 +0000 2015,0,0,"(6/6) In 1984, Tetris, one of the best-selling video games of all time, is first released in the USSR. http://t.co/u6imJsh20X"
175,606896087782289408,Fri Jun 05 18:51:17 +0000 2015,0,0,"(6/5) In 1956, Elvis Presley introduces his new single, ""Hound Dog"", on The Milton Berle Show. http://t.co/CB8o36lN1X"
176,606533440641634305,Thu Jun 04 18:50:15 +0000 2015,0,0,"(6/4) In 1912, Massachusetts becomes the first state of the United States to set a minimum wage. http://t.co/4IWPsh8EIU"
177,606231416725204992,Wed Jun 03 22:50:07 +0000 2015,0,0,"(6/3) In 2006, the union of Serbia and Montenegro comes to an end with Montenegro's declaration of independence. http://t.co/fzwq8Q3LTi"
178,605853987825319936,Tue Jun 02 21:50:21 +0000 2015,0,0,"(6/2) In 455, the second Sack of Rome occurs where Vandals enter Rome and plunder the city for two weeks http://t.co/zaQIVLXyqc"
179,605461092647743488,Mon Jun 01 19:49:08 +0000 2015,0,0,"(6/1) In 1857, Charles Baudelaire's ""Les Fleurs du mal"" is published. http://t.co/ySMbdEwVsD"
180,605141964795838464,Sun May 31 22:41:02 +0000 2015,0,0,"(5/31) In 1279 BCE, Ramesses II ""The Great"" becomes pharaoh of Ancient Egypt. http://t.co/9GdpC7ns5m"
181,604764477989486594,Sat May 30 21:41:02 +0000 2015,0,0,(5/30) In 1635 the Peace of Prague is signed and end to the civil war aspect of the Thirty Years' War. http://t.co/KhuSzeWuEo
182,604386482179194880,Fri May 29 20:39:00 +0000 2015,0,0,"(5/29) In 1453, the Fall of Constantinople occurs when Ottoman armies capture the city, ending the Byzantine Empire. http://t.co/sdYtCUXdzh"
183,604009041665355778,Thu May 28 19:39:12 +0000 2015,0,1,"(5/28) In 1644, the Bolton Massacre occurs in England under the command of James Stanley, 7th Earl of Derby. http://t.co/6SkJwXobSb"
184,603615675316379648,Wed May 27 17:36:06 +0000 2015,0,0,"(5/27) In 1703, Tsar Peter the Great of Russia founds the city of Saint Petersburg. http://t.co/Br9Qlk65Nc"
185,603282744291000321,Tue May 26 19:33:09 +0000 2015,0,0,"(5/26) In 1896, Nicholas II becomes the last Tsar of Imperial Russia. http://t.co/6eLb6WFSvD"
186,602905224030855168,Mon May 25 18:33:01 +0000 2015,2,2,"(5/25) In 2011, Oprah Winfrey airs her last show, ending her twenty-five-year run of The Oprah Winfrey Show. http://t.co/LYmETIvzyP"
187,602587919044485121,Sun May 24 21:32:10 +0000 2015,4,1,"(5/24) In 1921, the trial of anarchists, Sacco and Vanzetti, begins after their armed robbery in Braintree, MA. http://t.co/rCcu2B5mCs"
188,602044049063829504,Sat May 23 09:31:01 +0000 2015,0,1,"(5/23) In 1995, the first version of the Java programming language is released. http://t.co/JHwKVhVXcy"
189,601832519231733762,Fri May 22 19:30:28 +0000 2015,0,0,"(5/22) In 1906, the Wright brothers are granted U.S. patent number 821,393 for their ""Flying-Machine"". http://t.co/QWZLT152hw"
190,601485208509140993,Thu May 21 20:30:23 +0000 2015,0,0,"(5/21) In 1934, Oskaloosa, Iowa, becomes the first municipality in the United States to fingerprint all its citizens. http://t.co/FQ0LPcXRor"
191,601158244233551872,Wed May 20 22:51:09 +0000 2015,0,0,"(5/20) In 1902, Cuba gains independence from the United States with Tomás Estrada Palma as the first President. http://t.co/sD9YXZzSFV"
192,600765381381337088,Tue May 19 20:50:03 +0000 2015,0,0,"(5/19) In 1963, the New York Post Sunday Magazine publishes Martin Luther King, Jr.'s Letter from Birmingham Jail. http://t.co/RY4q5kWV00"
193,600372569808752640,Mon May 18 18:49:09 +0000 2015,0,1,"(5/18) In 1756, the Seven Years' War begins when Great Britain declares war on France. http://t.co/e327YO4STQ"
194,600070573306343425,Sun May 17 22:49:08 +0000 2015,0,0,"(5/17) In 1990, the World Health Organization (WHO) eliminates homosexuality from the list of psychiatric diseases. http://t.co/4sAZ15nGfs"
195,599692808484687872,Sat May 16 21:48:01 +0000 2015,0,0,"(5/16) In 1929, the first Academy Awards are awarded in Hollywood. http://t.co/xiZafnEFDm"
196,599300250289967105,Fri May 15 19:48:08 +0000 2015,0,0,"(5/15) In 1648, the Treaty of Westphalia is signed, ending the Thirty Years' War (1618-1648). http://t.co/TT3UanxMZD"
197,598932835131650051,Thu May 14 19:28:10 +0000 2015,0,1,"(5/14) In 1607, Jamestown, Virginia is settled as an English colony. http://t.co/JmRYDloorZ"
198,598600648897232896,Wed May 13 21:28:10 +0000 2015,0,0,"(5/13) In 1846, the United States declares war on Mexico with strong support from southern Democrats in Congress. http://t.co/akTZPJVHP5"
199,598192462113480706,Tue May 12 18:26:11 +0000 2015,0,0,"(5/12) In 1821, the first major battle of the Greek War of Independence against the Turks is fought in Valtetsi. http://t.co/npFDxblxWN"
