,id_str,created_at,retweet_count,favorite_count,text
0,668354230881640448,Sun Nov 22 09:04:00 +0000 2015,405,0,"RT @FunnyWhiteGirI: Internet Bullies Laughed At Her In Her Prom Dress, But Look Who’s Laughing Now!! https://t.co/yCpb1EVqRw"
1,668354164494176256,Sun Nov 22 09:03:44 +0000 2015,447,0,RT @TheFunnyKhloe: Your finger length reveals your personality! https://t.co/Q0z9VEaOY9
2,668354098094190592,Sun Nov 22 09:03:29 +0000 2015,393,0,RT @LetsLaughAllDay: These Are The Top 10 Funniest Tweets Of The Day! https://t.co/mhLakzprfA
3,595062654508511233,Mon May 04 03:09:27 +0000 2015,10,50,searching to give a fuck like http://t.co/DVkNKmItOU
4,595062600565596160,Mon May 04 03:09:14 +0000 2015,6,29,when the teacher says you're mixtape sucks http://t.co/NjlGwzxJhl
5,595062387385896961,Mon May 04 03:08:23 +0000 2015,30,68,when the squad goes out and you have to stay home http://t.co/wMVdPDcU0q
