,id_str,created_at,retweet_count,favorite_count,text
0,668942798264147968,Tue Nov 24 00:02:46 +0000 2015,0,1,"True love is a unique blend of attraction, intimacy, commitment, and romance. It’s utterly personal and happens a little differently for..."
1,668912685967351809,Mon Nov 23 22:03:06 +0000 2015,0,0,Learn how to write a saleable book! Click here to learn about my free seminars and how you can register: https://t.co/kGidNtA7vR #Writing
2,668882737873428480,Mon Nov 23 20:04:06 +0000 2015,0,0,Here’s a challenge: Take up a new activity that involves direct contact with new people. #Leadership
3,668852524934410240,Mon Nov 23 18:04:03 +0000 2015,0,0,Really Useful Attitudes: https://t.co/RmD7ycNdL2 #Leadership #Relationships
4,668822285197975553,Mon Nov 23 16:03:53 +0000 2015,0,0,"If you are not happy with the way things are going, you are the only one with both the authority and the responsibility to change them."
5,668580182068973568,Mon Nov 23 00:01:51 +0000 2015,0,0,"When you know what you want and have done all that you can to get it, step back and allow events to unfold."
6,668550026034094080,Sun Nov 22 22:02:01 +0000 2015,0,0,Resisting temptation: https://t.co/XJODM2USMK #Leadership
7,668520016598429696,Sun Nov 22 20:02:47 +0000 2015,0,0,Research has shown that we have approximately 90 seconds to make a favorable impression when we first meet someone.
8,668489814321270784,Sun Nov 22 18:02:46 +0000 2015,0,0,The problem for many would-be writers is that they never get started on their book. Learn more in this video: https://t.co/9fG9d7VsKH
9,668459651932037120,Sun Nov 22 16:02:55 +0000 2015,0,1,"Make sure your audience, whether it’s one person or 1,000, knows why they’re listening to you. #Leadership #Sales"
10,668217812977086464,Sun Nov 22 00:01:56 +0000 2015,0,1,"Whether you’re trying to make a sale, get a date or wangle out of a traffic ticket, you need to establish rapport. #Connection"
11,668187676688916480,Sat Nov 21 22:02:11 +0000 2015,0,0,Changing minds with body language: https://t.co/bXt0gBzr0f #Leadership #Relationships
12,668157665114243072,Sat Nov 21 20:02:55 +0000 2015,0,0,The setting in which you see someone can have a significant impact both on how you perceive each other and how you choose to approach him...
13,668127481686310912,Sat Nov 21 18:02:59 +0000 2015,0,0,"My book, “How to Make Someone Fall in Love with You in 90 Minutes or Less”, will help you find love you seek: https://t.co/kcOt0i1Fyx"
14,668097320257519617,Sat Nov 21 16:03:08 +0000 2015,0,0,Likeability has something to do with how you look but a lot more to do with how you make people feel. #Connection
15,667855541738319872,Sat Nov 21 00:02:23 +0000 2015,0,0,Use your body as well as your eyes and voice to show you’re paying rapt attention. #Leadership #Sales
16,667825518176169984,Fri Nov 20 22:03:05 +0000 2015,0,0,Why William and Kate will live happily ever after: https://t.co/ajbErIxDUh #Love #Relationships
17,667795565648957440,Fri Nov 20 20:04:04 +0000 2015,0,0,"“The need for connection and community is primal, as fundamental as the need for air, water, and food.” Dean Ornish"
18,667765343239163904,Fri Nov 20 18:03:58 +0000 2015,0,0,"Check me out on the Robert Kennedy show, where I talk about how leaders can connect! Click here to listen: https://t.co/n3oYAyc2sy"
19,667735106946232320,Fri Nov 20 16:03:50 +0000 2015,0,0,Ask people questions that spark their imagination and ignite conversation. #Sales #Leadership #MLM
20,667493200039444480,Fri Nov 20 00:02:34 +0000 2015,0,0,"In my newest book, I will tell you how to write a book that actually sells! Click here to get all the info: https://t.co/gktSCyrmEQ #Books"
21,667463141266202626,Thu Nov 19 22:03:08 +0000 2015,0,1,Make sure what you wear is projecting the message you want to send. #Leadership #Sales #MLM #Business
22,667433151321481220,Thu Nov 19 20:03:58 +0000 2015,0,0,Communication is a double edged sword: https://t.co/dbqnf5a0j1 #Communication #Relationships #Leadership #Sales
23,667403021920411648,Thu Nov 19 18:04:14 +0000 2015,0,0,"If you want to motivate or convince, ground your message in pictures, physical sensation, or sound. #Leadership #Sales"
24,667372769038999553,Thu Nov 19 16:04:01 +0000 2015,0,0,“The business of business is relationships; the business of life is human connection.” Robin S. Sharma https://t.co/x38y53wyUD
25,667130771623256065,Thu Nov 19 00:02:25 +0000 2015,0,0,"According to the following article, social connection enhances your brain function. Click here for more: https://t.co/ZzR8tHlAzS"
26,667100725139349504,Wed Nov 18 22:03:01 +0000 2015,0,0,"Beliefs are really just opinions. Opinions we cling to, fight over and defend. #Beliefs #Leadership #Success"
27,667070867852128256,Wed Nov 18 20:04:23 +0000 2015,0,0,Good communication skills are essential to making positive connections! Learn more here: https://t.co/Hs4IqatFhb #Sales
28,667040578564173824,Wed Nov 18 18:04:01 +0000 2015,0,0,Research shows that the single most important attribute we all subconsciously seek in a potential mate is good health.
29,667010389008359424,Wed Nov 18 16:04:03 +0000 2015,0,0,"If your words and body language aren’t saying the same thing, people get confused and put off. #Leadership #Sales"
30,666768507711922178,Wed Nov 18 00:02:54 +0000 2015,1,0,"Social connection is such a basic feature of human experience that when we are deprived of it, we suffer. Leonard Mlodinow"
31,666738383398510592,Tue Nov 17 22:03:12 +0000 2015,0,0,Get Social: https://t.co/tmcOmbddha #Socialize #Relationships
32,666708358100090880,Tue Nov 17 20:03:54 +0000 2015,0,0,"Without the right attitude, you’re not going to get very far in attracting your matched opposite, or anyone else for that matter."
33,666678196876795905,Tue Nov 17 18:04:03 +0000 2015,0,1,How can you make more people like you? Check out “How to Make People Like You in 90 Seconds or Less” here: https://t.co/vgJi0kVvxG
34,666647932729430016,Tue Nov 17 16:03:47 +0000 2015,1,0,Your attitude is the first thing people pick up on in face-to-face communication. #Sales #Leadership
35,666406075281862656,Tue Nov 17 00:02:44 +0000 2015,0,0,An unconscious invasion of someone’s personal space can trigger a deep-seated response and cause real barriers to go up. #Leadership
36,666375998536052737,Mon Nov 16 22:03:13 +0000 2015,0,0,What would make you truly happy? How do you achieve that happiness? I will tell you in this video: https://t.co/ySGTSGxqpo
37,666346555830587392,Mon Nov 16 20:06:13 +0000 2015,0,0,People who do the same thing over and over again and expect different results are setting themselves up for disappointment.
38,666315659551367168,Mon Nov 16 18:03:27 +0000 2015,0,0,What if motivation is the opposite of inspiration? https://t.co/P2DKfdibQx #Leadership #Sales
39,666285544758972416,Mon Nov 16 16:03:47 +0000 2015,0,0,"The best way to begin to meet new people is through the people you already know —your friends, family and colleagues."
40,666043500417433601,Mon Nov 16 00:01:59 +0000 2015,0,0,“We live in a world where many of us have a lot of friends on Facebook but yet we have lost human connection.” Robin S. Sharma
41,666013334332944385,Sun Nov 15 22:02:07 +0000 2015,0,0,"Men, brood. Women, smile! https://t.co/EgbfKkTH94 #Relationships"
42,665983273676513280,Sun Nov 15 20:02:40 +0000 2015,0,0,"It’s not easy to overcome your hesitations and push yourself out into the world, but when you do, you’ll discover the rewards are great."
43,665953097362067456,Sun Nov 15 18:02:45 +0000 2015,0,0,"If you want to write a book that sells, I will teach you how! Click here for more information: https://t.co/YpyHJ3ENY8 #Writing"
44,665922908909412353,Sun Nov 15 16:02:48 +0000 2015,0,0,"Every day, wittingly or unwittingly, we make a myriad of connections with people around the world. #Connection"
45,665696206341951492,Sun Nov 15 01:01:58 +0000 2015,0,0,"Respect people’s space. Unexpected intrusions are bad for rapport, especially if they come as a surprise. #Leadership #Sales"
46,665666018023460864,Sat Nov 14 23:02:00 +0000 2015,0,0,"If you want to know how to connect with anyone and everyone, give this article a read: https://t.co/6crqIYRWGZ #Leadership"
47,665635948202491904,Sat Nov 14 21:02:31 +0000 2015,0,0,"Communication is a double-edged sword. It works best when you say what you want, not what you don’t want."
48,665605785561522176,Sat Nov 14 19:02:40 +0000 2015,0,0,Looking for a love that lasts? This book will teach you how to make someone fall in love &amp; stay in love with you: https://t.co/kcOt0i1Fyx
49,665575706995355649,Sat Nov 14 17:03:09 +0000 2015,1,0,"Great romantic relationships are based on friendship, and the bottom line in friendship is that people like people like themselves."
50,665328005561085952,Sat Nov 14 00:38:52 +0000 2015,0,1,@PamSantos78 thanks Pam
51,665318811101335552,Sat Nov 14 00:02:20 +0000 2015,0,0,The fact is that we like people who are like us. We are at ease with people who feel familiar… #Connection
52,665288715120599040,Fri Nov 13 22:02:44 +0000 2015,0,0,It only takes 90 seconds to make smart business connections! Check out my book to learn more: https://t.co/LaE2xWHKVD #Sales #Connection
53,665258672386347008,Fri Nov 13 20:03:22 +0000 2015,0,0,"You have to get yourself out there – talk to people, explore opportunities, make connections. That’s where love by design comes in."
54,665228501272936448,Fri Nov 13 18:03:28 +0000 2015,0,0,"Performance, perceptions and language: https://t.co/gSy6fM0ATU #Sales #Leadership"
55,665198278288478208,Fri Nov 13 16:03:22 +0000 2015,0,0,"In an attempt to meet the media’s ideals, we’ve been hoodwinked into wearing masks and falling for others who are also wearing masks."
56,664956383356395520,Fri Nov 13 00:02:10 +0000 2015,0,0,Eye contact is one of the most important nonverbal channels we have for communication. #Sales #Leadership
57,664926239887654912,Thu Nov 12 22:02:23 +0000 2015,0,0,“One of the clearest findings to emerge from research into happiness is that we are social.” Read more: https://t.co/ojxtnnV3eZ
58,664896202048172032,Thu Nov 12 20:03:02 +0000 2015,1,0,“Everybody laughs the same in every language because laughter is a universal connection.” Yakov Smirnoff
59,664865983937519616,Thu Nov 12 18:02:57 +0000 2015,0,0,Want to learn how you can make people like you in just 90 seconds? Check out my book by clicking here: https://t.co/vgJi0kVvxG
60,664835812035555328,Thu Nov 12 16:03:04 +0000 2015,0,0,"The first step in creating any new relationship is attraction. Without attraction, nothing happens. #Attraction"
61,664593724345851904,Thu Nov 12 00:01:06 +0000 2015,0,0,"“Eventually everything connects – people, ideas, objects. The quality of the connections is the key to quality per se.” Charles Eames"
62,664580899099529216,Wed Nov 11 23:10:08 +0000 2015,0,0,Really Useful Attitudes: https://t.co/RmD7ycNdL2 #Leadership #Relationships
63,664578626059378688,Wed Nov 11 23:01:06 +0000 2015,0,0,Become a Temporary Extrovert: https://t.co/r8YhoYTXMr #Leadership #Sales
64,664563499092299776,Wed Nov 11 22:00:59 +0000 2015,0,1,"If you just hang around wishing, waiting, and hoping for something to happen, nothing ever will. #TakeAction"
65,664548378001457152,Wed Nov 11 21:00:54 +0000 2015,0,0,"Hello, Twitter Followers! Don’t forget to visit and “like” my Facebook page! Click here to check it out, https://t.co/1VUj0TAuV9"
66,664531835410587648,Wed Nov 11 19:55:10 +0000 2015,0,0,"The cheapest, most effective way to connect with others is to look them in the eye. #Leadership #Sales"
67,662389768047763457,Thu Nov 05 22:03:21 +0000 2015,0,0,Get in the habit of noticing other people’s eyes when you first meet them.
68,662299390376325121,Thu Nov 05 16:04:14 +0000 2015,0,0,What is the meaning of communication and how can you communicate effectively? Watch here to find out: https://t.co/sJj44ir6Wz
69,662057486376148992,Thu Nov 05 00:02:59 +0000 2015,0,0,"Want to make better business connections? My book, “Convince Them in 90 Seconds or Less”, will teach you how: https://t.co/gVM4yJyRns"
70,662027458322030593,Wed Nov 04 22:03:40 +0000 2015,0,0,"When you shake hands, people make an immediate judgement about your character and level of confidence. #Sales #Leadership..."
71,661997500606382080,Wed Nov 04 20:04:38 +0000 2015,0,0,Can You Really Fall In Love In 90 Minutes Or Less? Find out by checking out this video: https://t.co/AixmElpDw9 #Love
72,661967259498381312,Wed Nov 04 18:04:28 +0000 2015,0,0,Good communication skills are essential to making positive connections! Learn more here: https://t.co/Hs4IqatFhb #Sales
73,661937012098899969,Wed Nov 04 16:04:16 +0000 2015,0,0,Encourage others to make favorable snap judgements about you. Establish a receptive mood and positive expectations. #Leadership #Sales
74,661695058467561472,Wed Nov 04 00:02:50 +0000 2015,1,0,Connect and live longer: https://t.co/VZGOzEuFzv #Leadership #Business #Sales #MLM
75,661665060025180160,Tue Nov 03 22:03:38 +0000 2015,0,0,Many of us go through life hoping that others will somehow intuit our and fulfill them without our having to articulate a thing.
76,661635004112482304,Tue Nov 03 20:04:12 +0000 2015,1,1,"When you spot an opportunity that’s too good to pass up, don’t: Just count to three, adjust your attitude, and make your approach."
77,661604845200261120,Tue Nov 03 18:04:21 +0000 2015,0,0,Your experiences become words…words become actions…actions become habits…habits become character…character becomes your destiny.
78,661574593824563200,Tue Nov 03 16:04:09 +0000 2015,0,0,What’s your “Big Idea”? https://t.co/70a5MMZB1Q #Leadership
79,661332513563009024,Tue Nov 03 00:02:12 +0000 2015,0,0,Compliments only work when they are sincere and not fabricated for the moment. #Relationships
80,661302461454512128,Mon Nov 02 22:02:47 +0000 2015,0,0,Get in the habit of noticing other people’s eyes when you first meet them.
81,661272424005181441,Mon Nov 02 20:03:26 +0000 2015,0,0,"All day long, we synchronize ourselves with those around us. We do it all the time. We thrive on it, and we can’t exist without it."
82,661242246688284672,Mon Nov 02 18:03:31 +0000 2015,0,0,Developing a knack for detecting sensory preferences means paying close attention to others – this alone makes you more people-oriented.
83,661212024307916801,Mon Nov 02 16:03:25 +0000 2015,0,0,"Before you can find true love, there are some things you should figure out. Click here to learn about them: https://t.co/f5wYEedvLR"
84,660970021217267712,Mon Nov 02 00:01:47 +0000 2015,0,0,"The more people you meet, the more chances you have of finding one who’s right for you in the long term. #Socializing"
85,660939811923091456,Sun Nov 01 22:01:45 +0000 2015,0,0,"There are three really useful attitudes that successful leaders have in common: enthusiasm, curiosity, and humility. #Leadership..."
86,660909714616795136,Sun Nov 01 20:02:09 +0000 2015,0,0,"“Rare as is true love, true friendship is rarer.” – Jean de La Fontaine https://t.co/ntzNfAy69u #Friendship #Love"
87,660879481914175490,Sun Nov 01 18:02:01 +0000 2015,0,0,100 great ways to stay single: https://t.co/dwLOYtqDIg #Relationships
88,660849289011294209,Sun Nov 01 16:02:03 +0000 2015,0,1,"When you actively make new connections you’ll live longer, be healthier, and make more money. #Relationships"
89,660599867715289089,Sat Oct 31 23:30:56 +0000 2015,0,0,"That fact is, most of us are relatively clueless about how to find love, and as a result we go about looking in a pretty haphazard way."
90,660569698317312000,Sat Oct 31 21:31:03 +0000 2015,0,1,Body Language – Reading What a Person Thinks of You: https://t.co/W7lvP2HSZk #Leadership
91,660539545277046784,Sat Oct 31 19:31:14 +0000 2015,0,0,"Like all energy systems in nature, we humans only come with 2 settings: grow or go. Live or die. Nothing in between. #Growth"
92,660509447467438080,Sat Oct 31 17:31:38 +0000 2015,0,0,"When you know what you’re looking for, you can fine-tune your self-presentation so that you make a fabulous first impression."
93,660479195198431232,Sat Oct 31 15:31:25 +0000 2015,0,0,"Two simple rules for meeting people: Entertain once a week without fail, and accept all invitations. #Socializing"
94,660267589252325376,Sat Oct 31 01:30:35 +0000 2015,0,0,The first steps toward falling in love are knowing yourself and finding the person who will complete you. #Relationships
95,660237399948140545,Fri Oct 30 23:30:37 +0000 2015,0,0,One way to meet people in a relaxed atmosphere is to take a course where people interact naturally. #Socializing
96,660207139898683393,Fri Oct 30 21:30:22 +0000 2015,0,0,The number one reason for divorce in the world is that many people marry the wrong person in the first place. #Relationships
97,659868011424260096,Thu Oct 29 23:02:48 +0000 2015,1,1,My last word: Stay open to opportunity – you never know where your next important connection will be made.
98,659838103448887296,Thu Oct 29 21:03:57 +0000 2015,0,0,"If you have a dream of becoming a successful author, “Write a Saleable Book”, my newest work, will help! Learn more: https://t.co/gktSCyrmEQ"
99,659808119170666497,Thu Oct 29 19:04:48 +0000 2015,0,0,5 ways to appear socially smarter over the holidays: https://t.co/d1WyHCXbRT #Leadership
100,659777842708938752,Thu Oct 29 17:04:30 +0000 2015,0,0,"When true love comes, it will come as a surprise and an enormous relief. It always does – out of the blue."
101,659747634370908160,Thu Oct 29 15:04:28 +0000 2015,1,1,Purchase your copy of “Convince Them in 90 Seconds or Less” for expert sales advice: https://t.co/gVM4yJQsf0 #Sales
102,659505669402402816,Wed Oct 28 23:02:59 +0000 2015,0,1,What is the meaning of communication and how can you communicate effectively? Watch here to find out: https://t.co/sJj44ir6Wz
103,659475673514426369,Wed Oct 28 21:03:47 +0000 2015,0,0,"We human beings live by stories. We also dream about them, worry about them, and die by them."
104,659445724543918080,Wed Oct 28 19:04:47 +0000 2015,0,0,Want to know the secret to finding lasting love? Check out this video in which I will tell you all about it: https://t.co/YgIF5KWvqk
105,659415511852326912,Wed Oct 28 17:04:44 +0000 2015,0,0,"Most of us are unwitting prisoners, in one way or another, of our own imaginations. It is the strongest force any of us possesses…"
106,659385175038676992,Wed Oct 28 15:04:11 +0000 2015,0,0,"Want to make better business connections? My book, “Convince Them in 90 Seconds or Less”, will teach you how: https://t.co/gVM4yJyRns"
107,659143274964361216,Tue Oct 27 23:02:57 +0000 2015,0,0,"When you shake hands, people make an immediate judgement about your character and level of confidence. #Sales #Leadership #Business #MLM"
108,659113268166983681,Tue Oct 27 21:03:43 +0000 2015,0,0,90 minutes is all it takes to make someone fall in love with you. Check out my book to learn more! Visit: https://t.co/kcOt0i1Fyx #Love
109,659083311151738880,Tue Oct 27 19:04:41 +0000 2015,0,0,It’s easier to be convincing if you care about your topic. Figure out what’s important to you about your message &amp; speak from the heart.
110,659053135177060352,Tue Oct 27 17:04:46 +0000 2015,0,0,"Become a master of first impressions! Read “How to Make People Like You in 90 Seconds or Less”, available here: https://t.co/vgJi0kVvxG"
111,659022844018491392,Tue Oct 27 15:04:24 +0000 2015,0,0,Don’t let your inhibitions prevent you from meeting people. Count to three then introduce yourself. #Leadership #Sales #MLM
112,658780859915485185,Mon Oct 26 23:02:51 +0000 2015,0,0,Socialize and entertain. Your matched opposite is out there. Finding him or her is a numbers game. #Socializing
113,658750910324195328,Mon Oct 26 21:03:50 +0000 2015,0,0,Learn how to write a saleable book! Visit here to learn more: https://t.co/kGidNtA7vR #Writing
114,658721002268987393,Mon Oct 26 19:05:00 +0000 2015,0,0,Nothing helps build good feelings like synchronizing body language and voice characteristics. #Relationships
115,658690720765755392,Mon Oct 26 17:04:40 +0000 2015,0,0,The quickest way to blast a hole in a relationship: https://t.co/fGpOM6X16p #Relationships
116,658660486930681857,Mon Oct 26 15:04:32 +0000 2015,0,0,You increase your chances for compliance if you offer a reason why you want something done. #Leadership #Sales
117,658418326650138624,Sun Oct 25 23:02:16 +0000 2015,0,0,"Nothing says trust and approachability like eye contact, a smile, and open body language. #Relationships"
118,658388173438001153,Sun Oct 25 21:02:27 +0000 2015,0,0,"In the following video, I will show you how to find love in 90 minutes. Click here to watch: https://t.co/9kwIEDFfaj #Love"
119,658358208575217665,Sun Oct 25 19:03:23 +0000 2015,0,0,"When all is said and done, it’s people who make the hard times bearable and the good times much, much sweeter."
120,658327993543172096,Sun Oct 25 17:03:19 +0000 2015,0,0,"In my newest book, I will tell you how to write a book that actually sells! Click here to get all the info: https://t.co/gktSCyrmEQ"
121,658297723158974464,Sun Oct 25 15:03:02 +0000 2015,0,0,Think of your love as a fire you must tend with enthusiasm every day. #Love #Romance #Relationships
122,658055907910250497,Sat Oct 24 23:02:09 +0000 2015,0,1,"Love is not a destination, it’s a process, a journey. #Love #Romance #Relationships"
123,658025820607369216,Sat Oct 24 21:02:35 +0000 2015,0,0,It only takes 90 seconds to make smart business connections! Check out my book to learn more: https://t.co/gVM4yJyRns #Sales #Connection
124,657995804825821186,Sat Oct 24 19:03:19 +0000 2015,0,0,Everything begins and ends with attitude. It’s what people respond to even before they meet you. #Relationships
125,657965607858655232,Sat Oct 24 17:03:19 +0000 2015,0,0,Can You Really Fall In Love In 90 Minutes Or Less? Find out by checking out this video: https://t.co/AixmElpDw9 #Love
126,657935424334266368,Sat Oct 24 15:03:23 +0000 2015,0,0,"People who connect live longer, people who connect get cooperation, &amp; people who connect feel safe &amp; strong. People who connect evolve."
127,657693819643785220,Fri Oct 23 23:03:20 +0000 2015,1,1,Consider buying a high-quality briefcase or handbag. The right accessory can make you look better-dressed than you are. #Sales #Business
128,657663620881502209,Fri Oct 23 21:03:20 +0000 2015,0,0,Good communication skills are essential to making positive connections! Learn more here: https://t.co/Hs4IqatFhb #Sales
129,657633736599719936,Fri Oct 23 19:04:35 +0000 2015,0,0,"Love doesn’t happen on command. It’s a process that flows, it’s a seed that grows, it’s a spark that turns into a flame. #Love"
130,657603506187169792,Fri Oct 23 17:04:28 +0000 2015,0,0,"Learn all about “Write a Saleable Book”, to be released this holiday season, by clicking here: https://t.co/gktSCyrmEQ #Writing #Books"
131,657573244036366336,Fri Oct 23 15:04:13 +0000 2015,0,0,"When you know what you want and have done all that you can to get it, step back and allow events to unfold."
132,657331315252031488,Thu Oct 22 23:02:52 +0000 2015,0,0,Your spoken language and your body language must say the same thing.
133,657301298535079937,Thu Oct 22 21:03:36 +0000 2015,0,0,Looking for love in all the wrong places? I can help! Learn how to attract that love you’ve been searching for: https://t.co/kcOt0i1Fyx
134,657271363594489857,Thu Oct 22 19:04:39 +0000 2015,0,0,"People who don’t give feedback appear bored, boring, or baffling. #Relationships"
135,657241087355043844,Thu Oct 22 17:04:20 +0000 2015,0,0,"A few years ago, I was featured on the @TODAYshow to explain how to make people like you in 90 seconds or less: https://t.co/PLBDAuaBzu"
136,657210886050992129,Thu Oct 22 15:04:20 +0000 2015,0,0,"Assumptions at their best are great for learning, but at their worst they lead to biased, unfair, limiting and dangerous fantasies."
137,656968925662584832,Wed Oct 21 23:02:52 +0000 2015,0,0,It’s amazing how people will blossom when you ask them a question about something for which they care deeply. #Relationships
138,656938879220633600,Wed Oct 21 21:03:28 +0000 2015,0,2,Pitching for Profit: https://t.co/fJMSFcz0a7 #Sales #Leadership #MLM
139,656909040933556224,Wed Oct 21 19:04:54 +0000 2015,0,0,Connecting is a two-way arrangement in which the participants cooperate and encourage each other along.
140,656878768326385668,Wed Oct 21 17:04:37 +0000 2015,0,0,It’s almost time for the release of “Write a Saleable Book”! I hope you’re all excited! Get all the info at https://t.co/gktSCyrmEQ #Books
141,656848475490009088,Wed Oct 21 15:04:14 +0000 2015,0,0,"Together we rise and fall, together we sink or swim, together we laugh and cry."
142,656606560345571328,Tue Oct 20 23:02:57 +0000 2015,0,0,Encourage others to make favorable snap judgements about you. Establish a receptive mood and positive expectations. #Leadership #Sales
143,656576468668039168,Tue Oct 20 21:03:23 +0000 2015,1,1,Connect and live longer: https://t.co/VZGOzEuFzv #Leadership #Business #Sales #MLM
144,656546595354361856,Tue Oct 20 19:04:41 +0000 2015,0,0,Many of us go through life hoping that others will somehow intuit our and fulfill them without our having to articulate a thing.
145,656516352711237633,Tue Oct 20 17:04:30 +0000 2015,0,0,"Learn about me, the books I’ve written, and how you can attend my next seminar! Click here: https://t.co/kGidNtA7vR #Writing"
146,656486162027192320,Tue Oct 20 15:04:32 +0000 2015,0,0,"Even when it feels as if the world is coming to an end, you can change your attitude from useless to useful. #Leadership #Sales"
147,656244099230642176,Mon Oct 19 23:02:40 +0000 2015,0,0,"Once your mind is set into a particular attitude, you have very little ongoing conscious control over the signals your body sends out."
148,656214070677385216,Mon Oct 19 21:03:20 +0000 2015,0,0,Your 5 Superpowers: https://t.co/UgVuJtKNLX #Leadership
