,id_str,created_at,retweet_count,favorite_count,text
149,656184135610953730,Mon Oct 19 19:04:23 +0000 2015,0,0,"When you spot an opportunity that’s too good to pass up, don’t: Just count to three, adjust your attitude, and make your approach."
150,656153951277096960,Mon Oct 19 17:04:27 +0000 2015,0,0,“First impressions matter. Experts say we size up new people in somewhere between 30 seconds and two minutes.” – Elliott Abrams
151,656123788518694912,Mon Oct 19 15:04:36 +0000 2015,0,0,Your experiences become words…words become actions…actions become habits…habits become character…character becomes your destiny.
152,655881569010327552,Sun Oct 18 23:02:06 +0000 2015,0,1,"Here’s a fact of life: All behavior is a feedback loop. You want something, you try for it. #Leadership #Sales"
153,655851484115050496,Sun Oct 18 21:02:33 +0000 2015,0,0,What’s your “Big Idea”? http://t.co/70a5MMZB1Q #Leadership
154,655821439157862400,Sun Oct 18 19:03:10 +0000 2015,0,0,Compliments only work when they are sincere and not fabricated for the moment. #Relationships
155,655791266471542784,Sun Oct 18 17:03:16 +0000 2015,0,0,"If you feel uncomfortable making small talk with others, check out this video to learn some helpful secrets: http://t.co/aW6go5QwyH"
156,655761017402691584,Sun Oct 18 15:03:04 +0000 2015,0,0,Wearing attractive clothes with confidence makes you feel different about yourself and makes other people respond differently to you.
157,655519223758856192,Sat Oct 17 23:02:16 +0000 2015,0,0,Get in the habit of noticing other people’s eyes when you first meet them.
158,655489087021957124,Sat Oct 17 21:02:31 +0000 2015,0,1,"All day long, we synchronize ourselves with those around us. We do it all the time. We thrive on it, and we can’t exist without it."
159,655459058288336897,Sat Oct 17 19:03:11 +0000 2015,0,0,It’s official. Radio makes you happy: http://t.co/zgTzTM9hMB #Happiness
160,655428900009455616,Sat Oct 17 17:03:21 +0000 2015,0,0,Want to learn how to write a truly successful book? I’ll tell you all about it! Click here: http://t.co/YpyHJ3ENY8 #Writing
161,655398724294811649,Sat Oct 17 15:03:27 +0000 2015,0,0,Developing a knack for detecting sensory preferences means paying close attention to others – this alone makes you more people-oriented.
162,655156963643363328,Fri Oct 16 23:02:47 +0000 2015,0,0,"Fine-tune your people skills so that when you meet your matched opposite, you are ready to connect."
163,655127028195282944,Fri Oct 16 21:03:49 +0000 2015,0,0,"In 2008, @LaraSpencer of @GMA put my book, “How to Make People Like You in 90 Seconds or Less”, to the test: http://t.co/Tx6LYbmIhP"
164,655096887402496001,Fri Oct 16 19:04:03 +0000 2015,0,0,"Open body language exposes your heart and body and signals cooperation, agreement, willingness, enthusiasm and approval."
165,655066750627749888,Fri Oct 16 17:04:18 +0000 2015,0,0,"My book, “How to Make Someone Fall in Love With You in 90 Minutes or Less”, will help you find love you seek: http://t.co/kcOt0i1Fyx"
166,655036559775899648,Fri Oct 16 15:04:20 +0000 2015,0,0,"For one day, make a mental note of the color of the eyes of every person you meet. You don’t have to remember the color, just take note."
167,654794562834030592,Thu Oct 15 23:02:43 +0000 2015,0,0,"In face-to-face communication, people give most credibly to what they see, next to voice tone and least to the words they’re hearing."
168,654764543986438148,Thu Oct 15 21:03:26 +0000 2015,0,0,"Before you can find true love, there are some things you should figure out. Click here to learn about them: http://t.co/f5wYEdVUnh"
169,654734520285986816,Thu Oct 15 19:04:08 +0000 2015,0,0,"The more people you meet, the more chances you have of finding one who’s right for you in the long term. #Socializing"
170,654704353589129216,Thu Oct 15 17:04:16 +0000 2015,0,0,Learn how to write a saleable book! Click here to learn about my free seminars and how you can register: http://t.co/kGidNtiw7h #Writing
171,654674159444717568,Thu Oct 15 15:04:17 +0000 2015,0,0,"There are three really useful attitudes that successful leaders have in common: enthusiasm, curiosity, and humility. #Leadership #Sales"
172,654432361799659521,Wed Oct 14 23:03:28 +0000 2015,0,1,"Great romantic relationships are based on friendship, and the bottom line in friendship is that people like people like themselves."
173,654402139536662528,Wed Oct 14 21:03:22 +0000 2015,0,1,"There are four processes that constitute the core #business model: dreaming, analyzing, persuading and controlling. #Leadership #Sales"
174,654372202373058560,Wed Oct 14 19:04:25 +0000 2015,0,0,"“Rare as is true love, true friendship is rarer.” – Jean de La Fontaine http://t.co/ntzNfAy69u #Friendship #Love"
175,654341928482377728,Wed Oct 14 17:04:07 +0000 2015,0,0,100 great ways to stay single: http://t.co/dwLOYtqDIg #Relationships
176,654311738448433152,Wed Oct 14 15:04:09 +0000 2015,0,0,A first impression begins with attitude. … You can spot someone’s attitude from a mile away.
177,654069798121394176,Tue Oct 13 23:02:46 +0000 2015,0,0,"If you want to learn how to make a great first impression, go ahead and check out this article: http://t.co/USjc4nUVyw"
178,654039710692700161,Tue Oct 13 21:03:13 +0000 2015,0,0,"Smart companies recognize the value of tapping into their employees’ values, of making their work meaningful. #Leadership"
179,654009696714665984,Tue Oct 13 19:03:57 +0000 2015,0,0,"If you want to write a book that sells, I will teach you how! Click here for more information: http://t.co/YpyHJ3ENY8 #Writing"
180,653979464628572160,Tue Oct 13 17:03:49 +0000 2015,0,0,Familiarity and friendship aren’t enough to sustain a romantic relationship. It takes something more. #Relationships
181,653949258433994752,Tue Oct 13 15:03:47 +0000 2015,0,0,In the following video I demonstrate the power of first impressions. Click here to give it a watch: http://t.co/cTajo40N2E #Sales
182,653707321131028480,Mon Oct 12 23:02:25 +0000 2015,0,0,What would make you truly happy? How do you achieve that happiness? I will tell you in this video: http://t.co/ySGTSGxqpo
183,653677259698622464,Mon Oct 12 21:02:58 +0000 2015,0,0,"When you actively make new connections you’ll live longer, be healthier, and make more money. #Relationships"
184,653647248551768064,Mon Oct 12 19:03:42 +0000 2015,0,0,How can you make more people like you? Check out “How to Make People Like You in 90 Seconds or Less” here: http://t.co/vgJi0kVvxG
185,653617106693586944,Mon Oct 12 17:03:56 +0000 2015,0,0,"That fact is, most of us are relatively clueless about how to find love, and as a result we go about looking in a pretty haphazard way."
186,653586880605356032,Mon Oct 12 15:03:50 +0000 2015,0,0,Body Language – Reading What a Person Thinks of You: http://t.co/W7lvP2HSZk #Leadership
187,653344818458927105,Sun Oct 11 23:01:57 +0000 2015,0,1,"Like all energy systems in nature, we humans only come with 2 settings: grow or go. Live or die. Nothing in between. #Growth"
188,653314669092995072,Sun Oct 11 21:02:09 +0000 2015,0,0,Looking for a love that lasts? This book will teach you how to make someone fall in love &amp; stay in love with you: http://t.co/kcOt0i1Fyx
189,653284603235598337,Sun Oct 11 19:02:41 +0000 2015,1,0,"When you know what you’re looking for, you can fine-tune your self-presentation so that you make a fabulous first impression."
190,653254439776686084,Sun Oct 11 17:02:49 +0000 2015,0,0,Why is body language important and how do we use it to our advantage? Find out by watching this video: http://t.co/cTajo40N2E
191,653224190137499649,Sun Oct 11 15:02:37 +0000 2015,0,0,"“The more social media we have, the more we think we're connecting, yet we are really disconnecting from each other.”"
192,652982424197050369,Sat Oct 10 23:01:56 +0000 2015,0,0,"“When people talk, listen completely. Most people never listen.” – Ernest Hemingway http://t.co/q74fHART0O #Listen"
193,652952318850269184,Sat Oct 10 21:02:18 +0000 2015,0,0,GUGOGI – your very own 3G Network: http://t.co/JOyEW4YWHp #MLM #Leadership #Sales
194,652922246953103360,Sat Oct 10 19:02:49 +0000 2015,0,0,"Two simple rules for meeting people: Entertain once a week without fail, and accept all invitations. #Socializing"
195,652892060450746368,Sat Oct 10 17:02:52 +0000 2015,0,0,Turning strangers into advantageous connections is a simple science. Learn all about it in my book! Click here: http://t.co/vgJi0kVvxG
196,652861880097218560,Sat Oct 10 15:02:56 +0000 2015,0,0,The first steps toward falling in love are knowing yourself and finding the person who will complete you. #Relationships
197,652620243798503424,Fri Oct 09 23:02:45 +0000 2015,0,0,"People in love don’t just come alive, they tend to stay alive and live richer, healthier, more exciting, and longer lives."
198,652590048827830272,Fri Oct 09 21:02:46 +0000 2015,0,1,Want to know the secret to connecting with people? Check out this article: http://t.co/uiTxxf1rfK #Leadership
199,652560027690139648,Fri Oct 09 19:03:29 +0000 2015,0,0,The quickest way to blast a hole in a relationship and to bring out the worst in your partner is to trample on his or her key feelings.
