,id_str,created_at,retweet_count,favorite_count,text
181,669082928991698944,Tue Nov 24 09:19:35 +0000 2015,0,0,Every episode of The Dr. Oz Show is just killing 59 minutes before telling everyone to eat blueberries.
182,669082318624002050,Tue Nov 24 09:17:10 +0000 2015,0,0,Congratulations to Avril Lavigne for marrying the reason we all hit scan on our car radios.
183,669081472578416640,Tue Nov 24 09:13:48 +0000 2015,0,0,People change things go wrong. Just remember life goes on.
184,669080830757572608,Tue Nov 24 09:11:15 +0000 2015,0,0,Thought You've Seen It All? 16 Yahoo! Funniest Answers For Dumb Questions! https://t.co/PDVcbJBAKE
185,669080099052912640,Tue Nov 24 09:08:21 +0000 2015,0,0,Nothing makes me feel better than a photo of a sandwich getting more Instagram likes than a picture of someones kid.
186,669079401909239808,Tue Nov 24 09:05:34 +0000 2015,0,0,"You Won't Believe On What You See For The First Time, You Have to Look At These Pictures Twice https://t.co/7eR3YZcXv3"
187,669078585638940673,Tue Nov 24 09:02:20 +0000 2015,0,1,Theres stupid then theres liking Facebook on Facebook stupid.
188,669077865472749568,Tue Nov 24 08:59:28 +0000 2015,0,0,15 Awesome Gadgets That Deserve a Space in Your Kitchen https://t.co/BOjaulGfeG
189,669077107817840641,Tue Nov 24 08:56:28 +0000 2015,0,0,17 Hilarious License Plates You Wish You Had For Your Car! https://t.co/JQSbWoHJCc
190,669076332236529664,Tue Nov 24 08:53:23 +0000 2015,0,0,Mick Jagger is the best at singing legendary songs while looking like he just walked into a spiders web.
191,669075530583375872,Tue Nov 24 08:50:11 +0000 2015,0,0,Celebs Then Vs Now https://t.co/UF4SHS2KLW
192,669074795699396608,Tue Nov 24 08:47:16 +0000 2015,0,0,Oh youre 15 and your boyfriend broke up with you? Please elaborate on how devastating and ruined your life is.
193,669073965046829058,Tue Nov 24 08:43:58 +0000 2015,0,0,Theres no people like dog people.
194,669073204401455104,Tue Nov 24 08:40:57 +0000 2015,0,0,ugly people : taken 💏 nerds : taken 💏 hoes : taken 💏 everybody : taken 💏 me : 🚶
195,669072358938800128,Tue Nov 24 08:37:35 +0000 2015,0,0,Every day is Take Your Child to Work Day in China.
196,669071499140030464,Tue Nov 24 08:34:10 +0000 2015,0,0,When I see a Scion in my rearview mirror I always pull over and let it pass so no ones late to the Hoobastank concert.
197,669070817574064133,Tue Nov 24 08:31:28 +0000 2015,0,0,Ok If we get caught heres the story...
198,669070198557663232,Tue Nov 24 08:29:00 +0000 2015,0,0,I insult you because I want you to know how much I care.
199,669069345272672256,Tue Nov 24 08:25:37 +0000 2015,0,0,"You Will Be Extremely Inspired By These Amazing Photos Of Women Making History, Especially #9! https://t.co/rUn3wGM2UG"
