,id_str,created_at,retweet_count,favorite_count,text
0,669208114852311040,Tue Nov 24 17:37:02 +0000 2015,0,0,13 Food Facts You Really Don't Want to Know...But You Do https://t.co/YnmnQpY0QN
1,669207491205423104,Tue Nov 24 17:34:33 +0000 2015,0,0,12 People Who Made Public Photoshop Requests… And Got Insanely Hilarious Results! https://t.co/EDjRrQkrik
2,669206554361499648,Tue Nov 24 17:30:50 +0000 2015,0,0,Some People Are Simply Asking For It - Accidents Waiting To Happen! https://t.co/8UHLe13v9n
3,669205649645940737,Tue Nov 24 17:27:14 +0000 2015,0,0,Before taking that selfie ask yourself Am I fourteen?
4,669204989001142272,Tue Nov 24 17:24:37 +0000 2015,0,0,19 Spine Tattoos That Will Level Up Your Passion For Inks! https://t.co/KmXhsRrx9n
5,669203921420705792,Tue Nov 24 17:20:22 +0000 2015,0,0,Please Meet 26 of The World's Most Photogenic Animals! https://t.co/78xfyRMdaM
6,669195987034861568,Tue Nov 24 16:48:51 +0000 2015,0,0,I have a girlfriend... oh wait no. Thats a fridge. I have a fridge.
7,669195401732296704,Tue Nov 24 16:46:31 +0000 2015,0,0,I know the new popes name wont be leaked early because the Catholic Church is the best at keeping secrets.
8,669194843906703360,Tue Nov 24 16:44:18 +0000 2015,0,0,Did you hear about the guy who got hit in the head with a can of soda He was lucky it was a soft drink.
9,669194235095068672,Tue Nov 24 16:41:53 +0000 2015,0,0,If the people in horror movies listened to me theyd still be alive.
10,669193562064424960,Tue Nov 24 16:39:12 +0000 2015,0,0,Father Pranks His Girlfriend Believing Their Son Died But The Result Is Shocking! https://t.co/RWOTz5PBBZ
11,669192960223744000,Tue Nov 24 16:36:49 +0000 2015,0,0,21 Students Who Gave Their Teachers The Wittiest Answers https://t.co/TV4HramlAl
12,669192388452093952,Tue Nov 24 16:34:33 +0000 2015,0,0,The Truth About North Korea That Outsiders Might Want To Know https://t.co/GqPjxavplL
13,669191855905484800,Tue Nov 24 16:32:26 +0000 2015,0,0,Ive never seen a guy wearing a Hawaiian shirt that didnt look like he had high cholesterol.
14,669191277703901186,Tue Nov 24 16:30:08 +0000 2015,0,0,Its not the size that coun... no wait its the size!
15,669190714631188480,Tue Nov 24 16:27:53 +0000 2015,0,0,Unique McDonald’s Food from Around the World https://t.co/aGXXGjrLKy
16,669190145472499712,Tue Nov 24 16:25:38 +0000 2015,0,0,Casually Fascinating Snopshots To Make Your Day Much Better. https://t.co/M1clAIicDf
17,669189668538191873,Tue Nov 24 16:23:44 +0000 2015,0,0,Today is the first day of the rest of your life...but so was yesterday and look how that turned out
18,669189137740660741,Tue Nov 24 16:21:38 +0000 2015,0,0,Theres a good chance your mother will go down on your father today. Happy Valentines Day!
19,669188550932336640,Tue Nov 24 16:19:18 +0000 2015,0,0,Today's Inspiration: Heart-tugging Acts of a Dying Mother for Her Only Son (You Will Cry). https://t.co/eUX9xxZ4je
20,669187862311473152,Tue Nov 24 16:16:33 +0000 2015,0,0,The State of the Union should just be an hour and a half of a guy crying in his car outside of an Arbys.
21,669187303361802240,Tue Nov 24 16:14:20 +0000 2015,0,0,Every mans dream is to be able to sink into the arms of a woman without also falling into her hands.
22,669186726905016320,Tue Nov 24 16:12:03 +0000 2015,0,0,12 Beggars Who Earn A Hell Lot Of Money https://t.co/HCiU6725jJ
23,669186170161487872,Tue Nov 24 16:09:50 +0000 2015,0,0,Kitchen-Destroyers:Keep These People As Far Away As Possible From A Kitchen!! What Were They Thinking? https://t.co/pTgL0XyAGF
24,669185532128198656,Tue Nov 24 16:07:18 +0000 2015,0,0,See What The Years Can Do To An Awesome Tattoo! https://t.co/iqXcc8An7i
25,669184865435148288,Tue Nov 24 16:04:39 +0000 2015,0,1,I just watched 15 Vines while driving 80mph on the highway if the Discovery Channel needs another television special.
26,669184293655064576,Tue Nov 24 16:02:23 +0000 2015,0,1,America's Well-known And Most Visited National Parks: It Will Surely Give You An Experience Full of Blasts https://t.co/4HgsgkMRqV
27,669183747707662336,Tue Nov 24 16:00:12 +0000 2015,0,0,People Bullied Her 'Cause She's Size 22 But Her Size And Courage Made Her Famous https://t.co/nhgTuNecTr
28,669183167765475328,Tue Nov 24 15:57:54 +0000 2015,0,0,Would You Agree That This Is Food Art At Its Finest?! https://t.co/dQPbsjD7bv
29,669182679179333632,Tue Nov 24 15:55:58 +0000 2015,0,0,Say what you want about Chris Christie but he gave those drivers plenty of time to finish their texts.
30,669182105516007425,Tue Nov 24 15:53:41 +0000 2015,0,0,"20 Mind Blowing Desktop Backgrounds, #2 Is Already On My Desktop https://t.co/wGTHTZBw4V"
31,669181529260593152,Tue Nov 24 15:51:24 +0000 2015,0,0,Mind-Boggling Stories From 15 Selfies That Can Make or Break Your Day! https://t.co/wo1SW5qoTV
32,669180817352953856,Tue Nov 24 15:48:34 +0000 2015,0,0,If someone dies on Valentines Day thats just Gods way of saying BE MINE!
33,669180202895839232,Tue Nov 24 15:46:07 +0000 2015,0,0,I wish celebrities would let us know if they have the greatest fans in the world.
34,669179631073800192,Tue Nov 24 15:43:51 +0000 2015,0,0,Pay Day: A Bi-monthly reminder that I chose the wrong profession.
35,669179033872011265,Tue Nov 24 15:41:29 +0000 2015,0,0,Girls of Florida: Happy Get Wasted Sit On a Curb and Cry Into Your Cell Phone While Wearing One High Heel Shoe Eve.
36,669178468567937024,Tue Nov 24 15:39:14 +0000 2015,0,0,Recession is when a neighbor loses his job. Depression is when you lose yours.
37,669177766575628288,Tue Nov 24 15:36:26 +0000 2015,0,0,Such a satisfying feeling when the one that got away turns into dodged that bullet
38,669177155956273152,Tue Nov 24 15:34:01 +0000 2015,0,0,Make Your Footwear Comfy With These 16 Shoe Hacks https://t.co/2J2p1hta6m
39,669176554686058496,Tue Nov 24 15:31:37 +0000 2015,0,0,These 12 Unbelievably Terrifying Places Will Make Your Skin Crawl https://t.co/t9RQNIdvrf
40,669176088426233857,Tue Nov 24 15:29:46 +0000 2015,0,0,I Didn't Wish to Live in a Shipping Container Until I Caught Sight of These.. https://t.co/eHMDNJXrPN
41,669175568634482688,Tue Nov 24 15:27:42 +0000 2015,0,1,You Might Regret Not To See These 22 Facebook Wins And Fails! https://t.co/VpWDYtcXzW
42,669174973584400384,Tue Nov 24 15:25:21 +0000 2015,0,0,My best friends are my best friends because everyone else sucks.
43,669174389137534976,Tue Nov 24 15:23:01 +0000 2015,0,0,At this point Im shocked if I find out the fast food Im eating isnt made of horse meat.
44,669173820352139265,Tue Nov 24 15:20:46 +0000 2015,0,0,No ones ever said bye less than 6 times at the end of a conference call.
45,669173246550405120,Tue Nov 24 15:18:29 +0000 2015,0,0,That sad moment when you lose a chip in the dip so you send in a recon chip in and that breaks too.
46,669172619506155520,Tue Nov 24 15:15:59 +0000 2015,0,0,Black And White Photos That May Give You Goose Bumps https://t.co/aDemaW4GMZ
47,669172062850670596,Tue Nov 24 15:13:47 +0000 2015,0,0,These Are The Most Annoying Things You Deal With In Your Daily Life. Can You Relate? https://t.co/PKAaDQe9Vf
48,669171534238388224,Tue Nov 24 15:11:41 +0000 2015,0,0,These Are The Most Amazing Images Captured Through a Regular iPhone https://t.co/aOe8J6vREx
49,669170896997748737,Tue Nov 24 15:09:09 +0000 2015,0,0,If you cant dazzle em with brilliance baffle em with bullshit.
50,669170283341746176,Tue Nov 24 15:06:42 +0000 2015,0,1,If you walk a mile in my shoes youll end up at the bar.
51,669169619710558209,Tue Nov 24 15:04:04 +0000 2015,0,0,Pics That Are Incredibly Enticing https://t.co/NaoG3kOXgp
52,669169105073647616,Tue Nov 24 15:02:01 +0000 2015,0,0,Ive exercised with women so thin that buzzards followed them to their cars.
53,669168614264602626,Tue Nov 24 15:00:04 +0000 2015,0,0,18 Most Hilarious Makeup Transformation...#11 is Just Mean! https://t.co/WPY5JYGAoe
54,669168018081976320,Tue Nov 24 14:57:42 +0000 2015,0,0,18 Tumblr and Instagram Fans Got Unexpected Response From Taylor Swift https://t.co/TGgqlGDMZL
55,669167453440643072,Tue Nov 24 14:55:28 +0000 2015,0,0,The L in my luck has been replaced with an F.
56,669166908587929605,Tue Nov 24 14:53:18 +0000 2015,0,0,Cool Stuff That Awesome Parents Do https://t.co/93WsOYoEz9
57,669166341362835456,Tue Nov 24 14:51:02 +0000 2015,0,0,Why do people pay to go up tall buildings and then put money in binoculars to look at things on the ground?
58,669165734052823041,Tue Nov 24 14:48:38 +0000 2015,0,0,Its funny how most people love the dead once youre dead your made for life.
59,669165071696723968,Tue Nov 24 14:46:00 +0000 2015,0,0,I hate most of the female population so if Im your friend consider yourself special
60,669164495319658496,Tue Nov 24 14:43:42 +0000 2015,0,0,Sexting Can Come Out To Be Very Funny... https://t.co/cofqXjdXAQ
61,669163880958943232,Tue Nov 24 14:41:16 +0000 2015,0,0,What People Worldwide Do To Remedy Hangovers https://t.co/2MuA12svKy
62,669163307610148870,Tue Nov 24 14:38:59 +0000 2015,0,0,"Believe It Or Not, These Beach Sculptures Are Only Made From Sands! https://t.co/lcqribRyKL"
63,669162689164218368,Tue Nov 24 14:36:32 +0000 2015,0,0,Hilarious Photos That Teaches The World All About Irony https://t.co/iJ27DwSfjw
64,669162179443097600,Tue Nov 24 14:34:30 +0000 2015,0,0,Dance like it hurts love like you need money work when people are watching you.
65,669161670023901184,Tue Nov 24 14:32:29 +0000 2015,0,0,I pledged allegiance to the Republic for Witches Stand until the 4th grade.
66,669161047983415296,Tue Nov 24 14:30:00 +0000 2015,0,0,Easter Egg Tidbits In Pixar Movies - Only A Pixar Fan Can Find Them All! https://t.co/K02OW0sZ3m
67,669160415104921604,Tue Nov 24 14:27:30 +0000 2015,0,0,If you knew that everyone you know was going to die tomorrow who would you visit today?
68,669159854565560324,Tue Nov 24 14:25:16 +0000 2015,0,0,I got This one! on BuzzFeeds Which Moment Will You Most Regret On Your Deathbed? quiz.
69,669159299734605824,Tue Nov 24 14:23:04 +0000 2015,0,0,These 16 Artworks Will Make Stop And Think AGAIN about Your Daily Life Routine. https://t.co/sKy844hAgM
70,669158719662370817,Tue Nov 24 14:20:45 +0000 2015,0,0,90% of a relationship is spent telling each other how full you are.
71,669158152391168000,Tue Nov 24 14:18:30 +0000 2015,0,0,"18 Pictures Of Perfect Epic Fails, Your Stomach Will Hurt From Laughing https://t.co/oN6L7LcBad"
72,669157487212281856,Tue Nov 24 14:15:51 +0000 2015,0,0,Simple Wonders: Fabulous Photos Around The World That Will Lighten Up Your Day! Try #20 Just for Kicks! https://t.co/S8f5ovLITs
73,669156888924188672,Tue Nov 24 14:13:29 +0000 2015,0,0,90% Of People Can’t Spot The Differences In These Photos https://t.co/LdzCw32Bnb
74,669156278376140800,Tue Nov 24 14:11:03 +0000 2015,0,0,Mike Taylor's Passion for Photography Led Him To Devote His Full Time Taking Amazing Images! https://t.co/OWNJ9mn3Gs
75,669155695921467392,Tue Nov 24 14:08:44 +0000 2015,0,0,You Will Love These 15 Heartwarming Animal Stories That Can Melt Even The Hardest Hearts https://t.co/HG6AOUNWDy
76,669155111311011840,Tue Nov 24 14:06:25 +0000 2015,1,0,if I ugly snapchat you I trust you
77,669154532715159552,Tue Nov 24 14:04:07 +0000 2015,1,1,"#27 Best of Tinder Screenshots, Do You Think They Are Wins Or Fails? https://t.co/OH1RzzqCnb"
78,669153928794140672,Tue Nov 24 14:01:43 +0000 2015,1,1,What a perfect night to curl up with a good book to Instagram and not read to appear intellectually superior to everyone.
79,669153346599583744,Tue Nov 24 13:59:24 +0000 2015,1,0,RAM disk is *not* an installation procedure!
80,669152681215156224,Tue Nov 24 13:56:46 +0000 2015,0,0,Leave the day-drinking to the professionals.
81,669152079999463424,Tue Nov 24 13:54:22 +0000 2015,0,0,When WWE Superstars Were As Ordinary As Us – These Before and After Pictures Will Shock You https://t.co/GpzRnQpGc2
82,669151514263355392,Tue Nov 24 13:52:07 +0000 2015,0,0,Theres stupid then theres liking Facebook on Facebook stupid.
83,669150940503535616,Tue Nov 24 13:49:51 +0000 2015,0,0,Pose like These Crazies on Your ID and You're Sure to be Called to the Principal's Office! https://t.co/OHc9ffhM31
84,669150357386227713,Tue Nov 24 13:47:32 +0000 2015,0,0,These 15 Before-And-After Photos Proves Why The Fall Is The Most Beautiful Season. https://t.co/R325h2fYQU
85,669149752689225728,Tue Nov 24 13:45:07 +0000 2015,0,0,The only thing worse than a bitchy woman is a bitchy man.
86,669149132380966912,Tue Nov 24 13:42:40 +0000 2015,0,0,25 Of The Most Bizarre Superstitions Around The World! https://t.co/s3sFjRZV4s
87,669148530011824128,Tue Nov 24 13:40:16 +0000 2015,0,0,How A Couple From Arizona Used Tree Trunks To Create Fantastic Flooring https://t.co/ARz0uQZhMe
88,669148046387646464,Tue Nov 24 13:38:21 +0000 2015,0,0,This is the most interesting thing about me. - People who drive yellow cars
89,669147448250527744,Tue Nov 24 13:35:58 +0000 2015,0,0,"Weddings Rings - Out, Wedding Tattoos - In. https://t.co/Y72khaDHik"
90,669146855205310464,Tue Nov 24 13:33:37 +0000 2015,0,0,30 Genius Things That Surprisingly Hasn't Been Invented Yet https://t.co/rts3iejSuS
91,669146271479828480,Tue Nov 24 13:31:17 +0000 2015,0,0,For a guy whose main weapon is an antique garden tool people sure make a big deal about the Devil.
92,669145673762103297,Tue Nov 24 13:28:55 +0000 2015,0,0,I may be short but I will kick the shit out of your shins!
93,669145115202420737,Tue Nov 24 13:26:42 +0000 2015,0,0,Why do we wash bath towels? Arent we clean when we use them?
94,669144390875480066,Tue Nov 24 13:23:49 +0000 2015,0,0,Lioness Killed Baboon. What She Did With The Baby Is Shocking! https://t.co/kbtf5T88Ik
95,669143810778099713,Tue Nov 24 13:21:31 +0000 2015,0,1,When we first met I had no idea you'd become this important to me.
96,669143250586877954,Tue Nov 24 13:19:17 +0000 2015,0,0,"Cheer Up, Coffee-Lovers! Here Are 15 Interesting Facts About Coffee That Will Make You Want To Drink More https://t.co/uX0w1HFPn3"
97,669142673488396288,Tue Nov 24 13:17:00 +0000 2015,0,0,If you have a headache do what it says on the aspirin bottle: Take two and KEEP AWAY FROM CHILDREN.
98,669142133949927424,Tue Nov 24 13:14:51 +0000 2015,0,0,Do You Wish To Go In A Real Pokemon World? After Seeing This Post You Won't! https://t.co/47wdrlTyPc
99,669141520453230594,Tue Nov 24 13:12:25 +0000 2015,0,0,Medical Staff................A Doctors cane
100,669141078109368321,Tue Nov 24 13:10:39 +0000 2015,0,0,When Taxidermy Goes Wrong In Every Possible NIGHTMARISH Ways!!! https://t.co/lqyTNDQf8S
101,669140534649163777,Tue Nov 24 13:08:30 +0000 2015,0,0,"Meet Claudia Alende: The Brazilian Megan Fox, But Even Hotter https://t.co/TZQVPlvMCq"
102,669139860028919808,Tue Nov 24 13:05:49 +0000 2015,0,0,19 Images That Show Just How Cool This World Really Is https://t.co/MoXk4sOnim
103,669139263749910528,Tue Nov 24 13:03:27 +0000 2015,1,0,13 Things Apple Store Employees Wish They Could Say To You But Can't https://t.co/sGm8qzb0bc
104,669138691558805505,Tue Nov 24 13:01:10 +0000 2015,0,0,What Lies Beneath The Easter Island Heads Is A Secret Hidden For Centuries...Until Now! https://t.co/FBy0jrw4x9
105,669138091043516416,Tue Nov 24 12:58:47 +0000 2015,0,0,These Are The Web Most Embarrassing Scenes That You Won't Believe Really Happened.. https://t.co/lue0PwdCfr
106,669137411520073728,Tue Nov 24 12:56:05 +0000 2015,0,0,Cats Have Nine Lives and so Do These People! How Did They Remain Alive After a Dangerous Fall?! https://t.co/DZ4ETBJ3tp
107,669136814511226880,Tue Nov 24 12:53:43 +0000 2015,0,0,Go ahead and carve Never gave a white BMW the right-of-way on my tombstone.
108,669136227828830209,Tue Nov 24 12:51:23 +0000 2015,0,0,Congratulations to Martin Luther King Jr. for having the only dream in history anyone actually wanted to hear about.
109,669135630530514944,Tue Nov 24 12:49:00 +0000 2015,0,0,That message felt like a great idea until I hit send...
110,669135057857024001,Tue Nov 24 12:46:44 +0000 2015,0,1,Why do they call it rush hour when nothing moves
111,669134475494686721,Tue Nov 24 12:44:25 +0000 2015,0,0,Ill do a lot of things for money but I draw the line at working.
112,669133956789366784,Tue Nov 24 12:42:21 +0000 2015,0,0,These 25 Awesome Facts Will Keep You Asking For More! https://t.co/241R9dWSJU
113,669133355984666625,Tue Nov 24 12:39:58 +0000 2015,0,0,Crows Troll Animals By Pulling Their Tails https://t.co/jMbCewmqSr
114,669133346820087810,Tue Nov 24 12:39:56 +0000 2015,0,0,18 Puns That Are Just So Corny It Will Force You To Smile https://t.co/Qym4h2774z
115,669132747365945344,Tue Nov 24 12:37:33 +0000 2015,0,0,Only Genius People Could Think Of Solving Problems Outside The Box Like That! https://t.co/lcCBkpqVSJ
116,669132179180417024,Tue Nov 24 12:35:18 +0000 2015,0,0,I always find shit out. I might not say it right away but I know.
117,669131587791929345,Tue Nov 24 12:32:57 +0000 2015,0,1,American Airlines saved $40000 in 1987 by eliminating one olive from each salad served in first-class.
118,669131029072904192,Tue Nov 24 12:30:43 +0000 2015,0,0,We Have Found The Lost Boys! Check Out What They Look Like Now (Hook) https://t.co/2z0SbdVQJK
119,669130451060064256,Tue Nov 24 12:28:26 +0000 2015,0,0,"Cookie Monster Has A Secret To Tell, And It's Appearing In Everyday Objects! https://t.co/Cvk0WO4Ieo"
120,669129730671558656,Tue Nov 24 12:25:34 +0000 2015,0,0,These 7 Mysterious Things That've Been Found On Earth Can't Be Explained https://t.co/KLSY4pSM62
121,669129156450385921,Tue Nov 24 12:23:17 +0000 2015,0,0,Theres no stronger sunscreen than sitting at the bar.
122,669128557050785793,Tue Nov 24 12:20:54 +0000 2015,0,0,10 Awesome Fashion Hacks Everyone Need To Know https://t.co/cJbcn08wnB
123,669127965104455680,Tue Nov 24 12:18:33 +0000 2015,0,0,What Cakes Have To Say On Life's Awkward Moments. https://t.co/aWhb3ZUgLy
124,669127409786974208,Tue Nov 24 12:16:20 +0000 2015,0,0,These Famous Structures Of The World Are Actually Burial Places - Know The Dark Truth Now! https://t.co/k7mc2Vj0Za
125,669126890871918592,Tue Nov 24 12:14:17 +0000 2015,0,0,I win every argument… in my head… later that day… in the shower.
126,669126182462341120,Tue Nov 24 12:11:28 +0000 2015,0,0,They say that money cant buy you happiness but being broke buys you nothing...
127,669125558568009728,Tue Nov 24 12:08:59 +0000 2015,0,0,Im tired of things costing money.
128,669124957033463808,Tue Nov 24 12:06:36 +0000 2015,0,0,21 People That Are Genius At Redneck Engineering! https://t.co/RDDGVwDK6p
129,669124104008564736,Tue Nov 24 12:03:12 +0000 2015,0,0,What These Crazy Fanatics are Wearing will Drive You Nuts. What's Happening to Fashion These Days..?! https://t.co/Mof9h7epK8
130,669123511932223488,Tue Nov 24 12:00:51 +0000 2015,0,0,If God didnt want man to eat pussy then why did he shape it like a taco?
131,669122893112999936,Tue Nov 24 11:58:24 +0000 2015,0,0,Im down to about 6 people on earth who I actually enjoy spending longer than 15 minutes with.
132,669122306011037696,Tue Nov 24 11:56:04 +0000 2015,0,0,22 Of The Biggest A-holes You'd Wish Not To Meet https://t.co/29YPb8pE8M
133,669121455058087936,Tue Nov 24 11:52:41 +0000 2015,0,0,Look at These Church Signs. They're Simply Religiously Hilarious! https://t.co/ajluCFb8TM
134,669118399172112384,Tue Nov 24 11:40:32 +0000 2015,0,0,12 Hilarious Facebook Typos and Errors You Are Going To Enjoy Reading https://t.co/egiZBX5TOV
135,669117564958564352,Tue Nov 24 11:37:13 +0000 2015,0,0,23 Weird Drawings Drawn by Children..#3 Is Horrifying! https://t.co/bQ8GWd1iH8
136,669116851532595200,Tue Nov 24 11:34:23 +0000 2015,0,0,Will poor helpless George Clooney ever find love? - Tabloid headline if George Clooney was a woman
137,669115983940882432,Tue Nov 24 11:30:56 +0000 2015,1,1,I told you Ill be ready in 5 minutes stop asking me every half hour. -Every Woman
138,669115400961982466,Tue Nov 24 11:28:37 +0000 2015,0,0,Every workplace Hanukkah display screams We legally had to do this.
139,669114583815077888,Tue Nov 24 11:25:22 +0000 2015,0,0,If the Kennedy assassination happened today I cant even imagine which emoticon kids would use to properly convey their shock.
140,669113852328448000,Tue Nov 24 11:22:28 +0000 2015,0,0,Are You Game for These Horrors? Let's See! https://t.co/9Y52lBYezl
141,669112997155987456,Tue Nov 24 11:19:04 +0000 2015,0,0,Every rappers laptop should have a $ sign where the S key goes.
142,669112323005542400,Tue Nov 24 11:16:23 +0000 2015,0,0,18 Things That Proved Luck Can Happen To Anyone https://t.co/czNSiyXevC
143,669111489836388352,Tue Nov 24 11:13:05 +0000 2015,0,0,Is ugh an emotion? Because I feel it all the time...
144,669110841816444928,Tue Nov 24 11:10:30 +0000 2015,0,0,18 Of The Most Awesome And Unique Baby Announcements Ever! https://t.co/KuLb5WYRxg
145,669110133641744384,Tue Nov 24 11:07:41 +0000 2015,0,0,Your Favorite Cartoons Are Taking Over Our Faces - Incredible Art! https://t.co/XrMceeNBVz
146,669109435365650432,Tue Nov 24 11:04:55 +0000 2015,0,0,Raccoons Sharing Their Hidden Talents with the World https://t.co/Qk8xLi8MF0
147,669108784443187200,Tue Nov 24 11:02:20 +0000 2015,0,0,You should be required to read a book for every 10 selfies you take.
148,669107939479674880,Tue Nov 24 10:58:58 +0000 2015,0,0,"When You See These 15 Facts About Food, Your Opinion About Foods Will Be Changed Forever. https://t.co/qrYNpvJUaP"
149,669107210056658945,Tue Nov 24 10:56:04 +0000 2015,0,0,There are two theories to arguing with a woman. Neither one works.
150,669106346134888448,Tue Nov 24 10:52:38 +0000 2015,0,0,18 Of The Most Inappropriate Ways To Celebrate Halloween https://t.co/KWCcSHYhtA
151,669105676342308864,Tue Nov 24 10:49:59 +0000 2015,0,0,Are these your eyeballs I found them in my cleavage.
152,669104875486121984,Tue Nov 24 10:46:48 +0000 2015,0,0,Pitbulls entire career could come crashing down if one day he wakes up and no longer wants to party.
153,669104217647255553,Tue Nov 24 10:44:11 +0000 2015,0,0,Im tired of all this nonsense about beauty being only skin-deep. Thats deep enough. What do you want an adorable pancreas
154,669103288676036608,Tue Nov 24 10:40:30 +0000 2015,0,0,Suicidal twin kills sister by mistake!
155,669102647526363136,Tue Nov 24 10:37:57 +0000 2015,0,0,"These Smart and Creative Packaging Designs, Will Make Us Want to Buy These Products ASAP! https://t.co/nSZflVe6mb"
156,669101850184978432,Tue Nov 24 10:34:47 +0000 2015,0,0,11 Unbelievably Ridiculous Names That Prove Parents Can Be So Cruel https://t.co/pGD4aVsUth
157,669101060426829824,Tue Nov 24 10:31:38 +0000 2015,0,0,Timing Is Everything - Images That Will Surely Blow Your Mind! Espacially #5. https://t.co/Xz8obpotGy
158,669100348049494017,Tue Nov 24 10:28:48 +0000 2015,0,0,They May Look Like Scary Aliens But They Reside Deep In The Sea! https://t.co/d9aUH6t0WY
159,669099654894653440,Tue Nov 24 10:26:03 +0000 2015,0,0,Youre never too old to say something inappropriate.
160,669098847478480896,Tue Nov 24 10:22:51 +0000 2015,0,0,What did you do? Genocide. You? I shared a 10 Funniest Autocorrect FAILS on Facebook. - Conversations in Hell
161,669098151567998977,Tue Nov 24 10:20:05 +0000 2015,0,0,19 Ridiculously Inappropriate Family Members Who Need To Not https://t.co/6f7GIjOp44
162,669097242746228736,Tue Nov 24 10:16:28 +0000 2015,0,0,26 Geniuses Who Tread the Fine Line Between Laziness and Convenience https://t.co/xqTql1o2Gf
163,669096583917531136,Tue Nov 24 10:13:51 +0000 2015,0,0,I dont trust anything that bleeds for five days and doesnt die.
164,669095688433627136,Tue Nov 24 10:10:17 +0000 2015,0,0,Happy Being Adult? After Seeing This You Will Wish To Be A Kid Again https://t.co/2mB8YdMQU3
165,669095067584303104,Tue Nov 24 10:07:49 +0000 2015,0,0,The 22 Most Artistic Snowmen People Have Ever Made! https://t.co/woqNGJWidW
166,669094174344417280,Tue Nov 24 10:04:16 +0000 2015,0,0,These Brilliant College Hacks Makes You Wonder Why You Have Never Knew About Them https://t.co/ADqCMi9mSB
167,669093476949078016,Tue Nov 24 10:01:30 +0000 2015,0,0,Recipe for laughter: Step 1: Mix parent with technology. Step 2: Sit back and laugh.
168,669092670036307968,Tue Nov 24 09:58:18 +0000 2015,0,0,After all is said and done a lot more will be said than done.
169,669091806861131777,Tue Nov 24 09:54:52 +0000 2015,0,0,23 Of The Funniest Tumblr Posts You Can Find In The Interwebs https://t.co/xNjEJrzKv7
170,669091139182419968,Tue Nov 24 09:52:13 +0000 2015,0,0,Whoa! Aren't These The Most Hilarious Senior Yearbook Quotes Ever? https://t.co/2Sp2KRK92C
171,669090463538765824,Tue Nov 24 09:49:32 +0000 2015,0,0,15 Seriously Freaky Playgrounds That Need To Be Shut Down ASAP https://t.co/D4YIvpdWCx
172,669089708819910656,Tue Nov 24 09:46:32 +0000 2015,0,0,18 Face-Palming and funny headline fails you'll want to see on your newspaper https://t.co/WM5VruyOeV
173,669088974544109568,Tue Nov 24 09:43:37 +0000 2015,0,0,Before And After Faces Of Meth! You Will Regret Their Choice For Sure! https://t.co/shNXr9k6JN
174,669088162757545984,Tue Nov 24 09:40:23 +0000 2015,0,0,20 Images Showing How Teens Have Changed In 20 Years https://t.co/zPx5BnuuCG
175,669087473406885888,Tue Nov 24 09:37:39 +0000 2015,0,0,Obamas teleprompter just says Youre the man. Wing it.
176,669086722630615040,Tue Nov 24 09:34:40 +0000 2015,0,0,Alright Internet you win. Im annoyed by everyone. Can I have my life back now?
177,669086005849227264,Tue Nov 24 09:31:49 +0000 2015,0,0,Atheism is basically worshipping yourself for having a super unique take on organized religion right?
178,669085253248520192,Tue Nov 24 09:28:50 +0000 2015,0,0,You know youre getting old when you have to have a drink to motivate you to go out and; have a drink.
179,669084508986064896,Tue Nov 24 09:25:52 +0000 2015,0,0,You Would Not Want To Work With Sharp Objects Again After Seeing These Freaky X-Rays! https://t.co/lrGZa5EJRr
180,669083675544256512,Tue Nov 24 09:22:33 +0000 2015,0,0,Incomprehensible GIFs That Are Exclusively Japanese https://t.co/dXgu0lkTfT
