,id_str,created_at,retweet_count,favorite_count,text
0,629165489541873665,Thu Aug 06 05:41:56 +0000 2015,1,3,Open ended maths questions evoke rich conversations  #LLCAus
1,629122012531666944,Thu Aug 06 02:49:10 +0000 2015,2,3,Encourage children to ask questions. Any questions. Encourage them to never stop challenging the world in which they live #LLCAus
2,629108708077801476,Thu Aug 06 01:56:18 +0000 2015,3,4,Saying you don't know fuels the fire to find out #llcaus
3,629106512145702913,Thu Aug 06 01:47:35 +0000 2015,4,6,How do we ensure children realise the value of talking to others to create and build their personal knowledge #llcaus
4,628915072237092864,Wed Aug 05 13:06:52 +0000 2015,0,3,Looking forward to Love Learning Conference tomorrow #LLCAus
5,626619160638787584,Thu Jul 30 05:03:44 +0000 2015,0,1,#4literacyresourcesmodel http://t.co/5Ec8VgcPsu
