,id_str,created_at,retweet_count,favorite_count,text
0,669061508949635072,Tue Nov 24 07:54:28 +0000 2015,0,0,@gayintheuk_net Hi there! If you need help reaching your fundraising goal then please visit https://t.co/V9ssqX1b0V &amp; we can start ASAP!
1,669061472169758720,Tue Nov 24 07:54:20 +0000 2015,0,0,@AhilyaTrust Hi there! If you need help reaching your fundraising goal then please visit https://t.co/V9ssqX1b0V &amp; we can start ASAP!
2,669011369640001536,Tue Nov 24 04:35:14 +0000 2015,1,0,Click here to support #Therapy Room for Roger by @charlablair78 - https://t.co/NUTSVxMCoL #crowdfunding https://t.co/Xe9xGdf4YK
3,669008871650934785,Tue Nov 24 04:25:19 +0000 2015,0,0,"DEAF Basketball Team- The Flames 
https://t.co/AjMnn4BxVN 
@HHKCED https://t.co/nLD8b8epOx"
4,669007623744786432,Tue Nov 24 04:20:21 +0000 2015,0,0,"Disney Competition 
https://t.co/oYY7wXFMea 
@tony2166 https://t.co/hNB3Hwkaqv"
5,669006359313162240,Tue Nov 24 04:15:20 +0000 2015,1,1,"Help homeless man https://t.co/sHUo7nWDpn 
@JohnMej27385124 https://t.co/gUQKwCN1Vv"
6,669005128301682689,Tue Nov 24 04:10:26 +0000 2015,0,0,TAKING TERRITORY FOR CHRIST Donate Here: https://t.co/z6mqDhEOeR @OracleStevie https://t.co/Hh3V0sPNkW
7,669002660683608065,Tue Nov 24 04:00:38 +0000 2015,0,0,Greenhouse fund:  https://t.co/CL2rRA85jc @Quasymoto https://t.co/nMCC6tFVbi
8,669002498594639872,Tue Nov 24 03:59:59 +0000 2015,0,0,@CharSumnerAllen Hi there! If you need help reaching your fundraising goal then please visit https://t.co/V9ssqX1b0V &amp; we can start ASAP!
9,669000085334835202,Tue Nov 24 03:50:24 +0000 2015,1,0,PLEASE HELP EQUINE THERAPY FOR VETERANS WITH PTSD https://t.co/NcgVJWit56  @GoFundVeterans https://t.co/TLSTdhZHn3
10,669000065298599936,Tue Nov 24 03:50:19 +0000 2015,0,0,Expanding Learning Experiences https://t.co/HwK2BEASIH        @MMarquit https://t.co/7TuZoQoqTz
11,668997519163170817,Tue Nov 24 03:40:12 +0000 2015,0,0,"Medical expenses after accident Donate: https://t.co/RhPKnYFdcF 
@dtraffanstedt21 https://t.co/H3lwNLN2EW"
12,668996304324923392,Tue Nov 24 03:35:22 +0000 2015,0,1,Let's Stop Cyber Bullying! https://t.co/HsJdD0D234 @AntonioBavaro4 https://t.co/iVVwYvveTY
13,668996294011199489,Tue Nov 24 03:35:20 +0000 2015,0,0,Click here to support HOPE for Future #Warriors by @TDShowcase - https://t.co/kU04Ch9q1C  #pelicans https://t.co/GQeuWPRihY
14,668995086525575169,Tue Nov 24 03:30:32 +0000 2015,0,1,Click here to support Divorce / Job loss / 2 Boys by @FLASHGORDON1963 - https://t.co/Altnt5gEaR https://t.co/8dWfbWosEv
15,668995041587761154,Tue Nov 24 03:30:21 +0000 2015,0,0,Click here to support sharief's medical an living expense by @kittykat2515 -    #app #victo… https://t.co/CbiMFxOHb5 https://t.co/saIxFF1A9S
16,668995008045916160,Tue Nov 24 03:30:13 +0000 2015,0,0,Imari's Secret Santa Mission. Please Donate Here: https://t.co/LGuGtBt49r @RahamanMuhammad https://t.co/RZkK2zvrxb
17,668993741336748032,Tue Nov 24 03:25:11 +0000 2015,0,0,Please Help Alex Angels https://t.co/MclXf3F083 @ChristyHoneycu2 https://t.co/3HMvJdULID
18,668993732159631361,Tue Nov 24 03:25:09 +0000 2015,1,0,Click here to support Samson's Emergency Surgery  by @JakeSolima - https://t.co/Sc9w5OlEnv https://t.co/NpiT0bcfUH
19,668992554281644032,Tue Nov 24 03:20:28 +0000 2015,0,0,"Mariah bills https://t.co/j8hs7x12x4 
@cbills75 https://t.co/7rYGT56aYX"
20,668992457061883904,Tue Nov 24 03:20:05 +0000 2015,0,0,#OneMillionWidows &amp; Modern Widows Club Campaign https://t.co/vyiUgNJNxK @mooralive https://t.co/I1KgbarKai
21,668991267041333248,Tue Nov 24 03:15:21 +0000 2015,0,1,Click here to support #Heroes Outreach #Program (HOPe) by @HeroesOutreach - https://t.co/s3BNVDvZBa https://t.co/GqnEhKfi5R
22,668991263782207488,Tue Nov 24 03:15:21 +0000 2015,0,0,Mary's Smile https://t.co/VXu7i4kec3 @rlpatt1967 https://t.co/HGgjedZnSs
23,668991251463733248,Tue Nov 24 03:15:18 +0000 2015,0,0,"Heather to Healthy https://t.co/VEGNEM0Kq7 
@cbills75 https://t.co/CGGkQ61GnE"
24,668989982288269314,Tue Nov 24 03:10:15 +0000 2015,1,0,"Help make it happen for LifeWatch: SOS, GPS, LifeWatch personal concierge by @IGlobal22    … https://t.co/yLcfWpqxrw https://t.co/k33BEC4nwv"
25,668988713012174848,Tue Nov 24 03:05:13 +0000 2015,0,0,"World innovating Smartphone App 
Tap here to hep: https://t.co/3z8YCw04IR 
@Heem_Scheme https://t.co/bfAi29EZxz"
26,668987636732862464,Tue Nov 24 03:00:56 +0000 2015,1,0,Click here to support Please Help Us Get A #Home by @LifeBeginsAt220 - https://t.co/UKHjdOgJ25 #trust https://t.co/woM0LIeRuB
27,668986195830009856,Tue Nov 24 02:55:12 +0000 2015,0,0,"Following the Dream, Live and Dance in the USA   donate Here: https://t.co/pgBZCzTIQc 
@2Rise4 https://t.co/oisJYGwRyq"
28,668984954425094144,Tue Nov 24 02:50:16 +0000 2015,0,0,Keep my tiny over taxed townhouse https://t.co/V8ShtOCc00 @simraptor1 https://t.co/K4eGjFGn4a
29,668984951208058880,Tue Nov 24 02:50:16 +0000 2015,0,1,Disabled Vet.Trying To Get MBA/PhD https://t.co/8zlQ0R2Jan        @Reggie91210 https://t.co/57jqT6Ojg1
30,668983774009556992,Tue Nov 24 02:45:35 +0000 2015,0,0,Get Carl out Of Poverty Fund https://t.co/NkkhpYgPC7        @hi1714 https://t.co/W3TiWDOWZ7
31,668983702278561792,Tue Nov 24 02:45:18 +0000 2015,0,0,Cheri's Oxygen Fund https://t.co/hQ7FDIwjTb @CheriWentzel https://t.co/mxmoZzjFTG
32,668983702131761152,Tue Nov 24 02:45:18 +0000 2015,0,0,dj @noahsaltz.com Help support my 2016 debut studio album 'Gone With Me' https://t.co/rjbwixQlAY https://t.co/5KPwqhtNzv
33,668983680627535873,Tue Nov 24 02:45:13 +0000 2015,0,0,Help With Furniture https://t.co/onHvcHpRnQ @susan_suek https://t.co/An71l5Dl5x
34,668982490405715968,Tue Nov 24 02:40:29 +0000 2015,1,0,Money #Marathon - Infinite Runner - #iOS and Droid Mobile Game @NNterprises - Click here https://t.co/SXfck6XVrz ☺ https://t.co/A0eFgomp6H
35,668982490149842944,Tue Nov 24 02:40:29 +0000 2015,1,0,Adopting three beautiful siblings https://t.co/3B4heqjGl0        @bmeans https://t.co/zdX1At3386
36,668982480238714880,Tue Nov 24 02:40:27 +0000 2015,0,0,Click here to support #Army Vet Father Of 5 Please Help  by @suzannebabygirl - https://t.co/WZjuKDyCJw  #military https://t.co/SYpngUYZh5
37,668982468133953538,Tue Nov 24 02:40:24 +0000 2015,1,1,"#Chef Daniel Dormer's Medical Bills https://t.co/q8BAmoEFZg 
@ScorpCCW https://t.co/0jW2jy8PpR"
38,668982440795484160,Tue Nov 24 02:40:17 +0000 2015,0,1,Mo's Dysautonomia &amp; POTS Fundraiser   https://t.co/94ASVmnfpV        @oshibkibozhyego https://t.co/jahCqJRbzb
39,668981185364774912,Tue Nov 24 02:35:18 +0000 2015,0,0,Jay Rhodes' fight for his future https://t.co/lzRW943Rbj        @missQ9 https://t.co/Lj9yfn4r3v
40,668980028294701057,Tue Nov 24 02:30:42 +0000 2015,0,0,Combat Wounded Coalition GWR Donate Here https://t.co/rkOgtcwy0d @BlackbeltSkydiv https://t.co/rItjsmwkGp
41,668979657853632512,Tue Nov 24 02:29:14 +0000 2015,0,0,@FlexSolar2015 Hi there! If you need help reaching your fundraising goal then please visit https://t.co/V9ssqX1b0V &amp; we can start ASAP!
42,668978693709160448,Tue Nov 24 02:25:24 +0000 2015,0,0,Handicap Van &amp; Equipment Funding https://t.co/iXu6xTbGaJ        @regionalrealtor https://t.co/ZrxW0HT1De
43,668978675589783552,Tue Nov 24 02:25:19 +0000 2015,0,0,Click here to support Sustaining culture through #food by @amada670 -https://t.co/PoIdblntQ8   #organically https://t.co/j4VVxo9gyQ
44,668978652701458432,Tue Nov 24 02:25:14 +0000 2015,1,1,SHINE Winter 2016 https://t.co/EjhT45fYIq @future_covergrl https://t.co/Y8KNDxW8dx
45,668977456225865728,Tue Nov 24 02:20:29 +0000 2015,0,0,Josh Laepple Kids College Fund https://t.co/OPo1La9pyE        @andybdecker https://t.co/ywZ5upvY4k
46,668977454522986496,Tue Nov 24 02:20:28 +0000 2015,0,0,Click here to support lost job - cursing out terrorist by @fitznpepper - https://t.co/FwoG5Saimh https://t.co/Q4lYfFpKkV
47,668977446373474304,Tue Nov 24 02:20:26 +0000 2015,0,0,Change Young Lives with Flipside's social circus https://t.co/nzB60Liz98 @FlipsideCircus https://t.co/Ty0qRGqGAD
48,668976226611130370,Tue Nov 24 02:15:36 +0000 2015,0,0,"Please help ""Life saving treatment for Amanda"" . Thank you. #RT #Donate https://t.co/Zvp8SlC6Pc @CarmenAmoros https://t.co/wuNBKd1N6s"
49,668976224077750273,Tue Nov 24 02:15:35 +0000 2015,0,0,Click here to support Thomas C. Deputy loving #Kids by @DDeputy52 - https://t.co/1Gd9iSYDXC  #paloalto https://t.co/jRPQy9PkcZ
50,668976177323909120,Tue Nov 24 02:15:24 +0000 2015,0,0,Click here to support Fund Raiser for Custody of my #girls by @leonardoolan78 - https://t.co/kcnupbbFos https://t.co/EbTWrXfauU
51,668974963525840897,Tue Nov 24 02:10:34 +0000 2015,0,0,Return home for treatment https://t.co/2d2IPRlkp3        @TLHighbaugh https://t.co/asqHBrDBCH
52,668974915119390720,Tue Nov 24 02:10:23 +0000 2015,0,0,Buddy Bench Aware Ireland Donate here: https://t.co/xZJepSZ9gh @buddybenchire https://t.co/uHNC2elRIB
53,668974083376214017,Tue Nov 24 02:07:05 +0000 2015,0,0,@makiyajackson5 Hi there! If you need help reaching your fundraising goal then please visit https://t.co/V9ssqX1b0V &amp; we can start ASAP!
54,668974046126542849,Tue Nov 24 02:06:56 +0000 2015,0,0,@revitusersirl Hi there! If you need help reaching your fundraising goal then please visit https://t.co/V9ssqX1b0V &amp; we can start ASAP!
55,668973989385994240,Tue Nov 24 02:06:42 +0000 2015,0,0,@deeptinarwat Hi there! If you need help reaching your fundraising goal then please visit https://t.co/V9ssqX1b0V &amp; we can start ASAP!
56,668973637333045248,Tue Nov 24 02:05:18 +0000 2015,0,0,Sam For Coryell County Commissioner https://t.co/NSNhmdD4w2 @samforprct1 https://t.co/sC390DWOA0
57,668973626830561280,Tue Nov 24 02:05:16 +0000 2015,1,0,House Fire Victims Need Your Help Donate Here: https://t.co/SUOD4CjCPt @sassy_cat2010 https://t.co/7wDT4Bx2oC
58,668972518594748416,Tue Nov 24 02:00:51 +0000 2015,0,0,Legal Fund:Stop Unlicensed Motorist https://t.co/xuwr5ZnzC2        @Foxy3939 https://t.co/FP5EVAudd5
59,668971113683267588,Tue Nov 24 01:55:17 +0000 2015,0,0,"Alto Stand, The modern minimal standing desk https://t.co/0L9wvZudPb        @by_rldh https://t.co/YB9Ms3snCR"
60,668970339226034176,Tue Nov 24 01:52:12 +0000 2015,0,0,"Alto Stand, The modern minimal standing desk https://t.co/0L9wvZudPb        @by_rldh https://t.co/dOYnIaGQ8d"
61,668969887675588609,Tue Nov 24 01:50:24 +0000 2015,0,0,"Truck Bed Covers, Cargo Net, Accessories &amp; Custom Cargo Solutions https://t.co/R8Y39c4Yyw        @cargocatch https://t.co/1UC1iJxpuJ"
62,668969867547136000,Tue Nov 24 01:50:19 +0000 2015,0,2,Disabled Couple Needs A Kitchen &amp; Bathroom Remodel https://t.co/jyqFOilczf        @PPorter921 https://t.co/YGU23rorPo
63,668968607246864384,Tue Nov 24 01:45:19 +0000 2015,0,0,Jose Andres' Africa Mission Trip https://t.co/tFDy3eDw81 https://t.co/mxSFohjnK7
64,668968600301150208,Tue Nov 24 01:45:17 +0000 2015,0,0,Mom and Dad's House Fixes Fund https://t.co/ze28xGWEta        @iamSEBlack https://t.co/sVqmomzYuX
65,668968084011687940,Tue Nov 24 01:43:14 +0000 2015,0,1,FOR MY BOYS.. WE NEED A CAR!! https://t.co/DFtEgTJnvR        @GuankitaLinda https://t.co/87RI9socwe
66,668967812602454016,Tue Nov 24 01:42:10 +0000 2015,0,0,We're raising £500 to buy &amp; take 4 berth caravan to refugees in Calais https://t.co/1XyhTA4yEX        @katebodoano https://t.co/cQy5tmFDVN
67,668967349194727424,Tue Nov 24 01:40:19 +0000 2015,0,0,Julie's Medical Fund https://t.co/XDZRRfjO1k        @speedi449 https://t.co/v2nKy7hRZW
68,668967315288023040,Tue Nov 24 01:40:11 +0000 2015,0,0,Help Phil stay at Home https://t.co/bjkJvm7ArM @PhilFitz65 https://t.co/erx6Wrw6Mp
69,668966116614647808,Tue Nov 24 01:35:25 +0000 2015,0,0,Tim's new mobile chair https://t.co/98Getkfg9P @TimothyWMccubb1 https://t.co/9FZRHP2cpU
70,668964987566743552,Tue Nov 24 01:30:56 +0000 2015,0,0,"Please #donate to ""Fundraiser For CCEF!""  by @ahaynesccef - Click here to #support https://t.co/DDmckp52Fv #gofundme https://t.co/wkA6KFFhRq"
71,668964039171665920,Tue Nov 24 01:27:10 +0000 2015,0,0,Lucas Discipleship Training School https://t.co/lFs9mLFIfF        @Booher32L https://t.co/p2k1XFeBbs
72,668962718645223424,Tue Nov 24 01:21:55 +0000 2015,0,0,@AprilWay1 Hi there! If you need help reaching your fundraising goal then please visit https://t.co/V9ssqX1b0V &amp; we can start ASAP!
73,668961143336103936,Tue Nov 24 01:15:39 +0000 2015,0,0,Ballz Pancake Balls. Join the pancake revolution! https://t.co/tWgZ1me2dR        @ballzpancakes https://t.co/TIlU54qajE
74,668961064038629376,Tue Nov 24 01:15:21 +0000 2015,0,0,"Pams med bills, loss car, work, bankruptcy 
Donate Here Please https://t.co/0D6IaAqImQ 
@pjramr9497 https://t.co/9xAG5yucl7"
75,668960006381961216,Tue Nov 24 01:11:08 +0000 2015,0,0,Capabilities Community Center https://t.co/yfw8835UAq        @LisaJ22 https://t.co/pE4hdFZ3vQ
76,668959772318765056,Tue Nov 24 01:10:13 +0000 2015,0,0,The Dubreuil Assistance Fund https://t.co/gfi5AQsgnC        @Lawrence1956 https://t.co/MC3aR6NdRD
77,668959499571609601,Tue Nov 24 01:09:08 +0000 2015,0,1,Say OK to #Bitcoin and #OKCash https://t.co/WFQdf6XPr7        @OKcashOrator https://t.co/ImUsQnPfGL
78,668958564753502209,Tue Nov 24 01:05:25 +0000 2015,1,2,"Please help us get our home back! 
Tap Here: https://t.co/9xtLAUuboh 
@islandandeight https://t.co/kmrbFLHoGM"
79,668957684188729345,Tue Nov 24 01:01:55 +0000 2015,0,0,"Michelle's Study Abroad, https://t.co/jS0iLf63ck 
@Miche_AGP https://t.co/5SZtGeA2nO"
80,668957591947579392,Tue Nov 24 01:01:33 +0000 2015,0,0,Kidney Transplant Expenses for Both https://t.co/qafaEp4gmV        @irongoof https://t.co/8GHq7GPrZf
81,668955976452673536,Tue Nov 24 00:55:08 +0000 2015,0,0,CLICK HERE to support A New #Kind of Online #Art School @LChoiFineArts - https://t.co/nheUWoMoOg https://t.co/N6Pb61XNge
82,668954797148659716,Tue Nov 24 00:50:26 +0000 2015,0,0,Help Me to Help Others https://t.co/HXPgohilVT @lanajthomas57 https://t.co/30qszsJOOd
83,668953542653313024,Tue Nov 24 00:45:27 +0000 2015,0,0,Help me Save George https://t.co/i3sN3ZWT63 @toddkelsey77 https://t.co/a9bRJ5Jogy
84,668952313659265025,Tue Nov 24 00:40:34 +0000 2015,0,0,"GetMyWindow https://t.co/Tz2QsjOgNh 
@getmywindow #GetMyWindow https://t.co/OZHW9J7pxR"
85,668952311125975040,Tue Nov 24 00:40:34 +0000 2015,0,1,"Heather to Healthy, Donate here: https://t.co/VEGNEM0Kq7 @cbills75 https://t.co/yFtB6BGklW"
86,668952307669839872,Tue Nov 24 00:40:33 +0000 2015,2,1,Help Lisa Basler Fight Cancer https://t.co/0tGIeuz98v        @LisaBasler5 https://t.co/toVtVReFjb
87,668951052738260993,Tue Nov 24 00:35:34 +0000 2015,0,0,"#Support ""Geeleen's #Medical Fund"" by @carpnedi - 
Click here to donate https://t.co/AuoMGz22WT https://t.co/UrNEc0zvLe"
88,668949866790391809,Tue Nov 24 00:30:51 +0000 2015,0,0,"HoneyMoon! https://t.co/AfoPGdzgLX 
@jimoser37 https://t.co/sqZRz0vnYB"
89,668948516333559808,Tue Nov 24 00:25:29 +0000 2015,0,0,"#Support ""Help Tim Fight Lewy Body Dementia"" by @Gtschultz55 - Click here https://t.co/dgz0hQpJZ0 #gofundme https://t.co/HFlrVQQgbV"
90,668947243832078336,Tue Nov 24 00:20:26 +0000 2015,0,0,Fund my education https://t.co/FCJNVOanhG @pranee_reddy https://t.co/rujIbxZXf7
91,668944722094923776,Tue Nov 24 00:10:24 +0000 2015,0,1,Nanette's last trip with family https://t.co/tkVzA186fS @wina5859 https://t.co/4PDutLUflF
92,668942506898407425,Tue Nov 24 00:01:36 +0000 2015,0,0,Buddy Bench Aware Ireland https://t.co/xZJepSZ9gh @buddybenchire https://t.co/Q1OkVl3m1x
93,668940914086293505,Mon Nov 23 23:55:16 +0000 2015,1,0,"A New, Greener Life in Scotland https://t.co/ywZabD2co9 
@innateplethora https://t.co/xGoAytymVH"
94,668939680256286722,Mon Nov 23 23:50:22 +0000 2015,0,0,"Combat Wounded Coalition GWR 
Donate: https://t.co/rkOgtcwy0d @BlackbeltSkydiv https://t.co/1lDdtn5EMP"
95,668938476491055105,Mon Nov 23 23:45:35 +0000 2015,0,1,Click here to support #Heroes Outreach #Program (HOPe) by @HeroesOutreach - https://t.co/s3BNVDvZBa https://t.co/RPoxwbwvmz
96,668937242849611776,Mon Nov 23 23:40:41 +0000 2015,0,0,@danielle_hined Hi there! If you need help reaching your fundraising goal then please visit https://t.co/V9ssqX1b0V &amp; we can start ASAP!
97,668937133265031168,Mon Nov 23 23:40:15 +0000 2015,0,0,@sjinjiguyver Hi there! If you need help reaching your fundraising goal then please visit https://t.co/V9ssqX1b0V &amp; we can start ASAP!
98,668937106329243648,Mon Nov 23 23:40:09 +0000 2015,0,1,@beliebfamhelp Hi there! If you need help reaching your fundraising goal then please visit https://t.co/V9ssqX1b0V &amp; we can start ASAP!
99,668933371691683840,Mon Nov 23 23:25:18 +0000 2015,0,1,Click here to support sharief's medical an living expense by @kittykat2515 -    #app #victo… https://t.co/CbiMFxOHb5 https://t.co/6skWDTSxXx
100,668933343233351680,Mon Nov 23 23:25:11 +0000 2015,0,0,"98% Burnt Survivor https://t.co/FJuAUje1W7 
@markykola https://t.co/AFeZAZ0zD3"
101,668932172380807169,Mon Nov 23 23:20:32 +0000 2015,1,0,The #HankWasWorried #Kickstarter is here! Please join us as we tackle #Anxiety in a new way… https://t.co/tutwj4JaHE https://t.co/L5FQiD9gao
102,668930902777569281,Mon Nov 23 23:15:30 +0000 2015,0,0,Save our friends Help Here: https://t.co/txZnFXY5s9 @glennrobin2000 https://t.co/WSeRKp2Xj2
103,668928359234150400,Mon Nov 23 23:05:23 +0000 2015,0,0,"World innovating Smartphone App 
Donate Here: https://t.co/3z8YCw04IR 
@Heem_Scheme https://t.co/eLsi6jwC4s"
104,668927354912264193,Mon Nov 23 23:01:24 +0000 2015,1,2,Kyle's Family https://t.co/1aJenmy0Iz @farmboybeats https://t.co/OS0Yb44RJG
105,668925774460821504,Mon Nov 23 22:55:07 +0000 2015,0,0,EQUINE THERAPY FOR VETERANS WITH PTSD Donate Here: https://t.co/NcgVJWit56  @GoFundVeterans https://t.co/Nm9E20OE45
106,668924530866397184,Mon Nov 23 22:50:10 +0000 2015,0,0,Expanding Learning Experiences https://t.co/HwK2BEASIH        @MMarquit https://t.co/DzyI0ELTmX
107,668924521290833920,Mon Nov 23 22:50:08 +0000 2015,0,0,Kindra Compete @ National Dog Show https://t.co/KQIle4CYOF @cms_kls https://t.co/HYzM3aoesG
108,668924510402420740,Mon Nov 23 22:50:05 +0000 2015,1,1,Homeless Veteran Needs Help https://t.co/pL2NSPrsOm @BethHanscom https://t.co/2M0gKeQ0Bk
109,668923400560189440,Mon Nov 23 22:45:41 +0000 2015,0,0,"Michelle's Study Abroad, Help Here: https://t.co/jS0iLf63ck @Miche_AGP https://t.co/dKbH6NreyE"
110,668922053626564608,Mon Nov 23 22:40:20 +0000 2015,0,0,"TAKING TERRITORY FOR CHRIST https://t.co/z6mqDhEOeR 

@OracleStevie https://t.co/vg7CbXUDWi"
111,668922015752024064,Mon Nov 23 22:40:11 +0000 2015,0,1,Nathan's school Europe trip https://t.co/vZtZGBdN8I @rehinson https://t.co/T8H1WSGOFl
112,668920785659142144,Mon Nov 23 22:35:17 +0000 2015,0,0,"Pams med bills, loss car, work, bankruptcy Donate Here: https://t.co/0D6IaAqImQ @pjramr9497 https://t.co/auGFG1xRqT"
113,668919644317724678,Mon Nov 23 22:30:45 +0000 2015,0,0,My Business Journey https://t.co/FCCmCkqWUd @AffiliateMon201 https://t.co/iu3Wo6biiE
114,668918259446644736,Mon Nov 23 22:25:15 +0000 2015,0,0,Help kids make healthier choices https://t.co/Ek5SB10X1V  @glenharrison85 https://t.co/9cHLm652JR
115,668914518249054208,Mon Nov 23 22:10:23 +0000 2015,0,0,Helping the less Fortunate https://t.co/CZQ5aVzqLz @Cwil2944 https://t.co/CFAT64Tn67
116,668913296540631040,Mon Nov 23 22:05:32 +0000 2015,1,1,Brighter tomorrow https://t.co/AEdaD9skMf @Mandyylasalle https://t.co/SJUI9obqGn
117,668912313559326720,Mon Nov 23 22:01:37 +0000 2015,0,0,Greenhouse fund Donate Here: https://t.co/CL2rRA85jc @QUASYMOTO1 https://t.co/gLMDsoy1iL
118,668912220282187779,Mon Nov 23 22:01:15 +0000 2015,0,0,GetMyWindow Donate Here: https://t.co/Tz2QsjOgNh @getmywindow https://t.co/UsqnYtMkgR
119,668910707765850112,Mon Nov 23 21:55:15 +0000 2015,1,0,House Fire Victims Need Your Help Click here to help: https://t.co/SUOD4CjCPt @sassy_cat2010 https://t.co/jpHixhgDcB
120,668909473201803264,Mon Nov 23 21:50:20 +0000 2015,0,2,"Stop Cyber Bullying! Donate here https://t.co/HsJdD0D234
 @AntonioBavaro4 https://t.co/AwRGquEEZA"
121,668906978060668928,Mon Nov 23 21:40:25 +0000 2015,0,0,Help Holly to Not be Homeless https://t.co/GIs51hkPVx @hhunter37 https://t.co/f4e25YU1bL
122,668905652551557120,Mon Nov 23 21:35:09 +0000 2015,0,1,Mo's Dysautonomia &amp; POTS Fundraiser   https://t.co/94ASVmnfpV        @oshibkibozhyego https://t.co/rmVnWEfFYS
123,668904593590460416,Mon Nov 23 21:30:57 +0000 2015,0,0,Help With Furniture https://t.co/onHvcHpRnQ @susan_suek https://t.co/VxuCxXYWyU
124,668903151030935552,Mon Nov 23 21:25:13 +0000 2015,0,0,Legal Fund:Stop Unlicensed Motorist https://t.co/xuwr5ZnzC2        @Foxy3939 https://t.co/zFIYonGzdI
125,668900752971145216,Mon Nov 23 21:15:41 +0000 2015,2,2,Prayers for Katie &amp; Baby Camille https://t.co/FzKLnmxZqA @momma_moral https://t.co/dv8n7AK4kH
126,668899393836290048,Mon Nov 23 21:10:17 +0000 2015,0,0,Helps and save dogs in Thailand https://t.co/nN0odiIURe @daniele_penna https://t.co/gfVW4BVSUg
127,668899363347955712,Mon Nov 23 21:10:10 +0000 2015,0,0,Click here to support Divorce / Job loss / 2 Boys by @FLASHGORDON1963 - https://t.co/Altnt5gEaR https://t.co/ZPmkHsIZLW
128,668898267829313542,Mon Nov 23 21:05:49 +0000 2015,0,1,Loving Memory Thomas &amp; Kids https://t.co/1Gd9iSYDXC @DDeputy52 https://t.co/xg0vpMHS6O
129,668898208370860033,Mon Nov 23 21:05:35 +0000 2015,0,0,Julie's Medical Fund https://t.co/XDZRRfjO1k        @speedi449 https://t.co/bB0IUw1xtO
130,668898155333869568,Mon Nov 23 21:05:22 +0000 2015,0,0,Get Carl out Of Poverty Fund https://t.co/NkkhpYgPC7        @hi1714 https://t.co/dZOqdXGtXO
131,668897266946727936,Mon Nov 23 21:01:50 +0000 2015,0,0,Return home for treatment https://t.co/2d2IPRlkp3        @TLHighbaugh https://t.co/PIV7W0rO8M
132,668897237594935301,Mon Nov 23 21:01:43 +0000 2015,1,1,The Luminous Vintage Electronic Bargraph Clock https://t.co/yKkWPSRjNA @nuvitron https://t.co/5stbn9Pwqf
133,668895683332689920,Mon Nov 23 20:55:33 +0000 2015,0,0,LA Extreme Football and Cheer https://t.co/KC4tQvQciy @tabjones01 https://t.co/IvlN8o5wq5
134,668893209498636289,Mon Nov 23 20:45:43 +0000 2015,0,0,dj @noahsaltz Help support my 2016 debut studio album 'Gone With Me' https://t.co/9USWsDRcnl https://t.co/npLRcVvcDQ
135,668893179584913408,Mon Nov 23 20:45:36 +0000 2015,0,0,"Help make it happen for LifeWatch: SOS, GPS, LifeWatch personal concierge by @IGlobal22    … https://t.co/yLcfWpqxrw https://t.co/27bMH2wrdt"
136,668893093178032128,Mon Nov 23 20:45:15 +0000 2015,0,0,Give Jimmy Williams some peace https://t.co/GkcUBuBHD4 @terrylynn1958i https://t.co/clH9QNy76C
137,668891926117146629,Mon Nov 23 20:40:37 +0000 2015,0,0,Cheri's Oxygen Fund https://t.co/hQ7FDIwjTb @CheriWentzel https://t.co/ULVHPj1hzn
138,668891899168714756,Mon Nov 23 20:40:30 +0000 2015,0,0,Handicap Van &amp; Equipment Funding https://t.co/iXu6xTbGaJ        @regionalrealtor https://t.co/60Y3jV8nbn
139,668890618047918082,Mon Nov 23 20:35:25 +0000 2015,0,1,#OneMillionWidows and Modern Widows Club Campaign https://t.co/vyiUgNJNxK @mooralive https://t.co/1ifV2GMjuS
140,668890564553777156,Mon Nov 23 20:35:12 +0000 2015,0,0,Jay Rhodes' fight for his future https://t.co/lzRW943Rbj        @missQ9 https://t.co/j48oFdxu74
141,668889566758232065,Mon Nov 23 20:31:14 +0000 2015,1,0,Click here to support Please Help Us Get A #Home by @LifeBeginsAt220 - https://t.co/UKHjdOgJ25 #trust https://t.co/VKIHCyiuBz
142,668889556138242048,Mon Nov 23 20:31:12 +0000 2015,1,0,Disabled Vet.Trying To Get MBA/PhD https://t.co/8zlQ0R2Jan        @Reggie91210 https://t.co/xdwEcWcQsv
143,668889432607559680,Mon Nov 23 20:30:42 +0000 2015,0,0,Shayntrice's Fund for College! https://t.co/x9B71uEoaZ @Lady__Shay https://t.co/RTpsdvW33B
144,668888999809806336,Mon Nov 23 20:28:59 +0000 2015,0,0,@claudiorgomez Hi there! If you need help reaching your fundraising goal then please visit https://t.co/V9ssqX1b0V &amp; we can start ASAP!
145,668888119190691841,Mon Nov 23 20:25:29 +0000 2015,0,0,Click here to support HOPE for Future #Warriors by @TDShowcase - https://t.co/kU04Ch9q1C  #pelicans https://t.co/d1iSbO3DEI
146,668888102614749184,Mon Nov 23 20:25:25 +0000 2015,0,0,Help homeless man https://t.co/sHUo7nWDpn @JohnMej27385124 https://t.co/oOdUIEu4zO
147,668888079093121024,Mon Nov 23 20:25:20 +0000 2015,0,0,"Truck Bed Covers, Cargo Net, Accessories &amp; Custom Cargo Solutions https://t.co/R8Y39c4Yyw        @cargocatch https://t.co/WnsrEkCJ8U"
148,668886887390707713,Mon Nov 23 20:20:35 +0000 2015,0,0,Click here to support lost job - cursing out terrorist by @fitznpepper - https://t.co/FwoG5Saimh https://t.co/If2DHut6h3
149,668886811272462337,Mon Nov 23 20:20:17 +0000 2015,1,1,"Please help us get our home back! 
Donate Here Please: https://t.co/9xtLAUuboh 
@islandandeight https://t.co/RcKl8Dnfxn"
150,668885686750191616,Mon Nov 23 20:15:49 +0000 2015,0,0,Click here to support Thomas C. Deputy loving #Kids by @DDeputy52 - https://t.co/1Gd9iSYDXC  #paloalto https://t.co/AKtBHfGWzJ
151,668885685777113088,Mon Nov 23 20:15:49 +0000 2015,0,0,3 surgerys https://t.co/sSFMOoZnwm @BusterLombard https://t.co/iM91L2vMDD
152,668885661177483264,Mon Nov 23 20:15:43 +0000 2015,0,0,Mr. Foster's Class Fundraiser https://t.co/CDZf4Rwak6 @dfos84 https://t.co/RGyGKr5M8x
153,668884537884192768,Mon Nov 23 20:11:15 +0000 2015,1,0,"Please help ""Life saving treatment for Amanda"" . Thank you. #RT #Donate https://t.co/Zvp8SlC6Pc @CarmenAmoros https://t.co/v2EAvU7Zsx"
154,668884413057531908,Mon Nov 23 20:10:46 +0000 2015,0,0,Click here to support Fund Raiser for Custody of my #girls by @leonardoolan78 - https://t.co/kcnupbbFos https://t.co/oZoAqow6Oo
155,668883115063050240,Mon Nov 23 20:05:36 +0000 2015,0,0,Video Course - Write and publish a novel with me  https://t.co/JB6qxhzPus @AuthorLen https://t.co/VObBKiDn0T
156,668883089549041664,Mon Nov 23 20:05:30 +0000 2015,0,0,"Click here to #support ""Help my friend come home!"" by @JosephD70598929 - https://t.co/89vKxKKxYj #donate #gofundme https://t.co/V47aHosrOB"
