,id_str,created_at,retweet_count,favorite_count,text
148,659923985472311296,Fri Oct 30 02:45:13 +0000 2015,0,5,SEO Worksheet For Etsy Sellers | #seo #etsy https://t.co/3LtERMDxsI https://t.co/lMmWyCFFJK
149,659905095405031424,Fri Oct 30 01:30:09 +0000 2015,0,0,"Accountant Marketing, Gifts For Accountants | Jewelers Glass Pendant #accounting https://t.co/OloX5MX9SO https://t.co/A8P0YL9hgJ"
150,659821230824927232,Thu Oct 29 19:56:54 +0000 2015,1,1,How fun!!! Twitter put balloons on my #Twitter...:) #happybirthday https://t.co/n37IVqP3Ku
151,659794672722837504,Thu Oct 29 18:11:23 +0000 2015,2,2,"New item: Artist Necklace | Artist Jewelry, Gifts for Artists, Artist Gift, Artist Pendant, Silver and Glass Neckla… https://t.co/7GdbogIEIC"
152,659744629672321025,Thu Oct 29 14:52:31 +0000 2015,1,5,"I just posted a new item to #Etsy!: Direct Sales Worksheet - The Power Of 3s | Network Marketing, Goal Setting, Sal… https://t.co/tZiu40mVEN"
153,659726893462237184,Thu Oct 29 13:42:03 +0000 2015,0,0,"If You Don’t Love Your Business, Please Read This | #Entrepreneur https://t.co/1WNK5hOqJL https://t.co/Htw6TJJQS7"
154,659721898557898752,Thu Oct 29 13:22:12 +0000 2015,0,0,[BLOG POST] My Second Week As A Lifestyle Blogger!!! (includes #'s) https://t.co/OjAV2rVDYk https://t.co/Xk6oud1IBg
155,659538697348608000,Thu Oct 29 01:14:13 +0000 2015,0,2,Find out how to make AMAZING #SocialMedia Graphics that make you look GREAT! https://t.co/VAhmHrqHRP https://t.co/5GXnxeIdwG
156,659476892370759680,Wed Oct 28 21:08:38 +0000 2015,0,0,"New item: Unique Gift for Psychic, Light Worker or Medium | Silver Pendant, Gifts for Psychics, Gifts For Mediums, … https://t.co/pwlL2Chetp"
157,659465441824387072,Wed Oct 28 20:23:08 +0000 2015,0,0,Passion Parties Bling Necklace Gift For Direct by WorkNecklaces https://t.co/uVGH9TBTjC https://t.co/pm3Z1ybGoq
158,659442927043788801,Wed Oct 28 18:53:40 +0000 2015,0,0,"New item: CUSTOM ORDER : Medium Pendant and Rhinestone Dangle Charm, Necklace, 30"" Ball Chain by WorkNecklaces (40.… https://t.co/zLZvdvHJGF"
159,659433219788533760,Wed Oct 28 18:15:05 +0000 2015,1,0,YOU NEED to enter this today!!! Time is running out... Ends tomorrow #contest https://t.co/CsPIRjc0N3 https://t.co/pNi4WAjpSo
160,659365288882917376,Wed Oct 28 13:45:09 +0000 2015,0,0,How To Pick Gift And Holiday #SEO Keywords https://t.co/T40QbO2chW https://t.co/9HmP0Xrrbb
161,659346509641707520,Wed Oct 28 12:30:32 +0000 2015,0,1,"Farmer Necklace, Gifts For Farmers | Necklace Jewelry 30"" Ball Chain #etsy #farminglife https://t.co/S1XWAf07AC https://t.co/fxTpkiJVTF"
162,659342314024890368,Wed Oct 28 12:13:52 +0000 2015,0,0,"New item: Teacher Appreciation Gift | A Unique Gift For Your Favorite Teachers! Top Teacher Gift, Best Teacher Gift… https://t.co/ZFRAeLtidq"
163,659336836746235904,Wed Oct 28 11:52:06 +0000 2015,0,0,People of mediocre ability sometimes achieve outstanding success… #quotes https://t.co/gKf6NL7VZR
164,659154902422265858,Tue Oct 27 23:49:09 +0000 2015,0,1,Advertising &amp; Promotional Opportunities On Paperly People https://t.co/HDPtvFi3dm https://t.co/1l6wFuRWAk
165,659112883809181696,Tue Oct 27 21:02:11 +0000 2015,4,0,"RT @stephanieoram1: Harry Potter Themed Charm Bracelet
http://t.co/9d186LThnU #womaninbiz #christmas #eshopsuk #harrypotter #craftbuzz http…"
166,659107823717064704,Tue Oct 27 20:42:05 +0000 2015,0,0,Freedom is the sure possession of those alone who have the courage to defend it… Pericles #quote https://t.co/yPgfaXkUfb
167,659010483614318592,Tue Oct 27 14:15:17 +0000 2015,0,1,IFTTT – How To Set Up If This Then That For Marketing #marketing https://t.co/Nf4ZTdcaP5 https://t.co/TZBOjzfHwY
168,658987809223626752,Tue Oct 27 12:45:11 +0000 2015,0,3,"How To Start, Manage and IMPLEMENT A Brilliant To Do List #timemanagement https://t.co/1I4ur5jbES https://t.co/JyIHwPPBli"
169,658981976674844672,Tue Oct 27 12:22:01 +0000 2015,1,2,Minding Your To Do List – Everything Can Not Be An Emergency #todos https://t.co/5qZJcojCqh https://t.co/y2tTAB2gol
170,658814146587283456,Tue Oct 27 01:15:07 +0000 2015,0,0,"[PRINTABLE PLANNER PAGES] To Do List Kit, Get PDF Worksheets!! #timemanagement https://t.co/ZCEeCaPXFt https://t.co/uaoy2xUMcN"
171,658783177209724928,Mon Oct 26 23:12:03 +0000 2015,0,0,"May we think of freedom, not as the right to please but as the opportunity to what is right. #quote https://t.co/1FDF1ETFzS"
172,658774841965879296,Mon Oct 26 22:38:56 +0000 2015,0,0,"New item: Firefighter Necklace, Gifts For Firefighters, Firefighter Jewelry, Fire Fighter Gift | Pendant, Jewelers … https://t.co/gtyqjCjCch"
173,658728619292913664,Mon Oct 26 19:35:16 +0000 2015,0,0,ROCK a great necklace that helps your #directsales business!!! https://t.co/wEs9KLS9mL https://t.co/dXB0ddl9sW
174,658723658630832133,Mon Oct 26 19:15:33 +0000 2015,0,2,Fiction Authors you MUST See The StoryShop Kickstarter #amwriting #author https://t.co/b0AJbm8LiL https://t.co/FIl1xeUhoU
175,658478366325108736,Mon Oct 26 03:00:51 +0000 2015,0,0,"Ideas Printable #Planner Page for Daily, Weekly or Monthly Planners  #GTD https://t.co/xlm1AKl5rB https://t.co/eK4mJUUU1o"
176,658444234123563008,Mon Oct 26 00:45:13 +0000 2015,1,1,[LAST DAY!!!] All of Erin Condren is on sale... 25% OFF EVERYTHING https://t.co/r1UbepfWwA https://t.co/GD3LFYqjQU
177,658421104747220992,Sun Oct 25 23:13:18 +0000 2015,1,0,RT @KottageKreation: Open Heart Necklace Two Peas In A Pod https://t.co/Wqy4L7ZiBV #etsymntt #HandStamped https://t.co/VyE5Jl6WhZ
178,658420811502456832,Sun Oct 25 23:12:08 +0000 2015,3,0,RT @Domruff1: Lightning Bolt Charm Chain Necklace Upcycled by Domruff1 https://t.co/ZNX7QN4FPR via @Etsy #HandMade #Upcycled  #EpiconEtsy
179,658387858844164096,Sun Oct 25 21:01:12 +0000 2015,3,4,[GREAT RESOURCE] Review of All The Fancy and Cute Planners #plannerlove #plannernerd https://t.co/jjhZhwH9yk https://t.co/7USIT3qoAV
180,658338812842512384,Sun Oct 25 17:46:18 +0000 2015,0,0,@sewsorose Thanks Rose!!! I grew up in the country and KNOW how hard the farmer ladies work...:)
181,658331223572508672,Sun Oct 25 17:16:09 +0000 2015,0,0,My Top 10 #TimeManagement Tips https://t.co/DLIax366il https://t.co/6WKK04ACTg
182,658245696408174592,Sun Oct 25 11:36:18 +0000 2015,1,2,"New item: Accountant Marketing, Gifts For Accountants, Accountant Gifts, Accouting Gift | Jewelers Glass Pendant, S… https://t.co/2fRYTVH1wM"
183,658245690045440000,Sun Oct 25 11:36:16 +0000 2015,0,0,"New item: Farmer Necklace, Gifts For Farmers, Farmer Gifts, Farmer Gift, Farming Pendant | Necklace Jewelry 30"" Bal… https://t.co/8Is9lfMUSt"
184,658090321784340480,Sun Oct 25 01:18:54 +0000 2015,1,1,FREE @LeadPages course! https://t.co/oJ7kAK8Gnu
185,657996494725890049,Sat Oct 24 19:06:03 +0000 2015,1,1,STOP NOW!!! Enter the SPOOKTACULAR Planner Contest!! https://t.co/CsPIRjc0N3 https://t.co/qsaXl0rbUo
186,657995549262630912,Sat Oct 24 19:02:18 +0000 2015,3,3,"Loose lips sink ships, loose tweets sink fleets! #quotes #socialmedia #funny https://t.co/Bpa9EqEyuO https://t.co/tBeCHIC5fJ"
187,657925054790017024,Sat Oct 24 14:22:11 +0000 2015,0,2,AMAZING Monthly Business Goals Planner Sheet #productivity #gtd https://t.co/lXmb40Ezvb https://t.co/mr8x0Yj3z2
188,657908244258488321,Sat Oct 24 13:15:23 +0000 2015,0,0,@Cari_On @JarilloPerez @AngieWagg Thanks for the shoutout Cari!
189,657907942260260866,Sat Oct 24 13:14:11 +0000 2015,0,0,@OfficeHounds You are SOOO welcome Maggie..:)
190,657695026722508801,Fri Oct 23 23:08:08 +0000 2015,0,2,Planner Manners – How To Color Code Your Time &amp; Your Life! https://t.co/cjIg2lQDvS https://t.co/eFPcGJqv6q
191,657629590681223169,Fri Oct 23 18:48:07 +0000 2015,0,2,How To Sell To Americans: Tips From On What Works In The United States #sales https://t.co/rlGIdU3reL https://t.co/0F7EXssKNq
192,657527146030723072,Fri Oct 23 12:01:02 +0000 2015,10,5,"Good things may come to those who wait, but only the things left by those who hustle #quotes https://t.co/PMzPHMTD5x https://t.co/KXZiZmZHGC"
193,657525333550366721,Fri Oct 23 11:53:50 +0000 2015,1,1,"New item: Veterinarian Marketing, Gifts for Vets, Top Gifts for Veterinarians, Best Gifts For Vets, Pendant, Neckla… https://t.co/Ek3zOwfiOh"
194,657387291997024256,Fri Oct 23 02:45:18 +0000 2015,0,0,Business Planner Kit...get three AWESOME #planner pages for the price of 2!! https://t.co/jYx1GbCEJB https://t.co/WXq5qpSEH2
195,657265240376287233,Thu Oct 22 18:40:19 +0000 2015,0,0,Holy Moley!!! Erin Condren EVERYTHING on sale for 25% off..:) #plannernerd #planneraddict https://t.co/r1UbepfWwA https://t.co/3xsGwlGAzG
196,657213581948243968,Thu Oct 22 15:15:03 +0000 2015,0,0,LIMITED EDITION : Teacher Gift | A Unique Gift For Your Favorite Teachers!  https://t.co/IPoPQPaUlI https://t.co/ykmH2il6Mi
197,657190954986815488,Thu Oct 22 13:45:08 +0000 2015,0,1,LIMITED EDITION : Gift for Authors or Writers | Beautiful Teal Pendant #amwriting https://t.co/xB1Dx4hAa9 https://t.co/fsuXnw1E7x
198,657185191467859969,Thu Oct 22 13:22:14 +0000 2015,0,0,What is #lifestyleblogging? My First Week As A Lifestyle Blogger! https://t.co/xsJWIPBdko https://t.co/EHoux51AW9
199,657175834076258304,Thu Oct 22 12:45:03 +0000 2015,0,0,Why You Should Have Written Lead Sheets #bizdev #sales https://t.co/PqD2ZDSyx5 https://t.co/UxMaxScFem
