,id_str,created_at,retweet_count,favorite_count,text
0,669251783731060743,Tue Nov 24 20:30:33 +0000 2015,0,0,SAVE 40% CYBER MONDAY SALE! Stupendous #productivity forms &amp; business systems.. https://t.co/1BVX3HkhDR https://t.co/5MSgTnG8mQ
1,669165339628969984,Tue Nov 24 14:47:04 +0000 2015,0,1,How To Make An SEO Sandwich | #SEO Optimization Tips https://t.co/GtQ1Pv10R2 https://t.co/wsjIJTlFwx
2,669146070216216576,Tue Nov 24 13:30:29 +0000 2015,0,0,Early #ThanksgivingSale!!! Stop cooking &amp; start working...:) 40% off EVERYTHING in my shop! https://t.co/1BVX3HkhDR https://t.co/UJgcpMz19Q
3,669144015829381120,Tue Nov 24 13:22:20 +0000 2015,0,0,#TimeManagement Tips | Everything Sucks The First Time You Do It! https://t.co/Hbo3yH3rB5 https://t.co/164QGlGWVY
4,668945161007837184,Tue Nov 24 00:12:09 +0000 2015,0,1,I'm going to keep going until I succeed… #harrypotter #quotes https://t.co/H6KVuoJJto
5,668890548426686464,Mon Nov 23 20:35:08 +0000 2015,0,1,Gifts for Teachers! This unique pendant is a great present for your favorite teacher! https://t.co/xGIRQNV98T https://t.co/DH9c2SmPwA
6,668825146103320576,Mon Nov 23 16:15:15 +0000 2015,0,0,How I Increased My Email Open Rate By 8 Percent | #Email Marketing https://t.co/GMHsMihL9k https://t.co/xXIZfemZTe
7,668824838916726785,Mon Nov 23 16:14:02 +0000 2015,0,2,OH MY GOSH!!! Last night's home staging webinar was AWESOME... get the replay! #staging https://t.co/pJyzAju6RV
8,668779836484243456,Mon Nov 23 13:15:13 +0000 2015,0,0,How To Have A Successful Black Friday Sale | Black Friday #Sales Tips https://t.co/dW2FXDko7x https://t.co/S1z4JdSph4
9,668640214395592704,Mon Nov 23 04:00:24 +0000 2015,0,0,Advertising &amp; Promotional Opportunities On Paperly People https://t.co/HDPtvFi3dm https://t.co/Oqo6eeK7BK
10,668549736585175040,Sun Nov 22 22:00:52 +0000 2015,0,1,Selling Digital Products On #Etsy | For Etsy Sellers https://t.co/yLCP0nUyNi https://t.co/b3DBnxQYF2
11,668493176764817408,Sun Nov 22 18:16:08 +0000 2015,0,0,Stop saying yes right now! #TimeManagement tips! https://t.co/zmLJGYSfKJ https://t.co/InxjiFEw5X
12,668434266129309696,Sun Nov 22 14:22:02 +0000 2015,0,0,How Newmarket’s Podium Publishing beat the world to The Martian https://t.co/Z1xi9Y51sR
13,668425006460878848,Sun Nov 22 13:45:14 +0000 2015,0,0,"Artist Necklace | Artist Jewelry, Gifts for Artists, Artist Gift #etsy https://t.co/MlIs7fUhkD https://t.co/noj6W8EFKj"
14,668157440215642116,Sat Nov 21 20:02:02 +0000 2015,0,0,"As we express our #gratitude, we must never forget that the highest appreciation… #quote https://t.co/LIRi0dehKS"
15,668130760952520704,Sat Nov 21 18:16:01 +0000 2015,0,0,2015 Holiday Merchandising Guide #etsy #retail https://t.co/QUmqIvRUDL
16,668112442996621312,Sat Nov 21 17:03:13 +0000 2015,0,0,@Suite369 thanks for the shoutout Miz..:)
17,668112116205785089,Sat Nov 21 17:01:56 +0000 2015,1,0,RT @ConvoMePodcast: Did you miss my #EtsyConvo w @PaperlyPeople last month? Gr8 news… U can still hear it now... https://t.co/T6QYpBodMP ht…
18,668086979863683072,Sat Nov 21 15:22:03 +0000 2015,0,0,"Ideas Printable #Planner Page for Daily, Weekly or Monthly Planners  #GTD https://t.co/xlm1AKl5rB https://t.co/MHngZvu4lN"
19,667857031567683584,Sat Nov 21 00:08:19 +0000 2015,1,1,[BLOG POST] Minding Your Time When You Are Just Too Busy https://t.co/vGwfBLXNZA https://t.co/5BIDaHlHIM
20,667791593341124610,Fri Nov 20 19:48:17 +0000 2015,1,0,Find out how to make AMAZING #SocialMedia Graphics that make you look GREAT! https://t.co/VAhmHrqHRP https://t.co/meCxsKknHK
21,667737962633916420,Fri Nov 20 16:15:10 +0000 2015,1,1,"Photographer Marketing, Gifts for Photographers | #photographer https://t.co/z2ezsB2UM1 https://t.co/kgXD0GpqiA"
22,667736006091743234,Fri Nov 20 16:07:24 +0000 2015,1,0,I just posted a new item to #Etsy!: Black Friday Sales Worksheet | Map out your Black Friday &amp; Cyber Monday Sales P… https://t.co/xp1Sdlh2YF
23,667700219686068224,Fri Nov 20 13:45:12 +0000 2015,0,2,How To Do Market Research On Etsy | #Etsy Seller Marketing https://t.co/pslfrWUKOQ https://t.co/GmpREXn9Fl
24,667549193536446464,Fri Nov 20 03:45:04 +0000 2015,1,1,AMAZING Monthly Business Goals Planner Sheet #productivity #gtd https://t.co/lXmb40Ezvb https://t.co/HxPDFtFlfn
25,667371894308499458,Thu Nov 19 16:00:33 +0000 2015,1,0,[REPORT] How To Make A SEO Sandwich | Make Your Blog Posts &amp; Websites Rank In Search Engines https://t.co/Z2T8VTUp7t https://t.co/FNEHN65qcb
26,667347296972066816,Thu Nov 19 14:22:48 +0000 2015,0,0,[ARTICLE] My Fifth Week As A Lifestyle Blogger | The Blogging Week https://t.co/VYU1MJvChs https://t.co/oBAeNsAqQD
27,667338411678834688,Thu Nov 19 13:47:30 +0000 2015,0,2,"New item: Artist Necklace | Artist Jewelry, Gifts for Artists, Artist Gift, Artist Pendant, Silver and Glass Neckla… https://t.co/VGhXVZwps8"
28,667164042654588928,Thu Nov 19 02:14:37 +0000 2015,0,1,How To Sell To Americans: Tips From On What Works In The United States #sales https://t.co/rlGIdU3reL https://t.co/kQOkggTikT
29,667092689956020224,Wed Nov 18 21:31:05 +0000 2015,0,0,Weekly Calendar Pages – Full Spread | Week At A Glance #planneraddict https://t.co/U4Mqy6z8wu https://t.co/SqGvNIXs39
30,667092596867600385,Wed Nov 18 21:30:43 +0000 2015,0,0,Top To Do List Tips From Productivity Experts | #productivity #todos https://t.co/IDrzSpwgLF https://t.co/LaYSrWM8Bl
31,667090696894078976,Wed Nov 18 21:23:10 +0000 2015,0,0,LIMITED EDITION Unique Gift for Psychic Light by WorkNecklaces https://t.co/zBoKy2o2mJ https://t.co/pbNJ766k4h
32,667005668981911552,Wed Nov 18 15:45:18 +0000 2015,0,1,How To Write Effective Marketing Blog Posts Your Readers Will Love | #ContentMarketing https://t.co/vmi4xTe6YV https://t.co/fhcnOL48M7
33,666962083691552768,Wed Nov 18 12:52:06 +0000 2015,1,0,All labor that uplifts humanity had dignity… Martin Luther King Jr #quote https://t.co/YcxFRrQEmo
34,666800046684381184,Wed Nov 18 02:08:14 +0000 2015,0,0,"Avon Necklace | Unique Gift For Avon Ladies, Avon Pendant | #avonlady https://t.co/lgCa9l1Bp7 https://t.co/nad94bMIfK"
35,666780146985140225,Wed Nov 18 00:49:09 +0000 2015,0,0,Business Planner Kit...get three AWESOME #planner pages for the price of 2!! https://t.co/jYx1Gbl3l1 https://t.co/qEOTvKFgNU
36,666733063720837121,Tue Nov 17 21:42:04 +0000 2015,0,1,I hate self-promotion | Author Marketing | Tim Grahl https://t.co/fwkAjX12ze
37,666690360660373504,Tue Nov 17 18:52:23 +0000 2015,0,0,How To Do Market Research On Etsy | Etsy Seller Marketing https://t.co/SfnDq2mqzz
38,666680146246651904,Tue Nov 17 18:11:47 +0000 2015,2,0,"I just posted a new item to #Etsy!: How To Do Etsy Market Research | For Etsy Sellers, Marketing, Sales, Product De… https://t.co/lXiZfwbRwv"
39,666669803428540416,Tue Nov 17 17:30:41 +0000 2015,0,1,[WORKSHEET] How to create content for AMAZING sales pages &amp; blog posts! https://t.co/HYloevFZWX https://t.co/WMcdGaRWlb
40,666607255727513601,Tue Nov 17 13:22:09 +0000 2015,0,0,#TimeManagement Tips – #Stop Driving Yourself Crazy https://t.co/YE734npZAa https://t.co/3MQts8c3HO
41,666414148125765632,Tue Nov 17 00:34:48 +0000 2015,0,0,Selling Digital Products On #Etsy | For Etsy Sellers https://t.co/ojOTeiBd1T https://t.co/G2RjX5uTFg
42,666408426147328000,Tue Nov 17 00:12:04 +0000 2015,0,2,Life is denied by lack of attention. Whether it be cleaning windows or trying to write a masterpiece. #writing https://t.co/WTjNyWPzlQ
43,666353813125746688,Mon Nov 16 20:35:03 +0000 2015,0,1,Gift for Nurse A truly unique necklace that she by WorkNecklaces https://t.co/bfdUb466WB https://t.co/LdF6pkWrWe
44,666258214145695744,Mon Nov 16 14:15:11 +0000 2015,0,2,#Entrepreneur Marketing – 10 Things To Do When You HAVE To Make Money $$$ https://t.co/2XL248EcIH https://t.co/9JgBplbwSt
45,666119529664290816,Mon Nov 16 05:04:06 +0000 2015,0,0,Selling Digital Products On Etsy | For Etsy Sellers https://t.co/xUmqynBOcG
46,666103520039407616,Mon Nov 16 04:00:29 +0000 2015,0,0,"[PRINTABLE PLANNER PAGES] To Do List Kit, Get PDF Worksheets!! #timemanagement https://t.co/ZCEeCaPXFt https://t.co/zVAW060KfO"
47,666012939887972353,Sun Nov 15 22:00:33 +0000 2015,0,1,Why Having An Ideas Journal Is Such A Good Idea #ideas #startup https://t.co/EsuuXgNrnp https://t.co/ISKF6N4Now
48,665956441073852417,Sun Nov 15 18:16:03 +0000 2015,0,1,Small Business #Marketing – Getting Motivated  https://t.co/pzFwVhCFIb https://t.co/hqUWedFhc0
49,665620723562622976,Sat Nov 14 20:02:01 +0000 2015,0,0,Let freedom reign. The sun never set on so glorious a human achievement. #Mandela  #success #quotes https://t.co/OHsIzYhvG6
50,665550282261209088,Sat Nov 14 15:22:07 +0000 2015,0,0,[Time Management Resource] Weekly Printable Planner Pages #planner #productivity  https://t.co/xi4jKT7nv7 https://t.co/39uwTH7B2O
51,665320255191805952,Sat Nov 14 00:08:04 +0000 2015,0,1,[BLOG POST] Color Coding Your Perfect Week | #TimeManagement Tips https://t.co/kUK7Lnw8ug https://t.co/QVzLKWXD1Q
52,665254819893026817,Fri Nov 13 19:48:03 +0000 2015,1,1,How To Succeed At Stock Photography #photography #kindleunlimited https://t.co/JPBlxZih90 https://t.co/2dujLWa1FJ
53,665246556380073984,Fri Nov 13 19:15:13 +0000 2015,0,0,OH MY GOSH!!! @voyicks new book is out!!! The #Infusionsoft Cookbook ... get it now! #email #marketing https://t.co/X1CVYicoys
54,665220307758764033,Fri Nov 13 17:30:55 +0000 2015,0,0,Weekly Calendar Pages – Full Spread | Business Planner #plannernerd #business https://t.co/U4Mqy6z8wu
55,665194366638649344,Fri Nov 13 15:47:50 +0000 2015,0,0,I just posted a new item to #Etsy!: How To Make A SEO Sandwich | SEO Tips To Make Your Blog Posts &amp; Websites Rank I… https://t.co/kQPvXBEJ8d
56,665012514736992257,Fri Nov 13 03:45:13 +0000 2015,0,0,[WORKSHEET] Figure out where all your time is going!!! #productivity https://t.co/cRa49uuBjH https://t.co/fP2mrLulOo
57,664989827130073088,Fri Nov 13 02:15:04 +0000 2015,0,1,"Unique Necklace for Mediums, Psychics &amp; Light Workers | Gifts for Mediums or Psychics https://t.co/5Mg31zvA1x https://t.co/z3j3muDebd"
58,664841565123289089,Thu Nov 12 16:25:55 +0000 2015,0,1,Wedding Planner Gifts | Gifts for Bridal Planners #weddingplanner https://t.co/sv0FSWjizJ https://t.co/4ZGp2u0qDv
59,664830920139145216,Thu Nov 12 15:43:37 +0000 2015,0,1,[BLOG POST] My Tenth Week As A Lifestyle Blogger – Getting Sales! #blogging https://t.co/lXE5LK1hSv https://t.co/41ZbnlMehj
60,664627208133214208,Thu Nov 12 02:14:09 +0000 2015,0,1,Infusionsoft Strategy Guide: Taking Your #Email Marketing To A Whole New Level  https://t.co/4qiqXUchED https://t.co/b4AZIuGbU6
61,664553965007331329,Wed Nov 11 21:23:06 +0000 2015,0,1,Unique Gift for Authors or Writers Fancy Glass by WorkNecklaces https://t.co/RtssTXgsY3 https://t.co/B7Nxx8ggE3
62,664548285248598017,Wed Nov 11 21:00:32 +0000 2015,0,1,My 15th &amp; 16th Weeks As A Lifestyle Blogger | Getting Ready For Christmas! https://t.co/fpSS6qEIgI https://t.co/OvppAsNzO0
63,664494088473956353,Wed Nov 11 17:25:11 +0000 2015,2,2,I just posted a new item to #Etsy!: Writing A Blog Post or Sales Letter Worksheet | Who Is Your Perfect Customer? C… https://t.co/zA0V8OYq3P
64,664445026517327872,Wed Nov 11 14:10:13 +0000 2015,0,0,Ebay Products Listing Sheet | 2 Versions Evernote &amp; Dropbox #EbaySellers https://t.co/63jldlfZ3T https://t.co/i7g00ii7iT
65,664425362542206976,Wed Nov 11 12:52:05 +0000 2015,0,0,"Never lose the childlike wonder. Show gratitude…don't complain, just work harder #quote https://t.co/HcHGZGFDGJ"
66,664243415559880704,Wed Nov 11 00:49:05 +0000 2015,1,1,[RESOURCE] Get all your ideas out of your head &amp; actually start implementing them! #etsy https://t.co/UmpDYsKoCQ https://t.co/N1bRmTK1Xi
67,664238570715025408,Wed Nov 11 00:29:50 +0000 2015,1,1,Weekly Calendar Pages – Full Spread | Business Planner #plannernerd #business https://t.co/26lMEM0GGj https://t.co/leiEoocHdI
68,664196361261350912,Tue Nov 10 21:42:07 +0000 2015,1,2,[STAGING WEBINAR] Ten Ways To Woo Realtors So They Work With You Every Time  https://t.co/1ziViFQbtN https://t.co/0yLlSNvBIf
69,664182038715621381,Tue Nov 10 20:45:12 +0000 2015,4,1,Order Form For Creative Products Companies | Custom Business Forms https://t.co/kJVP1V5msp https://t.co/dd9qYJksUA
70,664141727276511232,Tue Nov 10 18:05:01 +0000 2015,0,1,Weekly Calendar Pages – Full Spread | Business Planner https://t.co/HoqLr6WlC6
71,664128879599198208,Tue Nov 10 17:13:58 +0000 2015,1,1,"I just posted a new item to #Etsy!: Weekly Calendar Pages Planner Spread | Great For DIY Planner, Business Planner,… https://t.co/36PrJPQeIj"
72,664091414578536452,Tue Nov 10 14:45:06 +0000 2015,0,0,[BLOG POST] How to set up your DIY business planner! #planneraddict https://t.co/gqLkwfgqSB https://t.co/tgqWQFiQAJ
73,664070563325939712,Tue Nov 10 13:22:14 +0000 2015,0,4,#Marketing Focus…what are your three most important things? https://t.co/IS4ocp8Ywi https://t.co/WowygknOr5
74,663871722718953476,Tue Nov 10 00:12:07 +0000 2015,0,0,"When I was young I observed that nine out of 10 things I did were failures, so I did 10 times more work. https://t.co/EKLtViJQAA"
75,663846049807757312,Mon Nov 09 22:30:06 +0000 2015,1,0,"Christian Business, Christian Necklace Charm | Gifts for #Christian Business Owners https://t.co/aVmSuIydr0 https://t.co/AqgRI5aIKZ"
76,663817090336464904,Mon Nov 09 20:35:02 +0000 2015,2,2,"Veterinarian Marketing Bling, Gifts for Vets | #Veterinarian https://t.co/kG6TKjvybg https://t.co/sPpAPr1tFm"
77,663569079886811136,Mon Nov 09 04:09:31 +0000 2015,1,3,"[RESOURCE] Printable Worksheet - Choosing A Lifestyle Blogging Niche, #Marketing Form https://t.co/4tYFTRWdM5 https://t.co/7lLYVNmJ8J"
78,663568446471434240,Mon Nov 09 04:07:00 +0000 2015,1,0,AWESOME Gift for the cook or baker in your life! #cook #baking https://t.co/dh06V5hS5b https://t.co/R1I1NuKE8f
79,663564138208071682,Mon Nov 09 03:49:53 +0000 2015,7,0,RT @etsyaddict2: #etsy Utility/Festival Belts keeps your essential safe and at easy access. A must for ...  https://t.co/aRXNfIxGWS https:/…
80,663563663299624960,Mon Nov 09 03:48:00 +0000 2015,46,0,RT @ETSYcreativity: Beautiful ethnic weekend travel bags. #Handmade &amp; ethically crafted by Mayan artisans https://t.co/BqwKcMk6Ee #etsy htt…
81,663553458708983808,Mon Nov 09 03:07:27 +0000 2015,1,0,RT @ConvoMePodcast: Still haven't listened 2 my #EtsyConvo w @TARAdactyl of #Etsystore @PaperlyPeople? Y not? :) https://t.co/T6QYpBodMP ht…
82,663476403120287744,Sun Nov 08 22:01:15 +0000 2015,0,0,"[BLOG POST] Should You Use A Daily, Weekly Or Monthly Planner? #planner https://t.co/jBihkUQtJt https://t.co/nJUTRXZSnR"
83,663419719207264257,Sun Nov 08 18:16:01 +0000 2015,0,0,Goal Setting – Figuring Out Your Fabulous Life https://t.co/8H7ZPfxnnD https://t.co/VCWC5y5T4W
84,663357825050103808,Sun Nov 08 14:10:04 +0000 2015,1,0,"New item: Unique Necklace for Mediums, Psychics and Light Workers | Gifts for Mediums or Psychics, Psychic Gifts, P… https://t.co/g4AopS1uTn"
85,663094975224258561,Sat Nov 07 20:45:36 +0000 2015,0,0,"Artist Bling Necklace | #Artist Jewelry, Gifts for Artists, Artist Gift https://t.co/AHPbeAHW5V https://t.co/iYNnL78YRs"
86,663084039478333444,Sat Nov 07 20:02:09 +0000 2015,0,0,No duty is more urgent than that of returning thanks. #quotes https://t.co/Tq3HKDy9ZC
87,663057401965342720,Sat Nov 07 18:16:18 +0000 2015,1,1,Bento boxes for your inner geek https://t.co/w1lXimRaiI
88,663057096481579008,Sat Nov 07 18:15:05 +0000 2015,0,1,Flight Attendant Pendant | Flight Attendant Jewelry | https://t.co/aU6TZblaSJ https://t.co/2q5p0vWOZW
89,663026011781509125,Sat Nov 07 16:11:34 +0000 2015,0,0,@2BJewellery hi 2B! Have you found that giving away coupons like this results in sales?!?!...:)
90,663024586674585600,Sat Nov 07 16:05:54 +0000 2015,1,1,"New item: Photographer Marketing, Gifts for Photographers | Photographer Gift, Camera Enamel &amp; Rhinestone Dangle Ch… https://t.co/mqCwkJLZ5S"
91,663013553331421185,Sat Nov 07 15:22:03 +0000 2015,2,1,"Product Development Worksheet, Scope Out New Product Ideas! #startup https://t.co/H7alttEJ3i https://t.co/PX54STavUy"
92,662996769819750400,Sat Nov 07 14:15:22 +0000 2015,0,0,10 Things I Did To Make My #Etsy Store Successful In The First 3 Months | https://t.co/OIl28jVWsm https://t.co/JVqQGmHgKs
93,662783524806729728,Sat Nov 07 00:08:00 +0000 2015,0,0,#TimeManagement Tips – Turning Down “Great” Opportunities https://t.co/bKDl6JNbNl https://t.co/WEA1cUsMQl
94,662740939262156800,Fri Nov 06 21:18:47 +0000 2015,1,0,"New item: Baker or Cook Jewelry | Unique Gift for Bakers, Gifts for Baker, Gifts for Cooks or Cupcake Makers, Penda… https://t.co/xkKaxUq088"
95,662718152740986880,Fri Nov 06 19:48:14 +0000 2015,0,0,Retail Marketing Strategies For Brick &amp; Mortar Businesses #retail https://t.co/gVSVWWAKgw https://t.co/W8wZkwrGXX
96,662683564677304321,Fri Nov 06 17:30:48 +0000 2015,2,0,"RT @mommemoment: Love lavender? Try a bath bomb, great for when you need a MEmoment #etsyhandmade #etsymntt https://t.co/lAOmKjOHEv https:/…"
97,662683288771760129,Fri Nov 06 17:29:42 +0000 2015,3,0,RT @etsyaddict2: #etsy This lovely wallet is made especially to hold reward cards and the like. It can ...  https://t.co/64coKVAsp5 https:/…
98,662683060635222016,Fri Nov 06 17:28:48 +0000 2015,6,0,RT @marmalead: #FF @heychica @SunOverVegas @carvinchick @MyBeachStore @etsy_creativity @FourLetterWordC @TARAdactyl @paperlypeople @ConvoMe…
99,662478874438148096,Fri Nov 06 03:57:26 +0000 2015,0,1,Lead Tracking Sheet | Followup Worksheet for All Your Leads! #sales https://t.co/wWYClHXS1O https://t.co/okw4f3torZ
100,662407826585817089,Thu Nov 05 23:15:07 +0000 2015,0,2,"[WORKSHEET] #DirectSales  - The Power Of 3s | #NetworkMarketing, Goal Setting https://t.co/pG6d1jJfE1 https://t.co/ZTX58QvXEm"
101,662396773583990784,Thu Nov 05 22:31:12 +0000 2015,0,3,[VIDEO] Instagram for Your #Etsy Business - @suebzimmerman https://t.co/qPDAwgzUJd
102,662279540216078336,Thu Nov 05 14:45:21 +0000 2015,4,1,[Blog post] 5 Ways To Sell Successfully At Networking Events | #networking | https://t.co/cHLZu6JpAd https://t.co/wVKrKxp2tD
103,662273705930813440,Thu Nov 05 14:22:10 +0000 2015,0,0,My Seventh Week As A Lifestyle Blogger – Holy Cow I Posted A Lot Of Forms Week https://t.co/8hIPwTIyhp https://t.co/FrDce1oSUz
104,662260676749062144,Thu Nov 05 13:30:24 +0000 2015,1,0,Teacher Appreciation Gift | A Unique Gift For Your Favorite Teachers! | #etsy https://t.co/vBYhZmCT8I https://t.co/pKVxKhGWpS
105,662241010450329600,Thu Nov 05 12:12:15 +0000 2015,0,1,"New item: Veterinarian Marketing Bling, Gifts for Vets, Top Gifts for Veterinarians, Best Gifts For Vets, Pendant, … https://t.co/0hTzQcSGjg"
106,662159829239230464,Thu Nov 05 06:49:40 +0000 2015,0,0,"Fun Necklace for Cooks or Bakers | Baker Gift, Cook Gifts | #baker https://t.co/Sn6kVUTy2a https://t.co/rSrlwtkKd2"
107,662090496148422656,Thu Nov 05 02:14:09 +0000 2015,0,0,Find out how to sell YOUR unique Gifts &amp; Talents!! Unique Selling Proposition Ebook #sales https://t.co/kx6JkIOUqV https://t.co/DMcCzRLbJM
108,662088324069392389,Thu Nov 05 02:05:32 +0000 2015,0,0,"New item: Avon Necklace | Unique Gift For Avon Ladies, Avon Pendant, Avon Necklace, Direct Sales Pendant, Necklaces… https://t.co/z3FtMdpDpV"
109,662084602371153920,Thu Nov 05 01:50:44 +0000 2015,1,0,"I just posted a new item to #Etsy!: Ebay Products Listing Sheet | 2 Versions Evernote &amp; Dropbox, Ebay Seller, Form,… https://t.co/pgOSRysWeZ"
110,662030865548124160,Wed Nov 04 22:17:12 +0000 2015,2,5,[BLOG] Track Income Earning Activities For #DirectSales &amp; #NetworkMarketing https://t.co/q9uoQyYE7w https://t.co/2L03vwtIWQ
111,662017288409907200,Wed Nov 04 21:23:15 +0000 2015,1,0,Gift For Your Favorite Marketing Woman Super cute by WorkNecklaces https://t.co/GCsV1P1uxM https://t.co/yxhaQJ0tra
112,661888674926338048,Wed Nov 04 12:52:12 +0000 2015,1,2,No duty is more urgent than that of returning thanks. #quotes https://t.co/NSGsApCkYf
113,661729969081446400,Wed Nov 04 02:21:33 +0000 2015,1,0,RT @MyCozyHat: Photo: Bear Rug #bear #teddybear #teddy #crochet #knitt #etsyseller #etsyshop #etsyfinds #kidsroom... https://t.co/E9rieRZ6pg
114,661729711811268608,Wed Nov 04 02:20:32 +0000 2015,8,0,RT @MariaAsvesta: Red passion by Danae on #etsy!!! #etsysocial #etsyshop #etsyseller #handmade #eco #etsyaaa https://t.co/6wpVnqDRPd https:…
115,661728454027579394,Wed Nov 04 02:15:32 +0000 2015,0,1,@Mussanaf @FitFoodieTX Thanks for sharing Rai!
116,661706745656582146,Wed Nov 04 00:49:16 +0000 2015,1,0,[WORKSHEET] Little Projects Page! Take your ideas &amp; implement them! https://t.co/WqGrkl81Zk https://t.co/sf1bet1sXr
117,661659676036227072,Tue Nov 03 21:42:14 +0000 2015,0,0,[BLOG POST] Women Niche #Marketing Examples – Yes Everyone Has A Niche! https://t.co/78XdDvyZM8 https://t.co/EcPRot1gJ7
118,661616413707264001,Tue Nov 03 18:50:19 +0000 2015,0,2,"I just posted a new item to #Etsy!: Order Form For Creative Products Companies | Custom Business Forms, Letter Size… https://t.co/G7WrKPqpzM"
119,661604831426183168,Tue Nov 03 18:04:18 +0000 2015,0,0,"New item: Flight Attendant Pendant | Flight Attendant Jewelry, Gifts for Flight Attendants, Stewardess, Silver and … https://t.co/T06bwfsnIF"
120,661573950862983169,Tue Nov 03 16:01:35 +0000 2015,1,1,My Fifteenth and Sixteenth Weeks As A Lifestyle Blogger | Getting Ready For Christmas https://t.co/F6ApAC3WBp
121,661571146882519040,Tue Nov 03 15:50:27 +0000 2015,0,0,My 15th &amp; 16th Weeks As A Lifestyle Blogger | Getting Ready For Christmas! https://t.co/xVCxrRpDoh https://t.co/FKbiGSqB1f
122,661539647814791168,Tue Nov 03 13:45:17 +0000 2015,1,2,"Firefighter Necklace, Gifts For Firefighters, Firefighter Jewelry | #firefighter https://t.co/5jfmb3efF0 https://t.co/E8OTJH8Sgk"
123,661533838405947392,Tue Nov 03 13:22:12 +0000 2015,0,1,Goal Setting: Quit Trying To Find A Big Why  https://t.co/dnOW62SRyK https://t.co/XHR5mmRJPr
124,661335006048968704,Tue Nov 03 00:12:07 +0000 2015,1,1,Opportunity is missed by most people because it is dressed in overalls and looks like work. #Edison #quotes https://t.co/GrkP8YBlIo
125,661280392536850432,Mon Nov 02 20:35:06 +0000 2015,1,0,Send Out Cards Bling Necklace Special Pendant for by WorkNecklaces https://t.co/Lq3PiarsHi https://t.co/kFvqUwccR7
126,661213737450385410,Mon Nov 02 16:10:14 +0000 2015,0,0,Top To Do List Tips From Productivity Experts https://t.co/e4vIwMLxGF
127,661212986430742528,Mon Nov 02 16:07:15 +0000 2015,0,0,Top To Do List Tips From Productivity Experts | #productivity #todolist | https://t.co/pFYdM1LGIp https://t.co/xUBITggtNM
128,661211557972459520,Mon Nov 02 16:01:34 +0000 2015,0,0,@Bubo_The_Owl so beautiful...:)
129,661196439662534656,Mon Nov 02 15:01:30 +0000 2015,0,1,Wisconsin Badger Necklace | Gifts for Wisconsin Badgers Fans #Badgers https://t.co/glvivCHXmi https://t.co/kgSVg5XhSv
130,661030112700325888,Mon Nov 02 04:00:34 +0000 2015,0,0,SUPER FUN daily planner page! #plannernerd #planner #etsy https://t.co/81fz9NLx8q https://t.co/m0cNq9yYSV
131,660939712706793472,Sun Nov 01 22:01:21 +0000 2015,0,1,Should You Use Google Keyword Planner OR Marmalead For Your #Etsy #SEO Research https://t.co/S65w48Pt9L
132,660883014222782464,Sun Nov 01 18:16:03 +0000 2015,1,2,#TimeManagement Tips – How To Manage When You Have Too Much To Do https://t.co/vt9wnDYz3X https://t.co/crVIpufwmG
133,660854811320000512,Sun Nov 01 16:23:59 +0000 2015,1,1,"New item: Wedding Planner Marketing | Gifts for Wedding Planners, Wedding Planner Gifts, Bridal Planner, Necklace, … https://t.co/rBCJkiVKTa"
134,660824133438164992,Sun Nov 01 14:22:05 +0000 2015,0,0,"Adobe Predicts Online Holiday Sales To Hit Record $83B, Cyber Monday To Generate $3B https://t.co/7XU5cHSio0"
135,660532248417054720,Sat Oct 31 19:02:14 +0000 2015,1,0,To find joy in work is to discover the fountain of youth. Pearl S. Buck #quote https://t.co/kCm0koM5FC
136,660505520348991488,Sat Oct 31 17:16:02 +0000 2015,0,0,12 Wellness Experts On How They REALLY Built Their Brands Online - https://t.co/GL2Dw9Odmy https://t.co/1JfOWR62Ab
137,660496175234199552,Sat Oct 31 16:38:54 +0000 2015,0,0,"New item: Fun Necklace for Cooks or Bakers | Baker Gift, Cook Gifts, Unique Gifts for Bakers, Cupcake Necklace, Dan… https://t.co/7trM0q5bd0"
138,660461733723676676,Sat Oct 31 14:22:02 +0000 2015,0,3,[BLOG] Want to be more productive? Check out my daily #planner page! #etsy #gtd https://t.co/L5ZtUOqod2 https://t.co/ksH2WVxWFk
139,660458476976644096,Sat Oct 31 14:09:06 +0000 2015,0,1,"New item: Wisconsin Badger Necklace | Gifts for Wisconsin Badgers Fans, University of Wisconsin Madison, Wisconsin … https://t.co/z2KyFHW6a5"
140,660261177872617472,Sat Oct 31 01:05:06 +0000 2015,0,0,My 13th &amp; 14th Weeks As A Lifestyle #Blogging | Getting The Work Necklaces Going https://t.co/n6HqvugQEV https://t.co/uMFUFwwFlz
141,660231755832627200,Fri Oct 30 23:08:11 +0000 2015,1,1,Stop Being Overwhelmed | #TimeManagement Tips https://t.co/zmLJGYSfKJ https://t.co/TyFO963JaK
142,660230220360781824,Fri Oct 30 23:02:05 +0000 2015,2,1,10 Things I Did To Make My #Etsy Store Successful In The First 3 Months | https://t.co/fYRHxZ4Ldj https://t.co/o8kgVRuCLc
143,660229449481220096,Fri Oct 30 22:59:01 +0000 2015,0,2,@Melvynis Colder than I like it to be...:)
144,660173077964316672,Fri Oct 30 19:15:01 +0000 2015,1,2,LIMITED EDITION : Gifts for Photographers | Photographer Gift Necklace https://t.co/aEXuWcWRr6 https://t.co/pG0AmhrB6d
145,660166303337025536,Fri Oct 30 18:48:06 +0000 2015,1,1,Reveal the true you! Unique Selling Proposition Book #kindle #sales https://t.co/kx6JkIOUqV https://t.co/OLOwj86Xb7
146,660161773866254336,Fri Oct 30 18:30:06 +0000 2015,0,1,10 Things I Did To Make My Etsy Store Successful In The First 3 Months https://t.co/O2WNJ1BaXZ
147,660056157101424642,Fri Oct 30 11:30:25 +0000 2015,0,0,"New item: Christian Business, Christian Necklace Charm | Gifts for Christian Business Owners, Christian Gifts, Pend… https://t.co/nCmC7Zz3JZ"
