,id_str,created_at,retweet_count,favorite_count,text
0,295575700101005313,Sun Jan 27 16:55:13 +0000 2013,0,0,Missing vishwaroopam. Very much
1,295575445632610304,Sun Jan 27 16:54:12 +0000 2013,1,0,@SharadaRaja. Hi akks
2,241109733568811008,Thu Aug 30 09:46:54 +0000 2012,0,0,I've just updated my professional profile on LinkedIn. Connect with me and view my profile. http://t.co/eyYjsGfj #in
3,217673791113920513,Tue Jun 26 17:40:50 +0000 2012,0,0,Serving the God is nice
4,167830917438636035,Fri Feb 10 04:43:03 +0000 2012,0,0,@rajesh thanks its always oor
5,18364791212,Mon Jul 12 16:07:11 +0000 2010,0,0,the foot ball cup was interesting but no goals in first pace
6,18364616517,Mon Jul 12 16:04:34 +0000 2010,0,0,@mpreetha what happed are u on a tiresome job
7,18364298616,Mon Jul 12 15:59:54 +0000 2010,0,0,"we are making new discoveries abt the native place its history, heritage and old  & rare books"
8,10729706542,Fri Mar 19 16:17:31 +0000 2010,0,0,how are u all
