,id_str,created_at,retweet_count,favorite_count,text
0,668929564278693888,Mon Nov 23 23:10:10 +0000 2015,0,1,YOUR ULTRA HIGH-DEF TV COULD BOOST YOUR ENERGY BILL https://t.co/nVJPV4rg2x
1,668922010597109760,Mon Nov 23 22:40:09 +0000 2015,0,0,INTEL’S 72-CORE PROCESSOR IS COMING TO DESKTOP COMPUTERS NEXT YEAR https://t.co/ov5as90B57
2,668920753396588545,Mon Nov 23 22:35:10 +0000 2015,0,0,"Solar power generates savings, money https://t.co/yzjKeOyXtL"
3,668886793517981696,Mon Nov 23 20:20:13 +0000 2015,0,0,Solar panels at UW should cut 50 tons of carbon dioxide a year https://t.co/CYnok4ceyn
4,654398873239162881,Wed Oct 14 20:50:24 +0000 2015,0,1,The US is about to hit a big solar energy milestone  http://t.co/38Qd7KwlbO
5,654368720131870720,Wed Oct 14 18:50:35 +0000 2015,0,0,A new breakthrough with solar energy cells could make them cheaper and more effective http://t.co/AzJNlmdJZp
6,654319837695639552,Wed Oct 14 15:36:20 +0000 2015,0,0,"In Solar Energy, It’s the Haves and the Have-Nots http://t.co/dkgECZFa9w"
7,654020189110054912,Tue Oct 13 19:45:38 +0000 2015,0,0,DISPELLING THE MOST COMMON SOLAR ENERGY MYTHS  http://t.co/yieyhFCtUq
8,653974854841040897,Tue Oct 13 16:45:30 +0000 2015,0,0,Five solar energy projects under way  http://t.co/mPSxriyfHc
9,653926735562543105,Tue Oct 13 13:34:17 +0000 2015,0,0,India to Bring Light and Heat with Solar Energy http://t.co/XFF874SQRk
10,653314416600051712,Sun Oct 11 21:01:09 +0000 2015,0,0,SunPort Solar is rocking the energy world  http://t.co/O1j6L0NXjE
11,653282731741331456,Sun Oct 11 18:55:15 +0000 2015,0,0,Does SolarCity's New Solar Panel Change the Game in Solar Energy? http://t.co/TH1lGXxJ4e
12,653222318681030656,Sun Oct 11 14:55:11 +0000 2015,0,0,SOLAR POWER: Electricity production improves http://t.co/Chmw2FjdiX
13,653176990946693120,Sun Oct 11 11:55:04 +0000 2015,0,0,Should homeowners with solar panels pay to help maintain the electrical grid? http://t.co/NXMD8Kg06j
14,652590661645025280,Fri Oct 09 21:05:12 +0000 2015,1,0,Pacheco High will get solar panels http://t.co/BWVtJQU65i
15,652584994519580672,Fri Oct 09 20:42:41 +0000 2015,0,0,"Column: As OPEC turns to solar power, why hasn't Arizona? http://t.co/ZiBYTwJPq3"
16,652572456490766336,Fri Oct 09 19:52:52 +0000 2015,0,0,"Poor deserve piece of solar energy pie, too http://t.co/EeioYu6H57"
17,652514932987166720,Fri Oct 09 16:04:17 +0000 2015,0,0,UK energy policy slammed as solar company collapses http://t.co/SGlYaRTeis
18,652209464205049856,Thu Oct 08 19:50:28 +0000 2015,0,0,The U.S. needs a solar energy revolution. But it’s laying off solar energy researchers http://t.co/ESBd9o1ZTE
19,652164131269664768,Thu Oct 08 16:50:20 +0000 2015,0,1,Solar startup to build big factory in upstate New York http://t.co/MITi7vYFZt
20,652130688737542145,Thu Oct 08 14:37:26 +0000 2015,0,0,Solar energy farm planned for site near Anderson airport http://t.co/lxFI7fhr2e
21,651852043154518016,Wed Oct 07 20:10:12 +0000 2015,1,0,Solar power on campus just makes sense http://t.co/EEZLKoDSPm
22,651834535794077696,Wed Oct 07 19:00:38 +0000 2015,0,0,Panasonic surpasses SolarCity with world's most efficient solar panel  http://t.co/1DtCwjbflV
23,651808731165016065,Wed Oct 07 17:18:06 +0000 2015,0,0,Solar energy shines for NY higher education http://t.co/76dqE70aTZ
24,651478341216825344,Tue Oct 06 19:25:15 +0000 2015,0,0,Zimbabwe government rolls out solar energy tapping projects http://t.co/Iv54n14IXV
25,651431789207142400,Tue Oct 06 16:20:16 +0000 2015,0,0,Alliant weighs boosting solar power generation http://t.co/k0O7s1JFDy
26,651414264054480896,Tue Oct 06 15:10:37 +0000 2015,0,0,First Aldi store rooftop coated in solar panels http://t.co/ScGewGoBw1
27,651090839549136896,Mon Oct 05 17:45:27 +0000 2015,0,1,Germany offers India 2 billion euros for solar energy http://t.co/XjyNwkD5cj
28,651046720646815744,Mon Oct 05 14:50:08 +0000 2015,0,0,Are solar panels now as cheap as fossil fuels? http://t.co/CVMw9cI2K2
29,650392831526371328,Sat Oct 03 19:31:49 +0000 2015,0,0,Brazil Doubles Its Solar PV Target To 7 GW By 2024 http://t.co/kHUY8u2rmC
30,649989863207510019,Fri Oct 02 16:50:34 +0000 2015,0,0,Solar energy is ready to expand dramatically in Texas http://t.co/bszkzsVv5U
31,649941888997322752,Fri Oct 02 13:39:56 +0000 2015,0,0,SolarCity to start making highly efficient solar panels later this month http://t.co/sBpiyFaqIh
32,649695051765936128,Thu Oct 01 21:19:05 +0000 2015,0,0,SkyPower Announces 2 GW of Solar Energy Projects in Bangladesh  https://t.co/baf2AohTVz
33,649656401757868032,Thu Oct 01 18:45:30 +0000 2015,0,0,NRV hospital using solar energy to power building (video) https://t.co/Tq4yVoaJHK
34,649593010448146432,Thu Oct 01 14:33:37 +0000 2015,0,0,Shell CEO: Solar Energy To Be Backbone Of World’s Energy http://t.co/UANDffzBcL
35,648931537480761344,Tue Sep 29 18:45:09 +0000 2015,0,0,Australia leads world in household solar panel installations http://t.co/CZMHh6eERj
36,648922304404148224,Tue Sep 29 18:08:28 +0000 2015,0,0,North Carolina Passes 1 GW Of Solar Capacity http://t.co/XUl9vR0vvC
37,648550477148332032,Mon Sep 28 17:30:57 +0000 2015,0,1,Washington Real Estate: Local Officials to Give Free Solar Panels to Low-Income Households http://t.co/LdY5OdbIEO
38,648525156554567680,Mon Sep 28 15:50:20 +0000 2015,0,0,Why an oil guy believes solar has a big future http://t.co/hcTIulLB20
39,648492135050813440,Mon Sep 28 13:39:08 +0000 2015,0,0,Obama's solar energy socialism http://t.co/ioywRNLekc
40,647147270404710400,Thu Sep 24 20:35:07 +0000 2015,0,0,Want to put solar panels on your roof?  http://t.co/pvQdi1d3Vy
41,647123618992943104,Thu Sep 24 19:01:08 +0000 2015,0,0,http://t.co/QCssuVe1YD
42,647073033698590720,Thu Sep 24 15:40:07 +0000 2015,0,0,http://t.co/CcxsIA6CrF
43,645223512257507328,Sat Sep 19 13:10:47 +0000 2015,0,0,"Wall Street’s Message to US Solar Companies: ‘It’s the Profitability, Stupid!’ http://t.co/PyTGu9wEtM"
44,644334986041159680,Thu Sep 17 02:20:06 +0000 2015,0,0,"Obama administration unveils US$120 million to spur solar energy development in US
http://t.co/8HMTTYtFub"
45,642094083645800449,Thu Sep 10 21:55:33 +0000 2015,0,0,Luminant to purchase 116 MW of solar power from SunEdison http://t.co/578a5CSiRr
46,642047588640890880,Thu Sep 10 18:50:48 +0000 2015,0,0,Dyesol does light soaking degredation test on lab sample perovskite solar cells http://t.co/gmn3YOVdMF
47,642003468505452544,Thu Sep 10 15:55:29 +0000 2015,1,0,Elegant solar-powered Shine light delivers 30+ hours of portable energy with just one charge http://t.co/p794bJdJqK
48,641959783021551616,Thu Sep 10 13:01:53 +0000 2015,1,1,Eight ways to reach 100% renewable in developing countries http://t.co/5l70LjygME
49,641954386944651264,Thu Sep 10 12:40:27 +0000 2015,0,0,Solar industry is being slashed and burned by the Tories http://t.co/oKlrWT8axl
50,639181293763342336,Wed Sep 02 21:01:10 +0000 2015,0,1,"IRS ruling indicates US community solar could qualify for ITC support.

http://t.co/rZQZ97YBxG"
51,639119371965698048,Wed Sep 02 16:55:07 +0000 2015,0,1,"Barack Obama singles out Koch brothers over fossil fuel lobbying
http://t.co/PhqJnOAGwP"
52,638685475323146240,Tue Sep 01 12:10:58 +0000 2015,1,2,Cost of Installed Solar Continues to Fall http://t.co/biNIxT6NC1
53,637356709242085376,Fri Aug 28 20:10:55 +0000 2015,0,1,"Revolutionary new solar window tech can make any glass pane into a solar panel
http://t.co/EnDXfNUO2i"
54,637061841726783488,Fri Aug 28 00:39:13 +0000 2015,3,6,"Go Green without pain get clean energy @ no cost 4 you
Follow our main page @solarpanel4free 
http://t.co/dsZvTrqXSi 
http://t.co/mfgz6T3KzU"
55,637061307619934209,Fri Aug 28 00:37:06 +0000 2015,1,0,RT @solarpanel4free: Another milestone in hybrid artificial photosynthesis http://t.co/zeVTkEKJyI
56,637061292486844416,Fri Aug 28 00:37:02 +0000 2015,1,0,RT @solarpanel4free: Canning byelection: solar industry urges voters to reject Liberals 'war on solar' http://t.co/9AZs3yt1sQ
57,637061271947382784,Fri Aug 28 00:36:57 +0000 2015,1,0,RT @solarpanel4free: Barack Obama warns his fossil-fuelled opponents he has clean energy to spare http://t.co/Z9mvIyvtpL
58,637061256092880896,Fri Aug 28 00:36:54 +0000 2015,1,0,RT @solarpanel4free: White House Announcement Means 'Today Is a Very Big Day for PACE' http://t.co/e2nPqDapfp
59,637061240582356992,Fri Aug 28 00:36:50 +0000 2015,1,0,RT @solarpanel4free: Nevada Ratepayer Advocate: Reject NV Energy Solar Plan http://t.co/bNvNcPz1me
60,637061226183331840,Fri Aug 28 00:36:47 +0000 2015,1,0,RT @solarpanel4free: Enphase claims ‘aggressive growth’ continues with New Zealand deal http://t.co/sUPRP4t5cg
