,id_str,created_at,retweet_count,favorite_count,text
0,644982975671611392,Fri Sep 18 21:14:59 +0000 2015,0,0,Overcoming Age in Your Resume http://t.co/i432Yax4J1 http://t.co/FYIE7PZHJZ
1,644619138946625536,Thu Sep 17 21:09:13 +0000 2015,0,0,Great Jobs for Millennials http://t.co/wsz9l64HKH http://t.co/5mooCMwjzn
2,644258389938208768,Wed Sep 16 21:15:44 +0000 2015,1,0,How to Follow Up After Your Interview http://t.co/wsz9l64HKH http://t.co/OPxwcIvKfL
3,643895565235847168,Tue Sep 15 21:14:00 +0000 2015,0,1,Will Personality Testing Replace Interviews? http://t.co/wsz9l64HKH http://t.co/bsCz6X5fbm
4,643532400664932353,Mon Sep 14 21:10:55 +0000 2015,0,1,Is Your Resume Keeping Up With the Times? http://t.co/wsz9l6mj9h http://t.co/OEMZGp1yS7
5,643393001344004096,Mon Sep 14 11:56:59 +0000 2015,0,1,What Hiring Managers Are Looking for in Your Cover Letter http://t.co/wsz9l64HKH http://t.co/xtZtuZCm78
6,641360783998193664,Tue Sep 08 21:21:41 +0000 2015,0,0,Is the Cover Letter Dead? http://t.co/wsz9l64HKH http://t.co/Ekm8i5sz7S
7,641360637759610880,Tue Sep 08 21:21:06 +0000 2015,0,0,My Resume Says it All so Why Do I Need a Cover Letter? http://t.co/wsz9l64HKH http://t.co/KoEaPQh31N
8,640997149019406336,Mon Sep 07 21:16:44 +0000 2015,0,0,Why Frequent Job Changes May Not Be Bad For Your Career http://t.co/wsz9l6mj9h http://t.co/02I5u8JvS9
9,640997016814882820,Mon Sep 07 21:16:12 +0000 2015,0,0,How to Recover From a Setback at Work http://t.co/wsz9l6mj9h http://t.co/TA3JzFYewp
10,640634111116316673,Sun Sep 06 21:14:09 +0000 2015,0,0,Understanding the Job Search in Modern Times http://t.co/wsz9l6mj9h http://t.co/V4PKLad52v
11,640269960921653248,Sat Sep 05 21:07:08 +0000 2015,0,0,Check Out the Company Culture Before Applying http://t.co/wsz9l6mj9h http://t.co/yRBHIZ7SXY
12,639910181338525696,Fri Sep 04 21:17:30 +0000 2015,0,0,Is Telecommuting a Good Option? http://t.co/wsz9l6mj9h http://t.co/JXx3NzBlj7
13,639547278353670144,Thu Sep 03 21:15:28 +0000 2015,0,2,The New Resume http://t.co/wsz9l6mj9h http://t.co/XSkf3c04bm
14,639547129493635072,Thu Sep 03 21:14:52 +0000 2015,0,0,Should I Use My Current Boss as a Reference? http://t.co/wsz9l6mj9h http://t.co/P9hKF4naQa
15,639385432069902336,Thu Sep 03 10:32:20 +0000 2015,0,0,Tips for Your R-E-S-U-M-E http://t.co/wsz9l6mj9h http://t.co/TS7CPCyBTU
16,635945485744885761,Mon Aug 24 22:43:13 +0000 2015,0,0,Millennials and Their Job Search http://t.co/wsz9l6mj9h http://t.co/TuKlb1x9fQ
17,635938784421482496,Mon Aug 24 22:16:36 +0000 2015,0,0,Somethings to Think about Before Signing Up for College http://t.co/wsz9l6mj9h http://t.co/bzoPCZZ8Ji
18,635931997744054272,Mon Aug 24 21:49:37 +0000 2015,0,0,Convincing the Hiring Manager that You are the Right Candidate http://t.co/wsz9l6mj9h http://t.co/SB2orWphCv
19,635925478352793600,Mon Aug 24 21:23:43 +0000 2015,0,0,Shaking Off Anxiety Prior to the Interview http://t.co/wsz9l6mj9h http://t.co/uNkUlRcyOB
20,635595801343864832,Sun Aug 23 23:33:42 +0000 2015,0,0,Set Your Goal Using S.M.A.R.T. http://t.co/wsz9l64HKH http://t.co/EJ3SnR2eJ1
21,635589248536702976,Sun Aug 23 23:07:40 +0000 2015,0,0,How Would You Feel About a One Question Interview? http://t.co/wsz9l6mj9h http://t.co/MPrCnoTcdU
22,635582002482290688,Sun Aug 23 22:38:52 +0000 2015,0,0,Cover Letter Writing Guide http://t.co/wsz9l6mj9h http://t.co/oguFFnjjIF
23,635575299187544064,Sun Aug 23 22:12:14 +0000 2015,0,0,Be the Co-Worker Everyone Loves http://t.co/wsz9l6mj9h http://t.co/VvZpdODop5
24,635568766613618688,Sun Aug 23 21:46:16 +0000 2015,0,0,Employers Will Hire for These Reasons http://t.co/wsz9l6mj9h http://t.co/cowyTN8r40
25,635562621727571968,Sun Aug 23 21:21:51 +0000 2015,0,0,3 Job Interview Tips http://t.co/wsz9l6mj9h http://t.co/vevVCwIgUW
26,635228288634494976,Sat Aug 22 23:13:20 +0000 2015,0,0,Have You Considered Setting Up an Exploratory Interview? http://t.co/wsz9l6mj9h http://t.co/uTieG963m2
27,635222283351654401,Sat Aug 22 22:49:28 +0000 2015,0,0,Consider Deleting These Words From Your Resume http://t.co/wsz9l6mj9h http://t.co/JygqyypYdm
28,635213811948109824,Sat Aug 22 22:15:49 +0000 2015,0,0,How to Follow Up After Your Interview http://t.co/wsz9l6mj9h http://t.co/OQCAbbzmhs
29,635200449570820096,Sat Aug 22 21:22:43 +0000 2015,0,0,Is It Better to Resign or to Get Fired? http://t.co/wsz9l6mj9h http://t.co/TqgWEOb8T9
30,634869717090627584,Fri Aug 21 23:28:30 +0000 2015,0,0,Seven Ways to Bring Excitement to Your Resume http://t.co/wsz9l6mj9h http://t.co/sBzkgnZ2eQ
31,634863857643712512,Fri Aug 21 23:05:13 +0000 2015,0,0,Read and Heed This Bad Career Advice http://t.co/wsz9l6mj9h http://t.co/AYFww15UJV
32,634857281751023616,Fri Aug 21 22:39:05 +0000 2015,0,0,Explaining Your Employment Gaps http://t.co/wsz9l6mj9h http://t.co/LQQLGZu4CQ
33,634851485667454976,Fri Aug 21 22:16:03 +0000 2015,0,0,Keeping Your Cool When The Interviewer is Not http://t.co/wsz9l6mj9h http://t.co/Ipoq5tyuNN
34,634844520836911105,Fri Aug 21 21:48:23 +0000 2015,0,0,Personality Testing is Becoming the New Normal http://t.co/wsz9l6mj9h http://t.co/p61OA1B6Kc
35,634838578309296128,Fri Aug 21 21:24:46 +0000 2015,0,0,7 Secrets to a Great Cover Letter http://t.co/wsz9l6mj9h http://t.co/405t1JdfLu
36,634685894159634432,Fri Aug 21 11:18:03 +0000 2015,0,0,Resumes of the Future http://t.co/wsz9l6mj9h http://t.co/WHsf9CTQHm
37,634681463435325440,Fri Aug 21 11:00:27 +0000 2015,0,0,Is This the Key to Hearing Back to Employers? http://t.co/wsz9l6mj9h http://t.co/zTc23GIN3F
38,634673144809308160,Fri Aug 21 10:27:24 +0000 2015,0,0,How to Restart a Stalled Career http://t.co/wsz9l6mj9h http://t.co/LXoMibLqB0
39,634507575241871360,Thu Aug 20 23:29:29 +0000 2015,0,0,Baby Boomers Say Getting a Job Is Harder Today http://t.co/wsz9l6mj9h http://t.co/Com4H9iN3U
40,634489420553564160,Thu Aug 20 22:17:20 +0000 2015,0,0,Finding Your Dream Job in 30 Days http://t.co/wsz9l6mj9h http://t.co/nGwMnU4CLF
41,634475717309407232,Thu Aug 20 21:22:53 +0000 2015,0,0,Is It Better to Have Education or to Have Experience? http://t.co/wsz9l6mj9h http://t.co/jwoH1spRCJ
42,634197936113643520,Thu Aug 20 02:59:05 +0000 2015,0,0,Be the Co-Worker Everyone Loves http://t.co/wsz9l6mj9h http://t.co/SwQjalNRev
43,634183787853840385,Thu Aug 20 02:02:52 +0000 2015,0,0,What Colors Should You Steer Clear of When Interviewing? http://t.co/wsz9l6mj9h http://t.co/LfeyPBCTG7
44,634168516791390210,Thu Aug 20 01:02:11 +0000 2015,0,0,How to Restart a Stalled Career http://t.co/wsz9l6mj9h http://t.co/KqvshIiHyS
45,634158586852208640,Thu Aug 20 00:22:43 +0000 2015,0,0,Is It Better to Resign or to Get Fired? http://t.co/wsz9l6mj9h http://t.co/Ml6PWrFckH
46,634148752849248256,Wed Aug 19 23:43:39 +0000 2015,0,0,Cover Letter Writing Guide http://t.co/wsz9l6mj9h http://t.co/dL8VrQC86W
47,634135925510041600,Wed Aug 19 22:52:40 +0000 2015,0,0,Consider Deleting These Words From Your Resume http://t.co/wsz9l6mj9h http://t.co/2PLZgCrndY
48,634044524663341056,Wed Aug 19 16:49:29 +0000 2015,0,0,Tips to Deal With a Hostile Interviewer http://t.co/wsz9l6mj9h http://t.co/vaL3dU7xZG
49,634030171302006784,Wed Aug 19 15:52:27 +0000 2015,0,0,Employers Look For These Four Items on Your Resume http://t.co/wsz9l6mj9h http://t.co/xZfiw0BHSI
50,634015754241855488,Wed Aug 19 14:55:09 +0000 2015,0,0,Getting Past The Gatekeepers http://t.co/wsz9l6mj9h http://t.co/I3A1QH34KK
51,634005160457580544,Wed Aug 19 14:13:04 +0000 2015,2,2,Reasons Why Your Resume Isn't Getting a Response http://t.co/wsz9l6mj9h http://t.co/DyLshYTqhY
52,630518683991838720,Sun Aug 09 23:19:03 +0000 2015,0,0,What NOT to Include in Your Cover Letter http://t.co/wsz9l64HKH http://t.co/tJNn9nFAtH
53,630510803091746816,Sun Aug 09 22:47:44 +0000 2015,0,0,Great Networker Qualities http://t.co/wsz9l64HKH http://t.co/8hFLEWijsv
54,630503242909126656,Sun Aug 09 22:17:41 +0000 2015,0,0,Make Your Resume Stand Out http://t.co/wsz9l64HKH http://t.co/UZkR9QMVe1
55,630495165300371457,Sun Aug 09 21:45:36 +0000 2015,0,0,The Worst Opening Cover Letter Lines Ever http://t.co/wsz9l64HKH http://t.co/0zcqx3Oq7F
56,630487988510666752,Sun Aug 09 21:17:05 +0000 2015,0,0,What to Do When You Have No Relevant Experience http://t.co/wsz9l64HKH http://t.co/1YXphu6vu0
57,630193461036122112,Sun Aug 09 01:46:44 +0000 2015,0,0,Will Rescheduling My Interview Look Bad? http://t.co/wsz9l64HKH http://t.co/kSBGVDYGb2
58,630180831881859072,Sun Aug 09 00:56:33 +0000 2015,0,0,Will Personality Testing Replace Interviews? http://t.co/wsz9l64HKH http://t.co/lSdvafWdOi
59,630170822259314689,Sun Aug 09 00:16:46 +0000 2015,0,0,Top 5 Tips for Experienced Employees http://t.co/wsz9l64HKH http://t.co/XfnKpXf04k
60,630156308096749568,Sat Aug 08 23:19:06 +0000 2015,0,0,Kickstarting Conversation at a Networking Event http://t.co/wsz9l64HKH http://t.co/SYPNL0zlpB
61,630142056174780416,Sat Aug 08 22:22:28 +0000 2015,0,0,Consider Deleting These Words From Your Resume http://t.co/wsz9l64HKH http://t.co/JNGB2POKhG
62,630131328717983744,Sat Aug 08 21:39:50 +0000 2015,0,0,Personality Testing is Becoming the New Normal http://t.co/wsz9l64HKH http://t.co/lb0zKe2c5H
63,629815394887270400,Sat Aug 08 00:44:26 +0000 2015,0,0,3 Job Interview Tips http://t.co/wsz9l64HKH http://t.co/XY2Wm0gF6o
64,629803477380698112,Fri Aug 07 23:57:04 +0000 2015,0,0,Staying Positive During the Job Search http://t.co/wsz9l64HKH http://t.co/T1NL8Nmuhn
65,629792686023639040,Fri Aug 07 23:14:11 +0000 2015,0,0,What's In It For The Employer? http://t.co/wsz9l64HKH http://t.co/5W90S7k1Cn
66,629777469675978752,Fri Aug 07 22:13:44 +0000 2015,0,0,3 Job Interview Tips http://t.co/wsz9l64HKH http://t.co/J8nwta70cW
67,629764505300414464,Fri Aug 07 21:22:13 +0000 2015,0,0,What Story Does Your Resume Tell? http://t.co/wsz9l64HKH http://t.co/3ogXsGPRvd
68,629435976553631744,Thu Aug 06 23:36:45 +0000 2015,0,0,Set Your Goal Using S.M.A.R.T. http://t.co/wsz9l64HKH http://t.co/a3lbjoUvqA
69,629420865487179777,Thu Aug 06 22:36:43 +0000 2015,0,0,Top Five Reasons Employees Quit http://t.co/wsz9l64HKH http://t.co/hYg0UDKu9w
70,629406478865031169,Thu Aug 06 21:39:33 +0000 2015,0,0,What Hiring Managers Are Looking for in Your Cover Letter http://t.co/wsz9l64HKH http://t.co/jFv7RzuYAG
71,629093549808578560,Thu Aug 06 00:56:04 +0000 2015,0,0,Top 5 Tips for Experienced Employees http://t.co/wsz9l64HKH http://t.co/n8jZXkLo78
72,629080212265807872,Thu Aug 06 00:03:05 +0000 2015,0,0,Shaking Off Anxiety Prior to the Interview http://t.co/wsz9l64HKH http://t.co/POv2ofz04q
73,629064535530299392,Wed Aug 05 23:00:47 +0000 2015,0,0,7 Secrets to a Great Cover Letter http://t.co/wsz9l64HKH http://t.co/T8tvGkKqTY
74,629051550019620864,Wed Aug 05 22:09:11 +0000 2015,0,0,What to Do When You Have No Relevant Experience http://t.co/wsz9l64HKH http://t.co/dWnUpK6kUK
75,629037012746571777,Wed Aug 05 21:11:25 +0000 2015,0,0,Why are Job Seekers Facing Longer Hiring Time? http://t.co/wsz9l64HKH http://t.co/Ik651TBPlF
76,628720369361268736,Wed Aug 05 00:13:11 +0000 2015,0,0,The New Resume http://t.co/wsz9l64HKH http://t.co/T88v7gKBPE
77,628702515303858177,Tue Aug 04 23:02:15 +0000 2015,0,0,Finding a Job When You're Not Sure of Your Career Path http://t.co/wsz9l64HKH http://t.co/8XtRNWpPvw
78,628685775882686465,Tue Aug 04 21:55:44 +0000 2015,0,0,What to Do When You Have No Relevant Experience http://t.co/wsz9l64HKH http://t.co/KS5VSc7iV2
79,628373081484988416,Tue Aug 04 01:13:11 +0000 2015,0,0,Dealing With Workplace Bullies http://t.co/wsz9l64HKH http://t.co/8S7lE0xj3k
80,628361447559409664,Tue Aug 04 00:26:58 +0000 2015,0,0,Cover Letters Do Matter http://t.co/wsz9l64HKH http://t.co/wviAle1nRZ
81,628347752003473409,Mon Aug 03 23:32:32 +0000 2015,0,0,What to Do When You Have No Relevant Experience http://t.co/wsz9l64HKH http://t.co/EA51nQWkj0
82,628332839512047616,Mon Aug 03 22:33:17 +0000 2015,0,0,Fitting Your Resume to the Job Posting http://t.co/wsz9l64HKH http://t.co/UzTRXcB98h
83,628321260414574596,Mon Aug 03 21:47:16 +0000 2015,0,0,Dealing With a Bully Boss http://t.co/wsz9l6mj9h http://t.co/dvKwyVKb5M
84,627985807790374912,Sun Aug 02 23:34:18 +0000 2015,0,0,How to Follow Up After Your Interview http://t.co/wsz9l64HKH http://t.co/oX84BCBGON
85,627980441144852480,Sun Aug 02 23:12:59 +0000 2015,0,0,5 Job Search Tactics to Stop Immediately http://t.co/wsz9l64HKH http://t.co/fQD0zdJqjh
86,627974990680293380,Sun Aug 02 22:51:19 +0000 2015,0,0,7 Cover Letter Tips to Catch an Employer's Eye http://t.co/wsz9l64HKH http://t.co/K8KIW9Hnt0
87,627968628709720064,Sun Aug 02 22:26:02 +0000 2015,0,0,What is the Best Way to Handle Office Conflict? http://t.co/wsz9l64HKH http://t.co/detoGbnuoI
88,626914495953305600,Fri Jul 31 00:37:18 +0000 2015,1,0,Why Frequent Job Changes May Not Be Bad For Your Career http://t.co/wsz9l6mj9h http://t.co/t4LGFW7CWF
89,626883498255732736,Thu Jul 30 22:34:07 +0000 2015,0,0,Talent Solutions Increase Company's Performance http://t.co/wsz9l6mj9h http://t.co/ejYU1HyA0P
90,626883379691155456,Thu Jul 30 22:33:39 +0000 2015,0,0,The New Resume http://t.co/wsz9l6mj9h http://t.co/ISLpyCs8sl
91,626883249583878145,Thu Jul 30 22:33:08 +0000 2015,0,0,7 Cover Letter Tips to Catch an Employer's Eye http://t.co/wsz9l6mj9h http://t.co/0JHFxrIZgP
92,626549098838163458,Thu Jul 30 00:25:20 +0000 2015,0,0,What Colors Should You Steer Clear of When Interviewing? http://t.co/wsz9l6mj9h http://t.co/q3oONybjxr
93,626529324586401792,Wed Jul 29 23:06:45 +0000 2015,0,0,Avoid These Turnoffs at Your Next Interview http://t.co/wsz9l6mj9h http://t.co/UyciuqY0Pb
94,626529181254287360,Wed Jul 29 23:06:11 +0000 2015,0,0,Include These in Your Post Interview Follow-Up Note http://t.co/wsz9l64HKH http://t.co/Z6Ja1bpBqK
95,626529009845825536,Wed Jul 29 23:05:30 +0000 2015,0,0,Great Networker Qualities http://t.co/wsz9l6mj9h http://t.co/uqYTUZ08Oz
96,626178751412502529,Tue Jul 28 23:53:42 +0000 2015,0,0,Great Jobs for Millennials http://t.co/wsz9l6mj9h http://t.co/xThHv75MVH
97,626160874902978560,Tue Jul 28 22:42:40 +0000 2015,0,0,3 Ridiculously Obvious Things That Successful Job Seekers Do http://t.co/wsz9l6mj9h http://t.co/TTlG4HDgqA
98,626160762260713472,Tue Jul 28 22:42:13 +0000 2015,0,0,The New Resume http://t.co/wsz9l6mj9h http://t.co/7u42PhXOGJ
99,626140558814244864,Tue Jul 28 21:21:57 +0000 2015,0,0,Great Networker Qualities http://t.co/wsz9l6mj9h http://t.co/JGyyWF6N9C
100,626140434885160960,Tue Jul 28 21:21:27 +0000 2015,0,0,Working From Home Successfully http://t.co/wsz9l6mj9h http://t.co/mQsrRDfW0U
101,625818734490464256,Tue Jul 28 00:03:08 +0000 2015,0,0,Tips for Your R-E-S-U-M-E http://t.co/wsz9l6mj9h http://t.co/fCCBYg4t1p
102,625788850217029632,Mon Jul 27 22:04:23 +0000 2015,0,0,Is It Better to Resign or to Get Fired? http://t.co/wsz9l6mj9h http://t.co/MgMkwgi6HQ
103,625788624131489792,Mon Jul 27 22:03:29 +0000 2015,0,0,What NOT to Include in Your Cover Letter http://t.co/wsz9l6mj9h http://t.co/jx7HlcOdbr
104,625431946349400064,Sun Jul 26 22:26:10 +0000 2015,0,0,"Giver, Taker or Matcher - Which Are You? http://t.co/wsz9l6mj9h http://t.co/dEY3MM0yLR"
105,625431819161350144,Sun Jul 26 22:25:40 +0000 2015,0,0,Set Your Goal Using S.M.A.R.T. http://t.co/wsz9l6mj9h http://t.co/9IjPOjotjh
106,625431705227239424,Sun Jul 26 22:25:13 +0000 2015,0,0,Tips for Your R-E-S-U-M-E http://t.co/wsz9l6mj9h http://t.co/dM2xvqWeHg
107,625085719770451968,Sat Jul 25 23:30:23 +0000 2015,0,0,Understanding the Job Search in Modern Times http://t.co/wsz9l6mj9h http://t.co/U15HzMYCNF
108,625085582738370560,Sat Jul 25 23:29:51 +0000 2015,0,0,Getting the Job That You Want http://t.co/wsz9l6mj9h http://t.co/UFxjyNcwRv
109,625063833959317504,Sat Jul 25 22:03:25 +0000 2015,0,0,Is the Cover Letter Dead? http://t.co/wsz9l6mj9h http://t.co/gC7snNQOZx
110,625063699074678788,Sat Jul 25 22:02:53 +0000 2015,0,0,What is Your Greatest Weakness? http://t.co/wsz9l6mj9h http://t.co/UpDHYNjzPn
111,625019641983856641,Sat Jul 25 19:07:49 +0000 2015,0,0,Personality Testing is Becoming the New Normal http://t.co/wsz9l6mj9h http://t.co/ozgxhiTVf4
112,625019512803475457,Sat Jul 25 19:07:18 +0000 2015,0,0,10 Reasons Why You Didn't Get a Callback http://t.co/wsz9l6mj9h http://t.co/dMijeU6Gy8
113,625019373703548928,Sat Jul 25 19:06:45 +0000 2015,0,0,Baby Boomers Say Getting a Job Is Harder Today http://t.co/wsz9l6mj9h http://t.co/rXgf1jVOC0
114,624631619635277824,Fri Jul 24 17:25:57 +0000 2015,0,0,More Tips to Make Your Resume Stand Out http://t.co/wsz9l6mj9h http://t.co/ieYxF1W8TV
115,624631478215946241,Fri Jul 24 17:25:24 +0000 2015,0,0,How to Restart a Stalled Career http://t.co/wsz9l6mj9h http://t.co/FWYd9s9xz4
116,624596392409894913,Fri Jul 24 15:05:59 +0000 2015,0,0,Convincing the Hiring Manager that You are the Right Candidate http://t.co/wsz9l64HKH http://t.co/MOYM2vPbMM
117,624591836342923265,Fri Jul 24 14:47:52 +0000 2015,0,0,What's Keeping the Jobless From Getting Jobs? http://t.co/wsz9l64HKH http://t.co/Ee4w2C6jpk
118,624591668063244290,Fri Jul 24 14:47:12 +0000 2015,0,0,Employers Will Hire for These Reasons http://t.co/wsz9l64HKH http://t.co/1xmBk9ieqG
