,id_str,created_at,retweet_count,favorite_count,text
174,485947138933682176,Mon Jul 07 00:43:21 +0000 2014,1,0,Fashionable in the Rethink tent #rethinkattheraces #qp14 @rethinktweet mynameispea http://t.co/uCCiuvhH70
175,485946611462602752,Mon Jul 07 00:41:15 +0000 2014,1,0,Amazing day at the races #rethinkattheraces @rethinktweet #qp14 @nikki_byrne http://t.co/9RyQFujENh
176,484129363894349824,Wed Jul 02 00:20:09 +0000 2014,1,1,A bunting we will go. #rethinkattheraces @rethinktweet #artsandcrafts http://t.co/96qMNAdV8b
177,484128771294113792,Wed Jul 02 00:17:48 +0000 2014,0,0,Monday night roof top movies! #stormsurfers #smokeyandthebandit hosted by @henrysperson &amp;… http://t.co/d3yq1c10Zf
178,484127418060640256,Wed Jul 02 00:12:25 +0000 2014,0,0,Great weekend started with Saturday on the island #snakeisland http://t.co/zFQGVb7Pza
179,482151219319025665,Thu Jun 26 13:19:43 +0000 2014,8,0,"RT @rethinktweet: Are you interested in volunteering for Rethink? To get involved visit:
http://t.co/4isf2SwQYP @VolunteerCanada @Volunteer…"
180,479404157489528832,Wed Jun 18 23:23:52 +0000 2014,0,0,Happiness is a day at a vineyard #bestie http://t.co/l9aHWu8NMf
181,479372186436644864,Wed Jun 18 21:16:50 +0000 2014,0,1,Stroll through the vineyard. #peninsularidge @lindsaygrange #morewineplease http://t.co/ezwtV6Y4EU
182,479287871812038656,Wed Jun 18 15:41:48 +0000 2014,0,2,Great wine tasting at #peninsularidge #staffappreciationday @nikki_byrne stephanieapplin… http://t.co/OdzBrAbwq7
183,478255207781236736,Sun Jun 15 19:18:21 +0000 2014,0,0,Inspired by Father's Day I'm at the #woodbineoaks wearing the first pin he gave to my mom. I just got… http://t.co/6tNOamvC7p
184,478226832085774336,Sun Jun 15 17:25:36 +0000 2014,1,0,First bet places at the #woodbineoaks  Wish me luck! #fastmoney @WoodbineRacing
185,477511882794741762,Fri Jun 13 18:04:39 +0000 2014,1,0,"Its a race till the 6th of July, get your tickets to #rethinkAtTheRaces here http://t.co/CWd5Vkb8gN"
186,477083886057684992,Thu Jun 12 13:43:56 +0000 2014,0,0,It only took me 15 min to vote this morning! #getoutandvote #voteontario #civicresponsibility
187,476004179853336578,Mon Jun 09 14:13:34 +0000 2014,0,0,I got : Lauren Bacall! Enough Said. http://t.co/oct4uZLAhZ via @play_buzz
188,475396825390645248,Sat Jun 07 22:00:10 +0000 2014,0,0,Enjoying the #duwest festival. #sunnydays #community http://t.co/5OWTB2tPv7
189,474394222649307137,Thu Jun 05 03:36:11 +0000 2014,10,0,RT @canadianliving: Shocked to hear about the shooting of RCMP officers in #Moncton. Our thoughts are with their family and friends. http:/…
190,471705341994868736,Wed May 28 17:31:32 +0000 2014,1,0,"RT @exclaimnews: Belle and Sebastian (@bellesglasgow) Start Recording New Album, Announce Reissue Series: http://t.co/0vamNapSH7 cc: @matad…"
191,470769224139300864,Mon May 26 03:31:44 +0000 2014,2,0,RT @rethinktweet: Our very own @diannaklisanin is all set to do the 5km! @rmswomensrun #yougogirl # #canmore #breastcancer http://t.co/GICl…
192,470344861103554560,Sat May 24 23:25:28 +0000 2014,0,0,Living up to my new motto. #outdoorsy #canmore #cocktails @nikki_byrne http://t.co/v489f6fF2D
193,470019248308244481,Sat May 24 01:51:35 +0000 2014,0,0,The long way home. @nikki_byrne #canmore http://t.co/5uxB7SQNkv
194,466603677365444608,Wed May 14 15:39:20 +0000 2014,0,0,I need one of these in Toronto! I'm obsessed with my nails. La Lacquerie Brings the Nail Salon to You @InStyle http://t.co/DNEBrSHVv1
195,465575626779291648,Sun May 11 19:34:14 +0000 2014,0,0,Happy Mother's Day! #momselfie http://t.co/dWqkJWXo96
196,464396898523029506,Thu May 08 13:30:23 +0000 2014,3,0,RT @MariaKHerman: Heading to the @rethinktweet event tomorrow. You should too! http://t.co/LrfiBxuoyF @DawnWhitwell @Martha_ONeill @diannak…
197,461595520733958144,Wed Apr 30 19:58:42 +0000 2014,0,1,Shh - don't tell anyone.  BBC - Travel - When did Toronto get so cool? : Toronto http://t.co/ORgPVWWpDc
198,461514244438388736,Wed Apr 30 14:35:45 +0000 2014,0,0,Yeah I got my txt for Beyonce &amp; Jay Z! https://t.co/wkuLhkPJTp #wicked
199,460898278276861953,Mon Apr 28 21:48:07 +0000 2014,0,0,A pampered morning at #Civello thanks @rethinktweet http://t.co/Nzi6UdCcN3
