,id_str,created_at,retweet_count,favorite_count,text
0,660541539974778880,Sat Oct 31 19:39:10 +0000 2015,0,0,Happy Halloween #scaryboo #pumpkinhead #eatmorelittlechocotebars https://t.co/cNPtMyq321
1,658017871797317632,Sat Oct 24 20:31:00 +0000 2015,0,0,Out with my favourite gal pals. #caskdays @egbrickworks https://t.co/ElwH3D1NW7
2,656924757485604864,Wed Oct 21 20:07:21 +0000 2015,0,0,Good luck boys! #comeTOgether #boyofsummer @bluejays https://t.co/RPDkECFehe
3,656562337709760512,Tue Oct 20 20:07:14 +0000 2015,0,1,Go Jays Go! #comeTOgether #toronto https://t.co/X0eWDVwM2T
4,656280476529926145,Tue Oct 20 01:27:13 +0000 2015,0,0,I'm prepping for the orange crush in Quebec and riding the #bluejay wave. #elxn42 #ComeTogether
5,654467488181321728,Thu Oct 15 01:23:03 +0000 2015,0,0,What an amazing night! Dinner at #yasu and the @bluejays win game five.… https://t.co/iaSmvreHSI
6,651604392819474432,Wed Oct 07 03:46:08 +0000 2015,0,3,Madge has my heart. #rebelheart  #Toronto  #icon @madonna https://t.co/DX8mMHo8Q6
7,650105822182277120,Sat Oct 03 00:31:21 +0000 2015,0,0,Beautiful bouquets of flowers are sold on the honour system. We bought 2… https://t.co/ZDMoCr8fKU
8,649922507504529408,Fri Oct 02 12:22:55 +0000 2015,0,0,I got: David Price!  http://t.co/nS2lVdJeSQ via @Cut4
9,648959385042055169,Tue Sep 29 20:35:49 +0000 2015,0,0,Stop the madness! You can now make actual Coke at home -- in a Keurig http://t.co/cOnJsJAiSV #environmentaldisaster
10,648224006768824320,Sun Sep 27 19:53:41 +0000 2015,0,0,Christine and 48000 of her closest friends. @bluejays #comeTOgether… https://t.co/Kf7UzEhk3m
11,646738647807586305,Wed Sep 23 17:31:24 +0000 2015,0,0,Today's project is pickles! #domesticateddiva #dilliscous https://t.co/QURvuiCBpl
12,646145684924706816,Tue Sep 22 02:15:10 +0000 2015,0,0,Course three family style for just the two of us. #doggybagrequired… https://t.co/o7q64Rff4l
13,645795835796660225,Mon Sep 21 03:05:00 +0000 2015,0,0,Never to late for a ride #polishfestival2015 #Toronto https://t.co/QnerZdJyYG
14,643483322849472512,Mon Sep 14 17:55:54 +0000 2015,0,0,"My TIFF'ng has begun w The Reflektor Tapes, frenetic, rhythmic &amp; beautifully shot https://t.co/8pTuXJTlXg @arcadefire @TIFF_NET #kahiljoseph"
15,637017095738425344,Thu Aug 27 21:41:25 +0000 2015,0,0,Ice show in the summer! #letsgototheex #virtueandmoir https://t.co/dRKSAUvCnU
16,637006247498260480,Thu Aug 27 20:58:19 +0000 2015,0,0,Great day at the CNE! #nofilter #letsgototheex https://t.co/XuWXsh4h70
17,637005354832936964,Thu Aug 27 20:54:46 +0000 2015,0,0,Getting a few pointers at the CNE for tomorrow's battle axe throwing.… https://t.co/uVt5fLWWYo
18,636204931855314944,Tue Aug 25 15:54:10 +0000 2015,0,0,My handsome dates for David &amp; Peter's wedding. #gethitched #luckiestgirl https://t.co/VN0fm1Z4QA
19,634039874958528513,Wed Aug 19 16:31:00 +0000 2015,0,0,Shannon's moving day and new beginnings!! #hottestdaytomove #Toronto https://t.co/1Vg3GhfRG2
20,629681577505783808,Fri Aug 07 15:52:41 +0000 2015,0,0,Race is tomorrow it's a training day for these amazing athletes! #parapan… https://t.co/JwBg3sj8AV
21,629468377787035654,Fri Aug 07 01:45:30 +0000 2015,1,0,RT @HenrysPerson: Mulcair's answer on C-51 is what makes Trudeau seem naive. #macdebate
22,629465242926481408,Fri Aug 07 01:33:03 +0000 2015,166,0,RT @BuzzFeedCanada: Here is your official 2015 Federal Election Debate Drinking Game 🍷🍺🍸: http://t.co/M9Vw0BZ6t1 #elxn42 #macdebate http://…
23,629460502540759040,Fri Aug 07 01:14:13 +0000 2015,5,0,"RT @jm_mcgrath: Okay, feeling better about national politics in Canada now. https://t.co/vRvlZh9TRW"
24,629458966930587649,Fri Aug 07 01:08:07 +0000 2015,0,1,Agree to be disagreeable. Elizabeth May should be moderating the #macdebate #elexn42
25,629457899635412993,Fri Aug 07 01:03:52 +0000 2015,0,0,Love it!  https://t.co/1dUuru9A5S
26,629453315265269761,Fri Aug 07 00:45:39 +0000 2015,0,1,"I like it ""user pay and polluter pay"". Mulcair #macdeabte #elxn42"
27,629452141522845696,Fri Aug 07 00:40:59 +0000 2015,0,0,Harper has proposed an integrated North American climate plan. U.S. and Mexico are Canadian environment scapegoats. #macdebate #elxn42
28,629449358899982336,Fri Aug 07 00:29:56 +0000 2015,0,0,Not sure who's winning the debate but thrilled that Elizabeth May is holding her own. #elxn2015
29,629090010776645633,Thu Aug 06 00:42:01 +0000 2015,0,0,Take me out to the ballgame. For a #grand slam! #toronto @bluejays #nofilter https://t.co/7V3ajWcPbv
30,628706121436545024,Tue Aug 04 23:16:34 +0000 2015,0,0,@WINDmobile that's ironic after an hour on the they wouldnt give me my info over the phone wasted more time at a store  CSRs were no help.
31,628672125570838528,Tue Aug 04 21:01:29 +0000 2015,0,0,I've had the worst experience with @WINDmobile. No help with identity theft. #dontusewindmobile #fraud #badcustumerserivce
32,625419262396641280,Sun Jul 26 21:35:46 +0000 2015,0,0,Soaking up rays poolside. #lazysunday #hotandhumid #tottenham #sistersrock https://t.co/eTqaV40O8g
33,625306711532945409,Sun Jul 26 14:08:32 +0000 2015,0,0,I love the salvaged doors into Tottenham's Sunday farmers market. #pickles #jams #ontariogrown… https://t.co/K8YcHjnij5
34,623544459498778624,Tue Jul 21 17:25:58 +0000 2015,0,0,The morning in High Park. #toronto #chillout #favouriteguy https://t.co/Tgies2sH8T
35,623347568374902784,Tue Jul 21 04:23:36 +0000 2015,0,1,Celebrating their gold medal victory. #teamCanada #basketballCanada #Panamania https://t.co/fupIX7KnDa
36,623325988739526656,Tue Jul 21 02:57:51 +0000 2015,0,0,Gold for #Canada!!#Panamania https://t.co/PAocXyjoLb
37,623313190609362944,Tue Jul 21 02:06:59 +0000 2015,0,0,Nothin' but net! #Panamania #gocanadago https://t.co/AdQTlb2WtQ
38,623307383364820992,Tue Jul 21 01:43:55 +0000 2015,0,0,1/2 time and Canada's women basketball is tied! #Panamania #gocanadago #wickedseats https://t.co/ByrLCleLAz
39,623291905892335616,Tue Jul 21 00:42:25 +0000 2015,0,0,Super excited! My first gold medal match. #Panamania #gocanadago #thankscarm https://t.co/ndrVAEwyJU
40,623166761135927296,Mon Jul 20 16:25:08 +0000 2015,0,0,Love the sign! #Panamania #toronto https://t.co/AQCRoyidC1
41,622247070422966272,Sat Jul 18 03:30:37 +0000 2015,0,1,The start to a great meal #langdonhall. #leagueofextrodinarychefs #bbq https://t.co/M3k1GwPDv7
42,621727355023806464,Thu Jul 16 17:05:27 +0000 2015,0,0,Team Canada warming up for their match against Mexico. #Panamania #goteamcananda #handball nata.m.h https://t.co/wKnaPz6c8b
43,621724596694315008,Thu Jul 16 16:54:29 +0000 2015,0,0,Next stop women's handball! Brazil is amazing! #Panamania nata.m.h https://t.co/571Vhy8G7o
44,621723556670533636,Thu Jul 16 16:50:21 +0000 2015,0,0,We have officially started our #Panamania tour today. First stop beach volleyball. nata.m.h https://t.co/job9geL9QK
45,619364986708692992,Fri Jul 10 04:38:14 +0000 2015,0,1,Amazing concert!!!  drinadinon @foofighters #rockgods #molsonampitheatre #nofilter https://t.co/ddS57DeefR
46,619298833953091584,Fri Jul 10 00:15:22 +0000 2015,0,0,Can't wait! Rockin out with my sister. @foofighters drinadinon #brokenlegtour #nofilter https://t.co/hQUX9ICfap
47,614477650111787008,Fri Jun 26 16:57:42 +0000 2015,0,0,Heaven. #cottage #Bancroft #happyprideweekend #nofilter https://t.co/vxrf4fYNwN
48,613737794058461184,Wed Jun 24 15:57:47 +0000 2015,0,2,Shoe gazing at the @batashoemuseum #shoeshopping #toronto https://t.co/sbE0ot1UVF
49,613421780330360832,Tue Jun 23 19:02:03 +0000 2015,0,0,Hey @nespresso you should look into this! #Vancouver company patents world's 1st compostable coffee pods http://t.co/dgDJ3xU21i
50,610169374314528771,Sun Jun 14 19:38:09 +0000 2015,0,0,Toronto man’s quest to solve mystery surrounding dead friend still unfinished http://t.co/ezqPGcaCgQ. Can't wait the doc! Congrats Dylan.
51,610106087593889792,Sun Jun 14 15:26:41 +0000 2015,0,0,Front row seats to the #portuguesedayparade #custardtarts #tradition https://t.co/ZlVJFLtLbc
52,607699199669489664,Mon Jun 08 00:02:34 +0000 2015,0,1,#paulrevere likes #mikescannlies too!!  #Boston #northend https://t.co/hRX0QIdTk7
53,607698042230317056,Sun Jun 07 23:57:58 +0000 2015,0,0,Last nights debauchery in the South End. #Boston #mattandben #cafedelux https://t.co/NNNwl88iC5
54,607697528365170689,Sun Jun 07 23:55:55 +0000 2015,0,1,Took in a game at Fenway. #redsox #greenmonster https://t.co/XPDMrXTLqy
55,607697111124197376,Sun Jun 07 23:54:16 +0000 2015,0,0,Harbour tour #boston. #comesailawaywithme https://t.co/iWwrZsSS58
56,607696889245528064,Sun Jun 07 23:53:23 +0000 2015,0,0,Final meal in #boston! #lobster #rose https://t.co/oJrUhmyXd7
57,607358112010539008,Sun Jun 07 01:27:12 +0000 2015,0,0,On a stroll through Beacon Village #boston #walkups https://t.co/USuqJ4cP3d
58,607357774394212353,Sun Jun 07 01:25:52 +0000 2015,0,0,Day 2 #Boston via Charles River. #skyline https://t.co/dq0KkR6CLI
59,606945277556215808,Fri Jun 05 22:06:45 +0000 2015,0,0,Mass Stat Capitol Building. #causeimjustabill #boston #goldenglobe https://t.co/kjcBDKmons
60,606944696666046464,Fri Jun 05 22:04:26 +0000 2015,0,1,Where everyone knows your name. #cheers #Boston #pitstoppint https://t.co/OZ0UK3HrC7
61,606943337346670592,Fri Jun 05 21:59:02 +0000 2015,0,0,Strolling through Boston Gardens. #georgewashington #nofilter https://t.co/eenk7ArsvJ
62,602247394525339648,Sat May 23 22:59:02 +0000 2015,0,0,Great architectural tour at the #agakahnmuseum #freefloatingstairs #doorsopen https://t.co/b4OB0KnOwW
63,600768074627743744,Tue May 19 21:00:45 +0000 2015,0,6,"Full house at Rethinks High Risk Forum! Speakers, film screening &amp; discussion. #bchighrisk @rethinktweet http://t.co/3BkReK8hsD"
64,597532025197826048,Sun May 10 22:41:51 +0000 2015,0,0,Happy Mother's Day! drinadinon #onthegreen https://t.co/tK3e7VCNEu
65,597181179004092418,Sat May 09 23:27:42 +0000 2015,0,0,I got 11 right in the toughest 80s movie quiz ever http://t.co/vykoeK2GC2 via @guardian #childofthe80s
66,595755698673340416,Wed May 06 01:03:21 +0000 2015,0,0,No! Coach can't leave. I only watch for him and Winston. #NewGirl
67,595389518368395264,Tue May 05 00:48:17 +0000 2015,0,0,Amazing meal at @mamakastaverna with old and new friends. @daravandor @disamackay #itsallgreektome… https://t.co/3ar8JI3pSl
68,593566905178279936,Thu Apr 30 00:05:52 +0000 2015,0,1,Inspiring evening and talk about metastatic breast cancer. #IAMANNA @rethinktweet http://t.co/PmIhdlRlp2
69,589790376938053632,Sun Apr 19 13:59:18 +0000 2015,1,0,Love this video! A shout-out to Toronto's diversity: New music video goes viral http://t.co/sKmCY2wOGV
70,589789755631603713,Sun Apr 19 13:56:50 +0000 2015,0,0,Love this video! A shout-out to Toronto's diversity: New music video goes viral http://t.co/TfM8S6oN8X
71,588798365112098816,Thu Apr 16 20:17:24 +0000 2015,0,1,@begoodgelato #gelatofriday! when are you coming to 215 Spadina?
72,587353927571611651,Sun Apr 12 20:37:43 +0000 2015,0,0,Scene from a midnight walk thru the junction.  #toronto #itsaboy #oversizedlawnornaments https://t.co/rE9wkt110Z
73,587143188835512320,Sun Apr 12 06:40:19 +0000 2015,0,1,The walk home #booom #toronto https://t.co/3XYJG0aDXp
74,587026480149962752,Sat Apr 11 22:56:33 +0000 2015,0,0,Pastry chef in the making. #neicesrock #talented #creative #purple https://t.co/c92zC4I0Uj
75,586712030708510720,Sat Apr 11 02:07:03 +0000 2015,0,1,I'm bringing spring into the house because I can't get it outside. #nofilter #lovetulips… https://t.co/WyrzqDFAjA
76,585834326148960256,Wed Apr 08 15:59:22 +0000 2015,0,0,And add a bit of rain.  https://t.co/CpDPQOLte2
77,584878269033492481,Mon Apr 06 00:40:20 +0000 2015,0,0,I'm playing WordBrain and I've just reached brain size 4756! #wordbrain #genius #words http://t.co/UsZuT4dSAN http://t.co/UVfIOpnltN
78,579749265376976896,Sun Mar 22 20:59:30 +0000 2015,0,0,Love the lazy susan at dim sum! #spring #brunch https://t.co/kXxBKLW803
79,578380560898355200,Thu Mar 19 02:20:46 +0000 2015,0,0,Playing around at the home and garden show. chrissypatty3 thanks nancybruz77 for the tickets!… https://t.co/1sJazuw5jQ
80,574205847875747841,Sat Mar 07 13:51:57 +0000 2015,0,0,Lookin' good at the #VictoryChairtyBall stephanieapplin rethinkbreastcancer https://t.co/HiBM6dYkK7
81,571802634157465600,Sat Feb 28 22:42:26 +0000 2015,0,1,Partners in crime on the beer tour. chrissypatty3 @shermar74 #millstreet https://t.co/1I1ETo3VQt
82,571797551084650496,Sat Feb 28 22:22:14 +0000 2015,0,0,Raise a glass at the beer tour. #oldtownbeertour #startedat11am @leannegallant https://t.co/TGm7eAbpAh
83,569676995874959363,Mon Feb 23 01:55:54 +0000 2015,2,3,The Oscars need Tina and Amy. #yawnfest
84,566274508030767104,Fri Feb 13 16:35:38 +0000 2015,0,0,Getting ready for my close up with #edburtynsky #flagdaycelebration  #150years #ohcanada http://t.co/rAAbyafTdS
85,562058145116090368,Mon Feb 02 01:21:18 +0000 2015,0,0,Missy Elliott saves #SuperBowlXLIX halftime.
86,561235530776842240,Fri Jan 30 18:52:32 +0000 2015,0,0,On this cold Friday I'm missing st lucia. #beachvacay http://t.co/PWAa4cQei6
87,554484878159642626,Mon Jan 12 03:47:51 +0000 2015,0,0,Winner for best thank u speech and bow tie goes to Wes Anderson.  #GoldenGlobes
88,554480175623454720,Mon Jan 12 03:29:10 +0000 2015,0,0,Add to the must watch list The Affair. #GoldenGlobes
89,554470183067475968,Mon Jan 12 02:49:27 +0000 2015,0,0,We are all complicated women. #MaggieGyllenhaal #GoldenGlobes
90,554463386864713728,Mon Jan 12 02:22:27 +0000 2015,0,0,Must see Boyhood. #BehindTheTimes #GoldenGlobes
91,554460017890299904,Mon Jan 12 02:09:04 +0000 2015,17,0,RT @DanielleGraham: Bring back Ricky as Golden Globes host in 2016!! #etalkGLOBES
92,554459328900763648,Mon Jan 12 02:06:20 +0000 2015,0,0,Ok Helen Mirren is my idol. Love her. #Gorgeousforever #GoldenGlobes
93,554458426919907328,Mon Jan 12 02:02:44 +0000 2015,0,0,Yeah my boyfriend Matt Bomer won!! So old school Hollywood. #GoldenGlobes
94,554455630137032704,Mon Jan 12 01:51:38 +0000 2015,0,0,Love Prince! Rebirth of cool. #disco #golddenglobes
95,554452286744035328,Mon Jan 12 01:38:21 +0000 2015,0,1,#whatsjanethevirgin? #goldenglobes #upset
96,554443845325561857,Mon Jan 12 01:04:48 +0000 2015,0,0,Tina and Amy are again killing it!  And everyone is getting a cranberry candle. #GoldenGlobes
97,554438875771596802,Mon Jan 12 00:45:03 +0000 2015,39,0,RT @LaineyGossip: Maggie Gyllenhaal's barely contained disdain for Ryan Seacrest is making my life. #etalkGLOBES
98,554438529087205376,Mon Jan 12 00:43:40 +0000 2015,0,0,Love love love Emma Stone's jumpsuit. #wantneedget #GoldenGlobes
99,554435820003033088,Mon Jan 12 00:32:55 +0000 2015,0,0,"I think JLo and Kate Hudson are having a ""who wore less"" off. #GlodenGlobes"
100,554433774612926464,Mon Jan 12 00:24:47 +0000 2015,57,0,RT @VanityFair: The five jokes we wish Joan Rivers could deliver at the #GoldenGlobes http://t.co/Gqj15Nn9rq
101,554433108259667968,Mon Jan 12 00:22:08 +0000 2015,0,0,What is up with Channing Tatum? Spray tan gone wrong. #GoldenGlobes
102,554432177396797440,Mon Jan 12 00:18:26 +0000 2015,22,0,RT @WhoWhatWear: .@JLo wows in @ZMURADofficial (and the most va-va-voom red carpet hair of the night so far.) #GoldenGlobes
103,554431785774641154,Mon Jan 12 00:16:53 +0000 2015,0,1,Giuliana needs a sandwich. #GoldebGlobes #RedCarpet
104,554430853582184448,Mon Jan 12 00:13:10 +0000 2015,2,0,RT @rethinktweet: #FF Rethink's team! @MJDeCoteau @AllieLD @diannaklisanin @nikki_byrne @steph_rebecca @StephanieApplin @lindsaygrange @abl…
105,552647568334004224,Wed Jan 07 02:07:02 +0000 2015,0,0,We are all film critics! Thanks #manulife #tfca @allenbraude http://t.co/L0FynM1HFa
106,543654972521316352,Sat Dec 13 06:33:40 +0000 2014,0,0,Amazing dinner at Hot Joy with new friends. #yum #sanantonio http://t.co/AR3ZOcieUj
107,543476966662623232,Fri Dec 12 18:46:20 +0000 2014,0,0,Gorgeous day for a stroll on the River Walk. #sanantonio http://t.co/uwYihFtF4b
108,543272043157147649,Fri Dec 12 05:12:03 +0000 2014,0,0,Going old school on San Antonio. #reuben #schilos #established1917 http://t.co/MP0o2OOEOE
109,542453585313669120,Tue Dec 09 22:59:47 +0000 2014,0,0,Remember the Alamo. #eveyrthingsbigintexas http://t.co/EBReDwSUK9
110,542452897657532416,Tue Dec 09 22:57:03 +0000 2014,0,0,In the lone star state. #texas #sanantonio http://t.co/Fi1pyxomqD
111,538800529628221440,Sat Nov 29 21:03:51 +0000 2014,0,2,Lemon lavender bars! #nonstopbaking drinadinon http://t.co/Z8qnXExPvI
112,538765053567451136,Sat Nov 29 18:42:53 +0000 2014,0,0,Spicy ginger molasses by the tottenham barefoot contessas. #cookies #holidaybaking drinadinon http://t.co/drZd7cJxqb
113,538738687324852224,Sat Nov 29 16:58:06 +0000 2014,0,0,Weekend baking has started with peppermint bark. #yum #sistertime drinadinon http://t.co/0X7v2aLSof
114,537413141291077632,Wed Nov 26 01:10:52 +0000 2014,0,1,#steviewonder #acc #1977filter http://t.co/u7d2jssxEM
115,533249776947822592,Fri Nov 14 13:27:08 +0000 2014,1,0,"RT @mj7757: @diannaklisanin @iwashatruck @sarahmac etal at the #INSPIRE_TIBF Of course, I left w/ more books.  #feedingmyaddiction"
116,531656652483616771,Mon Nov 10 03:56:38 +0000 2014,0,0,Celebrating a great #boobyball in #ywg at Rae &amp; Jerry's. #manhattan #oldschool @ablasioli http://t.co/Fcfuk5VVcy
117,531561033975230464,Sun Nov 09 21:36:41 +0000 2014,0,0,Sold out today and no ticket to the Museum of Human Rights. 😔#ywg #nofilter http://t.co/LUsHlAMt5i
118,531280238458982400,Sun Nov 09 03:00:54 +0000 2014,1,0,The fun has started at #boobyball #ywg @rethinktweet mjdecoteau jordanmeagher http://t.co/PAVKQKjoGU
119,531272293281198080,Sun Nov 09 02:29:19 +0000 2014,2,0,mjdecoteau a Big Top Booby #boobyball #ywg http://t.co/rijxyUb0c9
120,531171559210110976,Sat Nov 08 19:49:03 +0000 2014,1,0,Visit the midway at Big Top Booby. #boobyball #ywg @rethinktweet http://t.co/ur7Tdzpqkg
121,531146116189159424,Sat Nov 08 18:07:56 +0000 2014,1,1,High flyers sneak peak for boobyball YWG. Big Top Booby is rolling into town tonight. @rethinktweet http://t.co/uKRXGgf6l9
122,531145479652777984,Sat Nov 08 18:05:25 +0000 2014,1,1,Calling all acrobats in Winnipeg! #bigtopbooby is in town. @rethinktweet boobyball http://t.co/AlDaZmwhFw
123,530774545494704130,Fri Nov 07 17:31:27 +0000 2014,1,0,T-minus one day til #Boobyball YWG. Everyone is hard at work! @rethinktweet @JordanMeagher #bigtopbooby http://t.co/ZvWfiQDxkK
124,530194066709827584,Thu Nov 06 03:04:50 +0000 2014,2,1,Thanks @0RT0LAN for a final great meal. We'll miss you. #bloordale #cornerbar #bestpannacotta
125,528784743379529728,Sun Nov 02 05:44:41 +0000 2014,0,0,Happy Halloween #introto40s #reneezelwegger #junction3030 http://t.co/JIKBh5Yl1N
126,526905888737861633,Tue Oct 28 01:18:47 +0000 2014,0,1,Not the outcome I wanted. Congrats to John Tory. #TeamOlivia
127,526724640509812737,Mon Oct 27 13:18:35 +0000 2014,0,1,Torontonians make sure you vote today! #ElectionDay #teamOlivia
128,524191376289058817,Mon Oct 20 13:32:17 +0000 2014,0,1,"6 subways, 4 street cars = 50 mins to get to work.  Hop on my bike = 25 min to work. #TTCsucks"
129,523608363074994176,Sat Oct 18 22:55:36 +0000 2014,1,0,Bells of #boobyball mynameispea #bigtopbooby http://t.co/MQoUyPzwnB
130,523344378543493120,Sat Oct 18 05:26:37 +0000 2014,1,2,Another amazing #boobyball. @nikki_byrne @lindsaygrange @rethinktweet http://t.co/ygdIFh2yvm
131,523122932482965504,Fri Oct 17 14:46:40 +0000 2014,2,2,Can't wait for Big Top Booby tonight! #boobyball @rethinktweet @4printca #worklife @anthonyseydel http://t.co/YTcgoP0tJ2
132,522088667645751298,Tue Oct 14 18:16:52 +0000 2014,1,0,RT @rethinktweet: The #Boobyball Auction is now LIVE! Step Right Up and Place your Bid http://t.co/qHMzaWJENQ
133,519902129902080001,Wed Oct 08 17:28:21 +0000 2014,0,0,Where can I buy a pink pumpkin in Toronto? #halloween #edible
134,517359762627776513,Wed Oct 01 17:05:54 +0000 2014,2,0,RT @rethinktweet: Check out our executive director @MJDeCoteau and @CancerFabulous blogger Sylvia Soo on Canada AM this morning: http://t.c…
135,517359544238747648,Wed Oct 01 17:05:02 +0000 2014,2,0,RT @HoltRenfrewQC: Don't miss our #ItalianImmersion launch party tonight! 10% of sales go to @rethinktweet #HoltsMontreal http://t.co/RCbeX…
136,516653170760908800,Mon Sep 29 18:18:09 +0000 2014,0,0,Very sedate art and culture debate. And still no clear front runner for me. Totally impressed with… http://t.co/SK1PZITS2y
137,516400984210571264,Mon Sep 29 01:36:03 +0000 2014,0,0,A great way to end an amazing weekend at the cottage. #stellas #burleighfalls http://t.co/2cFTmLKgHQ
138,515512389702545410,Fri Sep 26 14:45:06 +0000 2014,1,0,Fall at the cottage. #canadiana #kawarthas #nofilter http://t.co/GgU3nPJ9G8
139,515224535486840832,Thu Sep 25 19:41:16 +0000 2014,0,0,Well said Michael! An open letter to Olivia Chow from Michael Hollett | NOW Magazine http://t.co/8bbkKRqcCo
140,515187609514303488,Thu Sep 25 17:14:32 +0000 2014,0,0,Fall fashion? #bloorwestsyle #disgruntledemployee?! http://t.co/nHWeOX0Mav
141,514944666304012288,Thu Sep 25 01:09:10 +0000 2014,0,0,All alone in a theatre. #thisiswhereileaveyou http://t.co/vlHEciYlQu
142,511334044635000833,Mon Sep 15 02:01:51 +0000 2014,3,0,RT @ltorvi: Help make #TO safer for cyclists! Support the plan to create a #MinimumGrid of bike lanes by 2018. Sign &amp; RT: http://t.co/8sMUR…
143,511282473469083650,Sun Sep 14 22:36:55 +0000 2014,0,0,Going old school #polishfestival #roncesvalles http://t.co/8nScpxnY2R
144,510494749606690816,Fri Sep 12 18:26:47 +0000 2014,0,1,I got : Chelsea Handler! abut I thought I would get Joan. Which Female Comedian Are You Most Like? via @play_buzz
145,508356797162192898,Sat Sep 06 20:51:19 +0000 2014,0,0,Saturday afternoon fun. #dotherobot @henrysperson http://t.co/p5F1c5GBn5
146,507608810089762816,Thu Sep 04 19:19:05 +0000 2014,0,0,"A final Joan Ranger salute. The first time I see a jogger smiling, I'll consider it. - @Joan_Rivers #Hilarious #fashionpoilice #RIP"
147,504058000777437184,Tue Aug 26 00:09:26 +0000 2014,0,1,"Favourite line. New phone, who dis? Great opening by Seth. #Emmys2014"
148,501909623776231424,Wed Aug 20 01:52:34 +0000 2014,5,0,RT @StephanieApplin: A sea of pink for @rethinktweet's #Boobyball #CNE2014 #LetaGoToTheEx @Alyssa_Whited @Isabelledetoi @lauratrubkin http:…
149,501895052235644929,Wed Aug 20 00:54:39 +0000 2014,0,1,#Repost from @lindsaygrange with repostapp---At the #cne14 spreading the world about #bigtopbooby… http://t.co/zPvNFfIrO8
150,500749410264170498,Sat Aug 16 21:02:17 +0000 2014,1,1,Taking a little nap. #flavoursinthefield #tottenham drinadinon http://t.co/RSNjKl9X17
151,500748515702607874,Sat Aug 16 20:58:44 +0000 2014,0,0,Sisters rock! drinadinon http://t.co/RrE1xKfCdX
152,500747858471968768,Sat Aug 16 20:56:07 +0000 2014,0,0,Great day at the flavours of the field. #tottenham http://t.co/uXwC2tsEiv
153,500746800727588864,Sat Aug 16 20:51:55 +0000 2014,0,0,Off to flavours in the field. #steamtrain #tottenham drinadinon http://t.co/GnlYXjRg9E
154,498836126913024000,Mon Aug 11 14:19:35 +0000 2014,0,0,As a Gen Xer I can totally relate to this article. http://t.co/dAuYxJhppe #caughtinthemiddle
155,498222244104253441,Sat Aug 09 21:40:14 +0000 2014,0,0,Live long and prosper. #tasteofthedanforth chrissypatty3 http://t.co/0EDJplv9yu
156,497892268381339649,Fri Aug 08 23:49:01 +0000 2014,0,0,First tennis match!! Go Milos!!! #tenniscanada #rogerscup http://t.co/GNQ7WRDadf
157,497554848363999232,Fri Aug 08 01:28:14 +0000 2014,0,1,Thanks @henrysperson for the wicked seats. #bluejays @nikki_byrne http://t.co/4cmT3lFZE0
158,496741284657524736,Tue Aug 05 19:35:25 +0000 2014,1,0,Save the date to the GREATEST show on earth! Big Top Booby will tour #YYZ Oct 17 #YYC OCT 24 &amp; #YWG Nov 8! #Boobyball
159,495928040740749314,Sun Aug 03 13:43:53 +0000 2014,0,0,"Who knew, a cactus garden. #lanzarote http://t.co/JPcwBCSRai"
160,495926824442933248,Sun Aug 03 13:39:03 +0000 2014,0,0,Late night in Costa Teguise #vinoblanco #tapas http://t.co/F4EUtKJPAc
161,495925641443688449,Sun Aug 03 13:34:21 +0000 2014,0,0,Camel trek through the Montania del Fuego. #lava #desert #nofilter http://t.co/8izn1xnp9X
162,495924336822198272,Sun Aug 03 13:29:10 +0000 2014,0,0,A Caesar Manrique. #artist #environmentalist #lanzarote http://t.co/SNwhRbeydl
163,495923464809631744,Sun Aug 03 13:25:42 +0000 2014,0,0,Amazing vacation in Costa Teguise! #nofilter http://t.co/3U9qRFj5Ji
164,490685829460008960,Sun Jul 20 02:33:12 +0000 2014,0,0,#Repost from chrissypatty3 with repostapp #panchoesrock #bigonbloor---#superfan at Big on Bloor http://t.co/MKZmGoafkV
165,490596333758066689,Sat Jul 19 20:37:35 +0000 2014,0,0,Big talent on #bigonblooor @henrysperson chrissypatty3 http://t.co/QWZjc3I5Y2
166,490154960785387520,Fri Jul 18 15:23:43 +0000 2014,0,0,"I loved New Music and the Wedge, someone save Much! The rise &amp; fall of MuchMusic, from crucial TV to bust http://t.co/9U38GqiPh7 via @blogto"
167,488780888717537281,Mon Jul 14 20:23:39 +0000 2014,0,1,"This made me laugh, and now I'm nostalgic for Just Eat It. Weird Al's Pharrell Parody Video http://t.co/Yen3kt5IUP via @rollingstone"
168,487086276953505792,Thu Jul 10 04:09:52 +0000 2014,0,0,Jay Z!! #ontherun #nofilter http://t.co/77PGneDBDZ
169,487085855392423936,Thu Jul 10 04:08:12 +0000 2014,0,0,On the run! beyonce #nofilter http://t.co/fHt9CyiSYF
170,487085275579826177,Thu Jul 10 04:05:53 +0000 2014,0,1,Can't wait for #j+b to start #rogerscentre #singleladies chrissypatty3 http://t.co/b0mTKXfOo5
171,486615649389518848,Tue Jul 08 20:59:46 +0000 2014,0,0,Count me in! Why Riding Your Bike Makes You A Better Person (According To Science) http://t.co/cQAvSZgJ2X via @HealthyLiving
172,486615523363655681,Tue Jul 08 20:59:16 +0000 2014,0,0,@davidvallee Thanks David! So glad you could join us on Sunday.
173,486615197856309250,Tue Jul 08 20:57:58 +0000 2014,1,0,RT @davidvallee: Best bunting ever @diannaklisanin !!! http://t.co/4GNS1MX3G4
