,id_str,created_at,retweet_count,favorite_count,text
0,669219995734384640,Tue Nov 24 18:24:15 +0000 2015,0,0,RT CNNPolitics: .POTUS on downing of Russian jet: Turkey has the right to defend its airspace … https://t.co/T3RHVsTtdU
1,669219993586966528,Tue Nov 24 18:24:14 +0000 2015,0,0,Minneapolis police arrest a man in connection with shootings near Monday's #JamarClark protests. https://t.co/Vpbzczb2br
2,669219283130556416,Tue Nov 24 18:21:25 +0000 2015,0,0,BREAKING: Russian marine killed in Syria after Mi-8 helicopter hit by shelling while searching for the 2 pilots from the downed fighter jet
3,669219281889067008,Tue Nov 24 18:21:24 +0000 2015,0,0,"UPDATE: French Prosecutor says; Abdelhamid Abaaoud, suspected ringleader of #Parisattacks , returned to the scene of crime after the attacks"
4,669219280618147841,Tue Nov 24 18:21:24 +0000 2015,0,0,"BREAKING: Paris ringleader planned to attack La Defense business district,  2 explosive vests, automatic pistol found in suburban apartment."
5,669218674285420544,Tue Nov 24 18:19:00 +0000 2015,0,0,BREAKING: Interior Ministry says explosion in Tunisian capital was 'terrorist act; death toll now 12.
6,669218672918061056,Tue Nov 24 18:18:59 +0000 2015,0,0,"BREAKING: Obama calls Russia outlier in global coalition against ISIS, says it's in coalition with Iran."
7,669218671299051520,Tue Nov 24 18:18:59 +0000 2015,0,0,"BREAKING: NATO chief calls for 'calm and de-escalation,' says allies 'stand in solidarity with Turkey.'"
8,669215638141968385,Tue Nov 24 18:06:56 +0000 2015,0,0,"UPDATE: NATO chief Stoltenberg calls for 'calm and de-escalation,' says allies 'stand in solidarity with #Turkey'"
9,669210860913623040,Tue Nov 24 17:47:57 +0000 2015,2,0,"BREAKING: Obama says Turkey has right to defend territory, urges no escalation after plane shoot-down."
10,669209163344531456,Tue Nov 24 17:41:12 +0000 2015,0,0,"RT CNN: .POTUS says he and Hollande agree ""Russia's strikes against the moderate opposition only bolster the Assad… https://t.co/75cczCLakk"
11,669209161700372480,Tue Nov 24 17:41:12 +0000 2015,0,0,"Russia could be more helpful in stopping ISIS if it shifts focus of airstrikes, Obama says. … https://t.co/LiCyuddH58"
12,669209158483386368,Tue Nov 24 17:41:11 +0000 2015,0,0,RT CNNPolitics: .POTUS: fhollande &amp; I agree removing Assad from power is best way to bring peace to Syria … https://t.co/75cczCLakk
13,669208847324725250,Tue Nov 24 17:39:57 +0000 2015,0,0,Belgian prosecutor has charged a fifth suspect with terror offences in relation to the attacks that took place in #Paris
14,669207603784851456,Tue Nov 24 17:35:00 +0000 2015,0,0,"PHOTO: Of the new #ParisAttacks suspect: Mohamed Abrini,30, seen driving with fugitive #SalehAbdeslam on 11.11.15 https://t.co/K2y1h01zuU"
15,669207602098782209,Tue Nov 24 17:35:00 +0000 2015,0,0,"BREAKING: Belgian prosecutors issued an arrest warrant for Mohamed Abrini,30.seen driving with #ParisAttacks suspect Salah Abdeslam 11/11/15"
16,669207541386256384,Tue Nov 24 17:34:45 +0000 2015,0,0,"Manhattan: 611 6th Ave NYPD13pct calling a Level 1 mobilization in regards to a bank robbery of chase bank, perp m/b fled the scene."
17,669207130751258624,Tue Nov 24 17:33:07 +0000 2015,0,0,"RT APEntertainment: New Rocky story #'Creed balances brutality and theatricality
https://t.co/BQAOAcrLeG https://t.co/o4cBLoZYPS"
18,669207129421701120,Tue Nov 24 17:33:07 +0000 2015,0,0,BREAKING: Belgian authorities charge fifth suspect with terror offenses relating to Paris attacks.
19,669206602621276160,Tue Nov 24 17:31:01 +0000 2015,0,0,Manhunt launched for Mohamed Abrini over Paris terror attacks https://t.co/6BN8h0t3XY
20,669206600004067328,Tue Nov 24 17:31:01 +0000 2015,1,0,LIVE: President Obama Holds a Joint Press Conference with President Hollande https://t.co/efPlRD4DaF
21,669206597458087937,Tue Nov 24 17:31:00 +0000 2015,0,0,"Chicago police officer charged for fatally shooting black teenager 16 times, city braces for protests https://t.co/gM8rUGRIUf"
22,669204700982583296,Tue Nov 24 17:23:28 +0000 2015,1,0,AFP: Interior ministry says more than one person has died after an explosion hit a military bus in the Tunisian capital of #Tunis
23,669204330789085184,Tue Nov 24 17:22:00 +0000 2015,0,0,"RT CNN: .POTUS during press conference with Hollande: ""In the face of the French people we see ourselves” https://t.co/1aicOowbPQ"
24,669203460202618880,Tue Nov 24 17:18:32 +0000 2015,0,0,"Bronx;1805 Crotona Avenue, man shot multiple time, suspects fled, victim DOA, NYPD48Pct on scene investigating"
25,669202352382091265,Tue Nov 24 17:14:08 +0000 2015,0,0,BREAKING NEWS: Chicago police officer charged in shooting death of teen https://t.co/wNU8uKTS19
26,669199811485257729,Tue Nov 24 17:04:02 +0000 2015,0,0,PIX11 also carrying the joint news conference. https://t.co/do9UD3J2Tl
27,669199810189225985,Tue Nov 24 17:04:02 +0000 2015,0,0,Special reports airing now on all networks. https://t.co/JvXQyMLMyC
28,669199809153245184,Tue Nov 24 17:04:02 +0000 2015,1,0,Special reports momentarily. President Obama to hold news conference with French President Hollande live from the White House.
29,669199795731480576,Tue Nov 24 17:03:59 +0000 2015,0,0,"ISIS must be destroyed, Obama says in news conference with French President Hollande. LIVE: … https://t.co/uu1JV7fosf"
30,669199794624208896,Tue Nov 24 17:03:58 +0000 2015,0,0,"Police: Rocket tip explodes while Afghan children play with it, kills 7. https://t.co/29W3KuP5r7"
31,669199051552870400,Tue Nov 24 17:01:01 +0000 2015,0,0,UPDATE: NATO chief Stoltenberg is to give a statement after the emergency meeting after today's downing of the Russian fighter jet by Turkey
32,669199049774505984,Tue Nov 24 17:01:01 +0000 2015,1,0,UPDATE: Up to 15 Presidential guards killed &amp; many more injured after an explosion hit their bus in #Tunis #Tunisia https://t.co/8XWZqa8hMB
33,669199048222646272,Tue Nov 24 17:01:00 +0000 2015,0,0,"BREAKING: The Two Russian pilots from the downed fighter jet near Syrian border believed to be alive, Turkish officials say"
34,669198521116020737,Tue Nov 24 16:58:55 +0000 2015,1,0,BREAKING: Tunisian authorities: Explosion occurs on a bus carrying presidential security guards.
35,669196236126334978,Tue Nov 24 16:49:50 +0000 2015,0,0,Reuters: U.S. official says initial indications are that the incursion of the Russian jet into Turkish airspace lasted a matter of seconds
36,669195321713549312,Tue Nov 24 16:46:12 +0000 2015,1,0,UPDATE: Reports of at least 5 dead after the Bus explosion in #Tunis #Tunisia
37,669195319670923265,Tue Nov 24 16:46:11 +0000 2015,0,0,RT DeanMeminger: PBA President calls alleged cop killer a mutt after he pleads not guilty in death of Det #Randolp… https://t.co/bhJRBC2ezA
38,669195318949490688,Tue Nov 24 16:46:11 +0000 2015,0,0,"UPDATE: As of now it is unclear if the explosion was caused by explosive device or mechanical, injuries unknown https://t.co/uf5Nf3qfuZ"
39,669194705343787009,Tue Nov 24 16:43:45 +0000 2015,0,0,RT AP_Politics: The latest on Obama's meeting with French President Hollande about stopping the Islamic State grou… https://t.co/qtp3XWJWHe
40,669194703364050945,Tue Nov 24 16:43:44 +0000 2015,0,0,Carlos Sanchez was shot 3 times by attackers. Mexican police finished the job. https://t.co/ahVWHAEExe
41,669191917410910208,Tue Nov 24 16:32:40 +0000 2015,0,0,A Chicago police officer has been charged with 1st-degree murder in the 2014 shooting death of Laquan McDonald. https://t.co/0GiG1ABoTW
42,669191372730167296,Tue Nov 24 16:30:30 +0000 2015,1,0,UPDATE: According to reports the bus was transporting presidential guards when it exploded in downtown #Tunis avenue Mohamed V. #Tunisia
43,669191371115397120,Tue Nov 24 16:30:30 +0000 2015,1,1,"BREAKING: Initial reports of an explosion on a Bus in #Tunis #Tunisia, according to the reports a police bus was targeted, unclear if terror"
44,669190679436910592,Tue Nov 24 16:27:45 +0000 2015,0,0,"RT APEntertainment: The Grinch, #MariahCarey join the holiday TV festivities; Rudolph, too
https://t.co/B5KzljhyYp https://t.co/uG2sNra7mj"
45,669189805570306048,Tue Nov 24 16:24:17 +0000 2015,0,0,"Photo: Refinery fire reported in the Salina Cruz area of Oaxaca, Mexico - @SEMANARIODEOPI https://t.co/O8UGlQDO2P"
46,669189803280207872,Tue Nov 24 16:24:16 +0000 2015,0,0,"Cabin crew union in talks with Lufthansa, trying to avoid strikes - @Reuters https://t.co/1NhEhdj8mm"
47,669189799694106625,Tue Nov 24 16:24:15 +0000 2015,0,0,"Mother, boyfriend in Houston, Texas, charged after 1-year-old girl dies from burns suffered inside an oven -… https://t.co/qr41DW0U0x"
48,669189795852083200,Tue Nov 24 16:24:14 +0000 2015,0,0,"Editor's note: US stock indexes are trading lower. The Dow is off 67 and the Nasdaq, 38. - Tom https://t.co/REmP4JWXOL"
49,669189792878346240,Tue Nov 24 16:24:14 +0000 2015,0,0,White Chicago cop charged with 1st-degree murder in 2014 fatal shooting of black teen Laquan McDonald - @nbcchicago https://t.co/Qd15KlU1hc
50,669189790454038530,Tue Nov 24 16:24:13 +0000 2015,0,0,"French Interior Minister Bernard Cazeneuve says there have been more than 1,233 house searches under country's… https://t.co/yhWLNFLuq6"
51,669189788478533632,Tue Nov 24 16:24:13 +0000 2015,0,0,Philippines revalues jewellery seized from Imelda Marcos in 1986; collection was valued at $7 million in 1991 -… https://t.co/Hv5nneTQUn
52,669189786259845120,Tue Nov 24 16:24:12 +0000 2015,0,0,"Russian Defense Ministry says it views actions of Turkish Air Force toward Russian jet as unfriendly act, has… https://t.co/PeVIpb0cx0"
53,669189783793434626,Tue Nov 24 16:24:12 +0000 2015,0,0,Brazilian exchange launches app to track illegal timber trade - @ReutersTech https://t.co/VxUiWEqEwM
54,669189781763461121,Tue Nov 24 16:24:11 +0000 2015,0,0,4 wounded in West Bank car-ramming attack; driver shot - @haaretzcom https://t.co/BlntBD4TOP
55,669186774644736000,Tue Nov 24 16:12:14 +0000 2015,0,0,"BREAKING NEWS: Obama, Hollande hold joint press conference https://t.co/wNU8uKTS19"
56,669185605679607808,Tue Nov 24 16:07:35 +0000 2015,0,0,RT OraPolitics: DEVELOPING: Turkey Shoots Down Russian Warplane https://t.co/FbRZ6WCb1e NewsBreaker https://t.co/u5mJxZIFo2
57,669181835486695424,Tue Nov 24 15:52:37 +0000 2015,0,0,More: US military spokesman confirms that Turkey warned Russian pilots repeatedly before shootdown and Russian… https://t.co/VhXGgwtFB7
58,669181833959968768,Tue Nov 24 15:52:36 +0000 2015,0,0,US military spokesman says cannot confirm status of downed Russian pilots - @Reuters https://t.co/kzXnzNHyug
59,669181832634630144,Tue Nov 24 15:52:36 +0000 2015,0,0,Photo: US President Obama and French President Hollande meet in the White House's Oval Office - @jcartillier https://t.co/dKyegZuJs9
60,669181831313362944,Tue Nov 24 15:52:36 +0000 2015,0,0,Upcoming: U.S. President Obama and French President Hollande are currently meeting at the White House for the first… https://t.co/Bc5kdVgTud
61,669181829929287680,Tue Nov 24 15:52:35 +0000 2015,0,0,EasyJet on canceling flights to Sharm el-Sheikh: 'The situation is beyond our control and passenger safety will… https://t.co/Q914HrEref
62,669181828620685312,Tue Nov 24 15:52:35 +0000 2015,0,0,"Natali Tours, one of Russia's largest tour operators, suspends sale of package holidays to Turkey - @GazetaRu https://t.co/PnBi2JofmC"
63,669181827236532225,Tue Nov 24 15:52:35 +0000 2015,0,0,"Motion to sequester jurors denied in Freddie Gray trial, but jurors will remain anonymous - @cbsbaltimore https://t.co/geMBdDT1JM"
64,669179473498120192,Tue Nov 24 15:43:13 +0000 2015,0,0,"RT AP_Images: #APTOPIX for Nov. 24, 2015, our image selections from the past 24 hours. https://t.co/7eG6MleGvw Ju… https://t.co/JeBAM52VLj"
65,669175681591476224,Tue Nov 24 15:28:09 +0000 2015,0,0,Carlos Sanchez was shot. Who stood between him and a hospital? Mexican police: https://t.co/NfiBIGsPMp https://t.co/RwNeEscLDg
66,669175267705954304,Tue Nov 24 15:26:31 +0000 2015,0,0,Russian pilots ‘shot dead’ as they parachuted from plane - rebels https://t.co/qeQG0g8QhJ
67,669174064053751808,Tue Nov 24 15:21:44 +0000 2015,0,0,"Firefighters responding to chemical plant blast in Shijiazhuang area of Hebei Province, China - @PDChina https://t.co/DeYE04DdzJ"
68,669174062657114112,Tue Nov 24 15:21:43 +0000 2015,0,0,Kentucky Gov. Steve Beshear says he will sign executive order to restore voting rights for non-violent felons who… https://t.co/Wxa5jbO4Pf
69,669174060970995712,Tue Nov 24 15:21:43 +0000 2015,0,0,German Foreign Minister Steinmeier says he hopes Turkey's downing of Russian warplane won't be setback to Syria… https://t.co/YFg1ptD2cx
70,669174049767985152,Tue Nov 24 15:21:40 +0000 2015,1,0,Photo: School bus fire on Interstate-676 in Philadelphia; no children on board - @CBSPhilly https://t.co/9C9Z7aeomU
71,669174044214718464,Tue Nov 24 15:21:39 +0000 2015,0,0,"Photo: Press waits in White House briefing room to be escorted to the Oval Office, where President Obama is to meet… https://t.co/OYvPTIhrlR"
72,669174042268594177,Tue Nov 24 15:21:38 +0000 2015,0,0,Pa. state trooper hospitalized after being shot in shoulder along Interstate-676 near Philadelphia: report -… https://t.co/gDXfYR5eDO
73,669174040351805440,Tue Nov 24 15:21:38 +0000 2015,0,0,French and Russian authorities to increase fan zone security at Euro 2016 and 2018 World Cup - @AP_Sports https://t.co/s27kJkq75g
74,669174037877161984,Tue Nov 24 15:21:37 +0000 2015,0,0,"Woman, lover convicted of manslaughter of Chadwell Heath girl, 8, has jail sentence reduced by 3 years - @BDPost https://t.co/bPRAqXt3ET"
75,669174035024969730,Tue Nov 24 15:21:37 +0000 2015,0,0,"Russian Foreign Minister Lavrov says government does not recommend Russians visit Turkey, says terror threat is not… https://t.co/ZRA8oQcbtx"
76,669174032340660224,Tue Nov 24 15:21:36 +0000 2015,0,0,"Photo: High-rise fire at a building on Avenida Las Delicias in Maracay, Venezuela - @Elperiodiquito https://t.co/AnC7OMui8a"
77,669168573206667265,Tue Nov 24 14:59:55 +0000 2015,0,0,"UPDATE: Russian FM Lavrov advising Russian citizen not to travel to #Turkey ""We don't recommend Russians to visit Turkey""."
78,669168571453464576,Tue Nov 24 14:59:54 +0000 2015,0,0,"BREAKING UPDATE: Russian FM Lavrov has now officially cancelled his visit to #Turkey, Visit was due to be tomorrow"
79,669166485508481026,Tue Nov 24 14:51:37 +0000 2015,0,0,"Uber forms safety board, hopes to restore faith in its drivers - @engadget https://t.co/HjAWMXkf0b"
80,669166483805630465,Tue Nov 24 14:51:36 +0000 2015,0,0,French interior minister: 124 people charged since state of emergency imposed on Nov. 14 - @AP https://t.co/5uYz4tfr5D
81,669166481515548673,Tue Nov 24 14:51:36 +0000 2015,0,0,Western Washington University suspending all classes Tuesday due to social media hate speech targeting 'students of… https://t.co/V7JYvstMQO
82,669166479623917568,Tue Nov 24 14:51:35 +0000 2015,0,0,Russian Foreign Minister Lavrov cancels visit to Turkey following jet downing - @Reuters https://t.co/E9ruADpJgX
83,669166477837123584,Tue Nov 24 14:51:35 +0000 2015,0,0,"Taser shares rally after company wins bid to provide 22,000 London police with body cameras - @MarketsTicker https://t.co/fBrnoCqd4B"
84,669166476041936896,Tue Nov 24 14:51:35 +0000 2015,0,0,US stocks open lower after Turkey downs Russian warplane; Dow off 70 points as oil gains 3% and gold rises 1% -… https://t.co/MerqkViqON
85,669166474435522560,Tue Nov 24 14:51:34 +0000 2015,0,0,"Woman, 24, gives birth to baby girl in a taxi in Cúcuta, Colombia - @PoliciaColombia https://t.co/PHMm8KAPMv"
86,669166472627818497,Tue Nov 24 14:51:34 +0000 2015,0,0,"US markets (open): DJIA 17,770.90 (-21.78), S&amp;P 500 2,084.42 (-2.17), NASDAQ 5,070.66 (-31.82), NYSE 10,421.41 https://t.co/bnmITTBcxm"
87,669166471054950400,Tue Nov 24 14:51:33 +0000 2015,0,0,Map: Winter weather alerts in effect for much of Pacific Northwest as next storm moves in - @weatherchannel https://t.co/yAclRnjA3G
88,669166469209427968,Tue Nov 24 14:51:33 +0000 2015,0,0,DraftKings lawyer David Boies on No. 25 hearing over daily fantasy sports in New York: 'We look very strong' -… https://t.co/782FlyWIAP
89,669165509905117184,Tue Nov 24 14:47:44 +0000 2015,0,0,RT CNNMoney: U.S. stocks open lower after Turkey downs Russian warplane. Dow off 70 points. Oil gains 3% and gold … https://t.co/V9vbMIZh4a
90,669165495082422273,Tue Nov 24 14:47:41 +0000 2015,0,0,U.S. stocks open lower after Turkey downs Russian warplane. Dow off 70 points. Oil gains 3% and gold rises 1%. https://t.co/V9vbMIZh4a
91,669162020856569856,Tue Nov 24 14:33:52 +0000 2015,0,0,Reuters: Deputy commander of a 'Turkmen' brigade in Syria says his forces shot dead two pilots of downed Russian jet as they parachuted down
92,669161730971430912,Tue Nov 24 14:32:43 +0000 2015,0,0,RT CNNMoney: Turkish markets faltering after a Russian warplane crashed near the Turkish-Syria border. … https://t.co/ad3MS0PckP
93,669161729801265153,Tue Nov 24 14:32:43 +0000 2015,0,0,"Acting on tip, police search for #ParisAttacks suspect Salah Abdeslam in NW Germany. https://t.co/g2WrNzpcPx https://t.co/Rwx0n02N5L"
94,669161727850860544,Tue Nov 24 14:32:43 +0000 2015,0,0,ISIS claims responsibility for today's hotel bombing that killed at least 4 in Egypt's Sinai Peninsula. https://t.co/DZwkZ9LYjz
95,669161148089024513,Tue Nov 24 14:30:24 +0000 2015,0,0,UPDATE: Anti terror operation in Minden-Lübbecke area going on after a reported sighting of #Parisattacks suspect Salah Abdeslam in the area
96,669160097168367616,Tue Nov 24 14:26:14 +0000 2015,0,0,Turkey shoots down Russian warplane near Turkish-Syria border https://t.co/1zw6FG1E0U
97,669158448072757249,Tue Nov 24 14:19:41 +0000 2015,1,0,"Taser International wins major bid to outfit 22,000 London Metropolitan Police officers with Axon body cameras… https://t.co/fc7FE1MSD6"
98,669158445623345152,Tue Nov 24 14:19:40 +0000 2015,0,0,"High temperature in Beijing, China reached just -4C (25F) on Tuesday; marking lowest temp since Jan. 2013 -… https://t.co/v3FPx8TmUa"
99,669158443442266112,Tue Nov 24 14:19:39 +0000 2015,0,0,"Home prices in 20 US cities increase 5.5% in year to September, according to index - @business https://t.co/yJnu6LBEiv"
100,669158441378705408,Tue Nov 24 14:19:39 +0000 2015,0,0,Chicago police officer Jason Van Dyke arrives at courthouse to face charges in fatal shooting of Laquan McDonald -… https://t.co/rHZoEidw9G
101,669158438962724864,Tue Nov 24 14:19:38 +0000 2015,0,0,"Samarco hired firm to draw up disaster emergency plans in 2009, but never implemented their recommendations -… https://t.co/gxOggfo9aO"
102,669158437184401409,Tue Nov 24 14:19:38 +0000 2015,0,0,"Update: Officials say 3 killed, 15 taken hostage in helicopter crash in Taliban-held area of Faryab province in… https://t.co/cemkdGNtqQ"
103,669158434613280769,Tue Nov 24 14:19:37 +0000 2015,0,0,"Boxing trainer portrayed in 'The Fighter' charged with DUI in Lowell, Mass. - @WCVB https://t.co/VYCGliJMoA"
104,669158432314822657,Tue Nov 24 14:19:37 +0000 2015,0,0,Turkish lira tumbles after country downs Russian jet - @MarketsTicker https://t.co/DKXSDGHfyt
105,669158430301491200,Tue Nov 24 14:19:36 +0000 2015,0,0,"Amazon force-resets some account passwords, citing possible password leak - @zackwhittaker - @ZDNet https://t.co/1UAYZGEEG6"
106,669158428158201857,Tue Nov 24 14:19:36 +0000 2015,0,0,Preliminary 5.9-magnitude earthquake reported in Pagan region of Northern Mariana Islands - @USGSted https://t.co/Qj3WNDT6gt
107,669157821162897408,Tue Nov 24 14:17:11 +0000 2015,0,0,A look at the Turkmen community in Syria in the wake of the downed Russian jet: https://t.co/RRe72LR7zN
108,669157819795570688,Tue Nov 24 14:17:11 +0000 2015,0,0,"RT AP_Interactive: On climate science, Democratic candidates excel, while Republicans trail further behind: … https://t.co/Y6SYXTlefN"
109,669157202914091008,Tue Nov 24 14:14:44 +0000 2015,0,0,RT NYPDTransit: Take a look at this video from 149 St #6train station in the Bronx- 3 men wanted for 2 robberies- … https://t.co/TsCM3preBI
110,669157200816971776,Tue Nov 24 14:14:43 +0000 2015,0,0,Manhattan: Family claim NYPD is covering up man’s 2012 shooting by cops https://t.co/cJZv6L1Wkl
111,669155074157989888,Tue Nov 24 14:06:16 +0000 2015,0,0,Which do you think will happen first? 15-0 Warriors lose or 0-15 76ers win?
112,669154276124532736,Tue Nov 24 14:03:06 +0000 2015,0,0,"Putin: Downing of #Russianplane a ""stab in the back,"" will affect Russia-Turkey relations. https://t.co/LyppYxPY0P https://t.co/pFgF2LAj9P"
113,669153667291996160,Tue Nov 24 14:00:41 +0000 2015,0,0,"BREAKING: German police special units are conducting a anti terror operation in Minden-Lübbecke, the area of Rahden-Varl is cordoned of."
114,669150653671870468,Tue Nov 24 13:48:42 +0000 2015,0,0,Bon-Ton Stores says Cyber Monday deals to last from Nov.29 to Nov. 30 - @MarketsTicker https://t.co/kToxVrSZQH
115,669150652228988928,Tue Nov 24 13:48:42 +0000 2015,0,0,"European Commission President Donald Tusk: 'In this dangerous moment after downing of Russian jet, all should… https://t.co/o4ds2jXVQy"
116,669150650366713857,Tue Nov 24 13:48:41 +0000 2015,0,0,Vatican court rejects journalist's bid to drop leaks charges - @AP https://t.co/hCeZVW689l
117,669150648785485824,Tue Nov 24 13:48:41 +0000 2015,0,0,"Bombardier to unveil 'strategic imperatives' following $2.5 billion cash infusion from Quebec, Caisse -… https://t.co/24evi8p7We"
118,669150647254552576,Tue Nov 24 13:48:41 +0000 2015,0,0,"Denver, Colo., police investigate 3 separate early morning shootings - @denverpost https://t.co/JCcBL7CWq6"
119,669150644893147140,Tue Nov 24 13:48:40 +0000 2015,0,0,Convicted Cold War spy and former NSA employee Ronald Pelton to be freed from custody 30 years after arrest - @AP https://t.co/Kiswpga1f1
120,669150643282554880,Tue Nov 24 13:48:40 +0000 2015,0,0,US 3rd quarter GDP growth raised to 2.1% - @MarketWatch https://t.co/KkrgXc0QDx
121,669150641365757952,Tue Nov 24 13:48:39 +0000 2015,0,0,Dell apologies for HTTPS certificate fiasco that left systems vulnerable to hacking - @dangoodin001 https://t.co/nVPO01K9dz
122,669150638509453312,Tue Nov 24 13:48:39 +0000 2015,0,0,"Rare red-footed falcon found shot dead in Whittlesey, England - @BBCEngland https://t.co/eJgqEqBulF"
123,669150636366139393,Tue Nov 24 13:48:38 +0000 2015,0,0,Kohl's extends Cyber Monday to a full week from from Nov. 28 to Dec. 5 - @MarketsTicker https://t.co/X9nzptz22r
124,669142269807710208,Tue Nov 24 13:15:23 +0000 2015,1,0,"MORE: Russian fighter jet was shot down 4km inside Syrian territory,will have serious consequences on the Russian-Turkish relationship"
125,669141704642023424,Tue Nov 24 13:13:09 +0000 2015,0,0,BREAKING: Vladimir Putin says the downing of the Russian plane is a 'blow in the back' from Turkey.
126,669141703534714880,Tue Nov 24 13:13:08 +0000 2015,0,0,.AP Mobile app is experiencing technical issues showing yesterday stories. We're working to resolve this soonest.
127,669139669209214976,Tue Nov 24 13:05:03 +0000 2015,0,0,Sky Sources: Both pilots from the Russian warplane that was shot down by #Turkey over the Syrian border are dead
128,669139169608933376,Tue Nov 24 13:03:04 +0000 2015,0,0,"49% of Americans say racism is a “big problem,” according to new CNN/Kaiser Family Foundation poll. #RaceandReality https://t.co/WL7PN3HhOS"
129,669138977312669696,Tue Nov 24 13:02:18 +0000 2015,0,0,Mostly Sunny today! With a high of 49F and a low of 38F.
130,669138392144289792,Tue Nov 24 12:59:59 +0000 2015,0,0,"BREAKING: Russian President Putin 'Downing of Russian jet in Syria a ""stab in back by accomplices of terrorists"""
131,669137776554745856,Tue Nov 24 12:57:32 +0000 2015,0,0,The Latest: Russia responding cautiously to jet downing: https://t.co/7Ndw13beJ8 https://t.co/FAvLbeTL4c
132,669137195136086017,Tue Nov 24 12:55:13 +0000 2015,0,0,Tuesday front pages from across Connecticut https://t.co/lOAA1O66Hb
133,669135552143335426,Tue Nov 24 12:48:42 +0000 2015,0,0,"Merlin Entertainments: The crash on 'The Smiler' rollercoaster at #AltonTowers was caused by ""human error"" and ride will re-open next year"
134,669135435021484034,Tue Nov 24 12:48:14 +0000 2015,0,0,Facebook privacy judgement in Belgium delayed while court document is translated into English - @BBCTech https://t.co/8iYX9sfk5h
135,669135431435354112,Tue Nov 24 12:48:13 +0000 2015,0,0,"Human error caused Alton Towers rollercoaster crash in June that seriously injured 5 people, UK theme park says -… https://t.co/hzBHwq8599"
136,669135429011050496,Tue Nov 24 12:48:12 +0000 2015,0,0,Portugal's president names Socialist leader Antonio Costa as prime minister - @Reuters https://t.co/lPtZ9SHC1D
137,669135427303903232,Tue Nov 24 12:48:12 +0000 2015,0,0,Michel Platini's lawyer describes request from FIFA ethics investigators for a life ban as a 'pure scandal' -… https://t.co/Bbb4n9cSUy
138,669135425026396161,Tue Nov 24 12:48:11 +0000 2015,0,0,British Airways cancels flights between Egypt's Sharm el-Sheikh and UK until Jan. 14 - @BBCBreaking https://t.co/SSHz7g4yia
139,669135422539218945,Tue Nov 24 12:48:11 +0000 2015,0,0,Tropical Storm Sandra forms in the eastern Pacific - @AP https://t.co/uGBZnoNk0X
140,669135420232339456,Tue Nov 24 12:48:10 +0000 2015,0,0,Islamic State's Egyptian branch claims responsibility for bombing that killed 4 in a hotel in North Sinai capital… https://t.co/1ntVZ9E1Bd
141,669135418147799040,Tue Nov 24 12:48:10 +0000 2015,0,0,US official says US forces were not involved in incident involving Turkish shoot-down of Russian military aircraft… https://t.co/1Xn9GHQBno
142,669135415941533696,Tue Nov 24 12:48:09 +0000 2015,0,0,"Turkey PM announces new cabinet, Erdogan's son-in-law named energy minister - @AFP https://t.co/LZoGRpGQGZ"
