,id_str,created_at,retweet_count,favorite_count,text
143,669135413877968896,Tue Nov 24 12:48:09 +0000 2015,0,0,Syrian rebel group says 1 of Russian pilots who ejected from downed warplane was dead on landing - @BBCBreaking https://t.co/EPzg2UK26g
144,669134724577783808,Tue Nov 24 12:45:24 +0000 2015,0,0,"UPDATE: Russian FM Lavrov may sill go to #Turkey tomorrow, Trip was not yet officially cancelled"
145,669134024229658624,Tue Nov 24 12:42:37 +0000 2015,0,0,Tropical Storm Sandra forms in the eastern Pacific: https://t.co/GZLx5nuqY5
146,669134022908502017,Tue Nov 24 12:42:37 +0000 2015,0,0,PHOTO: Frame grab shows smoke on a hill after Turkey shot down a Russian warplane https://t.co/c7BN8XH7DC
147,669131597816446976,Tue Nov 24 12:32:59 +0000 2015,0,0,"RT CNNweather: Decent day for traveling today. West Coast is the exception, with rain and wind slowing you down. https://t.co/gkc2ea4meF"
148,669131596851716096,Tue Nov 24 12:32:59 +0000 2015,0,0,"4 killed in yesterday's crash of a U.S. Army helicopter during a training mission in Texas, Fort Hood says. https://t.co/3SNaD1uriR"
149,669130956813545472,Tue Nov 24 12:30:26 +0000 2015,0,0,IsraelHatzolah Was NOT shot down according to my information
150,669130955513286656,Tue Nov 24 12:30:26 +0000 2015,0,0,UPDATE: According to the rebels both pilots came under fire after they ejected the fighter jet after it was shot down by Turkish air-force
151,669128103034122240,Tue Nov 24 12:19:06 +0000 2015,0,0,Michel #Platini's lawyers say #FIFA's ethics committee has requested a life ban for the UEFA president
152,669128101943746561,Tue Nov 24 12:19:05 +0000 2015,0,0,British Airways has confirmed the airline will cancel all flights to and from #SharmElSheikh until 14 January
153,669127543916658688,Tue Nov 24 12:16:52 +0000 2015,0,0,Poll: GOP presidential candidate Ted Cruz surges to statistical tie for 1st place in new Iowa survey - @thehill https://t.co/3oqlDhBUCg
154,669127542410874881,Tue Nov 24 12:16:52 +0000 2015,0,0,Car bomb kills 5 at checkpoint east of Libya's capital Tripoli - @Reuters https://t.co/dmRuDt87V4
155,669127541005770753,Tue Nov 24 12:16:52 +0000 2015,0,0,Lawyer: FIFA ethics committee requests life ban for UEFA president Michel Platini - @AP https://t.co/WjSKYeRAwr
156,669127539185442817,Tue Nov 24 12:16:51 +0000 2015,0,0,Upcoming: NATO will hold an extraordinary meeting of the North Atlantic Council at 5pm Brussels time (11am ET) on… https://t.co/cXyz7bMEoA
157,669127197626601472,Tue Nov 24 12:15:30 +0000 2015,0,0,UPDATE: According to Free Syrian rebels the second Russian pilot is also dead. #Syria #Russia #Turkey
158,669126507369992192,Tue Nov 24 12:12:45 +0000 2015,0,0,#AP10Things: Russia confirms Turkey shot down warplane; French suspect faces terror charges: https://t.co/2V2Ohn5OeZ
159,669124319319089152,Tue Nov 24 12:04:04 +0000 2015,0,0,Sky Sources: 'Vote Leave' will ask 45 leading trade bodies to clarify their attitude to a UK exit from the European Union #EUref
160,669124318190804992,Tue Nov 24 12:04:03 +0000 2015,0,0,Update - AP: Rebel group that captured Russian pilot in #Syria after plane was downed on #Turkey-Syria border says he was dead upon landing
161,669123269304430592,Tue Nov 24 11:59:53 +0000 2015,0,0,"BREAKING: Explosion happened a short while ago  in #Kabul, #Afghanistan near a Police academy."
162,669123268297801728,Tue Nov 24 11:59:53 +0000 2015,0,0,UPDATE: Rebel group in #Syria that captured the Russian pilot isays he was dead upon landing.
163,669123259733004288,Tue Nov 24 11:59:51 +0000 2015,0,0,"UPDATE: NATO warned Russia on the 5/10/2015 of the ""extreme danger"" of its military aircraft incursions into Turkey https://t.co/boMVE4DWsz"
164,669123240783122433,Tue Nov 24 11:59:46 +0000 2015,0,0,Brooklyn: Man arrested on 7 hate crime charges after he Set #Jewish couples house on fire https://t.co/q02iGXC7oC https://t.co/D2CFi4boOm
165,669122753455398912,Tue Nov 24 11:57:50 +0000 2015,1,0,BREAKING: NATO will hold emergency meeting Tuesday in Brussels on downing of Russian plane by Turkey.
166,669122752520060929,Tue Nov 24 11:57:50 +0000 2015,0,0,The Latest on Paris attacks: Businesses feeling the pain as Brussels remains shuttered amid attacks alert: https://t.co/mIaqTTGKkt
167,669122751521808384,Tue Nov 24 11:57:50 +0000 2015,0,0,BREAKING: Platini's lawyer says FIFA ethics committee requests life ban for UEFA president Michel Platini.
168,669122750582255616,Tue Nov 24 11:57:50 +0000 2015,0,0,The Latest on downed Russian warplane: Rebel spokesman says Russian pilot landed dead: https://t.co/nZPo3nZmP4
169,669122749571457024,Tue Nov 24 11:57:49 +0000 2015,0,0,The Latest on Paris attacks: Belgium seeks intelligence-sharing with Morocco: https://t.co/3F4QQKA88N
170,669122748610932736,Tue Nov 24 11:57:49 +0000 2015,0,0,The Latest on downed Russian warplane: Turkey installs newly elected government amid tensions with Russia: https://t.co/21amUnyf2I
171,669122747608469504,Tue Nov 24 11:57:49 +0000 2015,1,0,BREAKING: Rebel group that captured Russian pilot in Syria says he was dead upon landing.
172,669120365143064576,Tue Nov 24 11:48:21 +0000 2015,0,0,Small Craft Advisory issued November 24 at 3:45AM PST until November 26 at 4:00AM PST by NWS https://t.co/EAWfnFVg9I
173,669120363435945984,Tue Nov 24 11:48:20 +0000 2015,0,0,Gale Watch issued November 24 at 3:45AM PST until November 26 at 4:00AM PST by NWS https://t.co/W2WMibygDf
174,669120357928820737,Tue Nov 24 11:48:19 +0000 2015,0,0,Small Craft Advisory issued November 24 at 3:45AM PST until November 26 at 4:00AM PST by NWS https://t.co/NFpevzWtFB
175,669120355861073921,Tue Nov 24 11:48:19 +0000 2015,0,0,Hazardous Seas Warning issued November 24 at 3:45AM PST until November 25 at 4:00PM PST by NWS https://t.co/9TWqHja3HT
176,669120353679994882,Tue Nov 24 11:48:18 +0000 2015,0,0,Small Craft Advisory issued November 24 at 3:44AM PST until November 25 at 3:00AM PST by NWS https://t.co/AGZZn1tW0v
177,669120350362296320,Tue Nov 24 11:48:17 +0000 2015,0,0,Small Craft Advisory For Rough Bar issued November 24 at 3:44AM PST until November 25 at 9:00AM PST by NWS https://t.co/HK6l02pDKE
178,669120347485003776,Tue Nov 24 11:48:17 +0000 2015,0,0,Small Craft Advisory issued November 24 at 3:44AM PST until November 25 at 3:00PM PST by NWS https://t.co/OBQ3GfipFo
179,669120344603496454,Tue Nov 24 11:48:16 +0000 2015,0,0,Small Craft Advisory issued November 24 at 3:44AM PST until November 24 at 9:00PM PST by NWS https://t.co/XEXlZGn3zy
180,669120204304162816,Tue Nov 24 11:47:43 +0000 2015,0,0,Turkey says it issued 10 warnings to the Russian plane it claims to have shot down. https://t.co/LyppYxPY0P https://t.co/HTYOhilgsu
181,669119667479277569,Tue Nov 24 11:45:35 +0000 2015,0,0,Volkswagen's Audi to pay millions to update engine software in US model - @WSJ https://t.co/NWKCYDV67W
182,669119664778117120,Tue Nov 24 11:45:34 +0000 2015,0,0,Turkish official says downing of jet was not action against any specific country but a step to defend Turkey's… https://t.co/jFf5FZAvRn
183,669119473534803968,Tue Nov 24 11:44:48 +0000 2015,0,0,UPDATE: NATO will hold an extraordinary council meeting 5pm Brussels time to inform members of downing of Russian jet by Turkish air-force
184,669119471693529089,Tue Nov 24 11:44:48 +0000 2015,0,0,"UPDATE: The Police operation in #Ariege #France is focusing on a local radical Imam known as ""white emir"" https://t.co/JSqVzLoAIW"
185,669118963025072128,Tue Nov 24 11:42:47 +0000 2015,0,0,"Excerpts from emails between Coke executives, leaders of anti-obesity group: https://t.co/zSWYr5Ci8a"
186,669116783610232832,Tue Nov 24 11:34:07 +0000 2015,0,0,Update - Turkish official: downing of jet was not an action against any specific country but a step to defend #Turkey's sovereign territory
187,669113025895522304,Tue Nov 24 11:19:11 +0000 2015,0,0,"OFSTED has found 9 of 22 faith schools to be ""inadequate"" and 4 schools were found to have ""inadequate practice"" in promoting British values"
188,669112052678418432,Tue Nov 24 11:15:19 +0000 2015,0,0,Video: Anti-tank rocket hits a car containing Russian journalists in Syria - @RT_com https://t.co/8fybSGV4uv
189,669111965306998784,Tue Nov 24 11:14:58 +0000 2015,0,0,"BREAKING: Big Police operation underway in #Artigat in Ariège #France, Heavily armed police units supported by Helicopters involved"
190,669109908764098561,Tue Nov 24 11:06:48 +0000 2015,0,0,Special Weather Statement issued November 24 at 4:03AM MST until November 26 at 11:00AM MST by NWS https://t.co/lX0fxOFuv2
191,669109906134269952,Tue Nov 24 11:06:47 +0000 2015,0,0,Special Weather Statement issued November 24 at 4:01AM MST by NWS https://t.co/ZIq5UQu2ri
192,669109902506258433,Tue Nov 24 11:06:46 +0000 2015,0,0,Wind Advisory issued November 24 at 3:52AM MST until November 25 at 8:00PM MST by NWS https://t.co/WAH0h38VXk
193,669109898987204609,Tue Nov 24 11:06:46 +0000 2015,0,0,Special Weather Statement issued November 24 at 5:49AM EST by NWS https://t.co/EclaI4xzHO
194,669109894792896513,Tue Nov 24 11:06:45 +0000 2015,0,0,Winter Storm Watch issued November 24 at 3:47AM MST until November 26 at 11:00AM MST by NWS https://t.co/iRbUHKfwg3
195,669108569837580288,Tue Nov 24 11:01:29 +0000 2015,0,0,APNewsBreak: Emails reveal Coke's role in anti-obesity group; company says exec has retired: https://t.co/mccImXTXlv
196,669105496712851456,Tue Nov 24 10:49:16 +0000 2015,0,0,Small Craft Advisory issued November 24 at 2:40AM PST until November 25 at 4:00AM PST by NWS https://t.co/nD12c4rOfF
197,669105495295193089,Tue Nov 24 10:49:16 +0000 2015,0,0,Small Craft Advisory issued November 24 at 2:40AM PST until November 25 at 3:00AM PST by NWS https://t.co/V93s49qTkA
198,669105493483261952,Tue Nov 24 10:49:15 +0000 2015,0,0,Small Craft Advisory issued November 24 at 2:40AM PST until November 25 at 3:00AM PST by NWS https://t.co/ODeCSW8zeJ
199,669105491897749504,Tue Nov 24 10:49:15 +0000 2015,0,0,Gale Warning issued November 24 at 2:40AM PST until November 25 at 9:00AM PST by NWS https://t.co/PBjFHkAa5N
