,id_str,created_at,retweet_count,favorite_count,text
0,270914609349795841,Tue Nov 20 15:40:50 +0000 2012,1,2,What Nike Can Teach You About Developing Your Business http://t.co/izt1Cq9E #news #latestnews
1,270904704870002689,Tue Nov 20 15:01:29 +0000 2012,0,1,Secured Credit Card vs. Prepaid Debit Card http://t.co/asSEluGW #news #latestnews
2,270904703913717760,Tue Nov 20 15:01:29 +0000 2012,0,0,What is FEMA and How to Get FEMA Assistance http://t.co/ohjlApve #news #latestnews
3,270743034948354048,Tue Nov 20 04:19:04 +0000 2012,0,0,Southwest Airlines Rapid Rewards Premier Credit Card | Review http://t.co/xyolXnVG #news #latestnews
4,266996385256206336,Fri Nov 09 20:11:13 +0000 2012,0,0,Why Books And Canned Business Courses Will Not Help You In Real Life http://t.co/ifnjuCer #news #latestnews
5,266724883378085888,Fri Nov 09 02:12:22 +0000 2012,0,0,Win a free copy of The Frugal Book Promoter http://t.co/kTVzs1EG #news #latestnews
6,266709221465268224,Fri Nov 09 01:10:08 +0000 2012,0,1,You Can Make Over Anything | Self-Help Happiness Blog http://t.co/5P6zVrkM #news #latestnews
7,266551897664663553,Thu Nov 08 14:44:59 +0000 2012,0,0,How Much Should a Professor's Salary Be? http://t.co/8zpAH9NH #news #latestnews
8,266179972899688448,Wed Nov 07 14:07:05 +0000 2012,0,0,Are You Ready to Fall Off the Fiscal Cliff? What You Need to Know if the Bush Tax Cuts Expire http://t.co/3RqcC8Oo #news #latestnews
9,265915208558596098,Tue Nov 06 20:35:00 +0000 2012,0,0,What To Do When You Have Too Many Empties | Barwhiz Blog http://t.co/FrTdetn2 #news #latestnews
10,265915207556165632,Tue Nov 06 20:35:00 +0000 2012,0,0,One Simple Process That Your Business Could Benefit From http://t.co/nJS3PXHx #news #latestnews
11,265915206679543808,Tue Nov 06 20:35:00 +0000 2012,0,0,Arbor Investment Planner – About Page http://t.co/nxg0w76A #news #latestnews
12,265816203463884800,Tue Nov 06 14:01:36 +0000 2012,0,0,Debt Snowflaking: Using Small Amounts to Payoff Your Debt Faster http://t.co/h7dQEk3E #news #latestnews
13,265650163157200898,Tue Nov 06 03:01:49 +0000 2012,1,1,Government Social Media Integration: Reducing Risks (III) http://t.co/uWUUUquX #news #latestnews
14,265650162125389825,Tue Nov 06 03:01:48 +0000 2012,0,0,Euro Weakens on Greek Concerns http://t.co/26xmbian #news #latestnews
15,265650161089384449,Tue Nov 06 03:01:48 +0000 2012,0,0,Obama or Romney: Presidential Election and the Stock Market http://t.co/NimrEWSn #news #latestnews
16,265650159843672068,Tue Nov 06 03:01:48 +0000 2012,0,0,3 Things Mortgage Lenders Look for in a Borrower http://t.co/OEfwbUBJ #news #latestnews
17,265481369495412736,Mon Nov 05 15:51:05 +0000 2012,0,0,What are Real Estate Closing Costs Made Up Of http://t.co/UfEapP72 #news #latestnews
18,265473472417918978,Mon Nov 05 15:19:42 +0000 2012,0,0,7 Ways Your Finances are Scarier Than Zombies http://t.co/fXXirY8Z #news #latestnews
19,264428151168438273,Fri Nov 02 18:05:58 +0000 2012,0,0,How You Can Adapt Google’s 20 Percent Time to Build Your Business http://t.co/vQJmYu2V #news #latestnews
20,264005807002222592,Thu Nov 01 14:07:44 +0000 2012,0,0,"Using Groupon, Living Social and Other Sites Like Them To Check Out a New City http://t.co/wRxlrlOY #news #latestnews"
21,263102837167366144,Tue Oct 30 02:19:39 +0000 2012,0,0,Return on Enterprise Value (ROEV) – Best Stock Valuation Calculation http://t.co/dMsfFH8v #news #latestnews
22,263102836181704704,Tue Oct 30 02:19:39 +0000 2012,0,0,Five Tips to Survive and Thrive Through a Divorce http://t.co/fzMYu3I4 #news #latestnews
23,263102835170869248,Tue Oct 30 02:19:38 +0000 2012,0,0,How Far Can You Trust the Internet? | David Leonhardt’s SEO and Social Media Marketing http://t.co/tvN6Sj8b #news #latestnews
24,262943319770931200,Mon Oct 29 15:45:47 +0000 2012,0,0,Sometimes You Need To Take A Step Back With Your Business To Move Forward http://t.co/VApbf9rL #news #latestnews
25,262817214648958976,Mon Oct 29 07:24:41 +0000 2012,0,0,NDRにはvxworks・linux・windowsドライバ開発、.NETソフトウェア開発、ソフトウェアローカライズ・グローバライズを行います。 http://t.co/gWm4Eie5 #news #latestnews
26,262817213826883584,Mon Oct 29 07:24:41 +0000 2012,0,0,NDRには PCI 設計開発、CPUボード設計、FPGA 設計、One Stop Solution システム開発を行います。 http://t.co/cSg4oe37 #news #latestnews
27,262817212782485504,Mon Oct 29 07:24:41 +0000 2012,0,0,エヌディアール （NDR）はハード部門とソフト部門のOne Stop Solutionシステム開発、海外でのオフショア開発を行います。 http://t.co/Fu4pQtfB #news #latestnews
28,262817211989753856,Mon Oct 29 07:24:40 +0000 2012,0,0,大阪市西淀川区御幣島での月極駐車場 http://t.co/taEUtVfw #news #latestnews
29,262817211088007169,Mon Oct 29 07:24:40 +0000 2012,0,0,マイクロバブルの活用について http://t.co/RIO2rG1w #news #latestnews
30,261843059686383616,Fri Oct 26 14:53:44 +0000 2012,0,0,Would You Sell Yourself to Pay for College (or Anything Else)? http://t.co/FYReNtfG #news #latestnews
31,261479708573720576,Thu Oct 25 14:49:55 +0000 2012,0,0,Using a Roth IRA as an Emergency Fund http://t.co/d3FrR3Ff #news #latestnews
32,261479707764211713,Thu Oct 25 14:49:55 +0000 2012,0,0,BarWhiz Android App released! | Barwhiz Blog http://t.co/spouRh0x #news #latestnews
33,261479706703040513,Thu Oct 25 14:49:54 +0000 2012,0,0,The Canada Student Loans Centre Problem Solving Flow Chart http://t.co/8mgJU4XP #news #latestnews
34,261479705641906178,Thu Oct 25 14:49:54 +0000 2012,0,0,Why Is The Canadian Student Loans Program Insane? http://t.co/B0VwPLMt #news #latestnews
35,261479704702353408,Thu Oct 25 14:49:54 +0000 2012,0,0,Where to Invest Your Money – Allocating Assets in Economic Uncertainty http://t.co/lK4OgFS3 #news #latestnews
36,258972031306059777,Thu Oct 18 16:45:18 +0000 2012,0,0,Interview With 8 Figure Shop Owner Polly Liu – Founder Of Beau-coup Favors http://t.co/Xp95BO2v #news #latestnews
37,258972030324592641,Thu Oct 18 16:45:18 +0000 2012,0,0,Following the Crowd Leads to the Slaughter House http://t.co/ePAwYFxn #news #latestnews
38,258924619514380289,Thu Oct 18 13:36:54 +0000 2012,0,0,Could a P2P Loan Help You Pay Off Your Credit Card Debt? http://t.co/gFduxxBp #news #latestnews
39,258924618386141185,Thu Oct 18 13:36:54 +0000 2012,0,0,What is Social Security Tax? http://t.co/2PlHUb7O #news #latestnews
40,258797585739964417,Thu Oct 18 05:12:07 +0000 2012,0,0,Millionaire Teacher: The Nine Rules of Wealth You Should Have Learned in School http://t.co/O1bVfWRG #news #latestnews
41,258797584850747392,Thu Oct 18 05:12:07 +0000 2012,0,0,How to Handle Money Matters After Tying the Knot http://t.co/IimWgvXS #news #latestnews
42,258797584074809344,Thu Oct 18 05:12:06 +0000 2012,0,0,5 Ways to Learn About Investing http://t.co/QUN876Se #news #latestnews
43,258797583206588416,Thu Oct 18 05:12:06 +0000 2012,0,0,What is Your Debt to Credit Ratio (And Why Should You Care) http://t.co/KQywrGV7 #news #latestnews
44,258797581914746880,Thu Oct 18 05:12:06 +0000 2012,0,0,Managing Your Travel Budget http://t.co/CyXTLd06 #news #latestnews
45,258758355923898369,Thu Oct 18 02:36:14 +0000 2012,0,0,How to Control Your Emotions When Shopping http://t.co/0bpurIgw #news #latestnews
46,258642921459417089,Wed Oct 17 18:57:32 +0000 2012,0,0,Selling  Stock at a Loss and Loss Aversion Bias http://t.co/Zkvj6hbZ #news #latestnews
47,258194505440837633,Tue Oct 16 13:15:41 +0000 2012,0,0,Euro Gains as Risk Appetite Makes an Appearance http://t.co/DCxPdOHu #news #latestnews
48,258194504526479360,Tue Oct 16 13:15:41 +0000 2012,0,0,"Now Matter How Little You Have, Start Saving NOW http://t.co/Wc4dFKJc #news #latestnews"
49,258194503112994816,Tue Oct 16 13:15:41 +0000 2012,0,0,How to Get a Personal Loan http://t.co/V51lcE9b #news #latestnews
50,258194502043443200,Tue Oct 16 13:15:40 +0000 2012,0,0,How to Invest In Foreign Currency http://t.co/H842Sp4H #news #latestnews
51,258194501091328002,Tue Oct 16 13:15:40 +0000 2012,0,0,Why We Choose to Live in a Smaller Home http://t.co/D7G3Ghen #news #latestnews
52,257898186339913728,Mon Oct 15 17:38:13 +0000 2012,0,0,A Woman's Perspective on Engagement Rings http://t.co/nEKY4wND #news #latestnews
53,257898185429757952,Mon Oct 15 17:38:13 +0000 2012,0,0,My University Money Interactive Student Budget http://t.co/AAZC61rB #news #latestnews
54,257842843698229249,Mon Oct 15 13:58:19 +0000 2012,0,0,Use a Credit Card to Build Your Credit History Fast http://t.co/0l3x7vnl #news #latestnews
55,256450722286145536,Thu Oct 11 17:46:31 +0000 2012,0,0,12 Things I Learned From Starting 3 Successful Lifestyle Businesses http://t.co/eGqXV93D #news #latestnews
56,256411623621787648,Thu Oct 11 15:11:09 +0000 2012,0,0,Paying for a Good Education in the Beginning or the End? http://t.co/OZN2k7rX #news #latestnews
57,256081956339597312,Wed Oct 10 17:21:10 +0000 2012,0,0,Vigrx Plus http://t.co/VteQS4Pa #news #latestnews
58,256058501212819457,Wed Oct 10 15:47:58 +0000 2012,0,0,Gender Ratio and Getting a MR Degree http://t.co/dyfa6do5 #news #latestnews
59,256058500269084672,Wed Oct 10 15:47:58 +0000 2012,0,0,Best Place to Live and Travel – South America or South East Asia? Part 2 http://t.co/pi6yTGAH #news #latestnews
60,256042574488424449,Wed Oct 10 14:44:41 +0000 2012,0,0,Should I Use the Home Office Tax Deduction for My Home Business? http://t.co/cFFNkhGV #news #latestnews
61,256042573607600128,Wed Oct 10 14:44:41 +0000 2012,0,0,The History of Columbus Day and Christopher Columbus http://t.co/iCkJdbEh #news #latestnews
62,256042572638724096,Wed Oct 10 14:44:41 +0000 2012,0,0,Can the Government Garnish Your Wages if You Don’t Pay Student Loans? http://t.co/6U9uq4fQ #news #latestnews
63,256042571581775873,Wed Oct 10 14:44:40 +0000 2012,0,0,Open Enrollment: What to Look for in Health Insurance http://t.co/v6x6VzXm #news #latestnews
64,256042570558357504,Wed Oct 10 14:44:40 +0000 2012,0,0,US Dollar Firms After Mario Draghi’s Speech http://t.co/dBxqpyQt #news #latestnews
65,255682517963796481,Tue Oct 09 14:53:57 +0000 2012,0,0,The Importance of Routine for Breeding Success In Business http://t.co/bC2aqprT #news #latestnews
66,255682516655169537,Tue Oct 09 14:53:56 +0000 2012,0,0,Chase Freedom Credit Card Review http://t.co/RIYbjvnh #news #latestnews
67,255682515635953665,Tue Oct 09 14:53:56 +0000 2012,0,0,5 Tips for Helping You Stick with Your Investment Strategy http://t.co/YjssF19L #news #latestnews
68,255548300088975360,Tue Oct 09 06:00:37 +0000 2012,0,0,6 Ways to Improve Your Marketability http://t.co/LQf4num0 #news #latestnews
69,255548299136860160,Tue Oct 09 06:00:37 +0000 2012,0,0,Have You Started Organizing Your Home Business Taxes? http://t.co/q65LD1LF #news #latestnews
70,255548298235092992,Tue Oct 09 06:00:36 +0000 2012,0,0,Pay Off Your Mortgage Faster - 5 Strategies to Own Your Home Quickly http://t.co/VwXIgcGP #news #latestnews
71,255548297329115136,Tue Oct 09 06:00:36 +0000 2012,0,0,Japanese Yen Heads Higher on Risk Aversion http://t.co/xpdUK9Ho #news #latestnews
72,255548296058269697,Tue Oct 09 06:00:36 +0000 2012,0,0,5 Best Prepaid Debit Cards http://t.co/qaCCodYk #news #latestnews
73,255460576753512449,Tue Oct 09 00:12:02 +0000 2012,0,0,What is QE3 (Quantitative Easing) and How Does it Affect You? http://t.co/L1IBkK0T #news #latestnews
74,254395057350778880,Sat Oct 06 01:38:02 +0000 2012,0,0,Best Place to Live and Travel – South America or South East Asia? http://t.co/w0wkmhpZ #news #latestnews
75,254395056440635392,Sat Oct 06 01:38:02 +0000 2012,0,0,Is An MBA Worth It? http://t.co/ZCRdBaOu #news #latestnews
76,254270299900624896,Fri Oct 05 17:22:18 +0000 2012,0,0,Credit Card Fees: Eroding Your Wealth http://t.co/6UHdu0mz #news #latestnews
77,254270298986274816,Fri Oct 05 17:22:18 +0000 2012,0,0,How to Become a Millionaire http://t.co/Ctci5JV7 #news #latestnews
78,253553081579606017,Wed Oct 03 17:52:20 +0000 2012,0,0,Know Your Spending Triggers To Change Your Financial Behavior http://t.co/2EKMBBy2 #news #latestnews
79,253330494236786689,Wed Oct 03 03:07:51 +0000 2012,0,0,Improve Your Satisfaction with Your Life: Meaningful Activities http://t.co/dVQK5dog #news #latestnews
80,253330493355999233,Wed Oct 03 03:07:50 +0000 2012,0,0,Freelance Writing: Handling Editing and Revision Requests http://t.co/1aSZwUQE #news #latestnews
81,253330492252897280,Wed Oct 03 03:07:50 +0000 2012,0,0,Pay Down Debt and Improve Your Life http://t.co/FSlbs9Rv #news #latestnews
82,253330491254652928,Wed Oct 03 03:07:50 +0000 2012,0,0,Don’t Feel Like a Chump: 3 Scams to Avoid on Craiglist http://t.co/gx8Rhc6g #news #latestnews
83,253330490239635456,Wed Oct 03 03:07:50 +0000 2012,0,0,Do You Need Life Insurance? http://t.co/eSAshRwj #news #latestnews
84,253193858622558209,Tue Oct 02 18:04:54 +0000 2012,0,0,Why Your Profitable Business Could Be One Step From Ruin http://t.co/CiweIuKW #news #latestnews
85,253178213709266944,Tue Oct 02 17:02:44 +0000 2012,0,0,Should You Consolidate Your Credit Card Debt? http://t.co/pJvTFZdf #news #latestnews
86,253178212425818112,Tue Oct 02 17:02:44 +0000 2012,0,0,SimplyCash from American Express OPEN – Earn Cash Back for your Business http://t.co/4su6lbsx #news #latestnews
87,252840172700438530,Mon Oct 01 18:39:29 +0000 2012,0,0,TED Spread &amp; LIBOR: What Every Investor Should Know http://t.co/xtOa2CI5 #news #latestnews
88,252840171614138369,Mon Oct 01 18:39:29 +0000 2012,0,0,The Difference Between a Hard Credit Pull and a Soft Credit Pull http://t.co/IgJpISmB #news #latestnews
89,251802449709510656,Fri Sep 28 21:55:56 +0000 2012,0,0,Citi Forward® Credit Card Review - Credit Card Smarts http://t.co/8bUMexGr #news #latestnews
90,251682983826845696,Fri Sep 28 14:01:14 +0000 2012,0,0,Learn about Building a Dividend Stock Portfolio with Mike Heroux http://t.co/wGbgd0wN #news #latestnews
91,251682982933446657,Fri Sep 28 14:01:13 +0000 2012,0,0,Teaching Your Child the Value of Patience when Spending Money http://t.co/cBc3BStW #news #latestnews
92,251682982023266305,Fri Sep 28 14:01:13 +0000 2012,0,0,A Brief Overview on How To Deduct Investment Losses http://t.co/CkuRNNPP #news #latestnews
93,251682980865650688,Fri Sep 28 14:01:13 +0000 2012,0,0,How Many Credit Cards Is Too Many? http://t.co/PxxJ1uNS #news #latestnews
94,251682979494105088,Fri Sep 28 14:01:13 +0000 2012,0,0,Thrift Stores as Part of Your Sustainable and Frugal Lifestyle http://t.co/Ijbm39xe #news #latestnews
95,251313402616627201,Thu Sep 27 13:32:39 +0000 2012,0,0,The Many Ways the Internet Saves (and Makes) You Money http://t.co/GYmjwfIR #news #latestnews
96,251289437844144128,Thu Sep 27 11:57:25 +0000 2012,0,0,The Fiscal Cliff: Why Your Tax Rates Could Increase Next Year http://t.co/k4y6mn6U #news #latestnews
97,251210230006947840,Thu Sep 27 06:42:40 +0000 2012,0,0,How to Consolidate Your Debt and Pros and Cons http://t.co/gjeeRsUs #news #latestnews
98,251210229046452224,Thu Sep 27 06:42:40 +0000 2012,0,0,"Exponential Growth, Double Time, and the Rule of 72 http://t.co/GmnyNlYp #news #latestnews"
99,250962891912671233,Wed Sep 26 14:19:50 +0000 2012,0,0,Should You Sign Your Child Up for Art Classes? http://t.co/7zC5FjJO #news #latestnews
100,250962890947952640,Wed Sep 26 14:19:50 +0000 2012,0,0,The Motley Fool Launches Invest Better Day http://t.co/izkdqi6Y #news #latestnews
101,250962889911975936,Wed Sep 26 14:19:50 +0000 2012,0,0,3 Ways to Save When You Buy Apple Products http://t.co/y26CWd7J #news #latestnews
102,250962888829853696,Wed Sep 26 14:19:50 +0000 2012,0,0,Identify Your Money Motivations http://t.co/tmxnAyzW #news #latestnews
103,250962887483461632,Wed Sep 26 14:19:49 +0000 2012,0,0,Five Surprising High Income Jobs http://t.co/4HsnJ7G1 #news #latestnews
104,250682338432925696,Tue Sep 25 19:45:01 +0000 2012,0,0,5 Simple Steps to Writing Engaging Web Content that Converts http://t.co/v5Yf7JST #news #latestnews
105,250682337426292736,Tue Sep 25 19:45:01 +0000 2012,0,0,Financing Platform for Borrowers and Lenders to Find Each Other http://t.co/3Q1qTwkq #news #latestnews
106,250682336411258882,Tue Sep 25 19:45:01 +0000 2012,0,0,6 Easy Ways to Make Money While Sitting in Front of the TV http://t.co/AZsNuXRl #news #latestnews
107,250682335341715457,Tue Sep 25 19:45:00 +0000 2012,0,0,How Much are Credit Cards Costing You? http://t.co/Z8CR3xnJ #news #latestnews
108,250585567056764928,Tue Sep 25 13:20:29 +0000 2012,0,0,Not Sure What To Do But Love Travelling? - My University Money http://t.co/LSQE3bSt #news #latestnews
109,250585566024957956,Tue Sep 25 13:20:29 +0000 2012,0,0,Delaying the Real World - Young And Thrifty http://t.co/IjLVsXWs #news #latestnews
110,250247889027215361,Mon Sep 24 14:58:40 +0000 2012,0,0,Shiller PE 10: An Important Stock Market Valuation Tool http://t.co/l5KZyGsX #news #latestnews
111,250237245573980160,Mon Sep 24 14:16:23 +0000 2012,0,0,Roth IRA 5 Year Rule on Withdrawals http://t.co/UbA3g225 #news #latestnews
112,250237238049402880,Mon Sep 24 14:16:21 +0000 2012,0,0,5 Tips to Help You Deal with Economic Uncertainty http://t.co/OZvAjuNH #news #latestnews
113,248781395399426048,Thu Sep 20 13:51:21 +0000 2012,0,0,"Kapitall Brokerage Review: A Trading Playground To Test Out Practice Portfolios, Then Trade http://t.co/AWhAN9Vs #news #latestnews"
114,248781393910444032,Thu Sep 20 13:51:21 +0000 2012,0,0,Gold Delta SkyMiles Credit Card from American Express Review http://t.co/26u3l0GZ #news #latestnews
115,248781391888785409,Thu Sep 20 13:51:20 +0000 2012,0,0,Price Earnings Growth (PEG) Ratio: Stock Valuation Tool http://t.co/30WVvIDI #news #latestnews
116,248438297913872384,Wed Sep 19 15:08:00 +0000 2012,0,0,How to Use the Debt Snowball to Pay Off Credit Card Debt http://t.co/QQXlOr6T #news #latestnews
117,248438296953356288,Wed Sep 19 15:08:00 +0000 2012,0,0,Swagbucks Review: Join to Receive Free Gift Cards and Other Prizes http://t.co/RAMmXmk1 #news #latestnews
118,248438295921557505,Wed Sep 19 15:08:00 +0000 2012,0,0,The 5 Principles that All Online Bootstrapped Businesses Should Swear By http://t.co/h6LAcaBf #news #latestnews
119,248438294583599104,Wed Sep 19 15:07:59 +0000 2012,0,0,Blame BOB If The Middle Class Is Destroyed http://t.co/YZEAp5C6 #news #latestnews
120,248438293555978241,Wed Sep 19 15:07:59 +0000 2012,0,0,Four Ways You Can Pay Off Your Home Mortgage Faster http://t.co/K30TCcnv #news #latestnews
121,241311209004101633,Thu Aug 30 23:07:30 +0000 2012,0,0,"Packing For A Blog Conference: What Gadgets, Software, Clothing And Other Things Should You Bring? http://t.co/MDH4Dyez #news #latestnews"
122,241192254751010816,Thu Aug 30 15:14:49 +0000 2012,0,0,Have You Thought about the Costs of Being Self-Employed http://t.co/RUHYUvWI #news #latestnews
123,240939388182360064,Wed Aug 29 22:30:01 +0000 2012,0,0,Discipline: An Attribute Of Millionaires That You Need To Succed http://t.co/FokboDRu #news #latestnews
124,240835114186190848,Wed Aug 29 15:35:40 +0000 2012,0,0,The Easiest Way To Start A Fully Featured Online Store Without The Headaches http://t.co/XcPuuGpN #news #latestnews
125,240819058918952961,Wed Aug 29 14:31:52 +0000 2012,0,0,Why A Fiduciary Standard For Investment Advisors Is Needed In Canada http://t.co/Mbb6pLPk #news #latestnews
126,240599713391443968,Wed Aug 29 00:00:16 +0000 2012,0,0,What Are The Best Student Credit Cards? http://t.co/S13Ef1u2 #news #latestnews
127,240599712443535360,Wed Aug 29 00:00:16 +0000 2012,0,0,"Looking for a Day to Celebrate? No Shortage of ""National"" Days http://t.co/pwvNNtA2 #news #latestnews"
128,240599711566950402,Wed Aug 29 00:00:16 +0000 2012,0,0,How Telecommuting Can Save You Money (and Help the Environment) | Sustainable Personal Finance http://t.co/pTpt93Pn #news #latestnews
129,240599710799372288,Wed Aug 29 00:00:15 +0000 2012,0,0,What are Your Cost Basis Options? http://t.co/xbvLA3sX #news #latestnews
130,240599709784371200,Wed Aug 29 00:00:15 +0000 2012,0,0,5 Ridiculous Ways to Save Money http://t.co/E5aqruOp #news #latestnews
131,240536266586865664,Tue Aug 28 19:48:09 +0000 2012,0,0,Financial Peace University (FPU) Review: The New Updated 2012 Membership Kit And Class http://t.co/cIqlW0qH #news #latestnews
132,240464486081904641,Tue Aug 28 15:02:55 +0000 2012,0,0,The Power of Personality in Online Business http://t.co/HvrnYta6 #news #latestnews
133,240464463868882945,Tue Aug 28 15:02:50 +0000 2012,0,0,American Express Blue Cash Everyday(SM) Review http://t.co/8RXfANCp #news #latestnews
134,240464462904164352,Tue Aug 28 15:02:50 +0000 2012,0,0,What is the Student Loan Forgiveness Act and Is It a Good Idea? http://t.co/S2iKs5KG #news #latestnews
135,240275216037728256,Tue Aug 28 02:30:50 +0000 2012,0,0,Gross Income vs Net Income http://t.co/en3kCczs #news #latestnews
136,240267485956419584,Tue Aug 28 02:00:07 +0000 2012,0,0,Advantages of Dividend Investing http://t.co/aICcgvzl #news #latestnews
137,240267485151113216,Tue Aug 28 02:00:07 +0000 2012,0,0,Life Insurance is a Vital Component of Any Financial Plan | Wealthy Turtle http://t.co/mUo7W24b #news #latestnews
138,240267484278697986,Tue Aug 28 02:00:06 +0000 2012,0,0,What Batman Taught Me About Blogging http://t.co/TUzCrOkn #news #latestnews
139,240212906829033472,Mon Aug 27 22:23:14 +0000 2012,0,0,30 Year Mortgage vs. 15 Year Mortgage: Pros and Cons http://t.co/z1q74QLW #news #latestnews
140,240212905965019136,Mon Aug 27 22:23:14 +0000 2012,0,0,Still Trying to Sort Out the Eurozone Problems http://t.co/mKvM126U #news #latestnews
141,240212903775588355,Mon Aug 27 22:23:13 +0000 2012,0,0,CAN YOU RELY ON THE 4% RULE IN RETIREMENT? http://t.co/yDSxJxFu #news #latestnews
142,240157927162400769,Mon Aug 27 18:44:46 +0000 2012,0,0,Paying Down Debt? Make Sure To Recognize Non-Financial Progress http://t.co/E1g8Tjk8 #news #latestnews
143,240157926189309953,Mon Aug 27 18:44:46 +0000 2012,0,0,Government Social Media Integration: Reducing Risks (I) http://t.co/xSJaH5Z2 #news #latestnews
144,240084774486700033,Mon Aug 27 13:54:05 +0000 2012,0,0,Why Maxing Out Your Credit Cards is Bad http://t.co/m5TVpQRn #news #latestnews
145,240084772964143104,Mon Aug 27 13:54:05 +0000 2012,0,0,How To Use A Stock Screener To Find The Best Stocks http://t.co/iXinuch0 #news #latestnews
146,240084772049801219,Mon Aug 27 13:54:04 +0000 2012,0,0,Your Portfolio Allocation Plan Needs to Change Because of These Facts http://t.co/vSEFyyWA #news #latestnews
147,239475823386701824,Sat Aug 25 21:34:20 +0000 2012,0,0,Should Canada Pay It’s Amateur Athletes? - Young And Thrifty http://t.co/kVG1oQqc #news #latestnews
148,239475822602366976,Sat Aug 25 21:34:20 +0000 2012,0,0,What Is Interning and Should I Do It? - My University Money http://t.co/kCEncDnK #news #latestnews
149,238814891098640384,Fri Aug 24 01:48:01 +0000 2012,0,0,4 Low Cost Home Businesses You Can Start Today http://t.co/BC4nEDKZ #news #latestnews
150,238814890217844736,Fri Aug 24 01:48:01 +0000 2012,0,0,4 Signs an Investment Might Be in a Bubble - Yahoo! News http://t.co/4g2j13Ce #news #latestnews
151,238814889148284928,Fri Aug 24 01:48:01 +0000 2012,0,0,5 Mid-Year Tuneups for Your 401k http://t.co/aqbjp84W #news #latestnews
152,238752150031851520,Thu Aug 23 21:38:43 +0000 2012,0,0,Top 10 Most Unique Bar Concepts | Barwhiz Blog http://t.co/mwy2DseL #news #latestnews
153,238752149201379328,Thu Aug 23 21:38:42 +0000 2012,0,0,How Far Would You Go to Score a Deal? - Young And Thrifty http://t.co/FpMZTg8f #news #latestnews
154,238752148287008768,Thu Aug 23 21:38:42 +0000 2012,0,0,Ancillary Fees: What Are You Paying For? - My University Money http://t.co/ds5521n4 #news #latestnews
155,238752147318124545,Thu Aug 23 21:38:42 +0000 2012,0,0,Investing In Yourself Doesn’t Have To Be Expensive http://t.co/Y6K4Iysw #news #latestnews
156,238642118715916288,Thu Aug 23 14:21:29 +0000 2012,0,0,Septic Tank Cleaning Camano http://t.co/cqz4fyCt #news #latestnews
157,238642117747032064,Thu Aug 23 14:21:29 +0000 2012,0,0,Dicas de Fantasias Masculinas http://t.co/NaY1yRIv #news #latestnews
158,238294091371249665,Wed Aug 22 15:18:33 +0000 2012,0,0,Are You Counting On An Inheritance? http://t.co/tmij6MVF #news #latestnews
159,238294090335281153,Wed Aug 22 15:18:33 +0000 2012,0,0,What If Zuckerberg Stepped Down as Facebook CEO? http://t.co/FXy47iaU #news #latestnews
160,235920385764384769,Thu Aug 16 02:06:17 +0000 2012,0,0,The Art Of Tipping http://t.co/29Ik6Vb1 #news #latestnews
161,235920384556421120,Thu Aug 16 02:06:17 +0000 2012,0,0,"Chantalyne sings ""Don't Cry Out Loud"" at Williamstown Fair 2012 http://t.co/qmETVymv #news #latestnews"
162,235920383738535937,Thu Aug 16 02:06:17 +0000 2012,0,0,Anonymous Sources – is it ethical to use them? http://t.co/nXuuJcPE #news #latestnews
163,235920382719303680,Thu Aug 16 02:06:17 +0000 2012,0,0,The Health Freak’s Guide To Boozing http://t.co/mvmNvSeG #news #latestnews
164,235825366428680192,Wed Aug 15 19:48:43 +0000 2012,0,0,Beauty marks | Self-Help Happiness Blog http://t.co/illCMOYq #news #latestnews
165,235825365610811392,Wed Aug 15 19:48:43 +0000 2012,0,0,5 Ways to Travel for Free http://t.co/sFADLskY #news #latestnews
166,235825364755165184,Wed Aug 15 19:48:43 +0000 2012,0,0,Portfolio Rebalancing: A Powerful Risk Management Strategy http://t.co/1agz3H5R #news #latestnews
167,235825363828211714,Wed Aug 15 19:48:42 +0000 2012,0,0,Gain Investment Advantage With An Index ETF http://t.co/7N3dXHVt #news #latestnews
168,235628759959609345,Wed Aug 15 06:47:28 +0000 2012,0,0,Applying For Student Loans Part 2 of 3 - My University Money http://t.co/7uKxWzIF #news #latestnews
169,235628759108161536,Wed Aug 15 06:47:28 +0000 2012,0,0,The Cost of a Family Cottage or Cabin - Young And Thrifty http://t.co/4hqstbMe #news #latestnews
170,235495842717507584,Tue Aug 14 21:59:18 +0000 2012,0,0,Review: Outright Online Accounting Software http://t.co/IWWivaXD #news #latestnews
171,235488071729164289,Tue Aug 14 21:28:26 +0000 2012,0,0,Tackling Debt: Start with the Credit Cards - Credit Card Smarts http://t.co/H3O8WhpQ #news #latestnews
