,id_str,created_at,retweet_count,favorite_count,text
172,235441066155847682,Tue Aug 14 18:21:39 +0000 2012,0,0,How to Minimize Investment Risk http://t.co/oDpMXCSv #news #latestnews
173,235441065077919744,Tue Aug 14 18:21:38 +0000 2012,0,0,Why You Shouldn’t Buy a House on a “Shoe String” http://t.co/zvRpQbAf #news #latestnews
174,235433210081841152,Tue Aug 14 17:50:26 +0000 2012,0,0,ETF Investing Advantages http://t.co/6wnmvq9J #news #latestnews
175,235433209222029312,Tue Aug 14 17:50:25 +0000 2012,0,0,How Customer Complaints Can Increase Sales And Why The Customer IS Always Right http://t.co/l3uNoUHf #news #latestnews
176,235140193630425088,Mon Aug 13 22:26:05 +0000 2012,0,0,Student Loans – Jackpot! (Kind Of) Part 1 of 3 - My University Money http://t.co/nYAAPAdV #news #latestnews
177,235140192787386368,Mon Aug 13 22:26:05 +0000 2012,0,0,Mutual Fund Managers = Minor Leagues - Young And Thrifty http://t.co/OmMgp7kD #news #latestnews
178,235077131640647681,Mon Aug 13 18:15:30 +0000 2012,0,0,How to Negotiate to Lower Your Credit Card Interest Rates http://t.co/C0d7SXel #news #latestnews
179,235077130764034048,Mon Aug 13 18:15:30 +0000 2012,0,0,"What Does It Cost To Sell A House?  How Much Can You Expect To Pay In Fees, Commissions And Taxes? http://t.co/sIsFxAY8 #news #latestnews"
180,235077129769984001,Mon Aug 13 18:15:29 +0000 2012,0,0,Singapore on a Shoestring - Young And Thrifty http://t.co/kPC3dmRI #news #latestnews
181,235053800572993536,Mon Aug 13 16:42:47 +0000 2012,0,0,Investment Management Strategies: Income Asset Allocation Plan http://t.co/6jvOkEJ9 #news #latestnews
182,234998743001358336,Mon Aug 13 13:04:01 +0000 2012,0,0,VIDEO: Tony Hadley sings Gold to Team GB http://t.co/NiaKlZNl #news #latestnews
183,234998742095376384,Mon Aug 13 13:04:00 +0000 2012,0,0,London 2012 Olympics: Charles van Commenee to consider position as UK Athletics chief 'rationa... http://t.co/GUSQgYMX #news #latestnews
184,234935968120049664,Mon Aug 13 08:54:34 +0000 2012,0,0,Daley dedicates bronze to father http://t.co/lGBzD9hH #news #latestnews
185,234184726963945473,Sat Aug 11 07:09:24 +0000 2012,0,0,How Social Entrepreneurs That Need Money Can Get Noticed http://t.co/V2a1Dw99 #news #latestnews
186,234012879161024512,Fri Aug 10 19:46:32 +0000 2012,0,0,The Best Credit Cards for College Students http://t.co/CpO44tVR #news #latestnews
187,234012878313750528,Fri Aug 10 19:46:32 +0000 2012,0,0,Credit Sesame Mobile Android App Review: Check Your Credit Score For Free On The Go! http://t.co/RIfWoWv8 #news #latestnews
188,233950162320506881,Fri Aug 10 15:37:19 +0000 2012,0,0,Why Do Employers Check Credit History? http://t.co/CN2CSyBm #news #latestnews
189,233934437778345984,Fri Aug 10 14:34:50 +0000 2012,0,0,Celebrating Two Years Of Boomer &amp; Echo http://t.co/ze2WnbIn #news #latestnews
190,233926626436591616,Fri Aug 10 14:03:48 +0000 2012,0,0,Techniques For Filtering Out Your Best Business Ideas http://t.co/Fj0tTb81 #news #latestnews
191,233736244553736193,Fri Aug 10 01:27:17 +0000 2012,0,0,Getting Health Insurance as a Small Business Owner http://t.co/bI5RVYEH #news #latestnews
192,233673491025629185,Thu Aug 09 21:17:56 +0000 2012,0,0,Focus on the Latte Factor? Or Sweat the Big Stuff? http://t.co/ef1DALsL #news #latestnews
193,233673490060963840,Thu Aug 09 21:17:56 +0000 2012,0,0,Attributes Of An Olympic Athlete That Can Help You In Your Financial Life http://t.co/RFucvSh1 #news #latestnews
194,233673489255657473,Thu Aug 09 21:17:55 +0000 2012,0,0,How Does Your Credit Report Affect Your Credit Score? http://t.co/vmnGev4h #news #latestnews
195,233507787584442368,Thu Aug 09 10:19:29 +0000 2012,0,0,Rev. Jesse Jackson says son is 'responding' to treatment http://t.co/IXTrWToe #news #latestnews
196,233507786800103424,Thu Aug 09 10:19:29 +0000 2012,0,0,Aly Raisman wins gold in Olympic floor after bronze in beam http://t.co/rX6J7KxY #news #latestnews
197,233507786091286528,Thu Aug 09 10:19:29 +0000 2012,0,0,"Crash hurts 2, shuts N. Ocean Ave. in Coram http://t.co/6q2iapav #news #latestnews"
198,233441689279287296,Thu Aug 09 05:56:50 +0000 2012,0,0,USAA Free Checking Review http://t.co/IT6l47S0 #news #latestnews
199,233328238607339520,Wed Aug 08 22:26:01 +0000 2012,0,0,Motif Investing Review: Theme Based Investing http://t.co/GfLwX3sl #news #latestnews
