,id_str,created_at,retweet_count,favorite_count,text
0,3761533692,Fri Sep 04 17:47:15 +0000 2009,1,3,Change your life...http://bit.ly/N4Zhr
1,3709889152,Wed Sep 02 12:01:18 +0000 2009,0,1,Always bear in mind that your own resolution to succeed is more important than any one thing
2,3693250623,Tue Sep 01 18:01:59 +0000 2009,0,0,Take a look at this Tony Robbins interview with Frank Kern and John Reese...http://bit.ly/rMQKl
3,3499313412,Sun Aug 23 21:46:24 +0000 2009,0,0,"I am careful not to confuse excellence with perfection. Excellence, I can reach for; perfection is God's business."
4,3491734203,Sun Aug 23 13:46:15 +0000 2009,0,0,Don't be too timid and squeamish about your actions. All life is an experiment. The more experiments you make the better.
5,3477642885,Sat Aug 22 19:45:52 +0000 2009,0,0,"All human actions have one or more of these seven causes: chance, nature, compulsion, habit, reason, passion, and desire."
6,3470565839,Sat Aug 22 11:46:04 +0000 2009,0,0,Real success is finding your lifework in the work that you love.
7,3454446387,Fri Aug 21 17:47:35 +0000 2009,0,0,Success usually comes to those who are too busy to be looking for it.
8,3449826477,Fri Aug 21 13:46:24 +0000 2009,0,0,The secret of joy in work is contained in one word - excellence. To know how to do something well is to enjoy it.
9,3437277808,Thu Aug 20 22:47:27 +0000 2009,0,0,"The superior man is modest in his speech, but exceeds in his actions."
10,3432815436,Thu Aug 20 18:46:16 +0000 2009,0,0,The ancient Greek definition of happiness was the full use of your powers along lines of excellence.
11,3428597092,Thu Aug 20 14:46:47 +0000 2009,0,0,It is possible to fail in many ways...while to succeed is possible only in one way.
12,3387975578,Tue Aug 18 18:46:23 +0000 2009,0,0,Is having the freedom to work from home and spending time with you family worth risking everything? http://bit.ly/14BOtC
13,3383521104,Tue Aug 18 14:46:14 +0000 2009,0,0,Take a look at what a little bit of effort can get you.http://bit.ly/dRXxi
14,3285484491,Thu Aug 13 12:55:26 +0000 2009,0,0,Do not turn back when you are just at the goal.http://bit.ly/dRXxi
15,3075719088,Sat Aug 01 21:01:05 +0000 2009,0,0,Heres information that could change the way you think..http://bit.ly/2qq6ac
16,3072429174,Sat Aug 01 17:02:03 +0000 2009,0,0,Forget about the recession...there is none one the World Wide Web....take a look!http://bit.ly/2qq6ac
17,3069537501,Sat Aug 01 13:01:12 +0000 2009,0,0,turn your yearly income into your monthly income...wanna learn how?http://bit.ly/dRXxi
18,3054819572,Fri Jul 31 17:35:52 +0000 2009,0,0,are you tired of regular MLM? Are you tired of recruiting friends and family? Learn how an ex Marine changed his life! http://bit.ly/dRXxi
19,2953136689,Fri Jul 31 15:46:35 +0000 2009,0,0,are you a regular person? regular people everyday are creating their own success from home. are you next??http://bit.ly/dRXxi
20,2951611926,Fri Jul 31 14:16:30 +0000 2009,0,0,Success from home....learn how.......http://bit.ly/dRXxi
21,2950163688,Fri Jul 31 12:31:08 +0000 2009,0,0,Earn a substantial income from home. Learn how many of leaders in network marketing are making their fortunes.http://bit.ly/dRXxi
22,2942084653,Fri Jul 31 01:16:05 +0000 2009,0,0,"Expand you income, learn how to make money like a pro athlete.http://bit.ly/dRXxi"
23,2936483043,Thu Jul 30 19:46:15 +0000 2009,0,0,Look to see if your favorite baseball player tested positive for steroids in 03. http://bit.ly/T9og9
24,2911258386,Wed Jul 29 15:31:38 +0000 2009,0,0,Are you open to new opportunities? Do believe in yourself? Make the decision to change your life forever!http://bit.ly/dRXxi
25,2896027377,Tue Jul 28 20:01:39 +0000 2009,0,0,create your own luck.....http://bit.ly/dRXxi
26,2892065530,Tue Jul 28 16:02:22 +0000 2009,0,0,Plug into a system that has shown proven results. Former marine earns 80K a month with this system.http://bit.ly/dRXxi
27,2888695965,Tue Jul 28 12:00:57 +0000 2009,0,0,-100 Millionaires? Internet Genius Vowed to Create 100 Millionaires by 2012!!! Are You The Next One?http://bit.ly/UgSwz
28,2879288312,Mon Jul 27 23:01:39 +0000 2009,0,0,Wanna learn and understand what the formula for success? http://bit.ly/dRXxi
29,2873901237,Mon Jul 27 17:31:47 +0000 2009,0,0,If I told you that success was right around the corner would you look? Here it is take a peek..http://bit.ly/dRXxi
30,2870190591,Mon Jul 27 13:31:24 +0000 2009,0,0,Those who blame others successes on luck are to lazy to create there own.You have to make an effort to see your success.http://bit.ly/dRXxi
31,2859135704,Sun Jul 26 21:46:04 +0000 2009,0,0,Of course there is no formula for success except perhaps an unconditional acceptance of life and what it brings.http://bit.ly/dRXxi
32,2855868588,Sun Jul 26 17:46:09 +0000 2009,0,0,Are you open to new opportunities? Do believe in yourself? Make the decision to change your life forever!http://bit.ly/dRXxi
33,2853090958,Sun Jul 26 13:46:15 +0000 2009,0,0,Not even D. Trump can save the MLM Industry...How can we remain ignorant to the facts..Will Don ensure your Biz Grows!http://bit.ly/LQt6A
34,2842372489,Sat Jul 25 20:30:31 +0000 2009,0,0,Understand that today could be the greatest day in your life. Make the decision to change. Create wealth from home. http://bit.ly/dRXxi
35,2839205445,Sat Jul 25 16:31:12 +0000 2009,0,0,Tired of failing in MLM....read shocking report that will save you from making the same mistakes over and over again!!!http://bit.ly/LQt6A
36,2836590390,Sat Jul 25 12:31:26 +0000 2009,0,0,Success from home is just around the corner. Wanna take a look...http://bit.ly/dRXxi
37,2797069216,Thu Jul 23 12:15:13 +0000 2009,0,0,Not even D. Trump can save the MLM Industry...How can we remain ignorant to the facts..Will Don ensure your Biz Grows!http://bit.ly/LQt6A
38,2784944227,Wed Jul 22 20:46:46 +0000 2009,0,0,Are you open to new opportunities? Do believe in yourself? Make the decision to change your life forever!http://bit.ly/dRXxi
39,2777498684,Wed Jul 22 13:16:16 +0000 2009,0,0,Plug into a system that has shown proven results. Former marine earns 80K a month with this system.http://bit.ly/dRXxi
40,2766119876,Tue Jul 21 22:15:10 +0000 2009,0,0,-100 Millionaires? Internet Genius Vowed to Create 100 Millionaires by 2012!!! Are You The Next One?http://bit.ly/UgSwz
41,2757737375,Tue Jul 21 13:31:43 +0000 2009,0,0,"I average 80k a month. You need a system that WORKS!!! 80% Profit margin, Completely Automated.http://bit.ly/dRXxi"
42,2756380258,Tue Jul 21 11:31:27 +0000 2009,0,0,Learn how a good marine friend of mine went from near bankrupcy to averaging 80K a month!http://bit.ly/dRXxi
43,2745452074,Mon Jul 20 21:02:49 +0000 2009,0,0,The secret of joy in work is contained in one word - excellence. To know how to do something well is to enjoy it.http://bit.ly/dRXxi
44,2740225218,Mon Jul 20 15:31:48 +0000 2009,0,0,Don't be too timid and squeamish about your actions. All life is an experiment.The more experiments you make the better.http://bit.ly/dRXxi
45,2737231914,Mon Jul 20 11:31:07 +0000 2009,0,0,Of course there is no formula for success except perhaps an unconditional acceptance of life and what it brings.http://bit.ly/dRXxi
46,2726528593,Sun Jul 19 20:02:33 +0000 2009,0,0,Learn How to make money online from the comfort of your home. Former Marine averages 80k a month!!1http://bit.ly/dRXxi
47,2723433821,Sun Jul 19 16:01:36 +0000 2009,0,0,"The superior man is modest in his speech, but exceeds in his actions.http://bit.ly/dRXxi"
48,2721150444,Sun Jul 19 12:00:59 +0000 2009,0,0,"The person who makes a success of living, sees his goals steadily & aims for it unswervingly.Thats dedication.http://bit.ly/dRXxi"
49,2711523112,Sat Jul 18 21:00:36 +0000 2009,0,0,"In the absence of clearly-defined goals, we become strangely loyal to performing daily trivia until ultimately we become enslaved by it."
50,2709476490,Sat Jul 18 18:16:11 +0000 2009,0,0,Let me tell you the secret that has led me to my goal. My strength lies solely in my tenacity.http://bit.ly/dRXxi
51,2708117208,Sat Jul 18 16:31:42 +0000 2009,0,0,The ancient Greek definition of happiness was the full use of your powers along lines of excellence.
52,2706810473,Sat Jul 18 14:45:24 +0000 2009,0,0,The secret of joy in work is contained in one word - excellence. To know how to do something well is to enjoy it.http://bit.ly/dRXxi
53,2705659736,Sat Jul 18 12:45:24 +0000 2009,0,0,There is only one success - to be able to spend your life in your own way.http://bit.ly/dRXxi
54,2696668598,Fri Jul 17 22:31:17 +0000 2009,0,0,Do not turn back when you are just at the goal.http://bit.ly/dRXxi
55,2694605571,Fri Jul 17 20:16:21 +0000 2009,0,0,Always bear in mind that your own resolution to succeed is more important than any one thing.http://bit.ly/dRXxi
56,2692454804,Fri Jul 17 18:02:35 +0000 2009,0,0,Success from home. Learn the secrets to making it big!http://bit.ly/dRXxi
57,2691086390,Fri Jul 17 16:40:12 +0000 2009,0,0,Learn How to make money online from the comfort of your home. Former Marine averages 80k a month!!http://bit.ly/dRXxi
58,2671416750,Thu Jul 16 15:56:31 +0000 2009,0,0,"All human actions have one or more of these seven causes: chance, nature, compulsion, habit, reason, passion, and desire.http://bit.ly/dRXxi"
59,2656852554,Wed Jul 15 20:02:27 +0000 2009,0,0,"I'm saying that we need to be willing to let our intuition guide us, and then be willing to follow that guidance directly and fearlessly."
60,2655176879,Wed Jul 15 18:15:50 +0000 2009,0,0,It's choice - not chance - that determines your destiny.http://bit.ly/dRXxi
61,2652578938,Wed Jul 15 15:31:27 +0000 2009,0,0,"Many receive advice, few profit by it.http://bit.ly/dRXxi"
62,2650647740,Wed Jul 15 13:16:07 +0000 2009,0,0,"Imagination is the beginning of creation. You imagine what you desire, you will what you imagine and at last you create what you will."
63,2650136444,Wed Jul 15 12:31:22 +0000 2009,0,0,The happiness of a man in this life does not consist in the absence but in the mastery of his passions.http://bit.ly/dRXxi
64,2619761836,Mon Jul 13 20:15:52 +0000 2009,0,0,"Genius is one per cent inspiration, ninety-nine per cent perspiration. http://bit.ly/dRXxi"
65,2618219248,Mon Jul 13 18:31:01 +0000 2009,0,0,"I was always looking outside myself for strength and confidence, but it comes from within. It is there all the time. http://bit.ly/dRXxi"
66,2616864618,Mon Jul 13 17:00:33 +0000 2009,0,0,The greatest mistake you can make in life is to be continually fearing you will make one. http://bit.ly/dRXxi
67,2615749623,Mon Jul 13 15:45:45 +0000 2009,0,1,"Imagination is the beginning of creation.U imagine what U desire,U will what U imagine and atlast U create what U will.http://bit.ly/dRXxi"
68,2614294287,Mon Jul 13 14:01:07 +0000 2009,0,0,Act as if it were impossible to fail. http://bit.ly/dRXxi
69,2613446424,Mon Jul 13 12:45:08 +0000 2009,0,0,Eighty percent of success is showing up. http://bit.ly/dRXxi
70,2600644983,Sun Jul 12 17:09:36 +0000 2009,0,0,Watch and learn from those who are much wiser than you.
71,2588068714,Sat Jul 11 20:01:24 +0000 2009,0,0,It is possible to fail in many ways...while to succeed is possible only in one way.http://bit.ly/dRXxi
72,2586441542,Sat Jul 11 17:47:07 +0000 2009,0,0,Don't be too timid and squeamish about your actions.All life is an experiment.The more experiments you make the better.http://bit.ly/dRXxi
73,2584971624,Sat Jul 11 15:45:47 +0000 2009,0,0,Do not turn back when you are just at the goal.http://bit.ly/dRXxi
74,2583860111,Sat Jul 11 14:01:02 +0000 2009,0,0,Always bear in mind that your own resolution to succeed is more important than any one thing.http://bit.ly/dRXxi
75,2583220080,Sat Jul 11 12:46:12 +0000 2009,0,0,"All human actions have one or more of these seven causes: chance, nature, compulsion, habit, reason, passion, and desire.http://bit.ly/dRXxi"
76,2572886362,Fri Jul 10 20:02:07 +0000 2009,0,0,"In the absence of clearly-defined goals,we become strangely loyal to performing daily trivia until ultimately we become enslaved by it."
77,2571612123,Fri Jul 10 18:18:57 +0000 2009,0,0,Of course there is no formula for success except perhaps an unconditional acceptance of life and what it brings.http://bit.ly/dRXxi
78,2570674671,Fri Jul 10 17:02:31 +0000 2009,0,0,"The superior man is modest in his speech, but exceeds in his actions.http://bit.ly/dRXxi"
79,2569714325,Fri Jul 10 15:45:59 +0000 2009,0,0,The person who makes a success of living is one who see his goal steadily and aims for it unswervingly.Thats dedication.http://bit.ly/dRXxi
80,2568317788,Fri Jul 10 14:02:22 +0000 2009,0,0,"I am careful not to confuse excellence with perfection. Excellence, I can reach for; perfection is God's business."
81,2567420577,Fri Jul 10 12:46:19 +0000 2009,0,0,"All human actions have one or more of these seven causes: chance, nature, compulsion, habit, reason, passion, and desire.http://bit.ly/dRXxi"
82,2558260029,Thu Jul 09 22:51:39 +0000 2009,0,0,"The superior man is modest in his speech, but exceeds in his actions.http://bit.ly/dRXxi"
83,2557381740,Thu Jul 09 21:50:42 +0000 2009,0,0,It's not enough that we do our best; sometimes we have to do what's required.http://bit.ly/dRXxi
84,2551280960,Thu Jul 09 15:02:28 +0000 2009,0,0,It is possible to fail in many ways...while to succeed is possible only in one way.http://bit.ly/dRXxi
85,2549716857,Thu Jul 09 13:01:50 +0000 2009,0,0,"In the absence of clearly-defined goals, we become strangely loyal to performing daily trivia until ultimately we become enslaved by it."
86,2542169426,Thu Jul 09 00:59:08 +0000 2009,0,0,Always bear in mind that your own resolution to succeed is more important than any one thing.http://bit.ly/dRXxi
87,2540599623,Wed Jul 08 23:03:06 +0000 2009,0,0,"I am careful not to confuse excellence with perfection. Excellence, I can reach for; perfection is God's business.http://bit.ly/dRXxi"
88,2539053820,Wed Jul 08 21:16:59 +0000 2009,0,0,It is possible to fail in many ways...while to succeed is possible only in one way.http://bit.ly/dRXxi
89,2537397678,Wed Jul 08 19:26:06 +0000 2009,0,0,The ancient Greek definition of happiness was the full use of your powers along lines of excellence.
90,2536826205,Wed Jul 08 18:48:25 +0000 2009,0,0,Let me tell you the secret that has led me to my goal. My strength lies solely in my tenacity.http://bit.ly/dRXxi
91,2535850187,Wed Jul 08 17:44:17 +0000 2009,0,0,Do not turn back when you are just at the goal.http://bit.ly/dRXxi
92,2520506294,Tue Jul 07 20:20:22 +0000 2009,0,0,"Management is nothing more than motivating other people.
http://bit.ly/dRXxi"
93,2519516995,Tue Jul 07 19:24:27 +0000 2009,0,0,Leadership and learning are indispensable to each other. -JFK
94,2517424003,Tue Jul 07 17:33:18 +0000 2009,0,0,"Books are the quietest and most constant of friends;they are the most accessible & wisest of counsellors, and the most patient of teachers."
95,2514904152,Tue Jul 07 14:50:54 +0000 2009,0,0,"I can't understand why people are frightened of new ideas. I'm frightened of the old ones.
http://bit.ly/dRXxi"
96,2513689762,Tue Jul 07 13:18:35 +0000 2009,0,0,"Our character...is an omen of our destiny, and the more integrity we have and keep, the simpler and nobler that destiny is likely to be."
97,2512965742,Tue Jul 07 12:08:40 +0000 2009,0,0,We can be sure that the greatest hope for maintaining equilibrium in the face of any situation rests within ourselves.
98,2506088814,Tue Jul 07 00:54:39 +0000 2009,0,0,"Eighty percent of success is showing up.
http://bit.ly/dRXxi"
99,2505188125,Mon Jul 06 23:47:36 +0000 2009,0,0,"Human beings, by changing the inner attitudes of their minds, can change the outer aspects of their lives."
100,2500614656,Mon Jul 06 18:12:26 +0000 2009,0,0,"Act as if it were impossible to fail.

http://bit.ly/dRXxi"
101,2498475098,Mon Jul 06 15:42:19 +0000 2009,0,0,"I am careful not to confuse excellence with perfection. Excellence, I can reach for; perfection is God's business."
102,2498056545,Mon Jul 06 15:11:44 +0000 2009,0,0,"In every power, of which taste is the foundation, excellence is pretty fairly divided between the sexes."
103,2497096970,Mon Jul 06 13:57:29 +0000 2009,0,0,"The superior person is modest in their speech, but exceeds in their actions."
104,2488760068,Sun Jul 05 23:29:27 +0000 2009,0,0,"Our lives improve when we take chances,the first and most difficult risk we can take is to be honest with ourselves.
http://bit.ly/dRXxi"
105,2485805808,Sun Jul 05 19:17:43 +0000 2009,0,0,Take calculated risks. That is quite different from being rash.
106,2477517592,Sun Jul 05 02:52:40 +0000 2009,0,0,"Just looked at my back office, we are on the Carbon Copy Pro leader boards. Happy Fourth of July."
107,2443192907,Thu Jul 02 21:01:20 +0000 2009,0,0,The ancient Greek definition of happiness was the full use of your powers along lines of excellence.
108,2441749236,Thu Jul 02 19:19:31 +0000 2009,0,0,"Imagination is the beginning of creation.U imagine what U desire,U will what U imagine and atlast U create what U will.http://bit.ly/dRXxi"
109,2440093881,Thu Jul 02 17:25:11 +0000 2009,0,0,You don't need fancy highbrow traditions or money to really learn. You just need people with the desire to better themselves.
110,2437599655,Thu Jul 02 14:33:37 +0000 2009,0,0,"If your success is not on your own terms, if it looks good to the world but does not feel good in your heart, it is not success at all."
111,2436321803,Thu Jul 02 12:49:17 +0000 2009,0,0,"The greatest mistake you can make in life is to be continually fearing you will make one.

http://bit.ly/dRXxi"
112,2435578399,Thu Jul 02 11:26:17 +0000 2009,0,0,"The more I want to get something done, the less I call it work."
113,2428739852,Thu Jul 02 00:14:37 +0000 2009,0,0,The one who makes a success of living is the one who see his goal steadily & aims for it unswervingly.Thats dedication.http://bit.ly/dRXxi
114,2426690441,Wed Jul 01 21:42:36 +0000 2009,0,0,We all have a few failures under our belt. It's what makes us ready for the successes.
115,2425391413,Wed Jul 01 20:09:53 +0000 2009,0,0,"I was always looking outside myself for strength and confidence, but it comes from within. It is there all the time.
http://bit.ly/dRXxi"
116,2423634359,Wed Jul 01 18:03:29 +0000 2009,0,0,"Genius is one per cent inspiration, ninety-nine per cent perspiration.

http://bit.ly/dRXxi"
117,2422362083,Wed Jul 01 16:33:44 +0000 2009,0,0,"To avoid criticism do nothing, say nothing, be nothing."
118,2419270147,Wed Jul 01 12:30:29 +0000 2009,0,0,"I owe my success to having listened respectfully to the very best advice, then going away and doing the exact opposite.http://bit.ly/dRXxi"
119,2418723227,Wed Jul 01 11:25:45 +0000 2009,0,0,It is no good to try to stop knowledge from going forward. Ignorance is never better than knowledge.
120,2413699900,Wed Jul 01 02:10:32 +0000 2009,0,0,"The policy of being too cautious is the greatest risk of all.

http://bit.ly/dRXxi"
121,2412900426,Wed Jul 01 01:10:33 +0000 2009,0,0,"Seek freedom and become captive of your desires, seek discipline and find your liberty."
122,2411970259,Tue Jun 30 23:58:34 +0000 2009,0,0,"Whenever you are asked if you can do a job, tell 'em, 'Certainly I can!' Then get busy and find out how to do it.

http://bit.ly/dRXxi"
123,2411150804,Tue Jun 30 22:55:14 +0000 2009,0,0,"I was always looking outside myself for strength and confidence, but it comes from within. It is there all the time.

http://bit.ly/dRXxi"
124,2410344948,Tue Jun 30 21:54:28 +0000 2009,0,0,"Our character...is an omen of our destiny, and the more integrity we have and keep, the simpler and nobler that destiny is likely to be."
125,2408309369,Tue Jun 30 19:28:31 +0000 2009,0,0,"I am careful not to confuse excellence with perfection. Excellence, I can reach for; perfection is God's business."
126,2407259512,Tue Jun 30 18:13:53 +0000 2009,0,0,"The secret of joy in work is contained in one word - excellence. To know how to do something well is to enjoy it.

http://bit.ly/dRXxi"
127,2405435511,Tue Jun 30 16:04:39 +0000 2009,0,0,"One must not lose desires. They are mighty stimulants to creativeness, to love, and to long life."
128,2403507822,Tue Jun 30 13:39:11 +0000 2009,0,0,"Honesty pays, but it doesn't seem to pay enough to suit some people."
129,2401772500,Tue Jun 30 10:18:43 +0000 2009,0,0,Character is like a tree and reputation like its shadow. The shadow is what we think of it; the tree is the real thing.http://bit.ly/dRXxi
130,2397877746,Tue Jun 30 02:54:31 +0000 2009,0,0,Genuine leadership is scarce these days because of Mike Dillard.......http://bit.ly/4yVY6
131,2397674899,Tue Jun 30 02:38:57 +0000 2009,0,0,Excellence is not a destination; it is a continuous journey that never ends.
132,2395316088,Mon Jun 29 23:32:09 +0000 2009,0,0,Natural ability without education has more often attained to glory and virtue than education without natural ability.
133,2393509470,Mon Jun 29 21:13:48 +0000 2009,0,0,"Always bear in mind that your own resolution to succeed is more important than any one thing.

http://bit.ly/dRXxi"
134,2390451973,Mon Jun 29 17:33:24 +0000 2009,0,0,"The greatest discovery of my generation is that a human being can alter his life by altering his attitudes of mind.

http://bit.ly/dRXxi"
135,2388693073,Mon Jun 29 15:24:13 +0000 2009,0,0,"Dreams come true. Without that possibility, nature would not incite us to have them."
136,2386341701,Mon Jun 29 11:40:34 +0000 2009,0,0,"You see things; and you say, 'Why?' But I dream things that never were; and I say, ""Why not?"""
137,2363482718,Sat Jun 27 21:03:32 +0000 2009,0,0,Resolve to pay any price or make any sacrifice to get into the top ten percent of your field. That payoff is incredible!http://bit.ly/dRXxi
138,2359005204,Sat Jun 27 14:12:40 +0000 2009,0,0,"A mediocre idea that generates enthusiasm will go further then a great idea that inspires no one.

http://bit.ly/dRXxi"
139,2349936151,Fri Jun 26 21:08:26 +0000 2009,0,0,Looking forward to a weekend with no rain...is that possible?
140,2348984782,Fri Jun 26 19:57:18 +0000 2009,0,0,Thousands of geniuses live and die undiscovered -- either by themselves or by others.
141,2345149697,Fri Jun 26 15:23:45 +0000 2009,0,0,"Limitations live only in our minds. But if we use our imaginations, our possibilities become limitless.

http://bit.ly/dRXxi"
142,2343771395,Fri Jun 26 13:37:24 +0000 2009,0,0,"“There are two ways to live: you can live as if nothing is a miracle; you can live as if everything is a miracle.
- Albert Einstein"
143,2343218719,Fri Jun 26 12:46:33 +0000 2009,0,0,"The greatest education in the world is watching the masters at work.
- Michael Jackson"
144,2336736735,Fri Jun 26 01:18:54 +0000 2009,0,0,carpe diem
145,2334912173,Thu Jun 25 23:29:33 +0000 2009,0,0,People who enjoy what they are doing invariably do it well.
146,2331426172,Thu Jun 25 20:11:40 +0000 2009,0,0,"Think for yourselves and let others enjoy the privilege to do so, too."
147,2331012679,Thu Jun 25 19:41:17 +0000 2009,0,0,"Had a personal revelation last night during a conference call, http://bit.ly/pyG42"
148,2327303701,Thu Jun 25 15:10:37 +0000 2009,0,0,"Wake up and smell the opportunity...
http://bit.ly/dRXxi"
149,2326060552,Thu Jun 25 13:29:39 +0000 2009,0,0,"There is one place that you have not looked, and it is there, only there where you will find the master.
-The Last Dragon"
150,2324840867,Thu Jun 25 11:10:19 +0000 2009,0,0,"Make today a day when you make something happen for yourself.  Look in the mirror and do it.

http://bit.ly/dRXxi"
151,2318515173,Thu Jun 25 00:05:27 +0000 2009,0,0,"Put your future in good hands - your own.

http://bit.ly/dRXxi"
152,2315931545,Wed Jun 24 20:39:01 +0000 2009,0,0,"Set your goals high, and don't stop till you get there.

http://bit.ly/dRXxi"
153,2314698403,Wed Jun 24 19:09:54 +0000 2009,0,0,"If you can find a path with no obstacles, it probably doesn't lead anywhere."
154,2313926131,Wed Jun 24 18:13:31 +0000 2009,0,0,"I can't change the direction of the wind, but I can adjust my sails to always reach my destination.

http://bit.ly/h9jOj"
155,2312899800,Wed Jun 24 16:57:00 +0000 2009,0,0,"The miracle is not that we do this work, but that we are happy to do it.

http://bit.ly/h9jOj"
156,2311886358,Wed Jun 24 15:42:22 +0000 2009,0,0,Some people grin and bear it; others smile and do it.
157,2303704944,Wed Jun 24 01:32:24 +0000 2009,0,0,"Wanna see how a automated system can lead to $80K a month...take a look, what do you have to lose???

http://bit.ly/h9jOj"
158,2300607925,Tue Jun 23 21:21:46 +0000 2009,0,0,"As you climb the ladder of success, check occasionally to make sure it is leaning against the right wall.

http://bit.ly/h9jOj"
159,2295944159,Tue Jun 23 15:34:20 +0000 2009,0,0,Seventy percent of success in life is showing up.
160,2294903264,Tue Jun 23 14:12:57 +0000 2009,0,0,"The difference between a successful person and others is not a lack of strength, not a lack of knowledge, but rather in a lack of will"
161,2287754765,Tue Jun 23 01:14:52 +0000 2009,0,0,"Gear yourself up to make $80k a month.... See how

http://bit.ly/h9jOj"
162,2285584879,Mon Jun 22 22:19:00 +0000 2009,0,0,"Always hold your head up, but be careful to keep your nose at a friendly level.
http://bit.ly/h9jOj"
163,2283834567,Mon Jun 22 20:07:35 +0000 2009,0,0,God wisely designed the human body so that we can neither pat our own backs nor kick ourselves too easily.
164,2281792703,Mon Jun 22 17:32:59 +0000 2009,0,0,"Are Your Friends and Family Members Creating a Vehicle for You to Earn $143,220.00? Probably Not... http://bit.ly/h9jOj"
165,2280007342,Mon Jun 22 15:17:11 +0000 2009,0,0,Nothing splendid has ever been achieved except by those who dared believe that something inside of them was superior to circumstance.
166,2278938955,Mon Jun 22 13:48:17 +0000 2009,0,0,"Put your future in good hands - your own. 

http://bit.ly/h9jOj"
