,id_str,created_at,retweet_count,favorite_count,text
0,572531704503541761,Mon Mar 02 22:59:30 +0000 2015,0,0,I posted a new video to Facebook http://t.co/K2gpKRSCVw
1,483037088087285760,Sat Jun 28 23:59:50 +0000 2014,0,0,"Who is your pick for the Women's Singles Champ at Wimbledon this year?  And, the Men's Champ?"
2,475055222042419200,Fri Jun 06 23:22:45 +0000 2014,0,0,Sharapova or Halep?
3,471778478816493568,Wed May 28 22:22:09 +0000 2014,0,0,Who is your pick for the Men's French Open champ this year?
4,418979016918323201,Fri Jan 03 05:35:56 +0000 2014,0,0,The Aussie Open is right around the corner.  Who are your picks this year?
5,374930203241226240,Tue Sep 03 16:21:40 +0000 2013,0,0,Who do you think will win the US Open?
6,358243961892110336,Fri Jul 19 15:16:31 +0000 2013,0,2,Very Cute http://t.co/2CV3wrZFFz
7,349985462460481537,Wed Jun 26 20:20:11 +0000 2013,0,0,It has been great watching pro players actually trying to win points at the net this week!
8,348206244126916609,Fri Jun 21 22:30:12 +0000 2013,0,0,"Federer and Nadal could meet in the QF's of Wimbledon.  ""Like"" this post for a Nadal victory or Comment if you... http://t.co/eIRGx0d6GR"
9,347007570151628800,Tue Jun 18 15:07:06 +0000 2013,0,0,Has the summer heat affected your racket tension?  Come by the shop and let us take a look.  http://t.co/f9R3kKOWTa http://t.co/XxagX4YqNj
10,344564175621742592,Tue Jun 11 21:17:55 +0000 2013,0,0,Wimbledon is only a couple of weeks away.  Who do you think will win the championship this year?
11,331776358093029378,Tue May 07 14:23:42 +0000 2013,0,0,Spring is Finally Here Sale!  2012 items must go!  Huge discounts.  Visit the website or call the store at... http://t.co/QM3iEzW1l6
12,330066282156265472,Thu May 02 21:08:28 +0000 2013,0,1,"Did your team make the ALTA playoffs?  Click ""Like"" if you missed the playoffs and Comment if you did.  Good luck... http://t.co/qMjMpZtg0y"
13,327809647987806209,Fri Apr 26 15:41:25 +0000 2013,0,0,"Vantage Bastcore Racket sale today and tomorrow ONLY.  Usually 200.00, 210.00, and 220.00, all three Bast Core... http://t.co/SMCYJ0TYIt"
14,323195387823394817,Sat Apr 13 22:05:59 +0000 2013,0,0,The Bastcore Frames arrived - they speak for themselves... http://t.co/NQNLcHq3Al
15,322004490888818688,Wed Apr 10 15:13:47 +0000 2013,1,0,"Getting New Sticks, Bags &amp; Shoes FRIDAY..."
16,320169455487438848,Fri Apr 05 13:42:01 +0000 2013,0,0,Beth's Nephew-----Come on Bryce! http://t.co/djgWqhTV7p
17,319861266652995584,Thu Apr 04 17:17:23 +0000 2013,0,0,"Read another experts opinion on Ashaway Monogut ZX - As Many of you know, this is what i now play with....... http://t.co/Y4cSpCKbrc"
18,319807790409453568,Thu Apr 04 13:44:53 +0000 2013,0,0,"Today, cold n rainy = get your racquets ready for Spring..the weekend is supposed to be beautiful!"
19,318917088578252800,Tue Apr 02 02:45:33 +0000 2013,0,0,Did you hit today or just wish you had?
20,318916955149070337,Tue Apr 02 02:45:01 +0000 2013,0,0,Did you hit today or just wish you were?
21,318342692188856320,Sun Mar 31 12:43:06 +0000 2013,0,0,Happy Easter - from the Hardcore Tennis Family http://t.co/onCxOuzU8o
22,317633242582888449,Fri Mar 29 13:44:01 +0000 2013,0,0,Great day or hit - or hang at a tennis store...
23,314696900081225728,Thu Mar 21 11:16:02 +0000 2013,0,0,Eric is still celebrating his birthday ~ so are we... http://t.co/YZcBvpfPNc
24,314174038631137282,Wed Mar 20 00:38:22 +0000 2013,0,0,"Commonly know as the Prince Original Graphite Oversize, this classic stick has gone by a few names. This Prince... http://t.co/dvqCyirGNK"
25,313039306996473856,Sat Mar 16 21:29:21 +0000 2013,0,0,Rafa! Now let's see what DEL PO can do
26,312732726706978818,Sat Mar 16 01:11:06 +0000 2013,0,0,DEL PO!
27,312711936498343936,Fri Mar 15 23:48:30 +0000 2013,0,0,too cute http://t.co/OhBtZb9clh
28,310778872482390016,Sun Mar 10 15:47:11 +0000 2013,0,0,"Eric, Kevin Asbell, Robert Holmes, Kano, and 3 more playing in Jekyll - Great weather for Hardcore Tennis family winning in Jekyll!"
29,310593094913507329,Sun Mar 10 03:28:59 +0000 2013,0,0,Rafa lookin good -
30,310232882000035840,Sat Mar 09 03:37:37 +0000 2013,0,0,hmmm http://t.co/TFciQNloM2
31,310085666346266625,Fri Mar 08 17:52:38 +0000 2013,0,0,"Quote from a favorite customer: ""as my game has 'matured' i have transitioned from 'serve and volley' to - ""serve... http://t.co/CMBoC5lhK3"
32,309454767162281985,Thu Mar 07 00:05:40 +0000 2013,0,0,It's Beth - Serena Williams on QVC - has anyone bought her sweaters or leggings?
33,308763596815495168,Tue Mar 05 02:19:12 +0000 2013,0,0,"Sam Harvey was the first to obtain a cool looking pair of Lotto Raptor Ultra IV Speed shoes. 
Check them out on... http://t.co/r9wT22f3pc"
34,307838908857716736,Sat Mar 02 13:04:49 +0000 2013,0,0,Road race in Sandy Springs - drove by tennis courts at 7:18 and people were out hitting - Abernathy Park..insane!... http://t.co/94tMtFhZ43
35,307580337385529344,Fri Mar 01 19:57:21 +0000 2013,1,0,"Eric's Birthday - BIG SALE - like, really big - huge - massive...Sat only http://t.co/QtJEb0tZiX"
36,307477158362746880,Fri Mar 01 13:07:21 +0000 2013,1,0,djokovic and del porto - on tennis channel now! Great way to start the day
37,306395316196880384,Tue Feb 26 13:28:30 +0000 2013,0,0,Eric is 48 today (he sure doesn't act like it) Stop in and surprise him - read today's Blog for a store discount... http://t.co/VNXhW2oe6l
38,305655692843433984,Sun Feb 24 12:29:30 +0000 2013,0,0,"Who is heading to Miami Next Month? Strongly considering...
http://t.co/8iw6jlfB8Q http://t.co/JYFXdAR3Tr"
39,305346831418785792,Sat Feb 23 16:02:12 +0000 2013,0,0,HARDCORE TENNIS Store Blog: QUESTION http://t.co/n6bJlmYLQL
40,305312411857076225,Sat Feb 23 13:45:26 +0000 2013,0,0,rain...
41,303143425971200000,Sun Feb 17 14:06:39 +0000 2013,0,0,Stay warm today during your mixed matches...
42,300771114580340736,Mon Feb 11 00:59:56 +0000 2013,0,0,Midtown indoor courts!!! We are working on getting our customers  - you - discounts on memberships. Stay tuned
43,299967500697882624,Fri Feb 08 19:46:39 +0000 2013,0,0,Winter Apparel at huge discounts - We are shipping what isn't sold to Macon...Stay warm before and after your... http://t.co/izJ6Ygom
44,299607629418872833,Thu Feb 07 19:56:39 +0000 2013,0,0,Perhaps you prefer these warm-ups (these are American) http://t.co/VTje5WIT
45,299596700941680641,Thu Feb 07 19:13:14 +0000 2013,0,0,HARDCORE TENNIS Store Blog: Used Wilson Six.One Pro Staff 95 (unstrung) http://t.co/zQfT2Sx7
46,299318128192659456,Thu Feb 07 00:46:17 +0000 2013,0,0,European Sweat Suits - Like? http://t.co/ND4o7N5N
47,298100931608842240,Sun Feb 03 16:09:35 +0000 2013,0,0,Where are you watching the game tonight?
48,297480802080550914,Fri Feb 01 23:05:24 +0000 2013,0,0,Super Bowl Predictions?
49,294849587729022976,Fri Jan 25 16:49:54 +0000 2013,0,0,Fed Vs Tsonga: Gut in Mains For Both Players..Here's Why (GREAT MATCH) http://t.co/g9xbIcOy
50,294848245383974913,Fri Jan 25 16:44:34 +0000 2013,0,0,Fed Vs Tsonga: Gut in Mains For Both Players..Here's Why (GREAT MATCH) http://t.co/rg69pMVI
51,294847776204914689,Fri Jan 25 16:42:42 +0000 2013,0,0,Fed v Tsonga - Gut in Mains Poly in Crosses http://t.co/pHUFxEDa
52,293137384156037120,Sun Jan 20 23:26:13 +0000 2013,0,0,Didn't rise up high enough.
53,293060741819424768,Sun Jan 20 18:21:40 +0000 2013,0,0,Let's Go Birds! I'll be watching both games at the store so come on by!
54,292682810584596480,Sat Jan 19 17:19:54 +0000 2013,0,0,Equipment Tune-Up Weekend &amp; Winter Apparel Sale http://t.co/plSyH3rj
55,292071159346909186,Fri Jan 18 00:49:25 +0000 2013,0,0,Alicia Keys serve is sound!
56,287535254158315520,Sat Jan 05 12:25:21 +0000 2013,0,0,ALTA starting tomorrow - are you ready?
57,285394437050339328,Sun Dec 30 14:38:30 +0000 2012,0,0,"I posted 6 photos on Facebook in the album ""WINTER APPAREL at HCT"" http://t.co/kg33BhqQ"
58,283218672997261316,Mon Dec 24 14:32:48 +0000 2012,0,0,We are open today so stop by ~ http://t.co/XA0gU7Qa
59,282158396529061889,Fri Dec 21 16:19:38 +0000 2012,0,0,Hardcore Tennis Holiday Sale http://t.co/LHR7bVok
60,281944213539667969,Fri Dec 21 02:08:33 +0000 2012,0,0,The store has some womens winter apparel - they all mix and match and that works for me!!! http://t.co/RyBVudO3
61,281853831464247296,Thu Dec 20 20:09:24 +0000 2012,0,0,"I posted 3 photos on Facebook in the album ""WOMEN ONLY - FILA for Christmas!!!"" http://t.co/XfiiPkfO"
62,279313857724440578,Thu Dec 13 19:56:27 +0000 2012,0,0,Nothing to add to this -- http://t.co/u21pT31b
63,279016572285235201,Thu Dec 13 00:15:09 +0000 2012,0,0,Taken at the National Cemetery in Minneapolis on a June morning http://t.co/PLoEDXJy
64,278948377260068865,Wed Dec 12 19:44:10 +0000 2012,0,0,Getting Ready for the Australian Open 2013! Great Photo! http://t.co/cWnJj9Ow
65,277871507429027840,Sun Dec 09 20:25:04 +0000 2012,0,0,that WAS a two-point conversion...
66,276443749968670720,Wed Dec 05 21:51:40 +0000 2012,0,0,"How the HELL is this not a National Holiday???
Well, it is for us...... http://t.co/mW9ILaph"
67,276393254751174657,Wed Dec 05 18:31:01 +0000 2012,0,0,Shoes Racquets and Your Stories... http://t.co/R894admz
68,276019548283617280,Tue Dec 04 17:46:03 +0000 2012,0,0,Ashaway - advertising Hardcore Tennis http://t.co/0pSgiUaa
69,275765271640293376,Tue Dec 04 00:55:38 +0000 2012,0,0,Serena on Home Shopping Network! HSNHD
70,275742099121508352,Mon Dec 03 23:23:34 +0000 2012,0,0,"For a great customer: More Custom Vantage Sticks
Extended Length http://t.co/ywFI95CD"
71,275721165924888576,Mon Dec 03 22:00:23 +0000 2012,0,0,"ANYONE looking for men 3.5 - 4.0 USTA to fill your team, we got one good one for you....Sharlles Menezes. You can... http://t.co/dEtxyVDK"
72,274682721266188289,Sat Dec 01 01:13:58 +0000 2012,0,0,"ROGER:
http://t.co/L1zOkfY6 http://t.co/FewkWdg1"
73,274639802601725953,Fri Nov 30 22:23:26 +0000 2012,0,0,New Shoes arrived today: So quit buying them elsewhere...... http://t.co/Id3SDeGH
74,274312209587384320,Fri Nov 30 00:41:41 +0000 2012,0,0,Back a few years... http://t.co/fgbBe4Z7
75,274214259653738496,Thu Nov 29 18:12:28 +0000 2012,0,0,Lost another GREAT ONE today:... http://t.co/Td1FR0RL
76,273806322808545280,Wed Nov 28 15:11:29 +0000 2012,0,0,congratulations Patti and her 3.5 team at Midtown Athletic Club... http://t.co/MIzTTOU2
77,273172506620342273,Mon Nov 26 21:12:55 +0000 2012,0,0,Just another very serious day at Hardcore Tennis... http://t.co/RzfILVkz
78,273095698331885568,Mon Nov 26 16:07:43 +0000 2012,0,0,Great day to hit...After that morning chill is gone. Now is the time of year to train and work on the things needing work
79,272509566787395584,Sun Nov 25 01:18:38 +0000 2012,0,0,These are hot! http://t.co/xplxuoGs
80,272354191459115008,Sat Nov 24 15:01:13 +0000 2012,0,0,"Bring your racquets in today, get them strung and watch some football...open until 5"
81,272188570100461569,Sat Nov 24 04:03:06 +0000 2012,0,0,Hey we need a new website person. Call me.
82,271278358992674816,Wed Nov 21 15:46:15 +0000 2012,0,0,Inside Tennis Magazine - back page - Ashaway promoting Hardcore Tennis for carrying their string - The Ashaway Monogut ZX is in my racquet!
83,269508937856999424,Fri Nov 16 18:35:12 +0000 2012,0,0,Black Friday Hardcore Tennis Style http://t.co/aiKyjbIC
84,268854882985975808,Wed Nov 14 23:16:13 +0000 2012,0,0,"I posted 2 photos on Facebook in the album ""Lexington S.C. ITF Tournament"" http://t.co/cnoIujQT"
85,268183874033577984,Tue Nov 13 02:49:52 +0000 2012,0,0,Congrats to James Tan  --- CITY CHAMPION (racquet strung with Solinco Tour Bite) http://t.co/vzKW3ghV
86,267359067708735488,Sat Nov 10 20:12:23 +0000 2012,1,0,Good luck to everyone playing Finals today and tomorrow! PERFECT weather! Play Hardcore
87,266930233465257984,Fri Nov 09 15:48:21 +0000 2012,0,0,"9 Year Old Girl Playing Football - wow
http://t.co/a6vzTBtQ http://t.co/g7MJOtbJ"
88,266313800578396160,Wed Nov 07 22:58:52 +0000 2012,0,0,Ladies - you have to watch this Outtake from Bridesmaids...Outtake from the tennis court http://t.co/iRwsn0hF
89,265916114515668992,Tue Nov 06 20:38:36 +0000 2012,0,0,"voting was easy - however, we heard Decatur has some LONG lines..."
90,265442614155825154,Mon Nov 05 13:17:05 +0000 2012,0,0,"Ordering new bags today: if anyone has a special order or request, call the store..770-933-1905"
91,264124198857883648,Thu Nov 01 21:58:10 +0000 2012,0,0,Closing at 6:30 Today (Thursday). Willett and I are going to see and hear RUSH!
92,263640803488956416,Wed Oct 31 13:57:20 +0000 2012,0,0,Happy Halloween! Stop by we have candy and cupcakes... http://t.co/rFqp65T3
93,263362738598838272,Tue Oct 30 19:32:24 +0000 2012,0,0,"STRING: 
For years I've been trying to get players to understand that stiff, polyester strings are not for... http://t.co/rzu6Sfpv"
94,261479393426276352,Thu Oct 25 14:48:40 +0000 2012,0,0,Eric and Emma courtside..Great Oct weather for tennis!!! http://t.co/dGQk2rXM
95,260700811468890112,Tue Oct 23 11:14:51 +0000 2012,0,0,Congrat's to S.F. Giants
96,260466382976720896,Mon Oct 22 19:43:19 +0000 2012,0,0,FOUR Prince Origional Graphite Mid Racquets for Sale: Arguably one of the best racquets ever made! These are still... http://t.co/xMLZQTic
97,259997740447178752,Sun Oct 21 12:41:06 +0000 2012,0,0,"I posted 6 photos on Facebook in the album """" http://t.co/Z3huxcEV"
98,259301869120282624,Fri Oct 19 14:35:57 +0000 2012,0,0,Hardcore Tennis Holiday Sale http://t.co/i3dETYZa
99,258564754661076992,Wed Oct 17 13:46:56 +0000 2012,0,0,Head String Information &amp; One-Time Discount...Because arm pain is an epidemic right now http://t.co/ApxuErCI
100,258563948817821697,Wed Oct 17 13:43:43 +0000 2012,0,0,Head String INFORMATION http://t.co/9MjGbQPd
101,255353920354938880,Mon Oct 08 17:08:13 +0000 2012,0,0,"ok - we need your help coming up with words that rhythm with 'TENNIS'....Serious, we need your help"
102,254347798395371520,Fri Oct 05 22:30:15 +0000 2012,0,0,someone update this page so we all know how everyone is doing at the tournament? I heard Kevin Won......?
103,253938911766786050,Thu Oct 04 19:25:29 +0000 2012,0,0,Big crew of HARDCORE TENNIS PLAYERS heading to Hilton Head for the Banana tournament....Represent...
104,253653544572420096,Thu Oct 04 00:31:32 +0000 2012,0,0,One of us is watching the debate tonight and one is not watching the debate tonight...
105,253527660259598336,Wed Oct 03 16:11:19 +0000 2012,0,0,"Good, no Great String: At Hardcore Tennis - email me any questions you have. eric@hardcoretennis.net... http://t.co/BQ2RxDRy"
106,253222958930219008,Tue Oct 02 20:00:32 +0000 2012,0,0,Hilton Head this weekend...
107,253222612040294400,Tue Oct 02 19:59:10 +0000 2012,0,0,See anything wrong here? It honestly came this way... http://t.co/PhNq6uwA
108,251758167631990786,Fri Sep 28 18:59:59 +0000 2012,0,0,Tennis Without All the Tension - Great Read from the Wall Street Journal http://t.co/hEoWjB4y
109,248274659928309760,Wed Sep 19 04:17:46 +0000 2012,0,0,Tennis Tomorrow? Y or N
110,244450896791080960,Sat Sep 08 15:03:30 +0000 2012,0,0,This is cool: http://t.co/OApAXIPl
111,243776973342646273,Thu Sep 06 18:25:34 +0000 2012,0,0,Hardcore Tennis Holiday Sale http://t.co/2IqhcU11
112,240974388558704640,Thu Aug 30 00:49:05 +0000 2012,0,0,Banana Open Results: Kevin had to retire in the semi's of 4.0 singles after he pulled his pork. After taking some... http://t.co/rhX082Pr
113,240862055912046592,Wed Aug 29 17:22:43 +0000 2012,0,0,Brian Baker on Tennis Channel right now - his shirt.....LIKE IT??? It's on sale here...Just sayin...
114,240556453436485633,Tue Aug 28 21:08:22 +0000 2012,0,0,Rainy Day in Atl - Watching US Open with Kevin Asbell and the others....Direct T.V. kicks ass during the grand slams!
115,239492763916333056,Sat Aug 25 22:41:39 +0000 2012,0,0,UPDATES ON JEKYLL ISLAND BANANA OPEN: - those of us in ATL wanna know...(Eric or Kevin...)
116,236853834054524928,Sat Aug 18 15:55:29 +0000 2012,0,0,While I review Fall Apparel and Shoes - (Athletic DNA Fall line is nice)  let me know if there is anything you... http://t.co/ce7ze5Af
117,236448228319563776,Fri Aug 17 13:03:45 +0000 2012,0,0,Peachtree City tonight!!
118,235568434254065664,Wed Aug 15 02:47:46 +0000 2012,0,0,The first person to answer this question gets 15.00 off almost any racquet stringing! (Except Natural Gut) You... http://t.co/XnCZVcDq
119,235497283343503360,Tue Aug 14 22:05:02 +0000 2012,0,0,"Hardcore Tennis VIPs 
Ted &amp; Jonathan Nurse just before Jonathan played the doubles final at Fair Oaks.. Jonathan... http://t.co/Vn5o7SIg"
120,235497195590270976,Tue Aug 14 22:04:41 +0000 2012,0,0,"Hardcore Tennis VIPs 
Ted &amp; Jonathan Nurse just before Jonathan played the doubles final at Fair Oaks.. Jonathan... http://t.co/NBgTw7Pk"
121,235437766018748416,Tue Aug 14 18:08:32 +0000 2012,0,0,Playmate Ball Machines are BOTH in: http://t.co/QWYVJJtC
122,233639834818838528,Thu Aug 09 19:04:12 +0000 2012,0,0,HOPE SOLO
123,233635424407547904,Thu Aug 09 18:46:40 +0000 2012,0,0,If you can sneak away from work stop by and watch some of the women's gold medal soccer match.
124,233006279470227456,Wed Aug 08 01:06:40 +0000 2012,0,0,"CUSTOMER NOTE: Genesis Black Magic String

Eric,
 
I tried the strings last night, they were awesome.   I will be... http://t.co/6trycrn2"
125,232610598414868481,Mon Aug 06 22:54:23 +0000 2012,0,0,Eric won 45 singles at Bitsy - just thought I would spit that out there.....Angelo and Eric played tough dubs but... http://t.co/QRJgIfgK
126,231823212722388992,Sat Aug 04 18:45:35 +0000 2012,0,0,"Congratulations to TWO great Hardcore Tennis Players:
William Cates &amp; Teresas Richards -- 6.0 MXD City Champions!
Way to go~"
127,231753080419532800,Sat Aug 04 14:06:54 +0000 2012,0,0,See you all at Bitsy -
128,229990611070095360,Mon Jul 30 17:23:29 +0000 2012,0,0,Wouldn't Olympic tennis be much more interesting if it were actually a TEAM event? Davis Cup format with two men's... http://t.co/twD80FXK
129,229560719924924417,Sun Jul 29 12:55:15 +0000 2012,0,0,Make sure you register for the Bitsy tournament by midnight tonight (August 4-7th)
130,229194523866173441,Sat Jul 28 12:40:07 +0000 2012,0,0,"Ashaway String for the non-sting-breaker - great feel, holds tension: DYNAMITE 18 http://t.co/AyBdi82H"
131,229192491369381888,Sat Jul 28 12:32:02 +0000 2012,0,0,Good luck everyone in the playoffs today - stop by and watch the Olympics with us
132,229192152616402944,Sat Jul 28 12:30:42 +0000 2012,0,0,Stop by and watch the Olympics with us today -
133,227924367286366208,Wed Jul 25 00:32:58 +0000 2012,0,0,KISS CONCERT
134,227759663473639424,Tue Jul 24 13:38:30 +0000 2012,0,0,"Very Popular with our customers: 

Pro Supex Synthetic Gut Spiral Flex
The new Pro Supex Synthetic Gut Spiral... http://t.co/QbyD6g58"
135,226764958027898880,Sat Jul 21 19:45:53 +0000 2012,0,0,"Hey - one of our great customers has two racquets he needs sold asap - email him if interested:
HEAD YouTek... http://t.co/dBquM22k"
136,226638351594319874,Sat Jul 21 11:22:48 +0000 2012,0,0,A multifilament string compromised of over 2000 filaments that are bonded and twisted together. Genesis Xplosion... http://t.co/e23mynTZ
137,226523886710296576,Sat Jul 21 03:47:57 +0000 2012,0,0,I finally had the privilege of playing doubles with Brian Fergison. It was worth the wait. Brian owns  Fergison... http://t.co/PP4ups06
138,226317502098071553,Fri Jul 20 14:07:51 +0000 2012,0,0,Athletic DNA - starting to be worn by some serious Hardcore Tennis Players http://t.co/dNXJaP8F
139,225953737062105088,Thu Jul 19 14:02:23 +0000 2012,0,0,More old school ass kicking sticks. From my buddy KC Thornton. http://t.co/ZbdTnf2Y
140,225534276702179328,Wed Jul 18 10:15:36 +0000 2012,0,0,"Liking Genesis String: Info on Twisted Razor
Twisted Razor takes co-polyester strings to a whole new level. Its... http://t.co/ewmSe019"
141,225230971312680961,Tue Jul 17 14:10:22 +0000 2012,0,0,Anyone going to Atlantic Station today? send some pictures
142,224877945670467586,Mon Jul 16 14:47:34 +0000 2012,0,0,Good line-up today:http://t.co/ItVLdF7C http://t.co/HnBJp8nX
143,224715522158243841,Mon Jul 16 04:02:10 +0000 2012,0,0,"Monday - Finals in Singles, Finals in Doubles..... Jekyll"
144,224101871386771456,Sat Jul 14 11:23:44 +0000 2012,0,0,We did these shirts in less than 24 hrs...record http://t.co/BHTQeErw
145,223575015122141186,Fri Jul 13 00:30:12 +0000 2012,0,0,Playing in Jekyll this weekend -
146,223180968700297217,Wed Jul 11 22:24:24 +0000 2012,0,0,We just received a new Playmate Volley Tennis Ball Machine. So we now have 2 great machines and they are both in.... http://t.co/ZiknqZGS
147,223179401947381761,Wed Jul 11 22:18:10 +0000 2012,0,0,"Move Your Feet  5K  
Saturday August 11, 2012  8:00 AM
Starts at Chattahoochee River Club Amenities Area and runs... http://t.co/geHgfC6Q"
148,223154456525680640,Wed Jul 11 20:39:03 +0000 2012,0,0,Take a look at this...Ready for some old-school ass-kickin http://t.co/Z9qVY4Dh
149,221086272691773440,Fri Jul 06 03:40:49 +0000 2012,0,0,"If you've never rented a tennis ball machine from us, you should. Our Playmate Volley does everything except... http://t.co/pusXoIaq"
150,220111715134750720,Tue Jul 03 11:08:17 +0000 2012,0,0,"Ball Machine Workouts
 
Tennis is a fun sport that offers physical fitness and an ability to compete in a... http://t.co/heOTcpqo"
151,218452477706637312,Thu Jun 28 21:15:03 +0000 2012,0,0,wow - Nadal out....Sorry Chad
152,218322537258549248,Thu Jun 28 12:38:43 +0000 2012,0,0,Brian Baker....
153,218202816626442240,Thu Jun 28 04:43:00 +0000 2012,0,0,"Using his new Donnay X-Dual Gold 99, long time Hardcore Tennis player Adam Laborde won the Peach League 4.5 singles final!"
154,216208395227766785,Fri Jun 22 16:37:53 +0000 2012,0,0,Wimbledon http://t.co/xt5iEOJS http://t.co/cMRc87Eg
155,215206906791342080,Tue Jun 19 22:18:19 +0000 2012,0,0,"Great Pic of Baker in the qualies at Wimbledon - Athletic DNA (pssst, we have it in the store) Good fun watching... http://t.co/xLQ7v6lZ"
156,214881333057560576,Tue Jun 19 00:44:36 +0000 2012,1,0,"DONNAY, WILSON, ATLHETIC DNA, BABOLAT SHOES, and all the string your imagination can gather....Come see our new Hardcore Tennis..."
157,213453878409179136,Fri Jun 15 02:12:25 +0000 2012,0,0,"Another Hardcore Tennis Stud, Larry Brown: USTA 3.5 Senior City Champion! (and Beth's Favorite) http://t.co/KbE5eaxK"
158,213450880970797057,Fri Jun 15 02:00:30 +0000 2012,0,0,"Another Hardcore Tennis Stud: Beth's Favorite, Larry Brown http://t.co/6qFBc5Lf"
159,211822934073937920,Sun Jun 10 14:11:37 +0000 2012,0,0,Djokovic's hair looks like a porcupine - Eric says he needs a good 'stylist'
160,211532459198783489,Sat Jun 09 18:57:23 +0000 2012,0,0,Athletic DNA - Men's &amp; Boys Apparel has arrived: http://t.co/NmgjFh8K
161,211330815802617857,Sat Jun 09 05:36:07 +0000 2012,0,0,Wilson has some surprisingly nice new frames. The Juice and Steam are much more arm friendly than the usual... http://t.co/c553gs94
162,211218411110400000,Fri Jun 08 22:09:28 +0000 2012,0,0,I did play in Chattanooga Thursday. Unfortunately I did not play very well and lost 13-11 in a super breaker.... http://t.co/gMnycGCn
163,211140862774743040,Fri Jun 08 17:01:19 +0000 2012,0,0,CONGRATS to a Great Customer! http://t.co/awRwxZaP
164,210689515839430657,Thu Jun 07 11:07:49 +0000 2012,0,0,Eric is playing in Chattanooga today....
165,208644853989511168,Fri Jun 01 19:43:04 +0000 2012,0,0,Sloan Stephens on Tennis Channel Right NOW
166,207996877633888256,Thu May 31 00:48:14 +0000 2012,0,0,UPDATES: we are getting in 2 new Babolat Mens &amp; Women's Shoes! All Wilson and Donnay Demo's are in! And the ball... http://t.co/UzGpTsU6
167,206461766157348865,Sat May 26 19:08:15 +0000 2012,0,0,Happy Memorial Day Weekend - Get out and hit!
168,205631325384876033,Thu May 24 12:08:23 +0000 2012,0,0,Hey - we need a truck that can hold a couch and refridgerator...just for an afternoon!
169,204625557764321281,Mon May 21 17:31:49 +0000 2012,0,0,The store is getting it's last touch-ups - we are BACK in our space and it is looking pretty awesome...
170,204623806814371841,Mon May 21 17:24:51 +0000 2012,0,0,Over the past 1 1/2 years I have transitioned to partnering with Hardcore Tennis in Atlanta/Marietta GA. Eric Burke th…http://t.co/bZy98b7W
171,202533804273971200,Tue May 15 22:59:56 +0000 2012,2,0,Considering Carrying athletic DNA: Some nice men and junior boys apparel...what do you think? Will you wear it... http://t.co/1jD4PfmU
172,202383137001570304,Tue May 15 13:01:14 +0000 2012,0,0,"Health Benefits for Women:Health Benefits of Cod Liver Oil
FOR WOMEN
By Doanphuong Nguyen, 
Many Americans take... http://t.co/2BTIaXOl"
173,201691401421983744,Sun May 13 15:12:31 +0000 2012,0,0,"Happy Mother's Day to all the Hardcore Tennis Mom's out there! 
These are NOT Hardcore Tennis Players.... http://t.co/YQXw3zsr"
174,201651771872002049,Sun May 13 12:35:03 +0000 2012,0,0,Our Ashaway String Guys on a day off - impressive http://t.co/SoFtN2Dl
175,201102455172374528,Sat May 12 00:12:16 +0000 2012,0,0,Store is coming along...looks so open and different!!! Thanks for all help we are receiving
176,200712476680134657,Thu May 10 22:22:38 +0000 2012,0,0,"With a huge assist from Hardcore Tennis VIP'S and great friends Mike and Ashley MCCall, the SC men headed to Los... http://t.co/ORGbJ6s8"
177,200265212337721344,Wed May 09 16:45:22 +0000 2012,0,0,"Melanie O - in to French Open
http://t.co/QYoW5wIj http://t.co/1sjZgjxl"
178,199723843584147456,Tue May 08 04:54:09 +0000 2012,0,0,"Stringing 31 racquets, not hitting for 5 days, sleeping for 4.5 hours, driving 3 hours, and getting out of your... http://t.co/Cz5HlEE7"
179,199676024865292289,Tue May 08 01:44:08 +0000 2012,0,0,OKAY - FYI: Eric hit this weekend with the Wilson BLX racquets that we got in - he and 2 guys as well. They were... http://t.co/EbFQt0n7
180,197762614074413056,Wed May 02 19:00:56 +0000 2012,0,0,DEMO'S in from Wilson: Two that are getting some major attention: BLX Juice 100 &amp; BLX Steam 100...Come get em http://t.co/eDcb73KI
