,id_str,created_at,retweet_count,favorite_count,text
181,197286682784051200,Tue May 01 11:29:45 +0000 2012,0,0,The Burke Brothers playing at Cherokee this week...
182,196982453968175105,Mon Apr 30 15:20:51 +0000 2012,0,0,We were told that there are two days remaining till we move BACK into our store....pictures to follow
183,195627028588929025,Thu Apr 26 21:34:52 +0000 2012,0,0,Demolition at Hardcore Tennis: http://t.co/PhDMWaKQ
184,194863946837139456,Tue Apr 24 19:02:39 +0000 2012,0,0,Don't wait until Friday Afternoon for your racquet to be strung for this weekends' matches...Our remodel is... http://t.co/de2ElImQ
185,194486691166302209,Mon Apr 23 18:03:35 +0000 2012,0,0,This is the LAST week for ALTA regular season - end strong with proper string and grips on your racquets. It could... http://t.co/jxv3zLhC
186,194427806455824387,Mon Apr 23 14:09:36 +0000 2012,0,0,"From : Hardcore Tennis Customer -- Eric,
Extremely pleased with the stringing and the new grip.  The combination... http://t.co/FSfeD57Q"
187,193692366182428673,Sat Apr 21 13:27:13 +0000 2012,0,0,Expecting Wilson Demo's to arrive - and it's a great day to get your racquet strung ---- we are all caught up
188,193357147034238978,Fri Apr 20 15:15:10 +0000 2012,0,0,Hardcore Tennis Crew Played last weekend at the Banana Open in Charlotte (Eric WON!)... http://t.co/TlTcM5Wg
189,193321160748957697,Fri Apr 20 12:52:11 +0000 2012,0,0,Hardcore Tennis Family Member - Adrian Strong http://t.co/BwvW6zIy
190,192964665343606784,Thu Apr 19 13:15:35 +0000 2012,0,0,Remodel Day 5 --- They are threatening to start.....This temporary space is fine as long as the airconditioning... http://t.co/htUxrLJb
191,189773099326119938,Tue Apr 10 17:53:27 +0000 2012,0,0,Day 2 Remodel: we have a lot of shit in this place to move 5 doors down....AND still string all y'all's... http://t.co/AjPKCgi3
192,189046144922423297,Sun Apr 08 17:44:47 +0000 2012,0,0,"Hardcore Tennis Team Member Ashley McCall, spotted at Family Circle Cup in Charleston with CHRIS EVERT!! http://t.co/DjRnhSVQ"
193,189044790745251840,Sun Apr 08 17:39:25 +0000 2012,0,0,"Hardcore Tennis Team Member, Ashley McCall with Chris Evert in Charleston at the Family Circle Cup http://t.co/XgPMY6PR"
194,188030910506074112,Thu Apr 05 22:30:37 +0000 2012,0,0,Tony Burke with the Kids at Ansley... http://t.co/Q09vetIU
195,186684129826447361,Mon Apr 02 05:18:59 +0000 2012,0,0,One of the original Hardcore Tennis team members Tony Burke stopped by to contribute to the sale and work the... http://t.co/PrLzMuQk
196,186683159784587265,Mon Apr 02 05:15:08 +0000 2012,0,0,Beth is playing on a new team out of Midtown Athletic Club. She and Lizel won their first match in straight sets.... http://t.co/OpSfmt51
197,186682426305675264,Mon Apr 02 05:12:13 +0000 2012,0,0,"Dean Fung A Wing (Yes that's his real name) Brian Davis, and EB were filmed by Hi Tech Tennis today. We will let you know what we see."
198,186680918461779970,Mon Apr 02 05:06:13 +0000 2012,0,0,Once again you Hardcore Tennis players were great! Thanks to everyone who sent new friends to the store for the... http://t.co/60HgBrpS
199,185718897192873984,Fri Mar 30 13:23:30 +0000 2012,0,0,Hardcore Tennis has provided the stringing and the strings for the South Carolina Game Cock Men this year. Adam... http://t.co/Qw9N7czb
