,id_str,created_at,retweet_count,favorite_count,text
0,649325397809631232,Wed Sep 30 20:50:13 +0000 2015,0,1,Your spam is on Louis TL ! https://t.co/zxB31MTHw7
1,649325152245690368,Wed Sep 30 20:49:14 +0000 2015,0,0,@loutreehill😊
2,649325090534899712,Wed Sep 30 20:49:00 +0000 2015,0,0,Screenshot of Louis' TL right now! http://t.co/zLWwhfHE7f
3,649269362256445440,Wed Sep 30 17:07:33 +0000 2015,0,0,@lookingoodlads there should be an option for it to do it automatically
4,649269004675231744,Wed Sep 30 17:06:08 +0000 2015,0,0,"Hey , Your spam is on Louis' Timeline ! https://t.co/IjGjsGXFQO"
5,649268290141978624,Wed Sep 30 17:03:17 +0000 2015,1,1,Hello! Your spam is all over Louis' Timeline 😊 https://t.co/d62yVpCF7y
6,649267996003860480,Wed Sep 30 17:02:07 +0000 2015,0,0,"Hey @ahazarry  , your tweet was rted onto Louis' Timeline!!"
7,649267577563299841,Wed Sep 30 17:00:27 +0000 2015,0,1,"Hey @kickasslou, your tweet was rted on louis' timeline!"
