,id_str,created_at,retweet_count,favorite_count,text
0,669313442948341760,Wed Nov 25 00:35:34 +0000 2015,1,8,Twitter at the Crossroads The company knows it’s in trouble. And its o... via @socialnerdia https://t.co/XRrH8l8r6I https://t.co/WMHhJZzJye
1,669281010937282561,Tue Nov 24 22:26:42 +0000 2015,3,10,Top Five Productivity Tips For Entrepreneurs - Forbes https://t.co/bQh3M3xz4t
2,669265915435847680,Tue Nov 24 21:26:43 +0000 2015,10,12,"""There is no sun without shadow, and it is essential to know the night."" - Albert Camus https://t.co/285aJO15RX"
3,669265643464601600,Tue Nov 24 21:25:38 +0000 2015,2,1,".@MurrayNewlands, I think it is a great strategy
by #InfluencerOwned @SharkReach because it creates real #brandloyalty"
4,669243054566453249,Tue Nov 24 19:55:52 +0000 2015,4,6,"Xtra-PC Gives New Life to Your Old PC, and We’re Giving 5 Units Away! https://t.co/QnZJlLr2kf #funstuff https://t.co/tTCqqcr6bA"
5,669229955906039808,Tue Nov 24 19:03:49 +0000 2015,20,0,RT @MurrayNewlands: Work hard and never give up even if it is raining #nevergiveup #motivation https://t.co/EN7woaCnFR
6,669219114347462656,Tue Nov 24 18:20:45 +0000 2015,26,30,"Fear is the disease. Hustle is the antidote.
- Travis Kalanick https://t.co/NyTkVIASK9 #traviskalanick #uber https://t.co/6AJg4WoYdv"
7,669205724543647744,Tue Nov 24 17:27:32 +0000 2015,38,0,RT @johnrampton: What to pitch social media influencers? Here are a few great tips  #socialinfluence https://t.co/kAGSkOf3Ga by @Cision @Ba…
8,669023395007229952,Tue Nov 24 05:23:01 +0000 2015,16,31,5 Ways to Get People to Remember You (And Your Company) https://t.co/Q6fmAuEZhE https://t.co/PjgvpBvG4q
9,668967006943645696,Tue Nov 24 01:38:57 +0000 2015,11,28,Yes https://t.co/4vWBWMo57U https://t.co/VGrjHyrOHV
10,668909437738881025,Mon Nov 23 21:50:12 +0000 2015,188,0,"RT @johnrampton: ""Never tell me the sky's the limit when there are footprints on the moon."" - Unknown https://t.co/9SSSVF9E0J"
11,668909350895796227,Mon Nov 23 21:49:51 +0000 2015,18,0,RT @MurrayNewlands: let go of what is not meant to be and clear a path for a better future #MotivationalMonday #motivation https://t.co/jkO…
12,668909291378618368,Mon Nov 23 21:49:37 +0000 2015,15,29,I was always looking outside myself for strength and confidence but it comes from within. It was there all the time. - Anna Freud
13,668907832868102144,Mon Nov 23 21:43:49 +0000 2015,5,16,6 Manageable Steps to Life Goals Achievement via @JWhite https://t.co/NZrENFoN8K #success https://t.co/kVj8vU0wgp
14,668845930943152128,Mon Nov 23 17:37:51 +0000 2015,2,9,A Look at Mobile App Development Options and How Cross-platform Tec... via @nimbyist https://t.co/cfYm2Av8o1 @odesk https://t.co/l3k7vPgUNT
15,668814190056894464,Mon Nov 23 15:31:43 +0000 2015,16,31,Doing what you love and getting paid for it... https://t.co/rPm9LVOrci https://t.co/7wq98Xb7xx
16,668337236367138816,Sun Nov 22 07:56:28 +0000 2015,19,23,"4 Essential Skills Every Digital Marketer Should Cultivate  --,What Marketers Get Wrong,... https://t.co/ud4bs517Yr https://t.co/etlQcgGNPC"
17,668336577790144512,Sun Nov 22 07:53:51 +0000 2015,13,25,5 Lifestyle Tweaks for a More Productive Life via @HuffingtonPost https://t.co/rBntrIkNzi https://t.co/93pQnMjncy
18,668335757778485248,Sun Nov 22 07:50:36 +0000 2015,4,6,login functionality + small modules using spring rest. -- 2 by rohanborde https://t.co/nZceHedk7g #java #postgresql
19,668334891059179520,Sun Nov 22 07:47:09 +0000 2015,17,23,Wisdom from Booker T. Washington concerning associations and limiting exposure to those ... https://t.co/t2cSpiF0k6 https://t.co/LotPLalgpm
20,668334094741192704,Sun Nov 22 07:43:59 +0000 2015,7,4,The Productivityist Podcast 66: A Doer Who Likes To Be w... via @mikevardy https://t.co/VZS1XNdB7z @productivityist https://t.co/6juSZVYNzS
21,668333050908971009,Sun Nov 22 07:39:51 +0000 2015,24,18,“Make something people want” includes making a company that... https://t.co/3zUuL2PK2i #sahillavingia #gumroad https://t.co/d4npU1XcsT
22,668332220046708741,Sun Nov 22 07:36:32 +0000 2015,3,3,RT @Techmeme: Periscope Piracy Sets Up Grudge Match: Hollywood vs. Twi... via @socialnerdia https://t.co/m6L0marG3u https://t.co/h4gJ6Ow2q5
23,668331636459630592,Sun Nov 22 07:34:13 +0000 2015,2,5,Freelancing the religious life: An 'urban hermit' tells her story - The Catholic Review https://t.co/Q48q69TVrw https://t.co/fEgNJBWA47
24,668134656479395840,Sat Nov 21 18:31:30 +0000 2015,190,145,"""Education is every day and everywhere, the only thing you have to pay is attention."" - Tim Fargo https://t.co/VPGc6NOPvO"
25,667964854108422144,Sat Nov 21 07:16:46 +0000 2015,12,25,6 Must-Dos When Hiring a Freelancer via @Entrepreneur https://t.co/bUx5KkC7L6 https://t.co/VsT0gYS7uF
26,667941327259070464,Sat Nov 21 05:43:16 +0000 2015,7,8,How NOT to Try and Help People in Times of Stress via @JWhite https://t.co/cc4oZ15b9p #howto #lifehacks https://t.co/iH5bROCnqA
27,667931701134290944,Sat Nov 21 05:05:01 +0000 2015,2,11,Facebook Rainbow Profile Photos: The Latest Big Data Experiment? - The... via @socialnerdia https://t.co/wZcQMyJfe2 https://t.co/4z2sHxwnpq
28,667915692209893376,Sat Nov 21 04:01:24 +0000 2015,16,19,Wisdom from Booker T. Washington concerning associations and limiting exposure to those ... https://t.co/Utu3mvwamZ https://t.co/4YOfC7Wbnp
29,667900777071939584,Sat Nov 21 03:02:08 +0000 2015,5,3,The Power Of A New Start via @productivityist https://t.co/5lh0xYL14Y #mindfulness #change https://t.co/oNdknlRjiQ
30,667888298744877056,Sat Nov 21 02:12:33 +0000 2015,3,2,Upwork Reveals Most In-demand Skills of 2015 via @odesk https://t.co/yz6rc4WLPh #allthingsupwork #onlinework https://t.co/wVTvcZs29W
31,667873950492311552,Sat Nov 21 01:15:32 +0000 2015,12,12,"In my 20s I was thrashing around in the water, trying to keep my... https://t.co/wwDAVaEb6x #lesliebradshaw https://t.co/nXKsmhiGbo"
32,667865124615548929,Sat Nov 21 00:40:28 +0000 2015,4,8,Unscrambling the Myths about SocialMedia  -- May 20 '14 https://t.co/SKU88jAEQV https://t.co/tLEhDKlnKa
33,667793878976565248,Fri Nov 20 19:57:22 +0000 2015,4,15,What brands do you think will do well this Xmas? https://t.co/0UiR0TFhAk
34,667793055282413568,Fri Nov 20 19:54:06 +0000 2015,37,0,RT @MurrayNewlands: Never stop learning because life never stops teaching #motivation #learning #life https://t.co/KU0v43Seqc
35,667482378374287360,Thu Nov 19 23:19:34 +0000 2015,5,14,Instagram account of University of Pennsylvania runner showed only par... via @socialnerdia https://t.co/9G4pBQohc8 https://t.co/Z47CjK1FfG
36,667396714551054336,Thu Nov 19 17:39:11 +0000 2015,8,0,RT @MurrayNewlands: Great things really come in your comfort zone #motivation #tryhard #leadership https://t.co/XyZl63OAO4
37,667373903841394688,Thu Nov 19 16:08:32 +0000 2015,43,0,RT @johnrampton: Great article on building a Real Brand that Builds a Better World by @KarenDellCMO @Dell https://t.co/FeXi8plBVS https://t…
38,667221044000784384,Thu Nov 19 06:01:07 +0000 2015,21,22,"Better yet, only compare now self with your desired self and focus on YOUR journey - it'... https://t.co/VJeHzleoBn https://t.co/o3JJ9bdwr4"
39,667195042952384512,Thu Nov 19 04:17:48 +0000 2015,6,12,Less via @mikevardy https://t.co/MaM74szi0e @productivityist #workflow #less https://t.co/R05F4Qa9Yn
40,667181210968322049,Thu Nov 19 03:22:50 +0000 2015,42,0,"RT @johnrampton: ""We like to see companies with a clear business model""says @christine_tsai Partner @500Startups Live @StartupGrind https:/…"
41,667178005685374976,Thu Nov 19 03:10:06 +0000 2015,8,21,"Freelance Writing Jobs, November 18, 2015 https://t.co/Ll4tN1OFhN #writinggigs #copywritingjobs https://t.co/VuoMHMHomC"
42,667165356012662784,Thu Nov 19 02:19:50 +0000 2015,47,54,"It is not the strongest of the species that survive, nor the... https://t.co/RGTn6YwAEr #charlesdarwin #change https://t.co/kc0s98rRqG"
43,667142173666635776,Thu Nov 19 00:47:43 +0000 2015,16,35,"How you make others feel about themselves, says a lot about you. https://t.co/Rc87Z5itP0 https://t.co/ybaUqFfOUe"
44,667122120250404864,Wed Nov 18 23:28:02 +0000 2015,3,20,Design a Logo  by phil48 https://t.co/YiWHyJhpFV #graphicdesign #logodesign https://t.co/Cm2sAm7lf6
45,667044900114796544,Wed Nov 18 18:21:11 +0000 2015,21,0,RT @MurrayNewlands: Great leaders make you feel like you are working for each other. #team #leadership #motivation https://t.co/MqRpW4QpUF
46,666876666090663936,Wed Nov 18 07:12:41 +0000 2015,365,0,"RT @johnrampton: ""It is amazing what you can accomplish if you do not care who gets the credit."" - Harry Truman https://t.co/YNrmJQYs5b"
47,666875831600283648,Wed Nov 18 07:09:22 +0000 2015,75,95,Live for today https://t.co/A8DE9Xidiq
48,666847171585544195,Wed Nov 18 05:15:29 +0000 2015,7,25,This designer earns $20k each month freelancing online. What's your excu... via @Techinasia https://t.co/OZWnuQGode https://t.co/5wl2mCABXe
49,666827677349847041,Wed Nov 18 03:58:01 +0000 2015,3,4,"Want a Better Online Presence?   -- Evaluation of highly Googled, prominently positioned... https://t.co/CHRITYbWs2 https://t.co/tb1AWctdaC"
50,666804045902802944,Wed Nov 18 02:24:07 +0000 2015,5,11,The cult of productivity is preventing you from being productive via @qz https://t.co/7fudXAgvpK https://t.co/uiYEPn73SV
51,666785126156636161,Wed Nov 18 01:08:57 +0000 2015,3,7,4 Social Media Tips for Retailers https://t.co/zXl1XcPutK https://t.co/EnncMB4Qyh
52,666749679011409923,Tue Nov 17 22:48:05 +0000 2015,3,9,Why You Need Good Writing Skills To Survive College via @JWhite https://t.co/w2FcpX1pA8 #success https://t.co/bqy48an81f
53,666714512322498560,Tue Nov 17 20:28:21 +0000 2015,5,7,"Whenever you find yourself on the side of the majority, it is... https://t.co/YrvraTUJjo #marktwain #change https://t.co/KRHrODX3t6"
54,666686774282878976,Tue Nov 17 18:38:08 +0000 2015,146,0,RT @MurrayNewlands: A team is not a group who slaves together. A team is a group who trust and inspire earth other #motivation ... https://…
55,666679795955068929,Tue Nov 17 18:10:24 +0000 2015,34,9,Perspectives on the Future of Work: November 16 via @odesk https://t.co/aTDXjRQNfD #thewaywework https://t.co/bXsztZCHBK
56,666473836980756480,Tue Nov 17 04:31:59 +0000 2015,4,7,Are you confused? It can hold you back and hamper your success. https://t.co/u10keqORXt https://t.co/UgzNDJBLSV
57,666425644113260544,Tue Nov 17 01:20:29 +0000 2015,3,18,"Freelance Writing Jobs, November 11, 2015 https://t.co/pwk5IcjRrn #writinggigs #contentwritingjobs https://t.co/fAQNYxbjzW"
58,666393599559372800,Mon Nov 16 23:13:09 +0000 2015,0,5,The Productivityist Podcast 65: Money and Minimalism wit... via @mikevardy https://t.co/94y205eyEW @productivityist https://t.co/n8OH2a4Ocy
59,666349937383202816,Mon Nov 16 20:19:39 +0000 2015,14,18,Follow Your Bliss https://t.co/Jmf7lVu3s9 https://t.co/uq2r72u6Am
60,666310227550040064,Mon Nov 16 17:41:52 +0000 2015,22,16,Twitter Overtakes LinkedIn As Number 1 Social Media Site For Salespeople via @Forbes https://t.co/I5b707yKHO @socialnerdia
61,666302565194162176,Mon Nov 16 17:11:25 +0000 2015,31,0,RT @MurrayNewlands: Leadership is not about fear. Leadership is about finding the right #motivation. #leadership #startup https://t.co/yWGB…
62,666282728652869633,Mon Nov 16 15:52:36 +0000 2015,8,15,How banning technology can boost focus and productivity via @FinancialTimes https://t.co/chNROxlXct https://t.co/ppYIZhTDKf
63,666257096254484481,Mon Nov 16 14:10:44 +0000 2015,1,4,Making The Move from Elance to Upwork? What You Need to Know Before You Hire via @odesk https://t.co/MxuZRepMvi https://t.co/5kxxThi9RS
64,666227707466772480,Mon Nov 16 12:13:58 +0000 2015,10,25,HOW-TO: Set Up An Attractive Facebook Business Page https://t.co/IWMO6bUULR https://t.co/gyDqRcnv9m
65,666144863465832448,Mon Nov 16 06:44:46 +0000 2015,205,0,"RT @johnrampton: Tomorrow is a new day.... Believe in yourself, you'll be surprised how far you'll get if you just try. @Entrepreneur #star…"
66,666088512073035780,Mon Nov 16 03:00:51 +0000 2015,20,20,"Whatever the problem, be part of the solution. Don’t just... https://t.co/GBacTP6HDG #tinafey #problem https://t.co/lASRfEKbbP"
67,666001163888693248,Sun Nov 15 21:13:45 +0000 2015,8,16,"* Google+, Instagram, LinkedIn, Twitter, Facebook: Optimal Image Sizes To Share On Socia... https://t.co/cfDBBsEjys https://t.co/AWkDykNKtR"
68,665978611204161536,Sun Nov 15 19:44:08 +0000 2015,130,0,"RT @Everette: When you're on top though, people can't wait for you to fail."
69,665977741540372480,Sun Nov 15 19:40:41 +0000 2015,44,0,RT @MurrayNewlands: Leadership is not about being in power it is about looking after those you are in charge of. #leadership https://t.co/M…
70,665912628837941248,Sun Nov 15 15:21:57 +0000 2015,3,6,Convert Stored Procedure (Oracle to MySQL) -- 2 by gfrobenius https://t.co/pSA10HgDi4 #databaseprogramming #mysql
71,665855235982622720,Sun Nov 15 11:33:53 +0000 2015,4,5,Comic: 11/13/15 https://t.co/crdBm5YR4j https://t.co/9V0mX6pvUe
72,665787899804160000,Sun Nov 15 07:06:19 +0000 2015,5,9,Why we need to take e-waste seriously via @JWhite https://t.co/gkb8KnjFoi #lifehacks #weee https://t.co/NT445V71S0
73,665779608281747456,Sun Nov 15 06:33:22 +0000 2015,9,20,"For the Lord satisfies the thirsty, and the hungry he fills with good things. -Psalm 107... https://t.co/5TmNQcSE1I https://t.co/wraTUmwUhs"
74,665768046359810048,Sun Nov 15 05:47:26 +0000 2015,2,5,How Efficient And Effective Sales Organizations Increase Productivity via @Forbes https://t.co/N9qbtIqcBf
75,665756197748908032,Sun Nov 15 05:00:21 +0000 2015,7,17,Looking For Innovators in the 47 Other States: https://t.co/YpJsnCLlLo via @johnrampton #startup #siliconvalley https://t.co/2kmkrPiEgw
76,665725997640261632,Sun Nov 15 03:00:21 +0000 2015,16,30,Weekend inspiration! #quote #motivate https://t.co/WSkRav66NM
77,665696239627968512,Sun Nov 15 01:02:06 +0000 2015,3,7,What do you think about the new Twitter features? #Twitter #Changes #Polling #Hearts https://t.co/ZHoCjY42ZA
78,665674771384832000,Sat Nov 14 23:36:47 +0000 2015,2,12,Pinterest marketing expert Anna Bennett tips for businesses: Men pin things they plan on... https://t.co/w0Fy6lFJvW https://t.co/VB7gdThma2
79,665643396208435200,Sat Nov 14 21:32:07 +0000 2015,5,13,What do you think of the new Dove Emoji Campaign? https://t.co/GnIXPR1vXV #Dove #Emoji #Curly https://t.co/Vi1Xpzxy9G
80,665606916501041153,Sat Nov 14 19:07:09 +0000 2015,63,74,"""Do not whine...Do not complain. Work harder. Spend more time alone."" 
- Joan Didion #quote #entrepreneur #guideline https://t.co/ek9tJQUKGe"
81,665594497544273925,Sat Nov 14 18:17:49 +0000 2015,23,0,RT @MurrayNewlands: You can have genius in your ideas however your impacts are determined by our actions #motivation #leadershi... https://…
82,665589855175335937,Sat Nov 14 17:59:22 +0000 2015,12,13,The First YouTube Video Ever Was Uploaded Exactly Ten Years Ago. Here ... via @socialnerdia https://t.co/zXAyOPba4b https://t.co/eN1RKHHtFK
83,665419710121566208,Sat Nov 14 06:43:16 +0000 2015,7,6,"Winning Proposals: Best Practices, Customized Templates, and Questi... via @nimbyist https://t.co/Vww2EnT81q @odesk https://t.co/KsTRC3KyIp"
84,665404835664175104,Sat Nov 14 05:44:10 +0000 2015,2,16,"Freelance Writing Jobs, November 12, 2015 https://t.co/F1zfZ6HlpY #writinggigs https://t.co/6KQEcUoYtq"
85,665381816170246144,Sat Nov 14 04:12:41 +0000 2015,3,9,Video Games and Relationships: A List of Pros and Cons via @JWhite https://t.co/wfhLkY8NsM #happiness https://t.co/D3m7GQk0rF
86,665379925436866560,Sat Nov 14 04:05:11 +0000 2015,4,9,Do you block ads? https://t.co/IxF0uRl9jt #adblocking #internet https://t.co/x7lf3zJYvs
87,665356332061495297,Sat Nov 14 02:31:25 +0000 2015,8,21,Follow Your Bliss https://t.co/ggWXgQMqdo https://t.co/1EwGXI3kdO
88,665338384181821441,Sat Nov 14 01:20:06 +0000 2015,16,19,Failure isn’t failure unless you don’t learn from it. -- Dr. Ronald Niednagel #perspective #failure https://t.co/qA76tvAB4Y
89,665322769656057856,Sat Nov 14 00:18:04 +0000 2015,0,3,SLC 2015: Goodbye LOTO — Bringing Productivity Back to Safety - EHS Today https://t.co/Z1bHSUv1od https://t.co/SYcF1hX5X1
90,665310362313449472,Fri Nov 13 23:28:45 +0000 2015,11,0,RT @MurrayNewlands: Tanking a walk after lunch #lunch #motivation #sf #SanFrancisco #photography #streetphotography https://t.co/nC5dtqQl63
91,665310215579918337,Fri Nov 13 23:28:10 +0000 2015,0,2,@JD_2020 @johnrampton @MurrayNewlands @CynthiaLIVE we agree!
92,665310160433246208,Fri Nov 13 23:27:57 +0000 2015,1,0,RT @JD_2020: Thanks for having me on! Cool topics that spurred a lot of great thoughts and ideas from those participating :) https://t.co/t…
93,665310072969388034,Fri Nov 13 23:27:36 +0000 2015,37,0,RT @johnrampton: Thinking of launching a startup? Read these 4 books first: https://t.co/MOxgnkpvZQ via @mashable https://t.co/az7fxHS4Ke
94,665310049464545281,Fri Nov 13 23:27:31 +0000 2015,21,0,RT @johnrampton: Trying to find awesome new employees? Here's out to weed out the bad candidates: https://t.co/fHfA276xhe #hiring # https:/…
95,665298141130989568,Fri Nov 13 22:40:12 +0000 2015,10,14,Growing your online following can be a daunting task. Here's how to pull it off: https://t.co/l9eg9mRKjF #social https://t.co/OsdTRyR0AN
96,665246568359047169,Fri Nov 13 19:15:16 +0000 2015,3,6,Forget everything you thought you knew about student loans: https://t.co/MewbZDEYKn #studentloans #CommonBond https://t.co/AMOFzJBzW8
97,665220128989048832,Fri Nov 13 17:30:12 +0000 2015,19,15,Failure is just a resting place. It is an opportunity to begin again more intelligently. -- Henry Ford #failure #work #entrepreneur
98,665213005169168385,Fri Nov 13 17:01:54 +0000 2015,0,4,@MurrayNewlands #friday
99,665212592000864256,Fri Nov 13 17:00:15 +0000 2015,13,0,RT @MurrayNewlands: He goal is not to be perfect when you are dead. The goal is to be better today. #motivation #leadership #SF https://t.c…
100,665199705626808320,Fri Nov 13 16:09:03 +0000 2015,5,8,Facebook users generally fall into one of these 9 categories. https://t.co/PoGBEvL2t3 https://t.co/rgsn26HStJ
101,665052041123753987,Fri Nov 13 06:22:17 +0000 2015,0,4,Just do it https://t.co/sbPTmNpYcc
102,665031614695645184,Fri Nov 13 05:01:07 +0000 2015,54,74,This is a good lesson for leaders! #Startup #Entrepreneur #Leadership https://t.co/72n15CAoWH
103,665031262277533698,Fri Nov 13 04:59:43 +0000 2015,4,10,Woocomerce Coupon Code change by ronniehutchinson https://t.co/y9Jv05cuZq #php #websitedesign
104,665005196884516867,Fri Nov 13 03:16:08 +0000 2015,1,12,Turn inspiration into reality! https://t.co/kqlQMldwr0 via @johnrampton #ideas #research #competition https://t.co/qNbD612Q50
105,665001821585473536,Fri Nov 13 03:02:44 +0000 2015,1,7,How To Keep Doing It Right (More Often Than Not) via @mikevardy https://t.co/5nQugP6ST7 @productivityist https://t.co/H34f3mfXot
106,664998924659257344,Fri Nov 13 02:51:13 +0000 2015,6,0,RT @AshleyKSmalls: Why do I have to deal with Christmas commercials already when I haven't had Thanksgiving dinner yet?
107,664998563600986112,Fri Nov 13 02:49:47 +0000 2015,114,0,"RT @johnrampton: ""You can use an eraser on the drafting table or a sledge hammer on the construction site."" - FLW #planahead https://t.co/r…"
108,664998303822540800,Fri Nov 13 02:48:45 +0000 2015,29,0,RT @MurrayNewlands: When you tell people what to do you get workers. When you inspire people you get leaders. #leaders https://t.co/j5TcAC4…
109,664992060169043968,Fri Nov 13 02:23:56 +0000 2015,15,28,Nothing is permanent https://t.co/s6e7vJCAEL
110,664980316906323971,Fri Nov 13 01:37:16 +0000 2015,5,4,How to Dream up a Product or Book to Make Your Readers Drool via @WritetoDone https://t.co/FccZa0ykZ5 https://t.co/kpvAnkSOWf
111,664975988401532929,Fri Nov 13 01:20:04 +0000 2015,9,18,Choosing the right location for a business meeting is crucial. https://t.co/eGk4iFL220 @MurrayNewlands #business https://t.co/I50G9vea5F
112,664947764837507072,Thu Nov 12 23:27:55 +0000 2015,8,13,Every problem has a solution. You just have to be creative... https://t.co/l7bGWmvZuW #startupquote https://t.co/hxT76pgc5L
113,664925871363461120,Thu Nov 12 22:00:56 +0000 2015,8,11,Stay eager. - Susan Sontag #Entrepreneur https://t.co/rQXSV1FGc8
114,664912122535505920,Thu Nov 12 21:06:18 +0000 2015,5,9,Want better thinking and productivity? Improve the air quality in your office. https://t.co/LcqzbMACeT https://t.co/suF5c1xN25
115,664909683895898112,Thu Nov 12 20:56:36 +0000 2015,1,7,"Thanks for joining #influencerhour today, w/ guest host @JD_2020 and the usual crew @johnrampton , @murraynewlands and @cynthialive!"
116,664909579327705088,Thu Nov 12 20:56:11 +0000 2015,0,0,@WalrusWinks Our team has been experiencing problems all week!
117,664909429083676673,Thu Nov 12 20:55:35 +0000 2015,1,0,RT @WalrusWinks: Anyone else having trouble with Twitter analytics? Seems to have been down all day.  #Influencerhour
118,664909294853165056,Thu Nov 12 20:55:03 +0000 2015,3,0,RT @WalrusWinks: @SkyAboveLondon @Brand The brand is the star who breaks through the 15 minutes of fame ceiling.  #Influencerhour
119,664909280617721857,Thu Nov 12 20:55:00 +0000 2015,1,0,"RT @JD_2020: @Brand #InfluencerHour Hardly a fair question!! But If I had to choose, I'd have to say that @CallOfDuty (cont) https://t.co/p…"
120,664909241459720192,Thu Nov 12 20:54:51 +0000 2015,1,0,"RT @TheeSmashBeezy: @Brand ""Q3 What are the top platforms being used in the gaming community? #Influencerhour"" Other than comps/consoles, m…"
121,664909231259148288,Thu Nov 12 20:54:48 +0000 2015,1,0,"RT @TheeSmashBeezy: @Brand ""Last but never least, Q4. What are your all time favorite games to play? #Influencerhour""Tetris all-time, genre…"
122,664908332147175424,Thu Nov 12 20:51:14 +0000 2015,1,0,"RT @LatestSale: A4, #influencerhour, @Brand, @johnrampton, @MurrayNewlands, favourite games to play for market research @monsterhunter and …"
123,664908131881758720,Thu Nov 12 20:50:26 +0000 2015,1,0,RT @MurrayNewlands: @Brand Does @WordsWthFriends count?!#influencerhour
124,664908091700342784,Thu Nov 12 20:50:17 +0000 2015,0,0,@TheeSmashBeezy Thanks for coming back to join #Influencerhour!
125,664907310897061888,Thu Nov 12 20:47:10 +0000 2015,2,0,"RT @BriefBreak: @Brand Blizzard games are awesome and they have a really huge community. International tournaments, High cash prizes etc...…"
126,664907186229743616,Thu Nov 12 20:46:41 +0000 2015,1,0,RT @WalrusWinks: I got into @Twitter primarily as an attempt to promote #Alicewinks Lots of personal growth via #Influencerhour etc. but li…
127,664907164805271552,Thu Nov 12 20:46:36 +0000 2015,1,0,RT @WalrusWinks: @Brand A4. Grim Fandango. look forward to trying the new remastered one. (I prefer Adventure Games to shooters/GTA) #Influ…
128,664907153593884672,Thu Nov 12 20:46:33 +0000 2015,1,0,"RT @WalrusWinks: @emilyrose780 True. but it gets harder to break through as time goes by, it seems.  #Influencerhour"
129,664907137374625793,Thu Nov 12 20:46:29 +0000 2015,2,0,RT @TheXboxMom: @Brand social profiles have a ginormous influence on gamers and how they feel about their purchases #Influencerhour
130,664907117057347584,Thu Nov 12 20:46:24 +0000 2015,3,0,RT @johnrampton: Q3. @facebook's integration between social and games is a pretty interesting space #Influencerhour.
131,664906005365460992,Thu Nov 12 20:41:59 +0000 2015,0,7,#Influencerhour https://t.co/M9mxP39n8O
132,664905956342370304,Thu Nov 12 20:41:48 +0000 2015,0,4,@DonJornson Great answer! Don't forget to #Influencerhour.
133,664905510500470784,Thu Nov 12 20:40:01 +0000 2015,6,16,"Last but never least, Q4. What are your all time favorite games to play? #Influencerhour https://t.co/7BcQEossXc"
134,664904806641745920,Thu Nov 12 20:37:13 +0000 2015,2,0,RT @ManTripping: A3: YouTube is huge for gaming videos and live stream etc for gaming events like lan parties and tournaments #influencerho…
135,664904797317828608,Thu Nov 12 20:37:11 +0000 2015,2,0,"RT @LatestSale: A3, #influencerhour, @Brand, @johnrampton, top gaming platforms, YouTube gamers becoming more active"
136,664904758600142848,Thu Nov 12 20:37:02 +0000 2015,1,0,RT @WalrusWinks: @ManTripping @MurrayNewlands Celebrity brands like @taylorswift13 don't do blogs or email true?  #Influencerhour
137,664904736160657409,Thu Nov 12 20:36:57 +0000 2015,1,0,"RT @JD_2020: @Brand #InfluencerHour The top platforms for gaming right now are certainly Facebook, YouTube, (cont) https://t.co/YHwNvMaLLf"
138,664904655273459713,Thu Nov 12 20:36:37 +0000 2015,3,0,"RT @JD_2020: @MurrayNewlands @Brand @reddit Oh yes, how could I forget Reddit! Huge gaming sub-communities on there. #InfluencerHour"
139,664904513526980608,Thu Nov 12 20:36:04 +0000 2015,0,4,@WalrusWinks @ManTripping there is a lot of growth happening there! #influencerhour
140,664904198690054146,Thu Nov 12 20:34:48 +0000 2015,1,0,"RT @WalrusWinks: @ManTripping And YouTube is going tet-a-tet into streaming music, too! That is a big brand arena.  #Influencerhour"
141,664904191429640192,Thu Nov 12 20:34:47 +0000 2015,1,0,RT @ManTripping: @WalrusWinks @MurrayNewlands it's still social + still media. Blogs are still blogs aim/powow is the same as fb messengers…
142,664904153198518272,Thu Nov 12 20:34:38 +0000 2015,2,0,"RT @JD_2020: @Brand @WalrusWinks #InfluencerHour Absolutely. Take League of Legends, for example. There is an ... (cont) https://t.co/E0bBw…"
143,664904134869454848,Thu Nov 12 20:34:33 +0000 2015,1,0,"RT @WalrusWinks: @ManTripping @MurrayNewlands Chat rooms, reddit, email forums were not quite the same as the mass social media of today.  …"
144,664903112935653376,Thu Nov 12 20:30:30 +0000 2015,3,0,"RT @WalrusWinks: There are surely a few ""Youtube stars"" and ""Snapchat stars"" who have built a social media brand, but they are a small #  #…"
