,id_str,created_at,retweet_count,favorite_count,text
145,664903040827195392,Thu Nov 12 20:30:12 +0000 2015,2,0,"RT @johnrampton: @Brand Social profiles allow communities to interact directly with their favorite games + motifs, they have huge influence…"
146,664903003590164481,Thu Nov 12 20:30:04 +0000 2015,5,0,RT @MurrayNewlands: Gaming communities can easily be found on platforms like @reddit. #influencerhour
147,664902561955102720,Thu Nov 12 20:28:18 +0000 2015,2,0,"RT @ManTripping: That being said I ran video game news sites in the 90s ""pre social media"" because that's where the gamers. Still true toda…"
148,664902396527575040,Thu Nov 12 20:27:39 +0000 2015,5,12,Q3. What are the top platforms being used in the gaming community? #Influencerhour https://t.co/OLEVGh7pqP
149,664901712629530624,Thu Nov 12 20:24:56 +0000 2015,0,2,@LatestSale @Serious_Factory @CyrilJIGUET Thanks for joining us again! #Influencerhour
150,664901594706608129,Thu Nov 12 20:24:28 +0000 2015,4,0,RT @JD_2020: @Brand #InfluencerHour Absolutely! At a rate and volume never seen before. As social media grows and... (cont'd): https://t.co…
151,664901566181183488,Thu Nov 12 20:24:21 +0000 2015,0,3,@ManTripping Thanks for joining us again #InfluencerHour
152,664901457284456448,Thu Nov 12 20:23:55 +0000 2015,2,0,RT @johnrampton: @Brand video games are an industry w/global revenues in excess of $100 billion/yr buyers are definitely looking at social!…
153,664901447675310080,Thu Nov 12 20:23:53 +0000 2015,5,0,RT @WalrusWinks: I have not found social media to be a way to build brand. I think you have to already have strong brand.  #Influencerhour
154,664900176318894080,Thu Nov 12 20:18:49 +0000 2015,0,4,@WalrusWinks @johnrampton @JD_2020 Probably could answer that question better... @CallofDuty has a super strong following. #InfluencerHour
155,664899404336238592,Thu Nov 12 20:15:45 +0000 2015,4,0,RT @JD_2020: @JD_2020 (cont'd) every type interfaces with audience differently bringing unique value to whatever a gamer is looking for. #I…
156,664899331078492160,Thu Nov 12 20:15:28 +0000 2015,4,15,Q2. Are gamers relying on social media to get information about new releases? #InfluencerHour https://t.co/71cGFPG7OV
157,664899045110910977,Thu Nov 12 20:14:20 +0000 2015,1,0,"RT @JD_2020: #InfluencerHour: Best part of social for games are the breadth of channel types. Brands, personalities, influencers. https://t…"
158,664897253530800128,Thu Nov 12 20:07:13 +0000 2015,1,4,Coping with loss in the Facebook era via @socialnerdia https://t.co/iXwxSXNmYe #'afeatures #'aissuetitles
159,664896064541986817,Thu Nov 12 20:02:29 +0000 2015,11,20,Q1. How are gaming social profiles influencing their communities? #influencerhour https://t.co/y7KkEBctWI
160,664894032825315328,Thu Nov 12 19:54:25 +0000 2015,2,4,"10 mins until #Influencerhour with @johnrampton, @MurrayNewlands, @CynthiaLIVE  and guest host @JD_2020! https://t.co/AbVCvCQ33y"
161,664876277271171072,Thu Nov 12 18:43:51 +0000 2015,11,9,Don’t measure anything unless the data helps you make a better... https://t.co/B3PlYPpH40 #sethgodin https://t.co/YH0EfpovsO
162,664874092667899908,Thu Nov 12 18:35:11 +0000 2015,4,9,Paying close attention to your analytics will set you apart! https://t.co/Vz7tUyGCFo via @johnrampton #analytics https://t.co/S55NN8m1vY
163,664850616594763776,Thu Nov 12 17:01:53 +0000 2015,7,15,All The Productivity Tips You Need In 9 Infographics https://t.co/0IuHpUYf6P #productivity https://t.co/GzzNQ1QPTy
164,664841622820007936,Thu Nov 12 16:26:09 +0000 2015,63,62,Do not settle for less.#win https://t.co/bAcV84EztZ
165,664841085038911488,Thu Nov 12 16:24:01 +0000 2015,16,0,"RT @MurrayNewlands: Wake up every morning with a smile on your face, go through the day withyour head up and don't let words ge... https://…"
166,664800914797039616,Thu Nov 12 13:44:24 +0000 2015,4,8,How Do You Keep Your Freelance Work Organized? via @odesk https://t.co/J3V3BWOMHX #thewaywework #tiptuesday https://t.co/pgi5NCAk9T
167,664800340823244801,Thu Nov 12 13:42:07 +0000 2015,85,105,Hair care branding done right. #influencermarketing #branding https://t.co/MJ1cOoptHa
168,664694798935199744,Thu Nov 12 06:42:44 +0000 2015,101,0,RT @Entrepreneur: 5 Hobbies That Can Make You Smarter (Infographic) https://t.co/lmXVHUabhp https://t.co/aaOmOMU840
169,664694073186381824,Thu Nov 12 06:39:51 +0000 2015,130,0,RT @Entrepreneur: You'll be a productivity machine if you stop trying to do everything yourself https://t.co/Hpd5e8etRl
170,664689262072229888,Thu Nov 12 06:20:44 +0000 2015,284,0,"RT @johnrampton: You are what you do, not what you say you'll do. #followthrough #integrity #character https://t.co/QBhuDHaRwB"
171,664688739877175296,Thu Nov 12 06:18:39 +0000 2015,31,45,Say something amazing https://t.co/BEyTu76Sm0
172,664681160312655873,Thu Nov 12 05:48:32 +0000 2015,1,4,Which do you find works best @OpenTable or @Yelp #food #hungry #restaurantmarketing
173,664679446029336576,Thu Nov 12 05:41:43 +0000 2015,13,24,Live life to the full https://t.co/i44zjjMWcc
174,664676589246898177,Thu Nov 12 05:30:22 +0000 2015,113,0,"RT @BrainyQuote: What is forgiven is usually well remembered. - Louis Dudek
https://t.co/6yprqbXiaU #forgiveness #QOTD https://t.co/o1PDt9a…"
175,664672820207738881,Thu Nov 12 05:15:24 +0000 2015,48,53,"""Keep some room in your heart for the unimaginable."" - Mary Oliver #vision #leadership #poetry https://t.co/dIJsCKY3WA"
176,664663865003606016,Thu Nov 12 04:39:48 +0000 2015,17,30,Everything is a risk. Stay strong and live life https://t.co/cBLWbici24
177,664663112784580608,Thu Nov 12 04:36:49 +0000 2015,26,0,"RT @MurrayNewlands: The strongest people aren't always the people who win, but the people whodon't give up when they lose. #mot... https://…"
178,664663009172713473,Thu Nov 12 04:36:24 +0000 2015,33,34,"Before you assume, learn. Before you judge, understand. Before you hurt, feel. Before you say, think."
179,664662401694875648,Thu Nov 12 04:34:00 +0000 2015,110,0,"RT @johnrampton: This is an essential quote for entrepreneurs! At the end of the day, you have to start #creating. https://t.co/AXz0NcbmQY"
180,664628705038376960,Thu Nov 12 02:20:06 +0000 2015,4,7,Black Friday is coming up soon! Are there any brands you're especially excited to shop? #BlackFriday #Sale https://t.co/5Dqv30PGi1
181,664578657869037568,Wed Nov 11 23:01:13 +0000 2015,2,9,Looking for new music? Check out @AliBrustofski: https://t.co/mNP0D9UUKh via @MurrayNewlands #YouTube #music https://t.co/ARWrxYCSsR
182,664577675063758852,Wed Nov 11 22:57:19 +0000 2015,8,12,*** The secret to excel in social listening is the use of right tools and strategies whi... https://t.co/YwO2PmSfed https://t.co/cXu3Wl5UD8
183,664543154276839424,Wed Nov 11 20:40:09 +0000 2015,4,10,Struggling to fund your startup? Here's the key: https://t.co/uUFGa34pen  @MurrayNewlands #financial #investment https://t.co/Pv0LHm7CA7
184,664491594490519552,Wed Nov 11 17:15:16 +0000 2015,15,38,Your ship comes in because you're the captain of it. - #PattiSmith #quotes #success https://t.co/uN0k3pDEDv
185,664478343274729472,Wed Nov 11 16:22:37 +0000 2015,12,17,Start your day right https://t.co/ZmAUaOqsUE
186,664477936083316736,Wed Nov 11 16:21:00 +0000 2015,17,0,RT @MurrayNewlands: Follow your dreams. #motivation #dreams https://t.co/OWuBuGuDUq
187,664458742331670529,Wed Nov 11 15:04:43 +0000 2015,1,7,Which is best #sprint or #at&amp;t ?
188,664334364851855360,Wed Nov 11 06:50:29 +0000 2015,3,7,How to block Valentine's Day from Facebook via @CNET https://t.co/9PVTzBbYyX https://t.co/uiZ23uxXoZ
189,664324555037544448,Wed Nov 11 06:11:31 +0000 2015,7,12,Why Consistency Powers Productivity via @mikevardy https://t.co/LdG9RpnlTK @productivityist #routines https://t.co/y6WooFuCmI
190,664310748206600194,Wed Nov 11 05:16:39 +0000 2015,1,5,"WhatsApp for Android now allows all users to make voice calls, iOS coming soon via @aghoshal https://t.co/TewWbY7CkG @socialnerdia"
191,664306669317283840,Wed Nov 11 05:00:26 +0000 2015,5,15,Did any of you take a sick day today? #Fallout4 https://t.co/W8Hu99a7Dx
192,664303607198564352,Wed Nov 11 04:48:16 +0000 2015,11,12,By Mistake: 6 Things You Do That Kill Your Productivity via @JWhite https://t.co/mElyVce4S4 #success https://t.co/VmWT1MF0Iu
193,664288406906601472,Wed Nov 11 03:47:52 +0000 2015,7,17,"Absolutely. Positively. Irrevocably. And  NEVER forget that! ""The LORD will accomplish w... https://t.co/CFPKEkxDhc https://t.co/aW3QvfMyyK"
194,664285200512360449,Wed Nov 11 03:35:08 +0000 2015,21,36,Still struggling to understand SEO? Here are 5 mistakes to avoid: https://t.co/JlZsFRbr71 via @simplilearn #SEO https://t.co/PZPvDt7XrK
195,664275268022865920,Wed Nov 11 02:55:40 +0000 2015,2,3,"Onsite dishwashing facility helps F&amp;B outlets save on manpower, increase ... https://t.co/HOslhvVqig https://t.co/8pZklmu8U4"
196,664256706264698880,Wed Nov 11 01:41:54 +0000 2015,13,25,UK-based graphic designer Ben Fearnley has created a series of inspirational typography ... https://t.co/6FQwaEBLto https://t.co/aPwnnkZ9SQ
197,664247422575579136,Wed Nov 11 01:05:01 +0000 2015,5,10,Which Social Media Trends Should Your Startup Invest in Next Year? https://t.co/OLrtK5Eno6 via @BrettRelander https://t.co/Nm1ujSfi8A
198,664245390493921280,Wed Nov 11 00:56:56 +0000 2015,8,11,"She dances to the songs in her head, speaks with the rhythm of her heart and loves from ... https://t.co/yFiax3SD4g https://t.co/b0lvJfuYrk"
199,664236242146471938,Wed Nov 11 00:20:35 +0000 2015,1,4,Logotip by janbazooka https://t.co/sP3KQiE1hz #graphicdesign #logodesign https://t.co/QNEWfNSyCI
