,id_str,created_at,retweet_count,favorite_count,text
0,661828385040125952,Wed Nov 04 08:52:37 +0000 2015,5,6,First team 'outta-the-box' for the 2016 Series... https://t.co/aIXFbNTi46 https://t.co/E6BeMnfKP2
1,658618696374603776,Mon Oct 26 12:18:28 +0000 2015,4,0,Norwegian public TV NRK caught Rasmus Køstner flying... https://t.co/zkFTKJvUpo…/se-han-flyr-over-vannet-1.12615066 https://t.co/tk05SWywu9
2,657474383838097408,Fri Oct 23 08:31:23 +0000 2015,6,2,Props to Kristianssand Seilforening for endorsing the #one4 Project https://t.co/yYW7BwC3IY
3,653576742947393536,Mon Oct 12 14:23:33 +0000 2015,9,14,"Usually We run after cats, but some people run for their lives. Help support the charity of the One4 Project #one4 http://t.co/AAT65o9ire"
4,650673638803439616,Sun Oct 04 14:07:39 +0000 2015,3,0,"Congratulations to The Wave, Muscat for a convincing win in Act 7 and Oman for hanging on to the last securing 2nd!"
5,650670948471980033,Sun Oct 04 13:56:57 +0000 2015,2,2,Podium secured; 3rd place!
6,650647611951681537,Sun Oct 04 12:24:13 +0000 2015,2,1,Leading race 6 of the day. They may have regained 2nd place overall in Act 7 if this holds to the finish...
7,650639334383726593,Sun Oct 04 11:51:20 +0000 2015,2,0,Very close racing; two bullets and closing the gap to Oman trailing by 6 points after 5 races...
8,650609438257213441,Sun Oct 04 09:52:32 +0000 2015,1,6,Just did the pre-race flyby for the shore audience... Game is on! http://t.co/5kqQ1aKCJT
9,650606233070735360,Sun Oct 04 09:39:48 +0000 2015,0,0,20 mins. to Live feed at http://t.co/GJrnwkYOlf
10,650595399057702912,Sun Oct 04 08:56:45 +0000 2015,11,0,"An hour before the start of the first race, wind is dropping to 4-8 knots making this a light wind affair... http://t.co/BSVUEcuaYC"
11,650580092050128896,Sun Oct 04 07:55:55 +0000 2015,3,2,Todays racing will be determined by calls from tactician Rasmus Køstner; today is a game of catching puffs! http://t.co/odMffmDbbd
12,650346444155715588,Sat Oct 03 16:27:29 +0000 2015,2,3,Sooo ready for tomorrow! http://t.co/fGZWGDLYeb
13,650345706218237956,Sat Oct 03 16:24:33 +0000 2015,7,3,What a day; ups and Downs and the notorious 'Black cat crossing the road' resulting in 2 DNS's... http://t.co/Zd5HM0NrH7
14,650293716305989636,Sat Oct 03 12:57:58 +0000 2015,3,1,"Ouch, DNS twice... lost two races due to halyard problems. Brad did a tremendous job up in the mast for over 20 mins! http://t.co/X2Kancnsab"
15,650271278692204544,Sat Oct 03 11:28:48 +0000 2015,5,8,Going South down the Bosphorus strait... http://t.co/jZqsTdwWHm
16,650225328833622016,Sat Oct 03 08:26:13 +0000 2015,4,3,Time for guests to hop onboard an get a blast of their life before course racing starts... http://t.co/LbcjjoBSim
17,650210287975596032,Sat Oct 03 07:26:27 +0000 2015,2,3,Though the Bosporus Race is an hour long the points awarded are only counting as one course race. http://t.co/WXdV9C9h66
18,650196409766014976,Sat Oct 03 06:31:18 +0000 2015,2,2,Time for Bosphorus racing in 25 mins. Track us live at http://t.co/GJrnwkYOlf
19,649961515953586177,Fri Oct 02 14:57:55 +0000 2015,2,0,"The day ended with placings of 6,1,6,4,4,1,1,4 consolidating the second place overall in Act 7 with 114 points – trailing The Wave."
20,649940975335436288,Fri Oct 02 13:36:18 +0000 2015,2,1,SAP is sailing red hot at the moment; Bullet in race 13 and now leading race 14! http://t.co/ITzSJHSrQy
21,649922552010248192,Fri Oct 02 12:23:06 +0000 2015,4,2,Broken shroud apparently. We hope all are safe and see them return for tomorrows racing... #extremesailingseries http://t.co/gK78W2Vz2z
22,649913030378156032,Fri Oct 02 11:45:15 +0000 2015,2,0,Bullet for the team in Race 2; Red Bull (the podium rival) is upside Down now...
23,649911175921147904,Fri Oct 02 11:37:53 +0000 2015,1,0,"Race Day 2 is on, second race started in very shifty conditions. Follow the races at http://t.co/GJrnwkYOlf"
24,649811249417555968,Fri Oct 02 05:00:49 +0000 2015,2,1,Well rested and ready for the 2nd day in Istanbul. Mentally a tough day if it gets too flukey... Bring it on! http://t.co/mQBxcoAbXS
25,649685775882289153,Thu Oct 01 20:42:14 +0000 2015,11,7,https://t.co/6qZq5Frg2x
26,649685574366941186,Thu Oct 01 20:41:26 +0000 2015,1,1,"Today's a wrap. A series of 3, 3, 4, 1, 4, 5, 1 of 8 teams ends the day at second place. https://t.co/GJrnwkYOlf"
27,649685240320032768,Thu Oct 01 20:40:06 +0000 2015,2,1,"Today's a wrap. A series of 3, 3, 4, 1, 4, 5, 1 of 8 teams ends the day at second place. https://t.co/GJrnwkYOlf https://t.co/N4rj3ApKKq"
28,649592256295473152,Thu Oct 01 14:30:37 +0000 2015,2,2,"Second bullet of the day for SAP Extreme Sailing, concluding the first day of Act 7 in Istanbul..."
29,649581522115239936,Thu Oct 01 13:47:58 +0000 2015,1,3,Just nailed a bullet in race 3!!!
30,649487744666857472,Thu Oct 01 07:35:19 +0000 2015,4,2,Game on and pumped up! Wind is picking up so we will be in the 10-20 knot range with shifty conditions.
31,649445290148278272,Thu Oct 01 04:46:37 +0000 2015,1,0,"Dull weather at Bosphorus; cloudy, rainy and 20c, but wind is picking up. Boys are beefin' up with a solid breakfast and in combat mode..."
32,648768859852414976,Tue Sep 29 07:58:44 +0000 2015,5,1,Ready for last 2015 act of the Extreme Sailing Series in Istanbul? We are!!! The fight at the Bosphorus Strait is just around the corner...
33,635440173132742656,Sun Aug 23 13:15:17 +0000 2015,3,13,Mads Emil pushes hard to wring every last drop of speed out of the #Extreme40 on the final day of Act 6. #KeepPushing http://t.co/YIN8l90DiB
34,634676995230728192,Fri Aug 21 10:42:42 +0000 2015,3,0,Get ready for today's #ESS racing in St Petersburg by jumping aboard @SAPExtremeSail with @bradfarrand - http://t.co/puApwxoFxR
35,634274913180876800,Thu Aug 20 08:04:58 +0000 2015,2,2,"As we wait for racing to kick-off, watch out boatbuilder @rconde88 work magic on a battle scarred SAP Extreme http://t.co/5w71AOwehm."
36,625318705514291200,Sun Jul 26 14:56:11 +0000 2015,1,7,Thanks for watching and thanks for supporting your team @SAPExtremeSail. Tune in again for St.Petersburg in a couple of weeks Signing off
37,625317847871393792,Sun Jul 26 14:52:47 +0000 2015,2,8,"Well done @SAPExtremeSail taking 3rd overall in Act 5 here in Hamburg, Germany at the @extremesailing http://t.co/1jhxF7TIPi"
38,625317484959297536,Sun Jul 26 14:51:20 +0000 2015,2,1,Well done Gazprom for one of the greatest races in Act 5 of the #EXSS and of course to The Wave for the win.@SAPExtremeSail take 3rd overall
39,625316960407015424,Sun Jul 26 14:49:15 +0000 2015,1,0,The wind is gone really light and Gazprom rolls @SAPExtremeSail on the line
40,625316523310219264,Sun Jul 26 14:47:31 +0000 2015,1,0,"Was there contact with between @SAPExtremeSail and Gazprom, we don’t think so.."
41,625316374655692802,Sun Jul 26 14:46:56 +0000 2015,1,0,"@SAPExtremeSail now looking to put The Wave between them and Gazprom, what a race and so tactical #EXSS"
42,625316173329121280,Sun Jul 26 14:46:08 +0000 2015,2,0,@SAPExtremeSail have crossed Gazprom.. Who will take 2nd overall #EXSS
43,625315891719372800,Sun Jul 26 14:45:01 +0000 2015,1,0,The guys break and split from Gazprom on the last leg #EXSS
44,625315720839208960,Sun Jul 26 14:44:20 +0000 2015,1,0,Can we do it…. its nail biting stuff as we approach the finish @SAPExtremeSail and The Wave pushing us out
45,625315392559431680,Sun Jul 26 14:43:02 +0000 2015,1,0,We need to roll any boat now to take 2nd overall.. #exss #pressure
46,625314811195359232,Sun Jul 26 14:40:43 +0000 2015,1,0,Looking for a boat between us and Gazprom for 2nd overall #nervous #EXSS #Bigpressure but amazing to watch
47,625314585923448832,Sun Jul 26 14:39:49 +0000 2015,3,3,The Wave keeping a close eye on @SAPExtremeSail as they round the bottom mark http://t.co/lsIzczXaNW
48,625314294171869188,Sun Jul 26 14:38:40 +0000 2015,1,0,So we are back for the double point race and @SAPExtremeSail are currently in 4 in the final race of the day applying pressure to The Wave
49,625312518311964672,Sun Jul 26 14:31:36 +0000 2015,1,0,"The final race is double points so its all to play for @extremesailing live from Hamburg, Germany #exss  Good luck @SAPExtremeSail #keepitup"
50,625311503315562496,Sun Jul 26 14:27:34 +0000 2015,1,1,"Getting caught at the top mark as we come to the finish, the guys will finish in 6th #EXSS"
51,625310761284423680,Sun Jul 26 14:24:37 +0000 2015,2,0,"RT @exssLIVE: .@SAPExtremeSail looking like they are searching for some good pressure in 4th, Team Turx following close behind #exss"
52,625310651091709953,Sun Jul 26 14:24:11 +0000 2015,1,0,"This is tough to watch. Positions changing all the time, the Wave is back and we lie 4th #EXSS"
53,625309962496004096,Sun Jul 26 14:21:27 +0000 2015,1,0,"@SAPExtremeSail tack on the line, slow but building speed now and taking 4th"
54,625309232926208000,Sun Jul 26 14:18:33 +0000 2015,2,0,"A big race ahead, shortened course so picking the correct side of the beat is key and so is the starts @SAPExtremeSail #EXSS Race 6 Day 4"
55,625307566571171840,Sun Jul 26 14:11:56 +0000 2015,2,0,"RT @exssLIVE: Great 6th place from @SAPExtremeSail after their penalty start they still managed to jump to teams, Team Germany 7th #exss"
56,625306605249261568,Sun Jul 26 14:08:06 +0000 2015,2,0,"So managed to roll @RedbullRacing and Team Germany to take 6th place as we come to the finish of Race 5, the final day of #EXSS"
57,625305633206730752,Sun Jul 26 14:04:15 +0000 2015,1,0,"@SAPExtremeSail looking to make some places up here, closing in on the pack.. #EXSS"
58,625304754877530112,Sun Jul 26 14:00:45 +0000 2015,2,1,Off we go now having taken our penalty and we go to the left upwind  @SAPExtremeSail #EXSS
59,625304496038641664,Sun Jul 26 13:59:44 +0000 2015,1,0,"Race 5 will get underway soon, starting with a penalty of 45secs before we can start due to @GACPindar in previous race #EXSS #badluck"
60,625303790447689728,Sun Jul 26 13:56:55 +0000 2015,1,0,Umpires give 45sec delay in next race due to decision over collision with @GACPindar to @SAPExtremeSail #EXSS @exssLIVE
61,625302261091143680,Sun Jul 26 13:50:51 +0000 2015,2,1,We are now TV live on http://t.co/GJrnwkYOlf welcome back @Jopickard &amp; @nickmoloney #EXSS Support your team @SAPExtremeSail
62,625301449094877188,Sun Jul 26 13:47:37 +0000 2015,1,0,Race 4 in the #EXSS @SAPExtremeSail take 2nd place
63,625301075227201540,Sun Jul 26 13:46:08 +0000 2015,3,3,A luffing match between @SAPExtremeSail and The Wave as they approach top mark #MatchRacing #EXSS http://t.co/ZaqswuhSG4
64,625300423931527168,Sun Jul 26 13:43:33 +0000 2015,2,0,RT @exssLIVE: .@SAPExtremeSail have come back meaning business rounding the mark first with The Wave chasing with Team Turx and Oman Air #e…
65,625300184533213184,Sun Jul 26 13:42:36 +0000 2015,1,0,Hulls flying and heart in mouth for @SAPExtremeSail as The Wave putting the pressure on #EXSS
66,625299746916278272,Sun Jul 26 13:40:51 +0000 2015,2,3,@SAPExtremeSail the boys are back out in front #EXSS #Race4 http://t.co/azqND82joe
67,625299537742200832,Sun Jul 26 13:40:01 +0000 2015,1,1,@SAPExtremeSail do well to take mark 1 in 1st #EXSS
68,625299182941827073,Sun Jul 26 13:38:37 +0000 2015,2,0,@SAPExtremeSail Race 4 start the boys choose a port start and working the right side of the course
69,625298937818255361,Sun Jul 26 13:37:38 +0000 2015,1,0,"Race 4 about to start, they boys need your support, tweet us @SAPExtremeSail and wish your team luck in a come back from todays racing #EXSS"
70,625297047336435712,Sun Jul 26 13:30:08 +0000 2015,1,0,@SAPExtremeSail happy to say all crew safe and @GACPindar out due to damaged bowsprit #EXSS
71,625296652870516737,Sun Jul 26 13:28:34 +0000 2015,9,5,Heres a close up from @SAPExtremeSail photog Tristan Stedman @GACPindar collision @extremesailing @exssLIVE #EXSS http://t.co/ZYup662moT
72,625295948013531136,Sun Jul 26 13:25:46 +0000 2015,23,21,Here’s the photos you’ve all been waiting from @GACPindar collision with @SAPExtremeSail Day 4 @extremesailing #crash http://t.co/kDBkaOuNcp
73,625295397649575938,Sun Jul 26 13:23:34 +0000 2015,2,1,"That collision didn’t help, more later on what exactly happened. Just finishing up here for race 3 in 7th"
74,625293403765481472,Sun Jul 26 13:15:39 +0000 2015,10,0,RT @extremesailing: Collision between @SAPExtremeSail &amp; @GACPindar on the line-All crew confirmed ok. The safety team now trying to separat…
75,625292620902858752,Sun Jul 26 13:12:32 +0000 2015,1,0,Oh! having an big issue with GAC. Not going well in the starts today..
76,625292360298139649,Sun Jul 26 13:11:30 +0000 2015,1,0,Race 3 - The boys stick close to the Wave off the start line… clear air and out the front
77,625292089492918272,Sun Jul 26 13:10:26 +0000 2015,3,3,"We are now lying 2nd overall after 2 races today. Final day at the #EXSS Hamburg, Germany. Photo: © Tristan Stedman http://t.co/tb7zxhiFD0"
78,625288428565962752,Sun Jul 26 12:55:53 +0000 2015,1,0,Thats it for Race 2 and we’ll take 3rd spot. Holding on in there #EXSS
79,625287211769069568,Sun Jul 26 12:51:03 +0000 2015,2,0,RT @carriemcneill: @omanair cabin crew welcomes @SAPExtremeSail back after yesterday's crash #exss http://t.co/N3OnpkYDF0
80,625287195906191360,Sun Jul 26 12:50:59 +0000 2015,1,0,Now jumped Team Turx’s for 3rd place as they head back downwind #EXSS
81,625286963030003713,Sun Jul 26 12:50:03 +0000 2015,2,0,Powering up the course and trying to take 3rd from the Turx #EXSS http://t.co/h0NF0poZvg
82,625286711321477120,Sun Jul 26 12:49:03 +0000 2015,1,0,"Now lying in 4th as we take the left gate in the second upwind leg, we can still to this #Believe #EXSS"
83,625285981122506753,Sun Jul 26 12:46:09 +0000 2015,1,0,Catching the front runners now… Race 2 #EXSS
84,625285664167301120,Sun Jul 26 12:44:54 +0000 2015,1,0,@SAPExtremeSail taking a penalty now as they were OCS #EXSS
85,625285344561393664,Sun Jul 26 12:43:38 +0000 2015,1,1,"@SAPExtremeSail Race 2 - Day 4 - opting for a mid fleet start this time around close to the Wave, sailing carefully now"
86,625284609127903232,Sun Jul 26 12:40:42 +0000 2015,2,0,RT @exssLIVE: AP down - 4 minutes to go for the start of Race 2  #exss
87,625283840429395968,Sun Jul 26 12:37:39 +0000 2015,1,1,"Looking to improve for Race 2, Day 4 here in Germany. Only 2 points separate @SAPExtremeSail from The Wave #EXSS #PressureisON"
88,625281646485487617,Sun Jul 26 12:28:56 +0000 2015,1,0,5th place result in Race 1 of Day 4 at the #EXSS Germany. Time to dust off and reset for Race 2. @SAPExtremeSail
89,625281319958880256,Sun Jul 26 12:27:38 +0000 2015,1,0,A nice manoeuvre on Oman Air sees us up to 5th now coming into the finish
90,625280303200866304,Sun Jul 26 12:23:36 +0000 2015,1,0,Not too sure what’s happened as they approached the windward mark but we are back in 8th now #EXSS
91,625279590123094016,Sun Jul 26 12:20:46 +0000 2015,0,0,"Penalty taken, looking now to push back on the leaders, currently 3rd, Race 1 Day 4 #EXSS"
92,625279161305837568,Sun Jul 26 12:19:03 +0000 2015,1,0,RT @exssLIVE: Penalty for @SAPExtremeSail for not allowing space around the mark #exss
93,625278813887406080,Sun Jul 26 12:17:41 +0000 2015,0,0,"@SAPExtremeSail coming back into this after a less than average start, rounding mark 1 in 3rd"
94,625278329000718337,Sun Jul 26 12:15:45 +0000 2015,0,0,"Race 1 - Day 4 - the boys start at the committee boat end and have a tricky one, currently trailing the fleet #EXSS"
95,625277854566236160,Sun Jul 26 12:13:52 +0000 2015,1,0,RT @exssLIVE: Good wind and extra strong tides are going to make this start very exciting #exss
96,625277728749694976,Sun Jul 26 12:13:22 +0000 2015,0,1,"Race 1 - Day 4 of Act 5 of the #EXSS is about to start, wish the team luck on holding onto the top spot @SAPExtremeSail #Goodluck"
97,625271746162237440,Sun Jul 26 11:49:35 +0000 2015,0,1,"Jes Gram-Hansen quoted this morning ""We are ready to race today &amp; hopefully we can play for the victory in the races today here in Hamburg"""
98,625256707309076480,Sun Jul 26 10:49:50 +0000 2015,1,2,"@extremesailing coverage starts in 1 hr, looks like a lively day of racing. Photo courtesy of http://t.co/wxL9nfIfiF http://t.co/NBxGwNq0bZ"
99,625254158673793024,Sun Jul 26 10:39:42 +0000 2015,5,0,"RT @hannahwhiteuk: Wow, just caught up with the @extremesailing action from today. Looks like @SAPExtremeSail had a big day. hope they are …"
100,625253564710039552,Sun Jul 26 10:37:21 +0000 2015,3,0,RT @othermilan: Win an #exss act after a capsize? Anyone done it before? Should be a good motivation for today! @SAPExtremeSail @extremesai…
101,625253526575411200,Sun Jul 26 10:37:12 +0000 2015,6,0,RT @exssLIVE: Final day of Act 5 and we are on for another windy and exciting afternoon. Stay tuned for updates - Check-in opens at 1405 (G…
102,624963881321021440,Sat Jul 25 15:26:15 +0000 2015,11,4,The shots of the day as @SAPExtremeSail go swimming Photo: Tristan Stedman Race 5 - Day 3 @extremesailing #EXSS http://t.co/3DkzNtqxJk
103,624955847748263937,Sat Jul 25 14:54:19 +0000 2015,1,1,"So that’s it for the day, the weather  isn’t playing fair and racing is over for today #EXSS we’ll have more later on our FB page. Bye folks"
104,624955504863879168,Sat Jul 25 14:52:58 +0000 2015,2,0,"RT @exssLIVE: Wow, how exciting last race here in Hamburg. The squally weather is back, with strong winds and rain, no more racing today fo…"
105,624953459012444160,Sat Jul 25 14:44:50 +0000 2015,4,0,RT @extremesailing: Capsize for @SAPExtremeSail in front of the crowds here on the River Elbe! All crew safe and unhurt. #exss
106,624953333124608001,Sat Jul 25 14:44:20 +0000 2015,2,1,The guys are apparently all good and now try to get the boat upright for Race 6 today. #EXSS
107,624953135275114496,Sat Jul 25 14:43:33 +0000 2015,5,2,@SAPExtremeSail have one as they capsize on the last leg of race 5 today http://t.co/KQJ8qLZEne
108,624952637163704321,Sat Jul 25 14:41:34 +0000 2015,1,0,@SAPExtremeSail capzise in Race 5 - Day 3 in Hamburg Germany
109,624952257231089664,Sat Jul 25 14:40:03 +0000 2015,1,0,Wow! @SAPExtremeSail nearly had a capsize at the top mark #EXSS
110,624951896156061696,Sat Jul 25 14:38:37 +0000 2015,1,0,Big Breeze on now as @SAPExtremeSail trail Redbull in second place
111,624951373306667008,Sat Jul 25 14:36:33 +0000 2015,1,0,@SAPExtremeSail take the right - side of the course with more breeze.. Now into 2nd place
112,624951168486244352,Sat Jul 25 14:35:44 +0000 2015,1,0,Race 5 - Day 3 of Act 5 in the #EXSS gets off to a mid fleet start
113,624950338521559040,Sat Jul 25 14:32:26 +0000 2015,3,0,RT @exssLIVE: Results after 18 races #exss http://t.co/RTi0wHYjca
114,624948778315980800,Sat Jul 25 14:26:14 +0000 2015,1,0,@SAPExtremeSail ended up battling it out with closest rival Gazprom finishing in 7th with half a boat length between them #EXSS
115,624948141784231936,Sat Jul 25 14:23:42 +0000 2015,1,0,@SAPExtremeSail and Gazprom battling it out for 7th spot #EXSS
116,624947511166431232,Sat Jul 25 14:21:12 +0000 2015,2,1,"Lots of work to do for @SAPExtremeSail but that’s not going to stop them, they can come back from this, a tight group"
117,624947337782296576,Sat Jul 25 14:20:30 +0000 2015,1,0,The boys are really struggling in the pack and taking up the rear in 7th #EXSS
118,624946886278008832,Sat Jul 25 14:18:43 +0000 2015,1,0,@SAPExtremeSail takes the left side of the first beat and dropped off a little into 4th place now. #EXSS
119,624946512490053632,Sat Jul 25 14:17:14 +0000 2015,1,0,"Big gust, all furling the genres now…."
120,624946386614796288,Sat Jul 25 14:16:44 +0000 2015,1,0,Race 4 - Day 3 - #EXSS @SAPExtremeSail worked the start well and unfurled the Gennaker
121,624944037674504193,Sat Jul 25 14:07:24 +0000 2015,2,0,"Now with a 7pt lead after 17 races over Gazprom, the boys on @SAPExtremeSail will be happy if the results keep coming. Consistency is key!"
122,624943219449692160,Sat Jul 25 14:04:09 +0000 2015,3,0,"RT @exssLIVE: .@RedBullSailing take the win, closely followed by @SAPExtremeSail in 2nd, and Team Turx already celebrating their 3rd #exss"
123,624943046258466816,Sat Jul 25 14:03:27 +0000 2015,1,0,"The team @SAPExtremeSail will be happy to take 2nd place in Race 3 of Day 3 in Hamburg, Germany #EXSS"
124,624942609232998404,Sat Jul 25 14:01:43 +0000 2015,2,0,"The guys on @SAPExtremeSail are holding their 2nd place, happy to have plenty of boats between them and Team Russia"
125,624941943114571776,Sat Jul 25 13:59:04 +0000 2015,1,0,@SAPExtremeSail holding on to 2nd place on the first windward rounding #EXSS
126,624941742740140032,Sat Jul 25 13:58:16 +0000 2015,2,0,"A massive mix of boats now, positions could change a lot now Race 3 - Day 3 #EXSS"
127,624941505472561152,Sat Jul 25 13:57:20 +0000 2015,1,1,"@SAPExtremeSail taking the lead and choosing the right side of course, Gasprom looking strong on the right side"
128,624941208108965888,Sat Jul 25 13:56:09 +0000 2015,2,0,Race 3 - Day 3 at the #EXSS underway with SAP taking the lead from the start!
129,624939616949420033,Sat Jul 25 13:49:50 +0000 2015,5,0,RT @extremesailing: The overall results after the 2 races sailed today- @SAPExtremeSail are now leading by 1 point over Team Russia #exss h…
130,624937646536687616,Sat Jul 25 13:42:00 +0000 2015,6,0,RT @exssLIVE: Great news fans - racing set to start at 1550 (GMT+2) #exss
131,624936274051383296,Sat Jul 25 13:36:33 +0000 2015,1,0,Looks like we’ll be back sailing shortly! #EXSS #Storm #Clouds #Windy @SAPExtremeSail
132,624926800121081856,Sat Jul 25 12:58:54 +0000 2015,2,0,RT @exssLIVE: I'm afraid racing has been suspended due to storms and strong winds. Stay tuned for the skippers thoughts after some hairy ra…
133,624924003052949504,Sat Jul 25 12:47:47 +0000 2015,3,1,@SAPExtremeSail hold the lead and finish 1st place in Race 2 of Day 3 #EXSS http://t.co/LRepVUGaSE
134,624924000993607680,Sat Jul 25 12:47:47 +0000 2015,2,0,"RT @exssLIVE: .@SAPExtremeSail smash Race 2, well done chaps! #exss"
135,624923106746986496,Sat Jul 25 12:44:13 +0000 2015,3,0,"RT @exssLIVE: .@SAPExtremeSail have a big lead on The Wave who are know in 2nd, with @PhilRobertsonNZ chasing hard in 3rd #exss"
136,624922966783074308,Sat Jul 25 12:43:40 +0000 2015,1,1,@SAPExtremeSail have a good lead on now need to keep it. #EXSS
137,624922674607865856,Sat Jul 25 12:42:30 +0000 2015,3,1,Left gate option for @SAPExtremeSail #EXSS http://t.co/CRMo9drMMa
138,624922294981382144,Sat Jul 25 12:41:00 +0000 2015,2,0,RT @exssLIVE: Line clear - Great start from @SAPExtremeSail and The Wave Muscat #exss
139,624922236403752960,Sat Jul 25 12:40:46 +0000 2015,1,0,Race 2 - Day 3 of the #EXSS - The guys went bow down at the pin and managed to make mark 1 in the lead #EXSS
140,624919114323206144,Sat Jul 25 12:28:21 +0000 2015,5,0,"RT @exssLIVE: Lino Sonego Team Italia 2nd, Team Turx 3rd and @SAPExtremeSail take 4th #exss"
141,624918925160136704,Sat Jul 25 12:27:36 +0000 2015,2,0,"Race 1 of Day 3, happy with a solid 4th place and boats between us and Team Russia"
142,624918724093562880,Sat Jul 25 12:26:48 +0000 2015,1,0,Looking to roll Lino Sonego here but not going happen now  #EXSS
143,624918242142855168,Sat Jul 25 12:24:54 +0000 2015,1,0,@SAPExtremeSail follow the leaders and opt of the left gate #EXSS
144,624918033350438912,Sat Jul 25 12:24:04 +0000 2015,1,0,@SAPExtremeSail get away clear at the top mark
145,624917906426580992,Sat Jul 25 12:23:33 +0000 2015,2,0,"The boys taking the left hand course on the first upwind, there will be congestion at this top mark #EXSS"
146,624917665816178688,Sat Jul 25 12:22:36 +0000 2015,2,1,"@SAPExtremeSail take the right gate, currently 4th place Race 1 #EXSS"
147,624917339834818560,Sat Jul 25 12:21:18 +0000 2015,2,0,@SAPExtremeSail Race 1 - Day 3 - Start middle of the fleet on second attempt of the race start...
148,624915993006108673,Sat Jul 25 12:15:57 +0000 2015,3,0,RT @exssLIVE: General Recall - That means too many boast over the start line #exss
149,624915860281495552,Sat Jul 25 12:15:26 +0000 2015,2,0,"Day 3, Race 1 of the #EXSS is underway, conditions are breezy and the guys @SAPExtremeSail take a windward approach off the line"
150,624912363553222656,Sat Jul 25 12:01:32 +0000 2015,4,0,RT @exssLIVE: Breeze on here in Hamburg! Check-in opens in 5 minutes #exss
151,624911596645666816,Sat Jul 25 11:58:29 +0000 2015,1,0,"We’ll be coming live on Twitter all evening long for Day 3 of the #EXSS in Hamburg, Follow us @SAPExtremeSail"
152,624909712488820736,Sat Jul 25 11:51:00 +0000 2015,2,0,RT @exssLIVE: Day 3 racing scheduled to start at 1405 (GMT+2) Follow here for live updates @exssLIVE #exss  https://t.co/YRAYvLs7iz
153,624606452955516928,Fri Jul 24 15:45:57 +0000 2015,1,0,"That’s all from us today, tomorrow at 14:00 local GMT+2 for more live action. Thanks to @Jopickard and @nickmoloney for todays commentary"
154,624600962150240261,Fri Jul 24 15:24:08 +0000 2015,1,0,@SAPExtremeSail the guys just couldn’t find the breeze but finished the day out great overall. Race 7 result 5th place
155,624600325274497024,Fri Jul 24 15:21:36 +0000 2015,2,0,"RT @exssLIVE: Oman Air and @SAPExtremeSail choose opposite sides, with Team Turx close behind - @GACPindar and Lino Sonego currently at the…"
156,624599898080415745,Fri Jul 24 15:19:54 +0000 2015,1,0,@SAPExtremeSail gaining one place on the downwind but lots of action at the bottom mark
157,624599392691990529,Fri Jul 24 15:17:54 +0000 2015,1,0,@SAPExtremeSail top mark looks like we have dropped back to 6th. Lots of congestion!
158,624598822526676993,Fri Jul 24 15:15:38 +0000 2015,1,0,"Race 7 - Day 2 - Start - @SAPExtremeSail duck the fleet and head out to the right side of the course, lets see how it works out #EXSS"
159,624596764377530376,Fri Jul 24 15:07:27 +0000 2015,1,0,Race 7 and the last one for today here for Act 5 in Hamburg #EXSS Good luck @SAPExtremeSail
160,624595221544763392,Fri Jul 24 15:01:19 +0000 2015,2,0,RT @exssLIVE: Delayed start - moving the mark - Standby for short delay #exss
