,id_str,created_at,retweet_count,favorite_count,text
0,669266753646682116,Tue Nov 24 21:30:03 +0000 2015,2,3,"Do you have a #LifePlan? Read my article ""Life Plan: Step 4 Rate Your Wheel of Life"" https://t.co/ppK0KGi5C6"
1,669262980828307460,Tue Nov 24 21:15:03 +0000 2015,3,3,"A journey of 1,000 miles begins with one step - Chinese Proverb. I challenge you today to take that the first step. - @JackCanfield"
2,669259212854337536,Tue Nov 24 21:00:05 +0000 2015,2,4,#WorryNoMoreBook is now available at Books-A-Million! @booksamillion Get it here: https://t.co/sfFfzZLFcC https://t.co/TRh1qolFi3
3,669259210518040576,Tue Nov 24 21:00:04 +0000 2015,8,6,"""I write entirely to find out what I'm thinking, what I'm looking at, what I see and what it means."" ~ Joan Didion #AmWriting"
4,669257340521218048,Tue Nov 24 20:52:38 +0000 2015,1,0,Thanks to my top interactors! @dekebridges @10MillionMiler @themovingroad   #tweetjukebox via https://t.co/kniNBBuQeu
5,669255434881118210,Tue Nov 24 20:45:04 +0000 2015,9,15,Today is a day you will never get to do over again. Make it count.
6,669254885414723584,Tue Nov 24 20:42:53 +0000 2015,4,3,Thanks to my top interactors! @TamaraMcCleary @brianmoran @MorningCoach   #tweetjukebox via https://t.co/kniNBBuQeu
7,669251658396909568,Tue Nov 24 20:30:04 +0000 2015,8,9,"We train for athletics, we train for job skills, but we usually neglect training/stregenthening our faith for life's spiritual battles."
8,669250650153156610,Tue Nov 24 20:26:03 +0000 2015,5,0,"""I don't want to be better!"" I explain what I mean on this morning's #Periscope message. Watch it here: https://t.co/t31075jBm5"
9,669249135846039553,Tue Nov 24 20:20:02 +0000 2015,4,1,"""Right book for the right moment!"" Another 5-star review for my #WorryNoMoreBook! Check it out:  https://t.co/TydCl9DcVf"
10,669247883531698176,Tue Nov 24 20:15:04 +0000 2015,12,8,Letting go isn't about having the courage to release the past; it's about having the wisdom to embrace the present. - @SteveMaraboli
11,669244124055404544,Tue Nov 24 20:00:07 +0000 2015,1,2,Craig and Kim Newton are helping people create life-long memories on @runforfuncruise | Listen to LIAM #Podcast: https://t.co/Av07cIWEmc
12,669244122927120384,Tue Nov 24 20:00:07 +0000 2015,15,8,The lies people tell us do far less damage than the lies we tell ourselves. - @LeadToday
13,669240339941707776,Tue Nov 24 19:45:05 +0000 2015,7,6,"Most of us have two lives. The life we live, and the unlived life within us. Between the two stands Resistance. - @SPressfield"
14,669236554754334726,Tue Nov 24 19:30:03 +0000 2015,6,2,I want you to fall in love with your ability to think and act intentionally. | LIAM 74 | Listen: https://t.co/uTgbDB6rtA
15,669232780488876032,Tue Nov 24 19:15:03 +0000 2015,5,8,"Few of us are going to be famous, but all of us can be great! - @Mark_Sanborn #FredFactor"
16,669229007540482048,Tue Nov 24 19:00:03 +0000 2015,0,2,I spoke about #WorryNoMoreBook on the #ReLaunch #Podcast https://t.co/C1obvFgg3k with @JoelBoggess @drpeikang https://t.co/N89RRFBx7G
17,669229006118592513,Tue Nov 24 19:00:03 +0000 2015,5,7,Don't be afraid of confusion. Confusion precedes learning! #PersonalGrowth
18,669225230238392320,Tue Nov 24 18:45:03 +0000 2015,4,1,Better Begins With You! | LIAM 38: https://t.co/rgn5lsWita
19,669221457587736577,Tue Nov 24 18:30:03 +0000 2015,5,3,"""How to be thankful for anything!"" with @BruceVH - The Old Soul Podcast via @chandlercraw4d https://t.co/n4owrkrB0j"
20,669218937792561154,Tue Nov 24 18:20:02 +0000 2015,5,3,I love sending out signed copies of #WorryNoMoreBook! Get yours at https://t.co/mR1HphmDwu https://t.co/aBx9s8OuWP
21,669217680533123073,Tue Nov 24 18:15:03 +0000 2015,1,3,I'm seeking to become the fullest expression of who I was created to be! https://t.co/VKyXzMNhC9 https://t.co/PWZAP9srL0
22,669216107237101568,Tue Nov 24 18:08:48 +0000 2015,23,21,There are plenty of people who will try to block your path and say hateful things to you. Don't be one of them! https://t.co/lzKbcyifJG
23,669213908159303682,Tue Nov 24 18:00:03 +0000 2015,12,4,Knowing what you want is the first and most important step toward success. #Leadership #PersonalGrowth
24,669210128856563712,Tue Nov 24 17:45:02 +0000 2015,4,4,You are always stepping in the direction of your dreams. The question is what are your dreams? | LIAM 116 | Listen: https://t.co/IfriLC24OZ
25,669210039727599616,Tue Nov 24 17:44:41 +0000 2015,0,0,@andreafrazer :)
26,669210006483550210,Tue Nov 24 17:44:33 +0000 2015,1,0,RT @andreafrazer: @BruceVH You touch my little grinchy heart with that face of yours. Thank you.
27,669209911314800640,Tue Nov 24 17:44:10 +0000 2015,0,0,"@emily_drennan The pleasure is mine, Emily! :)"
28,669208870653415424,Tue Nov 24 17:40:02 +0000 2015,2,0,"Try LIAM Life Coaching Community. WEEKLY live coaching with me, exclusive videos/resources, and more. 7 days free! https://t.co/16liy94wXj"
29,669206354222030849,Tue Nov 24 17:30:02 +0000 2015,5,6,"And now that she had nothing to lose, she found Herself. - @behappydoodles #doodle #quote #aliceinwonderland https://t.co/3enEuuY4dV"
30,669205348524298240,Tue Nov 24 17:26:02 +0000 2015,0,2,"""I don't want to be better!"" I explain what I mean on this morning's #Periscope message. Watch it here: https://t.co/t31075jBm5"
31,669203699374415872,Tue Nov 24 17:19:29 +0000 2015,3,0,"It's the season for giving! From now through Christmas, my #WorryNoMoreBook is 50% OFF! Order your copies here: https://t.co/mR1HphmDwu"
32,669203325187788800,Tue Nov 24 17:18:00 +0000 2015,5,0,"RT @stevedragoo: Stretch yourself 2 think differently, act confidently, &amp; enjoy life more fully. https://t.co/J3nyjRigOR @stevedragoo https…"
33,669202588177444864,Tue Nov 24 17:15:04 +0000 2015,9,13,Hi. I love you. https://t.co/IsFHTOXURB
34,669198824804622336,Tue Nov 24 17:00:07 +0000 2015,0,2,"Meditation is not shutting down your thoughts, it is focusing them! Meditate on that. :) | LIAM 92 | Listen: https://t.co/teE1OW9kCL"
35,669195037859848196,Tue Nov 24 16:45:04 +0000 2015,8,3,The difference between can and cannot is only three letters. Three letters that can shape your life's direction. - @MrScottEddy
36,669191258993254400,Tue Nov 24 16:30:03 +0000 2015,2,0,"RT @BobBurg: In his newest ""Life Is A Marathon"" #podcast the very-wise @BruceVH shares a ton of #wisdom! https://t.co/9MuFcvxlTC"
37,669188739176992768,Tue Nov 24 16:20:03 +0000 2015,2,3,#WorryNoMoreBook will help you change your life by changing your thoughts! Get it now! =&gt; https://t.co/fKH2UWBIGR
38,669187482181849091,Tue Nov 24 16:15:03 +0000 2015,12,17,"When you know what you want, and you want it bad enough, you will find a way to get it. - Jim Rohn"
39,669183724999860224,Tue Nov 24 16:00:07 +0000 2015,0,5,We think between 50-70k thoughts per day. About 95% are the same. 70-80% are negative. | LIAM 58 | Listen: https://t.co/myyqVzuiOE
40,669179934422736896,Tue Nov 24 15:45:03 +0000 2015,12,7,"""Peace is not a product, it is a process!"" Please read: https://t.co/1SWzIRaEfU https://t.co/IG3GvarEBJ"
41,669178674965520385,Tue Nov 24 15:40:03 +0000 2015,0,2,"""A fantastic read!"" is the title of @tsetty2000's 5-star review of #WorryNoMoreBook. Read the full review here: https://t.co/Xg5zAKrldH"
42,669176160115433472,Tue Nov 24 15:30:03 +0000 2015,0,0,"In defiance of fear, @Maimah Karmo made the decision to be #Fearless | LIAM #Podcast 132: https://t.co/9IIkc8RME9"
43,669175154287599616,Tue Nov 24 15:26:04 +0000 2015,2,0,"""I don't want to be better!"" I explain what I mean on this morning's #Periscope message. Watch it here: https://t.co/t31075jBm5"
44,669172384327467009,Tue Nov 24 15:15:03 +0000 2015,1,1,Holding a pencil between your teeth can help you get out of a bad mood! | LIAM 119 | listen: https://t.co/YqedwMQVt4
45,669172383148847105,Tue Nov 24 15:15:03 +0000 2015,0,2,I've been included in The Best Advice from Year 1 Guests of The Grass Gets Greener podcast https://t.co/bNkDARu9e4 via @themeliswilson
46,669168638742634496,Tue Nov 24 15:00:10 +0000 2015,3,3,I had a great time talking with @toddontlr about my life's journey on his Tremendous Life Radio Show. Listen here: https://t.co/SO5roWcA8a
47,669168626814074880,Tue Nov 24 15:00:07 +0000 2015,2,3,MT @KentJulian: Look what just came in the mail. Congrats Bruce!! #WorryNoMoreBook https://t.co/ZlxkpGR68H https://t.co/KNF9FXDxtj
48,669164839177224192,Tue Nov 24 14:45:04 +0000 2015,29,28,"Do the right thing because it's the right thing to do, not because you want something in return."
49,669161064358150146,Tue Nov 24 14:30:04 +0000 2015,0,1,"Listen to this fun, insightful conversation about ""Life Balance"" with @ChristyBWright | LIAM #Podcast 135: https://t.co/VPNU11pXO6"
50,669158548161581056,Tue Nov 24 14:20:04 +0000 2015,5,2,"""There is a difference, a profound difference, between having a plan and having a purpose."" #WorryNoMoreBook =&gt; https://t.co/fKH2UWBIGR"
51,669158019603804161,Tue Nov 24 14:17:58 +0000 2015,2,0,RT @mad_tesla: @BruceVH My first like 💓 after after the update!! (Yeah I'm a bit slow). And it was yours. Congratulations 👏👏👏 https://t.co/…
52,669157280424853504,Tue Nov 24 14:15:02 +0000 2015,8,12,Emancipate yourself from mental slavery. None but ourselves can free our minds. - Marcus Garvey
53,669156654508859392,Tue Nov 24 14:12:33 +0000 2015,2,0,"RT @Cledawgs: Have you lost sight of where you want to go?

#run you'll figure it out

https://t.co/8dcHreSqbE"
54,669153514610905089,Tue Nov 24 14:00:04 +0000 2015,5,5,"I think it is fair to say that, at any given moment, what we really want is to feel is peace. Please read: https://t.co/1SWzIRaEfU"
55,669149735035473920,Tue Nov 24 13:45:03 +0000 2015,0,0,I had a great chat with @craignewton_11 about @runforfuncruise and doing work you love. | Listen to LIAM #Podcast: https://t.co/Av07cIWEmc
56,669149732023988224,Tue Nov 24 13:45:02 +0000 2015,30,31,"Confident, loving people will always encourage you to reach your greatest potential. https://t.co/k3ScKCBglD"
57,669148481953603584,Tue Nov 24 13:40:04 +0000 2015,5,3,"I got my copy of #WorryNoMoreBook from Amazon in Oman and recomended to my kids to read. - @busyline_ali
https://t.co/6v4QHlTBFP"
58,669145957364289536,Tue Nov 24 13:30:03 +0000 2015,3,6,"You are looking for people who are looking for you and what you have to offer. ""No"" just means it wasn't the right person. #Sales #Life"
59,669145378017648640,Tue Nov 24 13:27:44 +0000 2015,0,5,"""I don't want to be better!"" I explain what I mean on this morning's #Periscope message. Watch it here: https://t.co/t31075jBm5"
60,669144945123553280,Tue Nov 24 13:26:01 +0000 2015,1,0,RT @genevievekohn: .@BruceVH on #Periscope: I Don't Want to Be Better https://t.co/bCYlq9xQ6A
61,669142179529555968,Tue Nov 24 13:15:02 +0000 2015,1,1,Love is the Bridge Between You and EVERYTHING! | Listen to LIAM #Podcast: https://t.co/VZZ4H61jFU
62,669138419424083968,Tue Nov 24 13:00:05 +0000 2015,0,1,"Read ""Worry No More!"" It will help you stop worrying and start living! =&gt; https://t.co/fKH2UWBIGR #WorryNoMoreBook"
63,669138418019008512,Tue Nov 24 13:00:05 +0000 2015,0,1,"""Let our family take care of your family"" is the motto of @runforfuncruise and they do! | Listen to LIAM #Podcast: https://t.co/Av07cIWEmc"
64,669138414642601986,Tue Nov 24 13:00:04 +0000 2015,2,0,"Listen as @JaimePrimak and I ""tawk"" about life and lessons learned #CawfeeTawk #JerseyBelle | LIAM 41: https://t.co/C7ssuFbE6T"
65,669138084336898048,Tue Nov 24 12:58:45 +0000 2015,3,1,LIVE on #Periscope: I Don't Want to Be Better https://t.co/t31075jBm5
66,669136148464279553,Tue Nov 24 12:51:04 +0000 2015,18,0,RT @RockChristopher: We have a choice every day regarding the attitude we will embrace for that day. ~ Charles Swindoll @LifePowerQuotes
67,669135285289156609,Tue Nov 24 12:47:38 +0000 2015,2,5,Thanks to my top interactors! @scedmonds @tdkinser @Judy_Cockerton @sam1meta   #tweetjukebox via https://t.co/kniNBBuQeu
68,669135213763665920,Tue Nov 24 12:47:21 +0000 2015,2,2,"Join me on #periscope live at 8:00am ET (in 15 min) for my morning walk/talk: ""I don't want to be better"""
69,669134629853614080,Tue Nov 24 12:45:02 +0000 2015,3,2,"""Our sons need #StrongFathers to be their Role Models!"" - @BruceVH Read more @TheRunnerDad https://t.co/zgmsLABi7o https://t.co/CFlbo2UwPV"
70,669130857790181376,Tue Nov 24 12:30:03 +0000 2015,5,11,A failure establishes only this: that our determination to succeed was not strong enough. - Christian Bovee
71,669128340742250497,Tue Nov 24 12:20:02 +0000 2015,4,2,"""What I'm looking for is not out there, it's in me. In fact, it IS me!"" #WorryNoMoreBook =&gt; https://t.co/fKH2UWBIGR https://t.co/PokK9J2TBc"
72,669127086389501952,Tue Nov 24 12:15:03 +0000 2015,8,11,"When talking to someone, be all there. Give the person and the conversation 100% of your attention. | https://t.co/xZ2BHZYwqE | #LifeThought"
73,669123326707675137,Tue Nov 24 12:00:07 +0000 2015,1,2,"Add ""yet"" to ""I can't"" to give you the hope you need to make it ""I can!"" | LIAM 76 | Listen: https://t.co/NGt7dZ4yzB"
74,669123324962865152,Tue Nov 24 12:00:07 +0000 2015,1,4,I'm so proud to be returning for my 2nd year of being the Life Coach on @runforfuncruise | Listen to LIAM #Podcast: https://t.co/Av07cIWEmc
75,669119542442991616,Tue Nov 24 11:45:05 +0000 2015,31,23,"There are plenty of difficult obstacles in your path. Don't allow yourself to become one of them. - @jamesryandobson
https://t.co/3CLeGPfRfA"
76,669118277738758144,Tue Nov 24 11:40:03 +0000 2015,4,5,#WorryNoMoreBook has been on the Best Sellers list since the day it was released! Thank you! https://t.co/tVUI6Cudci https://t.co/0tFNhH2ev7
77,669115771625324545,Tue Nov 24 11:30:06 +0000 2015,2,2,"Are you a Puppy Dog, Kitty Cat, Canary, or Goldfish? I'm a Puppy Dog! | LIAM 59 | Listen: https://t.co/8EgSzeOtxQ"
78,669111981077590016,Tue Nov 24 11:15:02 +0000 2015,5,7,Listen as I talk about what I do every night before I go to bed. I program myself for success! | LIAM 91 | Listen: https://t.co/I2eXXxMJel
79,669108213862801409,Tue Nov 24 11:00:04 +0000 2015,8,13,Criticism will never get you what you want... https://t.co/OJDSInHirQ
80,669108213414027264,Tue Nov 24 11:00:04 +0000 2015,5,2,Peace comes when we let go of our story of how the world should be and find the truth of what is. - #WorryNoMoreBook https://t.co/fKH2UWBIGR
81,669104439601594368,Tue Nov 24 10:45:04 +0000 2015,4,1,"Please follow @HyeonseoLeeNK and read her book ""The Girl with Seven Names"" It will change your life! https://t.co/lSDNdYpZRY"
82,669100665738776576,Tue Nov 24 10:30:04 +0000 2015,17,12,Thinkers need to realize it's how we make people feel that leaves the strongest impressions #leadership
83,669098141703118848,Tue Nov 24 10:20:02 +0000 2015,2,5,"RT @sryn14: #WorryNoMoreBook ""You are 100% responsible for all your thoughts"" - Bruce, you and your book are very inspirational!"
84,669096884309516288,Tue Nov 24 10:15:03 +0000 2015,3,2,"Do one thing, every day, that scares you! - Eleanor Roosevelt | LIAM 111 | Listen: https://t.co/niwTfTgbLH"
85,669093132294836224,Tue Nov 24 10:00:08 +0000 2015,1,3,"Early in their marriage, Craig and Kim Newton decided to invest in memories, not stocks. | Listen to LIAM #Podcast: https://t.co/Av07cIWEmc"
86,669089347996618752,Tue Nov 24 09:45:06 +0000 2015,21,14,To argue with a person who has renounced the use of reason is like administering medicine to the dead. - Thomas Paine
87,669088076610818048,Tue Nov 24 09:40:03 +0000 2015,7,6,Worry is using your imagination to create images of what you do not want to want to occur. Get #WorryNoMoreBook =&gt; https://t.co/fKH2UWBIGR
88,669085563312582657,Tue Nov 24 09:30:03 +0000 2015,18,13,A man who has committed a mistake and doesn't correct it is committing another mistake. - Confucius
89,669081784768995328,Tue Nov 24 09:15:03 +0000 2015,25,17,You can get everything in life you want if you help enough other people get what they want. - Zig Ziglar #Leadership https://t.co/jEsl64P5ge
90,669078014160986112,Tue Nov 24 09:00:04 +0000 2015,4,5,"The secret to life is living. Setbacks happen in life, but don't let that stop you from living. | https://t.co/FEzzlPZPvv | #LifeThought"
91,669078014005796864,Tue Nov 24 09:00:04 +0000 2015,2,3,"""Step 2: Move to a Different State"" Read #WorryNoMoreBook =&gt; https://t.co/fKH2UWBIGR https://t.co/PokK9J2TBc"
92,669074236041011200,Tue Nov 24 08:45:03 +0000 2015,10,9,Just because someone threw you into Lake Inferior doesn't mean you have to keep swimming in it. Get out. You're better than that!
93,669070458264907776,Tue Nov 24 08:30:02 +0000 2015,3,7,I Want You to be Victorious! | LIAM 87 | Listen: https://t.co/X5v7TNCOia
94,669067948531826688,Tue Nov 24 08:20:04 +0000 2015,4,3,"""Follow the author's sage advice"" - @BobBurg Read #WorryNoMoreBook =&gt; https://t.co/fKH2UWBIGR https://t.co/PokK9J2TBc"
95,669062913878040578,Tue Nov 24 08:00:03 +0000 2015,3,3,"""Let our family take care of your family"" is the motto of @runforfuncruise and they do! | Listen to LIAM #Podcast: https://t.co/Av07cIWEmc"
96,669062912162578432,Tue Nov 24 08:00:03 +0000 2015,6,5,"The lower the price of your love, the higher its value."
97,669059136634691584,Tue Nov 24 07:45:03 +0000 2015,7,12,Successful people make the most of the best and the best of the worst. - via @LeadToday
98,669057878108610560,Tue Nov 24 07:40:03 +0000 2015,0,6,I had a great chat about #WorryNoMoreBook on #ReLaunch #Podcast https://t.co/C1obvFgg3k with @JoelBoggess @drpeikang https://t.co/N89RRFBx7G
99,669055362490855424,Tue Nov 24 07:30:03 +0000 2015,4,2,It was a pleasure to be featured on the Eternal Leadership #podcast https://t.co/SnDBjiSx4O via @johnramstead
100,669047818707947520,Tue Nov 24 07:00:04 +0000 2015,6,12,"We have all been put on NOTICE. Failure to comply will... well, just do it, OK? - @JaimePrimak https://t.co/2EfUKxGKkd"
101,669037751740841984,Tue Nov 24 06:20:04 +0000 2015,4,2,"Are you a worrier? Read ""Worry No More!"" An international bestseller that is changing lives! =&gt; https://t.co/fKH2UWBIGR"
102,669036490475859968,Tue Nov 24 06:15:04 +0000 2015,0,1,Seanlai Cochrane (@SeanlaiC) and I had a fascinating conversation about #Proclivities | LIAM #Podcast: https://t.co/RcD8XCLUBx
103,669032716931866624,Tue Nov 24 06:00:04 +0000 2015,5,1,Romance is the 1st stage. Intense attraction. An uncontrollable urge to be with your partner.  | LIAM 114 | Listen: https://t.co/S38yMHzpx4
104,669028943266230276,Tue Nov 24 05:45:04 +0000 2015,51,46,"""I've never met a strong person with an easy past."" - @lifelessonsforu https://t.co/WuMw932uEY"
105,669028939399077888,Tue Nov 24 05:45:03 +0000 2015,1,0,Craig and Kim Newton are helping people create life-long memories on @runforfuncruise | Listen to LIAM #Podcast: https://t.co/Av07cIWEmc
106,669027679765663744,Tue Nov 24 05:40:03 +0000 2015,2,2,In #WorryNoMoreBook I share how I stopped worrying and started living! Get it now! =&gt; https://t.co/fKH2UWBIGR https://t.co/PokK9J2TBc
107,669025164659658752,Tue Nov 24 05:30:03 +0000 2015,11,16,Never give anyone the power to take away your joy. - @JeanetteJenkins
108,669021388641058816,Tue Nov 24 05:15:03 +0000 2015,8,6,"""How to stop being a chronic complainer"" Blog post: https://t.co/i1FsaYddLF"
109,669017633728176128,Tue Nov 24 05:00:08 +0000 2015,3,2,"#WorryNoMoreBook is changing lives! It can change yours, too! Get it and Start Living! =&gt; https://t.co/fKH2UWBIGR https://t.co/PKxPhTwHdf"
110,669017631278673921,Tue Nov 24 05:00:07 +0000 2015,10,6,Confusion is the welcome mat at the door of creativity. - Michael J. Gelb #amwriting
111,669013835869757440,Tue Nov 24 04:45:02 +0000 2015,13,11,The truth is the truth regardless of whether or not people like it. - @LarryWinget
112,669010066071289857,Tue Nov 24 04:30:04 +0000 2015,22,29,Everything you do is a choice! Choose wisely! https://t.co/rlNoq8RuKY
113,669007547995680770,Tue Nov 24 04:20:03 +0000 2015,2,3,You need a #speaker with respected insight and a life-changing message for your next event. Check my availability: https://t.co/hn5yTyfW8h
114,669002510347214849,Tue Nov 24 04:00:02 +0000 2015,13,22,"Truth can only be found in this present moment. It cannot be found in the past, nor in the future. https://t.co/myvavocPDy"
115,668998737268768768,Tue Nov 24 03:45:03 +0000 2015,9,20,Want to be a better leader? Lead with a servant heart. Lead with love. #leadership
116,668997481221500928,Tue Nov 24 03:40:03 +0000 2015,2,0,#WorryNoMoreBook is an international best seller that is changing lives! Get a copy today! =&gt; https://t.co/fKH2UWBIGR
117,668994960516075520,Tue Nov 24 03:30:02 +0000 2015,9,22,Everything changes when YOU decide that YOU will be someone who makes a difference. - @LeadToday #Leadership
118,668991190499467264,Tue Nov 24 03:15:03 +0000 2015,6,2,"14 years later, I still remember how I felt on the morning of Sept. 11, 2001. #Blessed! | Listen to LIAM #Podcast: https://t.co/bkVzJaP33B"
119,668987430096236544,Tue Nov 24 03:00:07 +0000 2015,2,4,Focus on What You Want: The Solutions Focus! | LIAM 23: https://t.co/I07mCGTbOj
120,668987429521629184,Tue Nov 24 03:00:07 +0000 2015,6,5,Your thoughts are extremely powerful. Your thoughts are what control your behavior. - #WorryNoMoreBook https://t.co/fKH2UWBIGR
121,668987427919405058,Tue Nov 24 03:00:06 +0000 2015,0,4,I had a great chat with @craignewton_11 about @runforfuncruise and doing work you love. | Listen to LIAM #Podcast: https://t.co/Av07cIWEmc
122,668983640790011904,Tue Nov 24 02:45:03 +0000 2015,32,23,Remember that bad days only last 24 hours. Thats it. Simple as that. The next day is a new day. You can choose to move on. @Hyken
123,668979867996848130,Tue Nov 24 02:30:04 +0000 2015,4,6,Hope might sound good in a speech but it's not a plan for success. - @LeadToday #Leadership
124,668976093299384320,Tue Nov 24 02:15:04 +0000 2015,14,13,"Be kind to yourself! If being hard on yourself was going to work, it would have worked by now!"
125,668972382988533760,Tue Nov 24 02:00:19 +0000 2015,6,0,"RT @ChrisLoCurto: 1. Overcome limiting beliefs
2. Stop worrying about people pleasing
3. Gain self-confidence
4. Learn to...https://t.co/1p…"
126,668972319310782464,Tue Nov 24 02:00:04 +0000 2015,5,7,"I HIGHLY recommend @AndyAndrews book ""The Noticer Returns"" I've listened to the audiobook several times &amp; LOVE it! https://t.co/hcuZr1eznX"
127,668968537793437696,Tue Nov 24 01:45:02 +0000 2015,5,4,No person or situation makes you feel anything. You decide your feelings by your response | Listen to LIAM #Podcast: https://t.co/FMkLsYljH1
128,668967279405768704,Tue Nov 24 01:40:02 +0000 2015,0,2,"""In the midst of a crisis we often don't get answers. What we need is a new perspective."" #WorryNoMoreBook =&gt; https://t.co/fKH2UWBIGR"
129,668964764954046464,Tue Nov 24 01:30:03 +0000 2015,4,6,"Nobody tells you, when you get born here, how much you'll come to love it but how you'll never belong here. https://t.co/tNGExhyWJi"
130,668960992890630144,Tue Nov 24 01:15:04 +0000 2015,18,17,Confidence on the outside begins by living with integrity on the inside. - Brian Tracy
131,668957224706908161,Tue Nov 24 01:00:05 +0000 2015,3,4,Svava Brooks (@svavas) has a powerful personal testimony of taking her power back! | LIAM 105 | Listen: https://t.co/GreDqA02z4
132,668953440970780673,Tue Nov 24 00:45:03 +0000 2015,7,5,Listen as I share a few tips for taking care of and investing in yourself. | LIAM 72 | Listen: https://t.co/KsdjewmEMw
133,668949661558927361,Tue Nov 24 00:30:02 +0000 2015,11,11,Sometimes growth looks and feels like complete destruction! - via @MorningCoach https://t.co/jNUhdnJTqD
134,668947148734652417,Tue Nov 24 00:20:03 +0000 2015,2,3,"RT @john_esling: Delightfully inspiring, refreshing. Thanks for sharing from the heart. Great book! #WorryNoMoreBook https://t.co/Voq1ffaCKo"
135,668945892586758144,Tue Nov 24 00:15:03 +0000 2015,15,17,"We make a living by what we get, but we make a life by what we give. - Winston Churchill #GiveMore #Leadership"
136,668942464145735680,Tue Nov 24 00:01:26 +0000 2015,1,0,RT @ElevatingBeyond: How Our Guest @bruceVH Overcame 40 Years as a Victim-and Became a Victor! #ElevatingBeyond https://t.co/Gg0P5NvFG1 htt…
137,668942128668680193,Tue Nov 24 00:00:06 +0000 2015,1,2,We spend so much time thinking about the past or the future we forget to live right now! | LIAM 121 | Listen: https://t.co/UDCbxnfaPe
138,668938342025830400,Mon Nov 23 23:45:03 +0000 2015,1,5,The meaning of earthly existence lies in the development of the soul. ~ Aleksandr Solzhenitsyn via @RockChristopher
139,668937087153020929,Mon Nov 23 23:40:04 +0000 2015,3,4,"""This book will change your life!"" is what a 5-star reviewer of my #WorryNoMoreBook said. Read it here: https://t.co/cMAO4SRdX0"
140,668936160555761665,Mon Nov 23 23:36:23 +0000 2015,17,0,"RT @RockChristopher: Spirit can walk, spirit can swim, spirit can climb, spirit can crawl. There is no terrain you cannot overcome.  ~ Iris…"
141,668936099654299648,Mon Nov 23 23:36:09 +0000 2015,3,0,RT @KentJulian: Want to differentiate yourself as a #speaker? This 7-part video mini-course will show you how - https://t.co/MESZyUQjFP
142,668935366867623936,Mon Nov 23 23:33:14 +0000 2015,9,0,RT @DARRENHARDY: Be an agent of influence - here's how: https://t.co/AT4AxkqDQm
143,668934622588346368,Mon Nov 23 23:30:16 +0000 2015,1,2,Thanks to my top interactors! @SeanlaiC   #tweetjukebox via https://t.co/kniNBBuQeu
144,668934566145630208,Mon Nov 23 23:30:03 +0000 2015,3,4,"#LifeCoaching Tip: When rating things on a 1-10 scale, ask ""why so high?"" not ""why so low?"" | LIAM 79 | Listen: https://t.co/F2Nfvy9LHT"
145,668930793507540992,Mon Nov 23 23:15:03 +0000 2015,1,2,We only have feelings in this present moment by thinking about the past or the future. | Listen to LIAM #Podcast: https://t.co/FMkLsYljH1
146,668927016549396480,Mon Nov 23 23:00:03 +0000 2015,4,3,Is your mediocrity offended by someone else's excellence?
