,id_str,created_at,retweet_count,favorite_count,text
147,668923242531463168,Mon Nov 23 22:45:03 +0000 2015,16,20,"You have two ears, two eyes, and one mouth. You should use them in the same amount. #Leadership"
148,668919464579227649,Mon Nov 23 22:30:02 +0000 2015,10,10,The only people with whom you should try to get even with are those who have helped you. - John E. Southard
149,668917941979754496,Mon Nov 23 22:23:59 +0000 2015,5,3,.@leislooski and I had a great chat about learning how to love the truth of what is. Listen to LIAM #Podcast: https://t.co/fWlIuu89MO
150,668915697175646208,Mon Nov 23 22:15:04 +0000 2015,4,7,Every step you take in the direction of your dreams will be rewarded and tested. Take them! | LIAM 97 | Listen: https://t.co/YcudlFn1XV
151,668913206581207040,Mon Nov 23 22:05:10 +0000 2015,3,1,Thanks to my top interactors! @AkanshaGautam_ @SkipPrichard @MJasonHouck   #tweetjukebox via https://t.co/kniNBBuQeu
152,668911924386639872,Mon Nov 23 22:00:05 +0000 2015,9,12,It is not the employer who pays wages. Employers only handle the money. It is the customer who pays the wages. - Henry Ford
153,668908148510576640,Mon Nov 23 21:45:04 +0000 2015,10,22,Stop telling yourself you are not worthy! Stop it! You ARE worthy! You are unconditionally loved beyond comprehension!
154,668906881142890496,Mon Nov 23 21:40:02 +0000 2015,5,4,"When you are worried, you are stuck in the future. Give yourself the Present! Read #WorryNoMoreBook =&gt; https://t.co/fKH2UWBIGR"
155,668904367794335744,Mon Nov 23 21:30:03 +0000 2015,2,5,Personal Branding: Your Work is a Reflection of Who You Are | LIAM 49| Listen: https://t.co/uIHQGETs8Y
156,668900596385251328,Mon Nov 23 21:15:04 +0000 2015,19,25,Everything you do to improve yourself makes this world a better place for all of us! Thank you! https://t.co/yGlmkQnQtS
157,668896834870472704,Mon Nov 23 21:00:07 +0000 2015,0,3,"#WorryNoMoreBook is changing lives around the world! It can change your world, too! Read it: https://t.co/fKH2UWBIGR https://t.co/gq3z4LYlKY"
158,668896833566072832,Mon Nov 23 21:00:07 +0000 2015,0,3,"Early in their marriage, Craig and Kim Newton decided to invest in memories, not stocks. | Listen to LIAM #Podcast: https://t.co/Av07cIWEmc"
159,668896830957166592,Mon Nov 23 21:00:06 +0000 2015,0,3,"""My Twin is on Twitter"" via @katiemehnert (I wonder who it could be?) Read: https://t.co/DoHtphR3ot"
160,668889273593110529,Mon Nov 23 20:30:04 +0000 2015,16,19,"To be a great leader, you must have a fanatical level of integrity. #leadership"
161,668887241025040384,Mon Nov 23 20:22:00 +0000 2015,1,2,"@RockChristopher Wow, thank you, Rock! You totally rock!! :)"
162,668886825335963648,Mon Nov 23 20:20:21 +0000 2015,5,0,"RT @RockChristopher: #SuccessTRAIN Meet Bruce Van Horn @BruceVH Dad, author, life coach, speaker, runner. Respected insight. https://t.co/r…"
163,668886748622098433,Mon Nov 23 20:20:02 +0000 2015,1,2,"RT @Maimah: Learn how @BruceVH transformed his life. His story is powerful!!! ""Worry No More!"" Grab a copy of it! https://t.co/fKH2UWBIGR"
164,668885494583926784,Mon Nov 23 20:15:03 +0000 2015,5,7,In life there is a single color which provides the meaning of life and art. It is the color of LOVE. - Marc Chagall https://t.co/5VfRtxl9Zy
165,668881720243015682,Mon Nov 23 20:00:03 +0000 2015,44,31,"Yesterday I was clever, so I wanted to change the world. Today I am wise, so I am changing myself. – Rumi #Mindset https://t.co/DPd02B7ypx"
166,668877940508246016,Mon Nov 23 19:45:02 +0000 2015,6,3,There is only one person responsible for the life you live: YOU! | LIAM 67 | Listen: https://t.co/rJfsBQhiSK
167,668876681692753920,Mon Nov 23 19:40:02 +0000 2015,3,1,Are you a pastor or ministry leader looking to bring a life-changing speaker/event to your community? Let's talk: https://t.co/hn5yTyfW8h
168,668875058975215616,Mon Nov 23 19:33:35 +0000 2015,1,0,Thanks to my top interactors! @BurtonBrown @LeadToday @stevekrohn @BilleBaty   #tweetjukebox via https://t.co/kniNBBuQeu
169,668874169937997824,Mon Nov 23 19:30:03 +0000 2015,6,3,"""If I could do it over again, I wouldn't change a thing because it has made me who I am today!"" | LIAM 75 | Listen: https://t.co/pUkmZhVA6x"
170,668870392900120576,Mon Nov 23 19:15:03 +0000 2015,5,3,"#LifeCoaching Tip: I use the ""Solutions Focus"" technique in almost every coaching session. | LIAM 79 | Listen: https://t.co/F2Nfvy9LHT"
171,668866623730774017,Mon Nov 23 19:00:04 +0000 2015,19,13,Don't let people pull you into their storm. Pull them into your peace. - Kimberly Jones
172,668862852439126017,Mon Nov 23 18:45:05 +0000 2015,9,10,"The widest thing in the universe is not space, it is the potential capacity of the human heart. - A.W. Tozer"
173,668859070552608773,Mon Nov 23 18:30:03 +0000 2015,2,2,"""While @TheZigZiglar was alive, we estimate he impacted about 250 million people!"" - @TomZiglar | LIAM 85 | Listen: https://t.co/KGUMz53wxt"
174,668855294974369792,Mon Nov 23 18:15:03 +0000 2015,9,8,We often try to be brave when it is enough to be intelligent. #LifeThought #LifeCoaching
175,668851519916277760,Mon Nov 23 18:00:03 +0000 2015,1,2,I'm so proud to be returning for my 2nd year of being the Life Coach on @runforfuncruise | Listen to LIAM #Podcast: https://t.co/Av07cIWEmc
176,668851517441601538,Mon Nov 23 18:00:03 +0000 2015,6,5,"""It's not having what you want... It's wanting what you've got."" - Sheryl Crow / So true!"
177,668847744329629697,Mon Nov 23 17:45:03 +0000 2015,15,26,Your ability to endure difficult things today is in direct proportion to the clarity of your vision of the future. https://t.co/r1Z9uLF3AV
178,668846481231712256,Mon Nov 23 17:40:02 +0000 2015,6,2,"I am honored, humbled, and very pleased by the great things people are saying about #WorryNoMoreBook Read them here: https://t.co/sGQFswPUhL"
179,668843972341702656,Mon Nov 23 17:30:04 +0000 2015,1,7,"The improbable we do before breakfast, the impossible may take until lunch. - @danlpaul"
180,668840194859233281,Mon Nov 23 17:15:03 +0000 2015,15,9,"""Truth doesn't need me to believe it. The truth simply is, believe it or not."" - @donMiguelRuiz | LIAM 80 | Listen: https://t.co/P3TcqmMEIi"
181,668832641890787328,Mon Nov 23 16:45:02 +0000 2015,1,2,I've been included in The Best Advice from Year 1 Guests of The Grass Gets Greener podcast https://t.co/bNkDARu9e4 via @themeliswilson
182,668828878044049412,Mon Nov 23 16:30:05 +0000 2015,12,24,Fear cannot exist in the presence of Love. https://t.co/40gkXGlask
183,668825097843646465,Mon Nov 23 16:15:04 +0000 2015,7,9,"You can hope all you want, but your future will not change unless your behaviors do! | LIAM 83 | Listen: https://t.co/3yS5QpWyRh"
184,668821324773617668,Mon Nov 23 16:00:04 +0000 2015,9,16,Growth doesn't happen on the mountain tops; it happens in the often painful yet fertile valleys. Mountain tops show our next destination
185,668817545969930240,Mon Nov 23 15:45:03 +0000 2015,12,15,"If you can, take the stairs instead of the elevator/escalator. The increased blood flow will put you in a better mood. Seriously!"
186,668809994859618304,Mon Nov 23 15:15:03 +0000 2015,9,10,"Look for, recognize, be grateful for, and enjoy the blessings each day gives!"
187,668806409274925057,Mon Nov 23 15:00:48 +0000 2015,0,1,"@HelloSeanP Thanks, Sean!! :)"
188,668806363791904768,Mon Nov 23 15:00:37 +0000 2015,2,0,"RT @HelloSeanP: @BruceVH @BruceVH listened to this one and the ""Love is a Bridge Between You and Everything"" you have a new follower Bruce.…"
189,668806228534042625,Mon Nov 23 15:00:05 +0000 2015,1,1,"I want you to live a vibrant, peaceful life. I wrote #WorryNoMoreBook because I love you! =&gt; https://t.co/fKH2UWBIGR https://t.co/3Lzol8uDja"
190,668806223387602944,Mon Nov 23 15:00:04 +0000 2015,3,6,We all know that art is not the truth. Art is a lie that makes us realize the truth. - Pablo Picasso
191,668802448262320128,Mon Nov 23 14:45:04 +0000 2015,15,16,"When they are little, listen to the little things your kids tell you. When they are bigger they'll tell you the big things! #Parenting"
192,668798671799066624,Mon Nov 23 14:30:03 +0000 2015,2,8,The opposite of love is not hate. The opposite of love is indifference. | Listen to LIAM #Podcast: https://t.co/VZZ4H61jFU
193,668794891128975360,Mon Nov 23 14:15:02 +0000 2015,1,3,Hope Must Be Combined With Action To Change The Future | LIAM 83 | Listen: https://t.co/3yS5QpWyRh
194,668791118109253632,Mon Nov 23 14:00:02 +0000 2015,10,8,Building a better life begins with you owning your responsibility to change your life. #LifeThought https://t.co/PRf3EhICR6
195,668787345345421312,Mon Nov 23 13:45:03 +0000 2015,2,5,Personal Branding: Everyone is Self-Employed (Revisited) | LIAM 93 | Listen: https://t.co/3dj9pR1b0T
196,668787344619753472,Mon Nov 23 13:45:03 +0000 2015,1,1,I had a great chat with @craignewton_11 about @runforfuncruise and doing work you love. | Listen to LIAM #Podcast: https://t.co/Av07cIWEmc
197,668779792817369088,Mon Nov 23 13:15:02 +0000 2015,31,27,Don't let small minds convince you that your dreams are too big.
198,668776035887013888,Mon Nov 23 13:00:06 +0000 2015,1,3,Craig and Kim Newton are helping people create life-long memories on @runforfuncruise | Listen to LIAM #Podcast: https://t.co/Av07cIWEmc
199,668776028635070464,Mon Nov 23 13:00:05 +0000 2015,24,22,The man who doesn't read good books has no advantage over the man who can't read them - Mark Twain https://t.co/poMw8deMAl
