,id_str,created_at,retweet_count,favorite_count,text
0,668396233384308737,Sun Nov 22 11:50:54 +0000 2015,0,0,"Awards returned right before Bihar elections: 200. Awards returned after Bihar elections: 0. Till Assam election, its break time!!"
1,666627670826872832,Tue Nov 17 14:43:16 +0000 2015,0,0,"With Mitchell Johnson gone, the fear-factor might never be the same again."
2,666622400428007424,Tue Nov 17 14:22:20 +0000 2015,0,0,Mani Shankar Aiyar still suffering from foot in the mouth syndrome! Old habits die hard...
3,666622022726742016,Tue Nov 17 14:20:50 +0000 2015,0,0,Great Brand extension by OLA. https://t.co/I9LsbhTMJ9
4,665537442657636356,Sat Nov 14 14:31:06 +0000 2015,0,0,"He may have been partying hard in recent days, but Lewis Hamilton showed no signs of fatigue at Interlagos on Friday morning."
5,665537064398536706,Sat Nov 14 14:29:35 +0000 2015,0,0,Hamilton dominates opening Brazil session
6,665420233117712384,Sat Nov 14 06:45:21 +0000 2015,0,0,PM Modi made an excellent speech to British MP's at their Parliament. Pride moment for all of us and opp should stop playing politics...
7,665404949388488704,Sat Nov 14 05:44:37 +0000 2015,63,0,RT @ReshmiDG: Are the BJP veterans also agitating for OROP - One Rancour One Penance? 😊😊😊 https://t.co/UFm7flmhlJ
8,664681656578519040,Thu Nov 12 05:50:30 +0000 2015,0,0,"In comparison, sales on Cyber Monday, which is the biggest online shopping day in the US, hit $1.35bn"
9,664681537619660800,Thu Nov 12 05:50:02 +0000 2015,0,0,China's Alibaba breaks Singles Day record as sales surge. $11.6 Billion in just 24 hours.
10,664314383523155969,Wed Nov 11 05:31:06 +0000 2015,0,0,Wake up or blow away the mandate of the century. That's the summary of Bihar result.
11,664073464328810497,Tue Nov 10 13:33:46 +0000 2015,0,0,@suhelseth they will return for the next round of election...!!
12,664070656141561856,Tue Nov 10 13:22:36 +0000 2015,0,0,"No award Bapsi today? Oh Sorry, Bihar election are over...My mistake"
13,663762740272455680,Mon Nov 09 16:59:04 +0000 2015,0,0,Happy Diwali...enjoy festival of light https://t.co/4KjxaUJjBW
14,663762635058343936,Mon Nov 09 16:58:38 +0000 2015,0,0,https://t.co/J4LZon3Tqc
15,659358118053220352,Wed Oct 28 13:16:40 +0000 2015,0,1,None of the so called liberals will never ask for a uniform civil code. Modi bashing  for them is far more engaging and fun i guess.
16,657418560277340160,Fri Oct 23 04:49:33 +0000 2015,0,0,Its Ballpoint era and I am wondering where these dolts are getting so much ink?
17,657417042694287360,Fri Oct 23 04:43:31 +0000 2015,0,0,"Lets admit, we are an interpretative country. We will never know how people interpret. Lets hope that our Netas will shut up and work hard."
18,655174270449008642,Sat Oct 17 00:11:33 +0000 2015,0,0,What a disappointing day! No one returning any award? deeply disappointed..!!
19,654547205156507648,Thu Oct 15 06:39:49 +0000 2015,0,0,Who's having last laugh at Indian Start up Rush? Of course Media &amp; Ad agencies.. http://t.co/wCf0v3eV23
20,652429353691643904,Fri Oct 09 10:24:14 +0000 2015,0,0,"Rahul Gandhi is done with Steve Jobs...his current read is ""Stay Hungry, stay foolish""!! so Apt?"
21,652396665966493696,Fri Oct 09 08:14:20 +0000 2015,0,0,Protesting against harmless music concerts is insane. Silence is not heard.
22,650634186512924672,Sun Oct 04 11:30:52 +0000 2015,0,0,People who say “Don’t kill dogs” are Animal lovers and those who say “Don’t kill Cows” are communal bigots…Hypocrisy unlimited…
23,648163497566572544,Sun Sep 27 15:53:14 +0000 2015,0,0,PM Narendra Modi Talks About Digital India Vision At The Silicon Valley https://t.co/040BmxkT3n via @YouTube
24,644560279057989632,Thu Sep 17 17:15:20 +0000 2015,0,0,"Debate over: Gujarat no.1, Bihar 21 in development, says Jaitley"
25,643076191792984068,Sun Sep 13 14:58:06 +0000 2015,0,0,This Breathtaking Video Will Inspire You To Get Out And Run http://t.co/fOMHfH6YvI via @MensXP
26,641980101412827141,Thu Sep 10 14:22:38 +0000 2015,0,0,500 chickens in Thane participated in a flash mob to celebrate meat ban http://t.co/dB1j1qTT60
27,641940614372691968,Thu Sep 10 11:45:43 +0000 2015,0,0,Bahubali Sivuni Aana Video Spoof (Bag Bali) https://t.co/4uddzXY2Sp via @YouTube
28,641873606234890241,Thu Sep 10 07:19:27 +0000 2015,0,0,Hawabaazi Vs Hwalabaaz…! Our Netas &amp; their Dialog baazi can give Salim Javed run for his money..
29,640478809385398272,Sun Sep 06 10:57:02 +0000 2015,0,0,"OROP was indeed a Congress initiative...just that OROP should be translated as One Rahul, One Priyanka"
30,640181301975212032,Sat Sep 05 15:14:51 +0000 2015,0,0,4 decades long waiting have finally ended...Kudos to Govt for approving OROP
31,638000535879049217,Sun Aug 30 14:49:15 +0000 2015,0,0,.@PaulPolman We made a video about how #UnileverPollutes Kodaikanal. Workers demand justice now: http://t.co/pEbCRkr6s2 via @Jhatkaa
32,637990578144149505,Sun Aug 30 14:09:41 +0000 2015,0,0,Restaurants now put 'Hardik Patel' signs on reserved tables.
33,636855998557237249,Thu Aug 27 11:01:16 +0000 2015,0,0,Onam Greetings! http://t.co/V8UYWY0d8J
34,636824409525764096,Thu Aug 27 08:55:45 +0000 2015,0,0,Patels were the shining examples of Indians in US. They did very well in the US because of opportunity &amp; not reservation.
35,636395472341463041,Wed Aug 26 04:31:18 +0000 2015,0,0,"Rservation kills merit…someone doesn’t get a seat, someone who deserve it loses it. time to get hard with Patels."
36,636134070456442880,Tue Aug 25 11:12:35 +0000 2015,0,0,Time has come for us to give up onions too...just like some of us have given up LPG. http://t.co/qWqYLRk7i6
37,636122719528972292,Tue Aug 25 10:27:29 +0000 2015,0,0,"Kumar Sangakara have been offered post of SL high com to UK...5 years down the line, he may be SL Prime Minister..."
38,636121460432502784,Tue Aug 25 10:22:29 +0000 2015,0,0,"Tata sky and the rain are a combo made in heaven, just that it doesn't work on earth...sad."
39,636081867410698240,Tue Aug 25 07:45:09 +0000 2015,0,0,"30,000 to 40,000 LPG consumers surrender subsidy daily under 'Give It Up': Oil ministry"
40,636080998095060992,Tue Aug 25 07:41:42 +0000 2015,0,0,China is exporting something new to the world economy: Fear.
41,634914166797570048,Sat Aug 22 02:25:08 +0000 2015,0,0,"If you're single, marry a jain. You can save on onions."
42,631690976554192896,Thu Aug 13 04:57:19 +0000 2015,0,0,Mom&amp;son spoiled our Monsoon secession. Shame http://t.co/zN7qpp2WXA
43,631454973864206336,Wed Aug 12 13:19:32 +0000 2015,0,1,Digital disruption is the need of hour and not Parliament disruption...
44,631454638449922049,Wed Aug 12 13:18:12 +0000 2015,0,0,"Members of Parliament, political parties: Parliament to function - urge all political parties t... https://t.co/bMO02H1lXQ via @Change4India"
45,622967099527331842,Mon Jul 20 03:11:45 +0000 2015,0,0,BCCI makes our political parties look good. A 'working Grp' to study Lodha report?
46,618838736516714496,Wed Jul 08 17:47:06 +0000 2015,0,0,"Andy Murray can proudly claim to be the first British man to win Wimbledon What if he lose out in Semi? well, he will a Scotish."
47,611867629138001920,Fri Jun 19 12:06:25 +0000 2015,0,0,"Expect PM Modi to speak after Yoga Day event, currently he's in 'Lalit Asana'"
48,588257124024745985,Wed Apr 15 08:26:42 +0000 2015,0,0,Mars will heave a sigh of relief in unison with Jupiter. Rahul baba is back! 15th Apl will be celebrated as “Ghar Vapsi Day” by Congressmen…
49,587585072204611584,Mon Apr 13 11:56:12 +0000 2015,0,0,Hannover Fair 2015: 5 things that stood out in PM Modi's 'Make in India' pitch to German investors - Economic Times http://t.co/WacF6sdazJ
50,579172326442299392,Sat Mar 21 06:46:57 +0000 2015,0,0,"Vettori's blinder was Cricket's very own ""Hand of God""?"
51,566910207578484737,Sun Feb 15 10:41:40 +0000 2015,0,0,Enjoy The Ind Vs Pak Match With This Sweet But Epic Ad! You Just Can't Afford To Miss This! http://t.co/xwHcYJ2wjX
52,559713520250392578,Mon Jan 26 14:04:36 +0000 2015,0,0,RIP R K LAXMAN...the common man has lost his voice..
53,556852222831505408,Sun Jan 18 16:34:50 +0000 2015,0,0,AB de Villiers hit 16 sixes in that innings against West Indies. Alastair Cook has hit 10 sixes in total in 92 ODI's..tale of 2 captains!
54,556851863224463360,Sun Jan 18 16:33:24 +0000 2015,0,0,"AB de Villiers tries to prove he's human. 149 off 44, the most ridiculous innings you'll see until the next time he bats."
55,556801551428116480,Sun Jan 18 13:13:29 +0000 2015,0,0,AB De Villiers hits a 31 ball 100! SA remain my favourites for the World Cup this time.
56,550333392042995712,Wed Dec 31 16:51:20 +0000 2014,0,0,http://t.co/tcXcPXRxp6
57,550179003454074882,Wed Dec 31 06:37:50 +0000 2014,0,0,MSD do play the helicopter shot in the World Cup in 2015 ... that's the reason why you are so unique..
58,550166524036513793,Wed Dec 31 05:48:15 +0000 2014,0,1,AB Villiers will create a new record by playing his 97th consecutive Test match on trot. http://t.co/BFKn4Pau9G
59,550146344644382721,Wed Dec 31 04:28:04 +0000 2014,0,0,"Right man, right place, right time...2014 truly belongs to Modi http://t.co/tiftNMi4BJ"
60,550144041086488576,Wed Dec 31 04:18:55 +0000 2014,0,0,"MSD led by example, not rhetoric.."
61,550132372943826944,Wed Dec 31 03:32:33 +0000 2014,0,0,Its Mahi way... A day to celebrate and not be conspiratorial.
62,550129236996919299,Wed Dec 31 03:20:05 +0000 2014,0,0,MS Dhoni showed India what a tough man from a small town could dream and achieve. He has been a role model.
63,549880599582748672,Tue Dec 30 10:52:05 +0000 2014,0,0,"MSD played 90 test on trot...AB &amp; Sangakara top the chart with 95+..sheer coincidence may be, all are wicket keeping batsmen."
64,549788118828580864,Tue Dec 30 04:44:36 +0000 2014,0,0,Kohli nearing 500 runs in this series... What a turn around he has had after the England debacle where he was a walking wicket.
65,549566788044730369,Mon Dec 29 14:05:07 +0000 2014,0,0,Cabinet approves Ordinance to amend Land Acquisition Act..yet another landmark move. GST+Land Acquisition act should drive growth.
66,549448887144943616,Mon Dec 29 06:16:37 +0000 2014,0,0,Familiar sight...5 down for not too many. The real challenge is take the next 5...silver lining--No Smith to contain with!
67,549239817549000704,Sun Dec 28 16:25:51 +0000 2014,0,0,Outstanding batting by Kohli &amp; Rahane. They saved India out of real danger …but our long tail did what they were at best.old habits die hard
68,549109668996341761,Sun Dec 28 07:48:41 +0000 2014,0,0,Brilliant batting by Kohli and Rahane.. More peaks to climb.
69,547986693408555011,Thu Dec 25 05:26:23 +0000 2014,0,0,Vajpayee is an assertive politician with a human touch..
70,547681071635001345,Wed Dec 24 09:11:57 +0000 2014,0,0,http://t.co/iLWVKr1959
71,547611344539619330,Wed Dec 24 04:34:53 +0000 2014,0,0,"226 more people have applied for “Ghar Vapsi” … most of them are Spice jet passengers, stranded @ diff airports due to flight cancellations!"
72,547283641114447872,Tue Dec 23 06:52:42 +0000 2014,0,0,Prakash Javadekar to Sanjay Jha: We aspired 44 seats for one state but the Congress got 44 in the entire country
73,547283256991707137,Tue Dec 23 06:51:11 +0000 2014,0,0,http://t.co/e0cN0yYzXc
74,547282404109344769,Tue Dec 23 06:47:47 +0000 2014,0,0,Rupee Vs Dollar conversion is the only one matters the most…
75,546922576027455488,Mon Dec 22 06:57:58 +0000 2014,0,0,Rupee touched an all-time low of 64 today and going out of control… “Ghar Vapsi” on INR is the need of the hour…!!!
76,545588175033208832,Thu Dec 18 14:35:32 +0000 2014,0,0,"If conversions are ok for one religion, then they should be ok for another religion too. Or ban them across."
77,545543567658074112,Thu Dec 18 11:38:16 +0000 2014,0,0,RS disrupted for the 4th day in a row. Opposition guys are more suited 2 run halwai shop and not parliament. With due apologies to halwais.
78,545472673719926784,Thu Dec 18 06:56:34 +0000 2014,0,0,ISRO has successfully carried out human crew module experiment. Does this mean that now we can pack off “Opposition team” to space?
79,545132788001697792,Wed Dec 17 08:25:59 +0000 2014,0,0,Ironic that this year's Nobel Peace Prize &amp; Peshawar butchery originated from the same country.
80,545131244661391360,Wed Dec 17 08:19:51 +0000 2014,0,1,Imran Khan is yet to condemn Taliban. He has proven to the world that he is yet another self serving inhuman opportunist!
81,544798689261137921,Tue Dec 16 10:18:24 +0000 2014,0,0,All humanity is diminished today by the actions of these savages .
82,544794312576233472,Tue Dec 16 10:01:00 +0000 2014,0,0,Yesterday was Sydney Siege and today a massacre at Peshawar school… What maddeningly sick times do we live in?
83,544793253212459008,Tue Dec 16 09:56:47 +0000 2014,0,0,How can someone target innocent Children ? What maddeningly sick times do we live in?
84,543996838429200384,Sun Dec 14 05:12:07 +0000 2014,1,0,"RT @CallMeSiD: There is no Madrasi we are all Padosi..#SouthIndia 
http://t.co/kNkVq179iv"
85,541084689130196992,Sat Dec 06 04:20:17 +0000 2014,0,0,China has surpassed US &amp; now has the no 1 economy in the world. After hearing this China's children asked So now can we take a lunch break?
86,537975032392056832,Thu Nov 27 14:23:37 +0000 2014,0,0,Gone too soon. RIP Phil Hughes http://t.co/HtxLUmaW4R
87,536572702237020162,Sun Nov 23 17:31:15 +0000 2014,0,0,"Hamilton now joins an elite crop of double world champions. Brit will be hoping this success, is a springboard for further glories."
88,535474540336250880,Thu Nov 20 16:47:33 +0000 2014,0,0,One of the smartest things the Modi could do right now is to provide voting rights to NRIs.. All in the bag.
89,534354510299140096,Mon Nov 17 14:36:57 +0000 2014,0,0,"The event @ Allphones Arena may be less grand than that Madison square, but less filmy and more Indian. Bravo!"
90,534354280782635008,Mon Nov 17 14:36:03 +0000 2014,0,0,PM Narendra Modi in Sydney once again proves that he is India's ultimate showman in politics
91,533895030763573250,Sun Nov 16 08:11:09 +0000 2014,0,0,"With frequent foreign trips, Narendra Modi declared India’s first “Onsite PM”"
92,533504923049017344,Sat Nov 15 06:21:00 +0000 2014,0,0,3 weeks since I left my brand new Terrano for service check up at Nissan India..I am yet to get my car back.
93,533504671327846400,Sat Nov 15 06:20:00 +0000 2014,0,0,Nissan India is taking its customers for a royal ride
94,533504315151773696,Sat Nov 15 06:18:35 +0000 2014,0,0,@Nissan_India 3 weeks since I left car Brand new Terrano for service check up at Nissan Service center and I yet to get my car back.
95,533499316002766849,Sat Nov 15 05:58:43 +0000 2014,0,0,@Nissan_India Shawar Nissan Service Center (BLR) is the worst service center in the world. Guys are lethargic and irresponsible.
96,533499195307466752,Sat Nov 15 05:58:14 +0000 2014,0,0,Shawar Nissan Service Center (BLR) is the worst service center in the world. Guys are lethargic and irresponsible.
97,533453141295894530,Sat Nov 15 02:55:14 +0000 2014,0,0,"Samsung is working on a new app that gives you a 10-second warning before an earthquake. The app is called ""Too Late."" !!"
98,533100096947519488,Fri Nov 14 03:32:22 +0000 2014,0,0,Nissan Service experience is nothing short of nightmare
99,533098997633015808,Fri Nov 14 03:28:00 +0000 2014,0,0,@Nissan_India Terrible Service experience at Shawar Nissan..i regret my decision to buy Terrano. Deeply disappointed
100,533097913455755265,Fri Nov 14 03:23:41 +0000 2014,0,0,@Nissan_India People who buy Nissan Terrano will also be given downloads of apps such as Uber and Ola Cabs for the service backup..
101,533097683062644736,Fri Nov 14 03:22:46 +0000 2014,0,0,People who buy Nissan Terrano will also be given downloads of apps such as Uber and Ola Cabs for the service backup..
102,532937198522216448,Thu Nov 13 16:45:04 +0000 2014,0,0,Nissan India Service center sucks..
103,532847047930413056,Thu Nov 13 10:46:50 +0000 2014,0,0,Service experience at Nissan is horrible. Think twice before buying Nissan product
104,532846876186267648,Thu Nov 13 10:46:09 +0000 2014,0,0,Nissan India's service experience is horrible..2 weeks plus and they are yet to find a clutch plate replacement. Spineless guys
105,531726577583652864,Mon Nov 10 08:34:29 +0000 2014,0,0,"Heart says Hamilton, head says Rosberg, Hamilton the bigger talent but more prone to errors &amp; misfortune and maybe less cool under pressure."
106,531061993659056129,Sat Nov 08 12:33:40 +0000 2014,0,0,Buffaloes on our runways is unthinkable. Have we merged Civil aviation and animal husbandry ministries together?
107,530621881120862208,Fri Nov 07 07:24:49 +0000 2014,0,0,South India is not one State. Break the Stereotypes. http://t.co/7D9rejFlhc
108,530613251978301442,Fri Nov 07 06:50:32 +0000 2014,0,0,"Nolan creates overwhelming, often breathtaking suspense in a number of sequences…Interstellar is a Must watch"
109,530613107316768769,Fri Nov 07 06:49:57 +0000 2014,0,1,Interstellar is sufficiently grand and challenging to bear comparison with epic sci-fi: A Space Odyssey &amp; Gravity.
110,530403540338892800,Thu Nov 06 16:57:13 +0000 2014,879,0,RT @NASA: .@NASASunEarth's #SDO captured a Nov 5 mid-level solar flare in extreme ultraviolet light: http://t.co/ZJgaQp6HeT http://t.co/FDp…
111,529555037500866560,Tue Nov 04 08:45:34 +0000 2014,0,0,One of the top selling costumes this Halloween is a vampire version of President Obama called 'Barackula.
112,529554729374740480,Tue Nov 04 08:44:20 +0000 2014,0,0,Bangalore based IT company introduces “Work-from-Bus” as traffic takes a turn for the worse
113,529554205346766848,Tue Nov 04 08:42:15 +0000 2014,0,0,"Post Diwali Dhamaka, Flipkart ties up with Arvind Kejriwal to sell mufflers online..!! seasons sales by seasonal politician is back.."
114,529552701500035073,Tue Nov 04 08:36:17 +0000 2014,0,0,"Halloween is a day when we all get to fool people into thinking we're someone else. Or as Rahul Gandhi calls it, campaigning"
115,529227949552058369,Mon Nov 03 11:05:50 +0000 2014,0,0,"Statistically speaking, contest is far from over, but the psychology says it is... Its advantage Hamilton."
116,529128880561717249,Mon Nov 03 04:32:10 +0000 2014,0,0,2 races to go &amp; 75 points for grab… F1 title chase will go down to the wire. Love to see Hamilton lifting the cup
117,528799419575988224,Sun Nov 02 06:43:00 +0000 2014,0,0,3 in a row for Younis Khan. Outstanding achievement from an outstanding batsman…
118,528463060579520512,Sat Nov 01 08:26:26 +0000 2014,0,0,"The CEO of Apple, Tim Cook, announced he is gay. Rival Samsung responded by saying their CEO is 50 % more gay..!!"
119,525885162848915457,Sat Oct 25 05:42:47 +0000 2014,0,0,"Yet another person jumped the White House fence. It happened again. On the bright side, Obama is finally getting more Americans to exercise"
120,525313848387977216,Thu Oct 23 15:52:35 +0000 2014,0,0,http://t.co/DJgrn1cPeU
121,525311545194991616,Thu Oct 23 15:43:26 +0000 2014,0,0,http://t.co/ktlszWIyl5
122,525307496315887619,Thu Oct 23 15:27:21 +0000 2014,0,0,Remarkable gesture by PM to visit Siachen.
123,525307092349886464,Thu Oct 23 15:25:45 +0000 2014,0,0,http://t.co/1v9vb6oHcW
124,525275496934699009,Thu Oct 23 13:20:12 +0000 2014,0,0,http://t.co/1Ddpd2pf32
125,524060230829608960,Mon Oct 20 04:51:10 +0000 2014,0,0,As per Forbes Michael Jackson earned $140 M in 2014.  U have to admire Michael's work ethic. A lot of big stars stop working when they die
126,524059275190996993,Mon Oct 20 04:47:22 +0000 2014,0,0,"One should build service apartments outside of Apple stores so people can live in line, waiting for their products...!"
127,523787363957211136,Sun Oct 19 10:46:53 +0000 2014,0,0,UNESCO SHOULD declare Congress a World Heritage Party.... and preserve it too !!
128,522719942588657665,Thu Oct 16 12:05:20 +0000 2014,0,0,"The unthinkable was achieved by unknown club cricketer James Tull, as he smashed 341 for Mater Hill in a 44 over"
129,521954586228436992,Tue Oct 14 09:24:05 +0000 2014,0,0,Its crystal clear...what Congress need is a MP3 player and not a spokesperson...
130,521516266834497536,Mon Oct 13 04:22:21 +0000 2014,0,0,"Juila Pierson's 1st job was a costumed character @ Disney World. It may be a wild guess, but I suspect character was “Sleeping Beauty"" ??"
131,521510332695453696,Mon Oct 13 03:58:47 +0000 2014,0,0,Today is Vladimir Putin's 62nd birthday. He celebrated the way he always does: having someone try his cake before him
132,521497040032120832,Mon Oct 13 03:05:57 +0000 2014,0,0,"Phailin and year back and Hudhud now, IMD hit the bull’s eye when it came to tracking the course of Cyclone.. spot on twice"
133,519112102741413888,Mon Oct 06 13:09:04 +0000 2014,0,0,Flipkart is giving 75% off on Half Girlfriend. Should we call Quarter Girlfriend ?
134,519111206091517955,Mon Oct 06 13:05:30 +0000 2014,0,0,Flipkart just made Tatkal on irctc look good. Thank You Flipkart.
135,517859923858685952,Fri Oct 03 02:13:21 +0000 2014,0,0,"Incheon conquered, Rio calling...Proud of our Hockey Team"
136,517683420072128513,Thu Oct 02 14:32:00 +0000 2014,1,0,"Congrats to the men in blue! Not cricketers, but hockey players! Sreejesh played like a real hero"
137,517217253570641920,Wed Oct 01 07:39:37 +0000 2014,0,0,Mary Kom wins Asian Games gold… sad part is that PC earned more money acting as Mary Kom than Mary Kom earned all her life being herself.
138,517203596530569216,Wed Oct 01 06:45:21 +0000 2014,0,0,"Chelsea Clinton gave birth to a baby girl. True to the family tradition, baby girl will not confirm or deny whether she will contest in 2056"
139,517202808718651393,Wed Oct 01 06:42:13 +0000 2014,0,0,"Longest bachelor party held over the course of the last 30 years has come to an end … that’s right, George Clooney got married in Italy"
140,517202267296903168,Wed Oct 01 06:40:04 +0000 2014,0,0,George Clooney got married in Italy. His bachelor party was held over the course of the last 30 years.
141,517202045548261376,Wed Oct 01 06:39:11 +0000 2014,0,0,"This weekend the world said goodbye to one of the greatest players of all time. That's right, George Clooney finally got married!"
142,517201683286212608,Wed Oct 01 06:37:45 +0000 2014,0,0,Magnificent' Mary Kom gets gold for India at Asian Games http://t.co/nfvBEeeqli
143,517201060427882497,Wed Oct 01 06:35:16 +0000 2014,0,0,"Congrats to Chelsea Clinton, who gave birth to a baby girl named Charlotte. Or as Hillary described the baby, “3rd n line to the throne.”"
144,516991466564902913,Tue Sep 30 16:42:25 +0000 2014,0,0,Karnataka MLAs plan a short foreign trip while Arnab is in USA...
145,516959605830610944,Tue Sep 30 14:35:49 +0000 2014,0,0,"Today Russia announced that it will join America’s fight with the terror group ISIS. Then Putin said, ""But I did not say which side."""
146,514825787132751872,Wed Sep 24 17:16:47 +0000 2014,0,0,White House has re-evaluated its security and they will start locking the front door. They will start asking who's there when someone knocks
147,514808872289071104,Wed Sep 24 16:09:34 +0000 2014,0,0,http://t.co/dpYkagtH5l
148,514638103785775104,Wed Sep 24 04:51:00 +0000 2014,0,0,Mangalyaan @ Rs.450 Cr works 11.25/KM...BLR Auto charges 15/KM...Congrats ISRO !!
149,514618465223987202,Wed Sep 24 03:32:57 +0000 2014,0,0,Ajith Singh is constant touch with ISRO…he’s hopeful that Mangalayan bring back Charan Singh to the bungalow he is attempting to steal!
150,514613229285556225,Wed Sep 24 03:12:09 +0000 2014,0,0,"First signal sent by orbiter is picture of a signboard that reads ""Come, Make in Mars."""
151,513731518347624449,Sun Sep 21 16:48:33 +0000 2014,0,0,Mars may be getting crowded. NASA orbiter is approaching Mars orbit and it will be followed closely by India's first interplanetary probe.
152,513714199348801536,Sun Sep 21 15:39:44 +0000 2014,0,0,Bilawal Bhutto or Below-all Bhutto?
153,513708667669975040,Sun Sep 21 15:17:45 +0000 2014,0,0,Now mungeri lal's dreams are transborder--Bilawal Bhutto
154,513706554042748928,Sun Sep 21 15:09:21 +0000 2014,0,0,Escape velocity do have a cross border cousin...?
155,512439141418561536,Thu Sep 18 03:13:06 +0000 2014,0,0,Will Britain to walk away Scot free today?
156,512083249385181184,Wed Sep 17 03:38:55 +0000 2014,0,0,http://t.co/pnduYYQkQO
157,512081612285030400,Wed Sep 17 03:32:25 +0000 2014,0,0,"iPhone 6 and iPhone 6 Plus received 4M pre-orders in 24 hours. Meanwhile, the new Blackberry keeps driving by ur house to see if u r  home"
158,512077864808620032,Wed Sep 17 03:17:31 +0000 2014,0,0,"It's a hot day here in Chennai. It was so hot, I saw cat doing the ice-bucket challenge"
159,512076647533535232,Wed Sep 17 03:12:41 +0000 2014,0,0,World's factory will meet world's back office today...expectations are high on India China meet.
160,512075165870456832,Wed Sep 17 03:06:48 +0000 2014,0,0,YOUNGISTAN going to the Oscars? Are we gone nuts?
161,511798843000635392,Tue Sep 16 08:48:47 +0000 2014,0,0,Interesting by-election verdict. Never take the Indian voter for granted.
162,511746304285093888,Tue Sep 16 05:20:01 +0000 2014,0,0,"State election result is a proof that BJP needs Modi, more than he needs the BJP."
163,509940701895749632,Thu Sep 11 05:45:12 +0000 2014,0,0,"Apple mobile to replace credit cards. If there’s 1 company u want to trust with ur money, it’s the company that leaked celebrity “photos”… ?"
164,509899206270533632,Thu Sep 11 03:00:18 +0000 2014,0,0,"Our coal reserves 200 b tons, yet we import 150 m tons a yr. CIL reserves Rs 56,000 cr, coal import bill Rs 52000 cr. Indian irony"
165,509753232529178625,Wed Sep 10 17:20:16 +0000 2014,0,0,"Apple mobile wallet to replace credit cards.If there's one company u want to trust with your money, it's the company that leaked nude photos"
166,509752353503731712,Wed Sep 10 17:16:46 +0000 2014,0,0,"Obama will be at NATO summit, where he will discuss actions of Putin, who wasn't invited. Then Putin said, 'Has that ever stop me before?"
