,id_str,created_at,retweet_count,favorite_count,text
167,509750854119735296,Wed Sep 10 17:10:48 +0000 2014,0,0,"Apple iWatch can also track your movements to tell you how much you've exercised in a day. So long as it doesn't laugh, i am fine..."
168,509579977243623425,Wed Sep 10 05:51:48 +0000 2014,0,0,iWatch. Stunning. Mindblowing
169,509283057103159297,Tue Sep 09 10:11:57 +0000 2014,0,0,Modi didn't do routine aerial survey but reviewed on ground. Good precedent.
170,508892682857357312,Mon Sep 08 08:20:45 +0000 2014,0,0,Time to salute our armed forces and the para military forces for the remarkable work in Kashmir
171,508825973714726912,Mon Sep 08 03:55:40 +0000 2014,0,0,"Lewis - Rosberg added another chapter to their heated rivalry...but at the end, Lewis gets his revenge."
172,508636403756843008,Sun Sep 07 15:22:23 +0000 2014,0,0,Hamilton ups the pressure on Rosberg with Italy win
173,508272266396700672,Sat Sep 06 15:15:26 +0000 2014,0,0,Celebrities are loving BlackBerry. It is so secure...neither you can ever take photos nor you can store it...
174,508270847107141632,Sat Sep 06 15:09:47 +0000 2014,0,0,Kim Kardashian is calling her nude leaked photos ‘stuff I was going to release next week.’
175,508270563840647168,Sat Sep 06 15:08:40 +0000 2014,0,0,"New iPhone is going to come out soon. It’s going to come with a larger screen, more memory, and it can leak celebrity photos twice as fast.”"
176,507743498628771840,Fri Sep 05 04:14:18 +0000 2014,0,0,"On Teachers' Day, students to attend Modi ki paathshala"
177,506730753846042624,Tue Sep 02 09:10:00 +0000 2014,0,0,Mars Orbiter Mission has completed 300 days of its journey in space and is just 23 days away from reaching its intended orbit.
178,506723938181734400,Tue Sep 02 08:42:56 +0000 2014,0,0,"Contrasting backgrounds! One a proud tea-sellers son, other a PM's grandson. Yet  more camaraderie than with US /UK ."
179,506722777953742848,Tue Sep 02 08:38:19 +0000 2014,0,0,Mars Orbiter Mission (Mangalyaan) completes 300 days in space
180,506377949218471937,Mon Sep 01 09:48:05 +0000 2014,0,0,Chai pe Charcha is now Global... http://t.co/CKN1DcmsNs
181,505901215373213696,Sun Aug 31 02:13:43 +0000 2014,0,0,MOM (Mars Orbiter Mission) has completed 90 per cent of its journey towards the red planet
182,505901060108464128,Sun Aug 31 02:13:06 +0000 2014,0,0,Which is the real Imran? The greatest all-rounder Pakistan cricket produced? Or a potential self-styled anarchist?
183,505900893632331776,Sun Aug 31 02:12:26 +0000 2014,0,0,Mangalyaan to reach its Mars orbit soon
184,505689919767842817,Sat Aug 30 12:14:06 +0000 2014,0,0,"Within a couple of hours of his arrival, an agreement has been signed between the cities of Kyoto and Varanasi."
185,505689802323152896,Sat Aug 30 12:13:38 +0000 2014,0,0,"Not a minute to lose, that seems to be the priority of Prime Modi as he began his 5 day bilateral visit to Japan."
186,504852941753176064,Thu Aug 28 04:48:15 +0000 2014,0,0,"Suresh Raina is classic example of an Indian modern day cricketer: outstanding in ODIs and T 20, struggles in tests."
187,504309165376819200,Tue Aug 26 16:47:29 +0000 2014,0,0,California earthquake was so powerful it knocked Arnold Schwarzenegger off his housekeeper...!
188,504101996538781696,Tue Aug 26 03:04:16 +0000 2014,0,0,ISRO's Mars Orbiter Mangalyaan Just A Month Away From Rendezvous With Red Planet
189,503782691041320960,Mon Aug 25 05:55:28 +0000 2014,0,0,India's Mars Orbiter spacecraft is expected to enter the Red Planet's orbit on 24 September morning
190,503734469073707008,Mon Aug 25 02:43:51 +0000 2014,0,0,Mars Orbiter Mission: India’s ‘giant leap’ a month away
191,503022409075527680,Sat Aug 23 03:34:22 +0000 2014,0,0,"Happy birthday to former President Bill Clinton. He turned 68 today, or as he calls, 'one away from the fun one.'"
192,502702815949881344,Fri Aug 22 06:24:25 +0000 2014,0,1,Jet cabin crew who sport more than 4 pimples r grounded. 5 pimples and u r out. What happens if 5 pimple appears mid-air?
193,502661001188478976,Fri Aug 22 03:38:16 +0000 2014,0,0,"Ice Bucket challenge, African edition! http://t.co/7Xz5yGpToe"
194,502653318611877889,Fri Aug 22 03:07:44 +0000 2014,0,0,"Irom Sharmila is truly a remarkable woman. Anna becomes a national hero when he fasts for a week, Irom has been fasting for 14 years!"
195,502444326551441408,Thu Aug 21 13:17:17 +0000 2014,0,0,http://t.co/zsAfd8MVBP
196,502441863903584256,Thu Aug 21 13:07:29 +0000 2014,1,0,Has Rahul Gandhi taken ice bucket challenge? all sleepy guys should take this test...strongly recommended...
197,502378929290629120,Thu Aug 21 08:57:25 +0000 2014,0,0,"Lets nominate Indian cricket team for Ice bucket challenge...at least, some of these guys will wake up...finally"
198,502346870614949888,Thu Aug 21 06:50:01 +0000 2014,0,0,Ice water challenge origin can be traced back in Ram Teri Ganga Mali days...! Long live Mandakini...!!
199,502345735648473088,Thu Aug 21 06:45:31 +0000 2014,0,0,Ice Bucket challenge is aimed @ social media rather then charity...no one is donating...just that they chilling out n ice water
