,id_str,created_at,retweet_count,favorite_count,text
0,509059114605883392,Mon Sep 08 19:22:05 +0000 2014,0,0,@akshaykumar  happy happy birthday sir... God bless you always with lots of love and happiness..
1,427414274760130560,Sun Jan 26 12:14:38 +0000 2014,83,0,RT @SirJadeja: #26ChangesIWishToSee Indian Education System needs to be changed! It sucks. RT if agree. http://t.co/WMRP2U96mA
2,426478428380876800,Thu Jan 23 22:15:55 +0000 2014,0,1,Sleepy sleepy...
3,156389082203815936,Mon Jan 09 14:57:17 +0000 2012,0,0,Starting 2012 great with a bonus $205 thanks to this CNBC article http://t.co/sbONarxX
4,72729381059035136,Mon May 23 18:23:30 +0000 2011,0,0,@taran_adarsh Zindagi nmd
5,72473094119370753,Mon May 23 01:25:06 +0000 2011,0,1,Simply silly
6,67836833177939968,Tue May 10 06:22:16 +0000 2011,0,0,life is a challenge face it...
7,67271035053031424,Sun May 08 16:53:59 +0000 2011,0,0,life is a challenge face it...
8,66438421840797696,Fri May 06 09:45:28 +0000 2011,0,0,life is a challenge face it...
9,64722740749406208,Sun May 01 16:07:58 +0000 2011,0,0,life is a challenge face it...
10,64331821822910465,Sat Apr 30 14:14:36 +0000 2011,0,0,life is a challenge face it...
11,63189485772484609,Wed Apr 27 10:35:22 +0000 2011,0,0,life is a challenge face it...
12,62776659685801984,Tue Apr 26 07:14:56 +0000 2011,0,0,life is a challenge face it...
13,62410252762615808,Mon Apr 25 06:58:58 +0000 2011,0,0,life is a challenge face it...
14,60553114457096192,Wed Apr 20 03:59:22 +0000 2011,0,0,life is a challenge face it...
15,58189445714812928,Wed Apr 13 15:26:59 +0000 2011,0,0,life is a challenge face it...
16,57771287245881345,Tue Apr 12 11:45:22 +0000 2011,0,0,life is a challenge face it...
17,56756030369054720,Sat Apr 09 16:31:06 +0000 2011,0,0,life is a challenge face it...
18,19320505790103552,Mon Dec 27 09:15:42 +0000 2010,0,0,"People of banbasa again facing the electric cut problems......Light goes early in the morning and when come, no... http://fb.me/Rtw02Gvj"
19,18939043911831552,Sun Dec 26 07:59:54 +0000 2010,0,0,The Aussies bowled out for 98! Nope you're not dreaming!.........whome u r supporting ?
20,18629641866575873,Sat Dec 25 11:30:27 +0000 2010,0,0,thakur misthan bhandar http://fb.me/Lfg6rG7z
21,18520261582127104,Sat Dec 25 04:15:49 +0000 2010,0,0,Merry Christmas to all. Have fun with your santa :-) http://fb.me/QoPP07mL
22,17129001931767809,Tue Dec 21 08:07:26 +0000 2010,0,0,sumthing more abt banbasa on wikipedia........plz read this out http://fb.me/yqBtT0Ne
23,17124981464891392,Tue Dec 21 07:51:28 +0000 2010,0,0,"Hey friends wassup? CHRISTMAS is near, so how are you preparing for it???"
24,16045822009413632,Sat Dec 18 08:23:16 +0000 2010,0,0,Byandhura Baba Ka Mela Shuru Hone Mein Kuch Hi Din Hain Bhakto.....How Many Time You Have Visit This Temple?? If... http://fb.me/OFwoxz4c
25,14917100363583488,Wed Dec 15 05:38:08 +0000 2010,0,0,"Gas ke liye log subah 4 baje se line lagate hain, fir 12-1 baje tak khade rehne ke baad pata chalta hai ki aaj to... http://fb.me/Qk6FLOll"
26,14203570429624322,Mon Dec 13 06:22:49 +0000 2010,0,0,http://www.youtube.com/watch?v=Df54YZBkH5w http://fb.me/Q1KFuJ6B
27,13995174245961728,Sun Dec 12 16:34:44 +0000 2010,0,0,"Hai Friends, Wssup??? hws u ??? Missing The Chill Of Banbasa Or Enjoying It In Banbasa???"
28,13534774962421760,Sat Dec 11 10:05:16 +0000 2010,0,0,"Hey Prabhu....un tamam studnts ko xam me kamyab karna.. jinhe sal bhar padhne ka time nai mila,un masum hatho ko... http://fb.me/D1s0ZJJL"
29,13095137827622912,Fri Dec 10 04:58:18 +0000 2010,0,0,"Jhhot Bolna Paap Hai, Nadi Kinare Saanp Hai, Kaali Maiya Aayegi. Gala Kaat Ke Le Jaayegi ;-)  (Kuch Yaad Aaya??... http://fb.me/wQX0VnYn"
30,12409650443984896,Wed Dec 08 07:34:25 +0000 2010,0,0,Thand ke mosham mein der subah tak moti-moti razai ke andar soye rehna....mummy ke baar baar uthane par bhi soye... http://fb.me/KQTL3XSJ
31,11028202193424384,Sat Dec 04 12:05:02 +0000 2010,0,0,CBI's Website Is Hack By The Pakistani Hackers....Kya Hoga Is Desh Ka.
32,11027449403940864,Sat Dec 04 12:02:03 +0000 2010,0,0,Breking New:- CBI's Website Is Hack By The Pakistani Hackers....Kya Hoga Is Desh Ka.
33,11026644579917824,Sat Dec 04 11:58:51 +0000 2010,0,0,CBI's Site Is Hack By The Pakistani Hackers....Kya Hoga Is Desh Ka.
34,10747431465517056,Fri Dec 03 17:29:21 +0000 2010,0,0,wikileaks.ch the new address of wikkileakes....be update and see the truth which world dont no...
35,10669908413120512,Fri Dec 03 12:21:19 +0000 2010,0,0,hey friends do u know that  wikkileakes has disable :( Bt the sources sayes that the new domain for this site will... http://fb.me/J73LBNRi
36,10605234162241537,Fri Dec 03 08:04:19 +0000 2010,0,0,Do you know about wikileaks or not....
37,9889046457221120,Wed Dec 01 08:38:27 +0000 2010,0,0,"Ajeeb dastan hoti h dosti ki
ladna milne se b acha lgta h
lad ke manane wale b hote h kch
to kch ko chidhana acha... http://fb.me/OzZeRaoG"
38,9130528582148098,Mon Nov 29 06:24:22 +0000 2010,0,0,Munni Or sheela :P ? http://fb.me/LeLkFiXr
39,8720663187562496,Sun Nov 28 03:15:42 +0000 2010,0,0,"Yaad Aate Hain Wo School Ke Din
Na Jaate The School Doshton Ke Bin
Kaisi Wo Dosti Thi Kaisa Tha Wo Pyar
Ek Din Ki... http://fb.me/OEQ2gKtl"
40,8720572175351808,Sun Nov 28 03:15:21 +0000 2010,0,0,"Yaad Aate Hain Wo Shayahi Se Range Haath
Kaya Din The Wo Jab Karte The Lunch Saath
Chhutti Ki Ghanti Sunte Hi Wo... http://fb.me/xceN1j4j"
41,8032170123722752,Fri Nov 26 05:39:53 +0000 2010,0,0,"Do you Know, Now their are 2 ATM in Banbasa,One Is In Bank Of Baroda, And Second Is At Military Camp.. But Most Of... http://fb.me/OOChagNm"
42,7322429026213888,Wed Nov 24 06:39:37 +0000 2010,0,0,Paatni chorahe se lekar meena baazar tak ki road ko repair kiya ha raha hai...
43,6587476395163648,Mon Nov 22 05:59:11 +0000 2010,0,0,Now the marriage season is start...wts your plan?
44,4749038062669824,Wed Nov 17 04:13:53 +0000 2010,0,0,Aaj Ka Naashta Humari Taraf Se....Garma Garam Khaaje... Ek Ek Hi Uthana:-) http://fb.me/GKRKCUh2
45,4096217277534209,Mon Nov 15 08:59:48 +0000 2010,0,0,which is your favourate place in Banbasa??? Please share with us
46,1557418714599424,Mon Nov 08 08:51:32 +0000 2010,0,0,Surprise Surprise Surprise .....Not So Many People Came In NHPC Day....wt u say abt that? wt reason will behind that?
47,1556920972349441,Mon Nov 08 08:49:33 +0000 2010,0,0,"I posted 8 photos on Facebook in the album ""NHPC Day"" http://fb.me/KpIAvh3G"
48,884960110051328,Sat Nov 06 12:19:25 +0000 2010,0,0,how u celebrate diwali?
49,882512767229952,Sat Nov 06 12:09:42 +0000 2010,0,0,"I posted 11 photos on Facebook in the album ""Banbasa"" http://fb.me/NjyjrpIy"
50,476277056217088,Fri Nov 05 09:15:27 +0000 2010,0,0,"I posted 11 photos on Facebook in the album ""Banbasa"" http://fb.me/KgDm23Pe"
51,29661438405,Thu Nov 04 11:52:26 +0000 2010,0,0,"I posted 60 photos on Facebook in the album ""Banbassa’s Ramleela"" http://fb.me/KBl0XFiS"
52,29660346406,Thu Nov 04 11:35:33 +0000 2010,0,0,"I posted 10 photos on Facebook in the album ""Banbasa"" http://fb.me/NxPFVYCn"
53,29445238714,Tue Nov 02 06:05:36 +0000 2010,0,0,Lot Of People Are Coming Home To Celebrate Diwali....
54,28985347444,Thu Oct 28 12:47:18 +0000 2010,0,0,"A Quote By RATAN TATA

""I Dont Belive,
In Taking Right Decisions,
I Take Decisions,
...& Then l Make Them Right""... http://fb.me/FoNoaqbP"
55,28796606073,Tue Oct 26 14:37:26 +0000 2010,0,0,"Banbassa's Market Is Redy Fior Welcome Of Diwali, If You Were Their What You Do???"
56,28611841847,Sun Oct 24 17:05:48 +0000 2010,0,0,Today is Lions club ka mela.....Miss it or enjoying it??????
57,28524374700,Sat Oct 23 18:33:12 +0000 2010,0,0,hey friends good news...............we are now 100+ So lets chers :-)
58,27924431448,Wed Oct 20 12:05:31 +0000 2010,0,0,Hai friends. Whats Goiong On? People Who Are Out Of Banbasa Coming Back To Home For Deewali Or Not??
59,27729686819,Mon Oct 18 12:32:41 +0000 2010,0,0,"I posted 12 photos on Facebook in the album ""Banbasa"" http://fb.me/DkMH8JSR"
60,27534547713,Sat Oct 16 12:03:54 +0000 2010,0,0,Bhaktjano....Aapki Seva Mein Prastut Hai Banbassa Ki Ramleela ki Kuch Jhalkiyan....Hame Ummid Hai Aapko hamara Ye... http://fb.me/tuVpGaXi
61,27534346420,Sat Oct 16 12:00:37 +0000 2010,0,0,"I posted 14 photos on Facebook in the album ""Banbassa’s Ramleela"" http://fb.me/ILKrRDyW"
62,27335726014,Thu Oct 14 12:29:40 +0000 2010,0,0,"Raamleela Going So Good In Banbasa...Our Sources Says That Their Was Too Much Rush Last Day, Because Of ""Seeta... http://fb.me/KUz4Zzag"
63,27219780011,Wed Oct 13 07:16:05 +0000 2010,0,0,"Friends Due To Some Work I am not In banbassa, Is their any one who can post some pictures of Banbassa's Raamleela...............pls post"
64,27219430936,Wed Oct 13 07:08:20 +0000 2010,0,0,ramleela pics needed............pls post
65,27160297992,Tue Oct 12 17:47:57 +0000 2010,0,0,"I posted 5 photos on Facebook in the album ""Nepal"" http://fb.me/J5bWx0v1"
66,27120271576,Tue Oct 12 08:27:39 +0000 2010,0,0,Wish You All The Best To All People Who Participating For Joining  Indian Army In Banbasa Today..
67,27120181154,Tue Oct 12 08:25:38 +0000 2010,0,0,Wish You All The Best To All People Who participating For Joining Army Camp In Banbasa..
68,27016415925,Mon Oct 11 08:39:43 +0000 2010,0,0,"बानर क्लासेस, आओ  कमप्यूटर सीखें  :))) http://fb.me/KSJhNbZm"
69,26833343974,Sat Oct 09 10:52:27 +0000 2010,0,0,"Bhakt Jano Raamleela Ka Subhaarambh Ho Chuka hai, Sabhi Log Zyaada Se Zyaada Din Banbasa Ki Aitihasik Raamleela Ka... http://fb.me/HNfcPSMp"
70,26731993109,Fri Oct 08 09:14:40 +0000 2010,0,0,"Happy Navraatri To All Members...Jor Se Bolo ""JAI MAATA DEE"" http://fb.me/Ff8035p9"
71,26614793533,Thu Oct 07 03:17:17 +0000 2010,0,0,"A boy was crying because he did not had shoes, he stopped crying when he saw a man without legs. Life is full of... http://fb.me/BqRWkCna"
72,26519474228,Wed Oct 06 03:39:54 +0000 2010,0,0,Laxman Laxman Laxam....India se zyaada to Australia Laxman ka naam ka jaap kar raha hoga...wt u say about last day's win over Australia ?
73,26232230307,Sun Oct 03 03:19:41 +0000 2010,0,0,"Chandrkaanta, Mahabharat, Junoon ,Swabhimaan, Neem Ka pedh.....These are the some Doordarshan's Program Which... http://fb.me/utk8UpSH"
74,26150906810,Sat Oct 02 05:48:36 +0000 2010,0,0,Vartmaan duniya ko Darshaati Hui Ek Chhoti Si Koshish.....Wt Say Abt It? http://fb.me/IUjoW8jq
75,26092545243,Fri Oct 01 15:55:06 +0000 2010,0,0,"I posted 11 photos on Facebook in the album ""Banbasa"" http://fb.me/J8ZRYlZD"
76,26089440130,Fri Oct 01 15:21:03 +0000 2010,0,0,"October is here, Swater, Jaket, Baniyaan, Mokhlar,High-Neck etc Neekaal Lo Yaar....Thand start hone waali hai :-)"
77,25892711558,Wed Sep 29 15:26:13 +0000 2010,0,0,Have You Ever Done Shopping From Mahendranagar Or Any Other Market Of Nepal??? Its Great......
78,25794648970,Tue Sep 28 15:26:35 +0000 2010,0,0,"Who is the most popular person in Banbasa, do u know? wait we say you, Its RATIBHAAN chaat waale :-)

Bachha... http://fb.me/KpaNW8QQ"
79,25593962275,Sun Sep 26 14:24:19 +0000 2010,0,0,Who is the best actore in Banbasa's Raam Leela?? And Why????
80,25593861642,Sun Sep 26 14:23:05 +0000 2010,0,0,Who is the Best Actore In Banbasa's Raamleela??? And
81,25467286041,Sat Sep 25 03:44:59 +0000 2010,0,0,Coming..................Raamleela  Lions Clubs Mela and NHPC Mela
82,25285360802,Thu Sep 23 06:50:42 +0000 2010,0,0,The PM has announced a Rs 500-cr ad hoc assistance to Uttarakhand and will send an inter-ministerial team to assess damages...wt say??
83,25185031809,Wed Sep 22 04:52:11 +0000 2010,0,0,"chehre nahi insaan padhe jate hain, mazhab 
nahi imaan padhe jate hain..... bharat hi ek aisa desh hai, jahan ek... http://fb.me/AjXTaazn"
84,25042404741,Mon Sep 20 17:07:22 +0000 2010,0,0,"Pehle pahaadon mein baadal fatne ki ghatna, aur ab lagaataar ho rahi baarish, wt u say friends, Is their any signal of God to us?????"
85,24913569445,Sun Sep 19 06:15:19 +0000 2010,0,0,"It's difficult to forget someonewho was yours 'n changed your Life,But It's even more difficultto forget someone... http://fb.me/FqEogcaw"
86,24770451453,Fri Sep 17 15:59:57 +0000 2010,0,0,Thu-Budi-Thu (Katharkya tyaar) khoob khoob mumbaarak :-)
87,24750937791,Fri Sep 17 11:49:31 +0000 2010,0,0,Festivle season is here....wts your planing? http://fb.me/JvRH9H9E
88,22794098881,Thu Sep 02 12:35:35 +0000 2010,0,0,Wishing Birthday to Nand Gopal and happy Janmashtami to You All!
89,21977266803,Tue Aug 24 05:41:04 +0000 2010,0,0,All the people wish you a very happy Rakshabandhan :)
90,21173165058,Sat Aug 14 19:33:44 +0000 2010,0,0,"Swatantrata Divas Ki Haardik Subhkaamnaye...Happy Independence Day ! 

How You People Are Celibrating This Day???... http://fb.me/FoMRekkA"
91,21164243168,Sat Aug 14 17:01:08 +0000 2010,0,0,"aapka, mera...hum sabka tiraaha...... paatni tiraaha :) http://fb.me/EyP1CTZG"
92,21164007106,Sat Aug 14 16:57:41 +0000 2010,0,0,I posted a new photo to Facebook http://fb.me/FvKIHfbX
93,19726833306,Wed Jul 28 09:03:27 +0000 2010,0,0,What are major changes in last 2 yers on banbassa???
94,19632291052,Tue Jul 27 05:08:58 +0000 2010,0,0,"Who is the shop-keeper of banbassa you miss most, when you stay out of banbassa??"
95,18830507376,Sun Jul 18 09:55:49 +0000 2010,0,0,@priyankachopra happy birthday
96,18753005322,Sat Jul 17 08:20:41 +0000 2010,0,0,I posted a new photo to Facebook http://fb.me/EFa0VR6d
97,12991150150,Wed Apr 28 06:04:48 +0000 2010,0,0,@MallikaLA  do u have a nude scene in hiss too....
98,12877691296,Mon Apr 26 11:36:35 +0000 2010,0,0,@BeingSalmanKhan time pass karna h yara....
99,12582747991,Wed Apr 21 15:33:23 +0000 2010,2,0,"RT @vivek_oberoi: :)) RT @anjali777: A rare video interview of @vivek_oberoi with his dad, Suresh Oberoi - pt 1 http://bit.ly/c21K73 pt  ..."
100,12582429136,Wed Apr 21 15:27:18 +0000 2010,1,0,RT @MissMalini: plans to kill it today :) Wednesday is the NEW Friday I hear! http://bit.ly/dxuMvS
101,12561100799,Wed Apr 21 05:49:56 +0000 2010,0,0,@TheShilpaShetty  saree
102,12545792201,Wed Apr 21 00:09:52 +0000 2010,3,0,RT @ActorMadhavan: The only time I regret being an actor is when I have to dance to my film songs in public... abroad.. With my 16 left  ...
103,12524473855,Tue Apr 20 16:13:56 +0000 2010,0,0,Swear to bear that i didn't drink god
104,12514179485,Tue Apr 20 12:49:42 +0000 2010,0,0,Happy weddin anniversary to @juniorbachchan
105,12513993909,Tue Apr 20 12:45:37 +0000 2010,0,0,Not yet bt wat is it u knw @BeingSalmanKhan got married....lol
106,12489331757,Tue Apr 20 01:46:51 +0000 2010,0,0,Gd mrng....wndrfl wethr
107,12434596410,Mon Apr 19 03:09:25 +0000 2010,182,0,"RT @ONECampaign: Check out Bono's NYT column today ""Africa Reboots"" http://nyti.ms/bLQRXs"
108,12400167710,Sun Apr 18 14:34:47 +0000 2010,0,0,Xamzz.. Sucks
109,12399875644,Sun Apr 18 14:28:33 +0000 2010,0,0,@geneliad This is not a luck this is ur hard_work n talent too.....
110,12398461866,Sun Apr 18 13:58:08 +0000 2010,0,0,Chennai is in semifinals yuppy...!!!
111,12387939903,Sun Apr 18 08:24:46 +0000 2010,0,0,Gd afternoon....every1 had a wonderfull lunch wid mom
112,12387744370,Sun Apr 18 08:18:06 +0000 2010,0,0,@meerasapra  happy lunch
113,12387726069,Sun Apr 18 08:17:30 +0000 2010,1,0,"RT @meerasapra: At NSCI, Bombay for lunch"
114,12387688103,Sun Apr 18 08:16:15 +0000 2010,0,0,@MirzaSania  happy wedding
115,12387671952,Sun Apr 18 08:15:43 +0000 2010,0,0,@arbaazSkhan  sir malaika mam is in tweeter
116,12288261401,Fri Apr 16 15:16:54 +0000 2010,0,0,Hello everyone
117,12194751177,Thu Apr 15 00:59:37 +0000 2010,1130,0,RT @BeingSalmanKhan: Tumhare mummy daddy ko bolunga. Tweeting sab bandh ho jayega. Har cheez ke liye time hota hai.
118,12194729723,Thu Apr 15 00:59:12 +0000 2010,0,0,@BeingSalmanKhan is dat really u ?
119,12194664039,Thu Apr 15 00:57:53 +0000 2010,0,0,Gd mrng...!!
120,8553534078,Tue Feb 02 18:55:48 +0000 2010,0,0,@meerasapra  chrome has high performance
121,8553454913,Tue Feb 02 18:53:27 +0000 2010,112,0,RT @iamsrk: had a great chat with fareed zakaria on cnn. he is most gracious and a gentleman. drops visitors upto their car. wot an utte ...
122,8524275510,Tue Feb 02 02:12:42 +0000 2010,9,0,RT @geneliad: Good mrng tweeps.. On my way 2work..lookin fwd 2 d day.. Ul hav a gr8 day2: )
123,8524257753,Tue Feb 02 02:12:13 +0000 2010,0,0,Good morning
124,8524178110,Tue Feb 02 02:10:07 +0000 2010,0,0,@iamsrk congrats 4 nasdaq
125,8498276078,Mon Feb 01 13:30:15 +0000 2010,0,0,@juniorbachchan I em ur 1 of d big fan.waitin for ravan wen it releases
126,8498276032,Mon Feb 01 13:30:15 +0000 2010,0,0,It is very shameful thing done by shivsena workers
127,8497719756,Mon Feb 01 13:11:36 +0000 2010,0,0,Just 1411 we had to do sum thing
128,8497682200,Mon Feb 01 13:10:18 +0000 2010,0,0,"RT @juniorbachchan: RT @SaveOurTigers: http://twitpic.com/10tfqg - 10000 of us are now roaring,many more need to join! Let’s make this roar"
129,8497657082,Mon Feb 01 13:09:30 +0000 2010,0,0,"RT @juniorbachchan: Please RT guys  RT @SaveOurTigers: http://twitpic.com/10tfqg - 10000 of us are now roaring,many more need to join!"
130,8489231420,Mon Feb 01 06:57:22 +0000 2010,0,0,@reeceBADxx Hey gorgeous wanna u as a frnd
131,8457448442,Sun Jan 31 16:37:21 +0000 2010,0,0,"Just 1411 tigers left....
SAVE OUR TIGERS"
132,8420176944,Sat Jan 30 18:24:05 +0000 2010,0,0,@iamsrk Promos of mnik r excellent when ra1 is cumin
133,8420088764,Sat Jan 30 18:21:17 +0000 2010,0,0,@juniorbachchan Hws bingo running ?
134,8420067732,Sat Jan 30 18:20:36 +0000 2010,0,0,@geneliad Sorry abt ur phone.. Bt hw data lost frm it
135,8419995828,Sat Jan 30 18:18:22 +0000 2010,0,0,On the bed bt miles away frm ....
136,8417085821,Sat Jan 30 16:47:54 +0000 2010,0,0,@priyankachopra Belated Congratulations for fashion. I am a big fan of yours. Really u r as beautiful as lyk an angel.win lots of awards
137,8416894216,Sat Jan 30 16:41:53 +0000 2010,0,0,Salute to the MAHATMA....
138,7695939885,Wed Jan 13 03:45:11 +0000 2010,0,0,suffering frm jaundice
139,3643146076,Sun Aug 30 10:24:58 +0000 2009,0,0,masti
140,3141709445,Wed Aug 05 07:46:53 +0000 2009,0,0,masti all time..............
