,id_str,created_at,retweet_count,favorite_count,text
133,652477563437121536,Fri Oct 09 13:35:48 +0000 2015,0,0,Science news... Could ‘The Day After Tomorrow’ happen?: A researcher has produced a scienti... http://t.co/rtSbU2nTTs always moving fwd.
134,652241379981049856,Thu Oct 08 21:57:17 +0000 2015,0,0,Science news... Blue skies and water ice discovered on Pluto: The first color images of Plu... http://t.co/ZE7WDal4o5 always moving fwd.
135,652196592573767681,Thu Oct 08 18:59:19 +0000 2015,0,0,Science news... Environmental memories transmitted from a father to his grandchildren: If y... http://t.co/HXIcg6edmk always moving fwd.
136,652154162629574660,Thu Oct 08 16:10:43 +0000 2015,0,0,Science news... Fracking industry wells associated with premature birth: Expectant mothers ... http://t.co/CEhDeidMTY always moving fwd.
137,652106003891138560,Thu Oct 08 12:59:21 +0000 2015,0,0,"Science news... Bio-inspired robotic finger looks, feels and works like the real thing: Mos... http://t.co/Vv0VD21eBy always moving fwd."
138,651954755472723969,Thu Oct 08 02:58:21 +0000 2015,0,0,Science news... Resisting wheat rust in Texas: Wheat is vulnerable. Among the most damaging... http://t.co/G5D3BnvVVY always moving fwd.
139,651837462780575744,Wed Oct 07 19:12:16 +0000 2015,0,0,"Science news... Preventive care drops when government cuts close women's health clinics, re... http://t.co/g8W4tZTp3q always moving fwd."
140,651806825868689408,Wed Oct 07 17:10:31 +0000 2015,0,0,Science news... Predicting change in the Alzheimer's brain: Researchers are developing a co... http://t.co/JR06s3LFjq always moving fwd.
141,651776212117794817,Wed Oct 07 15:08:53 +0000 2015,0,1,Science news... The perfect match might be the imperfect one: When it comes to treating blo... http://t.co/KHJX2e3W8L always moving fwd.
142,651744139193663490,Wed Oct 07 13:01:26 +0000 2015,0,0,Science news... Candle soot can power the lithium batteries in electric cars: Burning a can... http://t.co/y2twAsUCcz always moving fwd.
143,651665225347825664,Wed Oct 07 07:47:51 +0000 2015,0,0,Science news... Chimpanzees shed light on origins of human walking: Scientists investigatin... http://t.co/0wgl5ofnfh always moving fwd.
144,651541571385470976,Tue Oct 06 23:36:30 +0000 2015,0,0,Science news... Ancient rocks record first evidence for photosynthesis that made oxygen: A ... http://t.co/AwuKz8WJo0 always moving fwd.
145,651472252890800128,Tue Oct 06 19:01:03 +0000 2015,0,0,Science news... From trees to power: Engineers build better energy storage device: New work... http://t.co/pyGoAS7eQA always moving fwd.
146,651441280354914304,Tue Oct 06 16:57:59 +0000 2015,0,0,Science news... A large-area detector for fundamental neutron science: How long do neutrons... http://t.co/dzVHwgvYpp always moving fwd.
147,651410322406838272,Tue Oct 06 14:54:58 +0000 2015,0,0,"Science news... New fossils intensify mystery of short-lived, toothy mammal found in ancien... http://t.co/2yvH4H9sov always moving fwd."
148,651379125920268288,Tue Oct 06 12:51:00 +0000 2015,0,0,Science news... Nobel Prize in Physics for 2015: The Royal Swedish Academy of Sciences has ... http://t.co/NkLQpu6K5e always moving fwd.
149,651337953961115649,Tue Oct 06 10:07:24 +0000 2015,0,0,Science news... New metabolomic platform reveals fundamental flaw in common lab technology:... http://t.co/7xPxROdjSb always moving fwd.
150,651161490691461120,Mon Oct 05 22:26:12 +0000 2015,0,0,Science news... Packaged food purchases at non-grocery stores are up but nutritional qualit... http://t.co/DrWpLOQpCU always moving fwd.
151,651120162259623936,Mon Oct 05 19:41:58 +0000 2015,0,0,Science news... How the brain recognizes objects: Using data from both humans and nonhuman ... http://t.co/xAdiDiiav1 always moving fwd.
152,651088393498030080,Mon Oct 05 17:35:44 +0000 2015,0,0,Science news... World's largest atom smashers produce world's smallest droplets: A series o... http://t.co/W2V55Mu1C1 always moving fwd.
153,651013971311366146,Mon Oct 05 12:40:00 +0000 2015,0,0,Science news... Molecular nanoribbons as electronic highways: Physicists have developed a m... http://t.co/gSjU9VsrDJ always moving fwd.
154,650150132864815104,Sat Oct 03 03:27:25 +0000 2015,0,0,Science news... Does knowing high-status people help or hurt?: How happy you are may have s... http://t.co/5bgpZCtubT always moving fwd.
155,650007993770098688,Fri Oct 02 18:02:36 +0000 2015,0,0,Science news... Drug used to treat cancer appears to sharpen memory: A drug now being used ... http://t.co/LK06i304QN always moving fwd.
156,649923845499949056,Fri Oct 02 12:28:14 +0000 2015,0,0,Science news... Breaking time-reversal symmetry in high-temperature superconductors: Resear... http://t.co/RP3SWzwOKx always moving fwd.
157,649711524752134145,Thu Oct 01 22:24:33 +0000 2015,0,0,Science news... Gene suppression helps form memories: A new study has identified a number o... http://t.co/K9d2Q435Rp always moving fwd.
158,649677041588039680,Thu Oct 01 20:07:31 +0000 2015,0,0,Science news... Ancient ecosystem response to 'big five' mass extinction: A new study explo... https://t.co/ArYPtqIuF7 always moving fwd.
159,649644964750594048,Thu Oct 01 18:00:04 +0000 2015,0,0,Science news... Finding links and missing genes: Catalog of large-scale genetic changes aro... https://t.co/TBYEEltWRe always moving fwd.
160,649402545668911104,Thu Oct 01 01:56:46 +0000 2015,0,0,"Science news... Relationship quality affects siblings' mental health, risky behaviors: The ... http://t.co/60XMkF1K4E always moving fwd."
161,649295582582837248,Wed Sep 30 18:51:44 +0000 2015,0,0,Science news... Crystal clear: Thousand-fold fluorescence enhancement in an all-polymer thi... http://t.co/WKYxkRP37w always moving fwd.
162,649226323647311874,Wed Sep 30 14:16:32 +0000 2015,0,0,Science news... Competing mice reveal genetic defects: A sensitive new toxicity test detect... http://t.co/FOx3Y6FQgY always moving fwd.
163,649194713891762176,Wed Sep 30 12:10:55 +0000 2015,0,0,Science news... Titan helps unravel decades-old plutonium perplexities: Condensed matter th... http://t.co/etdRM02BUK always moving fwd.
164,649017917791584257,Wed Sep 30 00:28:24 +0000 2015,0,0,"Science news... Disappearing carbon circuits on graphene could have security, biomedical us... http://t.co/6YcoE2NmPB always moving fwd."
165,648909768229171200,Tue Sep 29 17:18:39 +0000 2015,0,0,Science news... Reading the weather from inside a seashell: Does assembling a mega-continen... http://t.co/FWzTnWTKek always moving fwd.
166,648877154806005760,Tue Sep 29 15:09:03 +0000 2015,0,0,Science news... Chimpanzee personality linked to anatomy of brain structures: Chimpanzees' ... http://t.co/fqfgExAfZN always moving fwd.
167,648846393709191168,Tue Sep 29 13:06:49 +0000 2015,0,0,Science news... Earth-like planets around small stars likely have protective magnetic field... http://t.co/YYisp5f3Ra always moving fwd.
168,648672692053250048,Tue Sep 29 01:36:36 +0000 2015,0,0,Science news... Monsoon mission: Better way to predict Indian weather?: To better understan... http://t.co/Jv4kRkWkBO always moving fwd.
169,648590154454577152,Mon Sep 28 20:08:37 +0000 2015,0,0,"Science news... Pigment from fossils identified, revealing color of extinct animals: Scient... http://t.co/6Ep5j6sEkp always moving fwd."
170,648549303011557377,Mon Sep 28 17:26:17 +0000 2015,0,0,Science news... How ocean circulation changed atmospheric CO2: Changes to overturning circu... http://t.co/k27VYOtbvD always moving fwd.
171,648515188908408832,Mon Sep 28 15:10:44 +0000 2015,0,0,"Science news... Fewer, larger radiotherapy doses prove effective for prostate cancer patien... http://t.co/KnMobiJ2AT always moving fwd."
172,648484658070421504,Mon Sep 28 13:09:25 +0000 2015,0,0,"Science news... Robots: Our new underwater 'astronauts': Soon it may be easier to design, p... http://t.co/GOJAmaGBOj always moving fwd."
173,648345368632033281,Mon Sep 28 03:55:56 +0000 2015,0,0,Science news... Drug combination improves progression-free survival in melanoma patients: P... http://t.co/OvjrOybsA2 always moving fwd.
174,648252819426840576,Sun Sep 27 21:48:10 +0000 2015,0,0,Science news... Rare cancer responds unusually well to new treatment: Results from the NETT... http://t.co/Mw8gtZXGAU always moving fwd.
175,648219746303799296,Sun Sep 27 19:36:45 +0000 2015,0,0,Science news... Lung cancer survival rates improve with CT scan follow-up: Patients with re... http://t.co/NP2xanQys3 always moving fwd.
176,647796817011322881,Sat Sep 26 15:36:11 +0000 2015,17,0,"RT @NicholasDenmon: @Adizz09 bad enough that there is an entire industry built on these ""amateur athlete's"" backs. Now @CollegeGameDay is t…"
177,647794730525433856,Sat Sep 26 15:27:53 +0000 2015,31,0,RT @Adizz09: Hey @CollegeGameDay your #youhadonejob segment is DISGUSTING. Do y'all forget the players are KIDS? To publicly ridicule them …
178,647555947330596864,Fri Sep 25 23:39:03 +0000 2015,0,0,Science news... Plants with jobs: Scientists have developed a new research framework for th... http://t.co/DOm0oM8Uzp always moving fwd.
179,647428947207061505,Fri Sep 25 15:14:24 +0000 2015,1,0,"Science news... What will Volkswagen do? After an apology, companies often silence stakehol... http://t.co/n4jZOJVWbv always moving fwd."
180,647398312199389184,Fri Sep 25 13:12:40 +0000 2015,0,0,Science news... 'No Child Left Behind' leaves some voters behind: Assigning schools failing... http://t.co/OVelefAXTb always moving fwd.
181,647225719995502592,Fri Sep 25 01:46:51 +0000 2015,0,0,"Science news... 'Remote control' of immune cells opens door to safer, more precise cancer t... http://t.co/ubWDdCH8y1 always moving fwd."
182,647123270983004160,Thu Sep 24 18:59:45 +0000 2015,0,0,Science news... Newly identified mechanism solves enduring mystery of key element of cellul... http://t.co/d8q60PV7JM always moving fwd.
183,647092640203173888,Thu Sep 24 16:58:02 +0000 2015,0,0,"Science news... Fewer patients die at fully accredited hospitals: For the first time, resea... http://t.co/gxuijOs5DG always moving fwd."
184,647060308184293378,Thu Sep 24 14:49:33 +0000 2015,1,0,Science news... Tiny plankton can play a major role in CO2 storage in the oceans: Tiny zoop... http://t.co/cHAC1X6z2S always moving fwd.
185,647028323000807425,Thu Sep 24 12:42:28 +0000 2015,0,0,Science news... Cold snap: Climate cooling and sea-level changes caused crocodilian retreat... http://t.co/m3sim2Q0Ru always moving fwd.
186,646737559490457600,Wed Sep 23 17:27:04 +0000 2015,1,1,"Science news... New cancer genes identified, opening door to targeted treatments: Researche... http://t.co/OfCPPvsOLn always moving fwd."
187,646706738557644800,Wed Sep 23 15:24:36 +0000 2015,0,0,Science news... Horse owners can manage flies with wasps instead of pesticides: A new artic... http://t.co/T3yQlM8PoN always moving fwd.
188,646672516858052608,Wed Sep 23 13:08:37 +0000 2015,0,1,"Science news... Highly flexible and wearable tactile sensor for robotics, electronics and h... http://t.co/qZ49GDOXcq always moving fwd."
189,646466534651510784,Tue Sep 22 23:30:07 +0000 2015,0,0,Science news... A new view of the content of Earth's core: There is more oxygen in the core... http://t.co/xXfBeA3lMT always moving fwd.
190,646369002785079296,Tue Sep 22 17:02:33 +0000 2015,0,0,Science news... Confusion afoot: People struggle to tell their toes apart with their eyes c... http://t.co/FADrxBYOCs always moving fwd.
191,646124352874811394,Tue Sep 22 00:50:24 +0000 2015,0,0,Science news... Substance abuse recovery odds increase in a community setting: Following su... http://t.co/Chu1jrIICU always moving fwd.
192,646089196310949888,Mon Sep 21 22:30:42 +0000 2015,0,0,"Science news... Printing lightweight, flexible, and functional materials: Researchers have ... http://t.co/ypipo3CCAK always moving fwd."
193,646021422616186880,Mon Sep 21 18:01:24 +0000 2015,0,0,"Science news... Mind your manners, robot: How social cues influence human-robot interaction... http://t.co/xN0rZDoJDY always moving fwd."
194,645988280610123776,Mon Sep 21 15:49:42 +0000 2015,0,0,Science news... Predicting X-ray diffuse scattering from translation-libration-screw struct... http://t.co/bEFObdeYia always moving fwd.
195,645952333520592896,Mon Sep 21 13:26:52 +0000 2015,0,0,Science news... Africa's earliest known coelacanth found in Eastern Cape: Various specimens... http://t.co/ZIBLNm4VHs always moving fwd.
196,645660646797783041,Sun Sep 20 18:07:48 +0000 2015,0,0,Science news... Discovery of a new photonic crystal where light propagates through the surf... http://t.co/tISB6EmzIH always moving fwd.
197,644999389199511552,Fri Sep 18 22:20:12 +0000 2015,0,0,Science news... Flowing electrons help ocean microbes gulp methane: Good communication is c... http://t.co/DvrMPB3cV2 always moving fwd.
198,644890271272931328,Fri Sep 18 15:06:36 +0000 2015,0,0,Science news... Teens with bulimia recover faster when parents are included in treatment: I... http://t.co/5dBKWlh085 always moving fwd.
199,644855180308013057,Fri Sep 18 12:47:10 +0000 2015,0,0,Science news... Forever young? A barrier against brain stem cell aging: Neural stem cells g... http://t.co/IfE1RTw0lq always moving fwd.
