,id_str,created_at,retweet_count,favorite_count,text
0,669170713941553152,Tue Nov 24 15:08:25 +0000 2015,0,0,Science news... Ants filmed building moving bridges from their live bodies: Army ants build... https://t.co/DhmtVdx0dD always moving fwd.
1,668871705125765120,Mon Nov 23 19:20:16 +0000 2015,0,0,Science news... Computers can perceive image curves like artists: Imagine computers being a... https://t.co/7MuRXbS4wo always moving fwd.
2,668839857267961856,Mon Nov 23 17:13:43 +0000 2015,0,0,Science news... Forecasting the path of breast cancer in a patient: A mathematical model ha... https://t.co/ivRrveATSR always moving fwd.
3,668137758238478336,Sat Nov 21 18:43:49 +0000 2015,0,0,Science news... Heart failure improvements with diet and exercise: Doctors have shown the b... https://t.co/J0sOuSf8xV always moving fwd.
4,667734463409991682,Fri Nov 20 16:01:16 +0000 2015,0,0,Science news... Climate change: Warm water is mixing up life in the Arctic: The warming of ... https://t.co/o5ozTrkajs always moving fwd.
5,667476104878231553,Thu Nov 19 22:54:39 +0000 2015,0,0,Science news... Microscopy captures real-time view of evolving fuel cell catalysts: Atomic-... https://t.co/3K92rskPfT always moving fwd.
6,667429605029056512,Thu Nov 19 19:49:52 +0000 2015,0,0,Science news... Bacterial protein can help convert stem cells into neurons: As the recipe b... https://t.co/wZTOzsmrBG always moving fwd.
7,667387027529199617,Thu Nov 19 17:00:41 +0000 2015,0,0,Science news... Ancient fossil forest unearthed in Arctic Norway: Ancient fossil forests ha... https://t.co/NWy1NL0UHq always moving fwd.
8,667132914845401088,Thu Nov 19 00:10:56 +0000 2015,0,1,"Science news... Has Syria painted a target on medical teams around the world?: Even in war,... https://t.co/DFjLrynJgd always moving fwd."
9,667098073844215808,Wed Nov 18 21:52:29 +0000 2015,0,0,Science news... Neurogastronomy: How our brains perceive the flavor of food: Neuroscientist... https://t.co/ODdOswltAS always moving fwd.
10,667016814983929856,Wed Nov 18 16:29:35 +0000 2015,0,0,Science news... Economic significance of cities increases while that of countries falls: Ac... https://t.co/q4ttzSvJvq always moving fwd.
11,666765861974208512,Tue Nov 17 23:52:24 +0000 2015,0,0,Science news... 'Good' mozzie virus might hold key to fighting human disease: A new virus h... https://t.co/ATj7btrzsv always moving fwd.
12,666687268183109632,Tue Nov 17 18:40:05 +0000 2015,0,0,Science news... Blood phosphorus levels can help predict kidney failure risk in African Ame... https://t.co/zD2muzY5D7 always moving fwd.
13,666653680871931904,Tue Nov 17 16:26:38 +0000 2015,1,0,Science news... Understanding seal movement can help mitigate seal-fishery conflict: Unders... https://t.co/9kI9K190wJ always moving fwd.
14,666363040686694400,Mon Nov 16 21:11:43 +0000 2015,14,0,RT @NicholasDenmon: @NicholasDenmon: Review of Cocktail Noir on Huffington Post: https://t.co/zNzlOxJarJ @scottyyz
15,666354083339481088,Mon Nov 16 20:36:08 +0000 2015,0,0,"Science news... Safe spaces play important role in community-based HIV prevention, research... https://t.co/umyW0eKiF2 always moving fwd."
16,666322678526164993,Mon Nov 16 18:31:20 +0000 2015,0,0,"Science news... 'Supergene' underlies genetic differences, sexual behavior in male ruff: Th... https://t.co/lpF5kmGsHn always moving fwd."
17,666253957195403264,Mon Nov 16 13:58:16 +0000 2015,0,0,Science news... Teens and parents agree: Electronic cigarettes need restrictions: More than... https://t.co/5YooCp2yPk always moving fwd.
18,665922365079994368,Sun Nov 15 16:00:38 +0000 2015,0,0,Science news... Scientists sniff out female mouse scents that make males frisky: Scientists... https://t.co/PdsxJu5f6b always moving fwd.
19,665257739510153216,Fri Nov 13 19:59:39 +0000 2015,0,0,Science news... How DNA and a supercomputer can help sustain honey bee populations: To unco... https://t.co/MMzufS5QQ1 always moving fwd.
20,665206831174696960,Fri Nov 13 16:37:22 +0000 2015,0,0,Science news... New information about bacterial enzymes to help scientists develop more eff... https://t.co/W0wAIgDEfo always moving fwd.
21,665113838245679104,Fri Nov 13 10:27:50 +0000 2015,1,0,Science news... Eating sweets forms memories that may control eating habits: Eating sweet f... https://t.co/uYDkI6KuF6 always moving fwd.
22,664987823729053696,Fri Nov 13 02:07:06 +0000 2015,0,0,Science news... Lead exposure impacts children's sleep: Lead exposure in early childhood ar... https://t.co/ROL4y1fdmF always moving fwd.
23,664933353666162688,Thu Nov 12 22:30:40 +0000 2015,0,0,Science news... Massive northeast Greenland glacier is rapidly melting: A glacier in northe... https://t.co/9SCNyoCxpp always moving fwd.
24,664883202218070019,Thu Nov 12 19:11:22 +0000 2015,0,0,Science news... Carbon accumulation by US forests may slow over the next 25 years: Currentl... https://t.co/A0Izmu8lL8 always moving fwd.
25,664842108814032896,Thu Nov 12 16:28:05 +0000 2015,0,0,Science news... Genetics: 'Origins code' for DNA: The source of any life involves the dupli... https://t.co/7xmG4sexMe always moving fwd.
26,664810814029742081,Thu Nov 12 14:23:44 +0000 2015,0,0,Science news... Preschoolers need more outdoor time at child care centers: Child care cente... https://t.co/qDr1NcNoRf always moving fwd.
27,664759648931569664,Thu Nov 12 11:00:25 +0000 2015,0,0,Science news... Adolescent bariatric surgery reverses type 2 diabetes in 95 percent of teen... https://t.co/LiNZ9us5OT always moving fwd.
28,664577403440631808,Wed Nov 11 22:56:14 +0000 2015,0,0,Science news... Ant colony responds to predation simulation as a 'superorganism': Ants may ... https://t.co/lb2eswZhij always moving fwd.
29,664493178150490112,Wed Nov 11 17:21:34 +0000 2015,0,0,"Science news... Contact, connect and fuse: An ultra-structural view of the muscle formation... https://t.co/BwEcuYrVnc always moving fwd."
30,664454447355920384,Wed Nov 11 14:47:39 +0000 2015,0,0,Science news... Preventing radiation in cancer therapies to damage healthy organs: When a p... https://t.co/edXmLMmmhY always moving fwd.
31,664397455736225793,Wed Nov 11 11:01:12 +0000 2015,0,0,Science news... Breakthrough in superconducting materials opens new path to fusion: The eme... https://t.co/ZbCzCsXP0o always moving fwd.
32,664161331600187393,Tue Nov 10 19:22:55 +0000 2015,0,0,Science news... Large landowners key to slowing deforestation in Brazil: An analysis by soc... https://t.co/KivfeotBn1 always moving fwd.
33,664127599044530176,Tue Nov 10 17:08:53 +0000 2015,0,0,Science news... Sugar molecules lose their 'Cinderella' status: Carbohydrates are often con... https://t.co/UpLghnEe89 always moving fwd.
34,664095073114583040,Tue Nov 10 14:59:38 +0000 2015,0,0,Science news... Northern lakes act as carbon dioxide chimneys in a warming world: Many of t... https://t.co/uEgPcYyv6o always moving fwd.
35,663934280783958016,Tue Nov 10 04:20:42 +0000 2015,0,0,Science news... Colorado wildfire study shows actions can change outcomes: A new study of C... https://t.co/K8eQbPenwn always moving fwd.
36,663833673356021760,Mon Nov 09 21:40:55 +0000 2015,0,0,Science news... Specific vitamin D levels linked to heart problems: A lack of vitamin D can... https://t.co/wJQZXSnQty always moving fwd.
37,663787911985299456,Mon Nov 09 18:39:05 +0000 2015,0,0,Science news... Wealthiest -- not sickest -- patients may have edge in organ transplants: R... https://t.co/cNkVCjYDgf always moving fwd.
38,663744650910416897,Mon Nov 09 15:47:11 +0000 2015,0,0,Science news... New light shed on the challenge of climate negotiations: After over two dec... https://t.co/Avi9xyC4fv always moving fwd.
39,663458297555501056,Sun Nov 08 20:49:19 +0000 2015,0,0,Science news... Eating more homemade meals may reduce risk of type 2 diabetes: People who m... https://t.co/VSCZkP9j64 always moving fwd.
40,663357062022197248,Sun Nov 08 14:07:02 +0000 2015,0,0,Science news... New Milestone in Cardiovascular Disease Management for People with Rheumato... https://t.co/jVvBGXGwJm always moving fwd.
41,663169132662145024,Sun Nov 08 01:40:16 +0000 2015,0,0,Science news... Human-caused climate change increased the severity of many extreme events i... https://t.co/uwkY4oXwFb always moving fwd.
42,663132667915833344,Sat Nov 07 23:15:23 +0000 2015,0,0,Science news... Massive mysterious spring die-off kills more than 50 percent of the global ... https://t.co/sP4Yez6mlh always moving fwd.
43,663004364487847938,Sat Nov 07 14:45:33 +0000 2015,0,0,Science news... Cholesterol-lowering 'portfolio diet' also reduces blood pressure: A diet d... https://t.co/uVp9ahtBkI always moving fwd.
44,662745906719031296,Fri Nov 06 21:38:32 +0000 2015,0,0,"Science news... Food policy: Cutting waste, broadening systems: In two separate articles, r... https://t.co/TUW3dSd3OF always moving fwd."
45,662635973050634241,Fri Nov 06 14:21:41 +0000 2015,0,0,Science news... New way to find DNA damage: Chemists have devised a new way to detect chemi... https://t.co/PVMESV6opq always moving fwd.
46,662377971265634307,Thu Nov 05 21:16:29 +0000 2015,0,0,Science news... NASA mission reveals speed of solar wind stripping Martian atmosphere: NASA... https://t.co/YPFAEd0jae always moving fwd.
47,662345778514407424,Thu Nov 05 19:08:34 +0000 2015,0,0,Science news... Breaking free: Scientists show how telomeric RNA molecule escapes and produ... https://t.co/Z2v85aSgL1 always moving fwd.
48,662311387184558080,Thu Nov 05 16:51:54 +0000 2015,0,0,Science news... Researchers reveal acoustic complexity of chickadee songs: Researchers have... https://t.co/86b5pHn6Pi always moving fwd.
49,662274869594165249,Thu Nov 05 14:26:48 +0000 2015,0,0,"Science news... Spending more on patients lowers doctors' malpractice risk, study finds: Ph... https://t.co/9KABn20ayh always moving fwd."
50,662101024996331520,Thu Nov 05 02:56:00 +0000 2015,0,0,Science news... Research evaluates racial differences in GI cancer biology: Because America... https://t.co/sipykFRb0y always moving fwd.
51,662045665019564033,Wed Nov 04 23:16:01 +0000 2015,0,1,Science news... Some 3-D printed objects are toxic: Parts produced by some commercial 3-D p... https://t.co/t8DjgvXu55 always moving fwd.
52,661990878395785216,Wed Nov 04 19:38:19 +0000 2015,0,0,Science news... Insulin sensitivity: One night of poor sleep could equal six months on a hi... https://t.co/VAi177Tt1q always moving fwd.
53,661946660659011584,Wed Nov 04 16:42:36 +0000 2015,18,0,"RT @NicholasDenmon: @Scottyyz gets real with @TheGuySociety about drinks, mobsters, and crime writers. https://t.co/2KD3KCDKUc  interview b…"
54,661923706524930049,Wed Nov 04 15:11:24 +0000 2015,0,0,Science news... Chemotherapy-induced hearing loss affects neurocognition in pediatric brain... https://t.co/TJexD9VAfZ always moving fwd.
55,661738663240269824,Wed Nov 04 02:56:06 +0000 2015,0,1,Science news... 3-D printed 'building blocks' of life: Scientists have developed a 3-D prin... https://t.co/gBCAqJk8Jf always moving fwd.
56,661662883978149888,Tue Nov 03 21:54:59 +0000 2015,0,0,Science news... Radar images provide details on Halloween asteroid: The highest-resolution ... https://t.co/Ym2ve4p6FE always moving fwd.
57,661617342271500292,Tue Nov 03 18:54:01 +0000 2015,0,0,Science news... Righting a wrong? Right side of brain can compensate for post-stroke loss o... https://t.co/LPYgfbXoM8 always moving fwd.
58,661515400677490688,Tue Nov 03 12:08:56 +0000 2015,0,0,Science news... New genetic risk marker for late-life depression: One of the most powerful ... https://t.co/ro1b9kj8wl always moving fwd.
59,661384395215892480,Tue Nov 03 03:28:22 +0000 2015,0,0,Science news... Even a little is too much: One junk food snack triggers signals of metaboli... https://t.co/U978lohLge always moving fwd.
60,661321676999622656,Mon Nov 02 23:19:09 +0000 2015,1,0,Science news... Children's self-esteem already established by age five: By age 5 children h... https://t.co/UGyBqOfwaD always moving fwd.
61,661274330676891648,Mon Nov 02 20:11:00 +0000 2015,0,0,Science news... Early contact with dogs linked to lower risk of asthma: Scientists have use... https://t.co/n4YX1BEBFJ always moving fwd.
62,661216590315130880,Mon Nov 02 16:21:34 +0000 2015,0,0,Science news... Abdominal fat in early pregnancy can predict development of gestational dia... https://t.co/BYVh5Fhs9o always moving fwd.
63,661177737944526848,Mon Nov 02 13:47:11 +0000 2015,0,0,Science news... Solar Cells; High-quality perovskite materials developed capable of utilizi... https://t.co/UMPlIwdlWB always moving fwd.
64,660914251599470593,Sun Nov 01 20:20:11 +0000 2015,0,0,Science news... Hunting down hidden dangers and health benefits of urban fruit: Forgotten t... https://t.co/qCwt9XnIG1 always moving fwd.
65,660843243895062528,Sun Nov 01 15:38:01 +0000 2015,0,0,Science news... Ancient pollen reveals droughts between Sierra Nevada glacier surges: Hidde... https://t.co/SJ3QqYTN0l always moving fwd.
66,660496799862358016,Sat Oct 31 16:41:23 +0000 2015,0,0,Science news... Detecting diabetes in a saliva sample with a smart phone: A new device prov... https://t.co/qZZuQj9qdu always moving fwd.
67,660440390638538752,Sat Oct 31 12:57:14 +0000 2015,0,0,Science news... Extreme weather events in Chesapeake Bay give clues for future climate impa... https://t.co/oXjdtKTqym always moving fwd.
68,660435867987787776,Sat Oct 31 12:39:15 +0000 2015,13,0,"RT @TheGuySociety: He's back! @JeremyClarkson is his brilliantly cheeky self in the new @amazon fire stick ad. #WeHaveMissedYou

https://t.…"
69,660233572582752256,Fri Oct 30 23:15:24 +0000 2015,2,1,Science news... Halloween skies to include dead comet flyby: The large space rock that will... https://t.co/rRKmafTtwX always moving fwd.
70,660159503950745601,Fri Oct 30 18:21:05 +0000 2015,0,0,Science news... NASA spots the 'Great Pumpkin': Halloween asteroid a treat for radar astron... https://t.co/CL8MFLBoWt always moving fwd.
71,660126781739929600,Fri Oct 30 16:11:03 +0000 2015,0,0,Science news... Scientists get first glimpse of conductivity that could break size barriers... https://t.co/i3IEtix0On always moving fwd.
72,660114014098313217,Fri Oct 30 15:20:19 +0000 2015,14,0,"RT @NicholasDenmon: Spoke with Rosie Mac, from Game of Thrones. She said our site is elegant and sexy. She might as well have been... https…"
73,659915452970172416,Fri Oct 30 02:11:19 +0000 2015,0,0,Science news... Simulation of 3-D exotic clouds on an exoplanet: A nearby exoplanet has an ... https://t.co/UxtMP8Vxlc always moving fwd.
74,659864135471992832,Thu Oct 29 22:47:24 +0000 2015,0,0,Science news... New primate species at root of tree of extant hominoids: Researchers have d... https://t.co/SrGpBvlu53 always moving fwd.
75,659805452658540544,Thu Oct 29 18:54:13 +0000 2015,0,0,"Science news... People with MS may be more physically fit than tests indicate, study finds:... https://t.co/O2vGmkuKyx always moving fwd."
76,659774430244028417,Thu Oct 29 16:50:56 +0000 2015,0,0,Science news... Do hospitals tell patients about charity care options? Study finds room for... https://t.co/ggp7piNGgh always moving fwd.
77,659728682722832387,Thu Oct 29 13:49:09 +0000 2015,0,0,Science news... Three deadly bacteria families responsible for nearly 60 percent of meningo... https://t.co/HCm97IOLtZ always moving fwd.
78,659534840362995713,Thu Oct 29 00:58:54 +0000 2015,0,0,Science news... Electric eels curl up to deliver even more powerful shocks: Electric eels t... https://t.co/j6q1X9tva4 always moving fwd.
79,659436637227630592,Wed Oct 28 18:28:40 +0000 2015,14,0,RT @NicholasDenmon: Amazing interview about a leading lady of tech. Great job Thomas 'Frodo' Humphreys https://t.co/oqvCtNqGGw
80,659356290376798208,Wed Oct 28 13:09:24 +0000 2015,0,0,Science news... Revolutionary research work on glassy materials: Scientists have discovered... https://t.co/BWZtxgpj22 always moving fwd.
81,659308491270590464,Wed Oct 28 09:59:28 +0000 2015,0,0,"Science news... Singing calms baby longer than talking: In a new study, infants remained ca... https://t.co/0oJd01rHs3 always moving fwd."
82,659080255810899968,Tue Oct 27 18:52:32 +0000 2015,0,0,"Science news... Probing the mysteries of Europa, Jupiter's cracked and crinkled moon: New r... https://t.co/CDvxumrTmR always moving fwd."
83,659009268348116993,Tue Oct 27 14:10:28 +0000 2015,0,0,Science news... Genetic testing could identify men at a 10-fold increased risk of testicula... https://t.co/Dku7jtJWIr always moving fwd.
84,658810266696577024,Tue Oct 27 00:59:42 +0000 2015,0,0,Science news... Mycologist says our close relatives break the bounds of biology: The mushro... https://t.co/GfoPZKU2hb always moving fwd.
85,658774583672049664,Mon Oct 26 22:37:54 +0000 2015,0,0,Science news... Physicists uncover novel phase of matter: A team of physicists has discover... https://t.co/oRJ0zw8v5X always moving fwd.
86,658671725693898752,Mon Oct 26 15:49:11 +0000 2015,0,0,Science news... Products expectant mothers should avoid during first trimester: Expectant m... https://t.co/ZjYp27t96v always moving fwd.
87,658639003168563200,Mon Oct 26 13:39:09 +0000 2015,0,0,Science news... Pregnant women in Brooklyn have highest levels of certain preservatives use... https://t.co/YNQ2K48pFy always moving fwd.
88,658386986525265920,Sun Oct 25 20:57:44 +0000 2015,0,0,Science news... Blackouts and near drownings may signal sudden death risk: Blackouts and ne... https://t.co/GJJNDoiH0v always moving fwd.
89,657940488603873280,Sat Oct 24 15:23:31 +0000 2015,0,0,"Science news... Capacitor breakthrough: In the movie 'Back to the Future,' Doc Brown and Ma... https://t.co/WrVFUjr9aj always moving fwd."
90,657592285287215105,Fri Oct 23 16:19:52 +0000 2015,0,0,Science news... Steaming out some of luminol's wrinkles: A potential rival to the storied f... https://t.co/2VggnawI93 always moving fwd.
91,657559433342353408,Fri Oct 23 14:09:20 +0000 2015,1,1,Science news... Drilling the world's hottest geothermal well: There is an infinite amount o... https://t.co/kW5yil8v15 always moving fwd.
92,657366389578072064,Fri Oct 23 01:22:15 +0000 2015,0,0,Science news... CEO effect on firm performance mostly due to chance: A researcher calls int... https://t.co/X1MbttlmEt always moving fwd.
93,657279669117386752,Thu Oct 22 19:37:39 +0000 2015,0,0,Science news... Deep-sea bacteria could help neutralize greenhouse gas: A type of bacteria ... https://t.co/zyCFzvRDs9 always moving fwd.
94,657242121838071808,Thu Oct 22 17:08:27 +0000 2015,0,0,Science news... Alzheimer's disease: Plaques impair memory formation during sleep: Alzheime... https://t.co/QC2l4M7vTR always moving fwd.
95,657203901997805568,Thu Oct 22 14:36:35 +0000 2015,0,0,"Science news... 3-D map of the brain: The animal brain is so complex, it would take a super... https://t.co/mfjMdVfAqE always moving fwd."
96,657005239258615808,Thu Oct 22 01:27:10 +0000 2015,0,0,Science news... Algae virus can jump to mammalian cells: New research provides first direct... https://t.co/dindciWEWZ always moving fwd.
97,656945307150741504,Wed Oct 21 21:29:01 +0000 2015,0,0,Science news... Cats retain multiple functional bitter taste receptors: Cats have at least ... https://t.co/xOeZWcAZaf always moving fwd.
98,656909905320738816,Wed Oct 21 19:08:20 +0000 2015,0,0,"Science news... For Latinos, African ancestry adds to risk of glaucoma: Latinos with Africa... https://t.co/yEnG6cTrlV always moving fwd."
99,656874576899538944,Wed Oct 21 16:47:57 +0000 2015,0,0,Science news... Fish story: Analysts see nations' misuse of 'rational use' when it comes to... https://t.co/7DQ06dsoVd always moving fwd.
100,656836023964450816,Wed Oct 21 14:14:46 +0000 2015,1,0,Science news... New research paves the way to begin developing a computer you can control w... https://t.co/DZKUaQngsc always moving fwd.
101,656637646765096960,Wed Oct 21 01:06:29 +0000 2015,0,0,"Science news... Scientists find link between comet, asteroid showers and mass extinctions: ... https://t.co/XyF3G03sLQ always moving fwd."
102,656582739462787073,Tue Oct 20 21:28:18 +0000 2015,0,0,Science news... Internal fingerprint sensor peers inside fingertips for more surefire ID: M... https://t.co/M9aD1usNGD always moving fwd.
103,656487705212129280,Tue Oct 20 15:10:40 +0000 2015,0,0,Science news... Most Earth-like worlds have yet to be born: Earth came early to the party i... https://t.co/SrptVxtGmd always moving fwd.
104,656240923001556992,Mon Oct 19 22:50:03 +0000 2015,0,0,Science news... Significant nonmedical financial burden for families after child admitted t... https://t.co/OMevvCMioW always moving fwd.
105,656210310253035520,Mon Oct 19 20:48:24 +0000 2015,0,0,Science news... Solvents save steps in solar cell manufacturing: Advances in ultrathin film... https://t.co/emQMc8JnAN always moving fwd.
106,656179581951438848,Mon Oct 19 18:46:18 +0000 2015,19,0,RT @NicholasDenmon: Star Wars nerds...alert.  #starwars #StarWarsTheForceAwakens  https://t.co/wf3nYt7VIg
107,656178346426953728,Mon Oct 19 18:41:23 +0000 2015,0,0,Science news... The 20 lb. cereal box: Kitchen counter foods that relate to your weight: Ov... https://t.co/bjgerDhHZS always moving fwd.
108,656147676036100096,Mon Oct 19 16:39:31 +0000 2015,0,0,Science news... Imitation biologics are therapeutically equivalent to the original drugs: R... http://t.co/y4I7Scvcjs always moving fwd.
109,656115827821801474,Mon Oct 19 14:32:58 +0000 2015,0,0,"Science news... Heavy drinkers, drugs users underestimate their levels of consumption compa... http://t.co/dgstK2wgG2 always moving fwd."
110,655880827465699328,Sun Oct 18 22:59:09 +0000 2015,0,0,Science news... Scientists close in on a blood test for Alzheimer's disease: Researchers ar... http://t.co/JncLX5XrTh always moving fwd.
111,655830245086380032,Sun Oct 18 19:38:09 +0000 2015,0,0,Science news... Nuclear transport problems linked to ALS and FTD: Three teams of scientists... http://t.co/UwMk4FcvjV always moving fwd.
112,655795760710094848,Sun Oct 18 17:21:08 +0000 2015,0,0,"Science news... Dates for cataclysms on early moon, Earth questioned: A study of zircons fr... http://t.co/8BVDl4x8SW always moving fwd."
113,655512763205193728,Sat Oct 17 22:36:36 +0000 2015,0,0,Science news... Nanodiamonds might prevent tooth loss after root canals: Nanodiamonds may h... http://t.co/ervCgWbOwf always moving fwd.
114,655114812540628992,Fri Oct 16 20:15:17 +0000 2015,0,0,"Science news... A nap to recap: How reward, daytime sleep boost learning: Rewarding learnin... http://t.co/psWaQRlibV always moving fwd."
115,655072046754299904,Fri Oct 16 17:25:21 +0000 2015,0,0,Science news... Hot Jupiter-like planet: Discovery of two close-in planet companions sheds ... http://t.co/6Lr1mR9TvW always moving fwd.
116,655038681875546112,Fri Oct 16 15:12:46 +0000 2015,0,0,"Science news... Inflammation in the brain is linked to risk of schizophrenia, study finds: ... http://t.co/mtkAz0nFmj always moving fwd."
117,654791188927479809,Thu Oct 15 22:49:19 +0000 2015,0,0,Science news... 2015 Antarctic maximum sea ice extent breaks streak of record highs: The se... http://t.co/x3Woxn94qv always moving fwd.
118,654735678912114688,Thu Oct 15 19:08:44 +0000 2015,0,0,Science news... Engineers create artificial skin that can send pressure sensation to brain ... http://t.co/lnTDxhRj6D always moving fwd.
119,654703247706292224,Thu Oct 15 16:59:52 +0000 2015,0,0,Science news... Towards a favorable systemic radio-immunother target: Survival probability ... http://t.co/LCibrtDO67 always moving fwd.
120,654640539111845888,Thu Oct 15 12:50:41 +0000 2015,0,0,Science news... Could contaminated land actually be good for trees?: The very act of tolera... http://t.co/ZhoEhh6AgJ always moving fwd.
121,654459854342328321,Thu Oct 15 00:52:43 +0000 2015,0,0,Science news... Low physical activity responsible for 17 percent of cardiovascular deaths i... http://t.co/I2WSSoJtkM always moving fwd.
122,654361357215600640,Wed Oct 14 18:21:19 +0000 2015,0,0,Science news... 125-million-year-old mammal fossil reveals the early evolution of hair and ... http://t.co/Q18b2qQcyT always moving fwd.
123,654294656407048192,Wed Oct 14 13:56:16 +0000 2015,0,0,Science news... 'The Dress': Explanation of optical illusion of colors of the striped dress... http://t.co/hPPfWz1q2k always moving fwd.
124,654078841653080064,Tue Oct 13 23:38:42 +0000 2015,0,0,"Science news... Use of e-cigarettes, alternative tobacco products may lead to increased tob... http://t.co/hvfry0dkZd always moving fwd."
125,653989775305629696,Tue Oct 13 17:44:47 +0000 2015,0,0,"Science news... Billions of juvenile fish under the Arctic sea ice: Using a new net, marine... http://t.co/IKMuHRz9lu always moving fwd."
126,653956779680755713,Tue Oct 13 15:33:40 +0000 2015,0,0,Science news... New research sees zebrafish earn their stripes in the fight against Muscula... http://t.co/9xpodFYD9l always moving fwd.
127,653701053397909504,Mon Oct 12 22:37:30 +0000 2015,0,0,Science news... Global marine analysis suggests food chain collapse: A world-first global a... http://t.co/m8nTLXNG9B always moving fwd.
128,653667350512734212,Mon Oct 12 20:23:35 +0000 2015,0,0,"Science news... New research shows how to make effective political arguments, sociologist s... http://t.co/WilUbBuIlE always moving fwd."
129,653621238351265792,Mon Oct 12 17:20:21 +0000 2015,0,0,Science news... Hidden brain pathways crucial to communication: Being able to understand sp... http://t.co/kcWXutt3Ho always moving fwd.
130,653558125417525249,Mon Oct 12 13:09:34 +0000 2015,0,0,Science news... 2015 Nobel Prize in Economics: The Royal Swedish Academy of Sciences has de... http://t.co/EqxLxfVcUC always moving fwd.
131,653388985524293632,Mon Oct 12 01:57:28 +0000 2015,0,0,Science news... Study finds significant decrease in hospitalization of older nursing home r... http://t.co/hK7UhtbLif always moving fwd.
132,652508260663095296,Fri Oct 09 15:37:47 +0000 2015,0,0,"Science news... Adoption of streamlined breast cancer treatment has stagnated, study finds:... http://t.co/u6MX67sxTB always moving fwd."
