,id_str,created_at,retweet_count,favorite_count,text
0,668804075044126722,Mon Nov 23 14:51:31 +0000 2015,0,0,"Update on the NYC Trip:
 Due to recent threats targeted at NYC, those involved in planning the trip have decided... https://t.co/bs8Yr1QznV"
1,667383189699223553,Thu Nov 19 16:45:26 +0000 2015,1,0,RT @SalemState: Stay up-to-date on all the latest fun events coming to campus by following @SSUPC. One of many groups on campus making SSU …
2,663731893582569472,Mon Nov 09 14:56:29 +0000 2015,0,0,(Sorry it wasn't posted earlier in the week) But our newest PC member of the month is Jamie! She has been stellar... https://t.co/qLvQk37UL1
3,662463706408869888,Fri Nov 06 02:57:10 +0000 2015,0,0,Jamie's being seriously amazing by some of these magicians at NACA Northeast Region!! #ssupc #naca https://t.co/a0PYueH2xu
4,662428205723193344,Fri Nov 06 00:36:06 +0000 2015,0,0,Disco dome! Like a club with a moon bounce! https://t.co/kGll0f3C46
5,659762187351810050,Thu Oct 29 16:02:17 +0000 2015,0,0,Going to Rae Sremmurd tonight? Must have tickets for entry. Print out ahead of time. Visit the Campus Center room 218 for help.
6,659742492837810176,Thu Oct 29 14:44:02 +0000 2015,0,0,Early morning load in circa 8am https://t.co/Zt0tTQsTaK
7,659504132894556161,Wed Oct 28 22:56:52 +0000 2015,0,0,Hey everyone!! Just letting everyone know that there will be no backpacks/purses/food or drink allowed at the... https://t.co/9J0L31VJcM
8,658775237455036416,Mon Oct 26 22:40:30 +0000 2015,0,0,I posted a new photo to Facebook https://t.co/rNSDtX160F
9,658775237312405504,Mon Oct 26 22:40:30 +0000 2015,0,0,I posted a new photo to Facebook https://t.co/WoW8claJuH
10,658775237148839936,Mon Oct 26 22:40:30 +0000 2015,0,0,I posted a new photo to Facebook https://t.co/cmf3mbM5aE
11,658775234842112000,Mon Oct 26 22:40:30 +0000 2015,0,0,I posted a new photo to Facebook https://t.co/2oUTzJGGMN
12,658757502922833921,Mon Oct 26 21:30:02 +0000 2015,0,0,a pirate! https://t.co/Ycf62vsSsA
13,658756820261978112,Mon Oct 26 21:27:19 +0000 2015,0,0,I posted a new photo to Facebook https://t.co/GGHaxZ8We0
14,658756819926384640,Mon Oct 26 21:27:19 +0000 2015,0,0,I posted a new photo to Facebook https://t.co/K5wehMlBZL
15,658756819716866048,Mon Oct 26 21:27:19 +0000 2015,0,0,I posted a new photo to Facebook https://t.co/MrdiE3mrLX
16,658756819540578304,Mon Oct 26 21:27:19 +0000 2015,0,0,I posted a new photo to Facebook https://t.co/OzBTxWfiG6
17,658756819448418304,Mon Oct 26 21:27:19 +0000 2015,0,0,I posted a new photo to Facebook https://t.co/kKCuEaOiok
18,658756817808445440,Mon Oct 26 21:27:19 +0000 2015,0,0,I posted a new photo to Facebook https://t.co/lxcnBx1zO4
19,658755828992749569,Mon Oct 26 21:23:23 +0000 2015,0,0,I posted a new photo to Facebook https://t.co/SuEJWmoMp6
20,658755827797467137,Mon Oct 26 21:23:23 +0000 2015,0,0,I posted a new photo to Facebook https://t.co/27sZjnsiV6
21,658755827503771648,Mon Oct 26 21:23:23 +0000 2015,0,0,I posted a new photo to Facebook https://t.co/MUUBxCHzLz
22,658753999798169600,Mon Oct 26 21:16:07 +0000 2015,0,0,I posted a new photo to Facebook https://t.co/1oVcVOrCRg
23,658753998376202240,Mon Oct 26 21:16:06 +0000 2015,0,0,I posted a new photo to Facebook https://t.co/CON2aoRgvM
24,658753998225149952,Mon Oct 26 21:16:06 +0000 2015,0,0,I posted a new photo to Facebook https://t.co/zOvgRGf48A
25,658753998158196736,Mon Oct 26 21:16:06 +0000 2015,0,0,I posted a new photo to Facebook https://t.co/Z3QkmNK5V0
26,658753997776539650,Mon Oct 26 21:16:06 +0000 2015,0,0,I posted a new photo to Facebook https://t.co/cmU5jZpwFI
27,658753997650526209,Mon Oct 26 21:16:06 +0000 2015,0,0,I posted a new photo to Facebook https://t.co/2y7NuXpjOS
28,658753996711006208,Mon Oct 26 21:16:06 +0000 2015,0,0,I posted a new photo to Facebook https://t.co/OE6nfBw7ok
29,658753996203495424,Mon Oct 26 21:16:06 +0000 2015,0,0,I posted a new photo to Facebook https://t.co/Y5KnfIhuQ4
30,658753996044177408,Mon Oct 26 21:16:06 +0000 2015,0,0,I posted a new photo to Facebook https://t.co/bweyTz4OOT
31,658753995779928064,Mon Oct 26 21:16:06 +0000 2015,0,0,I posted a new photo to Facebook https://t.co/7AuvYtWzye
32,658753995633205248,Mon Oct 26 21:16:06 +0000 2015,0,0,I posted a new photo to Facebook https://t.co/wMKhpiwiAU
33,658753993699528704,Mon Oct 26 21:16:05 +0000 2015,0,0,I posted a new photo to Facebook https://t.co/yITLRgwVQ2
34,658753993636737024,Mon Oct 26 21:16:05 +0000 2015,0,0,I posted a new photo to Facebook https://t.co/fjlKTEeEON
35,658753993506738176,Mon Oct 26 21:16:05 +0000 2015,0,0,I posted a new photo to Facebook https://t.co/aFUL50hbxe
36,658753993418657792,Mon Oct 26 21:16:05 +0000 2015,0,0,I posted a new photo to Facebook https://t.co/QMGeziMi6C
37,658753993359814656,Mon Oct 26 21:16:05 +0000 2015,0,0,I posted a new photo to Facebook https://t.co/q0UiEIwSm6
38,658753991635955712,Mon Oct 26 21:16:05 +0000 2015,0,0,I posted a new photo to Facebook https://t.co/kJgxJ2tvlY
39,658753991476580353,Mon Oct 26 21:16:05 +0000 2015,0,0,I posted a new photo to Facebook https://t.co/1q1qswTWdX
40,658753991405387777,Mon Oct 26 21:16:05 +0000 2015,0,0,I posted a new photo to Facebook https://t.co/LWciK4bkJi
41,658753991359070208,Mon Oct 26 21:16:05 +0000 2015,0,0,I posted a new photo to Facebook https://t.co/wkk9luAMUW
42,658753990730129408,Mon Oct 26 21:16:05 +0000 2015,0,0,I posted a new photo to Facebook https://t.co/zCXlWU4tEu
43,658753989492666368,Mon Oct 26 21:16:04 +0000 2015,0,0,I posted a new photo to Facebook https://t.co/EDf9dT1Vu2
44,658753581848244225,Mon Oct 26 21:14:27 +0000 2015,0,0,I posted a new photo to Facebook https://t.co/u3bdw8cKLQ
45,658753581114368000,Mon Oct 26 21:14:27 +0000 2015,0,0,I posted a new photo to Facebook https://t.co/QSbzHZinfk
46,658753579813998593,Mon Oct 26 21:14:27 +0000 2015,0,0,I posted a new photo to Facebook https://t.co/wDbzXANxxl
47,658753579319230464,Mon Oct 26 21:14:27 +0000 2015,0,0,I posted a new photo to Facebook https://t.co/g0aHI1xGT1
48,658753579063377921,Mon Oct 26 21:14:26 +0000 2015,0,0,I posted a new photo to Facebook https://t.co/muMWVZ3nL6
49,658753578987864064,Mon Oct 26 21:14:26 +0000 2015,0,0,I posted a new photo to Facebook https://t.co/H0l6WcGTpl
50,658753578610376704,Mon Oct 26 21:14:26 +0000 2015,0,0,I posted a new photo to Facebook https://t.co/zsCiGWfnOf
51,658753577221906432,Mon Oct 26 21:14:26 +0000 2015,0,0,I posted a new photo to Facebook https://t.co/XsuVoTQIZX
52,658753577121353728,Mon Oct 26 21:14:26 +0000 2015,0,0,I posted a new photo to Facebook https://t.co/y6TPDtTAKp
53,658753577096097796,Mon Oct 26 21:14:26 +0000 2015,0,0,I posted a new photo to Facebook https://t.co/SJ5tpFBT69
54,658753577054248960,Mon Oct 26 21:14:26 +0000 2015,0,0,I posted a new photo to Facebook https://t.co/QmmtnKiOJi
55,658753576974487552,Mon Oct 26 21:14:26 +0000 2015,0,0,I posted a new photo to Facebook https://t.co/WSmLEcSpMv
56,658753575405797376,Mon Oct 26 21:14:26 +0000 2015,0,0,I posted a new photo to Facebook https://t.co/ahAEsgsLJx
57,658752376522739712,Mon Oct 26 21:09:40 +0000 2015,0,0,I posted a new photo to Facebook https://t.co/M4FQCoFniG
58,658688061170020352,Mon Oct 26 16:54:06 +0000 2015,0,0,Hey all! Don't forget to print your tickets for Rae Sremmurd if you bought them online.
59,658655382248620032,Mon Oct 26 14:44:15 +0000 2015,0,0,"Hey Salem State Peeps,

 As most of you know Rae Sremmurd is this Thursday and the concert is completely sold... https://t.co/VVlaskC7cM"
60,651153061021257728,Mon Oct 05 21:52:42 +0000 2015,0,0,"We are proud to announce that October's ""PC Member of the Month"" is Shannon Gallagher! Shannon has been a... http://t.co/9x1VSr4AEQ"
61,650407611335057408,Sat Oct 03 20:30:33 +0000 2015,1,1,What a great way to spend your Saturday night! Come join Program Council in watching illusionist Leon Etienne at... http://t.co/EYOgGSA8mi
62,649244186877661184,Wed Sep 30 15:27:31 +0000 2015,0,0,http://t.co/7eyOjhSWJ8
63,648181758152740865,Sun Sep 27 17:05:48 +0000 2015,0,0,http://t.co/4Xmgtu7cPS
64,647842241080262656,Sat Sep 26 18:36:41 +0000 2015,0,0,"Hello everyone! 

Map works has a new referral plan. 1 referral for PC = $1 that will go towards awesome perks... http://t.co/NZKZtiepe6"
65,647152848883597313,Thu Sep 24 20:57:17 +0000 2015,0,0,Come get some free PC Swag at Marsh dinning. We have sunglasses ☀️ water bottles 󾭛 and speakers 󾠔. All you have... http://t.co/2GzSiNrTDh
66,646857165987147776,Thu Sep 24 01:22:21 +0000 2015,0,1,We have a new member of our e-board! Carly Heath is officially the secretary for Program Council. Congratulations Carly!
67,646817961534099456,Wed Sep 23 22:46:33 +0000 2015,0,0,Program Council welcomes Carly Heath as our new Secretary! Congrats Carly!
68,645953273191510016,Mon Sep 21 13:30:36 +0000 2015,0,1,"Did you miss our meeting last week? That's okay, all of our meetings are open and you can come anytime to check... http://t.co/XpJjn0kC5K"
69,643421934886125569,Mon Sep 14 13:51:58 +0000 2015,0,0,Our first structured meeting is tonight in the MLK room at 4:30pm. Come join us if you want to get involved or just meet some wacky people!
70,642433426398838784,Fri Sep 11 20:23:59 +0000 2015,0,0,Don't forget to come out for Big Prize Bingo tonight at 8 in Vets Hall. We have some great prizes like Ed Sheeran... http://t.co/u7XUCvtNWT
71,642061371308281857,Thu Sep 10 19:45:34 +0000 2015,0,0,So for everyone who keeps asking me. There may or may not be spots left for Roller World tonight. If you need... http://t.co/Rh4OTkLJR1
72,642030596722688000,Thu Sep 10 17:43:17 +0000 2015,0,0,"Folks going to roller world tonight, don't forget a pair of SOCKS."
73,641338250481635328,Tue Sep 08 19:52:09 +0000 2015,1,0,"UPDATE: our open house has been moved to vets hall, tell your friends!! Stil at 4:30!"
74,640596652550545408,Sun Sep 06 18:45:18 +0000 2015,0,0,HEY! Our Open house is this tuesday in the Viking Hall Cafe at 4:30pm! In the off chance we cannot use that space... http://t.co/9K6GfApSdi
75,639992198860140544,Sat Sep 05 02:43:25 +0000 2015,0,0,http://t.co/RAWnwGsi4I
76,639981640501100545,Sat Sep 05 02:01:28 +0000 2015,0,0,http://t.co/smesvcXMTY
77,639203125274906624,Wed Sep 02 22:27:55 +0000 2015,0,0,Who's doing absolutely nothing tonight? Come see Hypnotist/Mentalist Spidey in Vets Hall at 7pm! http://t.co/pXhIeS5lKO
78,639101398618112000,Wed Sep 02 15:43:42 +0000 2015,0,3,Happy first day of classes everyone!
79,626153356550111232,Tue Jul 28 22:12:48 +0000 2015,0,0,http://t.co/SgqBjFVr66
80,626139599899914240,Tue Jul 28 21:18:08 +0000 2015,0,0,"Along with our awesome events for Welcome Week, Program Council has helped Campus Educators of Sexual Assault... http://t.co/JYnxJzG2OI"
81,621134019502206976,Wed Jul 15 01:47:45 +0000 2015,0,0,HEEEYY! guess what we now have?? A new public relations joining our e-board for next year! Say hello to the... http://t.co/rtolNgsPRR
82,613492409922678784,Tue Jun 23 23:42:43 +0000 2015,0,0,2014-15 Cohesion Tour // Official Recap http://t.co/CAiGlO2XmS
83,608292118218612736,Tue Jun 09 15:18:37 +0000 2015,0,0,"Come check out Program Council during Freshman Orientation!! 
Everyone is welcome to join! http://t.co/DX6dsIC0Eo"
84,597795195925725185,Mon May 11 16:07:35 +0000 2015,0,0,"If you are attending the bar crawl today, check-in is in the Bertolon Lobby at 5:15. See you there!"
85,596715276839690240,Fri May 08 16:36:23 +0000 2015,0,0,Just reminder Ladies and Gentleman we are still selling tickets for Six Flags and The Bar Crawl. There are still... http://t.co/J2nAvU3XBo
86,596020467380563968,Wed May 06 18:35:27 +0000 2015,0,0,Ladies and Gentleman we selling tickets for the Bar Crawl and Six Flags at the Ellison Campus Center Room 217... http://t.co/PJNgyDVhtj
87,595624596092641281,Tue May 05 16:22:24 +0000 2015,0,0,Ladies and Gentleman just a quick reminder that tickets for the Boston Cruise and The Bar crawl have been sold... http://t.co/m1pkf0mi0U
88,595414413844291586,Tue May 05 02:27:13 +0000 2015,1,0,Seniors attending the bar crawl! Due to popular demand we are moving the crawl to Boston instead of Salem.... http://t.co/ENng2fHApy
89,594239240151662592,Fri May 01 20:37:29 +0000 2015,0,1,We are officially sold out of senior week tickets for both the bar crawl and the cruise. There are some six flags... http://t.co/sAc4oX0el1
90,593212993099472897,Wed Apr 29 00:39:33 +0000 2015,0,0,Here we go! Just 25 minutes until the show starts!! http://t.co/fPXzBymZzO
91,593172664111489024,Tue Apr 28 21:59:18 +0000 2015,0,0,"Door open tonight at 7:45pm, FYI no backpacks allowed!"
92,593163115036024832,Tue Apr 28 21:21:21 +0000 2015,0,0,Setting up for the big show! Man Cave Monologues will open the doors at 7:45 sharp!
93,592849860249923584,Tue Apr 28 00:36:35 +0000 2015,1,1,Show volunteers! Be there as early as possible tomorrow. The volunteer meeting is at 6PM. If you are not at the... http://t.co/hGFyBHUYl8
94,592766578036453377,Mon Apr 27 19:05:39 +0000 2015,1,0,"Our senior week ticket sales schedule for this week is!

Wednesday 12:00-4:00
Thursday 12:30-4:00
Friday... http://t.co/ZWmekSSOjj"
95,592753454818455553,Mon Apr 27 18:13:31 +0000 2015,1,0,Hello seniors! We just wanted to give you all an update. We are officially sold out of the bar crawl tickets.... http://t.co/mw4xKRv66r
96,591311954079305729,Thu Apr 23 18:45:30 +0000 2015,1,0,BUY YOUR MAN CODE MONOLOGUE TICKET TOMORROW IN LOWER NORTH FROM 12PM-2PM AND YOU'LL GET ONE FREEEEEEEE!!! WHAT A... http://t.co/R69uG3BoW7
97,590985916082216960,Wed Apr 22 21:09:57 +0000 2015,0,0,Hi everyone just letting you know that we are selling tickets for Man Cave Monologues (Guy code) at Marsh Dining... http://t.co/DTRHa5p5F1
98,590955593881518081,Wed Apr 22 19:09:27 +0000 2015,1,0,Senior week and Guy Code tickets will be sold in Ellison 217 until 4pm.
99,590901858144780288,Wed Apr 22 15:35:56 +0000 2015,0,0,Hey Everybody just letting you know that we are selling tickets for Man Cave Monologues (Guy Code) in lower north... http://t.co/rinx7QA7I5
100,590537847968555008,Tue Apr 21 15:29:29 +0000 2015,0,0,"Come buy tickets for "" The Man Cave Monologues"" right now in the PC office, room 217 in Ellison Campus Center. I... http://t.co/3FQbm6nn35"
101,590246775010635776,Mon Apr 20 20:12:52 +0000 2015,0,0,"Here is our definite schedule to sell tickets in our office (ECC 217) this week!
Tuesday; 12:30-4
Wednesday;... http://t.co/dQOpoHpPHQ"
102,589114344631377920,Fri Apr 17 17:12:59 +0000 2015,1,0,"HEY EVERYONE THIS JUST IN, tickets can be bought for our comedy show ONLINE! Just follow this link here!... http://t.co/PLe16DYChZ"
103,588844685994684417,Thu Apr 16 23:21:28 +0000 2015,1,1,"Due to scheduling issues with the bus company, the whitewater rafting trip has been cancelled. We are sincerely... http://t.co/JxzoSOLcq7"
104,588767914884464640,Thu Apr 16 18:16:24 +0000 2015,0,0,"https://t.co/7zSZclhHlT
Check out this funny clip of rapid fire with Lil Duval, who will be... http://t.co/OXqUHiiBMW"
105,588745408379166720,Thu Apr 16 16:46:58 +0000 2015,0,0,Tickets for Man Cave Monologues and Senior Week events are being sold from now until 4 pm in the PC office (ECC... http://t.co/5LIqoc7L5i
106,588697631242772480,Thu Apr 16 13:37:07 +0000 2015,0,0,GOOD MORNING SALEM STATE!!!!  Congratulations to all the seniors who got their cap and gowns yesterday... If you... http://t.co/JZ2LTGaYqb
107,588384766019244033,Wed Apr 15 16:53:54 +0000 2015,0,0,"Correction to the post earlier.

If you are a senior looking for senior week and/ Guy Code Tickets, we will be in... http://t.co/YaZmwzNh0M"
108,588374395183325184,Wed Apr 15 16:12:41 +0000 2015,0,0,"Come buy senior week and Man Cave Monologue tickets now in Ellison 217. If door is closed, check Vets Hall during... http://t.co/G16bTQ4isR"
109,588197400034050049,Wed Apr 15 04:29:23 +0000 2015,0,0,"Ticket sales for tomorrow will start at 1PM at the grad finale, not 10AM. We apologize for any inconveniences."
110,588044689451970563,Tue Apr 14 18:22:33 +0000 2015,0,1,Here is our definite ticket selling schedule for the week. This includes both Senior Week and The Man Cave... http://t.co/hpZ4Q6Pbjx
111,587675558839877632,Mon Apr 13 17:55:46 +0000 2015,0,0,I'm in the office selling senior week tickets until 4! Room 217 of the Ellison Campus Center. Later today I will... http://t.co/UIo8KjwY48
112,587348240019759104,Sun Apr 12 20:15:07 +0000 2015,0,0,"We are looking for volunteers for our ""Man Cave Monologues"" show with the guys from Guy Code! If interested,... http://t.co/LuLiP02XRP"
113,587345767632936960,Sun Apr 12 20:05:18 +0000 2015,0,0,"The tickets for ""The Mancave Monologues"" featuring comedians from MTV's Guy Code will begin sales on Wednesday at... http://t.co/RDOiCIvsms"
114,586596743015346177,Fri Apr 10 18:28:56 +0000 2015,0,0,"Join  us on Monday for some awesome personalized swag! 
https://t.co/H7DU60tEDU http://t.co/XAnBRw9hTN"
115,586595730162192384,Fri Apr 10 18:24:55 +0000 2015,0,0,"Senior Week tickets will begin sales this Monday at noon in the office, Ellison Campus Center Room 217!"
116,586192474013618179,Thu Apr 09 15:42:31 +0000 2015,0,0,"Finish up your Senior Week with a day trip to Six Flags!!

https://t.co/QG3QPwm8qB"
117,585894266406244352,Wed Apr 08 19:57:33 +0000 2015,0,0,"Ready for some laughs? ""The Man Cave Monolouges"" are coming, featuring the guys from MTV's Guy Code!!... http://t.co/SstQ4H8w6D"
118,585847802523181056,Wed Apr 08 16:52:55 +0000 2015,0,0,"Congratulations to the next executive board members for 2015-2016 school year:

President: Christina Addonizio... http://t.co/tv04xscjmf"
119,585578966251089921,Tue Apr 07 23:04:39 +0000 2015,0,0,"Just to remind everyone, our Cake Boss event has been cancelled for this evening, sorry for any inconveniences this may cause."
120,584067149699907584,Fri Apr 03 18:57:14 +0000 2015,0,0,"Hey, this is the same cruise event. It was deleted by accident! http://t.co/PqW5Evrx5N"
121,584055512532004864,Fri Apr 03 18:11:00 +0000 2015,0,0,Senior Week Event Number Two! http://t.co/WKqaYVFVdT
122,584036591330578432,Fri Apr 03 16:55:48 +0000 2015,0,0,We're setting up for an awesome Senior Week! Here's event number one! http://t.co/kG7eeJBim9
123,582638375204704256,Mon Mar 30 20:19:48 +0000 2015,0,0,Jamming to 2000s rap before the meeting at 4:30! Last day to be nominated for an E-Board position! Be there or be square #pc
124,570962954050539520,Thu Feb 26 15:05:50 +0000 2015,0,0,"Help PC pick the spring concert genre! 

You can send a text vote by sending the codes below to the the number... http://t.co/qDZZWkR0FG"
125,568969150837760000,Sat Feb 21 03:03:11 +0000 2015,0,0,Just a snapshot lookout window! http://t.co/PgRbm6ubxG
126,568886072438067200,Fri Feb 20 21:33:03 +0000 2015,0,0,"Attention students attending Winter Ball

This is the PC Advisor again:

The first shuttle will arrive at 6:45pm.... http://t.co/gLr2X1aaki"
127,568472583269695488,Thu Feb 19 18:10:00 +0000 2015,0,0,"Hello everyone,

This is the PC advisor. Program Council, has purchased an additional 23 tickets for the winter... http://t.co/jn4hDtgD2t"
128,568201603595022337,Thu Feb 19 00:13:13 +0000 2015,1,0,"There are only 20 tickets left for Winter Ball. There will be someone in the office tomorrow, and it is a first... http://t.co/dZRY2ogJcv"
129,567727165647912960,Tue Feb 17 16:47:58 +0000 2015,0,0,Winter Ball tickets are being sold right now until 1:15pm in Program Council's office (room 217 in the campus... http://t.co/P54rZAa3wz
130,565925228589883392,Thu Feb 12 17:27:43 +0000 2015,0,0,Winter Ball tickets are being sold right now until 4:15 in Program Council's office! Cash and Clippercard are... http://t.co/ndsPbs5mQb
131,565538281681879040,Wed Feb 11 15:50:08 +0000 2015,4,2,We are currently selling Winter Ball tickets in Ellison 217. Come by to buy your tickets.
132,564876698072940546,Mon Feb 09 20:01:14 +0000 2015,0,0,Want a Spring Concert this semster? Take your MAP Works survey and write that Program Council referred  you.... http://t.co/wvzacjviQE
133,564529904029806595,Sun Feb 08 21:03:12 +0000 2015,1,0,"Today the Map Works survey went live! In addition to winning some AWESOME prizes, if you take it make sure you... http://t.co/0ELz6vK0IZ"
134,561662153795829760,Sat Jan 31 23:07:47 +0000 2015,0,0,"I posted 20 photos on Facebook in the album ""Cohesion EDM Show"" http://t.co/kLR4c1kOW1"
135,561659129006395392,Sat Jan 31 22:55:46 +0000 2015,0,0,"I posted 18 photos on Facebook in the album ""Cohesion EDM Show"" http://t.co/Q8ZVD5SMnz"
136,561448981616930817,Sat Jan 31 09:00:43 +0000 2015,1,2,"Program Council would like to thank not only the attendees for making this event huge, but the GrooveBoston staff... http://t.co/wfXCzA8QIn"
137,561363814906863616,Sat Jan 31 03:22:17 +0000 2015,0,0,ATTENTION: WE ARE SOLD OUT OF ALL TICKETS FOR COHESION!!!
138,561326163126022144,Sat Jan 31 00:52:40 +0000 2015,0,0,Were almost set for tonight!!!! http://t.co/RviBYVS048
139,561319757849579520,Sat Jan 31 00:27:13 +0000 2015,2,1,"Tonight at the door it is CASH ONLY! $10 for tickets. Bring cash for water bottles, $1 each. Are you ready? IT'S HERE!!"
140,561314827701080064,Sat Jan 31 00:07:38 +0000 2015,1,0,Don't forget to bring cash to buy waterbottles at Cohesion! No outside drink is allowed in tonight!
141,561304527539032064,Fri Jan 30 23:26:42 +0000 2015,0,0,"Hey Cohesion goers, just a reminder: DO NOT FORGET YOUR TICKETS! You need it to get in tonight! See you soon!"
142,561245988409839616,Fri Jan 30 19:34:05 +0000 2015,2,0,"Hey guys just an FYI, due to the amount of people expected to attend Cohesion tonight we have moved down the hall... http://t.co/l0wTML7O2s"
143,561191972426506240,Fri Jan 30 15:59:27 +0000 2015,1,0,Not feeling the snow? We have shuttles running to and from the show tonight on North and Central from 730 to 2am!
144,561180245085409280,Fri Jan 30 15:12:51 +0000 2015,0,1,Hello everyone! We will be selling tickets  for Cohesion until 12pm today. After that you will have to buy at the... http://t.co/nDOP3ji34G
145,561044301803945984,Fri Jan 30 06:12:39 +0000 2015,0,1,"Cohesion volunteers check your email! Also, WEAR A WHITE SHIRT TOMORROW!!!"
146,560933650725081088,Thu Jan 29 22:52:58 +0000 2015,0,0,Come by your Cohesion tickets right now in Marsh Dining! Only $5!
147,560918660274204673,Thu Jan 29 21:53:24 +0000 2015,1,0,We will be selling tickets to Cohesion tonight at dinner in Marsh!
148,560888351755350017,Thu Jan 29 19:52:58 +0000 2015,0,0,Today at 3:30 in the Ellison Campus center lobby we will be hosting a Make-A-Memory-Jar event and selling tickets to Cohesion! :)
149,560871278413099008,Thu Jan 29 18:45:07 +0000 2015,0,0,Are you ready??? http://t.co/ePX35vOdYy
150,560869426669830144,Thu Jan 29 18:37:46 +0000 2015,0,0,"Volunteers for Cohesion!!

Please wear a white shirt to the show. If you don't have one, let us know because we... http://t.co/sjnFLUFkMD"
151,559529675915931650,Mon Jan 26 01:54:04 +0000 2015,0,0,"Who's ready for build a buddy? This girl is, she was first in line! Happening right now in okeefe! http://t.co/mlb8HOaddW"
152,559452343667003394,Sun Jan 25 20:46:47 +0000 2015,1,0,Don't miss out on free skate and Build-A-Buddy tonight!!... http://t.co/DSoEQHWAGD
153,559387886832058369,Sun Jan 25 16:30:39 +0000 2015,0,0,"Cohesion Volunteers! Here's some important information!

If you are volunteering, we need a $5 safety deposit in... http://t.co/VzErGYjXlV"
154,559127251300929536,Sat Jan 24 23:14:59 +0000 2015,0,0,"What's better than good snacks with a good movie? Uh, nothing! Come watch Big Hero 6 in vets right now! http://t.co/LXzXk12bCr"
155,559121162903777281,Sat Jan 24 22:50:47 +0000 2015,0,1,Bored on your snow day? Come watch an awesome movie and get some free food!! http://t.co/MIu8TA0Vrs
156,558317433682137091,Thu Jan 22 17:37:03 +0000 2015,1,0,Looking for tickets to Cohesion? Here are the definite times to come to ECC 216 to buy a ticket. Look for us at... http://t.co/Fx3LYDo4j0
157,557875708102717442,Wed Jan 21 12:21:48 +0000 2015,0,0,Hypnotist Paul Ramsey did yet another great show here at SSU!
158,555915181105369088,Fri Jan 16 02:31:22 +0000 2015,0,0,We are looking for 25 volunteers for the Cohesion show! You will be fed and gain free entry to the event in... http://t.co/LXHv3SwfXM
159,554344557480267776,Sun Jan 11 18:30:16 +0000 2015,0,0,"We've got a wild Welcome Back Week coming up, with collaborations with Weekend Adventure Series and Weekend... http://t.co/4bjGf3mWqz"
160,552978640687104000,Thu Jan 08 00:02:36 +0000 2015,0,0,"Just 23 days away! Are you ready?

https://t.co/qdBoJNto3R http://t.co/gZjMS1WmSM"
161,542893181294350336,Thu Dec 11 04:06:35 +0000 2014,0,0,Here is the official event page! Please join and feel free to comment and ask questions. Are you ready???... http://t.co/lC74SxCBfQ
162,542427214071885825,Tue Dec 09 21:15:00 +0000 2014,0,0,Bring it. 1.30.15. http://t.co/rrWvgVYZfZ
163,542427111827324928,Tue Dec 09 21:14:35 +0000 2014,0,0,Are you ready? 1.30.15. http://t.co/tf9JiRvYVj
164,541052492680003584,Sat Dec 06 02:12:21 +0000 2014,0,0,"For those going to NYC with us tomorrow, the pick up has been moved to Marsh!!"
165,540968865422147584,Fri Dec 05 20:40:02 +0000 2014,1,1,"We're having another EDM show, but bigger and better than ever with the help of Groove Boston! Save the date,... http://t.co/z6iI1KPc1s"
166,529264192369737728,Mon Nov 03 13:29:51 +0000 2014,0,0,Hey Everyone! Happy Monday! Just a reminder our meeting is tonight in the MLK room at 4:30pm! All of our meetings... http://t.co/sNNBjuKnri
167,527865144207237121,Thu Oct 30 16:50:32 +0000 2014,1,1,Did you enjoy attending our events this week?Want to program with us? We're always accepting new members! Mondays MLK Room 4:30pm! #ssu #pc
168,526908968648851457,Tue Oct 28 01:31:02 +0000 2014,0,0,DIY Glow Mason Jars! http://t.co/ZFjpYgeavY
169,526908963531800576,Tue Oct 28 01:31:01 +0000 2014,0,0,DIY Glow Mason Jars! http://t.co/lyrVhLK23b
170,526908957575888896,Tue Oct 28 01:30:59 +0000 2014,0,0,DIY Glow Mason Jars! http://t.co/0oTqgWhavS
