,id_str,created_at,retweet_count,favorite_count,text
171,526908490770837504,Tue Oct 28 01:29:08 +0000 2014,0,0,"I posted 13 photos on Facebook in the album ""Arts Chairs' Events 2014-2015"" http://t.co/Rt1X6EynIh"
172,526880410283032576,Mon Oct 27 23:37:33 +0000 2014,0,0,Hey Hey Hey! DIY Glowing Mason Jars in T-1 hour!! Get your butts over to Vets Hall at 8:30 PM to make one! Super cute and super fun!
173,526543943581065216,Mon Oct 27 01:20:33 +0000 2014,0,0,"Some really fun events coming up this week! Tomorrow we'll be hosting DIY Glowing Mason Jars in Vets Hall at 8pm,... http://t.co/uXs3cA4MWK"
174,525468846598389760,Fri Oct 24 02:08:30 +0000 2014,0,0,"I posted 12 photos on Facebook in the album ""Miscellaneous PC Events 2014-2015"" http://t.co/W4l8PGAN8w"
175,525405761200197632,Thu Oct 23 21:57:49 +0000 2014,0,0,Hey All join us to celebrate U-Night at our Monster Bash Open Skate Night at Rockett Arena! It's tonight from... http://t.co/VKR12kGzAK
176,523152568294600704,Fri Oct 17 16:44:26 +0000 2014,0,0,"For those of you going on our Hysteria Scream Park trip tonight, don't forget the buses will leave at 5:30pm... http://t.co/2vuVQw3Von"
177,518850850081751041,Sun Oct 05 19:50:57 +0000 2014,0,0,"I posted 46 photos on Facebook in the album ""Family and Friends Weekend 2014"" http://t.co/eNLFcnVtvW"
178,518564395535048704,Sun Oct 05 00:52:41 +0000 2014,0,0,"I posted 4 photos on Facebook in the album ""PC Friendships, Selfies, and Other Gems"" http://t.co/3AWK4soG3v"
179,518564080219881472,Sun Oct 05 00:51:25 +0000 2014,0,0,"I posted 28 photos on Facebook in the album ""Family and Friends Weekend 2014"" http://t.co/VEu6r1dQv2"
180,518533024359514112,Sat Oct 04 22:48:01 +0000 2014,0,0,"Peter Boie in T-14 minutes! Come see his awesome magic in Marsh Dining, it's free! 🐰🎩 #magic #magician #peterboie #ssu #salemstate"
181,518532254700949505,Sat Oct 04 22:44:58 +0000 2014,0,0,"Come see Magician, Peter Boie at 7pm in Marsh Dining! It's FREE!!"
182,512779355479474176,Fri Sep 19 01:44:59 +0000 2014,0,0,I posted a new photo to Facebook http://t.co/YY3MsTjPTl
183,512779351683657729,Fri Sep 19 01:44:59 +0000 2014,0,0,I posted a new photo to Facebook http://t.co/EfbAnPdivE
184,512779012532211712,Fri Sep 19 01:43:38 +0000 2014,0,0,"I posted 9 photos on Facebook in the album ""Miscellaneous PC Events 2014-2015"" http://t.co/CZDg2kzmZe"
185,512778571341766657,Fri Sep 19 01:41:53 +0000 2014,0,0,"I posted 6 photos on Facebook in the album ""Welcome Week Fall 2014"" http://t.co/8d838SJ0yr"
186,512778277430116352,Fri Sep 19 01:40:42 +0000 2014,0,0,"I posted 6 photos on Facebook in the album ""Welcome Week Fall 2014"" http://t.co/l979ItrXHC"
187,512696633843146752,Thu Sep 18 20:16:17 +0000 2014,0,0,What's up all you lovely people?!!?! Hey have you heard that the one and only MARY LAMBERT is coming to campus... http://t.co/XtZxdhhatD
188,509874175746797570,Thu Sep 11 01:20:51 +0000 2014,0,0,All of the spots for Skyzone were filled tonight! We hope everyone who signed up has an amazing time tomorrow... http://t.co/vrJnx6ypKM
189,509491812902637570,Wed Sep 10 00:01:28 +0000 2014,0,0,Come win some fresh SSU swag at our trivia night right now in marsh 210! http://t.co/gkxbKYmSQb
190,509450884502155264,Tue Sep 09 21:18:50 +0000 2014,0,0,"Think you know the world's greatest facts? Come to trivia night, tonight in Marsh 210 at 8pm. There will be... http://t.co/BDfGFla31a"
191,509024277111513089,Mon Sep 08 17:03:39 +0000 2014,1,0,"We still have about 35 spots open for Skyzone, come to Ellison Campus room 217. All you need is your student ID! It's totally free!"
192,508999833718628352,Mon Sep 08 15:26:31 +0000 2014,0,0,Come Check us out at the Student Involvement Fair today! We're right in front of Meier Hall! http://t.co/r6LnLMOANG
193,508083453049307136,Sat Sep 06 02:45:09 +0000 2014,0,0,I posted a new photo to Facebook http://t.co/xpsaEkuhHW
194,508083450633797632,Sat Sep 06 02:45:09 +0000 2014,0,0,I posted a new photo to Facebook http://t.co/4hbZRldlHp
195,507715783863312384,Fri Sep 05 02:24:10 +0000 2014,0,1,Thank you to Brian Miller for an awesome magic show tonight! If you haven't checked out one of our welcome week... http://t.co/3BsYRpzNti
196,507715402403962880,Fri Sep 05 02:22:39 +0000 2014,1,0,"I posted 27 photos on Facebook in the album ""Welcome Week Fall 2014"" http://t.co/MENzOLm3CQ"
197,484189802938396672,Wed Jul 02 04:20:19 +0000 2014,1,1,"I posted 12 photos on Facebook in the album ""Miscellaneous PC Events 2013-2014"" http://t.co/HggESpRFvi"
198,484059350130892800,Tue Jul 01 19:41:57 +0000 2014,0,0,I posted a new photo to Facebook http://t.co/ICKrIYzFrq
199,484059254312038400,Tue Jul 01 19:41:34 +0000 2014,1,1,"I posted 4 photos on Facebook in the album ""Open Skate Hosted by PC 2013"" http://t.co/0xWM6mWuNc"
