,id_str,created_at,retweet_count,favorite_count,text
0,636633092413870084,Wed Aug 26 20:15:31 +0000 2015,0,0,"@ron_flordecana muchas gracias, parte de la duda que tengo es que tipo de proceso destilación usan, columna o pot still. Yo se que son 5 :)"
1,636361604108447745,Wed Aug 26 02:16:44 +0000 2015,0,0,"@ron_flordecana Una pregunta, entiendo que son 5 destilaciones pero que tipo de que tipo son, pot still o columna?"
2,636361027932655616,Wed Aug 26 02:14:26 +0000 2015,0,1,"@ron_flordecana Me gusta el 7 años blanco, tiene un perfil en nariz muy cítrico casi que podría remplazar cualquier coctel gin con 7 blanco."
3,636360671110672384,Wed Aug 26 02:13:01 +0000 2015,0,0,"@ron_flordecana Me encanta flor de caña, resultaría interesante un 15 o 18 años con un acabado en barricas de Jerez o Coñac como escocés"
4,636360111863173121,Wed Aug 26 02:10:48 +0000 2015,0,0,"@ron_flordecana Las botellas para los rones premium son increíbles, la de 25 pareciera que flota en el cristal :)"
5,636359828777009152,Wed Aug 26 02:09:40 +0000 2015,0,0,@ron_flordecana Quien o quienes son los maestros rones detrás de flor de caña? Resultaría interesante seguirles por twitter :)
6,362456013959479296,Wed Jul 31 06:13:42 +0000 2013,0,0,"@yindian hi, yeah I have been working on Bbcom for a while"
7,299387799390527488,Thu Feb 07 05:23:08 +0000 2013,0,0,"Muy tuanis NFC, para hacer pagos con el cel :) http://t.co/p6UzlJYK"
8,235127148229324800,Mon Aug 13 21:34:15 +0000 2012,0,0,"@dgolcher bueno el de queso, mas el badilla"
9,222370993757364224,Mon Jul 09 16:45:51 +0000 2012,0,0,"@dgolcher  (a menos que sea dependencias de diferentes versiones de log4j en sus dependencias de maven, en ese caso aplique exclusiones)"
10,222370964984442880,Mon Jul 09 16:45:44 +0000 2012,0,0,"@dgolcher Mae Log4j es una libreria muy simple, no veo que problema puede tener"
11,220552255458385921,Wed Jul 04 16:18:50 +0000 2012,0,0,@dgolcher sabe!
12,220542866932498432,Wed Jul 04 15:41:31 +0000 2012,0,0,"@dgolcher jajaja mae si, tan sucks que gano dos euros y un mundial seguidos, estan RE Sucks los pobres xP"
13,220194857791135744,Tue Jul 03 16:38:39 +0000 2012,0,0,@dgolcher que es la vara con espana? jaja
14,127091577792368640,Thu Oct 20 18:39:28 +0000 2011,0,0,@MuratDirilCA Ya llegaron? :)
15,76528706474094592,Fri Jun 03 06:00:40 +0000 2011,0,0,"Poniendome al corriente de lo nuevo en el proyecto http://www.sienaproject.com/, a ver en que puedo ayudar :)"
16,75679591167033344,Tue May 31 21:46:35 +0000 2011,0,0,"Mi opinión acerca de Spring 3 y sus Ioc approach basado en annotations
http://tinyurl.com/44al4x3"
17,19759867358,Wed Jul 28 18:08:29 +0000 2010,0,0,"11 ago, presentacion de http://code.google.com/p/padronelectoralcr
[+] info http://jsanca.ticoblogger.com/2010/07/prox-crjug-11-agosto.html"
18,16341591448,Wed Jun 16 22:53:21 +0000 2010,0,0,"Genial, me gusta C# pero no .Net asi como me gusta Groovy pero detesto Grails."
19,16341504383,Wed Jun 16 22:51:58 +0000 2010,0,0,En http://www.woot.com/default.aspx regularmente tiran algo a buen precio para que le lleguen
20,16181602729,Mon Jun 14 22:47:49 +0000 2010,0,0,"@abyzou Si yo le aposte a paraguay en la kinela, que madre con el empate 0 puntos"
21,16181482061,Mon Jun 14 22:45:39 +0000 2010,0,0,@abyzou Si git mucho mejor! SVN es una pega para hacer branches!
22,16167065907,Mon Jun 14 18:25:57 +0000 2010,0,0,"alfonsina; que haces aqui tan lejos del mar, las gaviotas, las olas y las ballenas. Acaso el frio de la primavera te lanzo a bocagarro aqui"
23,16166558624,Mon Jun 14 18:17:04 +0000 2010,0,0,"La verdad sobre esa cosa es un secreto a voces, que ni tu o mortal de corazón latente ha de saber o muerto viviente conocer"
24,15687557856,Tue Jun 08 06:17:01 +0000 2010,0,0,poniendole para sacar conecta2.cr
25,14870124900,Fri May 28 00:35:19 +0000 2010,0,0,"Buscando un api java para manipular scridb, me encontre con http://lnkd.in/S5mwmS"
26,14275370481,Wed May 19 04:57:35 +0000 2010,0,0,aqui otro de jquery: http://jsanca.ticoblogger.com/2010/05/filtrar-la-respuestra-de-un-callback.html
27,14275337561,Wed May 19 04:56:48 +0000 2010,0,0,nuevo post relacionado con jquery: http://jsanca.ticoblogger.com/2010/05/hacer-el-disable-con-un-boton-en-jquery.html
28,13080989501,Thu Apr 29 17:45:40 +0000 2010,0,0,"@SoySpeedbox musiquita (CD, DVD) y libritos"
29,12620789631,Thu Apr 22 04:52:02 +0000 2010,0,0,Reading the .Net book; http://lnkd.in/3dabs4
30,12620726166,Thu Apr 22 04:50:23 +0000 2010,0,0,Reading the book about stripes : http://lnkd.in/UR9n8B
31,12620570426,Thu Apr 22 04:46:22 +0000 2010,0,0,Starting drum lessons at http://lnkd.in/mR5QwS
32,10904293359,Tue Mar 23 02:23:30 +0000 2010,0,0,Listen to the world premiere of 'Between The Lines' by Stone Temple Pilots @STPBand #STPBetweenTheLines http://atlr.ec/b4uCz6
33,10292797474,Wed Mar 10 22:48:08 +0000 2010,0,0,@SoySpeedbox super
34,10292791292,Wed Mar 10 22:47:59 +0000 2010,0,0,@SoySpeedbox fijo
35,8872152543,Tue Feb 09 21:42:58 +0000 2010,0,0,@crjugorg en todas volvemos a las andadas :D
36,7954303014,Tue Jan 19 18:15:23 +0000 2010,0,0,@julietav buena rola como dicen por esos rumbos (Y)
37,7954143956,Tue Jan 19 18:10:12 +0000 2010,0,0,"@crjugorg buenisimo, ahi estaremos"
38,7954121016,Tue Jan 19 18:09:28 +0000 2010,0,0,@CostaRica auro feliz cumple
39,7954111326,Tue Jan 19 18:09:08 +0000 2010,0,0,"@javahispano si muy interesante, vaya tipo"
40,7954097799,Tue Jan 19 18:08:41 +0000 2010,0,0,@javahispano como esta la movida de los libros
41,7756958183,Thu Jan 14 18:35:57 +0000 2010,0,0,Donaciones para Haiti http://doctorswithoutborders.org/
42,7685239572,Tue Jan 12 22:26:22 +0000 2010,0,0,recomendacion musical de hoy: Will you be ready - deep forest
43,7685138225,Tue Jan 12 22:23:21 +0000 2010,0,0,"Lei acerca del procesador xcore86, de bajo consumo electrico, barato y muy pequeNo, podrias correr WinXP en un MediaPlayer o un cel"
44,7685087940,Tue Jan 12 22:21:51 +0000 2010,0,0,Quiero el nuevo set de los beatles :(
45,7006276366,Thu Dec 24 17:47:47 +0000 2009,0,0,"@MalditaVecindad Mae se puede comprar en linea, desde CR un abrazo"
46,7005689793,Thu Dec 24 17:27:08 +0000 2009,0,0,"Hasta q por fin, recibi mi primer paquete de speedbox, la verdad es que con solo ver el Dvd de Alter Bridge, se me quito un poco el enojo :)"
47,6972062596,Wed Dec 23 18:14:30 +0000 2009,0,0,"Aprendi algo de Nutch, Solr y Lucene esta semana, espero documentar pronto la experiencia para compartirla y que no se me olvide"
48,6972038431,Wed Dec 23 18:13:36 +0000 2009,0,0,Hoy se cumplen 15 dias desde que slowbox recibio mis paquetes! que tristesa!
49,6741708787,Wed Dec 16 20:53:23 +0000 2009,0,0,"myspeedbox.com, no estan tan speed! 6 dias y contando!"
50,6340574544,Fri Dec 04 15:55:59 +0000 2009,0,0,nueva entrada en mi blog: http://jsanca.ticoblogger.com/2009/12/la-banda-sonora-de-mi-vida-mis.html
51,6315521382,Thu Dec 03 21:25:20 +0000 2009,0,0,"Buscando info de encriptacion de msg XML, me encontre con: http://javadoc.iaik.tugraz.at/xsect/1.04/apidocs/106/overview-summary.html"
52,6311018699,Thu Dec 03 18:29:56 +0000 2009,0,0,otro mas de spring security: http://www.parleys.com/display/PARLEYS/Home#title=Using%20Spring%20Security%202;talk=19267601;slide=1
53,6310681612,Thu Dec 03 18:16:46 +0000 2009,0,0,"Buen video, como introduccion a los aspectos principales de spring security: http://www.viddler.com/explore/oredev/videos/22/"
54,6310557850,Thu Dec 03 18:12:01 +0000 2009,0,0,nueva version de lucene: http://lucene.apache.org/#25+November+2009+-+Lucene+Java+3.0.0+available
55,6310544767,Thu Dec 03 18:11:30 +0000 2009,0,0,"Investigando acerca de Lucene, para implementar un motor de busqueda interno"
56,6310530214,Thu Dec 03 18:10:57 +0000 2009,0,0,Investigando acerca de seguridad en Restful Web Services
