,id_str,created_at,retweet_count,favorite_count,text
0,668860474994368513,Mon Nov 23 18:35:38 +0000 2015,3,3,"Choose to Be Grateful. It Will Make You Happier., via @nytimes https://t.co/lkQCjRe4Ap"
1,668858026875559938,Mon Nov 23 18:25:55 +0000 2015,0,1,"Church of England Defends Ad Refused by Movie Theaters, via @nytimes https://t.co/M7L2HET2DL"
2,668550844116279296,Sun Nov 22 22:05:16 +0000 2015,3,13,"Tonight's sky ""When the sun hits the tree in a certain way even the meanest of them sparkle.""
-Flannery O'Connor https://t.co/4FEigceCD2"
3,668442009665933312,Sun Nov 22 14:52:48 +0000 2015,0,0,"Francis eschews his own safety to back the ‘three saints of Bangui’

PLUS: What else is at stake... https://t.co/u5ZlPdPgA5"
4,668401674663436289,Sun Nov 22 12:12:32 +0000 2015,0,3,Watch The Sunday Mass Videos Online | The Sunday Mass #ChristTheKing   https://t.co/NX75wZC5e4
5,668064239412736001,Sat Nov 21 13:51:41 +0000 2015,2,2,"Don't 'scapegoat' Syrian refugees, Catholic bishops and evangelicals say @CNNPolitics https://t.co/rGcJcdhaj1 @burkeCnn"
6,667860600001810433,Sat Nov 21 00:22:29 +0000 2015,1,2,"Greek New Testament Papyrus Is Discovered on eBay, via @nytimes https://t.co/zS2uSokcV1"
7,667489340130533376,Thu Nov 19 23:47:14 +0000 2015,0,1,"Bernie Sanders Defends Democratic Socialism, Calling It Route to Economic Fairness, via @nytimes https://t.co/v4jbhYCLk1"
8,667487095435448320,Thu Nov 19 23:38:19 +0000 2015,0,0,"They Are Us, via @nytimes https://t.co/32tT0DKwoy"
9,667436235527450626,Thu Nov 19 20:16:13 +0000 2015,0,6,Pope Francis says ‘Jesus weeps’ over piecemeal world war | Crux https://t.co/K71uVkfyIp
10,667135371898183680,Thu Nov 19 00:20:42 +0000 2015,0,3,"Finding Peace Within the Holy Texts, via @nytimes https://t.co/thXuBAKC49"
11,667036082970697728,Wed Nov 18 17:46:09 +0000 2015,0,0,@DougBrunt Nice sitting next to you at 24 Hr Plays. Look forward to reading your novels. Blessings +
12,667032762034094080,Wed Nov 18 17:32:57 +0000 2015,0,0,"Assailants in Bangladesh Attack Catholic Missionary, via @nytimes https://t.co/fIdL4ZT7iW"
13,667031416853667841,Wed Nov 18 17:27:37 +0000 2015,0,0,@mslalib not judgement. Observation.
14,666958204253954048,Wed Nov 18 12:36:42 +0000 2015,7,11,Would we turn them away too? #refugees https://t.co/KDBAAtFJdz
15,666957042804887552,Wed Nov 18 12:32:05 +0000 2015,2,5,"Pope Francis at general audience: The Church is the doorman, not the boss of God's home https://t.co/giIvF77Dt1"
16,666748051604795393,Tue Nov 17 22:41:37 +0000 2015,2,5,"""You shall not wrong a stranger or oppress the stranger, for you were strangers in the land of Egypt.""
Exodus 22:21"
17,666394898241863680,Mon Nov 16 23:18:19 +0000 2015,3,7,Top Vatican diplomat backs use of force in wake of Paris attacks https://t.co/66x8tI8Zdt via Crux
18,666394230290563072,Mon Nov 16 23:15:40 +0000 2015,161,0,"RT @CBSNews: NEW: More states say ""no"" to Syrian refugees after #Paris attacks; but some say ""yes"" https://t.co/PUKshxRvFe https://t.co/hrK…"
19,666249812908613633,Mon Nov 16 13:41:48 +0000 2015,3,2,Pope Francis suggests Lutherans might discern taking Catholic communion individually https://t.co/lJ7zIOLScH
20,666249295759306752,Mon Nov 16 13:39:45 +0000 2015,338,0,"RT @nytimes: More than 1,000 members joined a mass resignation from the Mormon Church in Salt Lake City https://t.co/D1WU9MpHIg https://t.c…"
21,666240389863612416,Mon Nov 16 13:04:21 +0000 2015,4,2,"New #Isis video threatens to hit all those enabling the ""Christian mission"" opposing them. Names Washington and Rome (Vatican)"
22,666030660839186433,Sun Nov 15 23:10:58 +0000 2015,21,0,"RT @MassimoFaggioli: #Pope #Francis to liberation theologian Jon Sobrino last Friday: ""Please keep writing!"" - Radio Vatikan https://t.co/C…"
23,665859942889467904,Sun Nov 15 11:52:36 +0000 2015,10,10,"""To use the name of God to justify such violence is blasphemy""  - @Pontifex"
24,665619003306606592,Sat Nov 14 19:55:11 +0000 2015,1,2,The Exploitation of Paris https://t.co/VdDrhdA7uj @FrankBruni
25,665593880604184576,Sat Nov 14 18:15:21 +0000 2015,26,28,What a sin that #AllahuAhkbar has now become a call to death and destruction rather than praise befitting a peaceful and loving God
26,665586750677458944,Sat Nov 14 17:47:02 +0000 2015,48,0,RT @NewDay: .@Pontifex says #ParisAttacks are part of a piecemeal third world war. @CNN's Delia Gallagher explains more. https://t.co/lLQii…
27,665562952406278144,Sat Nov 14 16:12:28 +0000 2015,4,11,https://t.co/4qAo5X7FWY
28,665550770062913536,Sat Nov 14 15:24:03 +0000 2015,0,0,@Deanofcomedy statement seems to more want to destroy western life and values or perceived lack there of
29,665539997001498624,Sat Nov 14 14:41:15 +0000 2015,0,0,@Deanofcomedy revenge for...?
30,665533685555404800,Sat Nov 14 14:16:10 +0000 2015,1,0,RT @CynthiaEriVo: @FrEdwardBeck thank you Father!! You have no idea how much your blessings mean to me!God was definitely in the house last…
31,665532311581126656,Sat Nov 14 14:10:42 +0000 2015,0,0,@CynthiaEriVo you were truly amazing last night. Blessings on the journey on this side of the pond. #thecolorpurple Look what God has done
32,665523193332015104,Sat Nov 14 13:34:28 +0000 2015,2,7,Archbisop of Paris Vingt-Trois will celebrate Mass at the Cathedral of Notre-Dame on Sunday for victims &amp; families https://t.co/nNE6hRP2f8
33,665514857320587264,Sat Nov 14 13:01:21 +0000 2015,137,0,"RT @VictorCNN: #PopeFrancis says the #ParisAttacks were a part of the ""piecemeal Third World War."" https://t.co/kVyIcZo5PH"
34,665510465880113152,Sat Nov 14 12:43:54 +0000 2015,3,4,Pope Francis: No religious or human justification for Paris attacks https://t.co/1BCKHmTc8M
35,665509973565272065,Sat Nov 14 12:41:56 +0000 2015,8,7,"#ParisAttackers say they acted on behalf of God. How sick and delusional. Once again religion co-opted for nefarious, selfish ends. #Paris"
36,665207595582533633,Fri Nov 13 16:40:24 +0000 2015,0,4,"Taping @TheSundayMass today at Saint Francis de Sales Church, NYC #StationOfTheCross https://t.co/J4DBDDnTVb"
37,664786086103818241,Thu Nov 12 12:45:28 +0000 2015,1,2,Mormons plan to quit over church's new policy banning baptism in gay families https://t.co/l4I6L4SNAt
38,664780092598546432,Thu Nov 12 12:21:39 +0000 2015,0,3,Francis: Lay people not ‘second class’ members of Catholic church https://t.co/4taYPNzPuH
39,664768024432533504,Thu Nov 12 11:33:42 +0000 2015,1,0,Church’s sign on fatherhood- 2 dads-leads to storm https://t.co/7HXe0LDo9h
40,664574115660046336,Wed Nov 11 22:43:11 +0000 2015,1,2,Pope Francis says Catholics must be open to change | Crux https://t.co/kQ1Q2IoamY
41,664500160244948992,Wed Nov 11 17:49:18 +0000 2015,2,3,Blessings on veterans and their loved ones. Hope and pray for the day no such service is needed. Lion lays down with lamb.  #verteransday
42,664456887593779201,Wed Nov 11 14:57:21 +0000 2015,1,0,Security a top concern for Pope Francis' Africa visit - Religion News Service https://t.co/d5M8JdjuAF
43,664175153065172992,Tue Nov 10 20:17:50 +0000 2015,1,2,Pope Francis says Catholics must be open to change | Crux https://t.co/kQ1Q2IoamY
44,664094315375960064,Tue Nov 10 14:56:37 +0000 2015,0,1,Pope Francis stumbles in church for second time in three days - PRAYERS FOR HEALTH + https://t.co/FOIHoQjJUB
45,663726991301091328,Mon Nov 09 14:37:00 +0000 2015,2,2,Pope Francis says leaks won't deter him from reform agenda - Religion News Service https://t.co/gVmUDiDAwI
46,663693012204167168,Mon Nov 09 12:21:59 +0000 2015,0,0,Why 2015 has been a banner year for films about abuse and religion https://t.co/M2ufQyOVye
47,663491199832104961,Sun Nov 08 23:00:03 +0000 2015,0,2,Why there’s still a case for hope on Vatican financial reform | Crux https://t.co/SsTfPhNKic
48,663010640269824000,Sat Nov 07 15:10:29 +0000 2015,1,4,"Supreme Court to Hear New Case on Contraception and Religion, via @nytimes https://t.co/vorVMoICbV"
49,662847812317667328,Sat Nov 07 04:23:28 +0000 2015,0,1,"Mormons Reinforce Stand on Same-Sex Marriage, via @nytimes https://t.co/FPzZDEwR91"
50,662692916779950080,Fri Nov 06 18:07:58 +0000 2015,2,1,Pope Francis extends his moderate makeover of Church leadership | Crux @JohnLAllenJr  https://t.co/djnKXWjoU1
51,662692624470564864,Fri Nov 06 18:06:48 +0000 2015,1,2,"With the spotlight on Boston, Chicago archdiocese says it did better | Crux https://t.co/XdiEYe1WEY"
52,662692533219250176,Fri Nov 06 18:06:26 +0000 2015,0,2,"In ‘Spotlight,’ The Boston Globe digs up the Catholic Church’s dirt | Crux https://t.co/6qMAmydmTv"
53,662668731663958016,Fri Nov 06 16:31:52 +0000 2015,4,4,'Spotlight' film educated Catholic actor Brian d'Arcy James https://t.co/yYnO9EYQt5 @NCRonline @briandarcyjames
54,662399036629078017,Thu Nov 05 22:40:11 +0000 2015,0,1,Vatican’s finance czar: I’m not wasting money https://t.co/xKwoaDPhKq via Crux
55,662304755952259072,Thu Nov 05 16:25:33 +0000 2015,0,6,We kiss in the shadows. (And sometimes on TV.) @MichaelaCNN and #HarryPotter https://t.co/mKYnO5aez4
56,662300102250377216,Thu Nov 05 16:07:03 +0000 2015,7,0,RT @CNNnewsroom: Rpt: Vatican spent 37M€ that were supposed to go charity on itself https://t.co/VNp9c8Pcvz @FrEdwardBeck weighs in: https:…
57,662294806480232449,Thu Nov 05 15:46:01 +0000 2015,1,0,RT @CarolCNN: Now: @FrEdwardBeck talks on two bombshell books that place scrutiny on the #Vatican's finances.
58,661999094953586688,Wed Nov 04 20:10:58 +0000 2015,0,6,"Pope Francis ‘prepared to battle’ on Vatican reform, senior cardinal says https://t.co/rhBmR4vP3E via @RNS"
59,661639364934545408,Tue Nov 03 20:21:31 +0000 2015,1,3,"Join us on @HLNTV with @NancyGraceHLN to discuss whether HS football player should be penalized for ""God gesture"". 3:45 pm ET"
60,661585744033660928,Tue Nov 03 16:48:27 +0000 2015,1,2,"In Religious Arbitration, Scripture Is the Rule of Law, via @nytimes https://t.co/b6kZOTcQP7"
61,661582368453623808,Tue Nov 03 16:35:02 +0000 2015,1,2,"Study: More Americans reject religion, but believers firm in faith https://t.co/ztTkMWlZPz via @usatoday"
62,661571538618068992,Tue Nov 03 15:52:00 +0000 2015,20,16,"Americans becoming less religious, especially young adults: poll: https://t.co/hzNY3s3W9s via @AOL"
63,661174522377338884,Mon Nov 02 13:34:24 +0000 2015,16,0,RT @CatholicHerald: UPDATE: Vatican makes two arrests in investigation over leaked documents https://t.co/mP500q37tu https://t.co/mt1U3YULpP
64,661165164855746561,Mon Nov 02 12:57:13 +0000 2015,2,6,Sometimes TV lower thirds can lie. #cnn https://t.co/Vucr2l3h15
65,660947439755665409,Sun Nov 01 22:32:04 +0000 2015,2,10,President @BarackObama bows to the winning costume at #WhiteHouse #Halloween costume event. @Pontifex JR! https://t.co/N91XAHUu6Z
66,660924161506811904,Sun Nov 01 20:59:34 +0000 2015,0,0,@joelgia yes!
67,660901141635604480,Sun Nov 01 19:28:05 +0000 2015,3,1,Join us on @CNN at 3:45 pm ET with @FWhitfield to discuss controversy over @Pontifex plans to meet with President Rouhani of Iran.
68,659451697887080448,Wed Oct 28 19:28:31 +0000 2015,3,5,Theology and Hate @JamesMartinSJ https://t.co/KIYrlxgYfZ
69,659359653554442241,Wed Oct 28 13:22:46 +0000 2015,3,3,Cardinal Wuerl: Catholic Church moving from legalism to mercy - Religion News Service https://t.co/yJeins2i1r
70,659137530063925248,Tue Oct 27 22:40:08 +0000 2015,1,0,"RT @NicoleHenryJazz: @nilerodgers @VWOfficial  @FrEdwardBeck This was 3 years ago @JoesPub!  Can't wait 2 return tmrw, 7:30pm showtime! htt…"
71,659033768120963072,Tue Oct 27 15:47:49 +0000 2015,0,0,Francis’ Pastoral Revolution rolls on with two big picks in Italy  https://t.co/rJAH3EvNST
72,658830697055002624,Tue Oct 27 02:20:53 +0000 2015,1,5,"Catholic Church Leaders Issue Appeal on Climate Change, via @nytimes https://t.co/8bZ48GiBqk"
73,658679504643215360,Mon Oct 26 16:20:06 +0000 2015,0,4,"Divide Over a Synod Statement on Family Matters, via @nytimes https://t.co/gWbtANtoqE"
74,658472444005634052,Mon Oct 26 02:37:19 +0000 2015,2,3,"Catholic Paper on Family Is Hailed by All Sides, Raising Fears of Disputes, via @nytimes https://t.co/jUI85xSYij"
75,658363562574901248,Sun Oct 25 19:24:39 +0000 2015,0,4,Coming up on @CNN with @FWhitfield we discuss results of #Synod meeting with @Pontifex and bishops in Rome. Approx 3:40 ET
76,658259121448361984,Sun Oct 25 12:29:39 +0000 2015,5,5,Pope rebukes Catholic elders at closing of synod on family - The Washington Post https://t.co/dGe0Og1uNw
77,658255922800758784,Sun Oct 25 12:16:56 +0000 2015,1,3,"What Family Really Means, via @nytimes @FrankBruni          A thoughtful piece  https://t.co/NERNx2mTLT"
78,658008846410076160,Sat Oct 24 19:55:08 +0000 2015,1,1,Bishops: Integrate remarried Catholics into Church life | Crux https://t.co/GEPkWGovOU
79,658004459528810496,Sat Oct 24 19:37:42 +0000 2015,1,3,"Synod emphasizes role of discernment and individual conscience, in a win for liberal bishops. / Yahoo News https://t.co/gw9LiTwzEz"
80,658002738169683968,Sat Oct 24 19:30:52 +0000 2015,0,1,Catholic bishops at synod call for a more welcoming church - Yahoo News https://t.co/EQq6YJRMbK
81,657962244844687360,Sat Oct 24 16:49:58 +0000 2015,0,4,Pope Francis -- Synod Divided | National Review Online https://t.co/QEXxjCKolh
82,657961923280027648,Sat Oct 24 16:48:41 +0000 2015,1,5,"Over to you Pope Francis, as bishops wrap up stormy synod - Yahoo News https://t.co/1Bu4ydCbms"
83,657956601677115402,Sat Oct 24 16:27:32 +0000 2015,0,1,"Voice Is Sought at the Vatican on Remarriage, via @nytimes https://t.co/HG4UFGM90y"
84,657904812135161856,Sat Oct 24 13:01:45 +0000 2015,4,5,Vatican meeting reveals growing Catholic divide over divorce and homosexuality https://t.co/GaHRJNy19N
85,657901950902665216,Sat Oct 24 12:50:22 +0000 2015,0,2,What the bishops aren’t talking about during the Vatican synod | Crux https://t.co/DrOyywN9JO
86,657387143044689920,Fri Oct 23 02:44:43 +0000 2015,2,2,"A Whiff of Intrigue as Vatican Disputes ‘Unfounded’ Report on Pope Francis’ Health, via @nytimes https://t.co/L6C2D8Zhdg"
87,657191074901811200,Thu Oct 22 13:45:36 +0000 2015,3,9,Into every life a little rain must fall. https://t.co/jb8d6O92HR
88,656995771531657216,Thu Oct 22 00:49:32 +0000 2015,0,1,"Vatican Meeting Reveals Divisions Among Catholics on Family Issues, via @nytimes https://t.co/N0L3Eo2uV0"
89,656991177615388673,Thu Oct 22 00:31:17 +0000 2015,1,1,"2015 Likely to Be Hottest Year Ever Recorded, via @nytimes  And yet some still deny global warming https://t.co/FAySUzyyo9"
90,656901489248497664,Wed Oct 21 18:34:54 +0000 2015,0,2,Notes on a rollicking hump day at the 2015 Synod of Bishops | Crux https://t.co/VCfTynUgef
91,656901065531494400,Wed Oct 21 18:33:13 +0000 2015,0,3,Bishops’ dispute over Communion issue rachets up | Crux https://t.co/U0mayS3Bqc
92,656869844952813568,Wed Oct 21 16:29:09 +0000 2015,6,7,#JoeBiden speech about NOT running is one of the most inspired I have heard him give. Maybe that's what freedom does...
93,656863306091638786,Wed Oct 21 16:03:10 +0000 2015,0,1,So is the @Pontifex brain tumor rumor suggesting that the Pope must be out of his mind for suggesting progress and change?
94,656834392782802944,Wed Oct 21 14:08:17 +0000 2015,1,3,Vatican denies that Pope Francis has a curable brain tumor | Crux https://t.co/FKJ63fiXJ0
95,656833176203997184,Wed Oct 21 14:03:27 +0000 2015,0,0,@rajshehan next time! Thanks
96,656833042170822656,Wed Oct 21 14:02:55 +0000 2015,0,0,Pope Francis has a brain tumor? Sharp denials amid synod silly season - Religion News Service https://t.co/NerDZ4X7P9
97,656180248745107456,Mon Oct 19 18:48:57 +0000 2015,1,3,"Cardinal Marx's plea for divorced, remarried Catholics: Eucharist 'not a prize for the perfect' https://t.co/USHkB5cEZ0"
98,656137653524389889,Mon Oct 19 15:59:41 +0000 2015,1,2,Pope Francis canonizes first married couple in modern times - CBS News http://t.co/1waKIEi50o
99,656124815372259332,Mon Oct 19 15:08:40 +0000 2015,0,1,"Something Not Rotten in Denmark, via @nytimes http://t.co/GyN7G9icZ1"
100,656109576027111424,Mon Oct 19 14:08:07 +0000 2015,1,0,US archbishops Chaput and Cupich offer sharply different visions of Vatican synod - Religion News Service http://t.co/rUqT2OWLuI
101,655749694610477056,Sun Oct 18 14:18:05 +0000 2015,2,3,The Plot to Change Catholicism http://t.co/QfjVGMZHoQ. Most of the recorded meals of Jesus in the Scriptures are with sinners and outcasts
102,655749447075262465,Sun Oct 18 14:17:06 +0000 2015,1,2,The Plot to Change  JUST BECAUSE JESUS WAS AGAINST DIVORCE DOESN'T MEAN HE THOUGHT COMMUNION DENIED  Catholicism http://t.co/QfjVGMZHoQ
103,655745829391626240,Sun Oct 18 14:02:43 +0000 2015,2,4,The Plot to Change Catholicism    @DouthatNYT not a plot just because you disagree  Spirit may be alive and working http://t.co/B2i4czT8R7
104,655346073851031552,Sat Oct 17 11:34:14 +0000 2015,2,3,"What Could Raising Taxes on the 1% Do? Surprising Amounts, via @nytimes http://t.co/YPWm8H76IP"
105,655316478384865280,Sat Oct 17 09:36:38 +0000 2015,256,0,"RT @nytopinion: Once you get past the label, socialism doesn't sound that bad. http://t.co/cwg4xsDSwR http://t.co/FN6xrL64IE"
106,655315898304212992,Sat Oct 17 09:34:19 +0000 2015,8,9,Guess Who Else Is a Socialist? http://t.co/bOf3fqhLBr
107,654984158729646080,Fri Oct 16 11:36:07 +0000 2015,0,0,"France in Stalemate With Vatican Over Nomination of Envoy Said to Be Gay, via @nytimes http://t.co/1KxGSZblsM"
108,654981890106105856,Fri Oct 16 11:27:06 +0000 2015,0,0,"Congregants Were Abused and Shamed at Church Where Fatal Beating Occurred, Ex-Member Says, via @nytimes SCANDAL http://t.co/G8w9z9Gofj"
109,654499102869319680,Thu Oct 15 03:28:40 +0000 2015,0,1,"Glimpses Inside Secretive Sect After Killing at Upstate NY Church, via @nytimes The sickness of religion gone bad  http://t.co/XTvE8hUpY0"
110,654496412122652672,Thu Oct 15 03:17:59 +0000 2015,1,1,"@adriennelopeztv @Oprah @OWNTV great to see you, too! Next time, Porter House! :)"
111,654404886029844480,Wed Oct 14 21:14:17 +0000 2015,0,4,Looking forward to attending screening and conversation tonight with @Oprah @OWNTV #belief series begins October 18 @ 8 pm
112,654348557999321088,Wed Oct 14 17:30:28 +0000 2015,1,3,Pope’s mea culpa a Rorschach test for what people are thinking about | Crux http://t.co/tehiA9G2Wy
113,654086901259988992,Wed Oct 14 00:10:44 +0000 2015,0,0,@ActorLiam @MVPlayhouse thanks for making the trip Liam. Now you have to see the end sometime!
114,653990382989131776,Tue Oct 13 17:47:12 +0000 2015,6,3,‘Yes We Can!’ emerges as rallying cry at 2015 synod | Crux @JohnLAllenJr  http://t.co/6Si2Cjg7Vr
115,653937225269407744,Tue Oct 13 14:15:58 +0000 2015,1,2,"""Everything looks yellow to the jaundiced eye.” @Cardinal_Wuerl"
116,653935422234603520,Tue Oct 13 14:08:48 +0000 2015,2,4,Cardinals' secret letter to Francis warns of plot to rig reforms - Religion News Service  http://t.co/TpOAe8193c
117,653724089597730820,Tue Oct 13 00:09:03 +0000 2015,0,1,@BishopBarron Good seeing you in Philadelphia. Blessings on your inspired ministry.
118,653673302116954112,Mon Oct 12 20:47:14 +0000 2015,7,13,The world saw Pope Francis bless a boy with cerebral palsy. Here’s what we didn’t see. https://t.co/XrIXpZSUJU
119,653671557374545922,Mon Oct 12 20:40:18 +0000 2015,0,2,The Catholic Church’s Inclusion Problem @JamesMartinSJ http://t.co/YaiXvhNYvt
120,653667951795638272,Mon Oct 12 20:25:58 +0000 2015,1,4,"Thirteen cardinals, including Dolan and Di Nardo, challenged Pope Francis' decisions on the synod | America Magazine http://t.co/OrSkJETx3p"
121,653597967509794816,Mon Oct 12 15:47:53 +0000 2015,0,3,"""It just wouldn’t be a Synod of Bishops in the Pope Francis era without some behind-the-scenes drama..."" READ: http://t.co/4bj6dozdPZ"
122,653567690662133760,Mon Oct 12 13:47:34 +0000 2015,1,1,Chicago archbishop calls for tough gun control laws - Religion News Service http://t.co/ElTdV7pep5
123,653538085498679296,Mon Oct 12 11:49:56 +0000 2015,0,1,"Why Can’t We Sit Still Anymore?, via @nytimes http://t.co/Fiye5VqIcF"
124,653195138592862208,Sun Oct 11 13:07:11 +0000 2015,669,0,"RT @ljam185: Here comes the morning ...

https://t.co/l3Xo2UQ215"
125,652841373998170112,Sat Oct 10 13:41:27 +0000 2015,3,3,"Washington resident remembers 'kindness' of former teacher, now pope http://t.co/yFhclmJtCQ"
126,652827706460086273,Sat Oct 10 12:47:08 +0000 2015,2,2,The Pope's new 'comedic advisor' is a rabbi http://t.co/WDtGFmxpLK
127,652827455166787587,Sat Oct 10 12:46:08 +0000 2015,0,1,"Pope: When the Devil Numbs Your Conscience, He Has Won http://t.co/agX3K7bDze"
128,652827193563840512,Sat Oct 10 12:45:06 +0000 2015,1,2,Pope Francis’ Latest Convert: Kirsten Powers | Gleanings | http://t.co/0kWzrOK7sU http://t.co/OWD4GsyCvh
129,652159630697590785,Thu Oct 08 16:32:27 +0000 2015,0,1,Pope Francis defends bishop accused of concealing sex abuse http://t.co/AsPDSWX2FM
130,652158286095978497,Thu Oct 08 16:27:06 +0000 2015,0,1,Pope Francis: why do good things happen to bad people? https://t.co/Q25cHMt0ss via @sharethis
131,652118168979247104,Thu Oct 08 13:47:41 +0000 2015,1,4,Ordain women deacons?  Vatican synod gets an unexpected proposal - Religion News Service http://t.co/jcfVFSuIuH
132,651848577958944768,Wed Oct 07 19:56:26 +0000 2015,1,3,Archbishop Coleridge says synod 65/35 against Communion for the divorced and remarried http://t.co/36McoyUs3S
133,651754593739763712,Wed Oct 07 13:42:58 +0000 2015,0,4,Pope Francis may travel to Mexico in 2016 - Religion News Service http://t.co/p0BYgCYIWJ
134,651444618647744517,Tue Oct 06 17:11:14 +0000 2015,1,4,"Synod should reflect on possibly allowing female deacons, says archbishop http://t.co/9Mgll1FGvH via @CatholicNewsSvc"
135,651399185951006720,Tue Oct 06 14:10:42 +0000 2015,0,1,"Synod Notebook: On Day One, a debate about process and taking things off the table | Crux http://t.co/FBrBIoyoRu"
136,651397410606985216,Tue Oct 06 14:03:39 +0000 2015,1,2,Women hope their voices are heard at bishops’ family synod http://t.co/8NxMkD88IT via @RNS
137,651084792948236288,Mon Oct 05 17:21:25 +0000 2015,5,2,"On Day One of Synod 2015, conservatives strike first @JohnLAllenJr http://t.co/bDqk7pPXLn"
138,650865297533063168,Mon Oct 05 02:49:14 +0000 2015,0,2,"Pope Francis Opens Vatican Synod on Family Issues, via @nytimes http://t.co/zGfNL8nlsx"
139,650740971769098240,Sun Oct 04 18:35:12 +0000 2015,0,1,Pope Francis opens Roman Catholic synod amid gay row - BBC News http://t.co/k42Vs2j1Zk
140,650332456437043200,Sat Oct 03 15:31:54 +0000 2015,19,0,RT @60Minutes: Lara Logan reports as one priest searches to uncover the unknown victims of the Holocaust http://t.co/h2AFSEFW7l http://t.co…
141,650332226601750529,Sat Oct 03 15:31:00 +0000 2015,3,3,Hardline Archbishop Carlo Maria Vigano Set Up Pope's Kim Davis Meeting | Newser Mobile http://t.co/8U3jIUAa7C
142,650287118812585984,Sat Oct 03 12:31:45 +0000 2015,0,1,@ckipiniak told you
143,650286146245783552,Sat Oct 03 12:27:53 +0000 2015,1,1,Vatican responds to CDF official’s “coming out” http://t.co/8Ty4z1bDYr
144,650277541769576449,Sat Oct 03 11:53:42 +0000 2015,0,1,"The Pope’s Confounding Consistency, via @nytimes http://t.co/ArcpnmuUvb"
145,650106426128498688,Sat Oct 03 00:33:45 +0000 2015,1,4,"U.S. Church, in Pope Francis’ Afterglow, Sees Chance to Win Back Faithful, via @nytimes http://t.co/FGVAIJZNm7"
146,650101500346302465,Sat Oct 03 00:14:10 +0000 2015,4,1,"Archbishop at Center of Mystery of Papal Meeting With Kim Davis, via @nytimes http://t.co/h48M4WjcJ3"
147,650080806313021441,Fri Oct 02 22:51:56 +0000 2015,0,3,On @Cnni with @JonathanMannCNN to discuss Pope Francis meeting with both Kim Davis and gay couple. What are we to make of it all? 7:20 ET
148,650048503452991489,Fri Oct 02 20:43:35 +0000 2015,0,3,Was Pope Francis Actually Swindled into Meeting Kim Davis?  http://t.co/amkibaVfdp
149,650023159668805632,Fri Oct 02 19:02:52 +0000 2015,4,7,"The Pope's REAL MESSAGE: Don't put me in a box, because I just might tear it to shreds. #PopeFrancis #pope http://t.co/muB73fdhfU"
150,649993079261392896,Fri Oct 02 17:03:21 +0000 2015,8,13,Now everybody is a fan of @Pontifex again. People are so FICKLE. Get used to him surprising you. And not necessarily agreeing with you.
151,649990319749120000,Fri Oct 02 16:52:23 +0000 2015,1,1,Exclusive: Pope held private meeting with same-sex couple @BurkeCNN  http://t.co/F9HWR9Kr2R
152,649949754596700160,Fri Oct 02 14:11:11 +0000 2015,1,1,Gunman at Oregon college asked students their religion then killed 9 - Religion News Service http://t.co/SsInNeZGNT
153,649941695354769408,Fri Oct 02 13:39:10 +0000 2015,0,3,"""The encounter between Davis and Pope Francis was not organized by Vatican staff..."" http://t.co/i1mhZk0Alk"
154,649941007249862656,Fri Oct 02 13:36:26 +0000 2015,10,0,RT @publicreligion: Two-thirds of Catholics oppose refusing service to LGBT people on religious grounds http://t.co/11mRZ0hVve #KimDavis ht…
155,649940794493767680,Fri Oct 02 13:35:35 +0000 2015,1,1,Changes to Synod of Bishops on Family unveiled http://t.co/3mr5qc2IN2
156,649940240241676288,Fri Oct 02 13:33:23 +0000 2015,0,1,@frankpallotta you start early!
157,649926748285587456,Fri Oct 02 12:39:46 +0000 2015,1,4,"Pope's meeting with Kim Davis not an endorsement, Vatican says - http://t.co/Sft0pCcRjY http://t.co/W7eYZ3D4rv"
158,649906211110961152,Fri Oct 02 11:18:10 +0000 2015,3,3,"Pope Francis’ Meeting Wasn’t an Endorsement of Kim Davis’s Views, Vatican Says http://t.co/Lni8WflRpH"
159,649905603926753280,Fri Oct 02 11:15:45 +0000 2015,35,0,RT @JohnLAllenJr: BREAKING: Vat says pope's meeting with Kim Davis not a show of support for her case 'in all its particular and complex as…
160,649715783149486080,Thu Oct 01 22:41:28 +0000 2015,1,3,"Oregon school shooting: Shooter asks students their religion, report says | http://t.co/dXM6gexE7S http://t.co/oRVTotD0lm"
